页码,微博id,微博作者,发布时间,微博内容,转发数,评论数,点赞数,发布于,ip属地_城市,ip属地_省份,ip属地_国家
17,5021579384194728,一曲话相思,2024-04-10 11:54:44,#华为盘古大模型首次应用于笔记本# 科技改变生活！万物皆可AI。 华为全新MateBook X Pro笔记本主打轻、强，并且突出了AI化，首款搭载华为盘古大模型的笔记本，将带来更智慧的体验，如更强的文献/资讯阅读与摘要能力，助力用户高效撰写文案、论文，进行学术研究。期待不？ ,0,188,18,广西,南宁,广西,中国
17,5021560652695374,上海乾娱010,2024-04-10 10:40:18,著作权法有哪些例外情况？著作权法的例外情况有很多，以下为您推荐：学术研究、教育、新闻报道、公共信息服务等领域的例外规则 。在这些领域，著作权人的许可并非必须，但使用者需要遵守一定的条件和限制，例如注明出处、不得侵犯著作权人的名誉权等。公共利益、社会公共利益等领域的例外规则 。在这些领域，著作权人的许可不是必须的，但使用者需要证明其使用著作物是为了公共利益或社会公共利益，例如环境保护、医疗卫生、社会福利等。此外，还有个人使用、私人研究等领域的例外规则、著作权保护期限届满后的例外规则等。,0,0,0,上海,上海,上海,中国
17,5021516627970615,frau_拍拍,2024-04-10 07:45:22,不懂为什么那么多人想要考研 只是想考研而是 不是想读研究生 延续了高考考试的传统一直想考… 真正适合学术研究的少之又少 ,0,0,0,浙江,杭州,浙江,中国
17,5021423556363325,绿色健康香菜泥,2024-04-10 01:35:32,伦儿要不加入稠密吧 不是说他丑，只是说物理生比较适合这种学术研究氛围 ,0,1,1,上海,上海,上海,中国
18,5021397157679171,Steiner_95,2024-04-09 23:50:38,论文写不出一个字 我是学术乐色这件事没救了 要我做学术研究堪比科学家研究男人生娃 ,0,2,1,江西,南昌,江西,中国
18,5021387247323117,勋衣草的毛毛鞋,2024-04-09 23:11:15,在“轴心时代”，全球有至少四大文明，包括犹太基督教文明、印度文明、希腊文明和中华儒家文明，都发挥了很大影响。从事学术研究，特别是比较文化学研究的学者们，认为这种精神——主要的文明同时出现、互相交融、互相影响的时代——意味着人类文明的多样性、多元性和包容性，这不是单向或非东即西的，而是一种东西南北都包括在内的特殊精神。,0,2,0,河南,许昌,河南,中国
18,5021372942125500,Selena_yolo,2024-04-09 22:14:25,掼蛋学术研究 ,0,0,1,湖北,武汉,湖北,中国
18,5021347315193765,yvettemiu,2024-04-09 20:32:35,八点十分坐在办公室 舞蹈课结束顶着浸满汗水的头和衣服就过来我写写写 我好好准备 运动完就干劲儿十足 可能我明天早上需要跑个几公里再来办公室maybe学术研究进度才不会为0 ,0,4,1,安徽,滁州,安徽,中国
18,5021328816475928,yvettemiu,2024-04-09 19:19:04,下午两点坐在办公室 学术研究为0  现在在舞室暴汗 活过来了 ,0,3,1,安徽,滁州,安徽,中国
18,5021320008434390,超绝二级闲人,2024-04-09 18:44:04,一磕上产品就开始各种扒星座，太阳星座上升星座月亮星座，扒mbti，然后开始对标三次里认识的人，然后把分析和视频各种拿去问拿去对标。这辈子让我像搞学术研究一样磕的也就们rps了，再磕rps我是狗，汪汪汪。汪 ,0,2,0,广西,柳州,广西,中国
18,5021317149495733,章晓华微博,2024-04-09 18:32:43,为什么说那些相信“西方伪史论”的人，都是智力欠缺的人？       理由很简单：中国各大院校历史系的规范学术研究，它们看不懂，也不信，就相信地摊文学。       与之类似的，还有很多民科——它们总认为各大院校教学研究的科学理论，都是错的，都不如它们坐在家里的空想。       还记得那个“卖肝卖肾，力争诺奖”的郭英森吗？还记得那个发明飞碟的奇人吗？       你要他们写出规范的学术论文，向严谨的学术刊物投稿，接受同行评议，他们就百般狡辩胡搅蛮缠。,3,2,4,安徽,合肥,安徽,中国
19,5021296918528865,书肆巡阅使,2024-04-09 17:12:19,#好书推荐# 《马鸣丝路蹄声远：唐五代马匹贸易研究》作者: 丁君涛出版社: 九州出版社出版年: 2021-3页数: 228定价: 58ISBN: 9787510894275内容简介 本书主要由六个部分组成：部分为本文的导论，进行了学术研究综述和探讨选题意义及研究架构等。第二部至第六部分分别论述了唐五代时期官私养马业的发展状况、政府对于马匹贸易的管理政策、官方和民间的马匹贸易发展状况、马匹贸易的演变及影响等。本书对唐五代马匹贸易研究有助于我们具体理解唐五代时期丝绸之路的经济贸易情况，这一项选题目前较少有人研究，本书填不了这一空白，该研究对于我们今天的 一带一路 建设有着重要的借鉴意义。目录  第一章 导论第一节 选题背景第二节 选题意义一、影响唐五代马匹贸易发展的因素二、问题的提出第三节 文献综述与研究架构一、文献综述二、本研究对唐五代马匹贸易史论述的架构三、创新尝试与不足之处第二章 唐五代的马政及养马业第一节 唐五代的马政一、唐五代的马政机构二、晚唐监牧的南迁三、唐代政府对民间养马业的管理第二节 唐五代的养马业一、唐前期对于官营养马业的投入及成就二、晚唐五代时期的官营养马业三、唐前期民间养马业的发展四、晚唐五代时期民间养马业的衰落第三章 唐五代马匹贸易的管理第一节 官方互市一、官方互市的机构和职责二、政府对互市的管理第二节 朝贡贸易一、朝贡贸易的机构和职责二、聘赐贸易及朝贡贸易的变化第三节 民间马匹贸易的管理一、政府对于民间越境贸易的限制二、民族间贸易的发展第四章 唐五代官方马匹贸易第一节 中原与回鹘的马匹贸易一、唐与回鹘的朝贡贸易二、唐与回鹘的互市贸易三、五代时期中原与回鹘的马匹贸易第二节 中原与突厥、吐蕃、吐谷浑的马匹贸易一、唐与突厥的朝贡贸易二、唐与突厥的互市贸易三、中原王朝与吐蕃及吐谷浑的马匹贸易第三节 中原与契丹、奚、党项的马匹贸易一、中原王朝与契丹及奚的马匹贸易二、中原王朝与党项的马匹贸易第四节 中原王朝与西域多国及私人的马匹贸易一、中原王朝与西域多国的马匹贸易二、官私马匹贸易第五节 官方马匹贸易的价格一、唐代官方马匹贸易价格二、五代时期的官方马匹贸易价格第五章 唐五代丝路沿线的民间马匹贸易第一节 丝路民间马匹贸易一、唐代丝路沿线的民间马匹贸易二、五代时期丝路沿线的民间马匹贸易第二节 民间市场上的马匹价格一、唐代丝路沿线的马匹价格二、五代时期丝路沿线的马匹价格第六章 唐五代马匹贸易的演变第一节 唐五代马匹贸易的演变一、茶马贸易的逐渐兴起二、马匹贸易的羁縻色彩逐渐淡化三、马匹贸易的管控日益严格第二节 唐五代马匹贸易发生演变的原因一、晚唐五代的财政压力二、军事上垄断马匹贸易的需要第七章 唐五代马匹贸易的影响第一节 对中原地区其他行业的影响一、交通运输业二、丝织业和制革业第二节 唐五代马匹贸易演变的影响一、促进了茶叶经济的发展二、推动新商路的开拓和兴盛三、政府垄断对商贸的限制第三节 对少数民族地区的影响一、中原货币畅行西北二、对于回鹘政治和经济的影响三、改变西域经济结构第四节 对沿线城市的影响一、商路的兴盛二、沿线城镇的发展结语一、唐五代马匹贸易的特点二、唐五代马匹贸易的历史价值三、唐五代马匹贸易对“一带一路”建设的借鉴意义参考文献,8,2,2,浙江,金华,浙江,中国
19,5021290471098021,我的煤炭,2024-04-09 16:46:42,“在某些领域，我们国内的学术研究依然缺乏一种专业感。”接受《中国科学报》采访时，赵鼎新说。,0,0,1,山东,济宁,山东,中国
19,5021284779950872,宜昌发布,2024-04-09 16:24:05,#连线宜昌#【“三峡之门”建成！宜昌再添一新地标】近日，位于三峡工程坝上库首的湖北省宜昌市秭归县——湖北三峡移民博物馆主体“三峡之门”建设完成。该馆计划今年内建成开放，主要承担湖北三峡移民工作展览展示、征集收藏、学术研究、教育传播、旅游接待等功能。湖北三峡移民博物馆，是湖北省首座依托三峡移民和三峡自然人文景观建设的历史类中型博物馆，也是湖北省兴建的第一座省级三峡移民博物馆，总投资1.98亿元，建筑面积1.3万平方米，是秭归、宜昌乃至湖北省新的文化地标。,1,0,1,,宜昌,湖北,中国
19,5021192710522686,社会学刘晨,2024-04-09 10:18:14,接受《中国科学报》采访时，赵鼎新说。目前很多学者考虑最多的并不是自己的学术志趣，而是什么样的研究课题更容易发表文章和申请项目、哪本期刊的标准更松、文章写成什么样式更能打动编辑、哪类学问更能名利双收……当这些功利性的想法主导其研究时，学者便将自己束缚住了，导致其在学术研究上畏手畏脚、瞻前顾后，最终难成大事。工作中，我非常支持周围的年轻学者摆脱内心的这些束缚，同时，我们也招收了不少研究“冷门”议题的学者。这些学者往往并不是文章发表的“大户”，但我们愿意为其提供相对宽松的空间。此外，我国几千年的传统教育一直强调尊师重道、提倡长幼有序，这当然是一种优秀的传统文化，但并不意味着对此应刻板地遵守。如青年老师“怕”大牌教授，在他们面前唯唯诺诺。——2024-4-9,6,5,48,重庆,重庆,重庆,中国
19,5021279325522511,编辑孙老师,2024-04-09 16:02:25,《信息系统工程》可查稿  省级，月刊，第一批学术期刊  知网，万方，维普三网收录  收稿方向：数字地方，技术应用，经验交流，信息化建设，学术研究，教育论坛等计算机相关 ,0,0,0,河南,郑州,河南,中国
19,5021269113964631,-雨_y,2024-04-09 15:21:50,我讨厌学术研究与写作方法 这门课… ,0,0,0,重庆,,重庆,中国
19,5021203221449491,中国考古网,2024-04-09 11:00:00,#学术研究# 新发现 | 黑龙江大庆九间遗址考古发掘收获：九间遗址坐落于松嫩平原的中部地带，其周边环境以低平地原和水洼众多为特点。该遗址的文化堆积性质单一，大致形成于金代。通过遗址内目前发现的窑址、房址和灰坑等遗迹现象基本可以认定该遗址的北侧区域为居住区和手工业作坊区，而南侧大型台基建筑遗存的性质还有待进一步深入研究与考证。通过对该遗址动植物的种属鉴定可以得知这一时期的人类生业模式是由定居农业、狩猎业和渔猎业组成的混合形态。（文博中国）网页链接,8,1,13,,北京,北京,中国
19,5021251898967601,熙宇熹宁,2024-04-09 14:13:26,正式进入大棚或者说常常关注他的消息之后再看直播，可以get好多好多梗，他一说就可以秒懂。这也是单纯补看直播回放没有的体验，直播回放把当时发生的事或者行程当参考资料更有趣（怎么好像在搞学术研究）。之前一直觉得实时追星很累，可追到这位兄台，只能一边笑笑自己命短，一边鸡血式实时打工，累什么呀累？一点不累！为了他是可以不断打开自己的。我也在卷创作官，最近每天会尽量多发，但自从达到入群条件后我为自己微博定的原则就是不随便对待我的账号内容，写这些他看不看得到无所谓，我不想随便对待我的内容一如我不随便对待自己的喜欢。,0,1,2,辽宁,沈阳,辽宁,中国
19,5021251840247838,青岛市图书馆,2024-04-09 14:13:12,#青图活动预告# 【青图云竞答】 “好文推荐”活动开始啦~学术期刊存在即合理，它的存在依据是其社会价值。学术期刊作为一种媒体，能传播学术信息，发表学术研究成果，在学术研究过程的上游与下游之间对研究主体起联接的中介作用。那么，你真的会使用学术期刊吗？青岛市图书馆联合维普中文期刊服务平台，共同发起“好文推荐”有奖投票活动，奖品丰厚，快快请朋友来助力吧！详情请戳：网页链接,0,0,2,,青岛,山东,中国
20,5021250672395224,匿于野,2024-04-09 14:08:33,最近久坐的时间实在是太长了，于是决定每周二在长宁的这天（白天勤工，晚上有课）空余时间用来跑步，遇上好天气不说，苏州河边的花花草草也是很漂亮。 早上看到了研究生科研新规，感觉学校大概是认清了大家的学术研究情况 ,0,3,0,上海,上海,上海,中国
20,5021248987859913,中国考古网,2024-04-09 14:01:52,#学术研究# 李俨 周学鹰 | 龙山文化建筑技艺初探：以藤花落和两城镇遗址典型房址复原为例——藤花落和两城镇遗址包含大量地面房址遗存。对比两地房址的空间体量与营建技术，可以发现藤花落房址规模呈现出明显等级差异，而两城镇房址的营造理念与技艺均领先于藤花落。从两处遗址的建筑特征考量文化类型，两城镇与尧王城遗址的房址高度相似，而藤花落遗址的房址特征无法证明其属于尧王城类型。网页链接,2,0,8,,北京,北京,中国
20,5021243151745713,Nabi379,2024-04-09 13:38:40,女子推理社 你好 我是一名新传学生 在进行关于女子推理社的相关学术研究 本次的问卷内容匿名并仅用于研究分析 占用大家三到五分钟时间去调查一下 根据上一次的问卷调查 我对问题进行了一些补充和细化 #女子推理社# ,0,0,3,安徽,芜湖,安徽,中国
20,5021235010868061,咬痕特长生,2024-04-09 13:06:19,公公们开始探讨生态划分人群我真的不行了 上个网而已还以为搞学术研究 ,0,0,0,福建,福州,福建,中国
20,5021225227390260,成长的小昭,2024-04-09 12:27:27,“学阀”是指在学术界中拥有权势、垄断学术资源、压制新思想和新人才的人或团体。  学阀现象通常表现为一些学者或学术机构凭借其地位、权力或资源优势，对学术研究和学术发展进行不正当的控制和影响。#学阀##学术研究# ,0,0,0,湖北,武汉,湖北,中国
20,5021216164807191,樱桃味糍粑,2024-04-09 11:51:26,不知道的还以为我疯了 不好意思我在做学术研究！ ,0,0,0,中国澳门,,澳门,中国
20,5021199798633490,小易爱分享-BTC,2024-04-09 10:46:24,4.9   今日密码 币种：BTC 位置：71000（进）-70000（补） 方向：多 止盈：72000-73000-74000分批止盈 止损：69000 币种：ETH 位置：3690（进）-3620（补） 方向：多 止盈：3760-3830-3900分批止盈 止损：3550 个人观点，仅供参考，市场有风险，投资需谨慎，仅为学术研究，不作为投资建议 ,0,0,1,广东,东莞,广东,中国
20,5021198123532357,小土豆爱喝茶,2024-04-09 10:39:44,姐们又开始学术研究了 ,0,1,0,山东,德州,山东,中国
20,5021184513280759,魅力河南早知道,2024-04-09 09:45:40,　　湖北三峡移民博物馆主体建成　　4月8日拍摄的湖北三峡移民博物馆建设工地（无人机照片）。近日，位于三峡工程坝上库首的湖北省宜昌市秭归县湖北三峡移民博物馆主体“三峡之门”建设完成。该馆计划今年内建成开放，主要承担湖北三峡移民工作展览展示、征集收藏、学术研究、教育传播、旅游接待等功能。,0,0,0,河南,南阳,河南,中国
20,5021179948305208,咖啡脑袋不困八,2024-04-09 09:27:31,搁这学术研究似的 ,0,0,0,美国,,,美国
21,5021171969426651,赫利克拉博,2024-04-09 08:55:49,老是以自己忙作为自己事情不想做、做不好的借口，但仔细一想，自己能忙得过大佬们吗，大佬们都能社会事务、个人事务、业绩业务和学术研究方方面面照顾好，我凭什么找借口 ,0,2,1,浙江,温州,浙江,中国
21,5021045400536723,为何一切尚未消失__,2024-04-09 00:32:53,突然发现在学术研究提出问题解决问题的过程中，“为什么不”比“为什么会”有趣的多，当然也需要更广博的知识储量加以全面考量。在《政治秩序的起源》里，福山一开篇就问，为什么是中国成为了国家制度的最初行者，可书写的重心又显见地难免放在“为什么不是欧洲、不是印度、不是原始部落？”。这一部分也诚然写得更加丝丝入扣、要言不烦。也许在科班的学术训练之下，社科研究者二十啷当岁就可以对“为什么会”给出成熟综合的解答。但真想要对“为什么不”给出个漂亮的回应，大概还要再苦学琢磨几十年。,0,0,0,四川,成都,四川,中国
21,5020848383070045,中国考古网,2024-04-08 11:30:00,#学术研究# 内蒙古巴林右旗地区兴隆洼、红山玉器的材质利用研究：内蒙古巴林右旗地区出土、采集到的兴隆洼、红山玉器较多，但长期以来缺乏针对当地玉器的系统性材质研究。本研究借助拉曼光谱仪和X射线荧光光谱仪等便携式仪器对当地的74件兴隆洼与红山玉器进行无损测试分析，确定了这批玉器的材质主要为闪石玉。网页链接,8,2,14,,北京,北京,中国
21,5021028504572510,银河星弦,2024-04-08 23:25:44,看完了《人生海海》，每个人读完都有自己的感受，但真心觉得没有有些人说的那么不堪，特别从学术研究看。。。 ,0,1,0,江苏,淮安,江苏,中国
21,5021026734047371,风行子98519,2024-04-08 23:18:41,问卷调查#问卷调查##学术研究# 学术研究 ,1,13,4,湖南,衡阳,湖南,中国
21,5021020610888233,魑斗_今天开始做反派,2024-04-08 22:54:22,看郫县友邻锐评甄嬛传我真的有点想看了，就当学术研究了（多闲（╯‵□′）╯︵┴─┴ ,0,1,0,上海,上海,上海,中国
21,5021010652562775,王YY一定要努力吖,2024-04-08 22:14:48,突然悟了学术研究的真谛：已知1+1=2，求解：1+1为什么等于2，如何验证他的科学性 ,0,0,0,北京,,北京,中国
21,5021009856172916,土逼滚远点,2024-04-08 22:11:38,对生命都没有敬畏之心的人你还指望他能做出什么学术研究@兰州大学 ,0,0,3,江西,九江,江西,中国
21,5021006488667133,小肚小肚o我在,2024-04-08 21:58:15,#我建议老乡鸡帮我写论文# 知道的老乡鸡是一家快餐店，不知道的还以为老乡鸡是搞学术研究的，溯源报告比我论文可强多了。 ,0,0,0,四川,成都,四川,中国
22,5020995513488428,季屿Yi_,2024-04-08 21:14:39,#虐猫考生#你说以后每年研究生考试成绩出来会不会都有人出来举报，都有人出来挖黑料？ 搞学术研究的把精力用来记录同学的黑历史，你说会出来个马斯克还是啥？ ,0,2,0,山东,烟台,山东,中国
22,5020994616169993,放了我吧求你了,2024-04-08 21:11:05,你的学术研究比较烂，但是呢你的工作量又弥补了这一点，如果继续增添内容的话，就会显得这坨屎越来越大。 ,0,0,0,四川,成都,四川,中国
22,5020973356551303,-叔叔的小壯暖男-,2024-04-08 19:46:36,今天带着我的“学术研究成果”去找我那接近一个月没见的论文导师，在经过接近一个多小时紧张激烈的学术讨论准备散会的时候，她从她的包包里翻出了一条她去剑桥开会时买的手信，她说要送我的时候我还震惊了一下，虽然并不是什么很珍贵或是贵重的礼物，但也算是对我努力后一丝丝的安慰，这样的神仙老师要是一直能够出现那该有多好啊😆……加油吧，少年[可愛],0,14,9,中国香港,,香港,中国
22,5020965843242384,莎士恼缠,2024-04-08 19:16:45,经过三次大创彻底承认了自己没有搞学术研究的能力 ,0,2,0,江苏,南京,江苏,中国
22,5020956059239970,薛定谔之海,2024-04-08 18:37:52,现在从事的职业给我带来的最大问题是无法把工作内容彻底视作“打卡上班”从而和精神生活完全分离，在被社畜生活挤压得喘不过气时能留存一方自我逃避的空间。我确实以学术研究为乐，但它又不仅仅是（也不能做）一个人头脑中的风暴。就像之前说的， 进入这个不可名状的评价体系意味着它会终身和自我拷问绑定，终身让“我能否靠自己在此生存”的诘难如影随形。一旦受挫，那种双重debuff的感觉会更加明显。好吧，其实就是受了挫在此感慨一下而已。但感慨以后，我仍然只能拥抱这样的生活方式。,0,2,10,北京,北京,北京,中国
22,5020935653952047,爱喝珍珠奶茶的小怪兽,2024-04-08 17:16:47,哎呀，一般看到定位就被狙了。 真是会到半夜爬起来扇自己一耳光，学术研究，学术研究嘛，为什么要选半结构访谈？！！！！ ,0,0,1,泰国,,泰国,泰国
23,5020911017658013,·星星也失眠-,2024-04-08 15:38:52,我不适合学术研究 ,0,0,0,福建,厦门,福建,中国
23,5020908404871057,汤咘哩咘咘-,2024-04-08 15:28:30,学术研究只有世界第一没有世界第二 ——泰戈尔 ,0,2,0,重庆,,重庆,中国
23,5020905661270938,shadow是shangshadow,2024-04-08 15:17:36,美团骑手 各位骑手们 下午好！ 这是一份新业态劳动者问卷 仅用作学术研究，不会泄露您的隐私 恳请大家帮忙填一填吧 祝大家身体健康，工作顺利！ ,0,0,0,湖北,宜昌,湖北,中国
23,5020871309134983,不見君歸處,2024-04-08 13:01:06,写这破论文让我直感叹还好：我不会考研，也考不上研，就算考上也读不下去…… 学术研究真的好难 ,1,0,1,广东,广州,广东,中国
23,5020853190264720,薄樱冬日薰,2024-04-08 11:49:06,大捕头人在现代应该搞学术研究 但可能偶尔去老二直播间 家人们今天我请了特别嘉宾我大师兄。今天是吃花专场… ,0,0,0,上海,上海,上海,中国
23,5020831019960881,广西师大出版社社科分社,2024-04-08 10:21:00,龚斌先生《魏晋清谈史》以求真求实的严谨科学的态度，为学术研究树立了高标，并全面梳理了魏晋清谈的历史：追溯清谈的源流；界定清谈的内涵；生动而具体地描绘清谈论难的场景，历历如在眼前；详述清谈人物的世家传承。作者再现了当时雅言哲思，并论及儒、道、佛三家思想的冲突、碰撞，及火花闪现之后的思想融合，凸显了魏晋时代的思辨与精神生活之自由，实是将魏晋清谈的研究推进到了一个新高度。——复旦大学教授  蒋凡#大学问图书#,10,8,19,广西,桂林,广西,中国
23,5020791921969022,风吹过来宇宙,2024-04-08 07:45:39,#张彬彬的朋友圈能不能带我一个#实话实说，这句唯一的bug就是张彬彬太帅了，很难想象一位学医5年，临床还要好几年，还要天天颠倒值班，遇上需求奇葩病人，然后，工作科室还有kpi，好像还要继续搞学术研究要完成的医生，手术做的要喝葡萄糖，衣衫褴褛的医生能那么帅 ,0,3,2,挪威,,挪威,挪威
23,5020715176166078,拜托你拜拜,2024-04-08 02:40:41,不知道在写论文的过程中收获了什么。收获了不健康的身体吧，更加意识到自己不愿也不适合做学术研究。 ,0,2,4,江西,南昌,江西,中国
23,5020704116835809,为什么半天改不了昵称,2024-04-08 01:56:44,没事，毕业论文写的差改就完了，不要担心，老师觉得我烂很正常，因为就是很烂，反正研究生不用搞学术研究了，把毕业论文搞完就可以美美享受生活啦 ,0,0,0,陕西,西安,陕西,中国
24,5020688788229156,你辣翅全给我,2024-04-08 00:55:50,我的学术研究就像是对着空气一通乱抓 拽几个惯用的名词就像address social justice了一样 好fw的高中生活 ,0,0,0,北京,北京,北京,中国
24,5020680437629429,曾拒绝吾煮克莱恩,2024-04-08 00:22:39,睡前健脑：一想到法师这种职业为了单纯的学术研究什么事都有可能干的出来 灵感整个飞流直下三千尺疑是银河落九天 ,1,0,0,浙江,杭州,浙江,中国
