页码,微博id,微博作者,发布时间,微博内容,转发数,评论数,点赞数,发布于,ip属地_城市,ip属地_省份,ip属地_国家
45,4966114545370796,汪瑜玮,2023-11-09 10:37:16,新浪微博会员13个月年卡半价 （48） 芒果TV会员年卡50   卡尔?威特于1818年写成了一本名为《卡尔?威特的教育》一书，该书是世界上最早论述早期教育的文献，他的教育理念被后人誉为早期教育的楷模。他认为，首先我们需要承认的是孩子的天赋当然是千差万别的，有的孩子高一点，有的孩子低一点。假设我们最幸运地生下一个禀赋为l00的孩子，那么白痴的孩子的禀赋大约只能在10以下，而普通的孩子只在50左右了。如果所有的孩子都受到同样的教育，而且这种教育也同样都是非常完全的，那么他们的命运就取决于其个人的禀赋。可是现在的孩子大都受到的是非常不完全的教育，所以他们的禀赋连一半也没发挥出来。比如说，禀赋为80的孩子，可能只发挥出了40；禀赋为60的孩子，可能只发挥出了30。因此，若能乘此之虚，对他们实施可以发挥其禀赋八到九成的有效的教育，那么即使生下来的禀赋只有50的普通孩子，也会优于生下来禀赋为80的孩子。当然，如果对生下来就具有80禀赋的孩子施以同样的教育，那么前者肯定是赶不上后者的。不过，我们大可不必悲观，因为生下来就具备高超禀赋的孩子寥若晨星，大多数的孩子都是普通而平凡的，其禀赋约在50左右。,0,3,0,安徽,六安,安徽,中国
45,4965958168873373,用户7870771056,2023-11-09 00:15:53,#怡日事# 11.8 1、单词全 2、单词核 3、阅读 4、高频词 5、词汇网课×2 6、长篇阅读 7、⭐文献修改 8、写作网课 9、公开课 10、教育类文献 11、阅读➕网课 12、听力 13、翻译网课 14、⭐清单 15、⭐现教案  16、日记 ,0,1,0,广东,茂名,广东,中国
45,4965632926548529,牛津-小裁缝,2023-11-08 02:43:29,人才之为教育众多针对人力资本和经济增长的实证研究都明确地将人力资本以教育成就的高低来诠释。大量文献记录了教育程度在国家层面经济增长中的作用。尽管这些研究很重要，但它们并没有考虑到区域溢出效应或相互依存关系。国家和其他大型辖区的区别主要是强制划分的政治边界；大都会区域则倾向于依靠经济性质来划分单位。其他一些学者也发现大都会提供了一个比国家更加合适用于评估人力资本作用的背景。使用空间计量经济学，菲舍尔在一项涉及 22 个欧洲国家的研究中检验了跨区域知识传播与增长之间的联系。至少自1958 年，厄尔曼首次写到教育对区域经济增长的重要性时，经济学家就已经认识到教育程度与区域发展之间的关系。大量研究建立在厄尔曼的初步工作基础上，以揭示城市区域内部和跨区域的教育水平与工资之间的重要关系。简而言之，这项研究发现，受教育程度较高的城市生产力更高。已发现教育每增加一年可使一个地区的生产力提高 3% 。西蒙发现1940年至1986年间大都市地区的教育程度与就业增长之间存在很大的正相关关系。他不仅发现了同一大都市区内城市之间的溢出效应，而且还指出，人力资本水平较高的城市比同一大都市区内的其他城市增长速度更快，这表明人力资本效应部分局限于城市本身。西蒙和纳尔迪内利也做了相似的研究，只是时间跨度更长，但最终也得出了相似的结论。他们发现，随着时间的消逝，拥有更多以教育来衡量人力资本的地方更能抵抗来自外部的冲击。最近的研究表明，随着时间的推移，人才和人力资本的差异越来越大。这是一个内生的过程，在这个过程中，最初受教育程度较高的地方，其人力资本水平随着时间的推移而比开始时教育程度较低的地方增加得更多。斯托拉里克等人探索了教育与经济绩效之间的区域内关系，以确定大都市区域内受过教育的人集群是否重要。他们发现中小型大都市区郊区的高水平人力资本与收入之间存在密切联系。然而，在人口超过 100 万的大都市地区，城市中心的人力资本与经济绩效的关系相对较强。,6,0,15,英国,,英国,英国
45,4965870367675169,2024年一定上岸呀呀,2023-11-08 18:27:00,《学记》 世界上第一本最早（系统的）论述教育学的文献or著作等 🌟🌟🌟 ,0,0,0,山东,菏泽,山东,中国
45,4965782169849548,中国教育新闻网,2023-11-08 12:36:32,　　【期待学术资源开放共享走得更远】近日，“PubScholar公益学术平台”在中国科学院文献情报中心正式发布。用户通过该平台，可检索的资源量约1.7亿篇，免费获取的全文资源量约8000万篇，包括期刊论文、学位论文、预印本论文、专利文献、领域快讯、科学数据和图书专著等各种类型。　　学术文献是科研人员创造知识、记录和展示学术成果的重要形式，也是科研工作者创新创造的智慧结晶，更是科学家沿着前人研究成果不断勇攀科学高峰的“铺路石”。这些资源既然是社会甚至人类的共同财富，就应坚持价值最大化原则在更大范围内传播、借鉴和使用。然而，一些学术平台却在资源共享方面筑起高墙，将论文等资源擅自收录，不仅不通知作者、发放稿酬，连作者本人都要付费才能下载，凭借资源垄断牟取利润。这种行为饱受诟病。公益学术平台的出现无疑有利于拆掉学术资源开放共享的高墙，重塑学术平台资源生态。　　作为中国自然科学最高学术机构，中国科学院具有自身科研产出富集的天然优势。在建院74周年上线“公益学术平台”，举全院之力、聚各方资源，积极打造普惠的公益性学术资源平台，为全社会提供公益性学术资源服务，打造开放高效的知识创新生态，充分体现了“人民科学院”的社会责任和使命担当，必将有利于构建起新型学术交流体系。　　“公益”“开放”已成为学术界获取资源的热词，更是世界各国科学家的共同呼声。“PubScholar公益学术平台”不但顺应了世界科技发展潮流，而且及时回应了我国在推动科技创新驱动发展过程中科研人员的现实需求。《2023中国科技论文统计报告》显示，我国论文数量首次超过美国排名世界第一。快速发展的科技创新事业，使得我国科研人员和社会公众对科技论文、专利、数据信息等学术资源的需求量越来越大。据介绍，“PubScholar公益学术平台”集合了中国科学院的科技成果资源、科技出版资源和学术交流资源，开放获取环境下允许集成服务的学术资源，以及协议授权或其他合作共建模式获得授权的学术资源。它的出现，必将促进我国学术平台走向普惠化、增强良性竞争，最大化实现公共资金资助的科研成果及时开放共享，推动我国科技创新学术成果走上国际舞台。　　当今世界科学技术日新月异，科技创新和学术产出层出不穷。如何提高平台核心竞争力，仍然需要通过增量、扩容、提质等手段，不断丰富学术资源、集聚最新学术成果，完善平台功能服务。如此，才能推动更大范围的学术资源共享和知识传播，持续提升更精准、更智能、更高效和便捷使用的服务能力。　　也有不少人追问，这一模式能否大力推广？由于平台在资源整合、及时有机更新和营运中会产生大量的成本，公益之下能否充分满足用户的多样化需求？如何让公益学术平台既要做到叫好，更要实现叫座？面对公众的热情期待，或许平台还要通过进一步的发展才能给出完整的答案，拓展更为广阔的学术资源空间，更好满足用户个性化的需求。　　此外，如何权衡好创作者、使用者与平台之间以及知识付费和学术分享之间的关系，充分用好政府“有形之手”和市场“无形之手”，找到平台运营的最佳平衡点，真正实现共建、共享和可持续发展，更是公益学术平台不得不思考的现实问题。只有直面更深刻、广泛和复杂的挑战，不断改进和创新，才能推动平台走向更宽广的发展空间。　　（张筠 作者系四川省中国特色社会主义理论体系研究中心特约研究员、四川省社会科学院马克思主义学院特约研究员）　　《中国教育报》2023年11月08日第2版#教育##教育新资讯##学术资源##学术##文献#,1,0,0,,北京,北京,中国
45,4965087700583647,absinthium_1,2023-11-06 14:36:57,你们搞哲学的不准随便缩写英文我说偷个懒用一下翻译软件，神经病一样的软件把文献里的HEC全给我翻译成了高等教育委员会。 ,0,0,0,福建,厦门,福建,中国
45,4965085477077011,期刊发表六六编辑,2023-11-06 14:28:06,救命！我为什么才知道这本超好发的教育核心！语文建设Language Planning基本信息曾用刊名：拼音.文字改革主办单位：语文出版社有限公司出版周期：半月ISSN：1001-8476CN：11-1399/H出版地：北京市出版信息专辑名称： 社会科学II；哲学与人文科学专题名称： 中国语言文字；中等教育出版文献量：25281篇总下载次数： 9452883次总被引次数： 101492次评价信息(2022版)复合影响因子：1.274(2022版)综合影响因子：0.079#教育##语文##文学#学术期刊论文发表期刊发表期刊#学术期刊论文发表##学术期刊论文发表##学术期刊论文发表##中国哲学社会科学最有影响力学者排行榜#,0,0,0,河北,石家庄,河北,中国
46,4964140104812980,OrionGodlike,2023-11-03 23:51:33,一个普通高校研究生的上学综述！写不完的文献综述，看不完的教育文献与经济文献，做不完的双语演讲，听不完点讲座和参加不过来的学术论坛，一打开电脑网页上密密麻麻知网的文章，永远做不完的学生工作，从班长到学院助理、在到校学生会、院学生会，从负责班级的细致工作到整个学院的大大小小的活，这看似很疲惫的生活就是我的研究生生活！我班里的同学经常问我：你不累嘛 咋感觉你精力这么充沛？我很累很累、但我真的很开心现在，真的很享受现在充实的生活，戒掉游戏、戒掉一切无用的爱好，用知识丰富自己，享受自己辛苦工作为同学老师分担压力的快乐，享受和好朋友们一起出去吃吃喝喝，聊学术聊人生的乐趣，享受自己不用在限制自己社交范围，跨越性别界限，以成为好朋友为目的的社交方式！俩个月以前的我和现在截然不同，甚至可以说天差地别，我的研究生院校并不优秀，我周围朋友老师的家庭条件，自身条件也没有那么优异，但这里的同学，老师都很真诚，都很热情，可以说很有人情味，不像之前那个充满黑暗，算计，人情世故的学院，我们都在朝着一个好的方向共同努力，水滴石穿，哪一滴水穿的并不重要，重要的是大家都在一直奋斗、最后取得成功。用四年大学的血淋淋的教训，让我终于醒悟了人生哲理：把自己当在第一位，多干点活，累一点不是坏事，全心全意为同学和老师服务，不要总想着为了点什么职位，为了点什么利益、当你自己的实力达到了那个高度的时候、你所拥有的一切都是心安理得的，都是你真正配得上的。现在的我除了失去了爱情，什么都有了。转念一想，对于爱情也有了重新的定义：并不是你一直一直很爱一个人就要指望别人也会一样爱你，也不是一直一直对谁好谁就会爱上你，爱情是一种感觉，是一种没有任何理由的情感上的火山喷发，说白了，一见钟情是基础，合不合适那是能否继续下去的关键因素。再遇见很喜欢的人我会收敛心中的想法、因为不是我的，我拼出命ta也不属于我，但我不会因为一次感情的失败而放弃敢爱敢表达，对的那个人出现的时候，我会知道那是我值得奔赴一生的人。还有，没必要因为失恋把自己弄的痛苦不堪，遗憾人生到处都有，只要自己在一段感情里毫无保留的付出，努力了，结果真的不重要了，做什么其实都是、一切都是最好的安排嘛！现在内心真的很感谢辽师今年没考上，真的因祸得福了，我自己都难以想象如果一直笼罩在那层黑暗的迷雾里，我又要花多久，走多少弯路才能醒悟过来，我真的很爱现在拥有的一切、很爱现在的自己，很爱现在的生活，我希望我能通过努力为学院做出成绩，为职业教育作出贡献，为自己精彩的活一次！,0,2,2,上海,上海,上海,中国
46,4964041884437203,橘子味的软汽水-,2023-11-03 17:21:15,教育优惠新买的pad真香啊（之前还是大学买的），查文献真方便啊，窗外真好看啊，努力的人太多了，我一直是最差的，但是我真的好幸运啊。 ,0,1,0,江苏,无锡,江苏,中国
46,4963784834679861,Anitaaalison_,2023-11-03 00:19:50,最近相册产出好低 全都是上课拍的笔记 文献课和教育心理学课我真的 还有痛苦的口译 救命 当然了 学校秋天的银杏和枫叶还是很漂亮的 总让我想到鬼怪阿加西！！！老霉芭酒重录好好听 好喜欢 最后 我想骂 王者农药是什么鼠杯游戏 ,0,11,0,辽宁,大连,辽宁,中国
46,4963749325702948,是半个小太阳,2023-11-02 21:58:44,之前我弟问我“借”钱我因为手头没有 给不了他因此好几个月不和我说话说我这个姐 “有跟没有一样”…这两天 他又找我问我能不能帮他对象写个毕业论文本来我以为就一篇论文结果仔细一问要求合着是一个成人继续教育的本科毕业设计 包含 开题报告+文献综述+实践研究然后我解释了我可以指导 帮忙修改 但是帮写 真写不了然后他又不回消息了估计又得大半年不和我说话然后我给我妈打电话说了这个事情她一句：让我帮忙写 那你就给写呗轻描淡写的…真的累了,0,2,1,法国,,,法国
46,4963742716531023,用户戴永成,2023-11-02 21:32:28,   《西藏生死书》是教育界、医疗界、科学界都必须了解的一本参考文献。     教育界可以因此获得“生命旅程的意义”更好教导每个人应该如何拓展生命旅程的高度。     医疗界可以因此获得“众生平等的哲学思想”懂得更好善待每个疾病中或者即将面临死亡的患者。     科学界可以因此获得“生命如何而来如何而去的秘密”延续爱因斯坦的物理证实量子医学的伟大价值。     《西藏生死书》用博大精深的哲学原理辩证思维深刻阐述癌症之类的疾病其实是一种警讯，提醒我们生命中一直被忽略的深层部分，比如精神的需求。如果我们能够认真看待这个警讯，全盘改变生命的方向，不仅能治疗我们的身体，甚至有益整个生命。       请善待我们的灵魂深处的需求而不是物质世界。————随笔于2023.11.2.,1,0,1,安徽,合肥,安徽,中国
46,4963717036904292,炙烤了德日纪,2023-11-02 19:50:26,难过的是昨天才看完有关教育公平的文献 今天遇到了有关教育公平的真题 我却提取不出来一点 脑袋晕晕的 教研也背不进去 ,0,7,0,湖南,长沙,湖南,中国
46,4963644022457519,知识产权-专利办理,2023-11-02 15:00:18,《重庆三峡学院学报》 期刊级别：省级，知网，双月刊，博士副高，收长篇 字符数：12000字符 栏目：三峡研究、文学研究、理论探索、语言研究、经济研究、传统文化、经济热点、文学评论、绿色教育、民俗视阈、政法论坛、经济经纬、书评、域外视野、管理科学、文献研究、社会治理、民俗视域、国家治理 ,0,0,0,河北,廊坊,河北,中国
46,4963289676120086,顺德图书馆,2023-11-01 15:32:14,#顺德地方文献#【知识产权公民教育简明手册】谭志亮主编（索书号：*D923.4/0028）。该手册是由顺德区科学技术局、知识产权局、专利信息中心联合制作的相关知识产权教育读本。内容丰富，既有条例法规规定，又有案例分析，还有情景漫画，漫画里虚构的卡通人物生动形象，极具代表性，为手册增添了可读性和趣味性。欢迎前来顺德图书馆五楼地方文献阅览厅查阅！本馆长期对外征集顺德地方文献，征集热线：22808607 22808621,0,0,0,,佛山,广东,中国
47,4963221169767760,糯雾yooo,2023-11-01 11:00:02,建议查阅精神分析学家的文献，以了解他们所提出的“自卑情结”这一教育方法对人类的影响。这个词汇可能是由那些接受过奥地利教育的人发明的。 ,0,0,0,辽宁,,辽宁,
47,4963004396340342,卤煮疫苗,2023-10-31 20:38:39,同意“循证医学包含了复杂的医学知识和医学实践，缺少相关教育和训练的公众死抠医学指南和文献不仅得不到好处，还可能因为曲解带来伤害”这句话且见过真实案例，但我想强调的是，如果不想被“非医学专业人员”碾压，那就得逼着提升水平，对那些碰瓷儿和强词夺理的除外,6,6,16,北京,,北京,中国
47,4962867114149301,小胡努力12,2023-10-31 11:33:08,"文献法”是研究方法吗？对于教育学发展而言, 研究方法是决定教育研究质量的关键因素, 它意味着教育学的科学性质。当前, 在教育研究文献中, 比如, 调研报告、学位论文等, 经常看到有研究者在研究方法部分强调使用了“文献法” (也称为“文献综述法”或“文献研究法”) 。这种所谓的研究方法主要表现为在撰写文献综述时, 对收集和整理的一些以往相关研究文献进行传统意义上描述性地分析与概括, 并以此作为提出研究问题的基础。对此, 有些教育研究者提出异议, 有人指出“文献法”不是研究方法, 而有人则强调它是研究方法, 甚至有时两种观点发生激烈的争论。从研究方法的视角来看, 这种“文献法”能称之为研究方法吗?对于这个问题的澄清, 有助于进一步明确研究方法的性质和完善教育研究方法论体系, 也有助于提升教育研究质量。一、研究方法的范式之争二、文献综述与研究方法1. 关于文献综述2. 研究方法的特征3.“文献法”不是研究方法三、对教育研究报告及论文撰写的建议1. 提升文献综述的思辨研究水平2. 重视文献综述的实证方法论文写作#论文##研究生#硕士论文在职研究生#论文写作#",0,0,1,陕西,西安,陕西,中国
47,4962802223547555,Christina倩789,2023-10-31 07:15:17,Day103 有氧30分钟 听力一小时 阅读20分钟 单词40分钟 教育与统计学1小时 没有读文献 ,0,0,2,河南,信阳,河南,中国
47,4962593209060234,albestalpass,2023-10-30 17:24:44,看文献时每次看到南京师范大学教育科学学院的署名时还是会有点心情波动 ,0,0,0,云南,昆明,云南,中国
47,4962466913846272,黑山老妖jy,2023-10-30 09:02:53,开创现代天文学的伽利略出生在一个音乐世家，父亲是当年佛罗伦萨著名的鲁特琴手和作曲家，兄长也以此为业。从文献记载得知，伽利略从小受到良好的音乐教育，具备成为音乐家的潜质。当然，他后来成了科学家，于是，人们就忘记了他早年所受过的音乐教育。 ,0,0,0,江苏,盐城,江苏,中国
47,4962418323095709,风之谷的教育微博,2023-10-30 05:49:48,2023年10月30日人民大学馆藏红色文献，鉴证了我们党创办正规高等教育的艰辛历程，是十分宝贵的红色记忆，要精心保护好，逐步推进数字化，让更多的人受到教育、得到启迪。要运用现代科技手段加强古籍典藏的保护修复和综合利用，深入挖掘古籍蕴含的哲学思想、人文精神、价值理念、道德规范，推动中华优秀传统文化创造性转化、创新性发展。要加强学术资源库建设，更好发挥学术文献信息传播、搜集、整合、编辑、拓展、共享功能，打造中国特色、世界一流的学术资源信息平台，提升国家文化软实力。基础教育中的教育者，在各个方面提高自己的文化软实力，最终为提升国家文化软实力贡献自己的一点点微光。相信888,0,0,0,河南,郑州,河南,中国
48,4962287142834279,吾老妻八嘎牙路,2023-10-29 21:08:32,想到燕麦你提问箱说有些作者写很多但不会就是不会，后面明牌这人是童谣老师额老实说有点翻白眼，主子受辱就是奴才无能，说我女神写文没天赋不就是说我品文没天赋吗，你水啊不过大概知道佢指什么，很明显啊童谣老师写文就是应试教育那套啊，可以看到很多参考文献的痕迹，那又怎样呢同人而已，灵气也是气匠气也是气匠气为何不能为我所喜呀，虽然我只看了tou和sbm，但确实看出人家写作前做了大量工夫，总比信手胡扯一个半夜的东京终电强吧,0,0,0,福建,泉州,福建,中国
49,4961514462381087,朱梦麟-山神,2023-10-27 17:58:11,科学家如何变成流量大V？如何不扯淡不忽悠，把一篇运动科学文献变成一篇博文，进行大众科普教育？ 你绝对想象不到，在美国体能协会的官方教材里面有专门这样的指导。  这本书刚出现的时候，很多人就关注了。和大家认知里“它是一本高大上不落地的专业教材”不一样，里面的有些章节非常接地气且有意思。简单说就是在你原先靠经验摸索、毫无头绪、一直走弯路的工作状态下，能为你指出一条明路，用科学帮你提高工作效率。  不看血亏。,13,6,24,浙江,宁波,浙江,中国
49,4960824252698246,昭昭小照,2023-10-25 20:15:32,这周的作业 劳动教育论文格式 打印 手语资料 中外教育论文 1500字 手写 听障 文献综述 ,0,2,1,四川,乐山,四川,中国
49,4960376171790636,Iriscuteeeeee,2023-10-24 14:35:00,早上文言文晚上英文文献  感觉自己在学汉语言教育 ,0,8,2,陕西,西安,陕西,中国
49,4960336418178583,DL-叫我了了kun,2023-10-24 11:57:03,学前教育 想知道大家写文献综述时外国参考文献在哪里找 ,0,0,2,陕西,汉中,陕西,中国
49,4960330988914232,喜乐forever____,2023-10-24 11:35:29,"求电脑推荐 女生预算4500左右，汉语国际教育专业，写论文，看文献Excsl,word,ps,pr,PPT,wps,剪辑视频，追剧，内存要大，色彩好，续航时间长，求推荐。 ",0,5,5,湖南,湘西,湖南,中国
49,4960289529791151,秋山夕枫,2023-10-24 08:50:44,回复@太上敬天2:主要还是知识结构，如果只是普及性义务教育内容，的确只提及了阿拉伯保存古希腊文献并再次翻译后传入欧洲；问题在于拜占庭，即东罗马，首先是属于希腊文化区，其次它覆灭时已经快近代了。也就是说希腊文化基本没断绝过。,0,0,0,浙江,杭州,浙江,中国
49,4960265117369445,CS哥儿们,2023-10-24 07:13:44,加强新时代法学教育和法学理论研究的纲领性文献 加强新时代法学教育和法学理论研究的纲领性文献 ,0,0,0,江苏,无锡,江苏,中国
49,4960092048330042,Mao_Chou,2023-10-23 19:46:01,我真的累麻了，白天干各种杂事（督学和指导、检查和迎检、参会与会务、各类文书工作），下班后身心俱疲，还要腾出时间来读文献、准备教研和讲座，以及教育行症部门和砖家要求呈交的各种资料。 ,0,0,0,湖南,长沙,湖南,中国
49,4960032023119261,湖北省人民检察院,2023-10-23 15:47:30,#鄂检新闻##基层声音#【“不忘初心梦 红色教育行”敬老活动】近日，湖北省孝感市孝南区人民检察院组织退休老干部前往随州市新四军第五师旧址纪念馆和随州市博物馆开展重阳节红色教育活动。老干部们详细了解了红色文献、复原照片和历史文物等展品背后的新四军第五师的历史，深切缅怀了革命先烈，接受了思想洗礼，锤炼了初心使命。在参观过程中，老干部们时而驻足细观，时而凝神思考，时而相互交流。参观结束后，老干部们纷纷表示，将持续关心孝南检察事业发展，做到离岗不离党、退休不褪色，继续为孝南检察工作出计献策。（来源：@孝南区检察院）,7,0,0,,武汉,湖北,中国
50,4959967231348770,满杯水果茶_,2023-10-23 11:30:02,毕业论文应统专硕，想写数字经济对高等教育资源配置影响路径的研究，这个方向能写吗，找不到几篇参考文献，一直下不去笔，不知道怎么写，有没有人指导一下 ,1,2,4,浙江,金华,浙江,中国
50,4959911462307316,永远喜欢昌邑路,2023-10-23 07:48:26,危机（自杀）干预方法参考（2023年10月22日已更新） 本手册旨在为有意愿在自己的MTF亲友或少量陌生MTF遭遇严重危机时提供帮助、但又未接受过专业社工教育或训练者提供简单明了的行为指引，由寒涟漪结合大量参考文献进行整理。来源：危机（自杀）干预方法参考（持续更新） #抑郁症##跨性别者##mtf##危机干预# ,1,0,2,上海,上海,上海,中国
