页码,微博id,微博作者,发布时间,微博内容,转发数,评论数,点赞数,发布于,ip属地_城市,ip属地_省份,ip属地_国家
17,5022342652627844,台灣博客思出版社主編,2024-04-12 14:27:42,#出版論壇 #《 台灣閱讀與出版的急迫未來？！〰台北出版論壇2024春祭場 》4/23世界閱讀日，讀書議題再次掀起文化與教育界討論。閱讀是大哉問！卻是影響社會長久發展的大問題。藉由此次論壇正反意見的激盪探討，希望能根本的為台灣閱讀與出版環境把脈，釐清出不自怨自哀該清楚面對、急迫或不急迫的未來。■議題與主講人●上半場   ●一、台灣人讀書愛不愛??1.台灣學生讀書愈來愈新愈怪？作家宋怡慧2.台灣書店賣書愈來愈吃力？島呼冊店林詩涵3.台灣民眾閱讀風氣愈來愈好？圖書館館長王涵青綜合論壇：台灣人的新讀書樣貌：台北市出版公會理事長趙政岷，與談人：王涵青、林詩涵、宋怡慧+特邀嘉賓建中學生代表黃宥豪等）●下半場 ●二、台灣人出版急不急？！1.台灣出版未來的可能性？大雁出版集團董事長蘇拾平2.台灣出版經營的進化轉型？親子天下執行長何琦瑜3.台灣出版文化政策未來發展的可能？陳培瑜●綜合論壇：台灣人的新出版樣貌，主持人：出版公會理事長趙政岷，與談人：蘇拾平、何琦瑜、陳培瑜+特邀嘉賓寶瓶文化社長朱亞君、出版粉專A編工事中）●地點：央圖書館3樓國際會議廳（中山南路）。●主辦單位台北市出版商業同業公會有興趣嗎?一起來參加。,0,2,6,中国台湾,台北,台湾,中国
17,5022300521104057,草根设计师-CAD,2024-04-12 11:40:16,外国人来了中国，都感叹中国的基础设施，生活便利，安全环境，润人还挤破脑袋跑出去…被教育又不承认润错了，就开始各种无底线的表演//@大水豚:有时候不得不感慨。。。确实是制度问题。。。社会主义养巨婴。。。资本主义教育“人渣”,6,7,15,云南,怒江傈僳族自治州,云南,中国
17,5022076727464511,朱庆光易柱风水,2024-04-11 20:51:00,#卖房让娃退学环游世界的家庭怎么样了# 这大食伤很大，甚至有些过度了，走向另一个极端，野生环境了。不过如果一家人都喜欢，也就没什么。教育不是问题，互联网上什么都有，能自学就行，少学了很多没用的东西。钱也不是问题，年头多了总能遇到几个有财运的年份。回归社会就难受了。 ,5,6,80,陕西,西安,陕西,中国
17,5022339571648213,鱼儿棒棒52,2024-04-12 14:15:27,"一人一生，工作200↓天               ——智能化送给人类的礼物前言第一部分：被撕碎的真相，探寻创新的轨迹第一章：创新所需之客观环境创新需要条件吗？中国的客观清晰回答了这一问题。中国有14亿人口，有满足世界需求的生产能力，有充足的货币，有日益普及的高等教育体系,有日益庞大的工科生群体和日益庞大的研发队伍，总之，我们仿佛已经具备了支持创新发生的所有要素，但我们却依然与创新保持绝缘。是什么锁死了中国的创新能力呢？对于这一问题，大量的专家和学者做过大量的深入、理性的探讨和思考，从文化到体制，从体制到基因，从基因到思维方式，从思维方式到人种，给出的答案五花八门，总体概括这些思考大多锁定在主观领域，但“百家争鸣”并没有将我们引入创新的轨道，而越来越清晰的迹象表明，中国制造已然悄然走向“竞底”的轨道，幸福正在从人们指尖溜走。既然过去两百多年我们不能从主观方面找到解决问题的钥匙，那么，我们不妨先放下所谓文化、思维方式、体制、基因这些主观因素，直接从客观入手，寻求解决问题的答案。像所有概念一样，每个人都有自己对客观的定义标准，每个人都认为自己是客观的，但每个人接触的信息（数据库）被包裹在整体信息之中，因此，每个人所认为的客观实际又都是局部客观，即主观。那么，什么样的客观才是无争议的客观呢？笔者以为唯有以数学为基础、可测量的客观才是无差别、无争议的客观。对于“1+1=2”,无论任何国家，任何民族，任何信仰都不存在争议，以无争议的起点作为客观起点挖掘的规律才具有普遍意义，才能达成无争议的共识，无争议的共识是可测量性的基础，可测量性是创新发生的基础。人与机器之间存在相互替代关系，假设构成商品（含服务）的劳动合计100%，人和机器贡献比重分别为M%和N%，则M%+N%=100%。由于人力成本恒增，机器成本恒减，因此，M↓%+N↑%=100%，这一循环的终点是N%→100%。也可以说智能化的终点是智能机器人制造智能机器人，智能机器人全面替代人类在生产、运输、交付领域的劳动,智能化实现要求：人类“不劳而获”的程度要从现在的N%提升至100%。但在供给主导的市场中，充分就业（100%）是经济循环发生的基本条件。这就出现了主观努力方向（充分就业）与客观要求方向（零就业）的绝对背离，这种背离是智能化程度与消费者幸福指数呈现反比的根本原因，也是创新形成自锁的根本原因。∑微观=宏观，当所有微观单元运动方向均指向零就业，而大众主观愿望和政府调控却希望保持充分就业（100%）不变，市场自然失效，修复一个失效市场和试图努力证",0,0,0,广西,北海,广西,中国
17,5022336602082499,济南生态环境,2024-04-12 14:03:39,发布了头条文章：【2024年全市生态环境保护宣传教育工作会议召开】4月11日上午，2024年全市生态环境保护宣传教育工作会议在龙环大厦召开。会议贯彻落实全国、全省生态环境保护大会精神，传达省厅、市局党组指示批示，总结2023年全市生态环保宣教工作，安排部署2024年重点任务。 2024年全市生态环境保护宣传教育工作会议召开 ,6,4,12,,济南,山东,中国
17,5022331681900706,树后云,2024-04-12 13:44:06,女性作为弱势群体，我弱我有理。老人作为弱势群，青少年作为弱势群体，我弱我有理。仗着有法律维护，胡作非为。所以怎么说呢，儒家还是得跟上，文化教育也得跟上。儒家齐家，为什么婚姻得在利益上这么算计？你们真以为法律的作用可以解决一切吗？法律在人心的处理上，作用有其局限性。什么样的社会环境，会出现骗婚，捞女，勾心斗角？人性的恶是一门学问，知道人性的恶，然后以一种强大的心态去面对，是没有问题的。一开始有些人对于人性的恶，是保持着绝望的姿态，说我们无法去和恶相处。其实现在的学派，对于恶就有一个良好的态度，就是让自己变强大。不怕小人，小人畏威不畏德。在大乘佛法里，德有威德，只是两者的概念不一样。善良和善良的概念不一样，德和德的概念不一样。,0,0,0,广东,汕头,广东,中国
17,5022329966957127,颜控症候群,2024-04-12 13:37:17,我崽儿真的完全体现出了家庭成长环境和教育的重要性。,1,0,1,陕西,,陕西,中国
18,5022324598248582,幸福不再溜走,2024-04-12 13:15:57,每一个人都本自具足，在后天生长过程中，受到教养方式、教育、环境、际遇等的影响，而蒙上厚厚的茧以至于都忘记了自己的富足，所以，何时何地都相信自己，去发现自己内心的宝藏。 ,0,0,0,河南,平顶山,河南,中国
18,5022324530874367,爱吃鱼的猫6老板,2024-04-12 13:15:41,昨天教育部重申的快慢分班，看看人家小狗狗，个体发育有差异，有的能力强一点，有的能力弱一点，看着前面有良好的示范，也跟着上来了，动物在一个环境里互相影响，人也是一样。,0,0,0,浙江,杭州,浙江,中国
18,5022252187779962,一一团长2,2024-04-12 08:28:13,真会分析问题：“作为学校老师，既要耐心做好家长的解释工作，更重要的是，要采取针对特殊情况的教育方法，帮助问题学生不断改善过激情绪和行为，从而保护好每个孩子的权益，为他们营造更加良好的教育环境。”当老师是神啊，专治多动症，还要医生来干什么？,0,0,17,广东,广州,广东,中国
18,5022320087534048,勤恳饼干去蹦迪,2024-04-12 12:58:02,从小到大任何高兴的事情都不敢太开心，生怕自己笑的太大声被老天爷听到将这少有的开心顺利的事件收回去，之所以一直压抑自己的骄傲放纵，也是怕老天爷看不惯我给我狠狠的一击。不知道这种情况在心理学是如何解释，也许就是大环境的打压和服从式的教育让我们只敢活的谨小慎微，无时无刻不夹着尾巴做人。不行，要改变，芝麻大点的成就我开心也是应得的。开心就要大笑，不开心就要骂惹我的人。清汤大老爷，请你公平，别薅着老实本分人嚯嚯。,0,8,2,山东,威海,山东,中国
18,5022319502690896,好吃不过锅包肉,2024-04-12 12:55:42,为什么现在的年轻人浮躁 不愿意和长辈沟通？因为 当我认真想和ta们讨论一下事的时候 我能理解我们时代背景的不同 我们接受的教育程度和成长环境的不同 想耐下心解释一下现在生活的压力ta们只会搬出以前自己吃过多少苦 然后否认你的付出以及你在经历的所有糟糕事 即使你已经很耐心的解释 每代都有每代的辛苦及压力 不一样 没办法比较ta们更多只是指责你吃不了苦 现在工作有什么苦可言呢 身体上或许不辛苦 但是心理上蛮辛苦的 就我自己而言 上班和人打交道是件极为消耗情绪的事 是我自己调节能力的问题不能否认 我不愿意和父母沟通了 因为理解不了 解释不了 每每被否认自己的付出和努力 也不想看到他们急眼了开始道德绑架我 用身份施压于我我知道你们的不容易 能体谅你们心疼你们 但是被你们一次次的语言伤害 说真的 做不到公平对待 如果是为了养老 不如不要生下我 这样的生活环境 家庭氛围 挺累人的 当父母不需要被考核 当孩子却处处被父母的条条框框用来比较 我觉得我们这代挺适合当父母的 但是又不愿意当父母 挺好的 自己活的挺辛苦的了 就别让下一代继续辛苦了之前不知道在哪里看过一段话 大致意思就是 不被爱的小孩往往付出的更多 为了证明自己 我希望我做那样的人 我也希望能早日脱离这个家 以上发言谨代表自己,0,0,0,海南,海口,海南,中国
18,5022319049968839,我来自北平,2024-04-12 12:53:54,不是所有的孩子都适合高等教育的，本来就应该通过考试或者其他办法把人员分流到他们适应的环境中去，为啥现在的家长这么热衷于让孩子考大学、考研究生、甚至读博？因为职业的不平等性，大家在骨子划分好的等级！谁也不想自己的孩子低人一等造就了现在的畸形社会形态,0,0,1,北京,,北京,中国
18,5022316952033321,树后云,2024-04-12 12:45:34,女性作为弱势群体，我弱我有理。老人作为弱势群，青少年作为弱势群体，我弱我有理。仗着有法律维护，胡作非为。所以怎么说呢，儒家还是得跟上，文化教育也得跟上。儒家齐家，为什么婚姻得在利益上这么算计？你们真以为法律的作用可以解决一切吗？法律在人心的处理上，作用有其局限性。什么样的社会环境，会出现骗婚，捞女，勾心斗角？,0,0,0,广东,汕头,广东,中国
18,5022245909169591,亲子合作刘娜,2024-04-12 08:03:16,一个好的关系，永远是理解自己的能力，不是理解他人的能力。用李仑老师的话，就是学会用自己的内在影响关系。但是我们看现在的家庭教育也好，还是整个大环境也罢，宣扬的都是如何用自己的外在影响关系。比如是不是情绪稳定？是不是风趣幽默？遇事是不是不急不躁？会不会沟通？能不能理解孩子？为了迎合这些，很多人会特别喜欢那些看上去能让我们变得有所不同的学系。很多人把这定义为自己的成长，觉得没有改变的课就没用。其实不是的。就好像亲子冲突，我很负责任的告诉大家，如果一个人的人格不成熟，是没有能力关注自己的。所有的关注点一定都是去理解孩子。说白了就是通过转移注意力，去关注孩子的方式，回避关注自己。比如感受孩子的感受，理解孩子的想法。似乎只要理解了孩子，我就不生气了呀，我就情绪稳定了。很多人把这当成教育的成功。因此夸夸而谈，觉得这才是有用。可大家想一下如果只有理解了孩子，你才能情绪稳定。不理解孩子，你就没有理解自己，照料自己能力那理解孩子这件事，不就是妥妥的安抚你自己情绪的工具吗？这是把孩子工具化的过程好吧，醒醒吧，根本不是什么教育的成功。理解了孩子的确有助于情绪稳定可是，这种通过工具化他人的方式获得情绪稳定，并不可取。一个健康的关系，一定是独立且链接，就是我不需要理解你，我就有能力照料好自己。在这个前提下，我还能照料你。无法理解自己的父母，只能不断工具化孩子。这本身不可怕，可怕的是以此为荣。几乎所有的父母团体，或多或少都存在这样的现象。比如大家聊孩子，聊孩子当下的感受多么愤怒，多么无力。如果我说，当我们在聊团体之外的孩子多么愤怒或者无力的时候，或许我们的团体内部也正在上演这部分愤怒和无力。然后一定会发生2种情况一种是没人回应，沉默一会话题就被岔开了，似乎没人听我说过这样的话。一种是回击，我觉得我当下没有什么愤怒和无力呀。或者我其实听不懂什么意思，不知道说什么但如果是聊孩子的开心，同样的话，我只需要把愤怒换成开心。比如：当我们在聊团体之外的孩子多么开心的时候，或许我们的团体内部也正在上演这部分开心。那一定会收到及时的回应，对啊，我也很开心呀。这就是扼住很多人命运的枷锁。因为我们可以照料好自己的开心，所以在开心的时候，我们自然不会把孩子工具化。但我们不能照料好自己的不满和愤怒，所以只能不断工具化身边的人。为什么我总说离开团体，一个人就会丧失你的反思功能呢？原因就在这里。因为团体外没有人像带领者一样，能持续坚定不移的用这样的方式和你对话。更多的只是打着成人的幌子，实则在教你如何去工具化孩子，要么就是教你如何工具化自己。#教育聊一聊##你好我的小孩#,8,1,14,天津,,天津,中国
19,5022310648254321,-Yiinna,2024-04-12 12:20:31,某种程度上 终于摆脱压抑的中式教育和环境了 心理和身体上的健康恢复还需要时间 希望以后能够自由探索 自由成长 不被定义和束缚 ,0,0,0,上海,上海,上海,中国
19,5022309312364984,倒立喝芋泥波波奶茶,2024-04-12 12:15:12,#爸妈怕我难过给我也买了个椰子#受不了了，活在郭敬明小说里吗？天天一点屁事破防哭的要死，没有爱和钱就别生小孩，怎么会这么自私又这么愚蠢啊？你爸妈又不是什么教育专家，他们准备生小孩的时候又不是现在这个社会环境，苛责他们不觉得对他们也不公平吗？天天看抖音上那些营销号打造出来的人设被洗脑了吧？觉得别人都活在童话里，家庭和谐，人生美满，放下你的手机看看真实世界吧，有几个这样的？正常人都没几个。管他为什么给你买，给你买了不就行了吗？还非要人家捧在手心里给你？事实就这样，要么你自行改变，要么你就脱离环境，你指望哭一哭期盼别人改变那你可有的等,0,0,2,辽宁,沈阳,辽宁,中国
19,5022308501029987,-又又and木木-,2024-04-12 12:11:59,2024年  4月  12日  星期五   高新区   小雨转多云    21~15℃    终有一别    两个有两种生长环境，有两种生活环境，教育程度也不一样，家庭关系也很不同，所以思维也不一样。所以当两个陌生的人因为某种原因互生好感走到一起的时候，如果不能始终如初见，那可能终有一别，或早或晚而已。    每个人都是独体的，参与不了别的人，出生是，死亡也是。不要奢求太多，那样会很辛苦，我很小就知道，不奢望才不失望。很多美好只是瞬间，一切皆是昙花一现，人间常态是苦闷的，是孤独的。人总要学会独处，跟自己独处。    可以付出，但不要记得，可以失去，但一定要学会忘记。,0,0,0,江苏,苏州,江苏,中国
19,5022306566672184,_放_青_松,2024-04-12 12:04:18,#infj近乎病态的爱# 感觉infj一堆，中国实典型家庭教育环境下很容易出现这种人格诶 ,0,1,0,北京,,北京,中国
19,5021996394744380,DS完美生活,2024-04-11 15:31:47,我发现，一个真正有爱的人是不需要信仰的，不同的信仰来自于我们不同的成长环境，教育程度，真理观，价值观…而信仰会造成不同程度的分歧，甚至战争。在生活中享受阳光，享受天伦之乐这些都不需要信仰，而且免费，但当我们逃避现实，抱怨过去，幻想着可能会出现的未知时，我们才需要信仰。所以，我们只需要用心去爱就够了，不要让信仰成为爱的绊脚石。,2,20,107,北京,,北京,中国
19,5022305485063260,河南交警,2024-04-12 12:00:00,【#交通安全进校园# 交通安全 伴我“童”行】为进一步增强小学生遵守交通法规的自觉性，培养良好的交通安全习惯，提升同学们的交通安全意识和自我保护能力。近日，高新区交警大队走进辖区学校开展交通安全宣传教育活动。   活动中，宣教民辅警结合校园周边交通环境和学生年龄特点，用通俗易懂的语言讲解日常生活中和上放学期间，学生要如何安全通过国省道、安全骑车、安全乘车等交通安全知识，并结合涉及学生典型交通事故案例分析事故成因，让学生们更直观感受交通事故带来的伤害及惨痛后果，警示大家自觉摒弃交通陋习，遵守交通法规，不做“低头族”、不追逐打闹，拒绝乘坐超员车和非法营运车辆。同时，宣教民辅警还鼓励学生发挥“小手拉大手”作用，带动家庭和全社会关注交通安全，让文明出行理念更加深入人心，共同营造安全、畅通、文明、和谐的道路交通环境。通过此次活动，不仅提高了同学们遵守交通安全法规的自觉性，还深化了大家的交通法治观念，引导同学们自觉遵守交通法规，文明出行，将交通安全教育落到实处。,2,0,1,,郑州,河南,中国
19,5022302096592610,蜜蜜蜂啊,2024-04-12 11:46:32,有一个坚定的想法，就是一定要到很远很远的地方。很烦别人拿我与他人比较。人生来不同，所受教育成长环境都半天怎么期待大家都是健康长大的成年人。我不能沦为自己所最厌恶的一类人，指责自己又怎么不是与他们站统一战线来欺负自己，我得成为自己最坚实的盾。想来，自己算一半成功，可以夸赞自己是一个很坚强的小女孩。虽然我经常会崩溃，处理一些不好的情绪，总憋着泪水。可哪一次不是我自己擦掉眼泪，一遍又一遍收拾着自己的情绪，我会成为自己。我的童年一半是开心幸福的，一半是悲伤难熬的。陈年的伤痛堆积在心里成为裂缝，我日复一日缝缝补补，终于把每一角都化解。在去年到今年我终是与自己和解，在清醒的夜里我思考了很多。我敢和别人说我最深处的秘密，我不怕破窗效应，在每秒如针扎过后，我能平静的说出来，已然在心里嚼碎过千遍万遍，我的破事，爱怎么说怎么说。不心疼的人依然会说出最伤害人的语言。过年的时候，我和我妹妹说了一整夜。语无伦次，把话说了好几遍。她说，她不理解母亲的偏执，她告诉我她想要的，她羡慕每个有爱的家。她的意识，也在我成长路上有面对过，只不过没人为我解答。我说我明白她，我也理解我母亲。我想，我希望母亲与叔叔能够健康平安，两个人能相守到老，才是我唯一对家里的期盼。其余情绪价值，只能靠自己去积攒，不能在他们身上渴望得到，他们已经把能够给我们的都掏出来了，不能再想别的。我多渴望她能明白，也希望她不要成为像这样的我。也许她也成长许多，在我们彻夜长谈后，我没有哭泣，她竟泪流满面。似乎每代要面对的伤痛不同，我能理解我母亲的一切，每一代都是新的进化，总会演变成幸福的一代家庭。我是追求幸福的小井，我是幸福主义。如果，我是说如果。如果有足够爱的家庭，我一定要让自己的孩子幸福，我发誓。不过我得先过好自己。到现在我上过很多堂重大的课，首当其冲就是亲人离世。这堂课太深沉了，我花了十年才拿到结课书，这堂课让我生活发生天翻地覆的变化。在年纪小的时候多的是不解，畏惧。不解生命的离开，不解生活的艰难，不解粗鄙的语言怎么能从最亲的家人中说出，太肮脏了。畏惧别人发现我没人保护会来欺负我，畏惧自己一个人在出租屋里，畏惧万一母亲也突然不见。再大点演变成悲伤与自卑。难过离开的人终究会被替代，因为日子还得继续。自卑自己所没见过的光景，人格永远会缺乏一部分。后来变成思念与恨，两种情感相互矛盾斗争。最后无奈，只是，感叹。期间我惊觉我不属于家的三头，只是一份子。我期盼长辈的关心，同辈的关注，却没有回应。不仅如此，我受伤了。这个伤口到现在我也没法自然愈合，受的伤实在是太深太痛了，伤口太大了，我自己不愿意往这个伤口上药。包括很多的东西，我只想他们放在那，晾在时间的长河，起码现在我觉得烂了或是愈合都随便。我决定不做没有回应的期待，所以与家里越走越远。我一定要找到永生的城市，生生不息的栖息地。再者就是对于阶段性的友谊，我敏感的内心导致与每个真诚的女孩们走散。不过我也不期待，本身让别人理解自己的境遇就是一个奢望，太难得了，也不求在所有与朋友的时光里轰轰烈烈，我就是一个清冷淡漠的人，度过一些无聊的时间就好，我没有什么期待。我拽着无力的自己，一路上与他们相逢又错开。或许我应该去许多的地方走走，与更多人相逢又离开...就写到这吧，脑子有点空，我需要休息。,0,0,0,广东,广州,广东,中国
