页码,微博id,微博作者,发布时间,微博内容,转发数,评论数,点赞数,发布于,ip属地_城市,ip属地_省份,ip属地_国家
19,5015395628749005,性学研究僧,2024-03-24 10:22:42,放下评判，无关对错，好像可以学到更多。学习的目的是想更加了解自己，我达到了。当我接受自己原本的样子时，改变发生了。前天晚上跟学习群的小伙伴们连麦聊了聊，带大家对自己的【性自我】状况做了一次评估，这次活动对我来说感触很深，对于大家来说也是非常有意义的。之后我也会继续在群里举办这样的活动，帮助大家认识自我，解决一些实际的性问题。欢迎加入我的学习群，一起学习和进步，社群是付费会员制，非诚勿扰哈[抱拳],1,1,8,湖北,,湖北,中国
19,5015342334083759,环指姑娘,2024-03-24 06:50:56,听说有一些人有阴阳眼，前段时间看B站视频，很多阴阳眼的人看到得东西都非常类似。想做一项临床研究，纳入自我评估“有阴阳眼”的人为实验组，“无阴阳眼”为对照组。描述阴阳眼表现，根据表现明确分类标准，探究阴阳眼形成的预测因素，建议道教可以与科学界合作，可以看看要不要制造“阴阳眼”眼镜🤔🤔🤔,0,2,0,浙江,杭州,浙江,中国
19,5015249344007615,美伢日记本,2024-03-24 00:41:25,和老公讨论工作上的事还是很收获很成长的一下子有了思路和解决办法一起重看花少7看巴巴和安宇自我内耗于是我询问我是不是一个自我内耗的人回答是只有工作上内耗的凶追其根本一经验少二进社会晚（一码事）今年八月工作满3年前两年都是比较佛的评估机器去年6月才有机会开始去思考工作的方向今年更实是在溶的push和老公的启发下飞速成长现在还有一个问题 心态不知道是否正确总会在乎上面对我这个小组长的认可度 导致我内部总想藏着自己的想法于外部展示不知道这个想法是否正确不知道对团队来说是否正确anyway有成长终归是好的 对自己的定位是 做一个软刀子吧让硬不起来的自己舒服一点,0,0,0,四川,成都,四川,中国
20,5015238271568943,折赴,2024-03-23 23:57:25,然而事实就是，我们不能把自己的恋人或伴侣存入银行，自行进入冷静期，然后自我评估并重新步入婚恋市场去寻找性价比更高的另一半。 没有人会像超市货架上的商品一样等你采购并自言自语“我还没过期，我还有希望被选择”——假如你幻想着和爱人约定一个骑驴找马的期限。 ,0,0,0,河北,唐山,河北,中国
20,5015227843741113,皮皮刘刘,2024-03-23 23:15:58,我自我评估有至少50%活下去的概率......我在极端压力下，个性还是很“野”的，体能也还行。,0,0,0,上海,上海,上海,中国
20,5015077297849262,海南华大医疗美容,2024-03-23 13:17:46,今天受邀参加MD Codes Live tour 2024学术交流会。 南中国区的优秀同行们共聚一堂，一起分享和探讨最新提升抗衰打法NOW LOOK的应用。另外回顾了MD ASA 面部评估系统。面部注射填充剂看似简单，事实上背后有非常严谨的理论支撑。用科学的面部评估体系，用优异的产品，结合过硬的注射技术，才能打造出更轻盈、自然、年轻的容貌。跟着我科学变美，循序渐进，越久越年轻，一起做时间的朋友！#哪些时刻需要自我支撑##海口##正确的抗衰治疗思路##乔雅登##海口整形# 海口·华大医疗美容门诊 海南华大医疗美容的微博视频,0,0,0,海南,海口,海南,中国
20,5014905289441370,请你一个冰淇淋,2024-03-23 01:54:15,晚上又看了很久的can’t you see me和frost，mv和编舞都很喜欢。hybe打造的概念真是正中我的心，TXT的magic island恰好出现在这样一个时间点——由于对于自我能力、兴趣和前途的重新评估而产生了迷茫的心境，从而导致了动力的缺失，我的生活好像被按下了一个0.5倍速的播放键。这两首歌好像有一种神奇的魔力，让我穿越到奇妙怪诞的平行世界里，混沌的境遇和未知的前路令我同时感到精神的兴奋和心情的放松——魔法世界未知的一切调动了我的感官，而主角不用瞻前顾后、只需勇往直前的剧情走向，和对于命运庇护的相信，让我感到全身心放松——因为只要敢于历险，不需考虑其他，就能立足于这片永生之境。发自内心地，我早就已经厌倦了多思多虑、小心翼翼地做着每一个决定的生活，想要摆脱却又无法挣脱、也不敢完全抛弃社会传统的规则和框架。我想要精彩的、自由的、畅快的人生，但毕竟天赋和能力总有上限，大环境和传统经验有所限制，试错成本也随着年龄的增长而逐渐增加，万事如意无疑是异想天开。我也应该感谢目前22年人生里遇到的一切，因为与大多数人相比，我已经太过幸运，没有什么资格抱怨。但越长大，眼界变得越宽广，自然就会击碎小时候对于自身前景的美好畅想。同时，包裹着人群和社会公序良俗的甜美糖衣也逐渐剥落。我真的很难控制自己偶尔想要游离的心情。而怪诞童话、混沌之境就是我带着副作用解药。而这个副作用，可能是一时的上瘾，也可能是我为自己构建模拟人生的平行世界的不断变革和扩张。但在这些充斥着魔法元素的平行世界里，勇气、努力、美好的人格和一部分天赋决定了一切。这符合我从小被教育的“努力决定成功”论、“善良一定有好报”论。但这两个论点早在初中时就已经被我抛弃。因为我持续性的、对于生活经验和自我缺陷的分析和总结让我明白，天赋决定了上限，而太过善良毫无疑问是容易被人占便宜的。如果你问我怎样才是一个好人，我会告诉你，是善良、正直的人。但对于这个社会来说，绝大多数时候，圆滑才能占上风，内向是一个贬义词，耍小手段偶尔也是必要的。成长就是一个现实逐渐扼杀纯真的过程。可能哪天我不再沉迷于魔法世界了，我就完全变成了一个麻木的大人。 专栏 · 乱写的,0,1,0,上海,上海,上海,中国
20,5014886264081868,亚马逊的迷路蝴蝶,2024-03-23 00:38:40,如果过于依赖别人在他需要的价值排序上所发出的评估性声音，那么人会游离会迷茫会没有成长。而自我是一种牢固运行的机制，不是今天我好明天我坏的波动情绪。人生的探索也是取我所需、为我所用，不是别人的pua，更不是上位者利害程度的价值排序。不要做那些不需要用脑子思考就做的事，需求是短暂的，但我的每分精力都宝贵，必须要有自己的长期主义。别人怎么样我不管，我只愿意做好自己的事，拿自己的结果，追求自己的沉淀。,0,0,0,北京,,北京,中国
20,5014819176714205,有够离谱的我说,2024-03-22 20:12:05,很不想承认但是我的自我评估一直都挺准确的。 ,0,1,0,上海,上海,上海,中国
20,5014774861796661,中国市场监管报,2024-03-22 17:16:00,【山东推进公平竞争政策实施】山东省市场监管局深入推进公平竞争政策实施，大力查处各类垄断案件，积极开展竞争政策宣传，多措并举破除地方保护和市场分割。　　以机制建设为基础，推进公平竞争审查工作落地落实。山东省建立了自我审查、部门协同、政策会审、审查评估、在线监测五项工作机制，从源头上预防地方保护和市场分割，为有力推进全国统一大市场建设、有效激发市场活力夯实基础。　　以执法办案为抓手，破除地方保护和行政垄断。去年以来，山东省市场监管局查办滥用市场支配地位案件6起、办结2起，获评2023年民生领域反垄断执法专项行动典型案例，强力震慑公用企业限制竞争、与民争利的违法行为。查办垄断协议案件2起，强力打击固定价格、划分市场等恶意排除限制竞争行为。对3起行政垄断行为开展执法约谈，数量居全国首位。　　以政企对接服务为纽带，营造良好营商环境。山东省市场监管局牢固树立服务发展意识，积极服务企业经营者集中申报，协助企业建立完善反垄断合规制度。组织29家省属企业召开反垄断合规指导会；走进各类企业40余次，及时解决企业遇到的经营者集中申报难题；编印《经营者集中政策知识手册》并分发各地。山东省企业开办“一窗通”服务平台弹窗功能开通后已进行11万次提醒，有效避免企业因未及时进行经营者集中申报而带来法律风险，获得社会各界好评。指导30余家重点企业建立完善反垄断合规制度，服务企业手段更加丰富。　　下一步，山东省市场监管局将进一步加强反垄断执法，健全公平竞争审查机制，深入推进竞争政策实施，为加快构建新发展格局、推动高质量发展作出积极贡献。（李冠博）,0,0,0,,北京,北京,中国
20,5014718534385815,泡浮,2024-03-22 13:32:09,收腹提臀内裤女产后收胃束腰高腰塑身收小肚子强力安全裤夏季薄款   20.8     做女人难，做个好女人更难，要想成为社会上举足轻重的好女人，男人梦寐以求的好女人，就是难上加难了。既然我们做了女人，就尽可能的做得完美，自己满意，才能让别人满意，所以自信，自我评估也很重要！如果你已经是好女人了，你想让她再完美一点，就要加点坏坏的感觉拉：美丽、俏皮、解风情、懂浪漫，并且要从骨子里坏得洒脱，坏得大气，坏得高兴，坏得让男人舍不得、搁不下，夜缠梦扰，为之消魂。这种女人就是好女人中的极品了，你做到了吗？,0,1,0,江苏,连云港,江苏,中国
20,5014693460576631,FAIRY-_-SHI格儿啊,2024-03-22 11:52:32,嚯哈哈哈哈哈哈哈哈，是我。喝个药我都会自我评估一下,0,0,0,上海,,上海,中国
20,5014683441170593,张利华-华为研发作者,2024-03-22 11:12:43,3.20你感到幸福吗？联合国专家将各个国家的人均国内生产总值等作为衡量幸福感的指标。其他重要指标还包括预期寿命、民众对生活满意度和社会环境的自我评估。 此外，报告还研究了各国民众在人生困难阶段获得的支持程度。今年报告特别关注的重点是：各个年龄段的人们有多幸福？ ,0,1,1,广东,深圳,广东,中国
21,5014674703385528,澳大利亚SBS广播公司,2024-03-22 10:38:00,【为应对林火做准备？免费应用程序能帮你节省房屋保险费】澳大利亚最大的两家保险公司正在为使用 “丛林火灾复原力评级家庭自我评估”应用程序的澳大利亚人削减保费。该应用程序是免费的，旨在衡量房屋抵御林火的能力，如房屋具有更高的复原力评级，人们可以节省的保费就越多。网页链接 ,2,0,0,,,澳大利亚,澳大利亚
21,5014398786340083,奇思乱想吧,2024-03-21 16:21:36,玩了个测试小游戏，做完发现自己...怎么像只狗啊...我不能接受建议先自我评估一下，我不信我不信网页链接 ,123,177,472,江西,上饶,江西,中国
21,5014629808341510,朴镜学堂,2024-03-22 07:39:36,【百年管家】朴镜治企早分享·2968天👉运营须知-警惕自我🙏【朴镜读经典】庄子·养生主 (028)👉始也吾以为其人也，而今非也。 【朴镜浅解典】在来吊唁的路上，我以为夫子的弟子应该都是很有智慧的人，事实上却是我错了…【朴镜话治企】①以当下的自我认知为衡量标准来衡量、评估当下境遇中的一切，是所有人的共性…②然而，每个人在衡量、评估境遇中事物时的具体认知却并不是一致的，简单归纳下可以整合为以下三大类别…★普通人的意识中只有自我认知，他们往往会直接否定一切超出自我认知范畴以外及与自我认知相左的事与物…★聪明的人能够认知到除了自己的自我认知外还存在着他人的自我认知，因而他们往往会想方设法将他人的认知并入到自我认知中来，以集力所谓的“同荣共耀”境况…★智慧的人明白每个人皆有自己的自我认知体系，且每个人都只会做出自我认知标准下最为正确的举措来，因而他们能够冷静地看待境遇中的一切、悦纳境遇中的一切、共生境遇中的一切…🙏运营体系健全、优化与升维🙏朴镜学堂 无锡·梅里古都,0,3,3,江苏,无锡,江苏,中国
21,5014591549472803,年纪轻轻的跑什么步,2024-03-22 05:07:34,当一个新事物出现在我眼前时 我的想法是尝试它会不会死 自我评估为不会的话就会试试😳 ,0,0,0,德国,,德国,德国
21,5014517338082481,薛折柳,2024-03-22 00:12:41,虽然营销号，但说的对 “天才的行为没有准则。法度与礼仪，都是约束庸人的，不该用在他身上。这是他自尊心的一部分，后来成为一种为人羡慕的‘风度’，但首先，它是对自我和周围一种失真的评估。” ,0,1,0,江苏,镇江,江苏,中国
21,5014468484404337,心理专家Bill粟超,2024-03-21 20:58:34,【#心理#每日话题】#心理科普##感情这点事儿#【自我神化】是指个体过度高估自身能力、智慧或价值，将其神化至超凡脱俗的地步。【青少年】由于身心发育的特殊性，更容易出现自我神化的倾向。例如青春期的男孩认为自己有能力处理一切事务，进而出现和父母叛逆以及做事情莽撞的情况。正确评估自身能力，避免【自我神化】的负面影响，真实的自我，无需神化，只需努力与成长。,0,0,0,北京,,北京,中国
21,5014466640741081,ZXyZxr,2024-03-21 20:51:14,铁军自我评估折磨中 ,0,0,1,云南,保山,云南,中国
21,5014466198772392,重庆慢生活,2024-03-21 20:49:29,重庆#重庆公布107个巴渝和美乡村示范村#3月20日，重庆市农业农村委消息，经自我评价、三方评估、市级复核，结合综合评估情况、群众满意度核算得分，万州区甘宁镇楠桥村等107个村（涉农社区）成功创建巴渝和美乡村示范村，其中，五星级示范村43个，四星级示范村37个、三星级示范村27个。有你家乡吗↓,0,0,0,重庆,重庆,重庆,中国
21,5014450105224351,用户7521850312,2024-03-21 19:45:32,期待中解脱出来 我压根就不评估自己的效率。我不赞成自我评估，我觉得这是一种自我约束、自我惩罚和自我冲突。[1] 如果他人因对你抱有期待而受伤，那就是他们的问题。  勇气不是在枪林弹雨中冲锋陷阵，而是不在乎别人怎么想。 ,0,0,0,澳大利亚,,澳大利亚,澳大利亚
21,5014425807621650,医美魏薇博士,2024-03-21 18:08:59,一般疲态及显现于眼周，这时我们必须评估点位  一.眼皮下垂 二.眼凹 三.眼周皱纹 四.眼袋  五.泪沟 六.黑眼圈 七.内三角区 八.眼框骨  九.眉骨 十.眉凹 十一.印堂  以上各点位评估后才能治疗出完善的眼周抗衰，不能只是有坑补坑  #疲态脸##眼周##什么是正确的抗衰思路##哪些时刻需要自我支撑# ,0,0,0,广东,广州,广东,中国
22,5014395168228780,宋坦·坦荡荡,2024-03-21 16:07:14,搬进来这么久了，今天才算叫正式开伙吧。 Ps：当归乌鸡汤+肉沫鸡蛋蒸豆腐（配菜娃娃菜金针菇垫底）+豆角烧茄子（下次试试茄子先蒸下）可以用做保留曲目……整体被迎姐打了7分（满分10分）略有不服，自我评估怎么也得8分呢（排骨如何蒸的更嫩，一个需要解决的问题）。 ,0,0,0,上海,上海,上海,中国
22,5014384865182726,李大爷嘞,2024-03-21 15:26:17,警惕精神奖励和精神pua。昨天的破防和不甘之后带来了反思，让我觉得从幼儿园小红花到公司的精神奖杯都起到了让他人评估自己、渐进带来自我服从的负向作用。不论什么时候，我都应该学会认可自己的感受，我就是觉得自己很棒，进步很大，每一天的我都很好，我不跟别人比，也不期望成为所谓最好的自己，我自己本来就一直很好很好,0,2,1,北京,北京,北京,中国
22,5014378253910727,重庆市政府网,2024-03-21 15:00:01,#发展动态#【107个村成功创建2023年度巴渝和美乡村示范村】3月19日，重庆市农业农村委（重庆市乡村振兴局）消息，经自我评价、三方评估、市级复核，结合综合评估情况、群众满意度核算得分，107个村（涉农社区）成功创建巴渝和美乡村示范村。详见链接网页链接 ,0,0,2,,重庆,重庆,中国
22,5014349817316929,VanTalk,2024-03-21 13:07:01,#提了离职后更焦虑了#离职前需要对自己做一个全面自我评估，对自己在单位这些年工作复盘一下，找到你的特有的价值，以及再就业的方向。离职后建议休息三个月，不要盲目找工作，最重要的是把自己圈子经营好，这样无论接下来去哪里工作，也能很快找到存在感。离职，如果只是换一个公司，那不难，但如果要更进一步一定要做全面评估，否则单位HR章一盖，就没后悔药了。,1,1,8,云南,昆明,云南,中国
22,5014274193753342,苏渝,2024-03-21 08:06:31,【互联网时代的社保抉择：透视“放弃社保的年轻人”现象】,0,0,2,海南,儋州,海南,中国
22,5014268441526826,乔老爷玩转地球,2024-03-21 07:43:40,【互联网时代的社保抉择：透视“放弃社保的年轻人”现象】如今，不少年轻人选择暂别社保体系，这一现象背后折射出的不仅是对现行社保制度认知的变化，也体现了新时代职业规划与风险评估的新思维。在他们看来，灵活就业、创业初期的现金流保障以及对未来自我投资可能带来的收益预期，成为权衡利弊后的决策考量。然而，社保作为社会安全网的重要组成部分，其长期价值不可忽视。在鼓励创新与自由的同时，也需要倡导理性规划，引导年轻一代理解并善用社保机制，实现个人发展与社会保障的双赢。毕竟，未来的不确定性需要我们既有勇闯天涯的魄力，也有未雨绸缪的智慧。#那些放弃社保的年轻人#,3,2,2,湖北,宜昌,湖北,中国
23,5014222459371616,余昌国,2024-03-21 04:40:57,【 一个人沉稳靠谱的16个特征】1、自知之明一个可靠的人，往往具备深刻的自我认识。他们了解自己的长处与短板，在遇到问题时，可以准确地评估自我能力，不会轻易承诺超出自己能力范围的事务。对自身的清晰认识，是靠谱的基石。2、冷静应对遇到紧急情况时，他们能够保持冷静，不慌不忙地分析情况，采取最合适的应对措施。他们的冷静不仅仅是自我情绪的控制，更是对于环境敏锐的洞察力。3、履行承诺他们对自己的承诺极为重视。一旦承诺了某事，无论遇到什么困难，都会全力以赴去完成。这种可靠性，在人际互动中很宝贵。4、深思熟虑在做出决策之前，他们会仔细思考所有可能的结果。这种思考的深度与广度，使得他们的决策更加成熟稳妥。5、高效的时间管理沉稳靠谱的人很擅长时间管理。他们认识到时间的有限性，通过有效的规划与执行，确保每一分每一秒都在创造价值。6、情绪稳定他们的情绪相对稳定，不会因一时的高兴或失落，就做出过激的决策。这种情绪稳定性，让他们在任何环境下都显得可靠。7、坚持学xi无论在什么阶段，他们都保持着对知识的渴望。通过不断学xi，他们不断地提升自己的能力与见识，这也使得他们在面对未知领域时更有信心。8、良好的沟通能力良好的沟通能力让他们能够有效地传达自己的想法，同时也能够准确理解他人。在沟通中体现出的尊重与耐心，增强了他们的靠谱形象。9、诚信为本在与人交往中，他们以诚相待，让人感到温暖与信赖。他们知道，诚信是人际关系中最宝贵的财富之一。10、慎独行为即使在无人监督的情况下，他们也会保持自己的准则，不会做出违背原则的事。这种自我约束力，是沉稳靠谱的体现。11、先见之明他们能够洞察事物发展的趋势，并做出适时的准备，这使得他们在面对未来时更加从容。12、主动解决问题遇到问题时，他们不逃避，而是主动寻求解决方案。这种积极面对困难的态度，体现了真正的靠谱。13、感恩的心态他们懂得感恩，珍惜身边人的每一份帮助。这种正向的心态，让他们在人生的道路上更加抗压且乐观。14、勇于承担责任他们勇于承担起自己的责任，不论是成功还是失败，都不推诿塞责。这种勇气与担当，让人钦佩。15、适应能力强他们面对变化时，能够快速适应，调整自己的策略和行动。这种灵活应变的能力，是在复杂环境中生存的关键。16、关注细节他们对细节的关注，让他们在执行任务时能够做到精细入微，减少错误的发生。（阅见柠姐）,0,0,0,北京,北京,北京,中国
23,5014158787479852,圈圈的解放日志,2024-03-21 00:27:56,“自我不能通过描述表达出来，只能通过人的表达方式被推理出来。这就意味着人们可以通过一个人对待自己和别人的方式，他们如何评估自己以及他们是否接受自己的能力局限性，来识别健康的自我价值。”  嗯，在自我价值健康的情况下，一个人不必贬低自己或他们。 ,0,1,0,上海,上海,上海,中国
23,5014034572906604,小懒猫喵吖呜_Eve嘻嘻,2024-03-20 16:14:21,从雌竞心理来看女性“窃偶”行为，其实是一种生存本能在作怪，社会比较理论认为，个体通过与他人比较来评估能力和价值。另外一方面，很多女人仍把感情中的自我价值放在伴侣的认可上。放之情感领域，有些女性会将其他女人视为竞争对象，尤其是争夺伴侣。因为别人验证过的“好男人”，可以帮助自己降低筛选成本，比如有些女人会抢闺蜜的男友。,0,0,0,江苏,南京,江苏,中国
23,5013996499374338,纸鸢crystal,2024-03-20 13:43:04,我们都承认，学生在高中阶段承受巨大的压力会导致精神焦虑，那么同样是这群学生，他们进入大学之后，这一切又怎么可能自然地得到改善呢？已经有足够的证据说明，这群学生根本不会自愈。一项以大一学生为研究对象的大规模调研发现，大一学生的自我心理健康评估已经跌落至25年以来的最低谷。美国心理学会曾经公布一份名为《大学校园的危机》(The Crisis on Campus)的报告。该报告中提到，接近一半的大学生觉得自己“无望”；接近1/3的学生承认“在过去的12个月中，由于心情过度低落而影响到了自己正常的生活”。大学校园的心理咨询服务的需求从20世纪90年代中期以来一直攀升，现在几乎门庭若市，应接不暇。在接受过服务的学生群体中，被诊断有严重心理障碍的数量翻了3倍，接近整体人数的一半。——《优秀的绵羊》,2,2,2,上海,,上海,中国
23,5013968752218854,昆明市生态环境局,2024-03-20 11:52:48,#环境视野# 【IUCN发布NbS全球标准自我评估工具在线平台】近日，中国生物多样性保护与绿色发展基金会（中国绿发会、绿会）海洋与湿地工作组了解到，世界自然保护联盟（IUCN）发布了基于自然的解决方案（NbS）全球标准自我评估工具在线平台，并将于2024年3月19日召开线上研讨会对该平台进行讲解和说明，以帮助用户提升使用效率和准确性。（中国绿发会）IUCN发布NbS全球标准自我评估工具在线平台,0,0,0,,昆明,云南,中国
23,5013923360932757,tthreenine,2024-03-20 08:52:26,一分钟自测 嘴凸！ 一分钟自我评估 嘴唇凸出！ 佛山、福州合肥、西安正颌 #正畸##正颌术前# ,0,2,0,陕西,西安,陕西,中国
23,5013919810978578,趁着家中的书还未曾烧穿,2024-03-20 08:38:20,存一下，自我效能感很重要。先前我采取的理论依据把“对自己的能力评估”类比于“对自身所有势能”的评估。无论是重力势能、电势能还是什么，我们必然会选取一个势能零点。很多时候人的焦虑和抑郁来源于将自身的能力与他人的相比，无视彼此所处的客观环境和客观条件，运动是相对的，这种情况下通常总能找到另一个人的能力比自己更强，所以需要一个客观化的标准，一个相对固定的参考系。上面这段写得还是太简单了…回头可以看看科普文的例文想想看怎么写。这个比喻依然可以继续延伸到我近期的感想上：没有什么比做功更能衡量能量。当然，在这里必须要注意，能力转化到现实成果与能量转换到功相比，前者是不满足能量守恒的。重点并不在于我和谁比，我通过了什么考核，我在人生的天梯上爬到了第几位，重点是我能把我的能力重新转化为可见的成果，从而得到i am able to do。对于这种可见成果的重新察觉以及如何选取实验对象也很重要，前者可能涉及到认知盲区或者认知扭曲，后者则是一个更practical的考虑方向。,0,4,0,北京,北京,北京,中国
