页码,微博id,微博作者,发布时间,微博内容,转发数,评论数,点赞数,发布于,ip属地_城市,ip属地_省份,ip属地_国家
2,5023390299852077,皮皮侠学术风向标,2024-04-15 11:50:40,【学术资讯】文科生也能成为科学家！95后一作收获“科研自信”18岁以前，杨婉男从未想过自己会成为一名科学家。原因是，她从小酷爱哲学，高中学的是文科，父母辈中也没有一个从事与科学沾边的工作。高中毕业后，杨婉男来到英国爱丁堡大学读生物学；大三时她对神经科学产生了浓厚兴趣，争取到美国麻省理工学院（MIT）神经科学实验室做实验的机会；大三结束后她成功从生物学转到神经科学专业；如今，这个曾经是文科生的“95后”女孩，来到美国纽约大学医学院神经科学系教授György Buzsáki的实验室，攻读神经科学博士。从文科跨界到生物学再到钻研神经科学，杨婉男的求学和科研经历达到了令人称奇的程度。近日，杨婉男更以第一作者身份在Science上发表论文，揭示了大脑选择性记忆的生理机制。值得一提的是，这是博士四年级的杨婉男首次以第一作者身份发表文章。“现在，我想为研究记忆奋斗一生，希望能成为一名优秀的科学家。”杨婉男说。杨婉男一直秉持着这一点：永远保持好奇，永远充满热情。#数据皮皮侠##学术资讯#,0,0,0,四川,成都,四川,中国
2,5023387627816874,幸运美丽南波万,2024-04-15 11:40:03,处理数据费时费力就算了，跑出来之后一回归结果还不显著和与之前的截然相反 不过现在能做到想开了，科研不顺是常态，科研顺利是运气好，没有一帆风顺的事 以及，想把不爱干净到身上有异味和诡计多端的男的豆沙了 ,0,1,0,天津,天津,天津,中国
2,5023154972137387,我是香港警嫂,2024-04-14 20:15:34,出賣國家機密的人真該死，但是他死了，機密數據也已經洩露出去了………【#科研人员出卖核心机密被执行死刑#】据@央视军事 报道：某间谍情报机关公开网站收到来自中国的投靠信息，同时还有一段中国军队使用的高级密码，发出信息的人是我国某涉密科研单位人员黄宇……因在单位改革末位淘汰中被通知待岗，黄宇认为领导在排挤自己，出于怨恨心理他决定出卖自己掌握的核心机密，以报复单位，同时攫取巨额利益。最终，黄宇被执行死刑。#间谍窃取我国杂交水稻亲本种子# 央视军事的微博视频,9,11,111,中国香港,,香港,中国
2,5023383065198759,Chaorm1o,2024-04-15 11:21:54,我学商科的同学也是，其实一般做过科研的都会接触数据分析，所以这个东西真的要做我觉得可以往大数据那种方向，hadoop 啥的,0,0,0,美国,,,美国
2,5023376166880121,SPSSAU,2024-04-15 10:54:31,姐妹们，这才是导师想看到的论文数据分析啊🌟 今天就来给大家揭秘一下，那些看似高深莫测的数据分析，其实也可以很亲民！😉📈 描述性统计分析这一步，就像是你对数据的“第一印象”。通过计算均值、标准差、频数分布等，我们可以初步了解数据的“长相”和“性格”。👀 比如，你的数据是偏胖还是偏瘦？是活泼开朗还是内向文静？这些都能从描述性统计分析中看出来哦！🆚 差异性分析这里就是开始对比啦！比如，你想知道男生和女生在某个数据指标上有没有差异，就可以用差异性分析来解答。通过T检验、方差分析等方法，我们可以找出哪些组别或类别之间存在明显的差异。🔍🌀 相关性分析想知道两个变量之间是不是“好朋友”吗？那就得靠相关性分析啦！通过计算相关系数，我们可以判断两个变量之间是正相关、负相关，还是根本没关系。🤝 这样，你就能更清楚地了解变量之间的“友情”深浅啦！🎯 影响关系研究最后一步，就是深入研究某个变量对其他变量的影响啦！这一步通常会用到回归分析、路径分析等方法。通过这一步，我们可以找出哪些变量是“关键先生”，对结果有着至关重要的影响。🎯💪 数据分析，虽然看似复杂，但只要掌握了SPSSAU的使用与分析，这些基本方法，就能轻松应对啦！希望今天的分享能对大家有所帮助，让我们一起在学术的道路上越走越远吧！🚀#spssau##spss##数据分析#科研问卷星学术期刊论文发表#回归分析##统计学#问卷星#毕业论文##论文发表##期刊论文#,0,1,0,北京,北京,北京,中国
2,5023368288405349,医晋升咨询,2024-04-15 10:23:12,【文章写作】论文初稿写完先别急，还有4个问题要自查作为科研人，写完初稿时的开心程度就不用多说了但是咱们开心归开心，论文初稿写完后还有4个问题要记得自查，保证文章水平更加在线哦！那么在写作论文初稿时，有两大方面需要格外注意，先来看看从哪两个方面入手吧：两大方面1、在数据应用方面写作初稿是根据所搜集的数据和抄录的笔记卡来进行，所以在撰写初稿前，一定要将这些数据按大纲的先后顺序整理好，以便写每一章、每一节时参考之用。有时为了节省时间，避免错误，可将影印数据剪贴于初稿之上，遇到有需要作附注的地方，应将附注的数码记在该记的位置，各附注的文字可用另纸书写。2、在文字应用方面学术论文的文字，有别于文学作品，应以简洁扼要的实用文为主，有些同学，为了表示典雅，想用文言文来书写，除非自信自己写文言的能力很强，否则请不要轻易作这种尝试，还是用白话文来书写比较好。1、规范性规范性包括2个方面。语言规范，即确保论文中没有用词不当、词不达意、自造词、错别字、不当使用标点符号等情况。格式规范，即按照相关要求对论文的格式进行调整，包括字体字号、图表的呈现形式、参考文献的标注形式等。2、完整性检查论文整体结构是否完整。一篇完整的论文包括题目、摘要、关键词、引言、方法、结果、结论、讨论、参考文献等，毕业论文还要有封面、目录、致谢等，这些结构缺一不可，需要在论文初稿完成后一一核对，并及时补充缺少的部分。3、一致性一篇论文工作量很大，难免会出现前言不搭后语的疏漏，因此需要对一致性进行检查和完善。4、原则性一篇论文无论质量如何，原则性问题不能有。如有概念性错误、常识性错误则需要立即改正。对于论文中的专业性问题，需要反复推敲，不容有误。#论文自查##论文##论文期刊#,0,0,0,广东,东莞,广东,中国
2,5023364590603846,知识分子,2024-04-15 10:08:31,"【#美国本地人不愿做博士后了吗# 在美国，本地人已经不愿意做博士后了？】根据美国国家科学基金会（National Science Foundation,NSF）的最新数据，在美国博士后这一学术界的中坚力量正在流失。一些PI表示现在博士后的招聘越来越难，科研项目不得不推迟，尽管经费在缩水，大学迫于压力仍开始考虑提高工资和福利待遇。根据美国国家科学基金会（NSF）近期发布的《2022科学与工程专业研究生及博士后调查》(Survey of Graduate Students and Postdoctorates in Science and Engineering, GSS)数据，2022年秋季，美国机构雇佣的科学、工程和健康（Science, Engineering and Health，简称SEH）领域博士后人数为62,750人，比前一年下降了约1%。这个变化看起来不大，但美国博士后人数从2019年达到顶峰之后，已经出现连续多年的下滑。2020年至2021年间，NSF此项调查涉及的机构博士后人数一共下降了2,353人，下降幅度达到3.6%。自2019年以来，博士后人数减少了2,033人，下降幅度达到5.2%。一旦按照国籍对博士后群体进行分类，其间的差异便显得尤为突出。从2021年到2022年，美国公民和永久居民选择做博士后的人数从29,755人下降到27,289人，下降了8.3%，这一降幅是自1980年该调查开始以来年度降幅最大的一次。与此同时，持临时签证的博士后人数却上升了5.6%，从33,573人增加到35,461人，与2020年的水平大致相同。对于有出路有选择的美国本地人来说，博士后似乎在成为一个越来越没有吸引力的选项。Science的一项调查，从研究人员的角度印证了博士后流失的现实。当时他们联系了100多位美国研究人员——他们在科学协会的招聘网站上发布了博士后职位的招聘广告。有37位研究人员回复了Science记者，其中四分之三都表示在招聘方面遇到了挑战。“今年的情况让我很难接受：……我们的招聘信息完全没有得到回应。”其中一位写道。“申请人数比 2018到2019 年少了10倍。”另一位写道。这些遇到招聘困难的学者涉及 STEM各领域，包括生物医学、化学、环境科学、人类学、物理学和计算机科学。一些学者表示，不仅博士后申请数量不足，申请质量同样下降了。一位学者写邮件给Science表示他已经做了两轮招聘，花了半年时间才招到合适的候选人，而过去他只需要用一个月的时间。详情戳下方链接查看↓↓在美国，本地人已经不愿意做博士后了？#博士后##美国#",8,1,10,,上海,上海,中国
2,5023354468434837,offer播报酱,2024-04-15 09:28:17,#酱酱帮问time#香港中文大学 211大数据均分85申港三有机会吗？211大数据专业，均分85，雅思6.5，GRE315，有两段科研，一篇论文，一篇论文发表中，一个专利发表中，两段科研，一个北京数模二等奖，三段实习，还有篮球和乒乓球的三级裁判证。。。第一批早申的话，有机会申请到港三的数据或者计科专业吗 （如果考多一个中级软件工程师呢）  网页链接,0,0,54,天津,天津,天津,中国
2,5023348230193908,威海日报,2024-04-15 09:03:30,【#国家安全机关公布5起典型案例#】国家安全机关14日公布5起典型案例，呼吁全社会提高国家安全意识，共筑反间防谍的钢铁长城。①境外企业窃取我稀土领域国家秘密；②境外间谍情报机关窃取我稻种及制种技术；③境外间谍机构非法搜集我气象数据；④某高校学生出于猎奇落入陷阱；⑤境外驻华机构雇员阻碍国家安全机关执法。详戳→网页链接 #科研人员出卖核心机密被执行死刑##发现间谍行为拨打12339# （新华社）,4,4,5,,威海,山东,中国
3,5023345390911690,鲁小迅3,2024-04-15 08:52:12,中国科研单位免费向全世界公布中国人的基因图谱数据，美其名曰全球合作，是多么的幼稚啊。这是将中国人的生命至于十分危险的境地，中国国安监察局，应该清醒地认识到，中国的敌人一旦得到这个人的基因组合，就会将中国亿万人民的生命至于危险之中。新冠病毒能在中国肆意传播，就是一个很好的例子， ,0,0,0,广西,玉林,广西,中国
3,5023344554410769,墟里临风,2024-04-15 08:48:54,#60秒了解总体国家安全观#国家安全观是总体概念，涵盖范围领域很大：比如政治安全、军事安全、国土安全、经济安全、金融安全、文化安全、社会安全、科技安全、网络安全、粮食安全、生态安全、资源安全、核安全、海外利益安全、太空安全、深海安全、极地安全、生物安全、人工智能安全、数据安全……随着时代的发展，国家安全涵盖的内容还会增加和丰富（原有16项，目前已增至20项），所以大家不要以为仅仅只有军事安全而放松对其他领域的警惕，这一点很重要；从事国家安全工作的部门除了大家熟知的国家安全部还有公安机关、有关军事机关、外交机关等等，所以除了12339其他举报电话同样受理线索；还是那句话，维护国家安全人人有责！ （怂的载体）#科研人员出卖核心机密被执行死刑#△看看还有没有什么人跳出来说取消安检的，还有没有什么人说哪有什么境外势力的 墟里临风的微博视频,0,0,1,河南,驻马店,河南,中国
3,5021927997965470,人间奇妙之旅,2024-04-11 11:00:00,中国三所高校：人民大学、南京大学、兰州大学，宣布退出世界大学排名。拒绝向世界大学排名机构提供相关数据，拒绝支付排名经费，不再参与大学排名。省下的经费将全部用于【国内】学子身上，一心一意搞好科研，扎扎实实做好教育。他们认为：好的大学应该坚持为国家培养人才，为国家作出贡献，而不是为了登上世界大学排名榜单。,260,381,4270,浙江,杭州,浙江,中国
3,5023339946446668,时时自省以修身,2024-04-15 08:30:35,如何通过我的状态判断我的实验情况 我真的适合做科研吗？—实验失败了 我想死—实验连续失败了/坑了别人 这个世界带着人类一起毁灭吧—实验被别人坑了 科研有点意思—实验有结果了 这个世界真美好—有能用的数据了 ,0,0,2,福建,厦门,福建,中国
3,5023199232790143,假装不在美国,2024-04-14 23:11:26,夏老师怎么啦，人都是一张嘴吧两条腿，来和我比英文吗，比学术，比科研，比高数线代微积分数据结构软件开发，来嘛，某些领域夏老师就是给我提鞋都不够格。 ,0,23,80,德国,,德国,德国
3,5021911627072938,痴史,2024-04-11 09:54:57,南京大学宣布退出世界大学排名，拒绝向排名机构提供相关数据，拒绝支付排名经费，他们决定将这些资金全部用于提升学生教育质量。精心搞科研，扎实做教育。 前有哈工大拒绝给留学生提供津贴，后有南大拒绝世界排名，希望越来越多大学能挺起中国脊梁。力挺南京大学扎扎实实搞教育、不参与虚荣、不参与名利、不参与金钱、干干净净教学，教出干干净净的学生。,284,464,4999,北京,北京,北京,中国
3,5023270651036200,康钊,2024-04-15 03:55:14,这段时间够黑龙江联通总经理王传宝忙乎，这次中国联通成为哈尔滨亚冬会的主赞助商，却没有黑龙江移动和黑龙江电信的身影，他肯定很开心。据悉，这次中国联通正式成为哈尔滨亚冬会官方通信和云服务合作伙伴，不过，有家叫安恒信息的公司成为哈尔滨亚冬会官方网络安全和数据安全赞助商。哈尔滨冬亚会把云服务与网络安全拆分了赞助商，这也有意思，以往这都属于三大运营商的业务范畴。杭州亚运会都是中国移动和中国电信同时是赞助商，哈尔滨亚冬会却只有中国联通一个赞助商，黑龙江移动是否有点遗憾？黑龙江移动总经理刘刚还有机会去争取赞助商资格吗？#科研人员出卖核心机密被执行死刑#,1,1,0,加拿大,,加拿大,加拿大
3,5023256072945921,风清扬徒弟-A,2024-04-15 02:57:18,折叠空间与时间，多维度，便捷服务，一键触达，应用服务，不仅在数据，算法，人文关怀，数据要素，释放，小微商户用户行进，人找货物，密密麻麻，超市柜台，寻找不过来，科技金融的力量，数字化底蕴，2023科研投入高达200多亿 ,0,0,0,浙江,杭州,浙江,中国
3,5023215298544724,千千晚风_,2024-04-15 00:15:17,两个科研+工作狗的日常友：吗的这只耗子又把我显著性拉到0.053我：支持你收完数据后把它宰了泄愤友：我一直很好奇这是不是intj的通病我：👂友：一暴躁就体现在敲键盘上我：不好评价，我intj舍友暴躁也爱用力敲键盘友：n=3，我觉得很显著我：我看你也挺显著：精神病挺显著的我：这个材料我是写不下去了，吗的数据不支持我怎么编友：要不我给你把它搞显著了我：……啊啊啊啊啊啊啊啊啊啊,0,1,0,河北,秦皇岛,河北,中国
3,5023213539558410,Somnus_neko,2024-04-15 00:08:17,Gumayusi你就是最棒的～世界第一～大赛选手比赛越重要发挥越好才是真正的底牌～上野辅吃着双C老本常规赛打弱队科研刷数据上嘴脸～总决赛这样几次了啊？你看看呢最后总决赛是不是上路养大爹～辅助绝对软辅美美躲在AD后面～打野就保上单～faker不单要开团还要打伤害！AD不仅是下单还得做视野！～是不是这个剧情？大O我不怪他～他也很难的一直是绿叶这个队永远只有一个前排～这么多年～也有三年了吧～你一直受到不公正得评论～但是一直在坚持！我希望你有更大的舞台表现自己～,0,1,3,上海,上海,上海,中国
4,5023207814600397,秋凉peri,2024-04-14 23:45:32,啊哈？！我真的笑了，tm你自己不写就等我，要使唤人又看不起人😅是谁给你惯的毛病啊，讨厌急功近利的人！就是你这种人，整天发几篇文章要写啥说说说，什么什么课题都是你的，好好好，写完全世界你最牛逼了好吧。然而现实情况呢就是做科研，想要得到什么数据怎样设计实验，怎么合理，tm都不考虑。只幻想着做完发文章发文章，那么大的脑子不知道咋想的问一个问啥要做这个啊，人家SCI这么做了这个，我无语了好吧，不是你做了这个就能发SCI的，要考虑实际情况吧，现实就是你连他会得到什么都不知道。没有几斤几两的本事，心气还tm高。我写的东西吧要你改的吧你从来没tm提出过建设性的意见，问就是忙还没看，把你当个师长问问还高贵的，反过来整天问我这写了吗那写了吗？？？OK？这是我的事，tm我问你的时候你不是忙吗？反过来催催催，整天想着剽窃抄袭，卧艹我真tm受够这种男的了！啊啊啊啊啊啊啊好想骂回去啊！煞笔！,0,0,0,重庆,,重庆,中国
4,5023206765497092,Wb_Tesla,2024-04-14 23:41:22,我终于找到具体理由反驳我为什么讨厌理工男了因为对着枯燥的数据和代码脑子只有严谨的思维和逻辑精力都在科研 /分一点给运动或者游戏生活寡淡真的很讨厌对很讨厌毕设时间的自己但是不可否认我在变强质疑理工男成为理工女那么为什么和张少傅少关系好呢因为他们是混子…生活多姿多彩我们才能玩到一起,0,1,1,上海,上海,上海,中国
4,5023138567947415,斯图卡98,2024-04-14 19:10:23,中国在AI领域拥有庞大的市场、丰富的数据资源、以及众多活跃的科研机构和公司。这些条件为AI技术的研发和应用提供了良好的环境。在智能制造、智慧城市、健康医疗、金融科技等多个领域，AI技术都得到了广泛的应用。#周鸿祎邀请哈佛毕业生回国创业##同时，中国在AI领域还面临着一些挑战，包括技术创新、人才培养、数据安全、伦理法规等方面。因此，中国在推动AI技术发展的同时，也在不断完善相关政策和法规，以确保AI技术的健康、可持续发展。#周鸿祎称中国存在巨大AI创业机会#,20,2,32,四川,成都,四川,中国
4,5023176570180423,湖北日报,2024-04-14 21:41:23,【#国家安全机关公布5起典型案例#】①境外企业窃取我稀土领域国家秘密；②境外间谍情报机关窃取我稻种及制种技术；③境外间谍机构非法搜集我气象数据；④某高校学生出于猎奇落入陷阱；⑤境外驻华机构雇员阻碍国家安全机关执法。#科研人员出卖核心机密被执行死刑#,3,0,3,,武汉,湖北,中国
4,5023174238930864,_llllllV_,2024-04-14 21:32:07,我真的做不了一点科研 本科生真的有鞋毕业论文的必要吗！写出来也是一坨史啊！tmd这些数据运算我真的想凭心情乱填一下 ,1,0,0,西藏,拉萨,西藏,中国
4,5023168500859191,飞奔回家的大姐,2024-04-14 21:09:18,今天举办一个求职者比赛，有一个评委点评一个选手。 “我看你的简历科研经历很丰富，你对数据反应很快，但是你对于人的反应可能就要欠缺一些” 高情商：反应欠缺 低情商：情商低 ,0,0,0,湖北,武汉,湖北,中国
4,5023167682708596,作家宸哲,2024-04-14 21:06:04,#科研人员出卖核心机密被执行死刑#看评论很多末位淘汰不好的，所以涉秘单位就该万事无忧，就该混吃等S？问题不是贩卖机密换钱这件事吗? 换个概念，你在现公司职场不顺，就可以把公司的核心数据卖给竞争对手？ 都什么逻辑？ ,0,0,0,湖南,长沙,湖南,中国
4,5023166634657599,Mily661,2024-04-14 21:01:54,#科研人员出卖核心机密被执行死刑#科研人员辛苦得来的数据，那得是多少个日日夜夜的辛劳，这还是核心机密，可能甚至不是一代人的努力，就被背叛者窃取并出卖，背叛者诛 ,0,0,0,湖南,怀化,湖南,中国
4,5023162016993213,Sosndjioamlahi0I_29197-dwlx,2024-04-14 20:43:33,好累啊 不想搞科研了 最近头发一抓一大把的掉 不知道是因为熬夜还是因为吃药还是因为科研压力 但是此时此刻文献还没看完数据还没处理却还要今晚之前交PPT就觉得心累了 sosad ,0,1,0,上海,,上海,中国
4,5023159730573948,迷糊波比666,2024-04-14 20:34:28,不会真有人觉得lmh的才能是季节性的吧？为什么他常规赛不够“亮眼”但是偏偏大赛总是能站出来？还不是因为拳头和批摊硬捧的一些废物东西常规赛要抢数据搞科研偷pog，就只好让ad牺牲；但是大赛了这些软脚虾就原形毕露啦，可不就得让中下双C兜底了么，不就显出lmh的强度了么 ,0,0,3,北京,,北京,中国
5,5023154612733408,郑育龙营养师,2024-04-14 20:14:08,人类站在食物链的顶层，依靠的不是敏捷或者力量，而是智慧，这来源于人类相较其他动物占比更大的大脑。而且我们的大脑，还在越变越大。近期，加州大学戴维斯分校科研团队在《JAMA·神经病学》杂志上发表论文，研究者们分析了1930年-1970年出生的3千余人的大脑数据，发现与30后相比，70后的大脑体积增加了6.6%，大脑皮层面积更是增加了近15%之多！研究者认为，更大的大脑能够给年龄相关的脑部疾病带来缓冲，近年来观察到的痴呆症发病率下降就可能与此有关。#郑说健康#,101,101,101,山东,青岛,山东,中国
5,5023133029107984,yangbo说lzq背着我偷偷当m,2024-04-14 18:48:22,要我说全天下的科研工具都该找我做推广 我虽然小红书数据不好看 但我真心实意推给我朋友 ,0,1,1,山东,青岛,山东,中国
5,5023131636337806,_风凭借力,2024-04-14 18:42:50,我真的服了啊啊啊啊啊啊啊啊啊啊我数据单位弄错了我说为什么结果一直这么怪啊啊啊啊啊啊啊啊啊啊救命这就是自己做科研没有人带的下场呜呜呜呜呜呜呜呜 ,0,0,0,云南,昆明,云南,中国
5,5023125693530770,我想放你心里一朵花,2024-04-14 18:19:13,大一到大三三年充分证明了我不适合搞科研 今天下午写实验报告整理数据到想吐 还好我的考研方向不是搞科研，庆幸自己做了目前最正确的决定🙏🙏🙏 ,0,0,0,天津,,天津,中国
5,5023102591044848,小于期待毕业中,2024-04-14 16:47:25,整理毕业数据中 我的数据分布在无数个U盘里 一会插上这个弄点数据 一会插上那个弄点数据  我到底是什么科研邋遢鬼啊 ,0,6,1,江苏,无锡,江苏,中国
5,5022999659676155,航运中心v,2024-04-14 09:58:24,上海国际航运研究中心信息研究所有哪些科研成果上海国际航运研究中心航运信息研究所的科研成果丰富，涵盖了多个领域。该所由徐凯博士领衔，拥有一支由博士、硕士研究生等组成的专业研究团队。他们的研究主要集中在港航信息化理论体系、发展追踪、应用研究、信息规划、大数据分析和技术咨询等方面。航运信息研究所已经形成了四大业务板块，包括航运数据合规治理标准与服务、全球港航信息化发展报告、港航大数据实验室（含中国航运数据库）、信息化战略咨询和航运创新发展咨询。这些板块涵盖了从数据管理咨询、数据合规技术方案，到敏捷数据治理与中台搭建等多个方面。特别是他们在航运大数据、物联网、区块链、互联网+等领域取得了显著的研究成果，并在航运数字化发展新媒体方面积累了大量读者。此外，航运信息研究所在首届北外滩国际航运论坛上发布了全球航运景气指数和《全球港航信息化发展报告2021》两项重大成果，显示了其在国际航运领域的重要影响力。总的来说，上海国际航运研究中心航运信息研究所在港航信息化和大数据分析等领域取得了丰硕的成果，对航运业的发展和创新产生了积极影响,0,0,0,湖北,孝感,湖北,中国
5,5022792561199499,财富密钥,2024-04-13 20:15:27,【宁愿近亲繁殖，不愿鲶鱼效应】中科院这个数据简直不堪入目，中国最权威的科研机构，却是完全封闭型的。拥有一百多个研究所的中国科学院，十几年来，真正全职到位并留下工作的国际正教授恐怕不到十人，也许不到五人。,13,3,23,北京,,北京,中国
