页码,微博id,微博作者,发布时间,微博内容,转发数,评论数,点赞数,发布于,ip属地_城市,ip属地_省份,ip属地_国家
36,5019228966750417,鱼生从0开始,2024-04-04 00:15:01,我的新学术研究成果之春日一番可能是半浪漫吸引/半性吸引： ,0,0,2,上海,上海,上海,中国
36,5019227981611368,小八评论区每天更新案例反馈6,2024-04-04 00:11:05,可以参考其在学术研究和实践中的表现，来判断其专业性和可信度。  （可查的）金辉(属于比较狠的，维度能一个度到另一个度算是常事）陈倩（风格比较自然，衔接也可以，有反馈吸收率高) ,0,1,0,山东,枣庄,山东,中国
36,5019223695298837,多元多彩,2024-04-03 23:54:04,高盛：目前只有不到5%的企业正式使用AI生成技术来推出产品和提供服务，而这一比例在信息、专业服务和金融企业中则达到10-15%。IT支出调查显示，虽然当前只有12%的CIO计划将5%以上的IT预算用于生成式AI，但未来三年内比例有望超过一半，AI在IT预算中的份额也将翻番。学术研究估计AI可以提高9-56%的劳动生产率，中位数为16%，平均为25%；企业报告中预计生产效率提升的中位数为25%，平均为26%。,0,0,0,上海,,上海,中国
36,5019220431078517,小八评论区每天更新案例反馈6,2024-04-03 23:41:06,可以参考其在学术研究和实践中的表现，来判断其专业性和可信度。  （可查的）王波（有个别吐槽太自然，感觉变化不大的)王棱（擅长peng体材料) ,0,1,0,山东,枣庄,山东,中国
36,5019215393722284,小八评论区每天更新案例反馈6,2024-04-03 23:21:05,可以参考其在学术研究和实践中的表现，来判断其专业性和可信度。  （可查的）曹智慧（业内比较出名，风格比较自然)肖军磊（鼻bi额角鼻bi尖表现点处理得不错 ) ,0,1,0,山东,枣庄,山东,中国
36,5019205550474994,好鸡不敢不背,2024-04-03 22:41:58,今天看传播学里传播效果研究的时候深感传播学真的好学术，感觉类社会学，新闻学相比之下就重实践很多，类管理学（？）两个一起学好割裂，学新闻学的时候有种马上就要就业的感觉，学传播学的时候感觉要搞一辈子学术研究x，不过结合起来又很奇妙的契合，新闻与传播就是天作之合——不居小婕说的（） ,0,0,1,山东,青岛,山东,中国
36,5019205328179008,小八评论区每天更新案例反馈6,2024-04-03 22:41:05,可以参考其在学术研究和实践中的表现，来判断其专业性和可信度。  （可查的）罗明生(腿相对比较多，部分案例还不错，有的一般，审美比较中式）赵绛波(精细度不够，眉心三角处理生硬） ,0,1,0,山东,枣庄,山东,中国
36,5019197778169573,小八评论区每天更新案例反馈6,2024-04-03 22:11:05,可以参考其在学术研究和实践中的表现，来判断其专业性和可信度。  （可查的）李勇(不是那种很精致的韩式，有点假假的感觉）尹成瑶（bi背线条感还可以) ,0,1,0,山东,枣庄,山东,中国
37,5019195262112353,小八评论区每天更新案例反馈6,2024-04-03 22:01:05,可以参考其在学术研究和实践中的表现，来判断其专业性和可信度。  （可查的）李冠达（鼻bi头比较柔软有弹性)刘大猛（审美还行！翻车也有，野生能查到） ,0,1,0,山东,枣庄,山东,中国
37,5019119517436440,爱知君,2024-04-03 17:00:06,AI与劳动生产率：多家学术研究机构和研报的初步结论显示，在采用人工智能后，劳动生产率平均提升25%-26%。以后KPI里一天多加两场路演 ,4,2,23,上海,,上海,中国
37,5019175065748770,见闻美股,2024-04-03 20:40:50,【高盛：“AI革命”后的第一年，不到5%公司使用，但早期使用者效率提升显著】高盛指出，尽管AI尚未普及，但数据显示，AI可以大幅提高生产效率，学术研究和企业案例都显示，采用AI后劳动生产率平均提高25%。网页链接 (来自@华尔街见闻APP) ,1,0,1,,,上海,中国
37,5019174478807920,我们可是纯爱啊,2024-04-03 20:38:30,小琳，你很适合做学术研究！（不是） ,0,0,0,上海,上海,上海,中国
37,5019162544177524,小八评论区每天更新案例反馈6,2024-04-03 19:51:04,可以参考其在学术研究和实践中的表现，来判断其专业性和可信度。  （可查的）周珂(自然，高度低起点低）杜亚旭(喜欢小v的看看，不属于保守的类型，很少有留jiao） ,0,1,0,山东,枣庄,山东,中国
37,5019126315354255,小八评论区每天更新案例反馈6,2024-04-03 17:27:07,可以参考其在学术研究和实践中的表现，来判断其专业性和可信度。     尹卫民（鼻基底填充可以，鼻基底凹陷的妹纸做了面中改变都会比较明显）  刘跃辉（审美很潮流，针对不同人有不同的方案） ,0,1,0,山东,枣庄,山东,中国
37,5019114726492016,小八评论区每天更新案例反馈6,2024-04-03 16:41:04,可以参考其在学术研究和实践中的表现，来判断其专业性和可信度。     穆宝安（多年从ye经验）  詹慧（眼周年轻化做得不错） ,0,1,0,山东,枣庄,山东,中国
37,5019113720907386,小八评论区每天更新案例反馈6,2024-04-03 16:37:04,可以参考其在学术研究和实践中的表现，来判断其专业性和可信度。     戴震洲（从业多年，基础扎实，在修複上有较深造诣）  于广洋（风格紧跟时尚潮流，善根据个人特色塑型） ,0,1,0,山东,枣庄,山东,中国
37,5019110859604076,时空潜行,2024-04-03 16:25:41,黑魔经常会在行会做一些奇奇怪怪的学术研究，偶尔的实验失误会导致长袍也被烧掉一些地方，又因为一直垂在地面难免有摩擦导致破损，仔细看起来会是脏脏旧旧的，但好歹是黑色看不太出来，黑魔也没太管，反倒是咒杖被擦的干干净净，还会定期维护修理。骑士的盔甲反过来是银白色的，亮闪闪的，看起来优雅又高贵。被弄脏的时候会被骑士仔细擦拭清理，是王政厅的骑士服，当然会好好维护。两个人倒奇迹的没有因为这个吵过架，骑士羡慕黑魔可以不用太在意着装，黑魔偷偷因为骑士与生俱来的优雅心动。两个人见面的时候被擦拭得干干净净的胸甲和头冠会隐约倒映出黑色的影。你会一直看着我，对吧？,0,3,3,湖北,武汉,湖北,中国
38,5019106411545788,小夏少买点,2024-04-03 16:08:02,不要把以前的学术研究挂嘴边好吗，好的 ,0,5,0,江苏,南京,江苏,中国
38,5019104391463611,中国考古网,2024-04-03 16:00:00,#学术研究# 裴学松 | 关中地区仰韶晚期遗存分期再探：关中地区是仰韶文化分布的核心区域之一，其中仰韶晚期遗址数量多、分布范围广、出土材料丰富，处于仰韶时代向龙山时代转变的关键期。通过梳理关中地区仰韶晚期典型遗存，并结合最新发现的泾阳蒋刘遗址出土材料，将关中地区仰韶晚期遗存分为“蒋刘期”“半坡四期”“泉护二期”三个发展阶段。三个阶段前后相继，关系密切，代表了关中地区仰韶晚期早、中、晚三个时段。网页链接,6,0,7,,北京,北京,中国
38,5019101135372348,小八评论区每天更新案例反馈6,2024-04-03 15:47:03,可以参考其在学术研究和实践中的表现，来判断其专业性和可信度。     叶森明（案例不算惊艳，但比较符合个人气质）  陈兵（效果有点儿夸张，山根略粗壮） ,0,0,0,山东,枣庄,山东,中国
38,5019095711878173,襄阳市图书馆,2024-04-03 15:25:31,#襄阳市图书馆# 【全省唯一！就在襄图】3月30日，由中国图书馆学会学术研究委员会、北京大学信息管理系和《中国图书馆学报》编辑部联合主办的第四届中国图书馆馆长高级论坛暨阅读推广人与馆长对话论坛在北京大学成功召开。来自全国相关知名高校的10余名学界专家和全国各地的14名公共图书馆代表共聚一堂，围绕“社区图书馆与全民阅读推广服务体系建设”主题，开展了深入探讨。襄阳市图书馆党总支书记、馆长郝伶俐作为湖北省唯一一名公共图书馆受邀代表参加了本次论坛活动。,0,0,0,,襄阳,湖北,中国
38,5019094808793920,Agoldenbean,2024-04-03 15:21:55,最近快要毕业了才后知后觉学术研究的魅力，和科研工作者的性感是怎么一回事… （以及和众uu表示写论文真的痛苦，但也沉浸式学术研究到废寝忘食也是真的愉悦呀。） ,0,3,2,浙江,杭州,浙江,中国
38,5019047592466222,黑糖波波不喝雪碧呢,2024-04-03 12:14:18,【已截止】❤️麻烦美女们花3分钟做一下我的论文调查问卷🥹🥹 所有信息将严格保密 仅用于学术研究 谢谢！ ❗❗❗完成后点赞这条微博 抽1个人送出YUZUMUMU橡胶钱包 抽2个人送出书展的手机绳 谢谢大家！！🙏🙏 （之后会后台check问卷的） ,4,89,141,韩国,,韩国,韩国
38,5019089385031559,棕熊号航母,2024-04-03 15:00:22,参加完研究生复试，出现一问五不知的孩子，在想：高考都对报考专业的文理科背景做限制，为何研究生招生不对本科专业做限制呐？大部分跨专业的同学参与学术研究对于学生与导师来说都是双倍折磨，何必如此呐？ ,0,0,0,四川,成都,四川,中国
38,5019085085087015,念念年念心,2024-04-03 14:43:17,我觉得陈爽教授对于国内的魏晋南北朝学术研究的问题是非常一针见血的：国内的学者往往只抓住婚宦关系去研究门阀世家，并没有从国外的魏晋学者的论文里切换新的思考角度，没有考虑过从社会学经济学角度去分析门阀政治，他把这一类的研究说成是反复劳动原地踏步我觉得确实如此，我在看桓温北伐的论文里就很明显能感受到，近一个世纪来对于魏晋的研究观点都是没有很强的突破性的，确实都是从婚宦姻亲角度去解释门阀政治的关联性，但是这样的问题就会导致并不是从社会存在去分析门阀政治，而是用门阀政治这个答案去反推社会存在并解释其存在的合理性，除了史料的缺少和不够客观之外，对于国外的学术研究的观点吸收也不够拿日本的魏晋学者来说，他们对于这一块的研究首先是因为日本战国时代和魏晋南北朝无论是政治经济来看都是高度相似的，他们的论文观点里透露出来的感受就是，并没有过分刻意强调门阀世家之间的联系，而是从经济角度去解释得更多一点，魏晋南北朝的庄园经济单独拿出来是一个很大的课题，但是往往不符合小农经济的规律而经常被人带过，或许知道这一时期的经济特殊性但是很难去做到深入研究，但是我们都知道门阀政治是一种上层建筑，它的经济基础就是这一时期诡异的经济形态，那么再反观国内的很多研究其实都是用社会意识去推理证明社会意识，和它扎根的社会存在联系是不强的我觉得这是魏晋南北朝的研究缓步前行然后时而呆滞的原因，那么从这个角度来看的话，对于门阀政治，从经济学的角度去切入衡量家族势力或许是一个不错的方向,0,0,2,浙江,宁波,浙江,中国
38,5019074193525244,中国考古网,2024-04-03 14:00:00,#学术研究# 高云逸 | 西梁文化再认识：敖汉营子遗址和胡斯台遗址是典型的西梁文化遗址，它们的发现为该文化的研究增添了新的基础性材料。敖汉营子遗址的发现表明，西梁文化的南界已进入西拉木伦河南岸，这就更新了我们以往对于该文化分布范围的认识。基于横向的类型学比较可知，敖汉营子遗址西梁文化遗存的年代大致相当于兴隆洼文化中期。文章在此基础上梳理了西拉木伦河流域“查海时代”文化格局的动态演变情况，同时探讨了西梁文化的谱系结构及形成机制，并对其突然消失且无流向可寻的根由做了初步分析。网页链接,2,1,4,,北京,北京,中国
38,5019065905316274,小八评论区每天更新案例反馈6,2024-04-03 13:27:04,可以参考其在学术研究和实践中的表现，来判断其专业性和可信度。     刘怀朴（shu后即刻效果好，后期自然稳定）  昝涛（见解独到） ,0,1,0,山东,枣庄,山东,中国
39,5019064389079183,小八评论区每天更新案例反馈6,2024-04-03 13:21:03,可以参考其在学术研究和实践中的表现，来判断其专业性和可信度。     姚远（弧度都很自然流畅，美中不足的就是处理的鼻头不够小巧精致）  朱园杰（做的很自然，很饱满） ,0,1,0,山东,枣庄,山东,中国
39,5019055835060871,小八评论区每天更新案例反馈6,2024-04-03 12:47:03,可以参考其在学术研究和实践中的表现，来判断其专业性和可信度。     江华（独特手法）  张怀军（口碑分化严重，技术还行） ,0,1,0,山东,枣庄,山东,中国
39,5019052938365608,斯奈普而,2024-04-03 12:35:33,【读书摘录】吕贝尔规定了马克思学研究的三项任务:一是了解马克思的著作;二是批判的分析的评论;三是文献和图书。学院派的马克思学研究强调价值中立和学术研究的客观性，强调超越意识形态偏见。当然，研究者事实上很难真正做到价值中立，因为任何解读研究都会存在“合法的先见”。 ,0,0,0,湖北,鄂州,湖北,中国
39,5019052414340429,批判传播学bot,2024-04-03 12:33:28,最后，怎样在经验证据上提炼新鲜概念。上面已经提到，一个好的方法是从经验证据与现存理论的脱节点出发，与现存理论，尤其是经典性的著作，对话来澄清、推进自己的概念。最好是跨越不同流派的理论，因为同一流派中的论证，多只关乎次级问题，而不同流派的交锋点，常常是最为基本和关键的问题。有的同学可能会觉得掌握单一流派的理论已经不容易，要求同时与不同流派对话，可能是过分苛求。但实际上，只掌握单一流派，常常会陷于不自觉地完全接受其预设前提，久而久之，甚至会以为是天经地义，无可置疑的&quot;真理&quot;，因此陷入由意识形态主宰的研究。而且，通过不同流派之间的争议，可以更清晰深入地同时掌握不同概念，并把自己的认识和问题提高到最基本的层面上。这方面中国的研究生其实具有比美国学生优越的条件。作为处于两种文化冲击下的知识分子，中国的研究生更能体会到理论与实际的脱节以及不同 理论之间的交锋。今天中国的研究生，几乎不可避免地都是&quot;双重文化人&quot;，和美国一般研究生很不一样。若能既不迷信普世理论，又不迷信自己的感性认识，这本身就是一个可资学术使用的重要资源。最后是通过严谨的经验研究与高层次的理论问题意识的探讨，来回反复连接，由此才可能建立既是中国的也是现代性的学术，并为全人类建立一个不同于西方现代主义传统的学术传统。——黄宗智#书摘##社会科学##学术研究# 黄宗智 | 青年学者如何阅读学术著作和做读书笔记,0,0,0,美国,,,美国
39,5019044828417165,-seaniceberg,2024-04-03 12:03:19,越听老师讲学术研究规范越觉得做学术真没意思 ,0,0,0,广东,深圳,广东,中国
39,5019004733491793,陈之秀,2024-04-03 09:24:00,老大“闲职”在家后，潜心自己的学术研究，写的一万字左右的学术论文终于发表了。为他高兴，晚上请他吃饭！ ,0,4,4,北京,北京,北京,中国
39,5018998345302727,抗战文献数据平台,2024-04-03 08:58:37,#抗战文献数据平台# 【转载】中共党史党建学常用数据库列表【转载】中共党史党建学常用数据库列表为方便学术研究，提升资料搜集能力，中共党史党建学院研究生会推出“党史党建学术圆桌”系列活动第四期——“中共党史党建学常用数据库列表”。罗列49个网站平台、数据库，其中含有“抗战文献数据平台”。 ,7,0,2,北京,,北京,中国
39,5018795661591825,橙子c不是橘子-,2024-04-02 19:33:13,#复试结束在酒店把书全撕了# 考研只有考上的那一刻才最高兴，后续搞学术研究、搞实验的时候才是痛苦的开始 ,3,22,110,四川,攀枝花,四川,中国
39,5018981465326795,驴游万花筒,2024-04-03 07:51:32,旅游近期，湖北三峡移民博物馆主体建成，建筑面积1.3万平方米，计划今年内建成对外开放，是宜昌秭归乃至湖北省新的文化地标，主要承担湖北三峡移民工作展览展示、征集收藏、学术研究、教育传播、旅游接待等综合功能。#记录旅行##带着微博去旅行# 宜昌·三峡移民博物馆 ,1,2,8,上海,,上海,中国
39,5018975845482508,冷风袭人心,2024-04-03 07:29:11,这个世界对大多人来说很无聊的事情。 大概是做学术研究和数据分析。 虽然人类对世界的探索没有停止过。 但是学会独自探索却是一件很难的事情。 ,0,0,0,广东,佛山,广东,中国
40,5018920936800259,小八评论区每天更新案例反馈6,2024-04-03 03:51:00,可以参考其在学术研究和实践中的表现，来判断其专业性和可信度。！ 张朋（网红风的鼻子，整体比较圆润一点）胡熠茜（主做修複多一些，案例不算精致） ,0,1,0,山东,枣庄,山东,中国
40,5018898283626943,小八评论区每天更新案例反馈6,2024-04-03 02:21:00,可以参考其在学术研究和实践中的表现，来判断其专业性和可信度。！ 刘学琴（做小鼻头还可以，喜欢网红风的可以面一下）陈文磊（风格以自然风为主，束后鼻型自然耐看） ,0,1,0,山东,枣庄,山东,中国
40,5018884956488613,苏老师很菜,2024-04-03 01:28:03,可以让我这种只能写出一坨对学术研究没有任何帮助的💩的人直接毕业吗 写不出来一点 ,0,1,0,内蒙古,呼和浩特,内蒙古,中国
40,5018879674550163,艾伦耶片,2024-04-03 01:07:03,紫微斗数命宫有忌真的好适合搞学术研究。 忌太执着了，也是专一的能力。 我周围我亲哥，我朋友，我的导师都是命宫忌。最厉害的一个SU的直接巨门忌，我嘞个豆听说本硕期间发了20多篇文章。 有时候恨自己忌不在命宫，忌在命宫只要愿意走学术，真的太牛了。 ,0,1,0,广东,广州,广东,中国
40,5018877140928798,小八评论区每天更新案例反馈6,2024-04-03 00:56:59,可以参考其在学术研究和实践中的表现，来判断其专业性和可信度。！ 邓洪（修複做得还可以什么样的问题都会接）张四文（适合方脸的姐妹，风格自然线条流畅） ,0,1,0,山东,枣庄,山东,中国
40,5018864485665179,斗数小姐姐,2024-04-03 00:06:42,天蝎座的 我还见过好几个天机巨门坐命的（如果是机巨这个组合，基本上可以确定，这个天蝎欲望就没那么强烈了，因为机巨不适合经商，内在清高）。如果是机巨的天蝎，我们可以说这个是走了艺术或者学术道路（天蝎座也有很多艺术工作者，搞学术研究的） ,0,1,3,湖北,孝感,湖北,中国
40,5018854490900765,小八评论区每天更新案例反馈6,2024-04-02 23:26:59,可以参考其在学术研究和实践中的表现，来判断其专业性和可信度。！ 刘楠辉（山根处理不错，尤其是衔接处）周伟娟（内推做的比较多，会留角） ,0,1,0,山东,枣庄,山东,中国
41,5018854220628749,冷雨未暂筱停,2024-04-02 23:25:55,学术研究的基本功之一就是从有用的信息中找出无用的信息。 One of the basic skills of academic research is to find useless information from useful information. ,0,0,0,福建,厦门,福建,中国
41,5018850156610078,是草莓芒果桃啊_,2024-04-02 23:09:46,今儿是为了学术研究奋斗到十一点才休息的马师傅 ,0,1,0,内蒙古,赤峰,内蒙古,中国
41,5018845289385261,月亮邮递员ero_,2024-04-02 22:50:25,我发现我根本不能离开导师 导师就是我学术研究路上的指明灯毕业这么久真正想开始写点东西的时候才发现拥有一位导师是多么幸福 一个题目我都要纠结好久 我亲爱的导师能不能给我指条路 告诉我该选什么题目 ,0,1,0,湖北,武汉,湖北,中国
41,5018799064221626,从不给女人口,2024-04-02 19:46:44,学校别太穷了吧？ 以前知网是免费用的，md现在好像要充钱了。。 这是真不打算让我推动学术研究进程了 ,0,0,0,陕西,西安,陕西,中国
41,5018795875762568,深爱论文18831953279,2024-04-02 19:34:03,《社区文化》国家级知网收录，综合期刊24年3月版面3版4100字符不要摘要、关键词、参考文献文化，艺术，非遗，档案图书馆，文学评论、文学作品赏析、语言研究；历史学术研究、人物传记、史学评论；学术研究文章；艺术评论(音乐、美术、戏剧、电影、电视、舞蹈、书法、摄影、曲艺、杂技、工艺美术等相关的,0,0,1,河北,邢台,河北,中国
41,5018794551153260,马乐乐乐乐乐乐乐,2024-04-02 19:28:48,#海外探源为什么越来越火# 教育体系对全球视野的重视，鼓励学生和学者赴海外实地考察，以深化学术研究和个人成长。 ,0,1,0,福建,福州,福建,中国
41,5018791911884334,陈地理的微博,2024-04-02 19:18:19,聪明的特质之一是可以把握细节，可以见微知著聪明的一个显著特征就是对细节的高度敏感和深刻洞察。能够把握细节，意味着这个人具有细致入微的观察力和分析力，可以从细微之处发现关键信息，预见趋势或发现问题所在，这就是所谓的“见微知著”。这种能力不仅体现在学术研究、专业技能上，同样也表现在日常生活中，如人际交往、工作决策等方面。拥有这种能力的人往往能够在复杂的情境中找到突破点，提前布局，从而取得竞争优势，有效地解决问题。因此，“见微知著”是聪明的一种高级表现形式，体现了个体优秀的认知能力和逻辑推理能力，对于个人成长和社会发展都有着积极的意义。,0,0,1,上海,,上海,中国
41,5018788640590689,so01ng_sticker_,2024-04-02 19:05:19,人是怎么回事 人生又是怎么回事 我想搞清楚这些问题再讲给别人 有时候觉得做文艺作品表达好 有时候又觉得还是正经学术研究比较好 二十岁的年纪常常因为脑子转得太快装的东西又太杂而行动和各方面储备都跟不上而觉得头重脚轻 ,0,0,0,上海,,上海,中国
41,5018784553502681,不爱安安没道理哇,2024-04-02 18:49:05,像我这种缺乏交流，没说过几句完整的话，没有什么思考力的草履虫真的没有办法做什么学术研究。 感觉非常非常压抑，完成论文这段时间一直处于十分焦虑的状态。感觉我导发一个标点符号都能变成回旋镖伤了我。。。好脆弱的人类 ,0,5,0,广东,广州,广东,中国
41,5018780336390405,ing-moring,2024-04-02 18:32:18,我生来就是搞学术研究的 ,0,1,0,四川,自贡,四川,中国
42,5018771633473944,Harleytzx唐老师小课堂,2024-04-02 17:57:44,《黑龙江大学怎么样？在学科设置、师资力量和学术研究等有实力》播放量：447 作者：唐老师小课堂网页链接 ,0,0,0,云南,昆明,云南,中国
42,5018764908956273,福州新闻网fznews,2024-04-02 17:31:01,福州新闻 【拟招生！福州终于也有学校可以发985文凭啦！】据悉，天津大学福州国际联合学院由天津大学与福州大学牵头，福建师范大学、福建农林大学等高校参与，以合作共建方式开展研究生联合培养和前沿学术研究联合研究生院天津大学学生将全程在天津大学福州国际联合学院培养。 福州新闻网fznews的微博视频,2,0,6,,福州,福建,中国
42,5018738845289277,新一尔,2024-04-02 15:47:27,征稿启事】山西师范大学书法学院学术周 暨第二届研究生学术论坛（第一期）征稿启事发布时间：2024-03-27为了提升书法专业学生的创新实践能力和学术研究水平，打造书法学科的学术交流、科研成果的展示平台，山西师范大学书法学院拟定于2024年4月底举办书法学术周暨第二届研究生学术论坛活动。诚邀书法专业青年才俊齐聚山西师范大学书法学院，一起交流心得、切磋技艺、开拓创新，共襄学术盛宴。一、论坛主题凡有关书法理论、史论、美学、技法、考据、教育、评论等各个方面论文均可。提倡通过不同学科、方法论的交叉融合使用，对传统书法做出有新意的跨学科综合研究；鼓励作者对当代书法的时代境遇、创作现状、审美取向、历史趋势等方面问题进行有深度的学理分析，为当代书法创作的继承与发展提供学术引导。二、征稿对象本届论坛主要面向山西师范大学书法学院在读的本科生、硕士研究生。三、投稿要求,0,0,0,山西,忻州,山西,中国
