页码,微博id,微博作者,发布时间,微博内容,转发数,评论数,点赞数,发布于,ip属地_城市,ip属地_省份,ip属地_国家
2,5004179297012018,祺祺随笔,2024-02-22 11:33:00,#考虫倒闭#通过四六级的未必得到了英语行业的就业机会；努力备考一年研究生的未必成为众人中的幸运儿；拿到教师资格证、或许会因为专业不对口与教师无缘……先是中小学教育不好做了，现在考虫的倒闭，或许是人们对考试类培训，不再追崇的的一个表现。 ,0,0,0,辽宁,沈阳,辽宁,中国
2,4999948013933855,心理学与生活-诚哲,2024-02-10 19:19:24,自2018年人社部心理咨询师职业资格考试停止后，无论什么协会、学会、心理研究所等各类心理咨询职业技能培训均为相关技能培训，不代表具备执业资格。凡培训机构在宣传中涉及“职业资格”“推荐就业”“保证就业”“介绍工作”等内容的，均属虚假宣传，请广大心理学爱好者谨慎对待，并提防受骗。心理学,0,0,0,云南,昆明,云南,中国
2,4994080906677853,教师资格证,2024-01-25 14:45:36,科一背诵打卡第四天➡️第二章教育法律法规第一节 教师的权利与义务【考察0-1道选择题】 1.教师的职业权利： 【背·选择题】①教育教学权 ②科学研究、学术交流权 ③指导和管理学生权④获取报酬和相关待遇权 ⑤民主管理权 ⑥进修培训权 2.教师作为公民的基本义务：【背·选择题】①拥护国家统一和全国各民族团结的义务 ②遵纪守法的义务③维护国家安全、荣誉和利益的义务    ④保卫祖国和依法服兵役的义务 ⑤依法纳税的义务 3.教师作为专业教育教学人员的义务： 【背· 选择题】①遵纪守法 ②履行教育教学职责 ③对学生进行思想政治教育④爱护尊重学生 ⑤保护学生合法权益 ⑥提高水平  第二节  学生的权利及其保护  【考察0-1道选择题】1.学生的权利：【背·选择题】①人身权：隐私权、 人格尊严权、 人身自由权、 肖像权等②财产权：财产所有权、继承权、 受赠权、 知识产权中的财产权等③受教育权： 参加教育教学权、 获得经济资助权、 获得学业证书权、 申诉起诉权、 法定其他权 2.常见侵犯学生权利的行为：  【背·选择题】①侵犯学生的受教育权： 侵犯教育机会平等权、入学权、 参加考试的权利、 随意开除学生②侵犯学生人身权：侵犯人格尊严权、 隐私权(公开日记、公布成绩)人身自由权、 生命权、 健康权等③侵犯学生的财产权：没收财物、 罚款、 非法扣押④侵犯学生著作权：中小学生的作品也是作品⑤不作为违法侵权：对学生身体状况关照不力，学校活动组织失职，饮食安全事故等 #教资科一##教资笔试##教师资格证#教资笔试,2,0,1,四川,眉山,四川,中国
2,4993737239561154,德国学术交流中心北京代表处,2024-01-24 16:00:00,#德国高校介绍# 卡尔斯鲁厄师范学院(Pädagogische Hochschule Karlsruhe)卡尔斯鲁厄师范学院是一所拥有博士学位授予权和实习资格的教育大学，从事校内外教育过程的研究和教学工作。卡尔斯鲁厄师范学院有约220名教职员工和3600名学生。提供的课程包括小学和初中教师培训课程以及其他教育领域的学士和硕士学位课程。非全日制继续教育课程的特点是特别贴近研究和实践。高校性质：综合大学高校类型：公立学校所在联邦州：巴登符腾堡州大学官网：www.ph-karlsruhe.de/,1,1,1,,北京,北京,中国
2,4993695332174685,新浪保险频道,2024-01-24 13:13:28,【独家！#国开行副行长刘进将任中行副行长#】新浪金融研究院今日获悉，国家开发银行副行长刘进将任中国银行副行长。公开资料显示，刘进出生于1976年4月，是国家开发银行少有的内部提拔的高管，其副行长任职资格在2021年9月被原银保监会核准，此前担任过该行教育培训局局长。独家！国开行副行长刘进将任中行副行长 ,0,0,0,,北京,北京,中国
2,4987128465851378,不语书空花,2024-01-06 10:19:05,受是只小妖精，考取变人资格证后很happy的来到了城市，一边工作一边上后续培训班，感觉未来特别光明，然后工作第一天隔壁桌同事点了外卖，他被馋到，于是勇敢打听要去哪里请人给自己送饭。同事告诉他这是美团外卖的功效，于是他自力更生，下载美团外卖，狠狠研究，感觉自己会了，特别高兴，对同事颇有好感，于是邀请同事和自己成为好友。同事：？受：不可以吗？就是，加个好友，然后做网友？同事：……为什么你要加美团外卖的好友，你没有微信吗。受：啊，我有微信！但是美团外卖不行吗？不能加好友吗？同事还真不知道这玩意有没有好友功能，同时也觉得这段对话非常超现实，而受也从他的反应中察觉自己恐怕是犯了什么常识性错误，逐渐紧张不安，最后同事放弃了，告诉他美团外卖不能加好友，和他加了微信好友。,0,0,0,河南,洛阳,河南,中国
2,4980060446524516,流行等待,2023-12-17 22:13:18,亚力克斯说，每个挑夫都在“为生存而奋斗”。挑夫中很多人需要贴补家用，也有人是在为将来继续接受教育筹集学费。他本人也是在担任挑夫期间省吃俭用，攒够了培训费，考取了向导的资格认证。担任向导期间，他又幸运地结识了一对来自美国的登山夫妇，资助他上大学，研究旅游管理，最终得以创办自己的公司。他一直用自己的经历鼓励年轻的挑夫，无论生活如何艰苦，都不能失去内心的远大目标，并要为之付出努力。,0,0,0,江苏,盐城,江苏,中国
3,4978111680873318,小公举换头计,2023-12-12 13:09:36,医美行业内幕揭秘！！！会动到某些人的蛋糕，就算冒着被一堆人骂的风险也要跟你们说说；昨天发了这个故事之后网页链接，好多医生找我聊天，又了解了些新内幕：1.在国内一个医生，从完成本科学习、到临床实习和培训、到医学研究生毕业，拿到医生资格证起码要15年；你们认为他们拿到证书后会跑出来做代打这么高风险的事情吗？被抓到分分钟吊销，这只是年轻医生，更别说那些主任、教授级别，会因为想赚那点注射法拿自己职业生涯开玩笑？（所以那些所谓的代打医生是怎样的，你们懂了吧）2.还有就是用玻尿酸眉间、鼻子、眼睑、前额、鼻子以及鼻背和鼻尖这些部位时，一定一定要慎重，这块动脉特多：眶上动脉、滑车上动脉、鼻背动脉，只要打错一条，分分钟会会发生永久性视力丧失，严重的会脑梗死；如果你们不幸遇到这种事情（当然我不希望我任何一个粉丝发生这种事情），一定立刻马上第一时间去医院做溶解手术，不要拖，要跟时间赛跑！最后还是希望可以把这种事情扼杀在摇篮里吧，千万千万不要自己买药找人打，要做项目就去正规医院找专业医生做，这样才能确保自己的安全，否则就不要做！,8,14,47,浙江,杭州,浙江,中国
3,4978088155022465,易术录,2023-12-12 11:36:07,术考级教资必考证书！这才是加薪必备 社会艺术水平考级：教师证书！作为艺术类培训，教育中心老师必备从业资格证书！ 证书涉及：美术、书法、朗诵等等 证书直接由中国艺术科技研究所社会艺术水平考级中心颁发！证书含金量No.1 ,0,0,1,浙江,杭州,浙江,中国
3,4977724498381242,法学生江户川,2023-12-11 11:31:05,【投稿】川川，松了一口气！！！历时两年，终于考过了法律职业资格考试，为以后的奋斗打下基础。2019年7月研究生毕业后从事生鲜行业，2020年受疫情影响，部门裁撤；2020年转战教育行业，又遇到国家政策，带头人直播卖农产品去了；2021年做成人演讲培训遇到大裁员；2022年3月开始准备法考，客观题顺利通过后，遇到阳了个阳，主观题一拖再拖；2023年法考主观题一战差四分，开始在律所工作，直到年底二战通过。大家都告诉我，过了只是开始，所以我又把气提起来了！加油！,1,6,37,浙江,杭州,浙江,中国
3,4976398685703684,大博说考研,2023-12-07 19:42:46,浙江工商大学&amp;加拿大魁北克大学 中外合作办学硕士 专业：项目管理 学费：19.8w 学制：2.5年，在职就读 入学资格：硕士2年，本科3年，大专5年 上课时间：每月集中一次，3-5天 项目优势：没有语言要求，笔试+面试（培训） 学位授予：魁北克大学硕士学位证+中留服认证#研究生录取通知书#   ,0,1,1,广东,深圳,广东,中国
3,4976132404806239,依旧suki干饭_偶尔发疯版,2023-12-07 02:04:40,#西西爱政治#小红薯刷到了 来龙去脉大概捋清楚了微博也安排上个热搜呗 让贵校看看该“高贵”的研究生所参与的教学培训～只不过就是二创几个大佬的知识讲解  就占为己有了 还说别人剽窃知识产权属实笑叠了还斤斤计较威胁别人考不了研 区区几十块就没有考研资格 真的笑拥了 家人们心真的歹毒 啊啊啊啊啊,0,6,30,广东,深圳,广东,中国
3,4973414589138509,思程考研杨老师,2023-11-29 14:05:02,青岛大学研究生[青岛大学]妇产科学专业24考研    ⭕️100211妇产科学专业的4个研究方向不招生同等学力、专升本等考生。⚪️105115妇产科学专业不区分研究方向的报考人员须为符合国家规定的临床医师资格证报考条件并同时符合山东省住院医师规范化培训报考条件的本科 (全日制5年一贯制，不包括专升本)毕业生，报考专业应与本科(全日制5年一贯制)所学专业相同。1⃣招生目录2⃣参考书目3⃣最高分|最低分|平均分|录取人数⭐️需要青岛大学专业课资料的同学可以滴滴我哦！,0,0,0,山西,太原,山西,中国
3,4970831851816529,牡丹江铁路运输法院,2023-11-22 11:02:10,#全民普法# 【中华人民共和国生物安全法】第六十九条　国务院有关部门根据职责分工，加强生物基础科学研究人才和生物领域专业技术人才培养，推动生物基础科学学科建设和科学研究。 国家生物安全基础设施重要岗位的从业人员应当具备符合要求的资格，相关信息应当向国务院有关部门备案，并接受岗位培训。 ,0,0,0,,牡丹江,黑龙江,中国
3,4966186514907621,柿桃2足球,2023-11-09 15:23:14,扬州研究院培训 高质量低成本 高质量才有资格活着，低成本才能给客户吸引力 寂静的交叉路口 小概率发生了自行与转弯两车相撞 交警来了 然30分许 恢复往常  空是常态 扬州·中国航空研究院研究生院 ,0,0,2,江苏,扬州,江苏,中国
4,4961497404671793,攒一口袋星星沙,2023-10-27 16:50:24,刚看完一篇关于日本教师资格更新培训的研究，说以资镜鉴，随后就看到另一篇名为日本教师资格更新制因何废止的期刊，好家伙，刚研究完要借鉴一下，结果人家自己又废止了，研究也有白研究的时候害，不过大部分时候文科的研究都是在白研究，也不必太过在意 ,0,0,0,河北,石家庄,河北,中国
4,4957115472939076,郭小南1113,2023-10-15 14:38:10,辽辽爸爸翻出家里快二十年的老相机，他说报名了工会举办的摄影培训，有单反的才有资格去 这个相机用的次数不超过十次，买完后俩人谁都不会用，那时候也没有网上培训啥的，自己照着说明书研究也没研究明白，就这样一直被雪藏了十多年，今天可算重见天日了🙏 ,0,8,6,北京,,北京,中国
4,4956061481304613,黄河新闻网吕梁频道,2023-10-12 16:49:59,【交口县召开自然科学研究系列科学传播专业职称专题培训推进会】10月11日，我县召开自然科学研究系列科学传播专业职称专题培训推进会。县委常委、统战部部长王卫平出席并讲话。会上，县科协、县人社局主要负责人对科学传播职称申报程序、资格条件及相关要求进行了详细辅导，就科学传播职称申报工作的重要性作了说明和强调。科学传播专业职称评审采取个人自主申报、单位审核推荐、职称评审办事机构审核、职称评审委员会组织专家综合评议的流程进行。在自然科学研究系列职称下设科学传播专业，分设初级、中级、高级三个层级。科学传播专业职称设置科学传播研究、科学传播制作和科学传播推广三个方向。王卫平指出，一是要提高思想认识，抓住时间节点，迅速启动自然科学研究系列职称评定工作。各有关部门要着眼于国家战略高度，齐心协力，扎实推进。二是要迅速开展宣传动员，确保该项工作贯彻落实到位。要把政策说清、条件说明、意义说透，进一步扩大社会的知晓率，切实宣传到位。把惠及广大科普工作者的好政策落实落细，为基层一线科普工作者办实事，做好服务工作，确保该项工作产生新成果，为全县“三优两区”战略推进提供人才支撑，为自然科学研究发展注入更强动力。记者：解德智,0,0,0,山西,吕梁,山西,中国
4,4955397552866865,扬帆手机频道,2023-10-10 20:51:46,【扬州市邗江区融媒体中心公开招聘编外工作人员公告【扬帆】】扬州市邗江区融媒体中心公开招聘编外工作人员公告根据邗江区融媒体中心工作需要，经研究，决定面向社会公开招聘编外工作人员1名（劳务派遣制）。 （五）持证要求：持有有效的新闻记者证或者《新闻采编资格培训合格证》《全国广播电视播音员主持人资格考试合格证》《全国广播电视编辑记者资格考试合格证》《广播电视编辑记者证》《播音员主持人证》《互联网新闻采编培训合格证书》6种证书其中之一。网页链接（分享自@扬帆手机频道）,0,0,0,江苏,扬州,江苏,中国
4,4953925725458398,海门上元会计培训15851359242,2023-10-06 19:23:15,　　海门研究生考试培训  海门在哪里上考研课#海门上元教育##研究生# 　　上海交通大学上海高级金融学院　　非全日制高金人才奖学金：2022年正式入学的非全日制金融MBA新生有资格参与此奖项的　　评选。奖项的设置用来鼓励志向高远，坚持梦想的学生。他们不但在现有行业上表现优　　异，更能为了改变自身、企业、社会乃至环境继续深造。　　评选依据：提前批面试的总分（其中二等奖学金及以上的奖项需要通过【奖学金答辩】　　，最终奖项评定需结合答辩评分进行综合评定）。　　对大学毕业生来说，考研是一次二次革命，是调整未来发展方向的良机。当前，许多考　　生在选择研究生的专业时，都会考虑这个专业未来的发展前景。数据显示，为了更好的　　职业前景而选择考研的学生占了60%以上。　　考生在专业选择中表现出的理性是一个值得欢迎的现象。对这类学生，要提醒的是，不　　能只从“研究生”这三个字的字面上去理解，研究生教育不是也不应该只是“研究”这　　一条路，不同专业的研究生应该有不同的职业目标和价值取向。　　复旦大学管理学院　　①全国MBA联考奖学金　　一等奖：100%学费奖学金，授予当年被录取的MBA学生中联考成绩名列1-2名者。　　二等奖：50%学费奖学金，授予当年被录取的MBA学生中联考成绩名列3-5名者。　　三等奖：30%学费奖学金，授予当年被录取的MBA学生中联考成绩名列6-10名者。　　优秀奖：人民币2万元奖学金，授予当年被录取的MBA学生中联考成绩名列11-20名者。　　②在职MBA新生预审奖学金　　一等奖：50%学费奖学金，授予当年预审获得在职MBA项目C线资格，背景及面试综合评估　　排名第1-5名，并被复旦MBA录取的考生；　　二等奖：30%学费奖学金，授予当年预审获得在职MBA项目C线资格，背景及面试综合评估　　排名第6-15名，并被复旦MBA录取的考生；　　三等奖：人民币2万元，授予当年预审获得在职MBA项目C线资格，背景及面试综合评估排　　名第16-30名，并被复旦MBA录取的考生；　　Early Bird奖学金：人民币5000元，授予当年参加第一批预审面试获得C线两年资格的考　　生，并被复旦MBA录取的考生。　　联系人：杨老师　　咨询电话：15906279281　　咨询地址：南通市海门区（市）解放中路301号贵都之星8幢7层（利群超市东侧50米　　，电梯7楼上元教育),0,0,0,江苏,南通,江苏,中国
4,4949896622506028,平安商丘,2023-09-25 16:33:01,#教育整顿##豫筑平安##夏季行动#【冒充老师诈骗家长 夏邑民警快速破案】近日，夏邑县公安局曹集派出所接到群众报警：其刚才被骗走70000元钱。原来，该女士接到一男子电话，声称是其儿子老师，因为研究生招考培训马上截止，其儿子的培训费还没有缴纳，如果报名结束，其儿子会被取消资格。她一听急了，按照对方发过来的要求完成了缴费，事后发现儿子根本没有参加招考培训。曹集派出所接到报案后，立即组织民警开展调查。经查询，涉案银行卡内的钱已在广州被取走。民警立即奔赴广州，通过多日工作，终于将涉案嫌疑人范某抓获。经讯问，犯罪嫌疑人范某对其实施的诈骗犯罪行为如实供认，该案正在进一步侦查中。@平安中原 @中原盾 @人民公安报 @中国警察网 @中国警方在线,29,9,14,,商丘,河南,中国
4,4947835134937461,奥利奥泡一泡__,2023-09-20 00:01:25,细数人生中的考试小学中学在校期间：周考，月考，期中考，期末考升学考试：中考，高考，研究生入学考试大学在校期间：四六级考试，普通话考试，计算机等级考试，教资考试，法律职业考试，公务员考试，事业单位考试上班之后：执业资格考试，业务培训考试，年度工作考核生命不息，考试不止,0,0,0,云南,昆明,云南,中国
5,4946861442993047,博华教育y,2023-09-17 07:32:19,🍒中国关心下一代工作委员会儿童发展研究中心中国关心下一代工作委员会儿童发展研究中心和北京市海淀区智慧社区与家庭服务协会联合颁发的专项技能培训证书可以作为用人单位了解持证人接受专项培训情况，以及考核、聘用和继续教育学时等的重要依据。该证书不属于职业（执业）资格证书、职业技能等级证书，不具备资格、资质许可和认定功能。培训工种：家庭教育指导师、心理咨询师、幼儿教师等关工委🍒张老师🍒17610788666@所有人#心理咨询师##张老师17610788666##心理咨询##健康管理师##关工委#,0,0,0,江苏,,江苏,中国
5,4945451783819367,中小学教师资格证考试,2023-09-13 10:10:50,知识点归类：法规类&gt;《教师法》&gt; 【教师资格证/教师招聘 】教师应享有的基本物质利益权利是（    ）。#教师资格证考试##教师资格证笔试#  A.报酬待遇权        B.学术研究权 C.进修培训权        D.教育教学权  网页链接 ,2,3,294,上海,上海,上海,中国
5,4944551175524975,崔胖胖de生活,2023-09-10 22:32:08,㊗️崔老师教师节快乐研究生入学前那个暑假就报名了教资考试，研一就考取了高中教师资格证研一暑假就去了培训机构当助教研二就顺利从助教转岗成高中一对一教师研三果断辞职忙着毕业就业研究生一毕业就入职大学教师一步一步考高校教资评教师职称变成讲师慢慢积累副教授的评聘条件，曙光在望努力提升自己不知道这该是我的第几个教师节呢我这种念旧的人，果然刚才从手机相册里翻出了高校教资面试的自拍照（那天涂着最喜欢的兰蔻196，还被夸好看）当老师这么多年，好的是一直在做自己，也在职业上取得了一定的成绩，一直对工作有热情，对学生有爱心，坚信所有的事情要想得到必须付出！也学会了慢慢发现自己的优点，不再轻易相信他人的否定。嘻嘻嘻~告诉自己，都会好的,0,18,11,山西,晋中,山西,中国
5,4937474227573567,我是律师的朋友,2023-08-22 09:50:52,#在韩表演僵尸跆舞跆拳道馆被处罚#该表演宣扬遗风陋习，丑化民族形象，亵渎中华文化，造成恶劣影响。经研究，现依规作出以下处理:(一)取消“X-跆拳道馆”中国跆拳道协会会员资格级位考试考点资格和全国跆拳道相关赛事参赛资格;(二)取消刘豪教练员注册资格，禁止刘豪参与中国跆拳道协会举办的培训比赛等活动;(三)责令广东省跆拳道协会做出检查，取消广东省跆拳道协会和深圳市跆拳道协会3 年内评优资格。via：中国侨网的微博视频,2,2,6,浙江,宁波,浙江,中国
5,4931111580599347,北京市场监管,2023-08-04 20:27:59,【本市发布新版专技类培训服务合同示范文本】为规范专业技术类职业资格培训服务，化解培训服务纠纷，维护公平公正的市场竞争秩序，在充分吸收群众和社会各界合理意见建议，深入研究、多方论证的基础上，市人力资源社会保障局会同市市场监管局修订发布《北京市专业技术类职业资格考试培训服务合同》示范文本（2023版），已于8月4日正式发布推行使用。2023版合同示范文本结合培训市场形势变化，一是新增预收资金纳入资金存管、不得随意改变培训地点、保障消费者知情权、公布消费者了解预收资金存管情况途径等约定条款，以及收费周期额度风险、机构收款账户是否为预收资金存管专用账户提示，帮助消费者规避风险；二是进一步明确机构与消费者权利义务。对双方的退费条款、违约责任、争议处理等内容作了详细约定，减少服务纠纷；三是强化提醒引导。突出消费者风险提示，提醒消费者理性消费，引导培训机构承诚信经营，推动解决培训机构夸大培训效果营销、利用服务合同格式条款侵害消费者合法权益等问题。示范文本可登录首都之窗（www.beijing.gov.cn）、北京市市场监督管理局网站（scjgj.beijing.gov.cn）和北京市人力资源和社会保障局官网（北京市人力资源和社会保障局 版权所有）查阅、下载。2021年发布的《北京市专业技术类职业资格培训服务合同》（BF-2021-2730）不再推行使用。,0,0,0,,,北京,中国
6,4929905122349744,产科王蕾蕾,2023-08-01 12:33:57,现在国内想成为专科主治医生的时间成本和经济成本都很高！五年本科，三年研究生，再加上住院医生培训，毕业证、医师证、住培证都拿到才有希望找工作。之后还得在临床工作数年，发表文章，参与课题，才有资格申请主治医生资格。身边有太多三十岁还在求职路上的医学生，很多人都需要靠家里经济支持。而即使在三甲医院拿到主治医职称，也不像在国外那样就能养活一家人，其实一个月工资很低，工作量却是国外的几倍或者十几倍，甚至不会得到应有的尊重，就跟服务员一样被喝来喊去。报考医学院的学生，准备好迎接漫漫求学之路了吗？,0,8,20,辽宁,沈阳,辽宁,中国
6,4925868047075048,机工战略,2023-07-21 09:12:03,推荐大家关注一个活动：Workflow Canvas 精英训练营是首届西门子Xcelerator公开赛的一个特别企划。选择采用由西门子中国研究院自主研发的新一代工业数字化融合开发套件Workflow Canvas (工易魔方) 作为开发工具参赛，既有资格加入并免费获得参赛资源大礼包：包括工易绘道师培训考试认证资格、专家教练辅导共创服务、精英训练营结业作品展示与交流（将于8月31日-9月1日于苏州举行）。Workflow Canvas (工易魔方) 精英训练营意在搭建创新生态，我们鼓励参与企业将自身产品与解决方案与西门子先进的数字化开发工具互融互持，合作共创，更好地服务于市场和客户，并助力企业在首届西门子Xcelerator公开赛中大放异彩！为了帮助参与企业更好的准备，我们将于7月25日组织Workflow Canvas 精英训练营线上开营仪式，介绍公开赛、训练营的活动安排及注意事项，带领您初步认识Workflow Canvas (工易魔方)，并解答您的问题。活动链接在这里网页链接,18,1,7,,北京,北京,中国
