页码,微博id,微博作者,发布时间,微博内容,转发数,评论数,点赞数,发布于,ip属地_城市,ip属地_省份,ip属地_国家
15,5013413917104043,游游youy,2024-03-18 23:08:05,#书# 纸质书三十一如何抑制女性写作从整体上来看，这本书确实成文比较粗糙，结构没那么的好，但是我非常喜欢它里面的愤怒和锐利。它里面会写很多很多我们中文读者没有见过的书和作者，所以读起来会有一点困难，但是这本书其实相对于英语读者来说里面引用的很多作品也并不那么耳熟，毕竟女性主义目前还是小众市场并没有占据主流。所以母语是英文还是中文对读者的负担都差不多，认真读进去感受其思想才能受益。我以前总觉得看名著没什么意思，是看书少的人故意标榜自己才去专门找名著看的（其实我一直自卑于小时候父母阻拦我看书，导致我把新脑子浪费在和母亲斗智斗勇地见缝插针读垃圾书上，没有什么途径去接触真正好的书，小城市，我直到高中考到我们市最好的中学才第一次见到阅览室，它甚至不是图书馆而是小小的阅览室），但是我现在竟然有点庆幸我在中学时期看过《呼啸山庄》，虽然那时看不出个好歹但书籍有限的情况下我也反反复复全书阅读了好多遍，这本书大量写了《呼啸山庄》的作者以及她的作品，这让我读这本书有一定的熟悉感。其实人还是应该在脑子比较新的时候多读一点名著，以后接触更广大的世界的时候，看到自己以前看过的书会感到熟悉，并且会有新的感想。当然我现在也在不断的阅读，不管自己的脑子算不算新，但至少对比我未来的每一天，我当下的脑子都是最新的。,0,0,0,海南,海口,海南,中国
15,5013375603966771,-在在一直在-,2024-03-18 20:35:51,涉及粉圈有些事 可能不追星的人确实理解困难 就像我不进海底，打死我都不信，有些一把年纪的人，会相信两个男人演个剧，就改变性向“相爱”了 更不要说“假人”了 还好我有写作天赋 我会好好整理材料 反正 我就和你们过不去，我就要做你们梦魇 你们等着 ,0,9,16,天津,,天津,中国
15,5013050300303868,瞎改哈哈,2024-03-17 23:03:12,#抄书# 这便是所有妄自尊大者的宿命 斯大林终于啃完了，豆瓣三星，写作风格不适合我的胃口，尤其是蹩脚的翻译，读起来极其困难。书最后，写到斯大林坐在黑海边的别墅里回忆他的一生，作者开始介绍他亲友和政敌的归宿。一切如烟。全书还是太关注斯大林的私生活了，我不喜欢。 ,0,0,0,江苏,南京,江苏,中国
15,5012995434087846,只想躺平的小白白,2024-03-17 19:25:11,本来就写作困难，还要就写作困惑写1000的文章，我要写的出来我困惑啥啊 ,0,5,0,湖北,宜昌,湖北,中国
15,5012896360696842,海边卡夫卡的乌鸦,2024-03-17 12:51:30,读完伍尔夫的「一间属于自己的房间」，原来女性写作是这么困难的一件事，一间属于自己的房间不是字面的意思的一间房间，它代表你能独立拥有自己的房间可以思考。所有的男性都不曾写过女性，即使有也很肤浅和表面，因为他们从来不了解女性，就像波伏瓦讲的，过去男性把女性视为第二性，一个依附在男人的第二性，她的创造价值来源于男人，她的价值来于照顾家庭和别的琐事做好。莎士比亚的妹妹为了反抗家庭，不愿意嫁给她父母想让她嫁的人，离家出走，但她却没有莎士比亚那么走运，她后来在剧院怀上了一个男人的孩子，从此她年轻的命运就结束了。这个故事我觉得伍尔夫写的很好，这是一场女性对自己的革命，让我想起了深夜出逃的托尔斯泰，最后却死在了火车站，这是他对自己命运的揭竿而起。但是很不幸的，女性的解放之路走的太艰难了，从简匿名写「呼啸山庄」，我因为L的原故看了一下，刚开始还好，读到后面我真的读不下，硬着头皮在读，但看到伍尔芙评价简的时候才发现她也是那么矛盾的一个人，或者说在当时的社会环境和政治环境下不得不用这种手法去处理叙事，但伍尔芙说她是伟大的这点我深感同意的。写简爱和呼啸山庄时连稿纸都买不了几张，虽然同为女性的艾略特隐居在一处人迹罕至的别墅里也难以逃脱别人对她的非议。首先要有钱，其次有一间属于自己的房间。,0,0,1,广东,深圳,广东,中国
15,5012671519000598,青椒土豆potato,2024-03-16 21:58:04,我想想下午写了什么，我只记得关于生态啥的了，绿色带来大美？对农村什么经济的不足建议意见？发言提纲？自拟题目写关于青山绿水无价生态有价？  反正看着那些材料我憋不出来字，太困难了写作文 ,0,0,0,重庆,,重庆,中国
15,5012555728946894,表达开窍韩丽娜,2024-03-16 14:17:57,初一的悰信同学，直接参与寒假写事专项挑战，挑战期间积极主动不断突破。面对写作，从困难、无话可说，到有了方法思路；从之前的四五百字，到现在洋洋洒洒一千多字。高年级的孩子，只要用心参与，掌控写作不在话下。#让我们一起爱上写作掌控写作# 新学期的新挑战要开始了，感兴趣的欢迎加入。,0,1,1,北京,北京,北京,中国
16,5012524997283732,非自愿扭曲单线程情感博主,2024-03-16 12:15:50,今天通过论文开题报告的重写学到了不少课题理论知识与论文写作技巧，但最重要的是我懂得了一个道理：遇事多反思自己，多从自己身上找找是否真有问题，而不是一遇到困难就怨气满满骂天怼地的 ,0,1,0,陕西,西安,陕西,中国
16,5012521323598660,要不忘要勇往,2024-03-16 12:01:14,当然可能选完题的写作也可能很困难……但是，当你的范围是“古代文学”时，在茫茫大海里捞一根你想写的针，那真是太难为人了 ,0,1,0,上海,,上海,中国
16,5012466599725513,XRYXPX,2024-03-16 08:23:47,没意思😐爱情终究不过是一场梦，只剩下无尽的回忆与思念，也已越来越远，没有了再去寻找的勇气和希望，毕竟老了也没了意义简简单单的补课，也被搞得困难重重遥不可及，不如继续放弃下去胸口总是压着一块石，堵得慌，所以，什么都不要想，也不必念念叨叨，专注于读书跑步写作，从那些被束缚心灵的网中，挣破出来，独自找个清静之所，只爱惜守护住自己的孤独，往事随风，现实生活。,0,0,0,青海,西宁,青海,中国
16,5012341965982598,青提奶酥o,2024-03-16 00:08:32,写作困难就又暴饮暴食ㅠㅠ ,0,2,0,黑龙江,哈尔滨,黑龙江,中国
16,5012337073590608,刀小娜donna,2024-03-15 23:49:06,去年有段时间心理紧张，入睡困难，就又开启了睡前看书。我比较喜欢看作家的随笔，比如村上春树的好几本，关于跑步的、音乐的和自己写作的，比起他的小说（只看过一本《挪威的森林》）来，更轻松，也很亲切。抱着这样的期待，把路遥的《早晨从中午开始》当做睡眠读物。确实是每次看不了太多就睡着了，每天都要重复前面的才能接得上，就这样花了一段时间才读完。这本书对《平凡的世界》写作过程做了详尽的记录。没想到前期准备工作就有三年，每一部都是在不同的地方写的，而且是写完一部就发表一部。对写作时的身体和内心状态也有非常真诚、深入的剖析。特别细腻，就好像是能看到最柔软的内心，看到自己给自己鼓劲。但还是被这种摧毁式创作给震惊了，伟大作品的诞生牺牲太大了！不好说创作到底是快乐的还是痛苦的，可能就是痛并快乐着。他写到笔下人物的命运，眼前展开的人物关系的宏大图景，突然想到我看过的话剧最后一幕，他站在中间，被塑造的人物包围着……完完全全展示了书里这段我的想象。太神奇了！,0,2,3,陕西,西安,陕西,中国
16,5012294478071676,张登峰WAWA,2024-03-15 20:59:50,全书终于写完到下午六时，最后一个一千字写完，宣告全书写完。历经四个半月，每天写作八九个小时，克服了太多难题，征服了太多领域，把太多不可能变成可能，化太多腐朽为神奇，开创了太多不可思议，终于成功突围迎来了胜利。到此为止，没被困难打倒，要么被打倒，要么成就一番辉煌，后者成为现实，十万册起印，祝贺自己！为老太太找到更好的康复方式扶着老太太走路，然后走一趟坐在轮椅上休息一会，需要三个人，两个人扶，一个人在后面跟着推轮椅，为了减掉一个陪护力量，想到一头放一把椅子，走到一头直接坐在椅子上，竟然发现这样比起坐在轮椅上更锻炼腰部，否则坐在轮椅上直接靠着，腰部锻炼不上。而只有锻炼腰部，才能更有利于走路，父母较真老家表哥做的事幸亏及时掌握情况，几句话让他们不再顶真，算是释怀了。父亲拍的视频是刚出窝的小鸡们，老鸡带着小鸡啄食，真可爱。,0,0,3,安徽,滁州,安徽,中国
16,5012267208804602,亡命之徒chris,2024-03-15 19:11:29,檀健次studywithme写作对我来说还是太困难了。两个小时p都憋不出来！ ,0,1,1,上海,,上海,中国
16,5012263012402525,瑞瑞的瑞啦··,2024-03-15 18:54:48,三年级的写作困难户，总算看到一点进步了。 ,0,1,0,山东,烟台,山东,中国
16,5012259212887998,咸鱼团子233,2024-03-15 18:39:42,#做难而正确的事#  @海尔智家 做过的难而正确的事大概就是坚持读书写作吧，读书不难，写作不难，一两天，一两个月容易做到。难的是长期坚持，半年，一年，甚至更久，但目前还在坚持。我喜欢写作，记录生活，记录读后感，记录自己的所思所想，所见所闻。读书坚持得有点困难，但依然还想继续下去。写作是坚持最久的事情，什么都写，万事万物，我写我心。,0,0,0,浙江,杭州,浙江,中国
17,5012130361512302,雪舟_诗歌,2024-03-15 10:07:42,🍏《奥本海默》导演诺兰采访录在写作时，只有你和一张纸，当你有一个极好的想法时，你把它写下来，但可能发现它很糟糕，这是每天都会遇到的情况。写作非常困难，作家很孤独，他们需要很多的支持。我很重视什么也不做的时间，只是思考，努力想清楚现在在做的事情到底是什么。我很喜欢不用手机也不接收邮件，不与任何人联系，这样我可以利用碎片的时间来思考事情，这些碎片时间对我来说非常宝贵。任何电影对待时间的态度都非常复杂，这是电影中大量出现的事物之一。他们可以让你对时间以及时间的经过有非常不同的感受，我所做的事就是操纵你对时间的感受，把它做实。然后说，好的，我想让你参与进来，我想让你知道，比如这里有三条不同的时间线，它们正向不同的时间范围展开。我想让你知道这一点，因为我希望你不断想起每一个故事的有限设定，这样你就被困在已有的经验中了。这是一种诚实的操纵。我们的目的就是用视觉来讲故事，希望以现在时态与角色一起存在，希望使观众更多地融入电影中，尽量通过眼睛来了解发生了什么。博尔赫斯，我经常被他所吸引，我爱他的故事。他是我的最爱。我有他的小说集，我会重温它们，重读它们，我觉得这些书非常鼓舞人心。,5,1,7,宁夏,固原,宁夏,中国
17,5012118776580097,秋刀鱼的薄荷叶,2024-03-15 09:21:40,早上好 前两天娃学校说要举行10岁生日，让每个家长给孩子写一封信 今天准备构思一下信的内容 像我这种写作有困难的妈妈 真的是难为我了 ,0,0,0,上海,上海,上海,中国
17,5011781151885732,小爱同学,2024-03-14 11:00:04,即将毕业的朋友，毕业论文准备好了吗？ 不妨让小爱同学AI助手，为你提供帮助吧。流程不明、没有灵感？告诉小爱你在论文选题及写作中遇到的困难，#小爱同学升级大模型#帮你一一解决！ ,8,4,40,北京,北京,北京,中国
17,5011943854971247,我哩脑阔4399,2024-03-14 21:46:35,四六级 四六级备考规划之词汇写作#四六级一笑而过##四六级# 第二次打卡：今天终于见到了思思大王！好亲切，发现周思成老师说的两个背单词误区自己全中了 今天上完课用单词书加纸质抄写背单词，感觉困难但是有效果，比app背记得牢！老师讲课风格很幽默风趣，听到湖南口音好亲切，啊哈哈哈～加油呀！期待自己六月份的蜕变！,0,0,0,山西,晋中,山西,中国
17,5011868245300193,-大白菜菜,2024-03-14 16:46:08,我陷入了写作困难。 ,0,0,0,广东,广州,广东,中国
17,5011842288061483,译林出版社,2024-03-14 15:03:00,#在书里拥抱春天# 近日，诺奖作家古尔纳在中国之行的第二站——上海思南文学，与茅盾文学奖得主孙甘露展开对话，主题为“离散的人，寻着故事回家”。在谈到“写作的起点”这一话题时，孙甘露认为写作是一件不容易的事情：“写作的困难就像人生的困难，因为写作就是要处理你人生遇到的各种问题，人生有多困难，写作就有多困难。”《被折叠的时间》收录了孙甘露上世纪90年代至今与多位友人的三十多次对话，时间跨越三十余年，对象既有毛尖等学者，也有小白、王朔等作家，此外还有徐静蕾等电影人，谈话的主题既涉及上海、小说、写作等与作者相关的内容，也涉及当时流行的电影、文学风尚的变化等时代元素。,7,5,15,江苏,南京,江苏,中国
17,5011815471513784,丁丁的鸡毛蒜皮,2024-03-14 13:16:25,余华：写作的不同时期会遇到不同的困难，遇到困难，说明你就要进步了！ ,0,7,3,陕西,宝鸡,陕西,中国
17,5011612324597307,ryuichi1123,2024-03-13 23:49:12,春天，所有的心都在流浪，不管人在何处。史铁生  |  比如摇滚与写作 武汉马拉松的参赛号码出来了E9916 很喜欢今天跑了5公里有些顶风 配速有些快估计比赛日那天不会这么用力毕竟 气温 湿度都是阻力有可能要雨战 做好困难准备吃了俩芒果 太甜了可 就爱吃芒果 一冬天腿儿捂白了胳膊还是晒太黑了武汉那天 考虑涂防晒霜否则 又得有可能被紫外线灼伤提前做好准备 回来的机票得要订了工作不想再多想就想回家后 能安静的躺平今天晚上腿儿不疼 以后每次跑步都提前拉伸好跑步是为了让自己更好的释放也让自己能更加自信今儿客户说：我从后面看 练得真结实有点害羞〃∀〃呢,0,1,1,北京,,北京,中国
17,5011568885237237,海上有鱼009,2024-03-13 20:56:35,为什么要坚持在互联网上写作？如果一个人找到了一件自己热爱的事情，那么你的人生和那些没有热爱的事情的人，是截然不同的一生。一个人有信仰，有自己热爱的事情，其实你不会感觉到孤独的，因为热爱本身就是你的同伴。虽然你在过程中，也会遇到无数的挫折，遇到无数的困难，最后你熬过一个又一个漫长的黑夜的时候，你就会发现其实你的快乐，是你热爱的事情带过来的。你热爱写作，你每天都在互联网发布你的文章，开始的是，肯定是没有什么人关注你的，我们看到那些大v其实很多人都是熬了三年五年甚至十几年了。我们根本不需要给自己太大的压力，开始的时候，你就每天机械的完成，写作的认为。一天写5篇500～800字的文章。先坚持五年再说。现在无数的人都过于浮躁了，其实你会发现浮躁不会让你更快的进步，不浮躁也不会让你更快的进步，你的进步就是必须要经过漫长的日日夜夜的坚持，你才能做到的。其中里面的日子里，你无论是伤心的还是难过的，还是你高兴的，还是兴奋的，最后你发现这都不能让你快速进步。但是你浮躁肯定会影响你进步的。最后你还会发现，现在有无数的人不会PPT他们依然会过得很好。很多人都不会使用手机，也比那些大学生强，他们有自己的事业，他们可以养活一个家，他们可以用自己的积蓄，不用贷款，自己买了个好的房子。他们没有其他的焦虑，就是日日不断的干活，然后钱就到手了。现在无数受了高等教育的人，他们眼高手低，他们内心浮躁，他们做事情，三心二意，他们总是希望成为马云，马化腾，最后他们谁也成不了，最后只能回家啃老。我们就是要做一个认定一个方向了，我们就是要排除万难，排除所有的阻力去坚持，最后一定能把自己热爱的事情做好。,0,0,0,广东,珠海,广东,中国
17,5011538166154926,一直學到腦子變藍,2024-03-13 18:54:31,一面對論文寫作就感到emo，畢竟兩個核心人物都沒怎麼讀，而上週又亂七八糟讀了太多，直接反噬出現閱讀困難症和逃避心裡...現在在搜偉大的當代哲學教授，bless me，神祈罷了。 ,0,0,0,湖南,,湖南,中国
18,5011384710729889,苏河湾茅19,2024-03-13 08:44:45,做直播这2周以来的体验和总结：1.这个事情没有想象中的那么难，也没有想象中的那么简单。2.直播和写作一样，属于专业的技能，同样靠天赋吃饭，老天爷赏饭吃。 3.虽然有困难，但是入场的初心，背景条件没有改变，确实有平台的流量馈赠，昨晚直播，在凌晨1：40左右，突然平台就推流了400多人，最高同时在线80多人，全部属于平台流量。 4.直播几乎可以忽略私域流量，基本上都是靠平台推流，这点和入场前的判断是不一样的，公域和私域，就像泾水和渭水一样的区隔，很难打通。 5.毫无疑问，这个事情当然是值得做的，只要直播，一定会有关于流量的收获，这个实实在在的，在现在公众号图文几乎很难增长的情况下，这是一条必由之路，每个人，即便不擅长，也必须硬着头皮上。 6.直播和短视频的赛道异常拥挤，甚至说这个赛道更加下沉，因此绝大部分账号不可能带货，也不可能参与创作者分成计划来盈利，只有引流和打造人设的价值。 【 简单来说，变现很难，但也必须做】#私域流量引流与变现#路上自媒体联盟,2,2,1,广东,中山,广东,中国
18,5011373448761257,起个名字真是难上难,2024-03-13 08:00:00,海明威曾经说过，庞德是真正教他“如何写作和如何不写的人”。“如何写作”好比教我们如何获得一样东西；“如何不写”则是当我们已经获得后，教我们怎样将不必要的东西放弃。前者容易，后者就困难多了。我们往往在辛苦追逐到一样东西之后，便巴不得把所有的都一网打尽，结果不但拿不走，反而压垮了自己。,0,0,0,山东,东营,山东,中国
18,5011036300122787,别人家的毛毛妈,2024-03-12 09:40:17,语文学科的特点，如果说只是盯着课内的课本的那点知识那几篇文章，然后去背答题套路、写作模板等等，那孩子的语文是不可能特别好的，因为没有思考深度。但是如果说走向另外一个极端，对课本知识完全不屑一顾，只喜欢看课外书，课内基础不牢，那这孩子的语文成绩，可能连及格都困难。所以语文这个学科，既要有理想主义，还得有一定程度的功利主义；既要有课内的刷题，还得有课外的素养拓展提升。这就不像数理化那么单纯，课内课外都是要好好刷题就行，语文必须得是两手抓。其次，语文素养的提升，对于孩子成绩的提升，具有滞后性。哪怕家长从一开始就知道课外素养的重要性，但是，课外提升的见效过程是有滞后性的。小学语文和初中语文的知识相对简单，考察方式也比较死板，这就导致很多博览群书，有着深度思考的孩子，课内成绩未必高过那些，好好听课但是课外不读书的孩子，这是这个语文素养提升的滞后性。于是，对于那些课外素养比较好的孩子来说，他们小学甚至初中语文课内成绩可能不是顶尖的。但是，对于那些只搞应试不搞素养的孩子来说，上到高中之后，高中语文的变化会让他们立刻傻眼。高中语文和初中语文相比起来，不仅仅是难度的增强，更重要的是思维方式的全方位的提升，绝对不是背诵套路能够应付的，必须要有特别强的共情能力，需要有真正的文化素养和人文底蕴。小学初中阶段积累素养对考试成绩的提升不明显，但是一旦家长发现孩子素养不够的时候，就已经来不及去补了。所以语文为什么难，难在必须应试素养一起抓，两手都要硬。,84,5,128,江苏,南京,江苏,中国
18,5011217724738426,在繁茂的路上,2024-03-12 21:41:12,问问自己，尽全力了没有作息有些紊乱，导致上午写的慢，也是卡壳了，要更换场景。到下午时，写完6000字草稿，改文3篇正文6000多字的正文，晚上再写2000字草稿。虽然并不认为自己状态很好，但是日常完成6000字草稿同时改6000正文，已经没有压力，接下来要挑战日写8000字草稿，到目前还有些困难，但是并不大，本月有完成的可能。昨日观看人数1人，收益为0。下午的时候，我在问自己，是否尽了自己最大的努力，如果穷尽全力，依旧是这个结果，那自己就该反思这条路，但是我并没有拼劲全力，还有很大的余力，时长偷懒懈怠，给自己找寻借口，所以，先拼劲全力后，再考虑是否有天赋以及这条路是否适合自己。#小说##写作#日常 延边,0,0,0,吉林,延边朝鲜族自治州,吉林,中国
18,5011062858451399,夏仁炒饭,2024-03-12 11:25:49,这是我2016年给一位读者朋友回复的私信，后来过去了八年，我们没有再私下联系过，直到前几天她再一次给我发私信，告诉我，我的这句话支撑了她八年，这八年她都坚持写了下去，一直在写作，不管遇到怎样的困难都因为这句话没有放弃。妹子写了好长好长的话对我说，我看完都哭了。但你们知道我当时看到这些我第一时间是什么想法吗，就是我真的庆幸当初的自己看到了她的私信回复了她的私信认真告诉了她我对她的感谢和期待，把这句话说给了她听。我还很后怕，如果当初我没有看到她的私信，或者我没有回复，或者我冷淡应对……那她在遇到一些困难的时候，是不是就少了一些支撑她走下去的力量？我就想啊，真的是这样啊，就是你永远不知道你的一句话会给一些人带来多重要的力量，而这也让我更加明白了，一定要认真回应每一位读者朋友的心意，一定要给予她们最大的鼓励。真的，真的很庆幸！庆幸自己当初认真的回复！,0,11,29,山东,青岛,山东,中国
18,5011151370847731,峡谷2021,2024-03-12 17:17:32,这个王八蛋跟莫言老贼一样，夸张夸大了事实，他们就是带着仇恨时政写作，三年困难时期整个国家是很艰苦，说饿死三千万人纯粹是造谣，应该抓捕起来判刑！,0,0,0,江苏,南京,江苏,中国
18,5011119691268723,怪物失格tyz,2024-03-12 15:11:39,最近构思了一篇小说（应该不能说最近，具体时间大概在去年吧）大纲部分完成了 20%，第三部分构思的非常困难，目前心情十分糟糕(ಥ_ಥ)，等下一篇小说构思到第三部分的时候我一定要一口气写完，分成一点一点地写太难为人了我决定从今天开始记录一下我写作期间的种种情绪以及写作进程，之后等这篇文写完的时候，我可以再回忆一下（这几年记性蛮差的，上一篇文竟然是 20 年写的，我明明记得是 23 年写的啊）PS ：我在开头写这篇文是去年构思的，确实也不一定，我这个记性真的非常差，但我的记忆告诉我是去年，那就先认为它是去年吧૮ºﻌºა总而言之，写作的过程虽然很痛苦，但回头看看，是能感觉到幸福的，我想把每一点幸福都记录下来，我不想忘记这些(っ•̀ω•́)っ✎⁾⁾最近情绪特别差特别差，但我觉得不能因为情绪差就不继续写了，所以我必须加油，等下可能还要去接我弟弟放学(ง•̀_•́)ง，收拾一下，可能要等到晚上才能开始奋斗了(╥╯﹏╰╥)ง不过没关系啦，我准备今天晚上熬一个大夜，把第三部分完成，不能再拖啦ヽ(`Д´)ﾉ我一定可以的！！(๑•̀ㅂ•́)و✧,0,0,1,河北,邯郸,河北,中国
18,5011055059144362,上海译文,2024-03-12 10:54:50,在“离散的人，寻着故事回家”思南读书会上，#古尔纳# 谈起写作的困难。这引起了同为作家的 #孙甘露# 的共鸣，他回应说：“我觉得写作的困难就像人生的困难是一样的，因为写作就是要处理你人生所遇到的各种问题，人生有多困难，写作就有多困难。”#古尔纳中国行# 上海活动回顾 上海译文的微博视频,19,7,33,北京,北京,北京,中国
