页码,微博id,微博作者,发布时间,微博内容,转发数,评论数,点赞数,发布于,ip属地_城市,ip属地_省份,ip属地_国家
14,5007687310115563,满马春愁压绣鞍,2024-03-03 03:52:36,试图看点戏曲志但完全不懂二胡定弦……戏曲类书籍在中小学生科普读物和需要有工尺谱基础的学术著作之间不能有个中间地带吗🥲我用西贝柳斯模拟唱书调的样子真的很狼狈 ,0,0,0,上海,上海,上海,中国
15,5007600796308100,张明强-紫砂壶的那些事儿,2024-03-02 22:08:49,紫砂艺术 春节到朋友家去拜年，顺便了解交流一下紫砂壶艺术收藏和市场行情，从初三到今天跑了好几家，尤其是与壶二代壶三代的交流颇有心得，今天，与一位有名的壶二代谈及紫砂原料，说实在的，从前几年出版的几本关于紫砂泥料的书籍来看，我觉的太缺乏学术水平，很多全是以讹传讹，从出土的北宋紫砂残器标本来看，这几本书并未有更多的涉及，更没有深度分析，正确地说，现在说的“紫砂原矿”这个词是现代生造的，丁山人一直以来只说紫砂泥，紫砂矿是近代矿井开挖后才出现，在1960年代以前，紫砂原料取自于露天采场，并无矿井一说，象露天煤矿一样，从地表取材，所以，什么深井老紫泥、某革原矿紫泥，本山深矿段泥等等都是最近出来的新名词，我们现在直播间里吹嘘的网红泥料“底槽清”，更是有了紫砂矿井以后的产物，在1996年顾老离世前是没有这种叫法的，现在直播间里到处是苏门答腊青、龙背金砂，龙血砂等如雷贯耳的鲜艳名字，那是噱头，其实，紫砂泥是一种朴素的无机非金属硅酸盐物质，主要成份是二氧化硅，以及三氧化二铁，钙、镁、铅等，我们现在谈及的烧成收缩率以前叫烧失量，主要指这些物质在高温中的挥发，那些人为添加的金属氧化物更容易挥发。和一位壶三代交谈做壶的基本功，我说起来很简单，就是打泥片围身筒，拍打造型，再镶接附件，最后用明针完美整个壶身的一个过程，没有九九八十一道工序那么复杂，做壶如木工无异，与铁匠一般，仅仅是一种手艺，手艺无法遗传，技艺更无克隆，做好壶不容易，没有一个人不经努力靠父辈就会自己就能捏出一把好壶，学做壶只要三个月，做好壶需要一辈子。所以，我与壶二代壶三代他们交流，就一句话需要重复，即做壶如做人，一辈子的生命来不得半点弄虚做假，做壶，可以平凡一辈子，也可能做的很出秀，父母的艺术基因无法留住的话，子女有选择的权利，做不好壶是悟性不到，没有悟性就快点改行，这才是明智的选择。#非物质文化遗产#紫砂壶拍卖,1,0,6,广东,深圳,广东,中国
15,5007434201958562,新浪电影,2024-03-02 11:06:50,#大卫波德维尔去世# 据外媒报道，著名电影学者大卫·波德维尔去世，享年76岁。大卫·波德维尔是美国当代电影理论家和作家，著有《电影艺术》《世界电影史》《电影风格史》等重要的学术著作，这些著作也是许多电影人对电影理论的入门书籍。 ,19,7,54,,北京,北京,中国
15,5007536069018060,用户5699556403,2024-03-02 17:51:37,《通往奴役之路》作者哈耶克。自1944年出版起，该书已成为历史上最著名、最受欢迎的自由主义理论书籍之一。截止2010年，该书已被翻译成超过20种语言出版，累计销量突破二百万本，是二十世纪最具影响力的学术著作之一。 ,0,0,1,上海,,上海,中国
15,5007466910189234,Gattuso_Richard,2024-03-02 13:16:48,时效性很强的书，增加阅读量的同时体会作者写书的目的和行文角度，但没有必要买，因为没有反复阅读的价值，更不具备收藏的属性 文学名著和学术性书籍则刚好相反，可以买回去精读并反复阅读。  以前买了不少冤枉书 苏州·西西弗书店&amp;矢量咖啡(华润吴江万象汇店) ,0,0,0,江苏,苏州,江苏,中国
15,5007186336680336,南方米粉肉,2024-03-01 18:41:54,有个看理想的节目《倒霉人生生活指南》，来自袁长庚老师，社科类音频，每集都推荐一些文科类偏学术的书籍，我是真没想到每一集基本都能把我听哭，感觉能被顺到炸飞起来的毛毛～是不是日子过的太切题了。 ,0,1,1,北京,,北京,中国
15,5007122391634603,杂志社--马老师,2024-03-01 14:27:49,学术期刊论文发表《造纸信息》 月刊  3月征稿  4月出刊 国家级  知网   方向：剪纸、纸质书籍、纸材料、手工纸、纸巾品牌、衍纸艺术、纸张材质、纸包装 ,0,0,0,河北,石家庄,河北,中国
15,5006911826822199,blmfc,2024-03-01 00:31:06,在寻觅新书 本来想读《瓦尔登湖》，但是从他前面大段类似于学术分析的导读和酷似民族志的第一章劝退了我 现在是真的半点都看不进带有学术色彩的书籍了 ,0,0,0,云南,昆明,云南,中国
15,5006821202859163,陈昌文,2024-02-29 18:31:00,陈昌文书籍，是一条实体线路，是成果物线路，是制作线路，是基于陈昌文音频文字，书籍，价值观的线路，本质上是陈昌文方法，是打造陈昌文的学术体系，所以我们会出一条全面介绍陈昌文老板社群，陈昌文读书会，项目的模型。所有粉丝，全员参与的各项目手册，业务手册，企业手册。这样，我们在做这个书籍的时候，就抖音，以及全网所有地方布局。这样，每一天，都是根据陈昌文的已经有的核心，不断的在全网浪潮式发售了。我们的讲课，以及视频，直播，都可以记录这个，同时就营销了。这样，所有编辑，翻录人员都在开始盈利了》-陈昌文,1,0,0,上海,上海,上海,中国
15,5006755254240294,offer播报酱-北美,2024-02-29 14:08:56,哥伦比亚大学的BUSINESS &amp; ECONOMICS LIBRARY（商业与经济图书馆）是专门服务于商业和经济学科领域的学术资源中心。该图书馆收藏了大量与商业、经济学、金融学、管理学等相关的书籍、期刊、研究报告和数据库资源，为哥伦比亚大学商学院（Columbia Business School）以及其他相关学科的学生和教师提供了丰富的学术资源支持。除了丰富的藏书和学术资源，BUSINESS &amp; ECONOMICS LIBRARY还提供了一系列现代化的设施和服务。例如，学生可以在这里找到宽敞的学习空间、电脑室、多媒体设备等，以满足各种学习需求。此外，图书馆还提供了专业的参考咨询服务，帮助学生和教师解决学术研究中遇到的问题。值得一提的是，BUSINESS &amp; ECONOMICS LIBRARY还非常注重数字化和网络化建设，提供了大量的电子资源和在线数据库，方便用户进行远程访问和在线研究。这使得学生和教师可以随时随地访问这些资源，进行学术研究和学习。,0,0,0,天津,天津,天津,中国
16,5006458563594236,雅思天后刘薇Vicky,2024-02-28 18:30:00,在雅思备考书籍中，剑桥雅思真题集绝对是最重要的一名，它是雅思官方出品的备考练习册，需要注意的是从剑11开始，A类（学术类）和G类（培训类）是分开成册的‼️里面的题目都是雅思官方从之前的真实考题中抽取成册的，虽然有一些“小瑕疵”，但它要说自己是和雅思考试最贴近的第二名，那就没有书敢称第一名了！每本书，都意味着之后考试的走向，相当具有参考价值！给大家准备了雅思真题完整版，戳图中二维码领取哦！#高途雅思##雅思必备词汇##高途雅思#出国留学英国留学#雅思##寒假##龙年大吉##留学##雅思天后刘薇##英语##雅思攻略#,1,1,3,北京,北京,北京,中国
16,5006392979096345,不可爱屁屁,2024-02-28 14:09:23,#拍拍屁屁#  鹤十四真的是一个特别特别好的人跟她借了本文学术语词典，用了一下感觉很好用问她要链接打算自己买一本，她说你拿去吧，需要大于收藏，书籍的价值是这样的 我鼻子栓栓的😢鹤门😢 ,0,4,27,江苏,南京,江苏,中国
16,5006374054660435,白白noda酱,2024-02-28 12:54:11,看过一些国内的社会学书籍，都比较学术，好奇法国的青少年社会学是以什么方式传播的ne,0,0,0,湖北,武汉,湖北,中国
16,5006368992398938,汴人郭威,2024-02-28 12:34:04,查了一下，传输助手里都是学术资料、读书笔记、PDF书籍和磁力链接，问题不大。,1,7,4,天津,天津,天津,中国
16,5006061210437619,商务印书馆涵芬楼文化,2024-02-27 16:11:03,#好书推荐##新书推荐# @商务印书馆 《书虫杂记》：一场关于书籍、作者、写作的冷知识大会，一次有趣、古怪、迷人的书中乐趣大搜罗，抽丝剥茧，探索所有跟书有关的细节！·想知道墨水是怎么制成的吗？·哪些学术著作改变了这个世界？·藏书票到底是什么？·著名作家都哪些失传了的作品？……抽丝剥茧，探索所有跟书有关的细节！《书虫杂记》中充满了罕为人知的事实、稀奇古怪的清单和易于阅读的知识片段，你能在这里了解到纸张和书皮的历史、窥探禁书背后的故事，以及哪种羽毛适合做成笔、被拒稿过的畅销书作家、如何识别之前的初版书和签名本……并且远远不止这些！布面书脊、精致小巧，方便随时翻阅，获取意想不到的知识。,1,1,6,北京,北京,北京,中国
16,5005658494338938,-Tsavorite-,2024-02-26 13:30:48,#工地日语自汉化# K太太的新短漫....[吃馕]耗油道理，妙论派之光竟然将市面上难得一见的实体书籍叫破书的原因......我们学术家庭是这样的... ,0,2,1,广东,广州,广东,中国
16,5005475176775762,真性異言,2024-02-26 01:22:21,国内这类学术性书籍还挺多的，没想到这本也有中译。 ,0,0,0,福建,福州,福建,中国
17,5005472514443330,是星不是伯乐,2024-02-26 01:11:47,有时候喜欢的东西太多是一种苦恼。我平等的喜欢着所有的爱好和我的生活，喜欢我的学术喜欢我的工作。我愿意花很多时间在我喜欢的事上，但有时候也不得不费力气在不情愿对我也毫无意义的事上。最近写论文进度很慢，我想起开学的第一年我还可以做到课外一年读三十多本法学与哲学类的书籍➕三四百篇中英文献，而现在空闲时间已经完全不读书了，有些汗颜。今年定个小目标业余的时间还是要像大学一样，多看书多锻炼，等返校就准备减脂了。,0,2,7,江苏,南通,江苏,中国
17,5005381656382314,沧海一鳞不系舟,2024-02-25 19:10:45,我都不敢想象看完了我会成啥样的人从左到右依次为：《物种起源》，【英】达尔文著学术著作，人类文明的重要革命；《鼠族》，【美】阿特·斯皮格曼著漫画，唯一获得普利策奖的美漫至高神作；《中国哲学史》，冯友兰著学术著作，最经典的中国哲学入门书籍；《荷马史诗（伊利亚特、奥德赛）》，【古希腊】荷马著长篇史诗，西方四大名著之首；《白痴》，【俄】陀思妥耶夫斯基著小说，俄国文学的代表作；《机器人大师》，【波兰】斯坦尼斯拉夫·莱姆著科幻小说，科幻文学离诺贝尔文学奖最近的一次；《阿莱夫》，【阿根廷】博尔赫斯著短篇小说集，拉美文学的旗帜之一；《局外人》，【法】阿尔贝·加缪著小说，存在主义文学的代表作；《平面国》，【英】埃德温·A·艾勃特著科幻小说，超前一个时代的科幻巨作。,0,0,1,四川,成都,四川,中国
17,5005349705486689,一路向上爬的蜗牛,2024-02-25 17:03:47,考研复试前，这些内容你都准备好了吗？1、英文自我介绍2、中文自我介绍3、综合面试常考题（中&amp;英）4、专业课面试题找了没5、行业热点问题准备没6、学术期刊看了没，核心观点掌握了没7、导师研究方向弄清楚没8、专业领域书籍看了一本没9、简历写了没you see see you one day day！！ #考研##考研复试##研究生录取通知书#,5,0,4,北京,北京,北京,中国
17,5005314291667047,旧剑满霜雪,2024-02-25 14:43:04,作为一本快800页的学术书籍，意外的很好读，且有趣。尽管题目是研究唐代的舶来品，实际上描写的却几乎是整个盛唐时期的万象风物，穿越者必备（但要警惕携带行李超重） ,0,0,3,重庆,重庆,重庆,中国
17,5004984510579675,怀远如风,2024-02-24 16:52:38,在沙溪～    把书店引入沙溪的乡下村里，沙溪的领导有点意思。        先锋书店被称为网红打卡地，可是书店里的书可不一般，关于云南民族学方面的书很有力道。    网红打卡地与有学术书籍的书店背靠背，好玩。    我们拍了相片，也买了很多书托运回去了。    还逛了镇上国保兴教寺，看了六百年明代的壁画。 大理·先锋书店(沙溪白族书局),0,0,4,云南,大理,云南,中国
18,5004515121826403,小虎8461,2024-02-23 09:47:27,他们没有书号限制吧 书店书馆是都可以出版？我们的书号总量控制（最近还在缩减） 按理说出书是很难的，但是大家不关注出书，看来大家都默认书籍专著的含金量不如期刊。从另一个角度来说，学术期刊论文是学术共同体的流通物，而书籍流通则可能既有学术共同体也有大众社区，所以大概国内学术界只想自己玩,0,0,0,湖北,武汉,湖北,中国
18,5004349369485240,ShuangshuangCai_Lola,2024-02-22 22:48:49,看学术书籍看到激情澎湃 甚至想落泪！ 真的写的太好了 他是法国人：弗雷德里克·马特尔  ,0,0,0,上海,,上海,中国
18,5003944504591822,思维螺旋,2024-02-21 20:00:01,屠龙的胭脂井  管理学书籍发明了很多官方学术词是为了什么？  视频中说得很直，但确实是这么回事儿。 思维螺旋的微博视频 ,15,8,103,北京,北京,北京,中国
18,5004300518686986,颜牧之,2024-02-22 19:34:41,这年头，卖书的不容易，卖学术书籍的更难。唉！ ,0,0,3,江苏,扬州,江苏,中国
18,5003970773516524,亲爱的蕾宝,2024-02-21 21:44:23,我忘记为什么买了这本书，这是一本是关于日本文化的学术研讨书籍，本来感觉很复杂的日本文化，被作者剖析的很直白易懂，第一次看这种类型的书，比较感兴趣的是书中关于欠恩与报恩的讨论。从前阅读的范围比较狭窄，一般选择的都是自己感兴趣的，以后扩展一下类型也蛮好。我喜欢别人推荐阅读，任何人推荐我的任何书，我都会去看，这和我其他方面不太一样，其他事情我偶尔有点看人下菜碟，心里不屑一顾，但是在读书上我发现，任何人推荐我的任何书我都会认真去读，不管好坏心里也不会微词，可能我是真的挺喜欢读书吧。,0,0,0,辽宁,大连,辽宁,中国
18,5003795471271449,炎炎夏日1呀,2024-02-21 10:07:49,#新年开局真有一套#  @天猫  天猫新春开门红，新年开局真有一套！我年后回校行李箱带的东西是一本厚厚的专业参考书籍，里面充满了知识的宝藏和学术的深度。这些书籍是我的求学之路的指南，它们将陪伴我度过每一个学业的挑战，让我不断汲取新知识，在学海中航行，探索未知的辽阔领域。 ,0,0,0,广东,惠州,广东,中国
18,5003556655990890,桃子期待,2024-02-20 18:18:51,#豫践青春我是主角#作为图书馆志愿者，我深深体会到了图书馆对于社区和个人的重要性。图书馆是知识的宝库。在这里，人们可以自由地探索各种各样的书籍和资料，无论是学术研究还是休闲娱乐，图书馆都能满足大家的需求。作为志愿者，我有幸亲眼见证了无数读者在这里找到了他们所需的答案和灵感。其次，图书馆是社区的聚集地。在图书馆里，不同年龄、不同背景的人们聚在一起，共同分享阅读的乐趣。我也在这里结识了许多有趣的朋友，和他们一起参与各种活动和讨论，让我的生活变得更加丰富。在图书馆的每一天，我都能感受到知识的力量和文化的魅力！,0,1,0,山东,德州,山东,中国
18,5003538105631347,阿骀,2024-02-20 17:05:08,#阿骀推书# 友人节前赠给我一套毛汉光先生的《中国中古社会史论》与《中国中古政治史论》 。这书在学术界名气很大，我觉得应该属于比较难啃的那一类书籍，就准备清闲时再读。未曾想初四的时候头疼发烧，干咳难以入睡，也不知道是二阳还是甲流，反正退烧后感觉身体并不是很难受，就决定赖在床上看书修养。结果到昨天，居然把《中国中古社会史论》给翻完了！是的，我只能承认是翻完了。这书内容丰富到需要慢慢消化吸收，甚至需要一读再读，不然就是暴殄天物。我个人对于这本书的翻后感是：很惭愧很遗憾这么晚才遇到这套书。在我狭隘的阅读经历中，感觉毛汉光先生的这套书就如同田余庆先生的《东晋门阀政治》一样，不但是49年之后最好的历史学术类书籍，也是读史最容易入门并切切实实学到东西的书籍。在这个时代读史学书籍，除了要有相对客观的史观，再就是需要避免猎奇、翻案或是所谓“新解”。这些东西对出于好奇而开始读文史的人实在是太容易带偏了。像《中国中古社会史论》这种书，大部分论断其实都是正史中比较中直的结论，但史料的梳理与推导过程，让你叹为观止。有时候，牛逼的历史学术，无异于高明的推理小说，都知道最后谁是杀人罪犯，但魅力却在推导论证的过程。抛开过程或者只谈某个历史人物的行为决断，会让今人读史产生很多困惑，而历史是个立体并漫长的过程，只截取是非结论会容易形成演义连环画倾向，那就不是真实的历史了。其实，很多响当当有价值的文史书读起来很难有愉悦感，比如杨宽先生《西周史》，尽管老先生治学严谨，很多文物考证都做到了原文引用与今译同步，但整部书依然读下来很伤神。但毛汉光先生的《中国中古社会史论》不是那样，特别是他笔下关于魏晋南北朝的一些章节，那简直让我读嗨了。在老先生之外，我只在读顾诚先生的《南明史》与田余庆先生的《东晋门阀政治》有过这种感觉。最后再次着重推荐一下毛汉光先生的《中国中古社会史论》与《中国中古政治史论》，我甚至想用伟大二字评价这套书。,3,0,5,辽宁,营口,辽宁,中国
18,5003440270871153,幽兰葵ROSTL,2024-02-20 10:36:23,#艾琳喵姬作品研究#文学作品《巫咒》深圳·南山·文创微博南山图书馆馆藏在二楼的一批和巫术有关的人学术书籍，对于理解接近硬核奇幻、魔幻文艺作品有很大的帮助。以前读《巫咒》，感受到的是离奇、想象力，前后照应的行文，故事线索的透明，无边无际的天马行空，隐隐透出的空洞飘渺、虚无感。再读《巫咒》，已经看过系列和魔法、巫师有关的学术知识，也结合现代科学解说，却发现通篇语言文字蕴含着喷张的力量，掷地有声。借助绘画式技巧，凄楚、精美、炫彩的画面一副接着一副，无一不是在刻画资深巫师高超的巫术技巧之下的全盘设计、布局，呈现触整体和局部的关系，点、面和线索，空间层层叠加扩大，结构缜密稳固，形成精心编织的网，那是渔夫选址、抛撒、静候、垂钓过程的耐心和毅力，收网时候的胸有成竹，娴熟手法技巧，结局丰硕，不可一世的傲人业绩。巫觋是完胜者的能量集合体，所有努力成就他的绝世作品——堪称完美无瑕的情人。江山美人，权力和财富，一切尽在他的巫咒之下。《巫咒》在开篇文首给故事定下基调，表明对故事系列战争的发生的动机和结果的批判性态度，试图说明建立在掠夺、摧毁一切之上的私有野心的力量极其强大，以及这代表一类暗黑能量对安全、和平带来的巨大隐患。（作者擅长叙写恢弘、变幻场景）巫术的魅惑能量有时足以攻克最坚韧的意志，旷世一般的牺牲也会随之而来。和《巫咒》战争类似的能量较场，几乎贯穿整个人类史，细化而言，也许就近在咫尺。一个进化了的职业和名词：随着语言的进化演变，当我们把巫术重新定义，巫师也因此获得无数新的的职业名称？幽兰葵文化兰花、莲花、向日葵、郁金香和玫瑰,1,0,0,中国,,,中国
19,5003433529051322,某佯上树,2024-02-20 10:09:35,《人类简史》已阅…后1/3有点啰嗦有点点水，前面还是不错的…记得当时在北京最后一家公司，刚进去就是尤瓦尔的采访节目，结果他的书在时隔多年后的今天才念完一本…唔…人类啊！就是一场想象呢～《鸭川食堂》已阅…念完比较学术的书籍，得来一本温暖的小书来过渡一下，让脑子也歇歇…典型日式文学的细腻，有点鸡汤成分…我愿称之为-侦探版深夜食堂！嗯…#爱·阅读#,0,0,0,云南,昆明,云南,中国
19,5003304056652445,伞响响inBWV639,2024-02-20 01:35:07,当时stage 3写论文的时候不懂这个道理，在list里选书籍选了一本最难读的印度人写的东西，啃了一个月只看了一半而且硬是没看懂作者到底在讲什么（。。。）最后也是瞎扯一通结束了这篇学术垃圾的一生 ,0,0,1,广东,东莞,广东,中国
19,5003098785319812,段鑫明,2024-02-19 11:59:26,四川文化传媒职业学院的图书馆宽敞明亮，书籍丰富多样，每次走进这里，我都能感受到浓厚的学术氛围，满足我对知识的渴求。 ,0,0,0,四川,南充,四川,中国
19,5002896540437553,一抹薄酒鼠乐宝,2024-02-18 22:35:47,十分钟之前我在搜b。d。s。m。的科普 十分钟之后我开始阅读相关学术书籍 博大精深，海底捞月啊 ,0,3,0,山东,潍坊,山东,中国
19,5002425615778354,Miscellanea_wiwikatya,2024-02-17 15:24:30,这一款MT是回购的，上一卷用了至少有五六年了……胶带用做书签还挺方便的（学术书籍还是要用标签贴） ,0,5,1,黑龙江,哈尔滨,黑龙江,中国
19,5002420406715350,儿子儿媳在日本,2024-02-17 15:03:48,Parades剧照解禁 他在看的这本书叫《正多胞体》，搜了一下，竟然是几何学理论书！纯纯学术书籍！这什么人设啊，不是前银行职员吗？怎么变鬼之后开始研究纯数了，死了都这么有学术热情，本学术混子有点汗流浃背了 ,0,2,1,英国,,英国,英国
19,5002216576647803,唐达鲁士,2024-02-17 01:33:51,书籍：霍英东与抗美援朝战争  李敏生 纪实文学 很一般，非严肃的学术著作，仅供参考 ,0,0,0,山东,烟台,山东,中国
20,5002129748264296,黄义军_dno,2024-02-16 19:48:50,武汉几诺酒店大堂的图书馆。没想到在这座“好吃”的城市的经济型酒店看到这么多学术书籍，此情此景与我四十年前由武汉搭乘轮船去下江读书所见已有云泥之别。 ,0,2,10,湖北,武汉,湖北,中国
20,5002098436210716,知知为吱吱不吱为不知,2024-02-16 17:44:23,吴景超 这本经济学术类的书籍，文字里彰显的却是大儒的风骨，好。 ,0,0,0,广东,广州,广东,中国
20,5001991822772039,马鸣谦2024,2024-02-16 10:40:46,有朋友认为智能手机进入生活的近二十年缺少创造性的科技和文化艺术。可能吧。我却看到了另一种优势（或便利），反倒觉得技术带来的（思想、学术、书籍、影像、音乐以及其他资讯）的资讯充分获得，抹平了以前资讯垄断的少部分人的非天然优势，或将极大刺激未来的创作思维。问题是每个人的抉择，所以，保持生活的留白、保持适度隐居以及持续的阅读思考是有必要的，不但促进思维，也有益于身心的健康状态保持。,0,0,1,江苏,苏州,江苏,中国
20,5001671605751196,LaTeX_工作室,2024-02-15 13:28:20,用 LaTeX 排版的学术圈清流的出版社-德国语言科学出版社，所有出版书籍 LaTeX 代码均可免费获取，快来看看吧！ 用 LaTeX 排版的学术清流出版社，全书 LaTeX 均可免费获取 ,2,0,3,浙江,杭州,浙江,中国
20,5001489233217795,木头长星,2024-02-15 01:23:39,以前摸着纸质书总是会有一种骄傲感，仿佛我真的又拯救了一点点夕阳行业于倾塌。花了很久才说服自己承认，我确实被这种“非实体书不算阅读”的形式主义绑架了。电子书有电子书的好处啊，尤其是看一些学术性很强的书籍，他人的批注对我自己的理解也有助益。单枪匹马地看学术文章则会感到万径人踪灭的孤独，特别容易读读就放弃了。除此之外就是今晚，实体书的翻页对于一个穿短袖睡觉的人来说实在痛苦：胳膊必须伸在被窝外才能利索地翻书📖行之有效地利用一切资源是人类生存的基本技能，高低要把老祖宗留下的基因传承下去。想看实体书的时候就看实体书，想看电子书就看电子书！没有高低贵贱，也没啥优越感。东西看进脑子里，对读者产生一定程度上的影响，才是第一要紧的任务。,0,4,4,浙江,宁波,浙江,中国
