页码,微博id,微博作者,发布时间,微博内容,转发数,评论数,点赞数,发布于,ip属地_城市,ip属地_省份,ip属地_国家
37,4949996376425838,排球评论员-贱言贱语,2023-09-25 23:09:25,从某种程度上说，我真的觉得学习是一件重要的事情。在你学校接受教育的过程中，其实逻辑思维能力在得到锻炼，还有动脑解决问题的能力，多多少少都会有些提升。郎妈为什么能干，专业能力强是一方面，郎妈接受高等教育，学习过程中提升了自己的观察力，洞察力，有助于专业能力的提升。我朝这些男教练吧，就是入了这个行，在我看来和以前职工分流安排到岗位没什么区别。我无法理解的是，从事专业工作二三十年，还和个笨比一样，没脑子,6,50,370,上海,上海,上海,中国
37,4949970236736107,雅思聼力,2023-09-25 21:25:33,TED演讲双语文稿：如何训练一个人的逻辑思维能力？    考前名师精准雅思预测教育☞网页链接 ,0,1,4,湖南,郴州,湖南,中国
37,4949513732358687,娶妻娶贤嫁人嫁心,2023-09-24 15:11:33,教育的目的不是让一种动物能够掌握更多的技能和知识，而是让人知道自己为何是人，怎样才能成为一个合格的人，所谓的人才，人在前，才在后，一个人无法称之为一个品质合格的人，何谈什么人才？一个正确的人，才能做出正确的事情，因此教育的核心是德育、正确的逻辑思维、是独立思考和独立解决问题的能力,0,0,0,山东,济南,山东,中国
37,4949072496298084,浪漫在骨子里的法律人,2023-09-23 09:58:15,权力的游戏，权力的山头遍地都是。常识教育严重缺乏，逻辑思维严重缺乏，公民意识严重缺乏……,0,0,8,广东,深圳,广东,中国
37,4948726562688120,兰时见录,2023-09-22 11:03:38,不和蠢人浪费时间，逻辑思维教育真的很重要 ,0,0,0,陕西,西安,陕西,中国
38,4947791476424809,素溯塑_249,2023-09-19 21:07:55,好课推荐：傲德数学思维双师课全年班傲德数学思维是一种数学教育方法，旨在培养学生的逻辑思维、抽象思维和问题解决能力。它通过引导学生解决一系列具有挑战性的数学问题来训练他们的思维能力。比如教孩子们拆题，就是根据题目中的已知条件变得可视化，用一些图、表的方式先表达出来，这样原本晦涩的问题，一下子就形象了，孩子们特别好理解。而后会教孩子们在解题中，一步步的教孩子们，把形象化的问题落回到列式计算、得出结论和结果。,0,1,0,广东,汕头,广东,中国
38,4946718116546825,赞赞娱乐君,2023-09-16 22:02:47,网友总结父母那些令人难以接受的逻辑思维★父母必看系列 ★父母★中式教育 赞_赞_赞的微博视频 ,0,1,7,内蒙古,呼和浩特,内蒙古,中国
38,4946412707774956,案件学,2023-09-16 01:49:12,什么力量“阻止”人文启蒙？在中国，多因一果，且多因之间彼此作用形成茧房，把人们包裹在内持续麻木，其主因是教育不传授形式逻辑思维工具，次因政治制度优势口号浸淫导致麻木，最后就是赶往唯一留下的缝隙一一赚钱发财。,0,0,3,上海,上海,上海,中国
38,4945955319450067,微创泌尿外科张医生,2023-09-14 19:31:42,这枝签是预计我必将把过去放下，去追求崭新的明天吗？…我今天说认知是智力问题，而智力不仅仅是天生脑子转的快，更重要的是我们从小受到的教育和周围环境的影响，形成的我们的思维和行为做事的习惯，逻辑思维的 能力，再一次验证这难以改变，如果是正向合理的，那就会积极向上👆，相反，一堆人都在错误的认知里，那正确的就会被认为格格不入…我今天还说：每一次，都不要忘记我们行动的目的，目的是主要，其他是顺带，而不是到了跟前让临时的诱惑影响了我们主要的目的，走到偏道上去了…#思维##爱医日# 日本,0,1,1,日本,,日本,日本
38,4945454456113157,financec,2023-09-13 10:21:27,美国佬体育打不过非洲小国和叙利亚，应试教育和道德经残害俄国人是原因。  道德经强调打不赢投降，丘处机一看蒙古人兵强马壮就投降蒙古，还骗成吉思汗钱财。  应试教育则天天做题追分数，不培养逻辑思维能力和动手能力和身体健康和心理健康，小孩智力方面能把聪明蛋小孩培养成蠢猪，身体还差。 ,0,0,0,湖南,湘潭,湖南,中国
38,4944403980617023,神勇小白兎,2023-09-10 12:47:14,虽然日本小学生算得快些，但是从逻辑思维角度看，中国小学生的算法好像更适合教育。 神勇小白兎的微博视频 ,2,3,9,广东,广州,广东,中国
38,4944309456995304,最有价值华人,2023-09-10 06:31:38,我们常说要打好基础，拼命学语数英物理化的知识，小学就学别人初中教的知识，先进国家初级教育教的对人的基础意识、逻辑思维、做人的教育，厚厚的教科书，那叫基础。 ,0,0,1,广东,江门,广东,中国
39,4941974567913783,白日梦想家924,2023-09-03 19:53:37,强烈推荐成公教育的网课，特别是高老师的逻辑思维清晰，恍然大悟！ ,0,0,3,河南,安阳,河南,中国
39,4941845895579803,Ingreswade,2023-09-03 11:22:19,一个暴论，相对和平的年代，真正聪明的人（尤其指能在垃圾的教育中领悟基本的逻辑思维能力和并被激发求知欲的）基本都去搞科学研究了，去从政的大多只能是二三流人士，因此，指望政府能科学合理高效是完全不现实的。总而言之就是，有能力实践的人在搞理论和键盘政治，有权力实践的人缺乏必要的知识和思维素养。,0,0,2,江苏,南京,江苏,中国
39,4941223792216024,江门励步儿童成长中心,2023-09-01 18:10:18,表述一件事词不达意，没有逻辑；不能发现事物之间联系，角度单一；遇到困难不知所措，专注力差……不少家长在教育孩子的过程中，或多或少都遇到过这些问题，其实这可能是需要培养逻辑思维能力了！逻辑思维到底是什么？火花思维的李巍巍老师是这样说的👇👇👇 ,0,0,1,广东,,广东,中国
39,4940560781022501,未来爱一一,2023-08-30 22:15:44,#涨知识##亲子教育#育儿 别让孩子玩手机了，陪孩子玩玩脑筋急转弯，培养孩子逻辑思维和应变能力。 未来吖-的微博视频 ,0,0,0,辽宁,本溪,辽宁,中国
39,4940193468781531,financec,2023-08-29 21:56:10,美国应试教育愈演愈烈，美国小孩身体素质和心理健康水平和逻辑思维能力动手能力强于晚清，弱小。  科技创新能力差，依赖伊朗培养极品聪明蛋科学家. 但伊朗枪决几个美国极品聪明蛋科学家之后，从伊朗回到美国的极品聪明蛋科学家变得不多。 ,0,0,0,湖南,湘潭,湖南,中国
39,4940187069322328,朝如青丝丝,2023-08-29 21:30:44,文章里说父母这辈人是心理疾病严重爆发的一代：都是以爱你之名控制孩子，抱怨孩子，偷窥隐私。嘴上永远都在说都是为了你，这可能是因为他们出生的年代，教育资源稀缺得可怜，根本没有性教育、情感教育、心理教育、逻辑思维培养，这造成了他们的思维里有很多逻辑缺陷和认知缺陷，性格里有非常多守旧且顽固的东西，让他们这辈子很难获得幸福感。活在了文化大革命的时代，血液里流淌着封建思想和贫穷人格。,0,0,2,内蒙古,呼伦贝尔,内蒙古,中国
39,4939764785742245,青苔猫狮,2023-08-28 17:32:43,营地教育 为了逻辑思维，努力 ,0,0,1,江苏,徐州,江苏,中国
39,4939673887312686,financec,2023-08-28 11:31:32,美国应试教育培养蠢猪，身体差，因为天天做题导致身体差还逻辑思维差。 现在父母失业严重，营养也保证不了。  古代俺认识一个美国妹子和她弟弟，父母在新疆种地，苦不堪言父亲就杀了母亲，剩下姐弟两。 这个妹子干瘦的像一根柴火，没吃的。 ,0,0,0,湖南,湘潭,湖南,中国
39,4939024919169021,王大胆很多戏,2023-08-26 16:32:46,到底是因为我胖别人叫我胖子，还是因为别人叫我胖子我才变胖的——我这么多年接受教育建立起来的逻辑思维在无形中崩塌…… 东营·广饶 ,0,5,2,山东,东营,山东,中国
40,4936811909220301,纯爱小兵圆香芹,2023-08-20 13:59:03,久哲不当主教练的锅也能分到无畏这里，啊？都说了没完成九年义务教育的人不能追竞咯！文字阅读理解能力为0，逻辑思维乱七八糟，这可怎么办，现在还在网上蹦跶的，明年中考语文科目不合格那可能要上不了普高了。 ,0,0,0,广东,揭阳,广东,中国
40,4936234759362414,戳肺管子的大实话,2023-08-18 23:45:40,博主说两个IP都是浙江的是小号。我质疑一下，就被拉黑了。 北大毕业的就这水平？就这个逻辑思维能力还教育大V？ ,1,0,0,浙江,宁波,浙江,中国
40,4936017310648623,甜甜地球,2023-08-18 09:21:36,从天才知道认识阿蒲，钦佩于应试教育之外他的知识面之广、逻辑思维之快速严密，也有对于不同职业不同身份的突破，他的人生真的在闪闪发光,0,0,0,湖南,长沙,湖南,中国
41,4934650839957917,抓曙离不是数梨,2023-08-14 14:51:43,真的不想从社会教育历史环境等角度论述“100个数学家里99个都是男性，所以男性逻辑思维很好”这种说法的不合理性了。为什么要设立女子高中心里没点数吗。。 ,0,0,1,天津,,天津,中国
41,4932293682791513,行了知道随便你,2023-08-08 02:45:14,1325.译国译民教育【首知道营销大师届国际高级翻译人才培养研修班】 1324.模型思维【《逻辑思维引导师》5期培训班】 1324.陈奶爸课堂【短视频带货社群】 1323.且曼设计学院【【Nomand】六萌星教你建模】 ,0,0,0,福建,泉州,福建,中国
41,4931072187702576,别人家的毛毛妈,2023-08-04 17:51:27,我们从数学教育中习得了什么？数学家们是这么说的：1. 通过数学的训练，可以让一个人的逻辑思维变得比较强。2. 把所有这些具体的知识忘掉之后，最后能沉淀下来的其实就是数学教育所赋予你的东西。3. 一个小孩能确定他所得的结论是正确的，不是因为他的老师或教科书告诉他是正确的，而是他的内在逻辑能够让他确信他的结论一定是正确的。4. 其它学科没有，唯独数学学科有的：一个叫抽象、一个叫推理。——《被数学选中的人》,24,1,34,江苏,南京,江苏,中国
41,4929532241122120,亚热带沙滩的同学,2023-07-31 11:52:15,这是一个意识很强大的人才会有的逻辑思维，受高等教育这么多年了，你们觉得的你们意识足够强大了么？你们觉得你们的意识足够强悍了么？ ,0,0,0,海南,三亚,海南,中国
41,4928527427967238,苏小懒,2023-07-28 17:19:29,越发觉得，小学、中学、高中都应该把人文教育课，逻辑思维课作为必修课。这几天，我发现很多人的表达非常混乱。没有逻辑，没有重点，要么断章取义要么直接人身攻击，还觉得自己特别有道理。所以，如何对他人观点进行理性分析、思考？如何让自己的表达有逻辑、有独立输出？一定要从小培养孩子的思辨能力。我推荐三五锄的思辨伴读课。通过阅读陪伴，启发孩子的独立思考，在不断累加的阅读输入过程中，逐渐锻炼自己独立输入的能力。以下来自一年级组的孩子们最新分享：哪怕识字量有限，书写中有磕磕绊绊……对于内容、故事细节的把握不输高年级的哥哥姐姐们。孩子们身上的无限潜力——在经典童话、好故事的推动下，也能做到相对完整的内容回顾。连描绘故事的层次感，也已经有一定的“表现力”了。为大家申请了试听课，大家可以为小朋友安排起来啦。【苏小懒专享】50分钟线上直播课+天然楠竹阅读架,12,12,203,广东,珠海,广东,中国
41,4928190634532056,大话崛起,2023-07-27 19:01:11,曾碰巧接触过几个本地排名靠前的大学年轻教师和在读博士，总体感觉局限明显。今天再遇一个经济学在读博士，更惊诧于我们的教育对逻辑思维的藐视。难怪丁磊也如此感叹清北等一干名校生。 ,0,0,0,广东,广州,广东,中国
41,4926540666896626,关中大侠平民财经,2023-07-23 05:44:48,从桂林筏工打人事件看中国人的逻辑思维能力和是非观。一是普遍的逻辑思维能力很差，虽然号称义务教育阶段数学能力很强，但是数学考试分数不等于逻辑思维能力，突出表现在墙头草两边倒，看见刮风就是下雨，网络评论随着不同声音的出现不停地翻转。二是是非观薄弱，对一件事缺乏基本的是非判断，被地域歧视、身份歧视、性别歧视、财富歧视等等固有观念左右，扭曲了本来应有的是非观。有钱人挨打活该，人在外地要认怂，底层贫困大家要帮等想法充斥舆论。中国富强需要先强教育啊。广西那家医院是所有奇葩中的代表。,0,0,2,江苏,无锡,江苏,中国
41,4926280544029344,星夜心语嫣,2023-07-22 12:31:10,妈妈说虽然孩子成绩优秀想知道您孩子未来的学业会怎样吗？从孩子的星盘来看水星木星在学业宫的好配置也与太阳和金星和谐相处这种配置有助于孩子接受高等教育他不仅善于逻辑思维，而且有理想孩子们按照自己的节奏和计划做事这位妈妈的担心完全是多余的未来很有可能成为杰出人才妈妈还说孩子确实没有让她担心但我还是忍不住担心孩子的未来也许这就是父母的用心吧！#学业#,0,0,0,广东,广州,广东,中国
42,4926016706056294,翎羽真言,2023-07-21 19:02:46,中学同学群里U锁男比较多，可以理解，当年总共也没念过几天书，后来也是从事体力劳动，脑子里的信息有限，真没必要辨，也说不清。大学同学群里也有很多左党和恨美族，开始不理解，怎么也受过高等教育了，怎么基本逻辑思维都没有呢？后来才发现，他们毕业后都是吃体制饭的。自觉不自觉地就成集团成员。 ,0,0,8,北京,北京,北京,中国
42,4925983952212888,戴眼镜的蚂蚁看世界,2023-07-21 16:52:37,网络一段话照抄。教育受众者要学：科学精神、逻辑思维、团队精神、批评性思维方式；心理素质、家庭与人际关系；环保知识、健康知识、急求知识以及危机应对等。 ,2,0,1,贵州,贵阳,贵州,中国
42,4924219303658577,满满的世界地图,2023-07-16 20:00:32,📚今日读书   本章的主题是： 认清孩子的情绪  不论孩子的感情在我们看来是多么的荒谬和令人沮丧，它们对孩子来说都是真实而且重要的——我们也应该以同样真诚和重视的态度做出回应。  但是同时，我们也不建议仅仅因为孩子没有逻辑思维就一味地纵容他或者轻易让他突破你的底线。  #一起家庭教育# ,54,1,67,法国,,法国,法国
42,4925474864103664,等待的thunder,2023-07-20 07:09:40,#西安教育局工作人员回应河南回流生#看到好几个河南说河南难，这不是强占陕西娃资源的理由，不要搞强盗逻辑思维。还有这些空降兵不管是对陕西娃还是河南本本分分考试的都不公平，这就是投机取巧 ,2,20,281,陕西,西安,陕西,中国
43,4924789959166625,笔笔湖,2023-07-18 09:48:07,转发：“本科的性质是通识教育，打好基础。（物理、数学很重要）通过自学能力，培养思维，学会批判性思维、逻辑思维。报考学校大原则1、选城市第一国际大都市（纽约、伦敦）国内大都市（北京、上海、广州、杭州）2、学校比专业重要（本科阶段）       专业排名优先（硕士阶段）    读大学时打好基础（通识教育、自学思维培养）大学选专业，四年后变化很大，如果为了找工作而选专业在硕士阶段解决专业问题。就业1、把外语学好，说好英文是走向世界的必备工具。2、每一波就业与经济周期相关。第四次工业革命人工智能。需要T型人才。首先，不要把自己局限于某一专业。其次，不要去跟风。变化太快，有很多工作被淘汰掉。      人工智能会淘汰掉认知低的人。在当下要把自己打造成T字型跨学科人才。读书不要有边界，把自己进化到更高层次之上。       物理是科学的基础，数学是工具。把物理数学学好是底层逻辑。马斯克是物理学士，华尔街大多数金融大咖是物理、数学家。”#29岁女生入职3年月薪涨200元裸辞#,0,0,0,四川,绵阳,四川,中国
43,4923455297818392,沐小亚Sylvia,2023-07-14 17:24:39,一个领导 最致命的点 不是脾气性格暴戾动不动批评教育 而是没有工作思路没有逻辑思维 语言表达更没有任何逻辑可言 看似他很忙很累很卖命 其实下面的人更忙更累 因为都在跟着他像无头苍蝇一样乱转 费人费事费时 忙活半天还全是无用功 可悲至极 ,0,1,1,青海,,青海,中国
43,4923057154556074,支奥黛丽赫本,2023-07-13 15:02:33,我很少极少数会在互联网讨论关于女性的问题，我觉得跟一部分男的说不通，他们有沟通障碍，而且很多男性没有像女性一样从小就被教育规劝，不成熟幼稚且逻辑思维混乱，和他们说话就像对牛弹琴，浪费我的时间和精力。我也和一部分女生说不通，她们的生活好像随时需要我进行法律援助，活不明白，她们一边努力的表达自己爱护世间每一位女性，一边致力于厌恶女性，拼命证明自己与世界主流价值观契合，却掩饰不住自己厌女的心。对于这些人来说土是一种生活态度。请不要一边说着爱女，一边不相信女性说的任何话打上茶恶心见的字眼，相信啥呗说的话，表面上：我爱女我爱女，背地里暗搓搓比较看着真的几 把费劲。,0,0,3,云南,红河哈尼族彝族自治州,云南,中国
43,4922336329079819,周少说,2023-07-11 15:18:16,一道小学数学题目，题目要求是以下四人中只有一个小偷，只有一人说的是真话，请找出小偷。没想到难住了不少学生，甚至连一些家长也被绕懵了。有网友说，倒着推，分别假设甲乙丙丁四个人是小偷，看哪种情况符合题目要求。也有网友说，丁是小偷。还有网友说，高中政治选修三，就学这个逻辑思维。那么，到底谁才是真正的小偷呢？#周少说教育##在微博过暑假#,1,4,2,湖南,长沙,湖南,中国
43,4922090618623242,章晓华微博,2023-07-10 23:01:54,孩子5-12岁逻辑思维启蒙很重要 孩子成长#教育##公开课# 章晓华微博的微博视频 ,7,0,7,安徽,合肥,安徽,中国
43,4919471775160808,尚田园幼儿园,2023-07-03 17:35:33,6岁前多和娃聊这8类话题🌈孩子越来越聪明让尚田园带各位家长看看吧：💐亲子沟通的重要性大家都知道，但很多家长却不知道该和孩子聊点什么好🍄一、数感🍥1、我们家旁边的楼，一共有多少层？（点数技能、记忆力）🍥2、晚饭几个人吃的？每个人吃了几碗饭？一共吃了几碗饭？（记忆力、加减运算）🍥3、妈妈今天穿的衣服上有几颗扣子？（点数能力）🍥4、XX家住在7楼，我们家住在3楼，中间有几层楼呢？（加减运算）🍥5、家里有5个苹果，爸爸吃了1个，妈妈吃了1个，现在冰箱里还有几个？（简单加减运算）🍥6、我们家有几个男生，几个女生？（分类、简单运算）🍥7、糖果3块钱一袋，10块钱可以买几袋？买完还剩几块钱？（认识人民币、简单加减运算）🍥8、你把我们家的人按身高高矮排序，从矮到高要怎么排呢？（排序、比高矮）🍥9、家里的水果按大小排序，从小到大要怎么排呢？（排序、比大小）🍥10、现在是8点，过两个小时后是几点呢？（认识时间、简单加减运算）🍄二、观察力🍥1、宝宝请把眼睛闭上，妈妈今天穿了什么颜色的衣服？爸爸呢？（颜色观察、细节观察）🍥2、你今天去幼儿园遇到的第一个人是谁？（记忆力）🍥3、咱家的XX物品一般放在哪里？（日常观察）🍥4、今天早餐，我们吃了哪些食物呀？（物体观察力、记忆力）🍥5、你能说出几种家务活，越多越好。（日常观察力）🍥6、你被子上的图案是什么？（图形观察、细节观察）🍥7、咱们家黑色的物体都有什么？你来找一找。（颜色观察力）每天挑几个问一下孩子，既能增加亲子沟通，又能轻松培养孩子的多种能力，一举两得～#孩子教育##早教启蒙##武汉幼儿园##逻辑思维##家庭教育#,1,0,0,湖北,武汉,湖北,中国
43,4919075183266558,慕枫是庚金,2023-07-02 15:19:38,#中国的学生最缺少什么教育# 逻辑思维，质疑精神，爱的教育，死亡教育，生命意义。  教育的意义在于你有没有让自己拥有满意的人生，但是满意的定义因为个体的不同而变的不同。  看一个电影都被要求写观后感的教育，歌颂的教育，面子的教育，上下尊卑的教育等等可谓非常成功 ,7,24,93,河北,保定,河北,中国
44,4917568458198242,天祥宋瑞,2023-06-28 11:32:27,怪不着河殇，那就是一个发散性思维的文艺腔大集成而已，要怪就怪你国语文教育为毛总是反逻辑思维而动，还特么当成国学了～～//@飞扬南石:客观地说，是中国跑得太快，没有等一等公知。现在的公知，在40年前都属于改革先锋，思想很前卫很先进的那种，只是，40年过去，他们还在原地……,0,1,4,北京,北京,北京,中国
44,4917236655719240,讲逻辑做投资,2023-06-27 13:33:58,这段话对教育问题一针见血，尤其是逻辑思维、质疑精神、科学精神……  不过，想要解决教育问题，那涉及到的面太广了，目前想要解决，几乎不可能 ,47,16,74,上海,上海,上海,中国
44,4911237496836426,lijuan_n,2023-06-11 00:15:28,正式开启研学了 同学都很优秀，但也有跟想象不太一样的地方。好在大家素质教育都不错，团结、向上。有些同学的逻辑思维真棒～晚上宵夜吃了两场，交流一下也有些新的认知，颠覆了传统的经验之谈。所以，只有无知的人才是狂妄愚蠢的。山外有山，努力变得更优秀～加油加油加油！！！ 龙岩·汀州建国饭店 ,0,0,0,福建,龙岩,福建,中国
44,4910397902292159,深视体育,2023-06-08 16:39:13,乱吸氧、偷棋换棋等乱象在青少年围棋比赛过程中时常可见，这些行为都有悖青少年学习围棋的初衷。做事先做人，做人先立德，作为围棋界的未来，青少年棋手该如何把握自己的未来之路？#围棋##人生感悟 ##道德教育##逻辑思维##棋如人生##少儿围棋教育##人生观、世界观、价值观##青少年#   @徐莹_玉罕 深视体育健康频道的微博视频,11,4,9,,深圳,广东,中国
44,4909963895639853,SCUT魏剑峰,2023-06-07 11:54:38,#高考语文# 现在高考作文比较大的问题是，它几乎不怎么考察逻辑思维，只看所谓的“文笔”、“辞藻“、“经典例子”以及“名人名言”，这可能会导致很多高分作文读起来就是文笔好一点的废话文学。这一点与A-Level以及SAT的作文要求形成了鲜明对比。 语文教育中淡化逻辑思维和论述也会限制学生深度思考的能力，后面学生如果要写海外考试作文也会吃亏。,35,14,187,广东,广州,广东,中国
45,4901327949271174,贝总荐_谬论侦探_中文版,2023-05-14 15:58:28,啥是逻辑思维教育？  学会定义概念、学会正确推理、学会论证、学会批判反驳、学会识别逻辑谬误、学会分辨证据的强弱、学会深度思考、掌握一些思维的工具、学会提问、学会分辨各种类型问题极其意义可解决性、学会问题的解决方法 ,13,1,30,广西,玉林,广西,中国
45,4900350711304588,甲木逢庚的July,2023-05-11 23:15:16,应试教育是对官杀，印的筛选（勤奋，自制力，逻辑思维，记忆力）艺考是对食伤的筛选（创造力，表演力，才艺天赋）花钱读一读的学校是对财的筛选（财商，资源，人脉） 人还是要灵活，不要执拗，比如自己并不擅长应试教育非要扎堆和官杀、印类人群竞争。顺从自己命局或者运才会走适合自己的路。,12,5,26,上海,上海,上海,中国
45,4898458915836723,狗腿子想滑雪雪,2023-05-06 17:57:57,越来越觉得自己静不下心来  昨天听小伙伴说他一年看了31本书 就觉得自己好像很久（以年计）都没有看过书了  每天都以物喜 以己悲 很浮躁  有时候想想 应试教育虽然很讨厌 但是当时确实很充实 上知天文 下知地理 在数学的逻辑思维里探险 在历史的海洋里见证文明  但是我真的读不进去书了 叹气 ,0,2,0,日本,,日本,日本
