页码,微博id,微博作者,发布时间,微博内容,转发数,评论数,点赞数,发布于,ip属地_城市,ip属地_省份,ip属地_国家
15,5022295315713360,骑驴老师,2024-04-12 11:19:36,乐华娱乐最大的诈骗就是解散那会儿欢迎回乐华的视频，我以为和爱豆青春能有什么不一样呢，不一样的就是连经纪人都没有了，走了费朝和月亮，来了个同样废的周蓝。李汶翰的宣发是没有的，三年前的物料现在才发；李汶翰的职业规划是没有的，因为他都没经纪人呀；李汶翰的工作安排是随意的，签售会说开就开，说不开就不开，没有任何解释。周蓝每天岁月静好，专心搞新男团，是以为别人不知道？李汶翰真的让你们乐华很放心了吧。身材管理一等一，不需要你们去催或者让他减肥，他自己就爱健身和打篮球，每一次出现，脸都一等一的紧致；唱歌实力自己会提升，扩宽音域、气息稳定，现场话筒因为kuma的失误拿错了，听不到耳返的传送，但他全开麦无所畏惧，依然是唱得最好的那个。跳舞也没荒废，你们给个舞蹈综艺，24小时就能来一支高强度的舞蹈表演。演技更不用操心了，音乐剧都是夸的。《遇见你》唯一没有被否定的就是他的演技。其他艺人机场挥手都是要营销的，我们汶翰线下包场请粉丝看电影是只有粉丝知道的。李汶翰是歌手，音综、ost是没有的，连宣发都没发过几个cover。但他那么爱哼歌的人怎么可能没有唱歌片段，这不是三年前的周蓝都还有么，怎么可能没有新鲜的。遇到你们真是见鬼了。,6,4,168,上海,上海,上海,中国
15,5022778273038376,夜风穿林打叶,2024-04-13 19:18:41,们内娱丝事业心太强了 好想让他们来给我做体制内职业规划 ,0,0,1,重庆,,重庆,中国
16,5022773374355748,芒果追星小脑婆,2024-04-13 18:59:14,有时候 你不得不佩服王一博(or他老板对他的职业规划。。 ,7,46,51,安徽,马鞍山,安徽,中国
16,5022772998966838,莫拉莫拉塔,2024-04-13 18:57:44,也许球迷都是自私的，都想让喜欢的球员永远留在俱乐部。但球员也有自己的生活，自己的职业规划，他想去哪个城市哪个国家生活，他未来的发展路线，他退役之后的生活，他的家人意愿……种种因素下，他也许会离开，会转会，也许会离开然后再回来。我们什么都不能改变，什么都做不到，只能看着他走在自己选择的道路上，然后默默祝福。,0,0,0,天津,天津,天津,中国
16,5022772803929607,海棠师傅,2024-04-13 18:56:58,女人紫微命盘中，命宫，福德宫或夫妻宫有七杀，有化忌，陀罗，擎羊，天空，地劫时一生比较坎坷，事业不顺，被欺负，失业，破产，感情坎坷，容易被骗，被渣男性骚扰或强暴，有的是因结婚择偶或工作、职业规划等与家人发生冲突，甚至断绝关系，反目成仇，私奔，互不来往，家庭破裂这类女人不能早婚，也不要奉子成婚，否则嫁得不好，会被家暴，离婚,0,1,1,浙江,宁波,浙江,中国
16,5022768871769416,用户6973736646,2024-04-13 18:41:20,职业规划 是做一个关于房产样板间的抖音小红书 看有没有地产公司需要拍摄 然后把钱赚了的同时 做关于房地产的项目 不说别的 我是天才 ,0,0,0,湖南,长沙,湖南,中国
16,5022764560288513,芒果追星小脑婆,2024-04-13 18:24:12,网友瑞评龚俊的职业规划 选剧眼光太差 ,7,55,53,安徽,马鞍山,安徽,中国
16,5022763601367524,Aivilosun,2024-04-13 18:20:24,我在研一交到的最好的两个朋友q和x 我真的能在她们身上学到很多东西 一个让我学到职业规划 一个让我学到讨论事物的关注角度以及性格上的很多优点 好喜欢她们呜呜 每次和她们出去玩甚至吃一顿饭都能又轻松又能让我有或多或少的小感悟 ,0,0,0,北京,,北京,中国
16,5022762534700110,湖畔綠野,2024-04-13 18:16:09,三十岁之前有必要考虑什么人生大事职业规划吗 差不多活着就得了 ,0,0,0,广东,汕尾,广东,中国
17,5022756422549850,早八困的想薯,2024-04-13 17:51:52,不就是小小职业规划论文么（b溃无从下手谁来救救我） ,1,0,0,浙江,温州,浙江,中国
17,5022752549375222,甜蜜剂小偷,2024-04-13 17:36:29,刚才面试了pdd ，面完有一点应激想吐。目前不想再被面试了，尤其是问我三到五年的职业规划。 其实我只想休息，闲散地生活一两年，找到学业工作之外的价值和爱好。普普通通地生活着、幸福起来。前几年我真的过得好累 ,0,3,0,广东,,广东,中国
17,5022747816888843,寒隙,2024-04-13 17:17:40,笑死我了导演的职业规划要到40以后。。//@柠檬和氨基酸:码一下感谢🙏🏻,0,5,0,北京,,北京,中国
17,5022739943917415,少喝奶茶就,2024-04-13 16:46:23,这四天假我只能说真的安排的满满的星期三做志愿参观图书馆，昨天写了一天的职业规划，今天做了一天的微积分作业，明天刷大英赛卷子，还有个3000字论文下下周交 ,1,0,0,重庆,,重庆,中国
17,5022736726884611,互联网螺丝钉女工,2024-04-13 16:33:35,上天会偏爱真诚勇敢的小孩，它会在你迷茫的十字路口为你找到正确的人生方向，一直以来看你缺乏正确的职业规划和引导从而排斥表演，真的会为你惋惜，宝宝你在表演上是有天赋的，强大的bg感，优越的外形，骨相也很上镜，好好调教假以时日会越来越出彩的，感谢二十条和张导把你重新带回正确的道路,0,0,0,北京,北京,北京,中国
17,5022733992461085,唐九十二响,2024-04-13 16:22:44,星盘干货丨如何通过星盘做职业规划【1 期】作为占星师，唐九经常被咨询一个问题：“根据我的星座，哪种职业最适合我，可以为我带来持久而持续的成功？这一类问题总是让大家产生困惑，所以，让我们深入探讨如何运用占星术指导职业规划。在错综复杂的星宿之中，九大行星和十二星座各自代表着特定的职业特质。并扮演着不可或缺的角色，月亮是一个人的本质，它统辖着心灵，心灵主宰着思想，而思想又驱使着行为，因此月亮星座也对职业特质的影响深远。除了月亮星座，第十宫及第十宫宫主的强弱在确定适合的职业道路方面也至关重要。当出生图中的月亮星座和第十宫相辅相成时，成功的可能性也随之增加。另一个需要考虑的关键因素是星图中最强大的行星或行星群。尽管星座反映了个人天赋或对特定职业的天赋，但并没有固定的占星因素适用于任何特定的职业。通过将占星术的智慧融入职业规划，我们可以将自己的职业道路与宇宙之力相契合，潜在地开启更大的成就和成功。让我们一同探寻星宿背后的智慧，为自己敲开职业生涯的大门。下面提供一些基础的方法：第一步：找出你的守护星第二步：利用守护星看自然天赋第三步：注意守护星落在哪里（转下篇:守护星看事业）PS：由于篇幅受限，本篇幅只讨论守护星的自然天赋，守护星落星我们会在下篇具体讨论。找出你的守护星:牡羊座、天蝎座|你的第十宫宫主:火星金牛座、天秤座|你的第十宫宫主:金星双子座、仙女座|你的第十宫宫主:水星巨蟹座|你的第十宫宫主:月亮狮子座|你的第十宫宫主:太阳射手座、双鱼座|你的第十宫宫主:木星摩羯座、水瓶座|你的第十宫宫主:土星#星盘##星座##职业规划#,0,0,1,四川,成都,四川,中国
17,5022727356810716,Meteorwx-,2024-04-13 15:56:22,今天我两个杨梅的同学找我聊天，聊到职业规划我们都会心一笑：要饭 ,0,2,1,重庆,,重庆,中国
17,5022725377360837,头像即本人-人淡如菊版,2024-04-13 15:48:30,打工半个月后的一些未来的职业规划 ,0,0,0,中国,,,中国
17,5022720792724129,巡视中请稍候,2024-04-13 15:30:17,所以到底圆满在哪里？剧的本子是不及格的、节奏是比本子还拉的、镜头是只能吹空境的、拥有顶级的配乐但画面是配不上的。就姐来说表演状态是经常不在线的、顶级的脸部状态被滤镜糊了一层又一层的、练了两个半月的打戏正片是不如花絮的。但如果姐通过老凤拓宽了自己职业规划的边界那也算ok吧。但如果是圆满在拍老凤的每一天都很开心，那私密马赛，我理解不了，我看老凤的每一集都很遭罪。明明前8集看完就该放弃的，但因为对姐的表演尚存一丝期待所以坚持到了大结局这是我的错我知道。,0,0,0,日本,,,日本
18,5022707173556416,想吃酸奶麦片_,2024-04-13 14:36:09,大学开始以后的每一步都要为我以后的职业规划服务，仅仅只是想学画画都要向你你们解释千百遍给我以后有什么帮助而不能仅仅只是我想我喜欢她想报班她爸就给她直接打钱，她爸对她有愧疚你们也偏爱她那我算什么呢，为什么不在之前病得严重的时候就让我去死，一遍又一遍的心理咨询开药跑去其他地方看病换了一个又一个德心理咨询师苟延残喘到现在的意义是让我以后的人生更痛苦吗,0,0,0,江西,南昌,江西,中国
18,5022704391949902,春天哩那个百花鲜,2024-04-13 14:25:07,领导跟我谈岗位，谈职业规划，我以为他认真的。直到劝我早点结婚？。 ,0,6,1,山东,潍坊,山东,中国
18,5022696989266115,_1misaki,2024-04-13 13:55:42,梦：外婆家房子背景，外公一楼房间，突如其来见家长， 两情相悦 ，真情实感无欺骗，“你今天准备好收红包了吗”，妈妈，缓和家庭关系，言明职业规划，阖家欢喜。 ,0,1,0,广东,河源,广东,中国
18,5022695697946741,老潘聊生涯,2024-04-13 13:50:34,C06集 | 生命无意义？努力无价值？NO！NO！#职业规划##潘业喜培训课程推荐##生命的意义# 【老潘培训】 老潘聊生涯的微博视频 ,0,1,0,江苏,南京,江苏,中国
18,5022695234209763,脱脂小鱼,2024-04-13 13:48:44,"隐藏的职业规划：1-2年，花光积蓄追星。 第一步先买个随心飞 Wherever it will be, I am going 🥹 ",0,0,2,福建,厦门,福建,中国
18,5022692453385187,ttDeheiyalisuisuinianZ,2024-04-13 13:37:41,写了一上午作业 英语的20个测试写完了 大物测试写完了  把这个英语写完就开始搞c语言实验 周天开始构思大学生职业规划的论文 下周我就可以轻松了 ,0,0,0,山东,淄博,山东,中国
18,5022689110525390,试图多次改昵称,2024-04-13 13:24:24,我从来没觉得以后有什么光辉未来，我只能确定之后的几周内会发生什么，我总感觉我活不到那个时候所以我之前喂了自己不少💩不过我的职业规划是什么我连班都不想上，谈个狗屁职业规划也不是不想上班，我知道新氛围可以带动一些，现在这种情况维持下去没什么出路我只是想表达，我曹尼玛的，你这个死人，你他妈该死,0,0,0,江苏,盐城,江苏,中国
18,5022685173907685,墨蓝色的针叶帚菊,2024-04-13 13:08:45,大学生职业规划到底要怎么做啊 ,0,0,0,江西,,江西,中国
18,5022680547592180,步入山隐间,2024-04-13 12:50:22,　《不种田就会被啊呜掉》 作者：春山犹枝　　文案：　　穿越到古代的第七年，夏琛的金手指终于觉醒了，夏琛激动到语无伦次：“系统呜呜呜我等你好久了，我要成为人生赢家了吗？！”　　系统：“资源整合中，职业规划启动，根据适配度优先级，宿主的最终职业称号为一代神农。”　　夏琛：“……啥玩意儿？！”　　系统：“系统空间已经开启，望宿主努力种田，早日走上人生巅峰。”　　夏琛看着脚下巴掌大的土地，失声恸哭：“不！我不种田，死都不种田，我要去考科举，封侯拜相！”　　寒窗十载，考中秀才，赶考的路上，末世来了，僵尸遍地，夏琛缩在系统空间里瑟瑟发抖：“统儿，你出来，我回来种田了……”　　重生攻x穿越受　　【阅读指南】　　1、非典型种田，僵尸类末世，有私设。　　2、前期种田，中后期末世，慢热。　　3、金手指很粗很粗很粗。　　内容标签： 随身空间 穿越时空 种田文 末世,0,2,11,云南,昆明,云南,中国
19,5022671152878367,俞俞Jacky,2024-04-13 12:13:02,#研究生应该收父母给的生活费吗# 我看到这些tag我都无语了  研究生明明还在上学 建议你不拿父母的生活费 刚毕业找不到工作 建议你付费打工 想不清自己的职业规划 说你脱不下长衫 不想随便结婚生子 说你影响人类发展  这批年轻人到底做错了什么 总得让别人对自己的人生指手画脚 ,0,2,30,黑龙江,哈尔滨,黑龙江,中国
19,5022669774784088,贺贺贺贺嗝儿,2024-04-13 12:07:34,建议学校也别搞什么职业规划课了，每年秋春招拉去招聘会看看，冲击感直接push奋斗终身（尤其文科） ,0,0,1,上海,,上海,中国
19,5022294109588823,李太林导师,2024-04-12 11:14:48,人生是如何规划岀来的？ 1、探索过去：总结复盘，提升认知 2、确认现在：厘清位置，认清现实 3、设计未来：规划路径，选定方向 4、擅长喜欢：做自己擅长喜欢的事 5、优势优先：强化优势，弥补短板 #职业规划##认知思维##职场干货##职场##老板##团队##领导力# ,25,5,23,上海,,上海,中国
19,5022406219664564,_绿-茶-妹_,2024-04-12 18:40:17,不知立场开个班教怎么玩网都比大学生创新创业课程大学生职业规划课程有用多了 ,123,4,70,广西,钦州,广西,中国
19,5022660506945621,在海嘯間尋找不凍港,2024-04-13 11:30:44,布拉格昂是实锤曹丕去了对吗 一夜之间首页的风向由天天转发萌萌1拉课的喜庆氛围变成了贷款失败指责吊男一心为了女友，可是 你们不会第一天认识第一次知道他的德行吧，去年不是过去了没有凭空消失吗，说到底梦想中的职业规划竞男还是给不了你，早认识到就好 ,0,7,4,福建,,福建,中国
19,5022657454015250,达尔贝达达达,2024-04-13 11:18:36,好久没听伯师唱歌了……今天突然把淡坑以后出的所有都听了一遍感觉很有进步耶，真假声转换更成熟了吐字也变清晰，从翻唱的曲风隐隐有感觉到他的职业规划（）好啊好啊 看到你越来越好我感觉人生其实也挺有希望的 越来越好吧 ,0,0,0,河南,开封,河南,中国
19,5022654166207224,老潘聊生涯,2024-04-13 11:05:32,#潘业喜培训课程推荐# 🌹《赢在就业力｜大学生职前软实力提升训练》 🍀提升就业力，提高就业率。用最有效的训练方法，提升大学生的规划力、实践力、就业力，助力大学生用更自信更成熟的姿态迈向职场，走向成功。 18年职业规划与人才赋能实操经验。 【老潘培训 品质保证】 ,0,0,0,江苏,南京,江苏,中国
19,5022651406615892,想开一家麦麦,2024-04-13 10:54:34,趁早想好职业规划这件事情真的太重要了 而往上倒推就是在高中选科的时候就要强烈的意识到这一点  如果早知道这一点我应该挤破脑袋面临着考不上大学的风险我也会义无反顾的选择理科 ,0,0,0,湖北,武汉,湖北,中国
19,5022650730023826,被门夹过的大鱼能补脑,2024-04-13 10:51:53,又有新的职业规划了：去盒马烤面包 ,0,2,1,山东,青岛,山东,中国
20,5022639573434790,便当626,2024-04-13 10:07:33,2024年定向培养军士志愿填报指导、升学规划、职业规划，全程专业服务！（有想法的学生可以提前去做一个军检预检，有问题及时提前解决，高考文化成绩分数要求300分以上！）定向军士，专科军校。成长之路，技术为王。高薪工作，编制分配。建功国防，前程似锦。大学学费报销，毕业工作包分配。2024年定向培养军士志愿填报服务预定开始！时间紧迫，高考成绩出来就马上填报志愿啦！有想法的同学或家长，必须早做准备，,0,0,2,湖南,长沙,湖南,中国
20,5022639522845303,追天光的女孩,2024-04-13 10:07:21,#为什么选择远离原生家庭#我都已经26了，工作第三年了，我妈还是忍不住翻我的包，发现了我打印的演出经纪人备考资料，就问我是不是要考，是不是要换工作，说我脑子进水了，说我弱智，说我不懂人生职业规划，说让她没面子，说叫我滚出去，再也不想见我，受够了。可是每个月都叫生活费了，一个月赚四千多交两千多，哪里还有什么存款啊以前也不是没有在外面住过，可是距离不能解决问题，也无法产生美。,0,0,0,江苏,常州,江苏,中国
20,5022627118710798,也许天凉,2024-04-13 09:18:03,在@核桃编程 的引导下，孩子对编程产生了浓厚兴趣，也为未来的职业规划打下了坚实基础。感谢核桃编程，为孩子的未来铺就成功之路！#核桃编程未来职业规划##孩子未来成功# ,0,0,0,四川,成都,四川,中国
20,5022624252695499,今儿吃宵夜了吗,2024-04-13 09:06:40,感觉对自己的职业规划好迷茫 可能西安真的不适合工作……. ,0,2,0,中国,,,中国
20,5022527111824181,kgkjfjafa_5,2024-04-13 02:40:40,回想起当初老师给我的职业规划，读到博士，我现在想读技校 ,0,0,0,广东,,广东,中国
20,5022526019470880,窃衣喵,2024-04-13 02:36:20,笑死， 我以为的事业粉：支持他的职业规划，相信他理解他的工作。 谁知道有的事业粉：外行指导别人的职业，当人生导师来了。 啥也不懂，但主打一个勇气可嘉，外行指导内行 ,0,0,0,广东,广州,广东,中国
20,5022524419867782,k1myu,2024-04-13 02:29:58,职业规划方向：乞丐 ,0,0,5,广东,广州,广东,中国
20,5022518724004253,-JoyJoooy,2024-04-13 02:07:20,如果爱一个人需要这样那样考虑对方为双方的未来负责进行职业规划什么的话不是超级无敌累吗 ,0,4,2,广东,广州,广东,中国
20,5022507114169711,奥特曼本山,2024-04-13 01:21:12,突然想感叹一下，小鹤能走到这么多粉丝的面前真的是非常非常不容易的一件事。糊糊时期就知道去尝试各类角色，所以其实我桃花坞粉上他之后深入了解下看到他没有重复人设的角色也没下过海的时候还在和朋友说他真的很有职业规划。脑子是真的聪明，也是真的拎得清。下海像下饺子似的时代里都能恪守演员信念，一步一步扎实得走过来，就像他自己说的那样，“脚踏实地，好好演戏”，这真的好难好难。再看其实走捷径的那一批里没几个好结果的，几乎都是水坑里的鱼，扑腾那几下，等水干了也就没得折腾了。有人走捷径妄想一夜爆红，终不如厚积薄发来得底蕴深啊。,0,1,1,辽宁,沈阳,辽宁,中国
21,5022504475953750,我是一只他妈的猫猫,2024-04-13 01:10:43,infj和infp好惨 又上热搜了哈哈哈哈哈哈哈 我现在可是isfp！！！从大一的职业规划课上知道我的mbti之后 第一次！转人格！！！isfp！我很喜欢！ ,0,2,0,河北,衡水,河北,中国
21,5022497888011448,不见残云,2024-04-13 00:44:33,人生中第一次职业规划是在第一份工作干的一团狗屎之后。 但是怎么会有人半夜在烧烤摊上做职业规划。 ,0,3,0,甘肃,兰州,甘肃,中国
21,5022495853775579,flaming11_,2024-04-13 00:36:28,陈思炜职业规划 线上营销 ,0,0,0,山东,淄博,山东,中国
21,5022493087630873,别嫉妒我咳,2024-04-13 00:25:28,为什么没有研究生观察类综艺呢 不是像offer那种特别优秀的 就是普通人 这样大家就知道向往的生活是什么样的的了 看看追求学术的人怎么自洽 就算到自己读的时候有落差也会降低一下抑郁的概率 可以多几个专业方向 看的人有个大概的职业规划而不是盲目的考 了解一下考上了能怎么样没考上能怎么样 我觉得这个很重要,0,0,1,北京,,北京,中国
21,5022490317294324,宿醉阿姨,2024-04-13 00:14:28,即将步入30岁 开始思考未来的职业规划 我大概不会死了吧 30岁之前的挥霍将在30岁之后开始偿还 哎呀 我还是爱钱 ,0,0,0,江苏,南京,江苏,中国
21,5022484780814760,burgerbunny,2024-04-12 23:52:28,为什么写个职业规划也要知道我的体重 能滚吗 能别什么都要写体重吗5555 ,0,0,0,广东,东莞,广东,中国
21,5022478971962981,猫猫的太空船,2024-04-12 23:29:23,文韬Stefan勇敢的你   先享受世界从名学第一季第三期看到你开始  喜欢你第一条关于你的微博是19年年底被你偷过图     可惜现在看不到了也和你出现在同一期节目里  给你过了第五个生日了和你同一个专业    在大学的时候   备受你的鼓舞很多职业规划  都是在你20年年初那一场场直播中   慢慢建立起来的虽然   从来没有见过你   但是   一直觉得你就是我身边一个很厉害很厉害的学长  榜样你做的每一个决定   每一个选择  我都不意外很佩服  羡慕你的勇气   勇敢的你   先享受这个世界@文韬Stefan 生日快乐   万事胜意,0,3,19,浙江,宁波,浙江,中国
22,5022474468590800,然而然而逆流,2024-04-12 23:11:29,狗屁职业规划，我一点班都不想上 ,0,1,1,四川,成都,四川,中国
22,5022472103792984,-核桃璐-,2024-04-12 23:02:05,澜久 黄俊捷本职是演员要进组拍戏，不是模特，请为艺人做合理的职业规划，要拍杂志商务代言可以，但是不要短时间内安排太多高强度的拍摄了，现在他的整体状态真的很差，不要再一味压榨艺人了，为了他的健康，请让他好好吃饭@黄俊捷工作室 ,0,3,20,河北,保定,河北,中国
22,5022468803398737,momo12kala,2024-04-12 22:48:58,天哪，我的人生有没有人可以来指导我一下，我知道不能依赖别人的指导，不能依赖他人，就是永远都不要想着依赖他人自己感觉上个大学，然后毕业之后总是有点依赖心理，想要依赖他人！我总想有一个人，无论是谁男性女性，无论年龄高迪就是来指导指导，我包括性格，为人处事职业规划等等，我感觉我很多时候我的为人处事我的生活上的各种问题全都是我的错，就是我个人的性格懦弱，犹豫不决，猥猥琐琐不够聪明，然后不够坚定不够智慧，全都是我的个人问题，我这种性格很讨人厌的，我遇到的所有的问题都是这个，要么就是自己太软弱，给别人伤害自己的机会，就是性格问题，就是要么是不会拒绝，要么就是太软弱，就很多时候可能看起来自己好像没做错什么事情，但是不懂的人性的道理很多时候发生一些不好的事情，我感觉几乎都是必然的，就是不聪明不精明！不机灵，就跟我在网上看别人的很多事情是一样的，就是那种不机灵不精明的人就要吃亏就要被社会毒打！,0,0,0,浙江,杭州,浙江,中国
22,5022468009627004,月梦星影,2024-04-12 22:45:49,脱粉螃蟹不要再说王俊凯应该当爱豆不应该当演员了，他目前这个状况，当个人都困难了，你们还给他进行职业规划干嘛？他应该先gap一年学做人好么，他现在已经不人不鬼了还谈什么事业路线不是很荒谬么 ,1,2,4,上海,,上海,中国
22,5022466967866542,香蕉菠萝不吃榴莲,2024-04-12 22:41:41,#职业规划# 我该有怎样的职业规划？什么样的职业规划更适合我？我要干嘛啊？#迷茫# ,0,1,3,天津,天津,天津,中国
22,5022466378564707,植物大蘸姜丝,2024-04-12 22:39:20,xwx终于做出了一个比外面卖的好吃多了的食物 毛豆花生！ 吃的我根本停不下来 我已经想好他以后职业规划了 程序员下岗再就业之卖卤味 ,0,0,0,陕西,西安,陕西,中国
22,5022463977065875,南溪发布,2024-04-12 22:29:48,#毕业五年在家五年考公考编五年#【转给准大学生！大学四年可以考些什么？】大学四年，非常珍贵，别匆匆虚度再追悔莫及。如何搞好学业？有哪些奖学金可以争取？要不要早点开始职业规划？能给自己设置哪些目标？@ 准大学生，这份自我提升攻略供参考↓↓持续努力，莫负韶华！ ,3,0,2,,宜宾,四川,中国
23,5022460030489512,今天是吃泡芙的好天气,2024-04-12 22:14:07,哎哟喂好累啊忙不完啊忙不完 大学生职业规划 你狠狠要我做3000字word➕ppt 还要参加什么大赛 你是要干嘛啊ps差了四个作业没交 绝了 做不完啊 ,0,2,3,广东,佛山,广东,中国
23,5022430504686969,李太林导师,2024-04-12 20:16:47,员工为什么对“画饼”不感冒了？ “我牙口不好，吃不了老板画的饼。”老板们都喜欢画饼，什么是画饼，画的好就是梦想、愿景、规划、激励，画的不好、画饼过度就变成了“忽悠”。为什么员工不再爱听老板画饼了？1、规划太大、太远，完全没有立足现实。2、画的是老板的饼，跟员工关系不大。3、只是画饼，不谈员工关心的切身利益。4、总是画饼，缺乏实际有效的行动。“画饼”是一门艺术，也是一门技术，我们要将其虚大空的特性去掉，立足现实，保持初心，分解目标，匹配对应的激励机制，形成让员工看到，够得着的“饼”。#认知思维##老板##职业规划##企业发展战略##宏成咨询##领导力##职场##老板思维#,10,4,20,上海,,上海,中国
