页码,微博id,微博作者,发布时间,微博内容,转发数,评论数,点赞数,发布于,ip属地_城市,ip属地_省份,ip属地_国家
44,5010873332793616,两点之前是白天,2024-03-11 22:52:42,虽然物理化学双料22但是！自己考出来的就是比他们那些抄的觉得心安 通过成绩又总结了很多捏 我好像也不恐惧考试了哈哈哈 自己会的才是自己滴希望我能找到有效的方法然后下次超过那些鸡贼今天超级超级超级开心 tbq的同桌好可爱 她今天还说要抱抱我 我好开心好感动啊 就像突然被送了小红花的小孩嘻嘻他太可爱了 让我的自信心蹭蹭蹭的上涨最后最后 all is welll,0,2,2,吉林,白城,吉林,中国
45,5010767709995063,流泪眼望流眼淚,2024-03-11 15:52:59,当我们无限趋向于告别的时候，见到的一切都在暗喻。楼下从初盛到凋零的樱花，拨通的外卖电话并不知晓对面是谁，受到差评的娃娃机店再过十几米就是新的娃娃机店，时间定格在某日某分某秒的考试，包括一张汗津津的新的脸。我在认识你后，获得太多意料之外，恐惧之余也在试探，我从来没想过能有真正的永远——永远，再见面就是永远，流往未来的逃亡的河流在过去血腥，现在只能有涉水而过的人，天真地告诉它想要永远。本身就是伤害。但我怎么就开始有依赖感了呢。平心静气地讲一些奇怪的话。再睁眼后，我们就告别吧。,0,1,0,江西,吉安,江西,中国
45,5010675455754565,霖小橙,2024-03-11 09:46:25,毕业这么多年还是会被学生时代的考试恐惧支配，最常梦到的是数学考试计算公式记不住，语文考试诗句的下一句忘了 ,0,0,0,福建,厦门,福建,中国
45,5010666739991580,奋斗的向南,2024-03-11 09:11:47,#山东事业编试题现亚冠#那天在现场，赛前现场主持人说了，这是泰山队第三次晋级亚冠八强，没想到这也成了知识点…想起那些年被考试支配的恐惧，不管看见啥听见啥都得留个心眼儿，心想会不会从里面出题 ,20,10,19,山东,淄博,山东,中国
45,5010659464971034,当然啦我不对难道你对-,2024-03-11 08:42:53,、等崽37周足月且迎来产假的第一天！/果然做到了开车开到最后一天哈哈哈哈哈。/为工作以来最长的假期准备了好几套产前产后母婴课程、准备了打发时间的游戏卡、一直拖着没看的书籍和电影，甚至还看好了好几个遛弯的公园哈哈哈哈。/还是像是在等待一场极其重要的考试，但依旧是期待大于恐惧。/从来不是“难熬的终将过去”，从来都是“想要的总会到来”。,0,11,4,陕西,西安,陕西,中国
45,5010657185629734,我真的不是笨蛋诶,2024-03-11 08:33:49,高中数学对我造成的阴影依然存在，已经过去六年了，时不时的还会在梦到自己做高中数学卷子，自己已经好多年不学数学了，所以在梦里都很焦虑，很着急，每次做完这样的梦都很累，高三那年经常有模拟考试，而且还会根据排名去不同考场坐，我那个时候对数学的恐惧已经有了躯体化的反应，而对于这些情况我在学了心理学以后才算理解,0,0,3,河北,唐山,河北,中国
45,5010638231306743,焙焙397476194838,2024-03-11 07:18:30,恐惧考试了已经 天天天天天天考试 ,0,0,0,澳大利亚,,澳大利亚,澳大利亚
45,5010564827316768,我離開之後_,2024-03-11 02:26:49,考试恐惧症犯了 现在焦虑地心脏突突跳 可是我要有充足的睡眠才可以 呜呜呜呜好没用啊 每次考试都这样。啊怎么办 想到关于它的一切就好害怕 ,0,1,0,广东,深圳,广东,中国
45,5010540820694883,我好懒懒懒懒懒得起名字,2024-03-11 00:51:26,失眠啊啊啊…休假像没休一样，线上会邮件考试，难道上班恐惧症又开始了吗 我好懒懒懒懒懒得起名字的微博视频 ,0,2,0,贵州,贵阳,贵州,中国
46,5009906314773732,七七八八哈哈-,2024-03-09 06:50:08,服了 一个破考试 恐惧一晚上 惊醒时间为 3:30 4:30 5:00 5:30 6:10 把可能出现的悲剧都梦了一遍且深陷其中我永远痛恨考试 ,0,0,1,浙江,湖州,浙江,中国
46,5009896456323378,教育学马克服老师,2024-03-09 06:10:57,早上好#每天早起打卡# 各位考试人，学会与焦虑友好相处，用自己的方式处理未知的恐惧，哪个人不是负重前行，保持努力！ ,0,1,1,山东,聊城,山东,中国
46,5009821827335512,Lovelysick-,2024-03-09 01:14:24,为什么总是在极度快乐之后又极度悲伤 为什么还是解决不了面对考试的恐惧 为什么还要从别人身上获取能量 为什么要独自在深夜流泪 这样望不到头的日子 究竟还有多久 还要忍受多久的痛苦和孤单  能不能 不要再爱上任何人 这样 就不会对任何人抱有期待 也不会担心自己在别人眼里是什么样。  循环往复多久了 我快没有力气了  给点光吧 拜托了,0,0,0,湖南,湘潭,湖南,中国
46,5009820924510981,萤下心事,2024-03-09 01:10:49,今天是教资考试诶，我对教资一直有一种恐惧感 原因是科一考了三次，面试讲得很不好，不过好在结果是好的 希望我的朋友们今天考试顺利，笔试一把通过！！！ ,0,0,0,河南,焦作,河南,中国
46,5009800095600110,冲浪号号-,2024-03-08 23:48:03,考公失败以后  对各种考试充满恐惧 ,0,2,1,安徽,亳州,安徽,中国
46,5009796814081141,Jannnnnnne1,2024-03-08 23:35:01,不想考试，不想出门，突然恐惧一切，真心错付，钱打水漂，玩什么都不能玩人心啊 ,0,0,0,山东,聊城,山东,中国
46,5009795690267383,啵啵汽水鸽子味,2024-03-08 23:30:33,普通话考试命题三个半，虽然我平常贼能说，但是恐惧 ,0,2,1,吉林,长春,吉林,中国
46,5009794593456625,小kkkkkku,2024-03-08 23:26:11,感觉我患上了考试恐惧症从中考开始 我记得中考是我整个初中三年里考得最差的一次 因为紧张 差不多一整宿没有睡觉 整个人昏昏沉沉 高考可能是因为命运 腿崴了很累反而睡得很好 到了大学 每一次大型考试 四六级 教资 教资面试这样的 在距离考试还有一段时间 我就开始失眠 睡不好觉 一天就睡三四个小时 真的好痛苦,0,0,1,湖南,湘西土家族苗族自治州,湖南,中国
46,5009792703664870,魚魚aouu7,2024-03-08 23:18:41,骨子里对考试的恐惧........ ,0,1,2,江苏,扬州,江苏,中国
46,5009786405655140,可予玫瑰,2024-03-08 22:53:39,去年今天在济南准备考试 第一次一个人出远门 面对许多的未知 还有对考试的恐惧 晚上害怕的睡不着 在候考室紧张的手抖 终于在进考场前看到其他考生 我才有了信心 非常自信完美地完成了考试 在看到成绩的那一刻 我觉得那个冬天付出一切都值得了 和我的预期一样 即使最后的结果不尽人意 但也慢慢接受了 ,0,0,0,山东,青岛,山东,中国
47,5010148857481951,双子日记x,2024-03-09 22:53:54,这么多年了，还是免不了有考前恐惧综合征，哪怕是考不好也没关系的考试，我也不想去，我真的不想去了 ,0,0,0,山东,青岛,山东,中国
47,5010131194480838,当年生仔毛,2024-03-09 21:43:43,妈妈 如果我在新加坡 我一定会给你抢到票  可是我在寒冷的小县城 只能一边担心着爸爸的病 一边恐惧着你的复查结果 一边焦虑着我的考试   但是阿毛别怕 最坏的结果也只是死亡。 ,1,0,0,山东,济宁,山东,中国
47,5010090449178185,不可食用吸油纸,2024-03-09 19:01:49,每次考试我都会想象自己拉肚子的场景，这是一种埋藏在心底的恐惧 ,0,0,0,广东,东莞,广东,中国
47,5010067504760555,铝镁锰合金板不能使用,2024-03-09 17:30:38,我发现，“社恐”的本质是自身在社交中的客体性。当我恐惧社交的时候，通常都会把一场社交看成一场考试，仿佛有个第三方在评估我这场社交中的表现：社交礼仪对不对，哪句话有没有说错，经过这场社交别人是不是更加看得起你了……唯独少了至关重要的：这场社交有没有让我愉快，或者，我有没有通过这场社交获取了我想要的信息或资源。然而，社交中最重要的是“我自己”啊。我所做的每件事情，需要的是对我自己有交代而已。,0,2,3,北京,,北京,中国
47,5010048254218810,iynixiao,2024-03-09 16:14:09,第一次买色卡 让我想起了被色彩考试所支配的恐惧 很好 ！ ,0,0,0,重庆,,重庆,中国
47,5009988160586360,cho1houmnn,2024-03-09 12:15:21,真服了 不管多大了还是有考试恐惧症 ,0,0,0,山东,青岛,山东,中国
47,5009980274509264,Boocafe,2024-03-09 11:44:01,保不齐又是临阵逃脱 考试恐惧症越来越严重了呢 ,0,0,0,江苏,徐州,江苏,中国
47,5009944944313454,茹茹麻麻是小花吖,2024-03-09 09:23:38,陪老公考试被一群大妈大爷围攻的恐惧😨 ,0,1,1,吉林,,吉林,中国
49,5009351657917963,奶油泡芙大葵鼠,2024-03-07 18:06:07,看到上条转发的微博就想到自己，别看我每天逼逼这么多，实际也是能量很低的人，低能量一度在大学时期达到巅峰。一点脑子也不想动，做什么都觉得难和烦，怕苦怕累怕任何外界接触……对动脑和身体劳累的恐惧，会不断联想到生活无望，在外兼职像活在地狱。唯一幻想就是考试上岸，过上清闲体面安定的生活。也认识这样的女生，包括我在内，都渴望寻求一种龟缩起来柔软舒适的安全，不敢面对劳累、风浪、挑战，想一想都胆战心惊。家庭也是这么培养的，听到最多的话就是：你什么也不行，身体也不好，什么都干不了，你吃不了这种苦的，我还不清楚你的能力吗……反正就貌似路线只有一条，考进体制内，嫁个有钱人。这么念叨久了，确实会对任何上学考体制路线以外的事情都恐惧，没有在这条正路上，约等于万劫不复，被抛弃的人，只等生命被慢慢榨干。被影响时间久了就很低能量，不自觉的畏难和恐惧，所以我好喜欢靠近任何高能量的人,0,0,1,北京,北京,北京,中国
49,5009321337293365,一天不喝牛奶都难受_,2024-03-07 16:05:38,被考试支配的恐惧和焦虑 虽然说大专都差不多吧（我是这么认为的 除了公办和民办的区别） 但是不知道为什么就是想考高一点 可能为了面子？ ,0,0,0,安徽,滁州,安徽,中国
49,5009313271383964,K1yoT,2024-03-07 15:33:35,又弃考了哎 考试恐惧症 ,0,0,0,贵州,,贵州,中国
49,5009130787963687,滕滕吃点脑花,2024-03-07 03:28:28,现在我才发现，15岁因为太恐惧而在家打小抄作弊的我和19岁因为考试发抖眩晕失眠的我完全重合，而15岁打完篮球满身汗、插科打诨坏心逗我笑的你却变得不同了，你的19岁踌躇满志志得意满满载而归，拼图因为长大而不再吻合。伤口抻长时间，而我被时间钉在原地，我的拼图小小的，就凝固在那里，一副长不大、也难以愈合的样子。,0,4,9,甘肃,张掖,甘肃,中国
49,5009044781406865,yfgvifdjb,2024-03-06 21:46:42,在长辈眼里，考研复试、考编、找工作、毕业论文都是可以同时进行的每次回家就是被催着考编为什么他们总是觉得什么都很容易就能考上可是我就只是一个努力的笨蛋罢了没有天赋，没有聪明的头脑经历了考研这一年，我对努力已经恐惧了为什么我总是在考试我是人，不是考试机器离了考试，人生就寸步难行了吗,1,0,0,四川,泸州,四川,中国
49,5009042959239941,爱吃ji米花的羊,2024-03-06 21:39:28,读到大三了对考试还是非常恐惧，我是比较在意成绩的类型，调整心态，上次教资考试科一68没过，好担忧，希望这次顺利通过！！！ ,0,0,1,云南,昆明,云南,中国
50,5009691165852522,小熊超级侦探kkk,2024-03-08 16:35:12,天呢感觉我有考试恐惧症好想逃 ,0,0,0,四川,成都,四川,中国
50,5009604742742404,叙述并证明勾股定理,2024-03-08 10:51:47,恐惧且享受考试的刺激 成都·中国民航西南地区管理局 ,0,0,0,四川,成都,四川,中国
50,5009591342207605,秋声萤火,2024-03-08 09:58:32,一直以来最讨厌最恐惧的就是考试；现在更是 ,0,1,1,江苏,南通,江苏,中国
50,5009582352499633,用户1975-,2024-03-08 09:22:49,我这考试恐惧症啥时候能改改 ,0,2,1,河南,新乡,河南,中国
50,5009543360676119,晚霁行舟,2024-03-08 06:47:53,小时候的年少无知不算 生平第一次这么恐惧 上一次发出如此感叹好像还是去年某次考试？ 医生说是焦虑 感觉不像 具体原因不得而知 但这次真的 好怪 不敢睡 我在怕什么我自己都不知道 怕的是什么 真的很奇怪 规律与环境吗 日后注意一下 ,0,0,0,新疆,石河子,新疆,中国
50,5009465204016131,桃小纯pure,2024-03-08 01:37:19,考试临近感觉自己焦虑症又犯了，又睡不着觉了，每天看到书都很恐惧😨像那种看到虫子的感觉，最近心跳的也快，又喘不上气了，昨天临近快睡着的时候突然觉得自己不会用鼻子呼吸了，最近也很容易一惊一乍，只希望考试顺利通过吧 ,0,0,0,黑龙江,鸡西,黑龙江,中国
50,5009446984223160,2zY_ic,2024-03-08 00:24:55,晚修的时候突然想起来…之前初中的时候 期中期末都要考800 然后我是一个特别特别讨厌跑步的人 而且我会恐惧800考试、特别害怕。之前害怕到一上跑道就哭了…但是y出现了之后 每次跑完步都会有人在终点等我  我可以把下巴放在y的肩上休息喘气…ta很香我很喜欢ta的味道  y会给我准备好水 会安抚我…就算是y他们班跑完老师催着回教室 y也会躲在楼梯间或者其他地方看着我跑完全程  让我有种很安心的感觉……,0,0,1,广东,东莞,广东,中国
50,5009423183381229,一菲冲天炮,2024-03-07 22:50:20,辽宁专升本没动力是因为还没感受到考试的恐惧 ,0,2,0,辽宁,沈阳,辽宁,中国
51,5008716005114250,Dw_挽夜色,2024-03-06 00:00:15,我们说着佛系，其实并没有完全躺平。之所以担忧，是不愿意面对当下，不愿意接受现在的状况，而是心里面不停琢磨那些恐惧的事。只有活在当下，面对当下的情景，做出当下最应该做的行动，我们才不会为未发生的事而担忧不已。比如担心几天后的考试，那么从现在起不去想考试那天的事，只做好今天的复习，把今天的 复习工作做好就可以了。担心未来失恋，今天没有失恋，和恋人好好过好今天就可以了。因为每个今天都是过去的未来，过好今天就是过好未来。恰如《当下的力量》中说到，只有当我们深沉而诚挚地过好今天的生活，过去才会丰盈而饱满，未来也才能被更好地开创。当我们真正活在当下的时候，我们会发觉原来有那么多的担忧早已经神奇地消失。#真没必要为三五年后的前途担忧#.#越来越多年轻人确诊淡淡综合症# Dw_挽夜色的微博视频,1,264,96,湖南,长沙,湖南,中国
51,5008521483780548,晚矣宝,2024-03-05 11:07:18,情感 许多感到孤独的人都害怕迈出与他人建立联系的第一步。这种恐惧源于过去的负面经验、自我怀疑或是对被拒绝的担忧。但要知道，克服这份恐惧是建立人际关系和走出孤独的关键。尝试小步前进，不必一开始就期待与人建立深厚的联系。可以从简单的问候、分享日常生活中的小事开始，逐渐建立联系。保持开放和积极的态度，相信自己有能力与他人建立联系，并且每一次的尝试都是成长的机会。即使有时会遇到挫折，也不要轻易放弃。寻找与你有共同兴趣或经历的人，更容易产生共鸣，建立联系。最重要的是，要对自己有耐心和信心。改变和成长需要时间，不要急于求成。相信随着时间的推移，你会逐渐变得更加自信，与他人建立联系也会变得更加自然和容易。#建议取消高中学业水平考试科目#,4,5,11,陕西,西安,陕西,中国
51,5007187963543902,新浪江苏,2024-03-01 18:48:22,【最新通知 #宿迁中考体育恢复耐久跑#】近日，宿迁市教育局印发《宿迁市2024年初中毕业生升学体育考试方案》，里面明确恢复耐久跑（男生1000米、女生800米）为必考项目。评论区聊一聊，#那些年被耐久跑支配的恐惧#  ,1,1,1,江苏,南京,江苏,中国
51,5006805006026417,惠子老师_,2024-02-29 17:26:38,前段时间我连续做噩梦一周，主要集中于考试考不出和追击。实在没忍住，问了做精神分析的朋友，ta问我：梦里什么感觉？恐惧还是焦虑。我想了很久，好像恐惧更多。然后，噩梦就开始减少。因为我觉得：噢，没啥事，原来我只是胆小，怕的东西有点多而已。所以，把遭遇和感受说出来、明确化，是多么有效啊。 ,0,10,62,上海,,上海,中国
51,5005796594944293,钻石牌红烧燕麦通便饼干,2024-02-26 22:39:34,不对劲啊，难道少年时期充满考试的东亚人就只能通过这种“达到考试目标狂喜→努力准备考试精神失常”的循环获得快乐吗？这就是东亚宝宝的西西弗斯吗？哪怕我不愿意承认但我也必须承认，在查到分的时候我所感受到的欣喜居然远超我近来感受到的单个快乐的最高值。在这快乐之后我的恐惧却愈发剧烈，我并不是害怕我没办法克服下一场考试，而是我害怕，我的至臻的快乐只能在这种推粪式的过程中获得。,1,23,40,江西,,江西,中国
51,5004642295486342,小影日记本,2024-02-23 18:12:48,#开学恐惧症#没事……再告诉你们一个消息，不仅要开学，开学了还得交作业，还得离开家里温暖的窝，还得应付同学，还得考试……是不是更恐惧了？（内心:是支离破碎但强装镇定的） 小影日记本的微博视频 ,15,17,18,四川,成都,四川,中国
52,4989650311054216,中国日报-英语点津,2024-01-13 09:20:00,#旧词新解#paranoia：焦虑、恐惧、多疑 “That feeling you get after answering &quot;B&quot; for the last five questions. (考试最后五道题连续选了 B 之后的心情......）” ,3,0,12,,北京,北京,中国
52,4989342440753343,苏小鱼的梦镜,2024-01-12 12:56:38,摩羯座新月开启，土火木三星互动，土星坐镇双鱼座，给予情绪的处理方式不再是逃避，而是承认。承认自己面对未知的事情恐惧，焦虑，感受紧张在胃部，在不断吐气的嘴边。记得很小的时候，考试紧张，上演讲台紧张，大人给的安慰和鼓励都是，不要紧张，放松，放松，心态要好。现在来看，这完全就是在忽略，忽视紧张，不把它当回事，直接想跳过它，企图用轻松来代替它。最后不但没有消解紧张，反而把它藏在了更深处，若干年还要一点点吐纳出来。现在的紧张，至少当下就在意识里了，就在通过呼吸吐纳了，就和胃的感受同在了，没有抛下它不管，更没有用其他取而代之。做到这个程度就可以了，不要再加要求和期待了。已经很难了，身心已经承受够多够重了。,5,0,29,上海,上海,上海,中国
52,4988579426602771,好像没人教过我,2024-01-10 10:24:41,2291【】高柱是一名高三生，每次要上学前都会很恐惧很焦虑，比如晚上睡前会想明天又是做题上课满满当当的一天，我被前两次很失败的考试受到批评严重受挫，上个月做了个手术请假了十天感觉现在也没补上…经常会想要是下次考不好怎么办，恐惧期末，虽然自己很不想这样！但脑子经常控制不住…不想打扰身边同学朋友因为感觉大家压力也很大，想跟猫猫倾诉又支支吾吾的无法表达，家庭关系也不是很好💧可以给我一些建议吗,0,5,11,湖南,长沙,湖南,中国
52,4988068152740543,桀魅魑,2024-01-09 00:33:04,因为太害怕考试太害怕老师学车第一天就又开始深夜垂泪打退堂鼓了……可是不学会开车以后我就不能去自驾游哎不行什么时候才能克服对考试的恐惧啊……不管是不是自己擅长的考试我都好怕，，之前去曼奇期中考都画得我好崩溃，，最后一天直接废了前两天的进度重画的，，，娘啊我的抗压能力是糖葫芦，，,0,9,2,四川,成都,四川,中国
52,4987584444891821,山东大学,2024-01-07 16:30:59,#新技能get√# 【深呼吸有助于抑制负面情绪 】临近期末考试，小山竹们有没有感到紧张、焦虑？清华大学社会科学学院院长彭凯平表示：学会深呼吸，对负面情绪的抑制有很大帮助，尤其是在紧张、焦虑、恐惧的时候，慢慢把气吸进来，可以有效缓解负面情绪。一起来学习一下，以良好的心情备战考试吧！（via@CCTV生活圈）CCTV生活圈的微博视频,1,0,9,山东,济南,山东,中国
52,4986436054942837,Evlyn浅,2024-01-04 12:27:42,看回那年今天，原来去年今天爷爷偷偷跳出了时间。第一次目送家人汇入时间的长河，一年了还在感受无时无刻会突如其来的潮湿。这一年来和奶奶见面时她总会叫我好好读书，读研是您哪怕在离世前几天都在念叨我的事。前年突如其来的开放，考试前我每一日都活在哪天突然倒下无法如常参加的恐惧，那段时间几乎是把自己锁在一个小匣子里。我也开始遗忘了，我们最后一次聊天是在什么时候。您的记忆，也停在了我刚完成全国统考，觉得我一定可以的希冀里。您说，多少钱都不是问题，考上的话您来资助，一定要好好读书好好工作。您有去我学校里看一下吗？复试那一天，我总觉得您在，可能是幻想一下亲人在身边就没那么紧张和害怕了吧。我考研的路上没吃很多苦，也是您在庇护我对吗？我是一个不够听话的小孩，总是有太多自由意志。总让家人们担忧我睡眠不够、吃得太少、遇到不好的人。工作后每次去看您和奶奶，总让我别老用周末两天休息时间跑来跑去，后来准备考研，明明频次减少了，您还是这么说。所以我今天中午去喜欢的日料店，吃了喜欢的鳗鱼定食，我今天吃得很好哦。我最近总是觉得，未来我毕业了，您了了心愿，会从某个维度上慢慢淡去。时间真的很可怕，您几年前还没中风的样子在我心里已经开始模糊了起来。会不会有一天，您也化作一团雾一缕风，不着形状地在我身边。所以，爷爷，您对我还有什么其他愿望吗？虽然最近总是睡得不好，但是可以随时到我的梦里来做客哦。,0,17,6,广东,广州,广东,中国
52,4986191269332070,王盐Charles,2024-01-03 20:15:00,考驾照如何克服对科目二的恐惧？网友提问：我练车的时候都练习的特别好，从来没有在倒车入库上挂过科。但是第一次信心满满的去考试了，在科目二倒车入库，同一个地方，挂了两次。又要去考试了，模拟的时候也有通过的时候，但是一想到第一次的失败，感觉心里就七上八下的。我害怕这一次又会失败了，而且我的这个驾驶报名快过期了，我这次再不过，我感觉自己都快泄气儿了。该如何克服对科目二的恐惧呢？我感觉别人再怎么安慰我，作用都不大。王盐：1、还是要多练，练的越多越好。2、科目二考试的时候难免会紧张，我考科目二的时候，有两次考试机会，第一次太紧张上车忘记拉手刹直接挂了。然后就开始第二次。我当时就心想，这次肯定考不出去了，走完流程算了。就想着赶紧开到结束地点，把车开回去，结果放松下来，反而一次过了。紧张是正常的，你接受它就好了。这次不过，下次再考就是了，你越想一次过，你给自己的压力就越大。,6,8,24,广东,佛山,广东,中国
