页码,微博id,微博作者,发布时间,微博内容,转发数,评论数,点赞数,发布于,ip属地_城市,ip属地_省份,ip属地_国家
23,4981817683739764,7的sense,2023-12-22 18:35:56,#清华大学# 热泪盈眶的致敬！强大敏锐洞察视角教育储备积累发布研判逻辑思维畅享剖析格局先锋观念，百战不殆的酷炫超燃炸裂叙述主导释放前卫撕裂又细腻睿智教育展现创新模式效能转化利用率促进赋能高质量发展！展现绝无仅有的专业学院派至尊经典教育决策部署贯彻品牌巅峰塑造转型砥砺浸润！你对新时代教育使命责任担当召唤初心不变的自信坚毅瞬间升腾@清华大学,0,0,1,辽宁,大连,辽宁,中国
23,4981804746415340,七色花教育玩具,2023-12-22 17:44:32,#益智玩具##逻辑思维#益智玩具#一起家庭教育#  一串一逻辑，思维训练游戏，有点难度更好玩 七色花教育玩具的微博视频 ,0,0,1,北京,北京,北京,中国
23,4981075054952867,面相观察员,2023-12-20 17:25:00,七杀、伤官俱全的人，大多攻击性较强，很善于怼人。如果日主身弱，七杀、伤官都旺而为忌，又没有给力的印星，命主就会逻辑思维混乱，又很难控制自己的情绪。当他们受教育程度不够时，就容易变成杠精。 ,0,0,7,广东,中山,广东,中国
23,4981015367909722,雅思聼力,2023-12-20 13:27:49,【Jordan Peterson教授:如何高效准确地记笔记】记笔记是一个人的逻辑思维展示！如何做笔记？世界著名心理学专家Jordan Peterson教授教你这样记笔记，高效又准确！马住让你的学习效率提升100%，逢考必过！   考前名师精准雅思预测教育☞网页链接  雅思聼力的微博视频 ,2,1,1,安徽,芜湖,安徽,中国
24,4981000117685244,地质饼,2023-12-20 12:27:13,回复@尼龙:没接受过系统的科学教育和逻辑思维训练的人没法理解自然现象之间是否具有相关性，这很正常//@尼龙:宁信乌鸦 不信砖家//@地质饼:太抽象了//@内含子:没关系，不然北京长安街每年冬天都得地震,3,2,6,云南,昆明,云南,中国
24,4980891488616671,晨夕fly3,2023-12-20 05:15:34,好长时间没有因为焦虑而半夜醒了，脑子里就像过电影一样把发生的事演了一遍，那么好一个孩子，怎么就给我教育偏了，自己太急于求成了还是过度焦虑了?没有完美的人和事，可是怎么又能把一件事做到极致呢，好像挺矛盾的。阅读理解能力，逻辑思维，艺术细胞，运动特征，内向优雅端庄已呈现出 ,0,0,0,山西,太原,山西,中国
24,4980762267355042,本知论哲学,2023-12-19 20:42:05,逻辑是望远镜怀疑精神是双眼，逻辑思维是望远镜。没有镜片的镜框叫做形式逻辑，概念明确和内涵同一是望远镜的两个镜片，装上合格镜片的望远镜是同一逻辑，装上哈哈镜片的望远镜就是反逻辑同一律的诡辩法。现在的应试教育不教你学逻辑学，就是不给你望远镜。只让你刷题，就是故意弄瞎你的双眼，只让记住别人说的标准答案。,0,1,3,浙江,宁波,浙江,中国
24,4980297462188406,温爸教子,2023-12-18 13:55:07,有人说，要从小培养独立能力。有人说，要从小培养良好的素质。有人说，要从小培养逻辑思维能力。有人说，要从小培养这个能力那个素质。要我说，家长啥能力和素质都不需要给孩子可以培养。谁能分清楚这个能力那个素质的？儿童教育，不需要那么多花里胡哨的名头，不需要那么多概念性的东西。家长只要，用自己的行为动作，带动孩子养成好习惯，用手给孩子做示范动作教孩子孩子学习方法，让孩子熟练掌握了【好习惯和学习方法】，你奢望孩子的【能力和素质】就啥都有了。 【优秀孩子必备的好习惯】目录想要提高学习成绩，每个孩子的每门课，都要有一个完整的【学习流程】#学习方法# #能量父母成长计划# #微博亲子季#,4,0,4,内蒙古,锡林郭勒盟,内蒙古,中国
24,4979898151866985,最美的艺术生,2023-12-17 11:28:24,储殷：未来孩子靠走数学这条路，具有逻辑思维能力，或者靠人格魅力，身体和心理健康，格局和气质。    未来知识不再匮乏，大多数的知识教育没有意义，以后是一个知识过剩的时代！    储殷 储殷教授 储殷老师 女性成长 自我成长 孩子教育 父母与孩子 ,0,0,0,江西,九江,江西,中国
25,4979555054649758,记录者寒冰,2023-12-16 12:45:03,#清华教授认为鸡兔同笼数学题与现实脱节#  对于这位一天基层都没待过的所谓教授而言，就是何不食肉糜的教育版。鸡兔同笼本身就不是一个是否与现实脱节的问题，是把鸡兔换成什么都一样的训练逻辑思维的题目。 ,0,0,0,广东,广州,广东,中国
25,4979194503889880,骆驼柿子,2023-12-15 12:52:21,我们是缺少逻辑教育的所以我们很容易就很轻信别人的话我们从小到大听到的说服我们的论证大多数是经不起推理的而且这些论述有一个很大的特点，就是隐藏了隐含前提，而我们如果没有清楚的逻辑思维，就会下意识的去认同对方的这种隐含前提举个例子，你被一些人侵犯了权益，比如这些人是你的长辈/老师，三纲五常中地位比较高的角色时，这时你为自己的权益被侵犯而愤怒然后争吵，通常这个时候会有个人过来给你说：再怎么样，他们毕竟是你的长辈/老师，没功劳也有苦劳，再怎么样都是为了你好。你要尊老爱幼/尊师重道。大多数人听到这句话就会有愧疚感，从而选择原谅对方，甚至于责怪自己，但是问题依然没解决，你被侵犯的利益依然没有被补偿。OK，让我们来分析一下这段论证，首先这段论证的结果是什么，结果是你选择了原谅，为什么你会选择原谅，因为他们毕竟是你的长辈/老师，他们有功劳，所以你只能去原谅他们。大家觉得这个论述过程中有没有缺了什么东西，就是看上去似乎有道理，但感觉又没道理公布答案，那是因为他们没有说清楚其中的隐含前提下面我来推导一下这种逻辑思维前提1:他们曾经对你有过付出前提2(隐含）:被付出的人亏欠付出的人推导出结果1:你亏欠他们前提3（隐含）:过去的付出永远偿还不完前提4（隐含）:过去付出的人未来也一直会为你付出推导出结果2:你永远亏欠他们前提5（隐含）:对你曾经付出的行为可以抵消当下侵犯你权益的行为推导出结果3:你的权益受到侵犯，但是你依然亏欠他们前提6（隐含）:你不能责怪你亏欠的人前提7:不原谅长辈/老师是不可理喻的（传统理念）推导出结果4:你必须无条件原谅他们这就是传统教育下人们的逻辑思维，结果就是我们永远都在亏欠，我们没权利去责怪伤害我们的人这个论述过程中的隐含前提才是真正经不起推敲的环节，但是我们的教育会让人形成约定俗成的，以诉诸情感而非推理的逻辑思维，让人发现不了每一环的弱点（未完待续）,0,4,0,湖南,长沙,湖南,中国
25,4978965065761939,easieryy,2023-12-14 21:40:39,渣渣辉又一部力作《怒潮》，喜欢他的电影是因为一直趋向于真实警匪悬疑类，逻辑思维缜密，更趋于事实，给大家很好的警示和教育意义，再加上他本人出色的演技，区别于大多数暴力题材型电影，更具有故事性和教育性，场面更宏大，演员的演技都非常棒，值得一看。#电影怒潮暴力美学# ,0,0,0,黑龙江,,黑龙江,中国
25,4978940928069013,我是蔡蔡__,2023-12-14 20:04:44,今天收到的反馈孩子进步很大，成绩也提高了10月份的时候，家长找我咨询，说孩子逻辑思维混乱，在学校不会和老师同学交流，家长带孩子去测智商，问我怎么提升孩子的逻辑思维能力，我给出了四点建议。看来家长有听进去，并且真的去做了，太开心了，为他们感到高兴。这是让我感到快乐的事情也为这位家长点赞，她实在太棒了肯做出改变，这不是每位家长都能做到的事情。孩子就是家长的镜子。家长变了，孩子自然会跟着变。#教育的力量# #拥有松弛感的孩子如何养成#,0,0,0,湖南,长沙,湖南,中国
25,4978841804868187,黑云恋曲,2023-12-14 13:30:51,自从孩子跟着核桃编程老师学编程后，逻辑思维能力提升了，我的自由时间也越来越多了，这不刷到核桃编程新品发布会直播，自豪感油然而生！创始人的实操教育理念真不错，老母亲我尊滴爱shu！！！ ,0,0,0,广东,汕头,广东,中国
25,4978609251419324,宅家版木木夕,2023-12-13 22:06:46,#苦难##教育##逻辑思维# “永远不要相信苦难是值得的，苦难就是苦难，它不会带来成功，也不值得追求，磨炼意志是因为苦难无法避开。”——余华  宅家版木木夕的微博视频 ,0,1,2,河南,商丘,河南,中国
25,4978153135279489,_张大可,2023-12-12 15:54:20,#读书# 一文讲透“逻辑思维”：在中国教育体系中被压制的重要能力，我来教你如何提升！这篇推文，可以在思考质量、说话艺术、表达能力等方面的提升上，为大家提供极大帮助！内容较长，阅读时间大约20分钟，建议先关注收藏，可以慢慢学习和体会。一、什么是逻辑思维?首先，解释一下“逻辑”是什么意思：逻辑是一个外来词，来自于希腊语“logos”，词义是“秩序、规律、理性和言辞”，西方各门学科的词尾“学”（logy）就是来源于“logos”，汉语“逻辑”由此衍生而来。逻辑在中文的含义是：1、客观事物的规律：例如“历史的逻辑，决定了人类社会将一直向前发展。”2、某种理论观点，例如“只许官家放火，不许百姓点灯，这是哪一家的逻辑！”3、思维的规律、规则，例如“某个说法不合逻辑。”4、逻辑学或逻辑知识，例如“大学生应该上逻辑课。”所以，逻辑思维到底是什么？逻辑思维，是人的理性认识阶段，人运用概念、判断、推理等思维类型反映事物本质与规律的认识过程。通俗点说，逻辑思维是建立在因果关系之上的，反映客观现实的思维方式。在表达上的体现就是，有理有据，条理清晰，理由和依据缺一不可。理由指的是主观上的观点；依据指的是客观上的事实。逻辑思维是分析性的，按部就班做逻辑思维时，每一步必须准确无误，否则无法得出正确的结论。我们所说的逻辑思维，主要指遵循传统形式逻辑的规则的思维方式，常称它为“抽象思维”或者“闭上眼睛的思维”。逻辑思维具有规范、严密、确定和可重复的特点。这就决定了逻辑思维必须——有理有据。什么是有理有据？看下面的两句话：敬则怀忠，畏则怀乱，不治民则民怨怒，民怨怒则必生乱。名不正则言不顺，言不顺则事不成。事不成则礼乐不兴，礼乐不兴则刑罚不中。——《论语·子路》这两句话看似环环相扣，回味无穷，仅是说话有逻辑的体现，但不算是逻辑严谨。因为只有观点，没有依据，从逻辑思维的角度来看是很难有说服力的。二、你的逻辑思维为什么这么差？上干货前，大家需要先搞明白，有些人缺乏逻辑思维或者逻辑思维很差的原因。你肯定遇到过这几个熟悉的场景：1、听人家讲业务讲趋势，好像是听懂了，但让你复述表达，大脑直接空白了；2、刷短视频，一个一个地刷，但死活想不出上个视频说了啥；3、看辩论赛的时候，立场极不稳定，不管哪个选手说话，都觉他说得真对。出现这些场景的原因，是我们陷入了被动接受信息的惯性思维，缺乏主动思考的意识。在《反惯性思维》一书中有一个“看手表”理论：你觉得快到午饭的时间点了，然后你问我几点了，我看了眼手表，告诉你一个数字，你又把这个数字，告诉你旁边的人。乍一看好像没问题，但你从来没想过自己买块表，总是在想知道时间的时候，去问别人。这就是大多数人，总会陷入的惯性思维错误，总是习惯被动地去接受外部信息，也不觉得这样做有什么问题，懒得思考，导致思维能力越来越差。很多时候，逻辑思考能力差并不是你本身的“错”，而是你的思维已经形成了“懒惰”的惯性。所以，我们要学习逻辑思维，并用一些“手段”，找回主动思考的能力。,0,0,0,德国,,德国,德国
25,4977721698420071,王艳敏语言矫正中心,2023-12-11 11:19:57,儿童语言发育迟缓的影响:语言发育迟缓会严重影响儿童的正常发育，影响孩子的智力。不利于孩子的心理健康成长，影响孩子的社交能力，孩子无法正常上学、工作和生活，危害孩子的一生。 语言发育迟缓的问题在我校都能解决，矫正后都能正常说话，交流，认知理解能力、逻辑思维能力都能恢复到正常水平。#语言矫正##特殊教育##语言发育迟缓#,0,0,0,吉林,长春,吉林,中国
25,4977357041697972,行走的栗子君,2023-12-10 11:10:56,每个人都有自己与众不同的特点，要想找到适合自己的位置，最根本的一点是对自己所擅长的一方面有所了解，从更深的层次来说，就是天赋的问题。比如有的人精力充沛，活泼好动；而有的人则感情丰富；还有的人沉默冷静，逻辑思维能力强……再加上后天所接受的教育不同，生活的环境不同，使每个人都有了自己的特长，也就是自己的兴趣。,0,0,0,河南,平顶山,河南,中国
26,4977077993866592,Lucy跳跳妈妈,2023-12-09 16:42:06,我们学校每年都会搞冬季和春季音乐会，看着孩子过半年确实长大不少，有时看得还有点感动。我突然领悟到真正好的教育，就是开发孩子不同的可能，有的孩子在音乐上有天赋，有的孩子在画画上有天赋，有的孩子逻辑思维比非常强…好的学校就是能让孩子发现自己的特长并且提供展示的舞台，而不是只会考试刷题。我觉得这点我女儿学校也算做的不错。,0,0,1,上海,上海,上海,中国
26,4976822300971289,田园将芜湖不归,2023-12-08 23:46:04,世间没有巧合，偶然当中定有必然。 一切的呈现，也没有对错之分，都是象。 把从小被传统教育训练出的逻辑思维，转变成形象思维，形象思维反而有大逻辑。 最终，形象思维要转变成混沌思维。 混沌最近道，到了这个阶段，象也不用看了，脱口即是智慧流露。 #解行证# ,2,2,24,广东,云浮,广东,中国
26,4976435722718843,梦想是考985实在不行就种地,2023-12-07 22:09:57,这两周的工作真的很累，惧怕周末，从一开始一天一节课，到上周末一天五节课，也都坚持下来了，相信一句话难就是在上坡路，还有就是劝大家不要随便改行，从头开始真的很难还有就是感觉孩子们都很聪明，现在大家条件提高了注重孩子的教育，学编程的孩子以后做事肯定有逻辑思维，更容易找到解决问题的方法,0,0,0,山东,青岛,山东,中国
26,4976424582649979,EPstudio905,2023-12-07 21:25:41,宝宝在成长过程中，能够积极参与亲子阅读对他的认知发展非常重要！阅读不仅可以拓展宝宝的词汇量，还能培养他们的逻辑思维和想象力。因此，家长们可以选择一些富有教育意义的绘本和故事给宝宝听，可以让他们在阅读中感受到快乐和美好。 ,0,0,4,,,,
26,4975875810135279,老许日日谈,2023-12-06 09:05:03,第一次用AI生成一个话题，真的太神奇了。AI听说出来已经好久了，就是一直没有太当回事去操作操作，这不，突发奇想，操作一下，看看到底是个什么东东。一操作，哦，天啦，真的逻辑思维超级清晰呢。而且提出这观点，足以让人反思，我随便用的一个软件的AI形成，确实对于思考有一定的意义，你们觉得呢？#南京头条##教育##育儿#,0,0,0,江苏,南京,江苏,中国
26,4975504142895046,电易汇光伏产业大数据,2023-12-05 08:28:11,许多人对逻辑思维存在极大误解，逻辑思维不是纯理论学科，而是实用性极强的一门知识。之所以这样，估计大部分人都被大学时学的逻辑学给误导了，知其然而不知其所以然是中国教育的通病。而如何将理论知识变成实际可应用的技能，关键在于掌握方法。#逻辑思维能力##提高逻辑思维能力# ,0,0,0,北京,,北京,中国
27,4975251951716719,七色花教育玩具,2023-12-04 15:46:04,#益智玩具##教育玩具#好物分享#逻辑思维# 【一串一逻辑-烧脑的逻辑推理游戏】这是一款适合两个或更多参与者一起玩的逻辑推理游戏。利用八种不同颜色的蘑菇钉来设立密码，解码者需要利用最少的步骤把编码者设立的密码揭开，分为初阶和高阶难度，游戏难度可以灵活调整。非常锻炼孩子的逻辑思维能力和推理能力，全家一起游戏更开心，老幼皆宜。适合7岁以上的孩子。 七色花教育玩具的微博视频,0,1,5,北京,北京,北京,中国
27,4975164574139751,美貌包工头,2023-12-04 09:58:51,人生中每一件重大的事件都应该使人成长进步、懂得道理，而不是更加固步自封、陷入狭隘的逻辑思维怪圈。认知模式决定了一个人能到达高度的上限，而认知模式不全来自于外界，更多的则是从小接受的家庭环境的教育。家庭给予的爱固然重要，但光有爱是远远不够的，给予孩子正确的教育引导、思考解决问题的方法对其以后认知发育的影响更为深远。,0,0,2,江苏,南京,江苏,中国
27,4974926903641755,黑黑老,2023-12-03 18:14:26,这世上的知识原来有“正典”、“负典”之分，而窝巢从西域引入几乎为“负典”。这还是7年前偶然发现大姨妈从他那里头一次听说的。 “中学和大学的学生应该接受道德推理和逻辑思维的“经典教育”，而不是种族批判理论。” 专家：学生支持哈马斯 美国大学的问题何在？ ,1,0,0,北京,北京,北京,中国
27,4974881501088366,核武beast程世涛,2023-12-03 15:14:01,乐，要是连这点数学都不学，那怕不是菜市场买菜都算不清楚了，甚至被诈骗都更容易。话说回来，义务教育是让社会成员具备基础的知识能力，换句话说本来就是兜底的教育，顺便晒筛出好苗子。而随着人类社会越来越复杂，数学作为逻辑思维能力的培养基础学科，不好好学的代价会在未来找你的……,0,0,0,甘肃,兰州,甘肃,中国
27,4974856326613013,tomsang的微薄,2023-12-03 13:33:59,评论里说明我们被教育的完全没有基本常识和逻辑思维了,0,0,0,湖南,长沙,湖南,中国
27,4974673232659089,复活换不出就挂身上,2023-12-03 01:26:26,woc，刷到一节石老板的数学课，我居然听懂了，好有意思啊，原来数学是逻辑思维而不是计算。从初中开始我数学就没及格过了，小县城的教育水平就是我初中学三年 ，我觉得不如我在艺考恶补文化班的一节试听课学到的东西多。真的我的古筝启蒙老师水平也烂，甚至还不如我一些学生所以还是不要自怨自艾教育资源，最终也可能是殊途同归，我还是会回到我所热爱的音乐上了。,0,0,0,海南,三亚,海南,中国
27,4974624878365598,羽你一起看世界,2023-12-02 22:14:18,再次被孩子天生的逻辑思维给震惊到。从没教过，但猪大哥自己很小的时候就会了简单的类比，反比，推理等。今晚又发现他已经掌握了概括的能力。吃糖的时候，他拿了一颗绿色的。自言自语道，绿色的味道有，抹茶、青柠檬……想了一会儿说，还有菠菜，还有青苹果。我……老母亲自愧不如～我这是生了神马神兽呀～#小小说##宝宝成长记录##一起家庭教育#,1,1,0,重庆,,重庆,中国
27,4974605068403371,念思一一,2023-12-02 20:55:34,#秦朝乘法口诀从九九八十一开始#乘法口诀是秦朝数学教育的重要一环，从九九八十一开始，孩子们在其中学会了数学运算和逻辑思维。   #秦朝数学课也要背九九乘法表# ,0,0,0,四川,成都,四川,中国
28,4974495326276930,唯一纯白的茉莉花儿,2023-12-02 13:39:30,#张朝阳称去大学讲物理是班门弄斧#物理作为自然科学的重分支，在学术和科技领域都占据重要位。很多人认为，物理知识的传播应该是多方面的，无论是从教育的角度还是从社会的角度来看，大学教授物理能够传承科学精神、培养逻辑思维，这都是非常有价值的。张朝阳的言论也提出了值得思考的问题。当下，社会对于大学教育的期待已经不再局限于传授知识，更多地期待大学能够培养创新能力和实践能力。因此他的言论或许反映了一种对大学教育的思考，即如何更好地与产业融合，更好地培养学生的应用能力。无论如何，张朝阳的言论都引发了公众对于大学教育价值的深刻思考。物理教育的重要性、大学教育的使命和发展方向等问题都值得我们深入探讨和思考。愿这样的讨论能够促进大学教育的进步，为培养更多有志青年提供更加丰富的学习资源和更广阔的发展空间。,36,91,223,重庆,,重庆,中国
28,4973916595949996,台湾风云,2023-11-30 23:19:50,有粉丝私信我，#台湾##郭台铭# 让我断了教育广大社会底层草根政治文盲的念头我看了一下，确实是智障没错。。而且是一个系列的智障文章。还有3个付费的👍🏻，收入15块亮点在评论区:为什么认定只有郭台铭出来才能一定会当选？？这个逻辑思维导图是什么？文章作者回答:他是山西人。。这种人，这群人，不在我的考虑范围之内,0,0,1,重庆,重庆,重庆,中国
28,4973857822217186,nxshare,2023-11-30 19:26:17,多动脑的孩子会越来越聪明，收藏起来只为孩子[玫瑰] 为了培养幼儿园宝宝的逻辑思维能力，可以尝试一些有趣的锻炼方法。比如，通过玩具拼图让他们拓展思维，或者通过简单的问题启发他们的逻辑思考。这些小点子真的很适合培养宝宝们的智力哦！ #亲子教育##逻辑思维##宝宝成长# ,0,0,1,四川,成都,四川,中国
28,4973733540529267,师诚教育-苏苏呀,2023-11-30 11:12:26,言语逻辑思维导图，学完提分20陕西省考#师诚教育#公务员考试 ,0,0,1,陕西,西安,陕西,中国
29,4971736622960701,Joker-X1020,2023-11-24 22:57:24,沟通成本太高了 宁跟明白人打架，不跟糊涂人说话 建议义务教育到高中且包括逻辑思维测验，不合格的一律复读 ,0,0,0,天津,天津,天津,中国
29,4971611637155393,盛善心儿711,2023-11-24 14:40:45,今晚回家，抄《靖难之役》概述，争取把笔记整理出来； ——感谢九年义务教育，教授的数学逻辑思维，(ง •̀_•́)ง ,2,1,0,黑龙江,齐齐哈尔,黑龙江,中国
29,4971539728696991,三只快乐兔子,2023-11-24 09:55:01,教育层面有意识的引导，对事实和逻辑教育的刻意回避，使得无数人对现代文明的基本概念一无所知，也不具备起码的逻辑思维。 ,0,0,0,上海,上海,上海,中国
29,4971295436441084,圆的中心,2023-11-23 17:44:17,好玩而已！试着用数理逻辑范式描述世界首先是一件好玩儿的事儿。“社会科学哪有真理可言？”～这样的评论不止一次看到，但没有回复直接拉黑。数理逻辑“插手”经济学是上个世纪的事情，模糊数学把人类的混沌行为导入也不是什么新鲜事儿。一点感慨而已。记录几年来打通诗性思维、数理逻辑思维的体会，能不能惠及他人我也不知道，能不能带来流量我更不管不顾，我自己觉得好玩儿～不可以吗？其实讲的是通识，懒得再创超话了，先放在圆的诗书画这个超话里吧。圆的诗书画#通识教育#,2,2,5,广东,深圳,广东,中国
29,4970846621009959,飞机在哪里呀,2023-11-22 12:00:51,摘：         人类的认知有两套模式，一是元神，另一个是识神（现代会用心或脑来指代）。识神是逻辑思维、经验判断，偏于社会化，是由长期的后天教育、环境暗示、媒体引导，从外部世界加载而入，为“我”所用的认知模式。         元神是本能和直觉。 ,0,0,0,浙江,,浙江,中国
29,4970480117482056,厨艺教程,2023-11-21 11:44:29,#王国之泪登上大学课堂#《塞尔达传说：王国之泪》成为大学课堂的内容，这是一个颇具创意的教学实践。教育工作者们将这款游戏引入课程，利用其独特的创作系统和玩法，帮助学生更好地学习理工科知识。这种新颖的教学方式不仅可以提高学生的学习兴趣，还能够在游戏中培养他们的逻辑思维和创新能力。 ,0,0,0,广东,中山,广东,中国
