页码,微博id,微博作者,发布时间,微博内容,转发数,评论数,点赞数,发布于,ip属地_城市,ip属地_省份,ip属地_国家
18,5021950573545469,量子位,2024-04-11 12:29:43,#MIT新辐射探测器#：受俄罗斯方块游戏启发MIT 和 LBN 实验室的科学家们最近发明了一种新型辐射探测器。它的外形设计成了简单的四极形状，就像游戏中的那些方块一样。通过这种设计，探测器能够非常精确地判断出辐射是从哪个方向来的。而且研究人员会移动这个探测器，让它在不同的位置进行测量。通过比较这些不同位置的读数，他们就能够确定辐射源的确切位置。更多详情⬇️网页链接,4,0,7,,北京,北京,中国
18,5021941830779611,Blender王子,2024-04-11 11:54:58,搞了一个blender 概念设计的小实验，这样也蛮快的。你说呢 Blender王子的微博视频 ,1,0,4,上海,,上海,中国
18,5021931713335130,福州城市建设迷,2024-04-11 11:14:46,福州无人机（系统）孵化器坐落于福州高新区榕创大厦，是集创新、研发、设计、制造、应用一体的无人机智能产业应用基地，配备共享报告厅、共享实验室、迷你工厂、共享销售等区块，提供无人机科普、企业展览展示、无人机产品交易、青少年手工体验等功能。 ,0,0,15,福建,福州,福建,中国
18,5021922159232066,aPho3obb,2024-04-11 10:36:48,小稿画太细了 多一些未知的 不确定的东西 太确定了 就只有设计感没有绘画性 选材料 还是多做些材料实验吧？ 感觉材料也没什么特别的限制 捡到啥用啥最好 想来想去麻烦死了操..... ,0,0,0,山东,济南,山东,中国
18,5021681111795106,一位有理想有三个小猪的猪爸,2024-04-10 18:38:58,实验高中假期里，泡在实验室里，自己设计化学反应方程式，做化学电池，目标实现更高更稳定的电压。尽管有化学老师的压阵，还有同组小伙伴爸爸的协助，也是化学老师，但是不敌 人家爸爸 是锂电池的高工，直接做出个4V的配方，市场上的都没这么高电压。不过娃比较淡定，既然争不了一等奖，二等奖还是要努力的。这个实验对茜的锻炼非常的棒。开始对这个化学电池实验，我很不以为然，以为写个PPT应付一下就可以了。首先选小伙伴，自由组合，茜拉了两个教师子弟组队，一个化学老师的娃，一个生物老师的娃，由两个老师带队，本以为稳操胜券。结果碰到了职业选手，那也是没办法的。但是 实验步骤 具体方案 得自己搞，压根没整过，也压根没方向。他们几个居然想到用AI 做了整个方案，新一代的年轻人，真的牛。然后 去实验室，实验，不断的试错，排除，坚持不懈，特别遇到困难的时候，不放弃，难能可贵。设计的很完美，但是有电压，没电流，肯定哪里出现了断路。一段一段的查，然后推倒重新一个一个加试剂，发现其中的碳加了太多，可能会引起断路。这个非常赞。做完 当然还要整实验报告。这段经历，对于他们日后的成长会非常有帮助。,3,4,41,广东,广州,广东,中国
18,5021795904127117,炎焱燚熠,2024-04-11 02:15:07,嘿嘿嘿 写完实验设计就是一身轻松 ,0,0,0,重庆,,重庆,中国
18,5021791344918806,Mandelrede,2024-04-11 01:57:00,实验设计的灵感可能会出现在洗澡的时候、做饭的时候、去超市的时候、散步的时候、玩手机的时候、和朋友聊天的时候、看传记的时候，但就是不会出现在认真思考的时候 ,0,0,0,德国,,,德国
19,5021776935389192,MissBonnie_,2024-04-11 00:59:44,说实话写自己想写的论文的时候还是很爽的，会觉得有获得感的，以前我做生物的时候其实写论文做实验在生理上对我来说都很轻松但是完全没有任何获得感，甚至会因为实验过程中长久的没事干感觉到痛苦。就是那种觉得这些protocol都已经被人设计出来八百年了，我只是稍加改动然后照着做而已，感觉好无聊好没意思。我记得我的本科毕业论文，实验做了快一年，但其实成稿只用了一晚上，但内心非常难受，搞毕设期间出现过神经官能症。哈哈、一下到杭州的高铁就屁事没有了（）不过现在写课程论文都很少这么难受，顶多觉得自己写得不够好还需要精进罢了，不会出现那种对自我存在的怀疑。,0,1,0,浙江,杭州,浙江,中国
19,5021763970537260,仔仔加个七,2024-04-11 00:08:13,不想拖拖拉拉但是已经拖拖拉拉的我赶着值30h愿意熬夜抓紧赶个案➕设计实验 但是赶上生理期心脏还一抽抽的疼真的难受啊啊啊啊啊啊！！但是不把它设计出来我更难受啊啊啊啊啊啊啊！！ 吐槽完接着肝！！！ ,0,0,0,天津,,天津,中国
19,5021762932968885,llualla,2024-04-11 00:04:06,我当初为什么要设计正交实验呢… ,0,0,0,湖南,长沙,湖南,中国
19,5021760378373435,o花缇,2024-04-10 23:53:57,这周记得挂心身科门诊普通话考试要拿鞋套 身份证 准考证21号早上大英赛   下午普通话记得看就业指导网课明天给老师说一下抽签比赛情况要交哪些材料？什么时候交？什么时候答辩？答辩几分钟？老师提问几分钟？答辩材料打印几份？答辩PPT和项目计划书有什么要求？15号实验设计大赛的摘要写完这周五交互联网＋PPT计划书今晚体重50.8,0,0,0,陕西,咸阳,陕西,中国
19,5021756446215995,真的是艾克斯x,2024-04-10 23:38:19,哇靠这么难的作业让我来做没搞错吧我能设计出一个实验来还周六就要交 ,0,1,1,上海,上海,上海,中国
19,5021737555334399,奶思小黄敲可爱,2024-04-10 22:23:15,最近真的忙得焦头烂额前段时间被拉去拍阅读分享会短片，连着设计学校20周年校庆logo，然后又被物理老师拉过去帮他拍摄记录实验，今天学校音乐老师说五月份的比赛让我给初中学生做钢伴……离deadline还有两天班主任又通知要出黑板报艺多不压身，艺多压死我还有两周期中考试……我真的很焦虑啊😢怕跟别人说会被人觉得装但是这真是我最近忙疯了的事情啊,0,0,1,江苏,扬州,江苏,中国
19,5021736762871567,胡-四年毕业,2024-04-10 22:20:06,多读文献的好处，就是你设计的本来就很垃圾的实验方案，在做完等待结果的过程中，发现6年前有这么个人已经这么干了并且见刊了。 ,0,0,2,辽宁,沈阳,辽宁,中国
19,5021732165128723,疯着疯着的人生,2024-04-10 22:01:50,4月10日 防溺水家访✓ 理化生集体备课教学设计✓ 中考实验操作✓ ,0,0,0,江西,宜春,江西,中国
20,5021709845663114,荣荣别忘背舒包,2024-04-10 20:33:09,要讲sb实验设计ppt了 无语 ,1,0,0,黑龙江,佳木斯,黑龙江,中国
20,5021702415977783,用户7494772997,2024-04-10 20:03:37,她自己上实验，自己设计的，很好看。而且她答应送给我，全球独一无二😃 ,0,0,1,四川,德阳,四川,中国
20,5021701728111985,望若愚1994,2024-04-10 20:00:53,《最新！九龙坡区2024年新开工学校建设进度》1、九龙坡区实验外国语学校改扩建工程项目：主体工程计划开工时间2024年9月，目前已完成立项批复、设计勘察招标工作；网页链接 ,0,0,0,重庆,重庆,重庆,中国
20,5021696392430792,德众诚国际,2024-04-10 19:39:41,【技术职】机械设计·电子电气设计·嵌入式软件设计·实验/验证 中国国内人才🉑应聘 2025年3月新卒🉑 日语N2必须 ,0,0,0,山东,济南,山东,中国
20,5021685927121139,杭州青少体育频道,2024-04-10 18:58:06,超有创意的“仙鹤IP”！杭州观成实验学校304班的同学们历时两个多月，自己投票、设计、绘画、创作的5款仙鹤笔记本和配套桌垫终于出炉啦！为他们的创意点赞👍你喜欢哪款呢？#杭州一学校的学生们自制文创用品# 杭州青少体育频道的微博视频 ,0,0,0,,,浙江,中国
20,5021682368514465,大鹏发布,2024-04-10 18:43:58,【全球征集令｜2024大鹏地赞艺术设计实验室计划即将上线】 以山为体，以海为底。 在深圳最美的山海间施展设计才华，碰撞创意火花。 一场设计界盛事即将在广东省深圳市大鹏新区拉开帷幕。 全球征集令｜2024大鹏地赞艺术设计实验室计划即将上线 ,0,0,0,,,广东,中国
20,5021670817662907,美国罗德岛设计学院,2024-04-10 17:58:04,#平面设计#   酸性风格的设计以各种尖锐的几何图形或高饱和度渐变色呈现，大量令人眼花缭乱的3D图形、实验性的液态金属字体，个性十足！  #罗德岛设计学院# ,2,0,11,北京,北京,北京,中国
20,5021665865500524,抱歉太漂亮了,2024-04-10 17:38:23,愁啊愁死了我这跟开山大弟子有什么区别，老板之前又没带过学硕，给了两个关键词，剩下的全靠自己找，自己设计实验，又没人做过这个东西我他妈真想鼠 ,0,0,0,陕西,延安,陕西,中国
20,5021663479203904,长沙巴跃仪器有限公司,2024-04-10 17:28:54,"多岐管型冷冻干燥机FD-1E-50产品说明：冷冻干燥机FD-1E-50为T形多歧管冷冻干燥机,适用于安瓿瓶。 对细菌，真菌等微生物菌种的保藏，实验室常采用安瓿封存法。样品冷冻干燥后封装在小安瓿内。它具有保藏期长、变异小，便于大量保藏及适用范围较广等特点。主要特征：1、 冷冻干燥机由台式设计，紧凑，占用台面小。2、外形美观，人体工学设计，操作方便。3、全封闭压缩机，噪音低。4、冷阱开口大，带样品预冻功能。5、冷阱为全不锈钢，冷阱内无盘管，光洁耐腐蚀。6、设计导流筒，提高冷阱有效面积，快速冻干。7、充气阀，可充干燥氮气或惰性气体。8、 冷冻干燥机真空接口，可与多种真空泵联用。9、 数字显示温度及真空度。",0,0,0,湖南,长沙,湖南,中国
21,5021663118494072,长沙巴跃仪器有限公司,2024-04-10 17:27:28,标准型生物安全柜BSC-1300IIB2产品说明：巴跃生物安全柜是一种在微生物学、生物医学、基因重组、动物实验和生物制品等领域的科研、教学、临床检验和生产中广泛使用的负压安全设备，它采用了空气净化技术和负压箱体设计，实现了对环境、人员和样品的保护，是实验室生物安全一级防护屏障中基本的安全防护设备。主要特征：1.恒定的气流100%排放，负压垂层流。2.采用电机，安全柜本身可以自动调节风速。3.紫外灯只有在前窗正确关闭时才能正常工作。4.工作窗开启高度超过规定值时发出声光报警。5.工作区电源输出插座，具有防水保护盖及超载保护。6.生物安全柜采用高效过滤器（或超高效过滤器），对0.3~0.12&amp;mu;m的尘埃颗粒捕集效率达99.999%~99.99957.安全柜前窗可手动开启、易于操作。8.洁净的工作环境，光滑、无缝、无死角，可以轻松彻底消毒。9.工作腔由整块U型304不锈钢板制成，圆角连接，无焊缝，表面涂聚酯可防止UV光线，腐蚀剂和消毒剂的侵蚀。10.可移动台面，可方便清洁工作台面下面的空间。11.过滤器的更换可定期进行，可方便地从前面取出。12.白色内壁，无反光，消除了眼睛的疲劳。13.控制部分设置在工作区以外，可以方便地对其进行检查和维护，而没有任何风险。14.生物安全柜人性化设置，有效保护人体的安全。15.变频风机可自动调节风速，具有自动电压补偿功能。16配备高效过滤器失效报警功能。工作区气流外泻报警。送、排风联锁功能失效报警。,0,0,0,湖南,长沙,湖南,中国
21,5021658022416939,用户7513163845,2024-04-10 17:07:13,慧准医疗咨询集团办理各地区：（可提供地址和人员）●、工商注册  记账报税●、二类医疗器械经营备案，●、三类医疗器械经营许可证●、一二三类医疗器械备案 生产许可●、医疗器械网络销售备案，●、广告审查表，●、互联网药品信息服务资格证，●、冷库的设计安装，临床实验●、化妆品、消毒、食品生产许可证●、商标、专利、3A、知识产权认证●、13485体系辅导 第三方检测 信用评级电话微信：18560131357李经理【  专业   专注  放心   安心 】,0,0,0,山东,济南,山东,中国
21,5021657842059412,世界建筑,2024-04-10 17:06:30,WA设计实验奖 优胜奖 WA丨中国建筑设计研究院有限公司丨国家雪车雪橇中心丨2023 WA中国建筑奖（1） ,1,0,2,,烟台,山东,中国
21,5021651878545281,睡不醒想吃小蛋糕,2024-04-10 16:42:48,有种霸道实验课强制爱的感觉，还要被迫上讲台讲自己的设计 ,0,0,1,黑龙江,哈尔滨,黑龙江,中国
21,5021647977054876,谷德设计网gooood,2024-04-10 16:27:18,厦门翔安区第二实验小学黎安校区 / 一舍建筑工作室（合立道工程设计集团）三园记 – 学园 • 花园 • 乐园gooood谷徳设计网#gooood建筑# 项目选址于厦门市翔安区，环抱于若干自然村落之中。本案拟建一座48班的小学，以重新激活片区的教育空间。我们希望，建筑作为一种教育资源，给使用者带来潜移默化的影响。而我们如何在现有局促又刁钻的场地，创造出既能满足空间需求，又令人惊喜的公共文化建筑？网页链接,2,0,5,北京,北京,北京,中国
21,5021642894606396,潮流牙刷,2024-04-10 16:07:05,……我设计实验……诶，真的假的？ ,0,0,1,北京,,北京,中国
21,5021550248203641,云无心45,2024-04-10 09:58:58,#研究发现每天3个苹果或会帮助体重减轻#这就是典型的“科研游戏”。【欧洲的研究人员发现，40 名成年志愿者因每天吃两个苹果而改善了心脏健康。巴西学者发现，每天吃三个苹果，帮助 40 名超重女性体重减轻，血糖水平下降。】——且不考虑“40名志愿者”的样本数是否足够，也不考虑实验设计是否合理（比如吃了苹果是否调整饮食中的其他组成部分），但就说苹果，换成梨、桃、草莓、桃……有类似的结果么？这就像茶与健康关系的研究，日本发表的多数是“绿茶会……”，英国发表的“红茶会……”更多，前些年云南则是有大量“普洱茶会……”的研究。,4,12,33,北京,北京,北京,中国
21,5021642172666057,西红柿才不胖,2024-04-10 16:04:14,问卷互填 诚信互填！有填必回！ 因为是实验！麻烦认真看一下情景设计！选择真实感受即可！ 🔗在plq ,1,23,2,浙江,杭州,浙江,中国
21,5021641530150996,superrookie_03,2024-04-10 16:01:41,我要辍学啊啊啊啊啊啊问你搜着你就说你那你弟呢被；i自己到哪不打卡我爸sbkzmsmixjsnzhksbsjdjsbxnjekfnshnd化工原理和高分子化学和机械设计和电工实验和材料基础是人学的吗。感觉自己一出生就脑瘫了。好严重的脑瘫。严重弱智。国家发展靠不上我 当垫脚石有我块。我给别人垫脚算了。老尸你也别教我了，你讲课水平也烂得要死一句话嗯嗯啊啊哦哦999次再便秘也一泻千里了。rnm,0,0,0,湖南,长沙,湖南,中国
21,5021631040981083,顶尖包装设计,2024-04-10 15:20:00,#包装设计# 瑞格纳·美味薯片包装 源自丹麦纯正奶酪风味  by 彭狮设计实验室 ,5,1,7,广东,广州,广东,中国
22,5021624892655405,成都高性能纤维材料产业功能区,2024-04-10 14:55:34,【#四川00后造出轻型载人飞机#】4月5日，成都航空职业技术学院应届毕业生李英豪设计的载人轻型运动类飞机在重庆首飞成功。4月2日，该航空器获得中国民航局颁发的西南地区首张实验类特殊适航证。该航空器可用于体验观光、农林播撒、地质勘探等。 成都发布的微博视频 ,1,0,0,,成都,四川,中国
22,5021620759956089,秋明间,2024-04-10 14:39:09,本周初步存活ddl进度5/6！ 剩下就是毕论文献和实验设计了（但是百废待兴啊啊啊） ,0,4,5,北京,,北京,中国
22,5021620735578830,偷看你一眼Zzz,2024-04-10 14:39:03,联系上导师了  他给我从现在到九月入学前的任务全都给安排上了 看书 看他的博士论文 看英文文献 掌握几种研究方法 自己设计实验 暑假提前进组给他打工 写论文 投稿 还要把本科毕业论文发给他看感觉一眼望到头了 ,0,0,1,湖北,武汉,湖北,中国
22,5021601085522587,半个菠萝pineapple,2024-04-10 13:20:58,今天测了四十多个OD值 谁懂呀…好在毕业设计的实验终于做完了 从今天开始我就只需要写论文 去兼职 美美的享受生活喽 ,0,2,2,陕西,西安,陕西,中国
22,5021578794376183,冰逸创意,2024-04-10 11:52:24,ASAP设计的 Max大学实验室： 未来教育的未来场景！ 在一个牧场里出现了天堂。 ,0,0,1,北京,北京,北京,中国
22,5021572781835977,一个炸地瓜丸儿,2024-04-10 11:28:30,实验影像就是不看设计说明谁也不知道你拍的啥看完设计说明再看片子也一头雾水 装置艺术看完设计说明还能有点明白的感觉  实验影像看完真抽象 抽象的画面抽象的背景音乐 根本不知道他为什么要用这镜头表达  搞不了 ,0,0,0,辽宁,大连,辽宁,中国
22,5021567488361376,反-葱-香菜-芹菜-孤独者,2024-04-10 11:07:28,看完#种地吧# 去云南看拍卖花，昨晚做梦🤤能到自己在那里捡漏（没拍完的会处理掉，我去捡处理掉的🌹）有暗蓝色的玫瑰还有粉红色的🌹，捡完我还在那里写作业（场地太像图书馆，又有免费🆓零食），写的还是微生物实验作业，老板娘看到我在写过来看，看完吐槽：这谁设计的实验(●v●)🧪一个梦，没有连贯性🙃一会跳这一会跳那,0,2,0,福建,,福建,中国
22,5021563332067659,攻略奥利奥,2024-04-10 10:50:56,最近天天待在交互设计实验室和老师做东西，感觉很开心 ,0,0,0,北京,北京,北京,中国
23,5021504352551433,红色经典白,2024-04-10 06:56:35,林治波：20240404德国政府承认没有大流行德国传出重大消息，联邦政府被迫承认所谓的「 阴谋论家 」在新冠 大流行期间的一切都是正确的。事实上，根据德国政府的数据，根本没有发生大流行，只是一场精心设计的军事级 心理战 ，目的是给大众 洗脑 ，让他们接受实验性 疫苗 ，从而带来灾难性的后果。这些透过资讯自由请求和随后的诉讼获得的德国政府 秘密文件 揭露了全球精英的新冠谎言，让尽可能多的人了解真相至关重要。【点评】同样，包括本人在内的我国爱国者，对于共济会和美帝投毒制造瘟疫，制造社会恐慌，诱逼公众注射疫苗的阴谋的揭露和预警，是正确的。,58,9,36,内蒙古,鄂尔多斯,内蒙古,中国
23,5021550375863176,爱梦到谁梦到谁,2024-04-10 09:59:28,实验真难设计 ,0,0,0,河南,信阳,河南,中国
23,5021547914068680,坏小子亓,2024-04-10 09:49:41,#触摸生活中的“极”智科技#话说洗车模式北汽极狐以“场景化造车”为理念，将汽车的设计与使用场景紧密结合，很细心的挖掘车主需求，不断丰富满足车主的智能化用车需求。“场景化造车”理念的落地，让北汽极狐更加贴近车主生活。车机中的HYGGE实验室APP，里面有小憩时光，极致节能，清新换气，精心冥想，宝宝睡眠，户外露营，旅途独醒，极地探索等情景模式，还可以自定义全新的模式。今天我们来说下洗车模式。在中控屏点击hygge实验室 ＞ 洗车模式即可进入该界面。开启洗车模式之后，自动调节空调、车辆到设定状态，门窗会自动调节，也可通过物理按键进行调节。日常使用时，唤醒语音助理说“打开洗车模式”即可开启洗车模式。洗车完成后，唤醒语音助理说“关闭洗车模式”，或者点击关闭退出。空调温度、门窗位置以及车辆，恢复到开启洗车模式前的状态。另外，在中控屏点击hygge实验室 ＞ 洗车模式，设置空调、车辆和门窗功能。之前去自动洗车机上洗车，需要手动关闭所有门窗以及天窗，然后将车辆调节到内循环。这里面的每一项都很重要，但是有的时候会检查不仔细，导致车窗没有关闭洗车喷水直接喷到车内。有了小狐狸之后就不会了，只要语音告诉小狐狸，或点几下屏幕就可以了。这两天我又给小狐狸洗了个通透。,0,0,1,北京,北京,北京,中国
23,5021543391823059,返朴,2024-04-10 09:31:43,X-59是一架独一无二的实验飞机，它是一款设计飞行速度在1.6-1.8 马赫的#超音速飞机#，关键它在突破声障时非常“安静”，其传到地面的声爆音量大致相当于6米外关车门的动静。X-59将于今年首飞，一旦经过相关测试，美国国家航空航天局计划在2026年让它飞越选定的城市，以获取更多实验数据。这些数据或许将打破商业超音速飞行的限制——在过去的50多年里，由于声爆对航线周边地面社区的巨大干扰，美国禁止民用飞机在其陆地上空飞行速度超过1马赫。#微博公开课##微博知识+#  低声爆飞机首飞在即，超音速旅行指日可待？,6,1,13,北京,北京,北京,中国
23,5021542960073327,近卫T-34,2024-04-10 09:30:00,用于432 (T-64) 工程的实验型挖掘设备。 但是坦克的任何额外设备都意味着车组的额外负担和成本的增加。 结果，T-64A在前下部安装了哈尔科夫设计局开发的犁刀，也能很好地应对其任务。 #苏联坦克装甲车辆# #烽火问鼎计划# 近卫T-34的微博视频 ,8,5,13,山东,威海,山东,中国
23,5021537887588089,Kristal超粉,2024-04-10 09:09:51,可恶的毕业设计，要怎么办，没有实验数据 ,0,0,0,内蒙古,呼和浩特,内蒙古,中国
23,5021533691712326,Tarowwx,2024-04-10 08:53:10,我说吗的shi 学校 论文中期报告一个老师都不讲怎么写 带做实验的学长也不讲 怎么我是第二次毕业是吧 我身边的人也没一个人知道的 还有什么论文指导日志 你们当时就不讲 现在四月了来提醒毕业生了 我实验还没开始做你让我交中期报告 不看各位老师安排进度的是吧 谁给大学生发明毕业论文毕业设计这种要人命的东西的 怎么我现在飞回学校也来不及吧,0,0,0,安徽,黄山,安徽,中国
23,5021532840002752,-酸奶续命,2024-04-10 08:49:47,窗外的樱花🌸 最近做完实验都会被实验室楼梯外面的这一幕治愈，平时上楼都不会留意这里，直到日本晚樱的盛开配上恰到好处的设计，疲惫的时候看到这一幕，瞬间就会忘掉烦恼，享受风景的同时心情都变得舒畅了，枯燥的生活需要美景来治愈！ ,0,0,2,浙江,杭州,浙江,中国
23,5021522161044166,辣评糖,2024-04-10 08:07:21,在东京涩谷一片三条道路交叉口的飞地，Miles Pennington 与东京大学 DLX 设计实验室设计建造了一座公共洗手间，将展览、影院、快闪亭、信息中心等功能融入其中，创造了一个综合社区空间。为增强作为公共设施的使用感和社区感，实验室在建筑门厅开发了一种座位系统，一系列可升降的金属柱被嵌在地面，在需要时可能够升起连接，成为长椅。建筑的其他部分也被充分利用，赋予更多公共功能。这座建筑成为一个交点，连接了笹塚和幡谷地区的社区，本身洗手间的主体反而成为整个空间里跟其他功能交互的一部分，把公共空间以更开放的形式融入在地社区生活。#设计#,0,0,4,江苏,南通,江苏,中国
23,5021491823903153,马头人车库,2024-04-10 06:06:48,昨天参观长城汽车，有个交互体验实验室挺吸引我。它是利用VR技术来测试人车交互的设计是否合理，比如车机好不好用啦，会不会影响开车啦，后排功能用起来方不方便等等，测试员会先在虚拟世界中体验设计师的设计，如果不好用，就会出现犹豫、紧张、厌恶等负面情绪，然后被仪器捕捉到，设计师就拿回去改，一直改到让测试员体验好了为止。讲真，现在有些新能源车型为了追求设计与众不同，往往会忽视人机交互的合理性，说大白话就是中看不中用，大概率就是在开发过程中缺少交互体验实验的环节。这可能就是为什么长城这两年的车型，不管外观内饰设计得好不好看，但上手使用起来一定让你觉得很舒服。#长城汽车#,0,0,9,河北,保定,河北,中国
24,5021416259585813,椰青乳,2024-04-10 01:06:32,写了一个小时实验设计 我现在阳气已被吸干 ,0,5,1,湖北,武汉,湖北,中国
24,5021410160804346,BurgerKingLove,2024-04-10 00:42:18,毕设中期的反馈很不好啊论文理论逻辑和实验方法论之间有不匹配，关于理论的理解和关于实验设计与数据收集的方法和理解都不够，有点小寄了，关键是还要涉及到编程，更是重量级的煎熬啊有点救命了 ,0,6,3,荷兰,,荷兰,荷兰
24,5021398453720603,飞跃晨昏线,2024-04-09 23:55:47,5月之前，如果能把论文完成80%，大体结构，实验中的问题思路以及难点都理清楚回忆清楚，形成完整的报告。实验设计完成60%，思想汇报以及材料写80%，平时组会表现不错，五一就奖励自己去看王一博的新电影！ 加油！！ ,0,0,0,吉林,长春,吉林,中国
