页码,微博id,微博作者,发布时间,微博内容,转发数,评论数,点赞数,发布于,ip属地_城市,ip属地_省份,ip属地_国家
34,4975616766512927,四川超格教育,2023-12-05 15:55:42,🔎瑶瑶整理——教心笔记带背 重点大默写：第二章 心理发展与教育                     第三节 社会化发展与教育  每章节课程结束后格格都会给大家同步带背重点哦！ 赶紧🐴住学起来！打卡完成的宝子扣&quot;111&quot;~  四川省教师公招#四川教师招聘##四川教师公招# ,20,0,11,四川,成都,四川,中国
34,4975588873865253,真有妮的好运女孩88,2023-12-05 14:04:52,#中史# 2黄炎培实用主义职业探索，批评，职业教育萌芽，第一个，江苏省，上海中华职业教育社，后来创立学校，形成方针，社会化，第一，参与社会互动和发展，第二，考虑人民大众利益职业教育思想体系1作用，个人—个性，谋生，服务社会，国家生产力，对社会-改善民生地位，一贯，整个，正统2.目的：无业者有业，有业者乐业3.方针：社会化，科学化社会化-宗旨，目标，组织形式，办学方式科学化-用科学来解决职业教育问题，物质，人事4.原则，手脑，知行，理论联系实际，知识技能5.职业道德教育：敬业乐群乐群，高尚情操，合作精神敬业，尽职，做贡献总体：平民，实用，社会，科学职业教育之父,0,0,0,浙江,绍兴,浙江,中国
34,4975272082279747,山东法制报,2023-12-04 17:06:03,【同心黄丝带  携手育新人——#德州# 监狱与民盟德州市委会举行“黄丝带帮教”启动仪式】为进一步拓宽社会帮教渠道、创新帮教形式，凝聚罪犯教育改造合力，提升监狱工作社会化水平，12月4日，德州监狱与民盟德州市委会举行“黄丝带帮教”启动仪式。活动中，民盟盟员、新闻媒体记者等60余人共同观看了纪录片《新跨越——德州监狱安全稳定和文明发展工作纪实》，并参观了罪犯生活、学习、劳动现场，详细了解罪犯教育改造成果。启动仪式上，德州市政协委员、民盟德州市委会副主委李晓东与德州监狱党委副书记、纪委书记武传将共同为“黄丝带帮教”基地揭牌。民盟德州市委会办公室主任刘文远与德州监狱党委委员、副监狱长刘润锋签订帮教协议。德州监狱党委委员、总会计师刘蒙主持会议。德州教育改造科负责同志为心理专家韩海岭教授颁发教育改造名师工作室特聘专家聘书。启动仪式后，韩海岭教授为罪犯开展题为《情绪的自我调节》心理健康讲座，27名持有心理咨询师资格证的干警和180名罪犯现场听讲。中美协会员、山东省美术家协会理事姚向东等5位书画名家开展了书画帮教活动，现场进行了艺术作品创作和捐赠，并对罪犯进行了书画艺术指导，24名罪犯书画爱好者参加活动，交流学习。长期以来，德州监狱充分利用社会资源，在社会帮教方面持续发力，大力实施亲情帮教、“书香狱园、文化润心”等活动，有力推进帮教工作社会化进程。“黄丝带帮教”基地揭牌成立后，德州监狱将积极联合民盟德州市委会，组织帮教志愿队伍来狱组织开展爱心义诊、心理疏导、法律援助、文化帮教等活动，使“黄丝带帮教”工作真正取得实效。该狱还将不断拓宽帮教渠道、丰富帮教内容、深化帮教形式，以罪犯教育改造工作高质量发展推动监狱工作现代化。（通讯员：方延杰 张文娟）,0,0,0,,济南,山东,中国
35,4972633313515570,即墨发布,2023-11-27 10:20:32,【青岛即墨：打造社区里的少先队实践教育“样板”】少年儿童是祖国的未来、中华民族的希望。自第二批主题教育开展以来，即墨区持续推动少先队社会化改革纵深发展，在全区77个条件成熟的社区（村庄）成立少工委，潮海街道和玉社区便是其中之一。详情请戳链接：青岛即墨：打造社区里的少先队实践教育“样板” ,2,1,11,,青岛,山东,中国
35,4972019602957481,天涯客G2049,2023-11-25 17:41:52,零分  接受过五千年奴化驯养教育的学子把脸丢到国外了 [捂脸] 没有哪一个父母迎接孩子来到这个世界上是希望他或她为享受苦难而来 偏偏有一种教育在颂扬苦难的同时  还把能吃苦耐劳 勤劳才能致富当做社会化教育  一代代韭菜从此前仆后继努力吃苦只为要做人上人的梦…… 生命的过程本该是一段快乐的体验之旅  生而为人快乐就好  所以  当你背着房贷 车贷 助学贷  美容贷  还被教育 医疗 住房 养老资本化后的大山压着时  醒醒吧韭菜  我脑海里曾经的儿歌 “我们是共产主义接班人”呢 [笑脸]不算数了  只能是梦一场 精通掌握了驭民五术的官僚们在愚民  弱民  辱民  贫民  疲民的路上轻快的哼着心中的歌 ………… 做个好官  让人活成人类该有的幸福的样子吧！最近看到网上对两个标语争论不休 “全心全意为人民服务” 以及  “以人民为中心”  到底哪个体现团队执政理念更深入人心且明了 ？见仁见智吧  我这个老农咋总觉得“以人民为中心”是半句话呢 [捂脸] 中国文化真是太博大精深了⑧,0,0,0,北京,北京,北京,中国
35,4971639381164646,爽爽贵阳品质白云,2023-11-24 16:31:00,#品质白云向新而行# 【党建引领 | 白云区龚家寨街道组织国有企业退休职工党员开展党性教育活动】11月21日，白云区龚家寨街道国有企业退休人员社会化管理中心组织90余名国有企业退休职工党员到贵州省瓮安县猴场会议遗址开展党性教育活动。【党建引领】白云区龚家寨街道组织国有企业退休职工党员开展党性教育活动 ,0,0,1,,贵阳,贵州,中国
35,4970931970902129,财新周刊,2023-11-22 17:40:00,【心智｜精英制造】皮埃尔·布迪厄是法国当代极具国际影响力的社会学大师，给我最大震撼的是他的教育观点。心智｜精英制造　　教育，在个人层面，向内是获得知识、完善自我；向外是通过获得知识，完成社会化；在社会层面，看似是在弥合社会差距，但也在制造区隔，这样人群就会分为两类，读书人与非读书人。最后一个观点，是布迪厄倾注一生关注的重点。　　布迪厄作品的底色是激进的，《国家精英》是他在教育领域的集大成之作。这本书的一个观点是——精英是如何被造就出来的。也可以说，《国家精英》揭秘了“造神运动”。这里的“神”，是精英群体。　　早在几千年前，中国的陈胜、吴广揭竿起义，喊出：“王侯将相，宁有种乎！”　　若将“王侯将相”换成“精英”，同样可以发出类似疑问：精英是自出生就是精英吗？相信很多人毫不犹豫地回答，当然不是。,3,1,3,,北京,北京,中国
35,4970631033524978,孬话梅,2023-11-21 21:44:11,社会化是榴莲，有人天生就喜欢这味，有人天生闻了就觉得是屎。社会化是三轮车，会开就开，不会开拉倒。一个真正文明的社会应该允许社会化训练不足的人也能舒适地生存，性少数可以正当维权，社会化缺乏者怎么活？现在典型的霸权统治，高度社会化的人把社会化当做必需品，教育制度满眼的社会化内容。社会化是G点一样的东西，不存在但让所有人高潮了一百年,0,0,0,湖北,武汉,湖北,中国
35,4970279764761442,曹莓啵啵Yuu,2023-11-20 22:28:22,我妈是一个就算在家睡觉也要全妆的精致女人。我是一个非特殊情况不化妆的舒适主义。 曹泡泡是一个十岁还踩奶的妈宝猫。 曹发财是一个从不踩奶的小猫。 我的社会化教育导师是我妈，曹发财的社会化导师是泡泡。 很显然，他们不会把受教育的人教育成自己。 ,0,2,0,江苏,苏州,江苏,中国
35,4970095963016111,兰州安宁,2023-11-20 10:18:00,#禁毒# #禁毒宣传# 【禁毒进行时】科教城社区：禁毒宣传进商铺为进一步加大禁毒宣传力度，全面提升个体商户识毒、防毒、禁毒的能力，深入推进禁毒教育社会化，发动群众积极参与到禁毒斗争中来，11月10日，孔家崖街道科教城社区禁毒专干在沿街个体商铺开展禁毒宣传进商铺活动。活动中，禁毒专干通过发放禁毒宣传手册及调查问卷的方式，向店主及顾客宣传了相关法律法规，使广大店主认清毒品对个人、家庭、社会的危害，同时，重点讲解了“依托咪酯、笑气、聪明药”等新型毒品不断变换包装，伪装成“彩虹烟”“奶茶”“可乐”“跳跳糖”“神仙水”“巧克力”等，倡导大家共同携手，自觉抵制毒品，要在思想上、心理上、行为上树立毒品防范意识，构筑拒毒防线。此次宣传活动得到了广大商铺经营者的积极响应，增强了大家禁绝毒品的决心，筑牢禁毒防线，使禁毒宣传教育深入人心，为构建平安、和谐、无毒的社会环境作出贡献。,1,1,2,,兰州,甘肃,中国
35,4969929368932974,一直苟下去__,2023-11-19 23:16:01,打电报 教育概念功能与社会政治经济文化科技与人身心健康社会化个性化主导作用有目的科学文化现代化教育目的概念五育理论依据 制度概念类型 课程定义类型理论目标定向最重要 评价理论 掌握组织形式课改从目标内容实施评价管理师生等 教学定义原则方法实验法理论过程关系 德育含义过程结构原则方法类型 反证法！任意不好说,0,0,0,天津,天津,天津,中国
36,4968263120061545,葫芦岛市检察院,2023-11-15 08:54:56,锦州监狱：情暖高墙润人心 社会关爱助回归为深化教育改造工作，推进监狱工作社会化，近日，锦州监狱邀请省人大代表及锦州中心医院、锦州医科大学附属医院专家来监开展帮教活动。　　在工作人员的引导下，人大代表、专家参观了民警执勤区、服刑人员生活区，并观看了服刑人员教育改造、文化改造成果展示。　　随后，省人大代表、辽宁华英律师事务所主任靖瑛琳为服刑人员进行普法讲座，通过理论与案例相结合的方式，教育引导服刑人员知法、学法、懂法、用法，让他们积极改造，回归社会后能遵纪守法，减少重新犯罪率。锦州中心医院和锦州医科大学附属医院专家为服刑人员进行义诊。　　锦州监狱将始终坚持把改造服刑人员作为中心任务，积极探索“监狱+社会”教育改造模式，全力实现将服刑人员改造成合格守法公民的目标。来源：辽宁法治报,0,0,0,,葫芦岛,辽宁,中国
36,4967703194371582,chenxichang91897,2023-11-13 19:50:00,11月13日 《生活教育》      陶行知先生提出“生活教育”的理念有近100年了，但无论过去还是现在，都有着对“生活教育”的误解。有些似是而非的口号，比如“学校社会化”，“教育生活化”，“学校即社会，教育即生活”，这些以偏概全、本末倒置的理解作为教育理论进行传播就容易导致更多的人曲解如何用生活来教育好学生。      生活是教育的源头，而不是教育的调剂品，教育的根本意义是带来受教育者的生活变化。陶行知先生认为“生活教育是生活所原有，生活所自营，生活所必须的教育。”这是教育本身是来涵养生命的，生命的高度、广度和深度是通过生活体现出来的，生活的教育既来源于生活，也服务于生活。      生命的高度是我们人生的境界，是我们对生活的领悟，是在生活当中一点点活出来的，生活的教育教会我们更加超越和豁达；生命的广度是我们人生的视野和阅历，是生活的见识和积累，生活的教育帮助我们不断突破自我的认知；生命的深度是我们对生命的理解和回归，生活的教育帮助我们看见生命的伟大、神奇和神圣，生活当中所有的一切都是帮助生命醒来。,0,0,0,湖北,武汉,湖北,中国
36,4967420935798995,清河漼氏,2023-11-13 01:08:24,现代的教育的目的就是培养能够满足社会化大生产需求的人才，这就是通识教育，能成为一个听话照做的人，就是最合格的人。所以很多人都搞错了，以为教育的目的是为了培养独立思考的人，其实，教育的目的是为了培养零件，也就是听话照做的人，所以在考试当中，所有的答案都是标准的，你只要默写下来就可以了。我们在学校里学到了知识，但是绝不是智慧。,0,0,0,山西,太原,山西,中国
36,4965860282205835,小唐小唐蜜罐软糖,2023-11-08 17:46:55,最近经常会冒出不想结婚，不想养育下一代，不想再跟这个世界多任何联系的想法，并且越来越觉得很合理，毕竟我自己的生活都一团糟，哪儿有精力去孕育，教育，社会化一个（甚至可能更多）新的生命呢。 ,0,0,0,云南,昆明,云南,中国
36,4965772668175720,你见过瓦尔登湖的清晨吗,2023-11-08 11:58:46,没有分寸感的人给我的感觉就是  既没接受过教育又没接受过社会化训练 跟低级动物一样 ,0,0,3,湖北,,湖北,中国
36,4965727668799465,qazwscedcrfvtgbyhnujm,2023-11-08 08:59:58,不得不说我这边非常皮的小孩很适合欧美教育，人家小学一年级除了母语字母啥都不学，就学控制脾气，如何社会化与人相处，还给孩子设置情绪小屋。 ,0,0,1,广东,,广东,中国
36,4965492402947326,东南北没有茜,2023-11-07 17:25:06,现在的教育最大的麻烦是，学生只知道标准答案，而不知道怎么提问题，甚至缺乏问题意识。整个教育社会化的目的是要提高人的功能，产生好的、可见的、可数字化测量的，这样才有普遍的适用性。（毛诗篇x刘擎x水哥：怎么看待人工智能下的教育？） ,0,0,1,北京,北京,北京,中国
37,4965171162775622,Clare--An,2023-11-06 20:08:35,一个有生命的个体是如何成为一个人的？是在动物本性之上添加了我们界定为人的特征？还是人性天生内在的潜质有待必要的条件才表现出其本质特征？或者，幼儿天性本无定形，受着外在影响，因此需要文化教育和社会化过程把未成型的潜质塑造成一个人？最后，要对这些问题作出有意义的回答，是否需要区分“作为”人还是“体验”为人？——前者考察行动和外表是否符合人的标准，后者则考察个体主观经验的特性。#心理成长联盟##心理咨询师##心理咨询#,0,1,5,北京,北京,北京,中国
37,4965107211961758,李休成,2023-11-06 15:54:29,父母教育很重要。但时代潮流影响父母后，所教育出的孩子又不一样。学校老师同学只是社会化教育。,0,0,1,浙江,,浙江,中国
37,4964305910891114,衡阳禁毒,2023-11-04 10:50:24,【衡山县组织观看禁毒题材电影】为进一步提高广大群众识毒、防毒、拒毒意识及能力，加大禁毒宣传教育力度，不断推进禁毒社会化工作的深入开展，近日，衡山县禁毒办组织各乡镇、各单位、各学校观看禁毒教育电影《带你归家》，观影人数达八千余人。衡山县组织观看禁毒题材电影 ,0,2,1,,衡阳,湖南,中国
37,4964059202722297,榛子雪顶美式,2023-11-03 18:30:04,越来越感觉，教育就是把人社会化的手段，年纪越小越野蛮，年纪大一点社会化程度越高。 ,0,2,1,河南,郑州,河南,中国
37,4961883267273201,怪兽家的暹罗猫,2023-10-28 18:23:41,阴天就适合窝在家里抱毛孩子✨小棉袄是猫舍里年纪最大的猫🐱已经步入了猫生的第七个年头 相当于人类的52岁了👵依然还是那么粘人懂事🥰像一只未成年小猫咪一样喜欢静静的窝在人的怀里喜欢娇嗔着撒娇默默委屈地吃醋…一个完整的童年以及专业的的社会化教育产生的影响之深远足以影响终生✨而一个有缺陷的原生家庭则需要用一生来治愈💕人如此猫亦是如此家有暹罗猫#传统暹罗猫# 深圳,0,0,5,广东,深圳,广东,中国
37,4961418270738785,教育学考研er,2023-10-27 11:35:57,学科教学英语考研24教育学考研背诵打卡—埃里克森的心理社会化发展理论①感知运动阶段的早期(0-1.5岁)；②自主对羞怯(1.5-3岁)；③主动感对内疚感(3-6.7岁)；④勤奋感对自卑感(6.7-12岁)；⑤少年期和青春期(12-18岁)；⑥青年晚期(18-30岁)；⑦本期包括中年期和壮年期(30-60岁)；⑧(60岁以后)相当于老年期。,0,0,0,江苏,南京,江苏,中国
37,4961380890314416,滚动的小猪贝,2023-10-27 09:07:25,2003年，还有个热词叫“留守儿童”。因成年人长距离打工，成长期间与父母分离的小孩。所以，到了20年后的2023年，网上出现什么极端言论都不奇怪。二十来岁的青少年里，字面意义上没有父母教养，基础教育极差（语文是体育老师教的，不是梗，是事实），社会化教育欠缺的人群，累积起来，数量恐怕得有八位数。2016年，妇联做的留守儿童情况调查，说全国有留守儿童902万，占农村儿童比例约28%多一点，每四个孩子里就有一个长期与父母分离（剩下的三个还没算流动儿童）。二十多年，走转移支付和项目资金的渠道，天文数字的资金涌入内地城市，撑起密密麻麻的（含烂尾）楼盘、园区和风景区，撑起某些地方省会引以为傲的奢侈品零售业。而当地数量庞大的留守儿童群体，除了一部可以用来刷短视频和喷人的手机，似乎也没有得到其他从天上掉下来的钱，不管孩子念书，不管未来养老，先搭个撑面子的房壳子，其他花天酒地挥霍掉——这种行为短视而愚蠢，未来贻害无穷。但怨种血牛只有埋头挣钱接济兄弟的份，兄弟们拿了钱怎么花，轮得到你管？他们拿着钱灌一肚皮黄汤，让老婆孩子喝西北风，说起来那也是你的错，都怪你太小气网页链接,0,0,3,上海,上海,上海,中国
37,4961241880331933,多邻国辅导,2023-10-26 23:55:02,教育心理学第2章第3节是社会化发展与教育@超格燕飞 @超格教育 超格#超格教育# ,0,0,2,山西,大同,山西,中国
38,4960726007680006,每天都有新实习,2023-10-25 13:45:09,我感觉现在商科教育缺乏一个社会化通道，现在基本都要本硕博一路读下来才能去教学，但其实这样的老师甚至都不知道外面的世界长什么样，很多东西都是跟社会脱节的。其实最合适的，应该是开放给外部一些授课型教师岗位，甚至都不用给编制，让这些有经验的人来做教学，肯定教学质量很好的。就好比，我当初上学时听投资学，基本都是在听老师讲理论+段子，现在一想，感觉那个教授讲的确实不怎么样。如果让我现在回去讲投资学，肯定要靠谱很多，同样的也适用于会计学、公司财务、运营管理、市场营销等等。现在的问题就是老师教自己的，学生随便学学，然后靠着实习积攒真正有用改的技巧。学校不教真东西或者教不了真东西，好学校的商科学生更多是在用自己学校的名气和自己的聪明智商来解决学习和就业问题。这样对商科学生来讲也是很麻烦，大家都是靠实习学，那么理工科的、文史哲的，都可以靠学校名企+校外培训+实习来积累同样的能力，商科的一比就很痛苦了。,24,24,355,广东,深圳,广东,中国
38,4960844117445989,如月诗音,2023-10-25 21:34:28,读《河边的错误》小说  一个受教育的人逐渐变成一个社会化的人的过程。所有人物如机械般凝重，嵌合在每一道沟槽里。一颗颗螺丝在流水线上被组装上去，运载的机器越发沉重，终于停在了生产线的末端，成为了新的生产机器。 致所有曾年轻过的人。 ,0,0,0,山西,太原,山西,中国
38,4960719377533060,日啖溏心蛋两颗,2023-10-25 13:18:48,一老师每节课都说大家伙社会化程度太低，不关心这个锅嘉也不关心这个社会，接着用了两个小时给我们大抒情，过去的三年那啥期间她是怎么在许多瞬间热泪盈眶怎么自豪的……大姐，只能说你没有做错任何，你特别值得我羡慕，受高等教育半生归来仍然在学校，你才真真正正是社会化最低的那批人。。。 ,0,0,0,吉林,长春,吉林,中国
38,4960527070267404,洋蓟钟II,2023-10-25 00:34:38,有没有想过禁养犬种的立法其实是无效的，就像并非所有的德牧都危险，温顺的犬种也会产生攻击行为。不推动公众教育来鼓励人对狗进行社会化训练，不立法约束不负责任的人，想当然觉得狗天生能够解读人的行为，那要怎么防范狗伤人，除非咱们来把这个物种灭绝了。 ,0,0,1,四川,成都,四川,中国
38,4960432395388468,一个普朗克质量,2023-10-24 18:18:26,一个困惑。社会化的过程中，我们被教育沟通要“表达需求，而不是表达情绪”，社会了之后，再社会化，又教我们要纯纯地表达情绪（发疯）。所以人的天性是不是本来就领先于社会文明，还是说现在是乱纪元文明人都先脱水倒下了？ ,0,0,0,浙江,杭州,浙江,中国
38,4959944668351453,NNWAN1985,2023-10-23 10:00:23,遇到过最乖的狗狗是外滩的一只小博美，一般来说小型犬会比较吵（体型不自信），但这只狗子我和闺蜜远远看着它可爱，就互相问了句，能摸吗？它听到了就从站着的状态坐下了，明示我们可以摸，我们饿狼扑虎似的就上去一顿撸。狗子是人最好的朋友，人类也要好好教育，做好社会化训练才对狗子是负责的。 ,0,0,0,上海,上海,上海,中国
38,4959583706809893,小乌龟爱碳水,2023-10-22 10:06:03,#陈牧驰吴楚一 小说情节# 招惹真心其实是一件很麻烦的事情。因为人心非常晦涩，既有道德驯化，也有兽性底色——人不过也就是动物，趋利避害、自私自利是天性，后天的教育无非就是给动物穿上了一件社会化的外衣，平时无风无浪穿了也就穿了——利益受损时可不就图穷匕见。真心就是这样，顺势时，阳光灿烂，分分钟都妙不可言；逆境时，低劣丑陋，饱蘸血泪算计和嫉恨不甘，像一个受伤的刺猬一样，竖起满身的刺，生怕自己再吃亏一点。谁也不能，超过人性，谈感情；超过自己，爱别人呀。干净无垢的爱，只存在于小说里、剧本里，浪漫的女作家乌托邦的想象里，说不定，没结婚的还在和未婚夫为块儿八毛拉扯着彩礼，结了婚的写完去厕所，为丈夫又没冲水、小孩又窜稀了而大发雷霆。生活没有童话，鸡零狗碎里哪写得出诗呢。可是，即便低劣丑陋，饱蘸血泪算计和嫉恨不甘，那也是活生生、血淋淋的真心啊。真心没有换来真心，那转账就该及时退还。践踏真心这种话太虚无了。没谁规定，爱一定要有回音。但欠债还钱，天经地义。请还钱。,1,0,5,安徽,池州,安徽,中国
38,4959225614698979,原烽_BOE,2023-10-21 10:23:07,"【#张朝阳曹德旺称教育是事业而非产业#】教育是一种培养人的社会实践活动，育人是教育的本质。然而教育事业发展现实中，人们往往视教育为产业，将学校教育事业视作第三产业,错误强调其服务性、生产性、工具性等。其实教育事业不是社会化的工厂，教育活动还传递知识、文化、精神等，即缔结着人类文明，是促使人类种族繁衍，发展和进步的重要行为。需要民族、国家、团体、家庭共同的投入和参与,具有一点的公益性。中国经济周刊的微博视频",11,4,38,北京,,北京,中国
38,4958838154068839,交通广播大厅,2023-10-20 08:43:29,教育医疗产业化社会化，就只能让其畸形发展。,0,0,1,陕西,西安,陕西,中国
40,4955561592095820,该用户很懒没什么想说的,2023-10-11 07:43:36,低情商：责骂孩子 中情商：教育孩子 高情商：社会化孩子 ,0,0,0,重庆,重庆,重庆,中国
40,4954317067127522,Kikko-Cola,2023-10-07 21:18:18,有时候感觉自己是一个特别缺少挫折教育和社会化训练的自闭症儿童知道吗。 ,0,5,4,辽宁,沈阳,辽宁,中国
