页码,微博id,微博作者,发布时间,微博内容,转发数,评论数,点赞数,发布于,ip属地_城市,ip属地_省份,ip属地_国家
2,5023332955850299,Bssgxhp,2024-04-15 08:02:48,离开互联网以后，和格林的对话像韩语学术研究。 ,0,0,0,重庆,重庆,重庆,中国
2,5023302880067607,王诺的思想回忆录,2024-04-15 06:03:17,知识谱系研究指南搞清楚知识谱系，是所有学术研究的前提，也是发现政治、经济、文化等社会问题的症结并找出解决问题途径的前提。对于科学研究来说，没有对知识谱系的科学认识，就无法确认研究的必要性和研究的价值。一句话，知识谱系研究是一切自然科学与人文社会科学研究必不可少的基础。对于知识谱系研究具有指南性的原则有如下三条——首先是穷尽性地把握，不论是中国的还是外国的，所有已有研究都要一网打尽。知识谱系的建立要以文献的全球范围穷尽性搜索为前提，至少也要在全球主要学术语言——英语文献范围内做到穷尽。没有知识谱系梳理的治学根本算不上科学研究，只能算自说自话；知识谱系的边际只能抵达本国当代或者本国古代的研究，哪怕研究对象是本国的，也算不上严格的学术研究，只能算井蛙之见。中国高水准的自然科学研究已经基本做到了穷尽把握相关中、英文文献知识谱系；而人文学与社会科学研究如果做不到这样，就别指望实现其研究的人类前沿性和全球独特性。第二是系统性地把握，包括纵向的发展演变系统和横向的逻辑关系系统。对于已有研究与论述的梳理，绝不能只是流水账一般的记录复述，更不能是标题、关键词和摘要的堆积拼凑。系统把握分两个方面：概括古往今来所有重要论断观点，辨析每一个重要论断、每一类基本观点的历史贡献、创新与缺陷，把握前人研究的承启发展关系、否定反拨关系、阶段特征和发展趋向；根据逻辑关系与思想层次，将古往今来国内国外所有创新观点系统化，构建出已有研究的观念系统，将每个创新观点放在该系统恰当的位置上，把握这个知识系统中的失衡点与不足方面。第三是发现并论证自己研究的必要性与创新性。知识谱系的梳理和建构本身只是科学研究的过程和手段，其目的是确定自己研究的必要性、创新性及其价值和方法。因此，这方面的论证才是落点和关键。如果没有自己研究的必要性和创新性论证；那么，所有的知识谱系梳理和研究都失去了意义。这种论证分纵横两方面——前人早就做过而且做得很好，自然绝不能再做；前人未能攻克的难关、争论不休却达不成共识的问题，自己的研究能否解决难题或消弭纷争；自己的研究在前人基础之上究竟有多大的创新或多大的应用价值；自己的研究要怎么做才会不重蹈以往研究覆辙，要采取什么不同方法才能突破前人研究的瓶颈。解决当代人的问题乃至困境危机，填补某一具体问题或具体对象的研究空白等等，都是确定自己研究方向的理由；但最有学理性的创新则是对知识谱系的完善——通过自己的研究，使知识谱系实现均衡而非失衡、达到完形而非畸形，使系统的逻辑起点、关键节点的论断和假说被证实证伪，使系统漏洞被填补、系统匮乏被丰富。如果一种研究能达到这类目标，就具有了最高的学理价值。知识谱系的逻辑系统建构对自己研究的价值论证能提供最充分的理由。配图取自网络,1,1,4,福建,厦门,福建,中国
2,5023259712029804,只是个药狗,2024-04-15 03:11:46,只要不和客人打交道的话 我就还蛮喜欢现在的工作的 以前的我可能怎么也不会想到现在的我居然在干类似学术研究的工作 人生真是充满惊喜！ ,0,0,0,美国,,美国,美国
2,5023232398721166,灵意艺术田炳信,2024-04-15 01:23:13,确保敏感词管理不会误伤到非恶意的言论，需要采取一系列审慎的措施和原则：1. 精细化管理：敏感词的设定应当具体、明确，避免过于宽泛的定义，这样可以减少对非恶意言论的误伤。同时，应当区分不同类型的言论，如新闻报道、学术研究、艺术创作等，对这些特殊领域给予适当的宽容。 2. 语境考量：在判断言论是否敏感时，应考虑其语境和意图。同样的话语在不同的语境下可能具有完全不同的含义。因此，审查过程中应当全面考虑言论的背景、目的和可能的影响。 3. 透明度和可解释性：敏感词的管理和审查应当具有必要的透明度，审查标准和过程应当公开透明，让公众了解哪些内容可能被视为敏感。同时，对于被标记为敏感的言论，应当提供清晰的解释和申诉途径。 4. 人工审核与自动过滤相结合：虽然自动过滤技术在处理大量信息时效率高，但容易误判。结合人工审核可以更好地理解言论的复杂性和多样性，减少误伤。 5. 建立申诉机制：为被误判的言论提供申诉渠道，确保言论发布者有机会纠正错误的审查结果，并得到公正的对待。 6. 持续教育和培训：对负责审查的人员进行持续的教育和培训，提高他们对言论自由和社会责任的认识，帮助他们更好地处理敏感内容。 7. 定期评估和调整：敏感词的列表和审查标准不应该是一成不变的，应根据社会变化和公众意见定期进行评估和调整，以减少不必要的限制。 通过这些措施，可以在保护社会秩序和尊重言论自由之间找到一个平衡点，最大限度地减少对非恶意言论的误伤。,0,0,1,北京,,北京,中国
2,5023218461311761,VitaliVogt,2024-04-15 00:27:51,哎哟我想哭大晚上的在做学术研究 ,0,0,0,广东,韶关,广东,中国
2,5023190989931251,鲸鱼就在那儿,2024-04-14 22:38:41,忽然想到了去年去岳麓书院。书院一部分用于展览，一部分用于学术研究交流。了解到书院的历史和发展。拍了很多照片。惟楚有才，于斯为盛。令人印象深刻。 ,0,0,0,江苏,苏州,江苏,中国
2,5023185695149491,Iakiay,2024-04-14 22:17:39,周围考研的同学都无一例外的上岸了 都还是些不错的学校 说不羡慕是假的 但心里没有一点不甘和后悔 嗯 我或许真的不适合做学术研究 那就好好工作吧！ ,0,1,0,浙江,宁波,浙江,中国
2,5023163995394362,热情的小葵,2024-04-14 20:51:25,一搞学术研究就两眼发黑，是艺术生没错了。 ,0,0,0,福建,厦门,福建,中国
2,5023140763140428,芝麻口味冰,2024-04-14 19:19:05,拆那大学生所谓的学术研究其实就是场学术骗局，大家都知道学生怎么写论文的，结果大家都装不知道实际情况，还让学生写论文毕业 ,0,1,0,江苏,南京,江苏,中国
3,5023131127516430,小虾滑蒸饺,2024-04-14 18:40:49,我他妈写个日记都语句不通顺，还搞上学术研究了 ,0,4,1,江苏,苏州,江苏,中国
3,5023125263614957,Leeyingjiiiii,2024-04-14 18:17:31,找到不考研的理由了，讨厌搞学术研究写论文 ,0,0,1,广东,珠海,广东,中国
3,5023114889790143,木木晚愚,2024-04-14 17:36:17,（不知何时没发出去的摘录两行）从地缘和社会横向比较的角度来看，但凡是对西方文艺化入程度越深的，横向比较的落差越大，自我定义的必要性也就越强所谓的比较文学的典型已不单单是属于一种超脱的学术研究活动，无论其出发点是自觉的还是不自觉的，它都意味着创作者精神上的自我冒险，以及加人这种冒险活动带来的新型表达与想象的可能性。V.S. 奈保尔对写作题材的寻觅，加西亚•马尔克斯 “马孔多小说”的反复建构，表面上看只是一个如何写作的问题，实质是意味着跨国的文化转换过程中遭過的问题。所有共生，所有混杂都将导致巴洛克主义,0,0,1,浙江,杭州,浙江,中国
3,5023095604119673,蔚蓝色乱码_,2024-04-14 16:19:39,@程沉沉沉沉:。。师生就是师生呀。。师生是不可以变成妻子的，变成妻子了你就再也不能坦率地拍拍他的肩膀再和他一起搞学术研究了。。如果变成妻子了你们就只能在夜晚一起缩在被子里再钻进欲望与爱的温床了。所以师生只能是妻子。。哦不。。我是说。。所以妻子只能是师生。。抱歉。。我是说。。呃呃。。,0,0,0,北京,北京,北京,中国
3,5023079467582443,诗人麦扬,2024-04-14 15:15:31,搞学术研究，就是为了搞钱，最终变成了搞笑的教育事业,0,0,0,天津,,天津,中国
3,5023079351193049,RDJ爱飞豆ga,2024-04-14 15:15:04,滚啊啊啊啊啊啊啊啊啊脑残周末训你妹啊有这功夫不如好好搞点学术研究别他妈把心思放在这些无关紧要的b事上 重庆·荷麗可COFFEE HOLIC(南坪协信店) ,0,2,0,重庆,重庆,重庆,中国
3,5022758537004624,蔡雅奇刑法,2024-04-13 18:00:16,长沙的这个案件，是个很好的学术研究“素材”。  53岁的保安队长涉嫌性侵65岁女保安，这是第三次性侵，终被告发被逮捕。  #实务案例看一看# ,12,25,57,河北,保定,河北,中国
3,5023071499453158,LyinEye_,2024-04-14 14:43:52,龙图三变这个任务也太弱智了，我跑图跑得头晕，老毕登坐享其成，就这还学术研究我真想掐死。 ,0,0,1,福建,厦门,福建,中国
3,5023052708448908,小心爱吃烧烤,2024-04-14 13:29:12,4月10日#北邮15名研究生联名举报导师# 出现在我们视野，我想起今年一月份#华中农大11名学生联名举报信长达125页#  。我认为这两起事件本质是相同的，导师严重师德失范是学生不惜赌上自己的前途来换取光明的原因。导师学术不端以及学术造假等行为给学术环境带来了非常恶劣的影响，这影响以后的学术研究成果以及教育公平。阿尔兹海默症至今没能得到根治就是因为奠基性文章学术造假导致此类研究倒退了16年。每一位研究生都是辛辛苦苦备考很长时间，经受着身心压力才成功“上岸”，他们有着对未来的美好憧憬，有着对知识的殷切渴望，而因为遇上师德失范的导师他们的梦想破碎，希望崩塌，在举报之前他们肯定也经受了很多我们无法想象的崩溃瞬间。此类举报事件也会让许多想读研究生的学子产生迷茫，如何才能找到优秀的导师让研究生生涯是有意义有结果的。只能说师德失范影响的范围太大了，希望教育界加大对此类事件监管以及惩处，还学术之清明，还学子之未来。,0,0,0,吉林,长春,吉林,中国
4,5023050196060597,J小纪同学,2024-04-14 13:19:13,“仙境海岸，鲜美烟台” 如果您游览过烟台，感触颇深，请您在百忙之中根据自身真实感想抽空填写这份问卷，问卷作为学术研究，不涉及隐私。十分感谢 ,0,0,1,山东,泰安,山东,中国
4,5023050156215164,用户7903809914,2024-04-14 13:19:04,马列毛高新科学研究的是人类起源，探索的是宇宙奥秘，揭示的是各种特异现象，寻求的是人类未知的知识，铲除的是私心，换来的是健康，她属于学术研究性质，任何人不得垄断。马列毛高新科学的理论基础是宇宙间高级智慧生命——我们创造了你们人类。我们是你们人类的共同祖先，我们不但在地球上创造了人类，在宇宙间其他星球也创造了人类。所以我们说你们都是我们的万代子孙。你们都是兄弟姐妹。为什么你们人类现在看不到我们？是因为你们人类目前科技水平还很低，你们利用的只是电能，我们掌握利用的是光能，而光能要比电能高之百倍千倍。宇宙间未知的知识还太多太多，比如说宇宙间好多奇异现象的发生，你们都无法考证和解释。如果我们贸然与人类见面，你们从科学的角度还解释不了，又归到唯心上去了，还会给社会造成混乱。所以，我们利用光能将自身掩盖起来，等时机成熟我们是会和人类见面的。,0,0,0,山东,烟台,山东,中国
4,5023037466347262,一盒维他小豆奶,2024-04-14 12:28:38,真的想知道学术写作给我带来了什么，因为我现在英语水平一塌糊涂、学术研究啥也不会，但是莫名其妙在各大平台花了很多钱，并且一周去电影院看了三次电影，光电影票就花了150 ,0,3,0,北京,,北京,中国
4,5023025330390672,樰莯-,2024-04-14 11:40:25,🥺去年做了八个月LGBT学术研究 了解到了超越性别的爱 今年在小红书刷到了一对异国les情侣 其中一方是美国人 却为了女友来中国工作生活 她们越过了性别和地域的障碍 太让我受触动了！ 世间还是有真挚的感情的🩵 我追求的东西也不过如此 追求着自我价值的实现和纯粹的爱 ,0,0,0,浙江,宁波,浙江,中国
4,5023011642804298,山鸽丷,2024-04-14 10:46:01,阅读一本好书，就是与智者交流和思想碰撞的机会。可以将学术研究贡献分为两种：常规性知识和开创性知识。前者是知识的持续性累积之部分，后者则是突破了已有轨迹的新思路、新方向。开创性知识常常是可遇不可求的的机会，倘若碰到，那就不要放过，仔细阅读，让它成为激发自己的思考和想象的动力和机会。布尔迪厄的《论国家》正是这样一本好书。读书笔记,0,0,1,陕西,西安,陕西,中国
4,5022998664840850,海棠师傅,2024-04-14 09:54:27,紫微斗数。卯酉宫太阳天梁同度，天梁化科1，太阳、天梁在卯酉宫，会太阴独坐及借会天同巨门， 三方四正会煞曜时，则不构成日梁昌禄的格局2，天梁化科之后，孤克程度减轻，就能发挥太阳的优点，对学业和事业都好，也利于人际关系3，本星系最适合从事学术研究或科研开发类的工作太阴、天梁本身就具有原则性强的特点，所以有利于研究学问，适合专业性强的工作。4，如果有文曲化忌同度，最好独立研究比较冷辟、偏门的学问或技术，不适合与别人合作，否则反而容易有纠纷,0,0,0,浙江,宁波,浙江,中国
4,5022992423716271,卡卡卡167,2024-04-14 09:29:39,《陈寅恪的最后20年》：五六十年代的知识分子，一会被贬低歧视戴帽子，一会儿又被尊崇优待享特权，不仅我反应不过来风向，当时的人也反应不过来吧？其实没必要给特权，更不可实施歧视，让他们安安静静的做点学术研究，不好吗。 ,0,1,3,江苏,泰州,江苏,中国
4,5022991844376617,请来一份脆皮鸭好吗,2024-04-14 09:27:20,感觉自己压根不是做学术研究的料。。。。。。。 ,0,0,0,贵州,黔东南苗族侗族自治州,贵州,中国
4,5022865774871300,mommmmmmoki,2024-04-14 01:06:24,学术研究有的时候是以结果为导向的 但人的成长不是 ,0,0,0,四川,成都,四川,中国
4,5022863294202231,IIIIINDePENDENT,2024-04-14 00:56:32,都研究生了，还时常怀疑有些同学搞没搞过学术研究 ,0,0,0,新加坡,,新加坡,新加坡
5,5022856818461466,守望者熊猫,2024-04-14 00:30:48,终于把这学术研究伦理培训上完了，可以开始研究立项了，好累感觉我的英语阅读速度亟待提高 ,0,1,0,马来西亚,,,马来西亚
5,5022837821670744,拎箱牛奶站你门外,2024-04-13 23:15:19,之前觉得遥不可及，深不可测的东西学术研究现在懂了一点它的八股逻辑，最近终于开始get到了打框架提问题想机制的迷人之处，布迪厄、帕特南的书又能看懂一点了，一天一天慢点像琴靠拢，真的好幸福 （请大家多多践行公园20分钟理论🙇♀️double幸福） ,0,13,9,江苏,南京,江苏,中国
5,5022830452807557,Harleytzx唐老师小课堂,2024-04-13 22:46:02,《深圳大学研究中心好不好？在学术研究、人才培养等取得显著成绩》播放量：178 作者：唐老师小课堂网页链接 ,0,0,0,云南,昆明,云南,中国
5,5022828193646454,Quixoticme,2024-04-13 22:37:04,《椰壳碗外的人生》（本尼迪克特安德森回忆录）第三章“田野工作”太精彩了，多亏了他用讽刺挖苦的笔调讲严肃历史，才令我惊觉自己把《想象的共同体》还是读得太浅了，以及从他的整体自述中可以懂得，“好运”虽然在学术研究的每个关键时刻会起到重要作用，却也不能忽视了若想获得此般效用，就必须考虑如何靠自身的强制或半强制的干预，将“好运”转化为“方法”，否则田野永远只能是理想的田野，而无法成为现实中的行动领域。,0,0,0,湖北,恩施,湖北,中国
5,5022810684265313,程时旭,2024-04-13 21:27:29,最近看文献没啥动力，可能是看了很多仍然没有看见回报吧。我等本就是俗人，急功近利，做事操切。学术研究之类的工作，除非有极大的热情，一般人做不了。还是看肥皂剧，体育比赛，歌星演唱会，大厂新产品发布会，以及谈论股市和明星八卦，才是一个社会的主流啊。 ,1,4,10,广东,珠海,广东,中国
5,5022795212522325,宁波之声,2024-04-13 20:25:59,【MoAE馆藏及学术研究系列展：观念的演化”开展，全景式呈现中国版画时代脉络】今天（4月13日），华茂艺术教育博物馆举行“MoAE馆藏及学术研究系列展：观念的演化”开幕式，此次展览是华茂艺术教育博物馆首次大型艺术家群展，汇聚了中国版画史上的经典之作及“八大美院”版画艺术家的当代作品，共展出作品两百余幅，通过重现经典、接续古今，全景式呈现中国版画艺术近百年来的观念演化之路。本次展览分为“1980年代之前：中国现代版画的起点”和“1980年代之后：中国版画的当代转型”两大单元，精选了华茂艺术教育博物馆馆藏的罗清桢、李桦、胡一川、江丰等艺术家的经典版画，特邀徐冰、谭平、苏新平等当代艺术家的版画作品参展，题材广泛、内涵丰富，生动勾勒出中国版画近百年来的叙事结构与时代脉络。中央美术学院教授、博士生导师、本次展览学术主持张子康评价道：“本次展览作品跨度近一个世纪，为我们了解中国版画发展历程提供了一个全景视角。因此，这次展览不仅是对历史的一次深情回望，亦是对版画未来的殷切展望。”据悉，本次展览由将持续至6月16日。（宁波台记者李宁报道）,0,0,0,,宁波,浙江,中国
5,5022787482160642,榴莲撞地球·,2024-04-13 19:55:17,我真的很搞不懂为什么参考文献非得要有个外文？？？有外文也就算了，还得要个10篇那就是没有外文我就完成不了这个学术研究，就是必须得装一下这个外文文献的b啊，参考文献没有外文我就是学术垃圾是吧？来个学术很牛逼的人给我解释一下行吗？我真诚的提问 ,0,0,0,浙江,绍兴,浙江,中国
5,5022747646497569,李成东,2024-04-13 17:17:00,很多人不愿意相信，中国也有优秀教授院士，还有更多的优秀学生。但治校的不是搞学术研究的，普遍存在以政治为导向。学术研究的氛围太差！#东哥笔记#,12,13,31,北京,,北京,中国
5,5022780628403927,为什么睡不着尼,2024-04-13 19:28:03,搞学术研究也太刺激了 今天觉得有思路了明天就把你的路堵上 今天没找到相关参考文献明天就找到了可以参考的其他研究对象参考文献 今天搞明白了研究方向方法觉得能发期刊了 明天就发现最大的问题在于根本没有数据 真tm刺激一个半月的努力白费了 ,0,0,0,天津,,天津,中国
6,5022758696387089,寻鹿1098,2024-04-13 18:00:54,跑步【有偿招募】🙌🏻大家好！天津大学 计算社会科学实验室近期在做运动爱好者的社交媒体分享相关研究，有偿招募多名运动爱好者进行一个小采访，采访时间不超过40分钟。采访内容仅做学术研究，整理材料时会进行化名、编码处理，绝不会泄露您的个人信息！🎁我们会根据采访时长支付一定的报酬。如果您符合要求并愿意加入我们，欢迎私信联系我！👉希望您：是运动/跑步爱好者 经常在微博/小红书/抖音等社交媒体平台发布跑步动态并且动态能够获得他人评论🎤访谈时间：40分钟以内访谈形式：腾讯会议（不出镜）【声明：访谈过程中有任何疑惑的内容，您可以要求我们停止访谈】#调研##招募##社会科学#,0,0,0,天津,,天津,中国
6,5022716307966513,Long--S_,2024-04-13 15:12:28,麻烦大家填一下啦，仅作学术研究，谢谢大家 ,0,2,2,辽宁,大连,辽宁,中国
6,5022686423813006,ci偲,2024-04-13 13:13:43,北京最难约的博物馆：中国考古博物馆据说每天就接待500名游客，周一闭馆周二接待团体。我约了好几次都没约上。感谢网友告知有空余预约号，我终于约上了，实现了打卡的愿望中国考古博物馆以“历史中国，鼎铸文明”为主题，以“仓储式陈列，沉浸式体验”为特色，集展览展示、收藏保护、学术研究、宣传教育为一体。常设展厅7000多平方米，展品6000多件，基本陈列包括“文明起源”“宅兹中国”“大国一统”“和融万方”“民族觉醒”五个专题。我闺蜜问我怎么突然对这个感兴趣。我：因为难约，所以好奇,0,0,0,北京,北京,北京,中国
6,5022677498332755,纯洁的轮舞,2024-04-13 12:38:15,求文！攻好像是一个大学理科老师，受好像是一个摄影师。受追到攻后同居了对攻很好，但是攻一直在做学术研究，冷落了受好几年，受终于忍不了提出了分手，后面就是攻追妻，让我印象最深刻的是攻用理科里的知识来重新追受！推文找文 ,0,1,2,江西,宜春,江西,中国
6,5022676685688835,楚嘉中琴,2024-04-13 12:35:01,#研究生应该收父母给的生活费吗# 这个问题涉及到不同文化背景和个人情况的复杂因素。在一些文化中，父母给予研究生经济支持是一种家庭责任和孝道观念的体现，同时也有助于减轻研究生在学业上的经济压力，让他们更专注于学术研究。然而，在另一些文化中，研究生可能更倾向于自立更生，通过自己的努力来维持生计，从而更好地培养独立性和责任感。关于是否收取父母给予的生活费，可以考虑以下几点：首先，理解父母的出发点和意愿，如果他们给予支持是出于爱和关心，那么接受也是对父母之间的一种尊重和感恩；其次，考虑自己的实际情况和能力，如果自己有能力并愿意自己承担生活费用，也是可以的；最后，足够的沟通和理解，与父母坦诚交流，寻找双方都能接受的方式。这是一个需要根据具体情况和价值观进行衡量和选择的问题，可以考虑平衡父母的关爱与培养独立性的需求，以及个人的经济实际情况来做出决定。,0,0,0,湖南,益阳,湖南,中国
6,5022393103551161,调皮的陀陀,2024-04-12 17:48:10,搞学术研究真的非常累，也需要天赋。  其实一个学者，作品不在多，在精。  我在翻译完《老子》、《周易》等几部经典后，也不会再写 ,0,7,49,四川,成都,四川,中国
6,5022660590830046,阿希xii,2024-04-13 11:31:04,发现身边的大家好像都有学可上，有美好的未来可搏，反观自己，华农没上，调剂放弃……虽然都是我自己的选择，但还是有一丝丝的懊悔，怎么我就不能上呢，怎么我就比别人差呢……但是这也是我深思熟虑后的想法，我不喜欢科研，不喜欢学术研究，我去读研又何尝不是不是束缚住自己了呢？希望自己能早早想开吧～现在也是有地方上班，而且同事们也很好相处，我也过的很好！！不要气馁了呀！！加油,0,1,0,湖南,长沙,湖南,中国
6,5022353056335674,中国考古网,2024-04-12 15:09:02,#学术研究# 汉晋时期河西走廊张掖地区的开发研究——以黑水国汉代墓葬为例：黑水国汉代墓葬出土的农具、动物骨骼、农作物遗存和人骨为人们了解河西走廊张掖地区汉晋时期生业经济和农业发展等问题提供了重要证据。通过动物骨骼、农作物遗存鉴定结果和人骨碳氮同位素检测结果，可以揭示汉晋时期黑水国人群的食物结构和生业模式特点。网页链接,7,0,14,,北京,北京,中国
7,5022635178329117,翟振轶律师,2024-04-13 09:50:05,中国政法大学听罗翔老师讲法定犯的辩护，他以研究鹦鹉为例，介绍危害珍贵、濒危野生动物罪。  他说，所有的刑事辩护都是学术研究。 ,0,0,2,北京,,北京,中国
7,5022628270309771,钱红波0706,2024-04-13 09:22:38,前天在泉州见到的这块交通指路标志距今天已经有上百年的历史了，可以说是中国交通工程领域的活化石了！具有非常重要的学术研究和文物价值！#交通设计#交通安全#交通标志#文物#图说交通[超话]#同济大学@泉州交警 #泉州头条# 上海·陆家嘴 ,0,1,1,上海,上海,上海,中国
7,5022624042452408,Liebe-Grund,2024-04-13 09:05:50,为什么中国人不能研究德法法律？难道我不懂德语和法语就不配研究？？？翻译器真的是阻碍学术研究的洪水猛兽吗？还是实际上是白人对中国人彰显优越感的借口 ,0,0,0,英国,,英国,英国
