页码,微博id,微博作者,发布时间,微博内容,转发数,评论数,点赞数,发布于,ip属地_城市,ip属地_省份,ip属地_国家
2,5023071599330548,爱可可-爱生活,2024-04-14 14:44:16,【Mltraq：一个开源 Python 库，专门为 AI 开发人员设计、执行和共享实验，可以跟踪任意内容，流式传输、复现、协作和在任何地方恢复计算状态】'Mltraq - Track and Collaborate on AI Experiments. - Track and Collaborate on AI Experiments.' GitHub: github.com/elehcimd/mltraq #开源# #机器学习# #人工智能#,41,2,25,北京,北京,北京,中国
2,5023355454097113,A-期刊论文杂志社发表,2024-04-15 09:32:12,《漫科学 科学教育》省级，维普月刊，纸质刊 ，3版5000字符起发 收：科教论坛，科学教育研究，科学普及与科赛突破，创新人才培养，科教改革，教育信息化，科教实践与科学实验设计，科技成果转化，科教融汇，整本256页 ,0,0,0,河北,张家口,河北,中国
2,5023339921802721,溧阳发布,2024-04-15 08:30:29,日前，市第二实验小学开展以“锦绣华服 寻梦春日”为主题的校园华服节系列活动，让学生感受传统文化的深厚底蕴。 活动当天，老师、学生们身着民族服装、中式服装等，一起行拱手礼、鞠躬礼、叩首礼等传统礼仪。各班还开展了乐器演奏、棋盘对弈、汉服设计等传统文化体验活动，节日氛围浓厚。 ,0,0,1,,常州,江苏,中国
2,5023335985710118,中国教育电视台,2024-04-15 08:14:51,#全民国家安全教育日# 为增强同学们的国家安全观念，厚植爱国情怀，4月9日，安阳市文峰区第二实验小学少工委组织开展了“国家安全教育日”黑板报评比检查活动。各中队积极响应，队员们精心设计，同心协力创作出了一幅幅主题鲜明突出，内容积极向上，形式多样的黑板报，不断增强维护国家安全的责任感与使命感。@安阳市文峰区第二实验小学官博,0,1,5,,,北京,中国
2,5023329293699617,Usuakari,2024-04-15 07:48:15,我现在懂了mnknss就是tk让自己作品里最有名的那个和其他加起来的两大阵营互相打架，来做实验角色设计到底是集中好还是分散好 ,0,0,0,江苏,南京,江苏,中国
2,5023271636697321,九莘i,2024-04-15 03:59:09,终于把实验设计写完了 ,0,0,0,上海,上海,上海,中国
2,5023222526904660,流浪扣扣日记,2024-04-15 00:44:00,自己做的特别满意的图……第一张的排版 我真的是天才！！！！上次细胞实验报告里面讨论了传代时细胞的脱附和贴壁过程时不时必要的，然后设计了用在原代培养中贴上网然后让细胞爬到网上，再把网取出来放到新的🧫里作传代，还把网分成两半用来作为对照，特别有意思特别天才的设计,0,7,1,湖北,武汉,湖北,中国
2,5023215099840770,0绿巨不要吃甜食0,2024-04-15 00:14:29,在最慌忙的时间里读了一篇我觉得写的贼好的Cell，整个思维逻辑超级流畅，实验设计的很有意思，至少比免疫这边的套路性实验好很多，妈呀真的好想学神经生物了，想当年进来最感兴趣的都是脑科学现在怎么又肿瘤和免疫了 ,0,0,0,江苏,南京,江苏,中国
2,5023214117850635,Shinw_,2024-04-15 00:10:35,#其实四月才是考研真正的分水岭#当年七月份开始准备，第一个月就学了政治，九/十/十一月份大四上学期三门理论课，三个实验课以及三个课程设计，也没耽误上岸，何必制造焦虑，反而感觉一直强调这些的才是无法上岸的 ,0,0,2,广东,深圳,广东,中国
3,5023207814600397,秋凉peri,2024-04-14 23:45:32,啊哈？！我真的笑了，tm你自己不写就等我，要使唤人又看不起人😅是谁给你惯的毛病啊，讨厌急功近利的人！就是你这种人，整天发几篇文章要写啥说说说，什么什么课题都是你的，好好好，写完全世界你最牛逼了好吧。然而现实情况呢就是做科研，想要得到什么数据怎样设计实验，怎么合理，tm都不考虑。只幻想着做完发文章发文章，那么大的脑子不知道咋想的问一个问啥要做这个啊，人家SCI这么做了这个，我无语了好吧，不是你做了这个就能发SCI的，要考虑实际情况吧，现实就是你连他会得到什么都不知道。没有几斤几两的本事，心气还tm高。我写的东西吧要你改的吧你从来没tm提出过建设性的意见，问就是忙还没看，把你当个师长问问还高贵的，反过来整天问我这写了吗那写了吗？？？OK？这是我的事，tm我问你的时候你不是忙吗？反过来催催催，整天想着剽窃抄袭，卧艹我真tm受够这种男的了！啊啊啊啊啊啊啊好想骂回去啊！煞笔！,0,0,0,重庆,,重庆,中国
3,5023207583125915,是瓦娜吗,2024-04-14 23:44:37,在种完板后突然发现实验设计的大bug是对我周末躺了两天的严惩，明天又是组会日，还得和公司那边谈好，真完了 ,0,0,0,浙江,杭州,浙江,中国
3,5023202300661563,_巴黎在逃圣母-_-,2024-04-14 23:23:38,3.15 理了理研究思路3.20 组会报思路，一半能用，一半不能用3.24 设计实验流程3.25 开始筛量表3.29 开始做程序4.3-4.6 在泉州玩4.9 信誓旦旦催促老师看程序，要准备招被试了4.10-4.13 又玩+改卷4.14 实验流程不行，改了最后一版，强行开始招中间夹杂各种课程汇报这点活干了正好一个月，可以说没干啥，但也没闲着,0,1,1,福建,福州,福建,中国
3,5023196874806097,我哦你哦大家哦,2024-04-14 23:02:04,太原理工大学急需设计模式实验报告，出价，有人有么 ,0,0,0,山西,太原,山西,中国
3,5023193284743968,小狗骑士阿瓜,2024-04-14 22:47:48,明日计划： 1.读至少两篇DDM或EEG实验设计相关的文献 2.学一点unity入门 3.push一下社会计算大赛进度 4.给师兄当被试 5.有空去修电动车 罗伯特监督我 ,0,2,1,上海,,上海,中国
3,5023192723229121,碳酸可乐豆,2024-04-14 22:45:34,真不明白学校设计实验还要限制字数2000字以上 实验设计不是精简易懂的比较好吗 ,0,3,0,广东,珠海,广东,中国
3,5023189371721534,陈宛豫,2024-04-14 22:32:15,尝试让AI编制量表，生成访谈提纲，生成实验设计及操作，居然感觉出乎意外蛮准确的，很大程度上可能会比今天开题的很多同学思路都清晰。智能化时代，人太容易被替代，更应该时刻保持探索和精进。 ,0,6,8,广西,桂林,广西,中国
3,5023184901114885,x_outooto,2024-04-14 22:14:29,着急下班的时候，在实验室每一条动线都是精心设计的 ,0,1,0,河南,郑州,河南,中国
3,5023182652704024,sherplophturtle,2024-04-14 22:05:33,狗屎病毒检验小组作业结束，下面有请设计性实验粉墨登场！😅😅😅 ,0,2,2,四川,成都,四川,中国
4,5023106433548733,梁皓瑋Wayne,2024-04-14 17:02:41,第四版-《飞驰人生2》对撞实验室转场概念设计----------------------------------------------将灼烧版本与粉尘版本结合车身印花采用灼烧效果，而车漆的部分则用粉尘的形式呈现另外，增加双车撞击后，A3在粉尘形成的隧道内完成涂装幻化，最后转场至赛道 #飞驰人生2##概念设计##影视概念设计##电影# ,18,2,12,广东,珠海,广东,中国
4,5023174909757785,阳三好,2024-04-14 21:34:47,不管说这是成都阿那亚还是成都代官山，先锋、独立、前卫、实验、永续......cpi引领着一种更新的生活态度，拥抱自然、热爱生活、细节藏真，体验各种新鲜零售家具设计调性餐饮，还是小猫🐱小狗🐶的友好社区~快去打卡吧~ 📍成都天府新区麓湖水镇(地铁1号线红石公园站)📍📷富士XT4 🎬XF33mm F1.4 成都·麓湖水城,0,0,2,四川,成都,四川,中国
4,5023143255345593,智慧红谷滩,2024-04-14 19:29:00,【破防~ #学生做自卑测验结果让家长泪奔# 】#山东一学校推出5步自信测试# &quot;对自己的样貌是否满意？&quot;&quot;爸爸妈妈是否以你为傲？&quot;……近日，山东临清，专家为一所中学设计了一个户外心理实验。在5个测试问题之后，原本处于相同起跑线的同学们因答案不同拉开差距，场面让人破防。“勇于面对内心自卑的部分，通过努力来改变起点！”最终，同学们在鼓励声中露出笑容勇敢奔跑。加油吧少年，胜利属于不懈追求的你~@齐鲁电视台 齐鲁电视台的微博视频,0,3,2,,,,中国
4,5023130550011101,耳听目视,2024-04-14 18:38:30,分享专辑 Point Line Cloud任教加州大学圣巴巴拉分校的电声乐手 / 研究员 curtis roads，05年创作的实验性微声颗粒专辑，进一步实践他在著作《microsound》一书中探讨的微观声响理论。声响乐手 / 视像设计师 brian o'reilly 负责视频制作。curtis roads 在担任 computer music journal 副主编期间，撰写过不少关于电脑 / 电声音乐的理论、教学书籍，也曾在12年参加过 北京国际电子音乐节 演出。,0,1,1,美国,,美国,美国
4,5023125525760665,番茄灰灰酱,2024-04-14 18:18:33,比论文还难的管路设计说明书。难上加难的化工原理化工热力学期末考。没有一点知识储备的通识课结课考试。期中就不配拥有考试周吗。。这周还有两大节实验课。 ,0,0,0,浙江,杭州,浙江,中国
4,5023119209139317,小烊许的什么愿,2024-04-14 17:53:27,本来觉得我是没有拖延症的，但是发现我发展对象的答辩PPT拖到现在还没完成，更不必提那C语言课程设计了我都不好意思和别人说我还没写完实验书初稿，没办法洗了天杀的我要死了 ,0,1,0,安徽,芜湖,安徽,中国
4,5023117947438076,狗彤一路硕博,2024-04-14 17:48:26,又认真写了一遍“前测”的大题 第一个画交互还是把自己画坑里去了 （横坐标选的好像不太对 画出来烟花了……救命） 我再去把2*2的画一画捋顺捋顺 实验设计还是要自己动手写才能发现问题 萧妈的模板yyds 概括全面又有思考空间！ 大喊萧门～啊呜～@心理萧宵老师 实验心理学 ,0,0,2,山东,潍坊,山东,中国
5,5023110753157474,_臭脸达人,2024-04-14 17:19:50,人🧠怎么可能同时办到做实验看文献设计课题学新的东西自己解决实验问题还要打杂哈哈 ,0,1,0,天津,,天津,中国
5,5023107442017634,梁皓瑋Wayne,2024-04-14 17:06:42,第五版（最终版）-《飞驰人生2》对撞实验室转场概念设计 ---------------------------------------------- 沙子覆盖更加贴合同时补充了隧道，轮毂等关键帧赛车涂装从早期的概念示意涂装匹配成辛地机械涂装 #飞驰人生2##概念设计##影视概念设计##电影# ,3,4,4,广东,珠海,广东,中国
5,5023106495942486,-effortspaidoff-,2024-04-14 17:02:56,害怕面试到时候哑巴了就让AI根据我的实验设计方案提几个到时候老师有可能会问我的问题 好小子，你搞得有模有样的，我一个也回答不上来 ,0,3,1,广东,广州,广东,中国
5,5023105417740677,爱吃板栗的卷尾巴兔子_,2024-04-14 16:58:39,今天实验设计讲主被试，老师讲主被试会相互影响，一个人耍不成cp啊啊啊啊啊啊啊啊啊啊啊啊啊啊啊啊 ,0,0,0,山东,青岛,山东,中国
5,5023098302631899,妻子在地下室熬粥的手记,2024-04-14 16:30:23,看烧了，想到什么写什么吧，深深回味好几天。。。暖场音乐铺垫了好久，真的好喜欢他们自己做的实验电子，加上开头的灯光渲染出来的紧张的气氛吊足了人的胃口，最后晚了大概五分钟才登台不知道是不是可以设计的，开场是顽皮的天使，圣洁得要命搞久了死人乐队头一次吃到这么好的，尼克莱和达尼拉右耳都佩戴了银色的十字架，捡一下，后面唱老板的丈夫的时候大卖特卖，再捡一下…后面互动的时候感觉大家基本都摸到尼克莱了，人群实在很拥挤，他去鼓架的时候差点被人群一起带得摔倒，后来还试着扶他们起来🥹好喜欢尼克莱，演出的时候扫视观众的时候目光很尖锐，结尾和大家互动以及安可的时候才笑了，像苔原上的小猫头鹰，是身体很香很暖和很厚实的好毛子，不知道喷了什么香水，有凛冽的玫瑰和木质调气味！btw看录像才注意到是有人往台上扔了顶貂帽，恰巧达尼拉穿了金色皮裤，正好复刻愤怒的葡萄mv的穿搭,0,1,1,北京,,北京,中国
5,5023079445037727,翅膀飞走喽,2024-04-14 15:15:27,虚拟仿真实验到底是谁设计出来的东西？真想把它的系统炸了。 ,0,0,0,广东,广州,广东,中国
5,5023067183516977,Khoovakh,2024-04-14 14:26:43,同学们卷得我惊讶  但别都想拉着我一起卷行不行  我只想狠狠躺平  我感觉ry不是看不懂实验设计  但他非让我教  就是想让我学一遍  祖宗们放我躺平去吧 ,0,0,0,江苏,,江苏,中国
5,5023067023083081,猴子瘦身记,2024-04-14 14:26:05,壮阳中药对去势大鼠性激素影响     摘要目的：通过正交实验设计，探讨天然植物巴戟天、补骨脂、淫羊藿对去势大鼠性激素的影响及其交互作用、用药的最优组合。      方法：SD雌性大鼠48只，随机分组。假手术组8只。模型组8只。实验组32只，按L_8(2~7)正交设计标准要求再分为8个小组，每组4只。各实验小组按设计要求分组以相同实验药物，不同剂量灌胃16ml/kg。4周后观察各组大鼠血液E_2、T、P、FSH、LH、PRL指标改变，子宫组织形态学改变。       结果：13.2g/kg·d补骨脂显著增加实验组大鼠血中E_2值，6.6g/kg·d补骨脂显著降低实验组大鼠血中E_2值，13.2g/kg·d巴戟天与13.2g/kg·d补骨脂合用显著增加实验组大鼠血中E_2值，10g/kg·d淫羊藿显著增加实验组大鼠血中T值，20g/kg·d淫羊藿显著增加实验组大鼠血中T值。光镜下模型组大鼠子宫内膜呈萎缩性改变，各实验小组受多种激素的综合作用，子宫内膜形态各异，多数呈增生性改变。      结论：①高剂量补骨脂对去势大鼠有雌激素样作用。②低剂量补骨脂对去势大鼠有抗雌激素样作用。③低剂量淫羊藿对去势大鼠有雄激素样作用。④高剂量淫羊藿对去势大鼠有雄激素样作用，量效正向一致。⑤巴朝天与补骨脂合用有雌激素样交互作用，二者雌激素样作用的最佳量效比为巴朝天高剂量与补骨脂高剂量合用。,0,7,10,广西,崇左,广西,中国
5,5023052909512383,安徽气象,2024-04-14 13:30:00,【最新！传回珍贵影像】4月13日，据深空探测实验室消息，截至4月12日，天都一号、二号通导技术试验星顺利开展了月地高可靠传输与路由、月球轨道导航空间基准异源标定等新技术试验。经遥测数据计算结果表明，试验项目能够有效提高航天器环月轨道定轨精度，试验设计具有重要实用价值。 安徽新闻联播的微博视频,0,0,2,,合肥,安徽,中国
5,5023052075368623,演员李浩天,2024-04-14 13:26:40,上戏剧课怎能不设计舞台，谢谢谷老师#宇宙最棒的儿童实验剧团#戏剧教育#qfuntheater儿童实验剧团# ,0,0,1,北京,,北京,中国
6,5022841700877460,南海的浪涛,2024-04-13 23:30:44,155反一切炮：美国陆军正在寻求6600万美元的资金，用于支持多域火炮系统（Multi-Domain Artillery Cannon）的快速原型设计，即大口径高炮在发射超高速制导炮弹的基础上复活。美国陆军希望在2028财年之前建成第一座炮台，用于拦截巡航导弹和无人机。早在2021年9月21日，美国空军研究实验室（AFRL）在美国空军协会主办的空天赛博高峰会上，首次放出了一个MDAC多域火炮项目的演示视频。显示这是一款可以由C-130运输机空运的155毫米卡车高炮，主要是发射制导弹药拦截来袭空中目标，据称项目主要是用于空军基地防御。美军之前其实已经做过一次155火炮防空测试，用58倍径XM907型155加农炮发射HVP超高速炮弹，击落了一架BQM-167靶机，不过测试是陆军做的，这次的项目则是空军的。#烽火问鼎计划# 南海的浪涛的微博视频,12,22,70,湖南,株洲,湖南,中国
6,5023036246592526,_LeLovely,2024-04-14 12:23:47,我说我毕业去当文员算了，一上午编辑了一个调研报告和实验设计方案，一点细微的格式错误我都能发现，j人不允许出现一点不完美我真是编辑文档的一把好手#乐乐侠的考研日记# ,0,2,0,安徽,合肥,安徽,中国
6,5023011354710336,AAA生鲜冷链张哥,2024-04-14 10:44:53,我再说一遍cie物理你不要把我当科学家了 我真的不会设计实验每次写完成就感满满 一半的分都拿不到 滚吧… ,0,0,0,广东,东莞,广东,中国
6,5022997132084764,鹫十三,2024-04-14 09:48:22,实验心理学@心理萧宵老师  实验设计基础强化特训营（一） 交作业 研究报告可以算程序性记忆了，咱也发过一篇（虽然不是咱心理学的） ,0,2,1,四川,成都,四川,中国
6,5022971691008888,Pear_store,2024-04-14 08:07:16,笑死我了，一大早就在这里被礼貌地叼设计的这个连实验目的都不知道是什么的实验，3个人在这晕头转向 ,0,3,1,广东,广州,广东,中国
6,5022692695083682,智造圈,2024-04-13 13:38:38,椅式非对称三足低刚度机器人，可行走和站立运动，造价便宜到60美元，由东京大学 JSK 机器人实验室设计。 智造圈的微博视频 ,7,1,13,北京,北京,北京,中国
6,5022959162360162,冬天挺长的,2024-04-14 07:17:29,两周前，我参加了Hultin competition，这场比赛可以算作是我高考之后遇到的又一场挫败。为此，我停下了所有工作，脱产投入了两周的备赛。我邀请了教授和整个实验室的同学来帮我推敲内容，比赛中的互动也颇为不错，设计的梗大家也都领会到了。因此，我抱有很高的期望，毕竟，讲解和展示是我自以为为数不多的强项。当结果揭晓，我并没有获奖，这让我郁闷了好几天。经过一番深刻的反思，我认为自己虽尽力了，但仍有不足，也有许多我无法控制的外部因素。这次经历教会我如何接受和吸收别人的批评，特别是那些我原以为设计得非常巧妙的地方，却在别人眼中不值一提。学会怎样压抑自己的情绪，接受并改进意见，成为了我这段时间里不断修炼的新技能。比赛虽然结束了，但生活还得继续，实验室的研究也不能耽搁。目前已经学会了如何独自处理四到六人的聚餐，也能够独立设计小实验。继续努力吧那就。这次比赛还让我领悟到一点：对于那些你不爽的人，最好的方法就是在他们擅长的领域压制他们。,0,4,5,美国,,,美国
6,5022931346260007,爱可可-爱生活,2024-04-14 05:26:56,通过为抽象推理语料库(ARC)任务设计示例生成器，可大幅扩充每个任务的样本量，以支持针对少样本泛化能力的实验。,2,0,3,北京,北京,北京,中国
6,5022880788646963,有钱喊我,2024-04-14 02:06:03,又让我做大件又让我做小件又让我编书又让我设计文化推广（我至今没明白是什么）又实验影像… 等我做出来别人博士都读完了 ,0,0,0,河北,,河北,中国
6,5022868544684549,Ci果冻ovo,2024-04-14 01:17:24,好累呜～凌晨了还在赶比赛，这次感觉论文都交不带去，看来是真不适合考研究生啊，一天天怎么有这么多事情要忙啊实验报告也没写完，设计大赛也没时间准备真的好崩溃，今晚十点多才从教室回寝室吃上了晚饭一桶泡面，明天早上还要去试讲课了，现在才开始看讲义。晚上就必须要交实验报告。。。还有好多事情感觉都还没做，我每天都在忙什么啊，我现在真的好困好想去睡觉了我这过的是什么悲惨的人生啊真的心好累，看来我就是这种喜欢犯贱的人喜欢给自己找麻烦。。。,0,2,1,江西,南昌,江西,中国
7,5022847439471747,就会有光,2024-04-13 23:53:32,概统，精听，单词，新产品设计开发 有空的话取快递，化原和实验报告 ,0,2,0,辽宁,盘锦,辽宁,中国
7,5022841822513927,半缩醛多-学食谱版,2024-04-13 23:31:13,在搞令人崩溃的实验设计小组作业 今天就不回私信了  ,0,14,4,江苏,南京,江苏,中国
7,5022836339250592,Nefilibata_,2024-04-13 23:09:26,设计实验真的很抽象🧐😢 ,0,0,0,四川,成都,四川,中国
7,5022831731804533,别凶我omg,2024-04-13 22:51:07,莫名其妙很喜欢写生物设计实验题 ,0,0,1,吉林,通化,吉林,中国
7,5022828831445576,死亡说教者·,2024-04-13 22:39:36,威猫设计《Arnold渲染堡垒》电波 Blender动态海报进阶课2024最新不卷课堂角色动画泊宁班01期船长C4D产品表现案例课V3摇醒实验室平面设计全栈训练营-魔法学院尚道设研 2024年品牌设计课寒假班魔灯游戏场景高级地编班2023阿发你好Blender建模进阶教程阿发你好Blender建模高阶教程2024阿泰C4D美妆影像级实战提升班课程共享D0000FFFF请备注微博,0,0,0,湖南,株洲,湖南,中国
7,5022805563805210,别叫我奸夫,2024-04-13 21:07:08,一想到要交的实验报告程序设计的软件还下不下来就想马上死掉啊学了自动化的人生怎么每天都在当驴啊 ,0,0,1,浙江,,浙江,中国
7,5022799503297846,碎碎念塑料制造商,2024-04-13 20:43:03,过了一天ODS，感觉像玩游戏一样，一会洗瓶子一会旋蒸一会转移一会配流动相，怎么没有人发明实验室经营类小游戏，比如做合成实验有50%的概率失败、看文献可以提高5%的成功率但要花费10h号、一周时间到组会时间没出成果扣下周的经费之类的…真是一项很好设计发明的小游戏 ,0,4,1,广东,广州,广东,中国
7,5022784740658199,DOPE单针纹身,2024-04-13 19:44:24,🔲小姐姐专门来DOPE的遮盖纹身 烟雾蝴蝶 / 纹身不是买包不喜欢了就换.  是真的皮肤艺术跟你一辈子的 . 不要拿自己做实验哦。 选就选最爱的… 一次到位 不改了. 经典艺术. 成为代表自己的性格和符号标签. / #成都纹身##单针纹身##纹身设计# ,0,0,1,四川,,四川,中国
8,5022757404803977,死亡说教者·,2024-04-13 17:55:46,"不错实验室NiceAlGC!0基础实战应用! 卢帅第五期包装设计+Blender全能班 张晗2024upgrade 排版力进阶智疯字体版式设计课第17期 葵黑黑Blender建模+动画课10期“静宁见春,祉猷并茂” 宋叙文的地形和特效小课堂 NiceAIGC!0基础实战应用!  课程共享D0000FFFF请备注微博 ",0,0,0,湖南,株洲,湖南,中国
8,5022747308068686,华锐净化-舒先生,2024-04-13 17:15:39,医学检验、疾控中心、科研院校、生物制药#实验室建设 #实验室装修设计施工# 就找四川华锐净化，15年行业经验！#源头实力厂家 #实验室装修公司# 成都·四川华锐净化工程有限公司 华锐净化-舒先生的微博视频 ,0,0,2,四川,成都,四川,中国
8,5022741017134185,用户7848868165,2024-04-13 16:50:39,所里办农科开放日，好多小学生来参观，到处和小学生抢零食吃，刚好设计的引物没到，做不了实验，摸鱼一整天，爽死谁了哈哈哈哈哈哈哈哈哈哈哈哈哈哈哈哈哈哈哈哈哈哈 ,0,0,0,北京,北京,北京,中国
8,5022233955926559,陈圣亮-壹加设计,2024-04-12 07:15:46,设计发声 边界实验 | 悬浮墙体、与自然共生！建筑 ,12,2,21,北京,北京,北京,中国
8,5022733774094974,杠杆四球摩擦磨损试验机,2024-04-13 16:21:52,ATRS-500B全自动圆锥滚子剪切试验机（简称KRL剪切试验机）是一种用于测定润滑油、工业齿轮油、传动润滑剂抗剪切粘度损失的仪器。该试验机采用全自动化的设计，使得测试过程更为简便和高效。它使用带有圆锥滚子轴承的摩擦副对测试油进行剪切，模拟实际工作条件下的剪切环境，以评估润滑油的粘度剪切安定性。这款试验机可能具备一系列功能特点，例如负载力通过连接传感器和减摩轴承垫的轴传递给摩擦副，采用力加载系统，以及使用摩擦力矩和油的运动粘度损失开发的预测模型等。同时，它还具备工业级平板电脑，可以连接到个人设备，进行自动化控制，从而进一步降低维护成本。关于ATRS-500B全自动圆锥滚子剪切试验机的具体技术规格，可能包括负载范围、转速范围、润滑油温度范围等参数，这些参数可以根据实际需求进行调整，以满足不同的测试要求。此外，这款试验机符合多种测试标准，如NB/SH/T0845、圆锥滚子剪切法、传动润滑剂黏度剪切安定性的测定等，使其能够广泛应用于采矿和建筑设备中使用的液压油和齿轮油的质量分析，以及筛选用于润滑油粘度指数改进剂的聚合物等领域。请注意，对于具体的ATRS-500B全自动圆锥滚子剪切试验机（KRL剪切试验机）的详细信息、技术规格、价格以及售后服务等，建议直接联系济南尼科自动化科技有限公司13808922192以获取最准确和最新的信息。同时，也可以参考行业内的用户评价和使用经验，以便更全面地了解该产品的性能和质量。#润滑油##润滑油工厂##润滑油企业##润滑油实验室#,0,0,2,山东,济南,山东,中国
