页码,微博id,微博作者,发布时间,微博内容,转发数,评论数,点赞数,发布于,ip属地_城市,ip属地_省份,ip属地_国家
30,4990921621376403,小鱼大头s,2024-01-16 21:31:44,#札记# 近期集中看了历史类的书，戴着耳机在地铁通勤期间看，只为不想浪费时间。有的偏学术生涩，有的通俗易懂，但是几本书相辅相成，倒也容易吸收。一直以来都比较喜欢历史类书籍，尤其是秦汉历史，喜欢这段时期的厚重的文化，也为后期中华文明奠定了基础，连喜欢的毛笔字字体都是这个时期的隶书。也喜欢宋朝文化，宋朝时期的宽松政策，让社会氛围、生活饮食、经济文化等等，都达到了顶峰。历史就是如此让人回味无穷。,0,0,0,贵州,贵阳,贵州,中国
30,4990745104617858,杂志社--马老师,2024-01-16 09:50:19,学术期刊论文发表 《中华纸业》国家级月刊  中国造纸协会会刊 24年3-4月刊期  收稿方向：造纸技术与装备，纸史、纸文化、印刷出版、图书、纸质包装、纸质装饰材料、剪纸艺术、书籍设计等方向均可 ,0,0,0,河北,石家庄,河北,中国
30,4990523959938811,朱辰彬,2024-01-15 19:11:34,自从本人原创作品《古筮真诠》面世以来，本人完整的朱辰彬“野鹤六爻”理论体系也随之浮出水面，由此引起易学学术界广大读者、学者及爱好者的强烈共鸣。但因理论实用性过于强悍，书籍被外界疯狂盗印的同时，书中的各层次原创知识也被大肆盗用，各式各样的抄袭者为了掩盖抄袭真相，虚假冒充原创不说，还故意将书中原创的各系统理论曲解或调乱次序，知其然不知所以然的各种胡乱阐述，严重影响了知识体系本该有的高效率，应众多读者请求，特成立《古筮真诠》及野鹤六爻读书纠错微信交流群，日常在群内就《古筮真诠》及野鹤六爻各层面知识点展开深入探讨正本清源。,0,36,12,广东,广州,广东,中国
30,4990430957802165,郭庆民George,2024-01-15 13:02:01,人文社科专业考研复试（面试+笔试）建议一：（1）熟读所考专业2-3本经典书籍，了解其中最具特色的部分或章节；（2）熟知所考专业方向2-3个基本理论，并能结合自己的学术兴趣展开陈述；（3）熟悉所考专业方向2-3位（中外）著名学者，包括其基本学术观点、最具特色的理论视角和实践价值。    掌握以上三个方面，就可以在复试面试和笔试中作为举例展开深入讨论，使自己的回答看上去具有相当高的学术性。,3,0,8,北京,,北京,中国
31,4990110462383387,新京报书评周刊,2024-01-14 15:48:29,【#2023新京报年度阅读推荐# ——年度特别致敬】除2023新京报年度阅读推荐的十二本书外，我们还特地选出了5种“特别致敬”，包括年度译者、年度出版品牌、年度学术写作等等。这些写作和阅读，和众多好书一起，共同构成了2023年与书籍有关的悦人风景。#2023新京报年度阅读盛典#  2023新京报年度阅读推荐——年度特别致敬 ,16,0,10,,武汉,湖北,中国
31,4990278094030319,公子信忌,2024-01-15 02:54:35,大半夜太兴奋睡不着发点儿别的感想吧。我在b站刷视频看见不少高中小孩热衷于摆拍自己收藏的各种学术专著书籍，自称高中生多少天速通xxxx……这种人是不是天才我不知道，你要是自称自己几个星期或者几个月速通几百本小说的话那是可信的，碎片阅读、量子阅读能做到的人不在少数。（这种情况我都不敢想你是在阅读）你说你半年速通黑格尔逻辑学、精神现象学、甚至自称自己马恩全集读到哪哪的我一律视作啥都不懂故意装杯的👻物。黑格尔逻辑学 精神现象学这种艰涩难懂的东西研究生写论文都得看句读查找各种各样的解读文献，敢问你一个哲学基础大概率薄弱到不行、每日高强度做题训练加上课表满满当当的高中生你哪来的精力钻研这种书籍？我疫情期间在家休学一年没事干全天全职读书看这些东西，在每天能读书5到6小时的情况下断断续续的看，《历史与jj意识》读了三个星期，《德意志y识形态》节选本读了一个月，《黑格尔哲学导读》读了一个半月，包括前两个月没上网读《在哲学中成为马克思主义者》用了大概一个半月，目前还没有胆量直接去看黑格尔逻辑学原文。你一个成天做题没有多少课余时间的高中生说自己速通？看你那一尘不染多半刚拆封的一堆书我就知道大概率是自己给自己造神。,0,0,0,韩国,,韩国,韩国
31,4990255630123789,胡二二嘻嘻喜喜,2024-01-15 01:25:19,床头摆着诗词短句也有短篇小说 还有各种学术或者研究的书籍📚 但是笼统呢 大多数偶尔翻一番 兴致嘛 总是缺缺补补 大脑都是碎片知识 ,0,0,0,广东,佛山,广东,中国
31,4990255598143625,511_11,2024-01-15 01:25:12,#星穹铁道真理医生##崩坏星穹铁道#  @崩坏星穹铁道 真理医生的pv用书籍、公式开场，介绍了博识学会这位特立独行的“学术之星”。头套是真理医生隔绝感官、屏蔽感受、心无旁骛思考的工具。 ,0,1,0,江西,上饶,江西,中国
31,4990201021860197,貌美如花似邹霞,2024-01-14 21:48:20,#超话创作官# 刚才看了真理医生pv，这个角色还是有些特别的。在PV中，他“刀子嘴”形象，语言风格体现个性又坚定的学术追求。他热爱书籍和浴缸，追求精神与身体的双重治愈。在技能来说，他在比萨尔斜塔进行精彩的实验，给我们显示了实践能力和探索精神。但他表现出嘲讽与自信，确实很有魅力的角色。#星穹铁道真理医生##崩坏星穹铁道#崩坏星穹铁道,14,19,36,广东,珠海,广东,中国
31,4990194667231224,你给我炒个菜吧,2024-01-14 21:23:05,齐国骨科分享一段文献研究书籍中关于齐骨的内容。每次看这种很枯燥乏味的学术类文献都很痛苦，但是一看到文姜诸儿就来精神了。图源《简帛文献与〈管子〉研究》，著者为山东理工大学齐文化研究院的郭丽教授。教授指出，文姜妹妹理应住在鲁国，但她居于齐，应当是诸儿支持。诸儿向鲁国献卫宝，为了取悦文姜妹妹好磕，爱磕！#齐骨##齐襄公##文姜#,0,12,17,北京,北京,北京,中国
31,4990163323455514,苗怀明,2024-01-14 19:18:32,【学术讲座|张伯伟：知识环流：佛教、政治与性别——东亚书籍史研究方法例释】 学术讲座|张伯伟：知识环流：佛教、政治与性别——东亚书籍史研究方法例释 ,1,0,1,江苏,南京,江苏,中国
32,4989665253788181,莲藕尖尖,2024-01-13 10:19:23,#星穹铁道真理医生##崩坏星穹铁道#  《崩坏： 星穹铁道》真理医生角色PV「愚不可及」背景音乐再搭配上角色的人声，十分带感。一开始就是用书籍、公式开场，介绍了博识学会这位特立独行&quot;学术之星&quot;。真理医生是一个五星巡猎虚数属性角色，定位是一个输出角色。技能天赋＞战技 ＞大招 ＞普攻普攻：对目标造成基于攻击力的虚数伤害。战技：对目标触发一次天赋效果，然后造成基于攻击力的虚数伤害。终结技：对目标敌人造成虚数伤害，并施加&quot;愚者&quot;标记，持续一定回合。对带有愚者标记的敌人释放战技会增加天赋的触发次数和最大触发次数。天赋：我思故我在真理医生在施放战技后，有概率触发一次追加攻击。敌方目标身上每有1个负面效果，都会提高天赋追加攻击的触发概率。@崩坏星穹铁道 莲藕尖尖的微博视频,0,3,2,四川,泸州,四川,中国
32,4989377555468050,荳douyan言,2024-01-12 15:16:10,国内的书籍已经很少见到有关键词索引的学术著作了～我读大学那会好像还有很多附有索引的专著。 ,0,8,8,天津,,天津,中国
32,4989374328474060,韩雅舟,2024-01-12 15:03:21,我是极其不擅长阅读学术研究类的书籍，看到这类书就犯困那种。可是新课标硬生生给我磨成了研究型人士，磨平了我傲娇的棱角。 ,0,0,0,江苏,南京,江苏,中国
32,4989321763356930,合著社-哈罗学姐,2024-01-12 11:34:27,作者在书籍出版过程中是缺一不可的重要的角色，在书籍出版尤其是自费出版的过程中有许多工作需要作者兼顾学术 出版 #职称#  在书籍出版过程中，作者能做的工作包括哪些？ ,0,0,0,四川,成都,四川,中国
32,4988920479613197,墩爸,2024-01-11 08:59:54,不一样，出版书籍，很大程度上是为后续树立学术圈有“分量”的IP做准备。,0,0,1,浙江,宁波,浙江,中国
32,4988759483356477,为什么不能叫萌仔,2024-01-10 22:20:10,今早听播客，好几句话击中我了。 1. 在如今不愁吃穿的年代，优秀的人负责勤奋，普通的人负责享乐。 2. 普通人真的不会读太多书，因为对大多数人来说，生活化的语言就够用了。而有些文学语言，学术语言都是要通过阅读书籍才能get到的。 ,0,2,0,江苏,苏州,江苏,中国
32,4988657050585577,合著社-哈罗学姐,2024-01-10 15:33:08,看一本书是否适合众筹出版，首先需要搞清楚众筹出版的目的和书籍出版的目的是否一致学术 出版 #职称#  评职称用的专著，适合众筹出版吗？ ,0,0,0,四川,成都,四川,中国
32,4988377911526358,Therains14493,2024-01-09 21:03:56,"#爱在师大##争做上岸显眼包# 【师大上岸显眼包】第四轮第15天@师大教育官方微博 @别动我的狮子头维普系统跟老师让写的内容有些略微差异，编了一段“在开始写作之前,我利用学校图书馆资源搜集了大量的文献，包括查阅学术期刊、书籍、专利、网站等,以了解到目前为止关于财务报表分析的有关内容。同时，找老师交流沟通，并根据老师的指导意见修改，找准写作方向”正式通过了",0,0,0,山东,济南,山东,中国
33,4987954974166477,Essay菌,2024-01-08 17:03:20,essay菌干货分享Essay的四大基本格式：⭕ APA格式APA格式被广泛运用于引用行为和社会心理学领域的学术论文，通常在学术刊文以及书籍写作时都会用到。⭕MLA格式MLA格式是美国现代语言协会制定的论文指导格式，同时也是北美人学最惯用的一种英文论文写作格式，另外，MLA格式更新较快，如果导师有指定使用MLA，记得要留意多问一下具体是使用哪一版本。⭕Harvard格式Harvard格式是哈佛大学的论文参考文献标准，全名为：哈佛注释体系，此格式多运用在英国和澳洲等国家，尤其是物理和自然科学领域。⭕Chicago格式Chicago格式指的是芝加哥大学出版社于1906年首次发行的《芝加哥引注格式使用指南》，这种格式广泛应用于图书、杂志、报纸以及人文科学领域#留学生##留学辅导##essay写作#,0,0,1,辽宁,大连,辽宁,中国
33,4987941310960089,海淀区图书馆北馆,2024-01-08 16:09:03,【海北书院】谈论到李白与杜甫，有一本绕不开的书籍《#李白与杜甫# 》，这本书是郭沫若的封笔之作，也是小编今天为大家极力推荐的。这是一本集学术性和文学性于一体的李杜传记，提供了李白和杜甫的多方面参考价值，真正的探究了李白和杜甫的人性丰富面与作品的多元取向。作者以其卓越的考据功底和敏锐的诗人感受，生动还原出一代“诗仙”、“诗圣”的真实生活：李白究竟是哪里人？为什么李白能一生游山玩水却不为生计愁？为什么李白会成为道士？为什么说杜甫是禅宗的信徒？为什么说杜甫嗜酒不亚于李白？作者还饱蘸情感，叙述了李杜二人的从政历程，并对当时的政治风云、权谋之争作了细致剖析，显示出一代文史大家深邃的政治洞察力。书籍推荐 阅读原文：盛唐诗坛大PK，究竟李白和杜甫谁更胜一筹？,0,1,0,,北京,北京,中国
33,4987612928410768,pomengovo,2024-01-07 18:24:10,#学英语# 额，将英语学到能独自看懂各种学术论文和书籍需要多久？有大佬吗 ,0,0,0,广西,,广西,中国
33,4987201748731712,超心好,2024-01-06 15:10:17,看完一本小说需要一天 看完一本学术类书籍需要十年和半辈子的勇气 ,0,0,3,北京,北京,北京,中国
33,4987163853460399,有嘲gether原先叫山水,2024-01-06 12:39:42,"商业广告，媒体新闻，学术理论，书籍和视频等等...   这些信息 100%都是有某种目的,而到达你的，所以人们应该要能自己辨别信息背后的目的和动机，如果是你非常重视的方向，那最好自己去探查一下 ((())) ",0,1,0,北京,,北京,中国
33,4986965153809783,大子弹Zidan,2024-01-05 23:30:09,📍2024年阅读计划▪️给大家汇报一下我的2024年阅读计划✅【1月主题-了解自己，心理学相关书籍】-《蛤蟆先生去看心理医生》-《心流》-《亲密关系》-《长大了就好变好吗》（别看这个标题，文章有点学术不易读。我每每能从心理学相关书籍里面获得安慰和力量，因为客观世界影响我们的方式，就是是折射成各种各有的情绪。了解情绪为何产生，如何作用，消解这种未知，就能稍微获得掌控，不会被牵着走。另外，心理学有种和社会学一样，深深的宽容和接纳的底色：你遇到的问题，都不是你的错，都是阶层社会，或基因，或遥远的童年的影响，就不会对自己这个个体苛责了。✅【2月主题：了解关系，了解人性】结合春节放假，选了些长小说-《遥远的救世主》-《天幕红尘》我爸强推，说我这个老实人要看看。最近其实也反复提到，最近几年频繁被人说是“老实人”，感觉现在老实这个形容词并不是什么表扬。我也不打算改，我！就！是！这！样！的！不过也好奇那些聪明人是怎么想，怎么做的。从小说里应该能无痛观察。✅【3月-4月：了解身处的土地，由远及近。】-《中国历代政治得失》-《论中国》-《邓小平传》-《他改变了中国》等【5-6月思维主题：情绪，关系和社会都了解了，那了解下大脑如何思考的吧！】-《思考快与慢》-《噪声》-《事实》-《思考的技术》-纵横四海-提到脑子的播客先规划到年中，去年时常一个月开四五本书，很杂。今年尝试一下这种分主题读，把消遣的阅读稍微规划得成体系化些。去年读书状态很松弛，没有强迫自己每个月的阅读量，也没有强迫自己一定写书评，因为不追求量，还重复翻了以前的书，再看一遍感悟又不同。进入社会大学后，它的全面和玄妙，和社会交手已经让我学到很多了。所以不再把阅读，当成学习成长和增长知识的唯一渠道，而是健康的打发闲暇时间的选择。通过3年的刻意培养，我感觉我真的可以拍着胸脯，在爱好那一栏写下“阅读”。以下是之前一些读书记录，以及年度最推荐的一本书的记录。可以通过#子弹读书# tag找到所有。📍2023年度之书《回归故里》👉网页链接📍2022年底之书《那不勒斯四部曲》👉网页链接📍2021年度之书《把自己作为方法》👉网页链接📍2020年度之书《浪潮之巅》👉网页链接studyaccount,0,9,11,上海,,上海,中国
33,4986937050137072,阿乌卵半仙,2024-01-05 21:38:28,问隔壁历史老师：有什么讲宋朝民间生活的学术类书籍吗？ 同事：要求这么具体，为啥？ 我：呃……嗯…… 其实是在搞oc。 ,0,3,1,江苏,苏州,江苏,中国
33,4986615625943678,猫山王榴莲飞饼,2024-01-05 00:21:15,在一本书A里面看到了那种很戏剧性的、非常细节的内容，都不知道作者是怎么知道的，但是那本书不是很标准的学术书籍，引用出处都不标，我问老师这东西能采信吗？老师说，这个作者（写作时间大概上世纪末）跟当事人（20世纪上半叶）有私人关系，他们应该是直接听人说的。相同情况的书B，作者是参加革命的当事人的儿子，他对这个政治组织的一些细节是听他爸说的。以及最近看的写于60-70s的好几篇论文、专著，里面一些细节和主观回忆，是直接跟当时还活着的当事人（20-30s的事情）访谈对话得知的。感觉真牛啊………,0,0,4,北京,,北京,中国
34,4986610229969721,我真的超级开心哒,2024-01-04 23:59:48,1.今天跟同事一起出去玩啦！开心(ღ˘⌣˘ღ)还坐了同事的小车车～～ 2.今天组会的发言也很OK呀！逐渐在进步啦！ 3.今天看了论文+阅读半小时的书籍哦！  明天要开始把要搞的资料啥的搞好了！！！ 顺便看两篇学术论文+看书！！嗯嗯✧٩(ˊωˋ*)و✧加油啦！一定会越来越好的！嗯(✪▽✪) ,0,0,0,福建,福州,福建,中国
34,4986591558763039,此人小小年纪就吃的了五个大馒头,2024-01-04 22:45:36,学术垃圾果然还是更喜欢中文书籍 ,0,0,0,江苏,南京,江苏,中国
34,4986451382503151,只有一天晒太阳,2024-01-04 13:28:36,老天奶你是不是搞错了，我应该出生在电影世家，外公外婆都是三大戏剧学院的教授，爸爸是享誉国际的导演，妈妈是赫赫有名的编剧，家里荣誉挂一墙。我南加州美国电影学院随便挑，大学横扫国际学术圈，绩点拿全校第一，奖学金全包揽，真正的艺术天才再不济也是大师，平常爱好是潜水滑雪阅读相关书籍体验人生，一毕业就offer数不清，电影协会会长当不完，等我干几十年学术研究和艺术探索就去冲击世界十大杰出青年，最后名留青史回母校开讲座，怎么让我投胎到现在这个斯人身上,0,0,0,湖南,长沙,湖南,中国
34,4986431842290536,合著社-哈罗学姐,2024-01-04 12:10:57,对于有些人来说，出版书籍或许是自娱自乐的消遣方式，或者提升自己名气的名片，但是对于有些作者来说，出版书籍是一种刚需，比如评职称、进作协。同样都是书籍出版，这两者出版之间有什么不同呢？学术 出版 #职称#  加入作协的书和用来评职称的书，有什么区别呢？ ,0,0,0,四川,成都,四川,中国
34,4986421851457735,二代目寝坊君,2024-01-04 11:31:15,jesus…买一本国外学术类书籍的版权还不到一万美元吗（听说的，没细指到具体哪个门类哪个作者），翻译出版才要十几万那我们图录基本30万左右是不是太高了 ,0,1,0,中国,,,中国
34,4986212161686311,小小的兔子爱奔跑,2024-01-03 21:38:01,20240103，亲密关系专题第二本书，大名鼎鼎的学术书籍《亲密关系》。虽然是学术书籍，阅读体验还是很流畅的，非常有趣味性，并不枯燥。学术类的书籍，与其它流行性或者经验类书籍相比，内容更加严谨且全面，它不是作者根据自己的亲身经历得出来感悟、想法，具有片面性、特殊性，而是一系列通过科学实验得出的结论，更加全面且具有可复制性。作者首先阐述了一些基本的概念，包括亲密关系的定义、研究方法、文献综述等内容，对亲密关系有了初步的认识。接着，作者阐述了影响亲密关系的重要因素，包括吸引力、社会认知、沟通、相互依赖等。这是前6章的内容。,0,0,0,山东,青岛,山东,中国
34,4986157660636560,阿银是俺的,2024-01-03 18:01:27,某家学术分享讨论群 一群友分享了别家的书籍 群起而攻之 …… 想到当年 老师问我最近在看什么书 我说了某世面大神 他说 他有我好吗 我无言以对  唉 ,0,0,0,山东,济南,山东,中国
34,4985807842840472,Psycho_PassEyes7,2024-01-02 18:51:24,我感觉可能也是不追番这个点导致我没有办法继续写同人了因为我对原著角色根本毫无爱意没有爱意，写出来的东西就很无聊自己也没有创作的动力。可能是因为阅历的拓展我对于市面上的绝大部分动漫都毫无兴趣说的直白一点，如果我追求深刻、复杂和有内涵，为什么不去看传记和学术书籍呢。电影可能是更好的选择。总之，我真的很难再爱上一个二次元新角色了。他们都很boring像我落了灰的玩偶。,0,1,0,上海,上海,上海,中国
34,4985346901676176,MachineLearning-ZJU,2024-01-01 12:19:47,"【开源书籍：R绘图方案手册(第二版)】 《R Graphics Cookbook, 2nd edition》 免费在线阅读版：网页链接 论文学术期刊论文发表   #每天学点论文实验绘图# ",37,1,12,浙江,杭州,浙江,中国
35,4985370478119127,氢氦锂铍硼Sn,2024-01-01 13:53:28,#事件记录簿# •2023年事件记录  今年感觉人生走向另一个拐点，我总感觉人生是一种宿命，如今说不上好也谈不上坏。 有看一些书（闲书、论文、专著），看一些纪录片（但是还有书籍一、二季），参加学术研讨宣读论文，参加一些翻译竞赛，拿到一个省一。 这是2023。 希望2024开心、健康、有成长。 ,0,0,0,广西,百色,广西,中国
35,4985289074282061,中图网官方微博,2024-01-01 08:30:00,#每满79减30，满98元送笺纸和贴纸# 《宋代书籍出版史研究》作者在大量梳理古籍文献资料的基础上，在现代出版理论的指导下，对宋代书籍出版作了系统、全面、深入的历史研究，揭示了其物质、技术及社会、政治、经济、教育、文化诸层面之意义。对宋代书籍出版研究学术史、宋代文明与书籍出版、出版体制及其生产、发行与贸易、书籍设计与插图、书籍美学、版权保护、出版经济等方面做了系统考察，拓展了宋代书籍出版研究领域，挖掘出诸多新史料并予以科学运用，体现了我国宋代书籍出版研究的新境界、新水平。网页链接,2,0,13,河北,保定,河北,中国
35,4985140596710263,中图网官方微博,2023-12-31 22:40:00,#每满79减30，满98元送笺纸和贴纸# 《马可·波罗与元代中国 : 文本与礼俗》《马可•波罗行纪》是中世纪欧洲影响最大、流传最广的书籍之一。至今东西方学术界的马可•波罗研究皆历时长久。本书从马可•波罗出发，着眼于礼俗领域，运用文本比勘方法，重点利用新出碑刻史料，研究元代中国的一幅幅历史场景。《马可·波罗与元代中国》分为四个部分：“导论篇”全面梳理了马可·波罗研究的范畴、方法，及19世纪至今的研究史；“研究篇”研究马可•波罗所见元朝礼俗、物质文化等，聚焦中外交流，尝试解开《马可•波罗行纪》书中未解之疑；“评介篇”评介西方学术界与本书主题相关的几部最新著作；“译文篇”则译介了部分西方重要的论文。经过深入讨论，本书一方面证明了《马可•波罗行纪》在礼俗文化方面的史料价值，另一方面揭示了蒙元时代欧亚大陆多元文化交流的众多侧面。网页链接,5,0,11,河北,保定,河北,中国
35,4985018520967475,惜述,2023-12-31 14:34:55,教授们不自己看文献看专业书籍，喜欢报团拿着研究生做的ppt互相交流，还觉得自己掌握了学术前沿信息和高深的知识。结果一张口就把屁股漏出来的样子真的很滑稽。 ,0,1,6,江苏,南京,江苏,中国
35,4984426956591735,椿和刺猬,2023-12-29 23:24:15,寒假了，新人打算进击盲饭，家人们有没有相关科普类的书籍，文献，纪录片，小说，视频推荐，来者不拒，病理性和学术性都能涵盖的那种饭 ,0,4,2,吉林,长春,吉林,中国
35,4984288204034180,线头不是布,2023-12-29 14:12:54,2023 年度书籍Top31本书，个人来讲多又少的数字，思考过后决定抽取其中的16%作为年度最佳。总结来说，依旧喜欢阅读诗歌，但较往年动笔少。小说占比增幅，学术传记减少，也不得不承认小说看过容易忘个精光…1⃣️安德烈·塔可夫斯基《雕刻时光》塔可夫斯基对于艺术的理解与诠释完全有他个人最为鲜明且完整的认知体系，这就如同他说的“每个艺术家都在遵循自己特有的准则，这些准则对其他人完全不适用。”全书流露出塔可夫斯基感性又理性的一面，如同他的电影一般难能可贵。2⃣️胡安焉《我在北京送快递》《我在北京送快递》应该是今年读过最实在一本书，它让我看到一个普通人对工作的真诚，对生活的真诚，以及对文字的真诚。如果说当今社会真诚还不足以被撼动的话，那么道尽千千万万打工仔的春秋，也是动容的筹码了。3⃣️郑执《仙症》作为“东北文艺复兴”三剑客之一，郑执的故事如同东北人的性子，表面圆润诙谐，内里却饱含阵阵辛辣与柔情。生活处处遍布魔幻现实主义，如同他在书中结尾谈到“毕竟人生已经严肃到令大部分欢愉都显得太过短暂。”4⃣️陈春成《夜晚的潜水艇》我很难想象究竟是一个什么样的人，在共处一世的大环境下，能够如此丰盈又缥缈。5⃣️理查德·布劳提根《布劳提根诗选》再鬼马乖张的人被爱裹挟后，原来都是一样柔软又深情。他的诗歌于我而言，太有预见性了。,1,4,8,四川,成都,四川,中国
