页码,微博id,微博作者,发布时间,微博内容,转发数,评论数,点赞数,发布于,ip属地_城市,ip属地_省份,ip属地_国家
2,5022374171249009,烤鸭芋泥锅包肉小麻薯,2024-04-12 16:32:56,一想到那四个字的学科，以及那个学科的一系列学术名词，就会会想到那几个月的午后三四点，阳光拂过窗户照进室内，微粒灰尘在光线的轻抚下点点跳动，变蓝，变粉。热风拂面，带来书籍沉睡的气味。躁动是风带来的唯一讯息。昏沉的脑袋望着室外，幻想春天的到来。 ,0,1,1,广东,,广东,中国
2,5022140638169545,Msidan,2024-04-12 01:04:58,不懂zng们在狡辩什么女性也可以被称为先生……先不提杰出女性本来就不该被称为先生，也不提泰拉有没有这样的三次元说法。单从那句话的语境说，一个干员看到一个兜帽人在搬重物，不是什么学术书籍也不是什么泰拉颁奖大会，这样的称呼在这样的语境里根本就没有不分性别的敬称或者书面语的意思……yj真的是，把博当男的写的心思昭然若揭,0,0,0,甘肃,兰州,甘肃,中国
2,5022089667678702,用户0812039264,2024-04-11 21:42:25,阅读“马拉松”42天打卡第十八天(2024年4月11日) 书籍名称：《世说新语》文学(一) 书籍作者：刘义庆 读书感悟：“魏晋是自春秋战国百家争鸣之后，又一个学术思想的繁荣发展阶段，学术思想趋于活跃，文坛呈现出一派清新自由的景象，各种掌故轶事也是精彩纷呈，为后人津津乐道” ,0,0,2,陕西,西安,陕西,中国
2,5022083706259579,用户7728322191,2024-04-11 21:18:44,图书馆内，一排排书架高耸入顶，各类书籍琳琅满目，知识的海洋在此汇聚。静谧的阅读区，学子们或埋头研读，或凝神思索，空气中弥漫着淡淡的墨香和求知的热情。教室里，洁白的墙壁上挂着名人名言，激励人心；讲台上教师激情授课，台下学生专心听讲，笔尖在纸上沙沙作响，形成和谐的学术交响曲。 宁波·宁波城市职业技术学院,0,0,0,浙江,宁波,浙江,中国
2,5022064362652897,柴小春易学,2024-04-11 20:01:52,正印格八字含义　　正印在八字含义的方面来讲，属于是学术之星，故正印格，或正印为用，或正印现于月干、日支、时干者；或者命中正印能够带动财官流入日干者； 不论是喜是忌，其人普遍具有较高的智慧，仁慈的心地，健康的身体，勤于阅读书籍来充实自己，知识的来源普遍较广。命中正印，如能贴近日主，即现于月干、时干、日支或月支，除了热心追求知识外，它更有防灾之效果，遇到灾难时，能够逢凶化吉，遇难成【v】11330083】#招桃花##算命八字合婚看姻缘财运事业##婚姻##转运##心情日记##人生感悟##失恋分手复合##算八字看婚姻##什么才是真正的正缘#,0,0,0,安徽,淮南,安徽,中国
2,5021903415410813,山茶书苑7078390625,2024-04-11 09:22:18,相信我！这一定是2024年你最值得读的一本书🌹哈佛商学院的明星教授克里斯坦森，他的名字不仅闪耀在学术圈，更是家喻户晓的思想家之一。而他的重磅作品《你要如何衡量你的人生》再版了！这本书被誉为哈佛商学院毕业前最重要的一堂课，不仅如此，它更是一本引领读者重新定义成功之路的心灵自助书籍。🌿在书中，克里斯坦森不断强调：成功不是模板，但可以复制生活的逻辑。他不告诉你“答案是什么”，而是教你“如何思考”。这本书可不是那种平淡无奇的常识汇编，而是作者多年企业管理实践和研究的结晶。他运用缜密的分析，解读个人成功与幸福的内在联系，为我们揭示了选择与结果之间的深刻关系。🌸更让人兴奋的是，书中充满了有趣且具有说服力的商业案例，涵盖了苹果、迪士尼、宜家等知名公司。这些案例不仅生动形象，更是克里斯坦森观点的有力佐证，让读者仿佛置身于商业智慧的海洋中，感受到了成功的魅力。🌹他以丰富的商业案例为依据，解析个人成功和幸福的因果关系。在面对机遇时，如何做出最佳选择？克里斯坦森给出了答案：制定周密战略或采取应急战略。如果已找到事业出路，就需要制定周密战略，明确目标、坚定信念；如果还在探索中，就要采取应急战略，不断地进行尝试，并灵活调整，直到找到适合自己的方向。🌿最令人印象深刻的是，克里斯坦森提出人生目标的三个组成部分：我想成为的人、对目标是否认同、找到正确的标尺。他强调，这是一个过程，而非事件。这并非一蹴而就的事件，而是一个不断迭代的过程。通过这个过程，我们能够找到真正热爱的事业，并在其中取得卓越成就。🌸最后，让我们深思，一辈子最重要的是什么？与其沉湎于商业理论，不如花时间寻找自己的人生目标。因为学会寻找自己的人生目标，将成为你学到的最重要的事情，成就你的成功与幸福之路。🌹2024年，就让《你要如何衡量你的人生》成为你的指引吧！这本书的精彩观点和生动案例都十分让人激动不已，会让人忍不住一口气读完，其中的精华对工作和生活都有极大的启发价值。#努力成为更好的自己#你要如何衡量你的人生#我的私人书单#好书分享 昆明·滇池风景区,0,0,2,云南,昆明,云南,中国
2,5021737217427861,跳不起来的鞋子,2024-04-10 22:21:55,随手看一个书评就开始犯恶心，现代社会学的书籍究竟是因为作为大众读物的“社会学”太复杂了，所以不能用一些简化的非学术用语表达，还是译者因为抓住看社会学的大多数人都是nm装逼来读的书，所以刻意翻译得晦涩难懂？#当你想表达恶心# ,0,0,0,湖南,,湖南,中国
2,5021733361549387,一只小贝y,2024-04-10 22:06:34,案例分享day31 第七周 4.10 周三《三重阶：当代中国手工艺学术提名展作品》山东美术出版社书籍设计：韩湛宁 亚洲铜设计顾问设计亮点：本书的设计采用了三个颜色，分别表述“遗所思” “忽如寄”“道无因”的三个工艺追问，以此来表达书的主题。同时，三种不同颜色基调的文字让版面分类层次变得清晰，繁复的文本与图像交错，与画面吻合；图像的灵动分布与局部扩张的页面，一张一弛，富有律动感。整体版面设计简约而细部不失三重阶抽象符号的精心考量，最后还做了视觉化的图表索引，阅读后对全书信息一目了然，是一份用心的设计。,0,0,0,上海,上海,上海,中国
2,5021220838049885,牛津大学出版社学术出版-北京,2024-04-09 12:10:00,#牛津在线资源# 【在众多学者的强烈呼吁下，Oxford Scholarship Online (OSO) Archive 将牛津大学出版社在1990-2009年间出版的7500多本图书进行了数字化，覆盖艺术与人文、法律、医学与健康、科学与数学以及社会与行为科学这5大学科，欢迎您访问牛津学术官网阅读网页链接！】💡书籍推荐：📘Antigone网页链接📘Bad Business: Professional Crime in Modern Britain 网页链接📘Fear网页链接📘Females Are Mosaics网页链接📘Mating and Marriage网页链接如果无法访问，可以推荐给您的图书馆免费试用或购买哦网页链接！ （图片源于牛津大学出版社，经由Canva国际版编辑）,64,9,81,北京,北京,北京,中国
2,5021662834067435,赫奇帕奇的大麻瓜,2024-04-10 17:26:20,虽然是学术书籍，但还是觉得这段尊嘟好好玩 ,0,0,0,北京,北京,北京,中国
3,5021421348586586,笑有餘聲,2024-04-10 01:26:46,在即将搬家的时候还是买了这本纸书。翻开看了几页，本打算留在家里，最终成了那次离家行李中唯一一本书籍。一位功成名就的大状在初相识时推荐了这本书，挺奇怪的一个场景。书里收纳了作者40年学术生涯的阅读笔记，是一篇社会学、人类学书籍的活检索目录。虽说是听微声，却也是宏大的历史。在一篇篇小专题里，常常也能给人顿悟的感受。,0,0,0,阿联酋,,,阿联酋
3,5021014905590396,点点点叹号,2024-04-08 22:31:42,大韩出版文化协会主办，首尔国际图书展承办的2024《韩国最好的书籍》评选结果 ，分四个类别（书本设计，绘本，漫画，学术） ,0,0,1,广东,广州,广东,中国
3,5020921178099076,碎纸沉想,2024-04-08 16:19:16,这么学术性的书籍让我写读后感 跟要我命有什么区别 ,0,2,1,湖北,武汉,湖北,中国
3,5020862631379050,剑南小生,2024-04-08 12:26:36,说实话，论文一旦交了，再也不想看它了。连带其他的所谓的“学术”文章和书籍也看不下去。索性看点文艺，读点日记，非常有趣。连日来沉迷于各类电视剧和综艺，让我感到加倍快乐#剑南道# ,0,9,7,北京,,北京,中国
3,5020603648049424,科技边角料,2024-04-07 19:17:30,【北京风入松书店重开，由BOSS直聘全资持股】科技边角料获悉风入松书店日前在北京大学南侧的海淀区中关村大街9号重新开业。资料显示，风入松书店由北京大学哲学系教授王炜于1995年创办，2011年停业。重新开业的风入松书店以人文学术类书籍为主，以通识阅读为特色，开业之初有自然科学、社会科学、历史、哲学、文学、艺术、经济、商业、管理等各品类的图书6万余册。天眼查App显示，风入松书店运营公司为北京直品文化传播有限公司，该公司成立于2023年6月，注册资本1500万人民币，法定代表人为BOSS直聘创始人赵鹏，由BOSS直聘旗下北京华品博睿网络技术有限公司全资持股。资料显示，赵鹏毕业于北京大学法律系，现任看准网科技集团CEO ，BOSS直聘创始人董事长兼CEO。@风入松书店官方微博,0,0,0,北京,,北京,中国
3,5020452960865194,合著社-哈罗学姐,2024-04-07 09:18:44,国外出版的书籍，尤其是学术专著，有很多用途，而用途的实现，离不开考核和佐证。比如评职称认可国外学术专著，参评人可以提供图书馆等权威平台的检索页面，也可以提供国外出版社的出版证明，具体要看职称单位的要求提供的书面材料。出版 职称  在新加坡出版的书籍如何查询？ ,0,0,0,四川,成都,四川,中国
4,5020437052916013,-Piupiupiuuu-,2024-04-07 08:15:30,最近没看小说，没看增长见识的书籍，甚至连字也没读上几个。上一周才终于找到了好综艺看，感觉也还不错。生活中的难题迫在眉睫，我越来越不愿去思考脱离地面的，形而上的学者生活——恐怕此时此地的自己不合适。耐不住学术的枯燥寂寞，也耐不住不和钱打交道的日子。我现在脚踏在朴素的土地上，也挺好的。我观察别人，观察他们的职场经验，分析他们的人物特质，识别上位者对下位者狡猾的压迫，有种俯瞰众生百态的快乐。 当我的思考落在地上，它才高高飞扬，我想。,0,0,3,黑龙江,大兴安岭地区,黑龙江,中国
4,5020231628754646,爱可可-爱生活,2024-04-06 18:39:14,【AI生成内容泛滥冲击Google Books】- Google Books作为索引已出版资料的重要学术工具，正在收录大量低质量、由AI生成的书籍内容。  - 这些AI生成的书籍会出现在Google Books的搜索结果中。 - 大量索引AI生成的垃圾内容，可能会影响Google Ngram Viewer的结果准确性。Ngram Viewer是研究人员用来追踪历史语言使用情况的重要工具，它基于Google Books的数据。  - 这反映出在AI技术快速发展的背景下，学术界对付AI生成的大规模垃圾内容还缺乏应对之策。图书出版和学术搜索工具的把关机制亟待升级，以应对AI带来的挑战。  - 谷歌官方表示会删除所有低质量内容，无论是AI还是人工创作。但AI生成内容的泛滥，对搜索引擎和学术工具构成了前所未有的冲击。  思考：  - AI生成内容正以超乎想象的速度渗透到方方面面。作为知识索引的基础设施，Google Books这样的工具首当其冲受到冲击，凸显出AI时代学术规范和内容把关面临的困境。  - 海量的AI垃圾内容会稀释优质内容的密度，误导读者，破坏学术生态。Ngram Viewer等研究工具也会受到污染，影响学术研究的准确性。学术界需要高度重视这一问题。  - 识别AI生成内容本身就是一个技术挑战。传统的人工审核已然不敷使用，平台和工具方需要研发更智能的AI技术来对抗恶意的AI生成内容。  - 从源头治理，完善AI伦理规范，加强对AI滥用的监管，需要学界、业界、政府多方合力。在拥抱AI红利的同时，也要警惕其负面影响，建立科学的AI治理体系。,16,1,26,北京,北京,北京,中国
4,5020237416367888,一颗葡萄桃加冰,2024-04-06 19:02:14,吃饭的时候跟舍友聊天 说到以前喜欢的书和杂志 突然想到小时候的我极其对自然类的彩页科普书籍感兴趣以及是十万个为什么的忠实拥戴者 甚至当场就想把这种书再买两本 只可惜兴趣永远只是兴趣 兴趣变成专业学术我就没那种探索心了 ,0,0,0,云南,昆明,云南,中国
4,5020207231797921,IIOBEA,2024-04-06 17:02:18,印星生我者为印星，在古代也称印绶，是庇护我或授予我权利的人事物，也主文化，印克食伤，也是压制或者磨练我的思想的东西，以此为基准可以推理印星的类象：老师、监护人、学校、祖国、组织、田地、房子、单位、工厂、店铺、车船、衣帽、床被、知识、书籍、技术、学术、艺术、文章、文凭、文件、契约、合同、印章、广告、商标、旗帜、徽章、文化人、神明、补品、补药、文化机构、福利机构、教育机构、宣传机构、宗教机构、慈善机构,1,6,7,河南,郑州,河南,中国
4,5019765240235961,苏大夫说中医,2024-04-05 11:45:59,宋代官修书籍，将疾病分类，为了区分不同疾病不同特点，对于医生来说好掌握，这是好的学术思路。 #国医的精诚力量# #中医式生活# ,0,0,2,江苏,淮安,江苏,中国
4,5019521295319281,三金古玩,2024-04-04 19:36:37,#春日美好时光# 大家一直关注什么老物件会保值增值，老家具可正常使用，老紫砂壶长期饮水对身体有益！老书籍类有文献价值研究学术考证，和田玉件，老珠子，烟嘴子都会在近期在创高峰！这些会稳增不降。瓷器价格不稳，银制品价格低迷！中高古石雕交易受限，明清件价不如前！如今开办私人馆藏的主题为红色与抗战纪念藏品展示收集，民俗馆普通易常见用品目前存世量大价格未见增长！老普残古代艺术品稍涨价格，珍精稀的永远受人追捧还得留的住藏的好！仅代表个人观点与看法，大家也发表下你们的 三金古玩的微博视频,0,0,1,山东,济宁,山东,中国
4,5019377961799913,高冷的亲嘛嘛,2024-04-04 10:07:04,昨天去老妈家，看她整理老爸的遗物，都是老爸写的书，学术论文，还有日语日记……老妈问留不留？我无语，留，没人看，没人看得懂，不留，可惜了。      在即将扔掉的书籍里，翻到老爸曾翻译的文章，拿回家拜读……      老爸一生真勤奋，每天早上四点起床读书（英语、日语……）每天勤于笔耕，看着他写的那么多书，看着他的手稿由衷的佩服！可惜晚辈们没有一个继承了他的努力、他的奋进……,0,0,0,湖北,宜昌,湖北,中国
4,5019227878852458,桑桑是桑桑是33,2024-04-04 00:10:42,#桑の读书笔记# No.51/Apr/24  《非平面》［美］尼克·索萨尼斯⭐⭐⭐⭐这居然是一本图像小说式的学术论文！我就说图像小说一定会是一种趋势。这本书带来的感受是普通文字类书籍没法给你的，它的信息量丰富，把专业术语通过漫画或者说叫图像的方式呈现出来，虽然也没有到非常易懂，但也能明白了。它主要是探讨视觉和思维是怎么互相作用才让人类有了思考，而且用想象力填补单一维度的空隙，实现人类向多维方向发展，而图像和文字正是这一体现，作者用《平面国》这本书来举例（这本书完全可以作为平面国的参考书籍，因为作者画出来的更加易懂，可以加深对平面国的理解），解释了低维理解不了高维，所以我们更应该用不同角度（维度）来看待事物以及这个世界，才能让我们不至于被束缚在单一的思维模式里。书里用了物理、数学、哲学、文学等多种领域来论证，最重要是用画出来的方式，非常牛！,0,0,0,广东,深圳,广东,中国
4,5019114769482758,投资者的未来可期,2024-04-03 16:41:14,很多学术类书籍，只谈改革受损的成本，闭口不谈改革的收益。挺有意思的。 ,0,0,0,湖北,襄阳,湖北,中国
5,5018880776865717,_白首相知犹按剑,2024-04-03 01:11:26,一种学术论文一样的书籍，多么学识渊博啊，处处都是灵光与玄机。 ,0,1,0,江苏,徐州,江苏,中国
5,5018767404829232,比利时列日大学HEC列日高商,2024-04-02 17:40:56,比利时列日大学 提及菲利普·阿吉翁之名，或许大家都早有所闻。倘若记忆稍显模糊，那么提及那本颇具影响力的书籍——《创造性破坏的力量》，是否能唤醒你的记忆？即便你对他仍感陌生也无妨，今天让我们一起走进这位杰出人物的世界，一同领略其学术与智慧的风采吧。☞网页链接 ,0,1,0,广东,深圳,广东,中国
5,5018753849627430,LaTeX_工作室,2024-04-02 16:47:04,VividBook 的设计注重精美与质感，旨在打造一本令人愉悦的书籍。其优雅的排版和精细的细节使得每一页 都充满活力和生机。您可以通过VividBook 模板轻松创建自己的漂亮书籍，无论是学术论文、技术手册还是创意 作品集，都能以生动的方式呈现。网页链接 ,3,1,7,浙江,杭州,浙江,中国
5,5018594280473214,梅仁爱萍,2024-04-02 06:13:00,第一次看季羡林的书（非学术书籍）一下子觉得学者群体个个藏龙卧虎，从知识上轮番吊打文艺作品创作者（呃感觉说了一句废话）顿感不学会读英文论文真的不行了…尤其是如果想了解一些涉及自然科学的问题更是不得不看，我的洋文真的好烂啊（抱头尖叫） ,1,5,28,英国,,英国,英国
5,5018650074153021,直断功力派申秋,2024-04-02 09:54:41,万事万物都有阴阳两面，有阴就有阳，有阴就有阴。易学界也是阴阳混杂，真假知识混杂。互相攻击，自古以来就是如此。阳被阴胜也是常态。        古代风水书籍，作者的感慨就是伪书太多，他们都会有一个章节叫什么辨，就是点评错误荒谬易理的。         尤其易学牵扯经济利益之后，学术精神更加不纯。        在易学界留个名并不容易，谁有名谁就被攻击。这就是“道”，硬的东西就会被折断，刚强的人，就容易被挫。万物不离“道”。        古人书，一个人能力再强，也要注意防范他人，一个人种树不容易，十个人拔树。这棵树就不能成活。         越是处于风尖浪头，越容易被人攻击。展示能力也展示了，依然被攻击。这就是“道”必有黑有白。发展中的事也会参杂黑白。,0,0,0,河北,沧州,河北,中国
5,5018381805683116,Eruvin,2024-04-01 16:08:42,一直以来觉得很神奇的一件事，明明母语中文，但看中文类的学术文献或者书籍，总有种理解不够深入之感。甚至是上学时候的教材（特别是大学），换成英文版后，感觉一下子就通了，而且英文版的总是能引发很多令人兴奋的联想和感悟。不只是行文逻辑的问题，很多时候单个词的使用也会导致理解程度的差别。 ,1,0,0,广东,深圳,广东,中国
5,5018279007487372,AndrewLuo的围脖,2024-04-01 09:20:13,『2024.04.01  早安晨语』        人生如书，年少是色彩斑斓的流行杂志，写满了青春；中年是内容丰富的学术读物，写满了故事；老年则是一本古典线装书籍，写满了回忆。        然而，人生，不是因时光而变老，而是随着心态而改变。        年少看手，手心向下，勤奋努力；中年看心，历尽沧桑，不忘初心；晚年看脸，脸上有笑，人老心不老。        人生是一场自我完善的修行。历经岁月高低起落，遍尝生活苦辣酸甜。把握自己，掌控人生。所有的经历，无论悲喜，都为塑造更完美的自己。即使青春不再，年华已逝，也终究会遇见最美的自己。        愿在修行的路上，不悲不喜，不慌不忙，从容面对！,0,0,0,河南,,河南,中国
6,5017902136688851,Lacan和Zizek百年好合,2024-03-31 08:22:39,某日本学者的知名书籍真的能算是学术著作吗……一开篇的逻辑就莫名其妙啊…… ,0,0,0,广东,,广东,中国
6,5017661283762210,社会大学教师杨杰,2024-03-30 16:25:35,社会大学之科研问题的类型现象性问题的案例妈妈，太阳从哪里升起？你站在那个窗台看日出，你就知道太阳从哪里升起了。妈妈，我看见日出了，太阳从贵山的东面升起。学术性问题的案例妈妈，太阳和地球的空间位置关系如何变化？你去看看地理书籍吧，那里有答案妈妈，我知道答案了，地球围绕太阳公转，公转的轨迹就是太阳和地球的位置关系。实践性问题的案例妈妈，我想吃蛋炒饭，在炒饭时，鸡蛋会糊，请问怎么办？你先搅拌鸡蛋，然后锅子里放油，最后把鸡蛋倒入锅中。归纳总结：与研究对象表现出来的现象有关的问题属于现象性问题。与研究对象的本质有关的问题属于学术性问题。在创造价值或者提供服务的过程中，阻碍预期结果实现的问题属于实践性问题。,0,0,0,贵州,,贵州,中国
6,5017432894211606,一颗NACL,2024-03-30 01:18:04,尝试忽悠亲友给我写梦文，结果她瞬间答应并拉着我圆了一下午加一晚上设定，现在为了理解自设开始啃萨满相关学术书籍。。。。我宣布你是我的主人了。。。 ,0,3,0,四川,雅安,四川,中国
6,5017352113228760,牛眼看车,2024-03-29 19:57:04,第一次去敦煌莫高窟，就是带着九色鹿的储备去的，然后就是一脸懵逼，大受震撼，看完带了一堆问题回来，然后恶补各种书籍、报道、学术文章，稍稍抚慰了初见时的震撼。然后就要求自己再去一个地儿必须先储备点知识再成行。最近的目标是山西的古建筑，以三大唐构为主线。梁思成去了六次，我争取今年成行一次，站在大师和老师们总结成果的基础上，尽量效率高一点。,0,0,5,上海,上海,上海,中国
6,5017263080210787,SCI核心期刊SSCI发表-何编辑,2024-03-29 14:03:16,★国际专著★出版①正规ISBN书号②1-3个月左右出版，周期快③可中、英文两个版本，提供纸质版书籍④按需定制，各学科均可发⑤国际学术被认可度高，更具加分优势参考题目： 1.大学英语教学XXX模式构建：理论与实践2.绘画艺术在XXX装饰设计上的应用3.传统文化融入XXX高校思政教育机制探究4.音乐变革：古典和现代XXX碰撞和融合5.浅析流行音乐的XXX鉴赏与发展背景,0,0,0,河北,张家口,河北,中国
6,5017206887024284,中图网官方微博,2024-03-29 10:20:00,#淘书团#“百年五四：共同的文化精神家园”全4册：《五四那些事》《五四那些经典》《五四那些思想》，16开精装。以详实的史料对五四时期人物、事件、作品、思想等进行了梳理，每一册都是一部独立的史诗，但又相互呼应，共同构建了一幅完整的五四画卷。这套书籍不仅是学术研究的宝贵资料，更是每一个中国人了解自己文化根脉的重要途径。,2,2,8,河北,保定,河北,中国
6,5017169303437793,m遇见_369,2024-03-29 07:50:39,推荐书籍：《求真至善唯美》推荐理由：本书是“北京社科名家文库”丛书之一种，选编了作者在教学与研究工作中发表的有关哲学特别是西方哲学方面的文章，基本体现了作者的主要研究方向和学术视野。本书共分六辑：第一辑，哲学总论；第二辑，德国古典哲学；第三辑，现代西方哲学。内容条理，思想深刻。此书籍有益于我们陶冶情操。,0,0,0,陕西,西安,陕西,中国
