页码,微博id,微博作者,发布时间,微博内容,转发数,评论数,点赞数,发布于,ip属地_城市,ip属地_省份,ip属地_国家
41,5005950467443268,钢都刀郎,2024-02-27 08:51:00,ChatGPT进入到可自我自主选择阶段。人类的选择是基于理性判断，会权衡利弊，会从社会价值、经济利益价值、环境价值和人的成长价值等多个方面去评估，最后做出理性选择。但ChatGPT的选择让人看了心生恐惧。如果把这条恶龙释放出来，人类必然会自我毁灭。 ,0,0,0,辽宁,鞍山,辽宁,中国
41,5005949773284931,孤独的峰哥,2024-02-27 08:48:15,飞蚊症患者必须经由散瞳检查才能判定所患的飞蚊症是良性的或是病理性的，因此必须定期追踪与检查。只是就算当时检查出只是生理性或退化性飞蚊症，也不表示将来不会合并病理性的飞蚊症。可以借由自我检查，初步评估是否就医。在早晨起床前像视力检查般遮住一眼，轮流用单眼看天花板，如果看到眼前有黑点在晃动或是黑点数目变多、位置变动、大小改变等现象，那就要赶紧就医。如果只是生理性或退化性的飞蚊症并不须特别接受治疗，如果是病理性飞蚊症有些可借由雷射治疗或是手术处理。患较严重病理性飞蚊症的机率虽然仅占5％，但却有失明的可能，实在不可轻忽。视网膜脱离 眼科 药品和飞蚊一样，眼睛有时也会出现闪光情形，这是因为玻璃体在眼球内摩擦或拉扯到视网膜。就好像有人的眼睛遭到重重一拳时，看见满天金星道理是一样的。当眼睛看见闪光，甚至断断续续出现达数周甚至数个月之久。此时就必须立即到眼科医师检查，是否视网膜已经剥离。另外，由于偏头痛引起脑部血管收缩，也可能使眼睛出现闪光。这种闪光会伴随头痛，和前述的视网膜被拉扯所引起的闪光是不相同的，并不是眼睛的问题。来源 南方健康,0,0,0,河南,郑州,河南,中国
41,5005860411277347,尧乡钧铖,2024-02-27 02:53:08,情绪管理能力差的表现情绪管理能力差的表现可能有以下几种：缺乏自我认知：这类人往往对自己缺乏准确的评估，无法判断自己的情绪状态和情感需求，也不清楚自己的优点和缺点。他们可能会陷入自我怀疑和否定之中，导致情绪波动较大，难以控制自己的情绪。情绪波动大：这类人在情绪激动时会容易发脾气、哭泣或感到沮丧，这在社交场合中可能会影响他们保持冷静，与人交流时也可能受到情绪干扰，难以建立起他人的信任和支持。社交意识薄弱：这类人可能不了解如何与他人交往，缺乏解决冲突和处理人际关系的技巧。他们可能不懂得倾听他人的需求和情感，也不擅长适应不同社交场合，因此难以建立良好的人际关系。关系管理能力差：这类人可能不清楚如何维护良好的人际关系，也不懂得如何解决冲突和处理矛盾。他们可能容易与他人发生分歧和摩擦，也难以与他人建立深层次的情感联系。动不动就大哭：有些孩子在遇到小事时可能会过度哭泣，这可能是因为他们还没有学会如何适当地处理自己的情绪。容易发脾气，无理取闹：有些孩子可能会因为一点小事就发脾气，这可能是因为他们的情绪反应过于激烈，没有足够的同理心和考虑他人情感的能力。逃避现实，不想承担责任：这类人在面对问题时不愿意承担起责任，总是试图将责任推给他人，而不是主动解决问题。无法独立，将自己寄托于他人：这类人可能无法独立生活，需要依赖朋友或家人的帮助，不愿独自面对生活中的挑战。经常以自我为中心：这类人可能不会站在他人的角度思考问题，经常只关心自己的感受，不顾及他人的利益。对待压力的态度不佳：在面对压力时，情绪管理能力差的人可能会出现焦虑、抑郁等情绪问题，影响其应对和解决问题的方式。掌控不了自己的情绪：情绪管理能力差的人可能无法控制自己的情绪，尤其在面对挫折和困难时，可能会做出错误的决策，影响自己和他人的利益。,4,1,0,广东,惠州,广东,中国
42,5005757556985040,言小困,2024-02-26 20:04:27,最近看书总结到了一个奇怪的点，所有的行为都可以归结为商业模式，这么看的话很多之前解释不通的矛盾就一下子豁然开朗了，商业模式就是价值对标的，有多少价值对标多少量级的事物。做事情是之前需要自我衡量一下风险，做个基础评估，想要稳赢的话还是需要以大博小。 ,0,0,0,河北,廊坊,河北,中国
42,5005387785044932,柒爸星座,2024-02-25 19:35:06,上升太阳天秤座一周运势（2.26-3.3）：周二，自我表达宫位里的火星与木星四分相，它通常表示带来一种积极、乐观、豁达的情绪和心态，甚至有一点过度。所以不要对某事未来走向的预期过于乐观，或者是，过几天后，重新再评估一次。如果有公开表现自己的场合，如讲演、汇报、演出、面试等等，避免表现的太过高调、出风头，这不会给人留下好印象。这一星象有时也表示在娱乐消遣的活动上花了太多时间。周三至周五，太阳、水星、土星合相在职场和健康的宫位，并与木星六分相。在职场上可以有出色的表现，专注于当前的业务内容，使之稳步推进，看到切实进展。非常适合去做那些需要耐心和责任感的工作，如调研、磋谈、汇报、撰写等等。另外，这几天也非常适合为自己制定一个和运动、饮食、睡眠相关的健康计划。周四至周日，金星与凯龙、北交点吉相位，与天王星刑克，与恋人约会的好时间，同样利告白示爱。#天秤座##好运2024#,0,0,18,北京,,北京,中国
42,5005704814922772,一个古风工作室,2024-02-26 16:34:52,??注会向来擅长的自我保护方式是，cpa一旦察觉到对方冰冷的态度，cfa就自觉退避三舍，frm从来不会去想捂热这段关系。 24年中级会计 24年注册会计师 注册安全工程师 真正的坚韧，税务师超话应该是哭的时候要彻底，CPA超话笑的时候要开怀，#注会网课# 说的时候要淋漓尽致，#中级经济师# 做的时候要毫不犹豫。#初级经济师# 希望会有人一直护着你，中级会计网课超话不让你的棱角都被磨平，让你的眼睛里一直带着光，#资产评估师#我也喜欢又子的微博视频 ??? 人的一生会遇到很多事情，会有很多十字路口，会有很多泥泞与坎坷。但只要认真对待，不轻心大意地对待眼前哪怕看似很无足轻重的一件事，未来就一定不会有遗憾。 陕西作家柳青曾说：“人生的紧要处往往只有几步。”于是人们小心翼翼地寻找那关键的几步，比如每一次升学的机会，每一次工作的调换等等，希望在这样的转折上把握好自己的命运。,0,0,0,湖北,武汉,湖北,中国
42,5005543602914377,爱可可-爱生活,2024-02-26 05:54:16,[CL] Confidence Matters: Revisiting Intrinsic Self-Correction Capabilities of Large Language Models  网页链接  提出并验证了一种观点：大型语言模型(LLM)在自我修正过程中，对自身的“信心”有内在的理解和评估能力。这一能力可以通过独特的“If-or-Else”(IoE)提示框架来增强，该框架以一种新的方式利用模型的自信度来指导模型进行内在的自我修正。通过实验证明，使用IoE提示的方法能够显著提高LLMs自我修正的准确性，这一发现对于理解和提高LLM的自我修正能力具有重要意义。,15,1,14,北京,北京,北京,中国
42,5005546829119646,凝飞呀,2024-02-26 06:07:05,#凝飞精选早读#2155——既然躲不掉，那就要勇敢直面。从普通个体的角度来讲，在M型的消费社会中，要合理评估自己的认知能力和勇气，学会持续地自我成长，同时谨慎做好家庭资产负债表规划，一方面要尽量确保自己能够维持现状，另一方面也要全力做好向上跃升的准备。从企业经营者的角度来讲，在K型的企业分化过程中，要充分考虑自己的优势、特点和禀赋，准确找好自己的定位——引领者、等风者，还是追随者，尽量让自己走得更快、变得更强。老子说过，“祸兮福之所倚，福兮祸之所伏。”分化并不可怕，可怕的是没有准备。祝你，在日益加剧的分化中，寻找到向上的机会。祝你，在大风大浪中，寻找到自己的灿烂阳光。,0,0,0,浙江,杭州,浙江,中国
42,5005492469891801,我爱上了自己nn,2024-02-26 02:31:05,面对那些只看到你缺点而不承认你价值的人，可以采取以下几种策略：1. **自我反思**：首先，冷静地评估他们的批评是否有一定的道理。如果有，可以将其视为成长的机会。2. **沟通**：如果可能，尝试与这些人进行沟通，了解他们的观点，并表达你的感受和立场。3. **保持自信**：记住自己的价值不是由别人的看法决定的。保持自信，专注于自己的长处和成就。4. **选择性倾听**：如果沟通无效，学会选择性地倾听。不必过分在意那些负面评价，专注于那些支持你的人。5. **寻求支持**：与朋友、家人或同事交流，寻求他们的支持和鼓励。6. **专业建议**：如果这种情况影响到你的工作或生活，考虑寻求专业人士的帮助，如心理咨询师。7. **保持距离**：如果必要，与那些消极影响你的人保持一定的距离，以保护自己的情绪和精神健康。8. **积极行动**：通过实际行动证明自己的价值，用成果来回应那些质疑你的人。记住，每个人都有自己的价值，不应该仅仅因为别人的看法而否定自己。保持积极的态度，专注于自己的成长和幸福是最重要的。,0,1,0,广东,茂名,广东,中国
42,5005476364026635,Utooooooooopia,2024-02-26 01:27:05,诉苦之前谨慎地评估自己的苦配不配诉，得出结论是确实不太配诉，大家都惨惨的以致不带负外部性的诉苦显得不太可能。主打一个自我开解循环念诵怜我世人忧患实多生亦何欢死亦何苦… ,0,0,6,北京,,北京,中国
42,5005464075504957,单光辉网络家排创立人,2024-02-26 00:38:15,#单光辉爱自己心理学#了解单光辉布袋疗法的效果是否显著，可以从以下几个方面进行观察和评估：自我感受：首先，关注自己的内心感受和情绪变化。在进行单光辉布袋疗法的过程中，你是否感到更加放松和自在？是否能够更好地接纳和处理负面情绪？如果你感到自己的情绪状态有了明显的改善，那么这可能意味着疗法正在发挥作用。生活表现：观察自己在日常生活中的表现。你是否更加积极地参与社交活动？是否能够更好地应对工作和生活中的挑战？如果你的行为表现有了积极的改变，那么这也可能是单光辉布袋疗法效果显著的表现之一。他人反馈：询问身边的人对你的变化和进步是否有所察觉。有时候，我们的自我感知可能不够准确，而身边的人可能更能客观地观察到我们的变化。如果他们也注意到了你的积极变化，那么这可能进一步验证了单光辉布袋疗法的效果。专业评估：如果你有条件，可以寻求专业心理咨询师或心理医生的评估。他们可以通过专业的心理测评工具和方法，更准确地评估你的情绪状态和心理健康水平。如果专业评估结果显示你有了明显的改善，那么这可以视为单光辉布袋疗法效果显著的有力证据。,0,0,0,河南,郑州,河南,中国
42,5005403440288064,哈娃娃icecream,2024-02-25 20:37:19,20世纪的这种市场类目(market repertoires)和自我语言的渐进式融合，我称之为“情感资本主义”。在情感资本主义文化中，情感已经成为一种可被评估、检查、讨论、协商、量化和交易的实体。在这种创造自我以及通过部署大量文本和范畴来管理和改变自我的过程中，它们也促成了一个痛苦的自我，一个由其心理缺陷来组织和定义的身份自我，它需要通过不断完成自我改变和自我实现的命令，才能被重新纳入市场之中。 —,0,0,0,湖北,武汉,湖北,中国
43,5005335226221557,那个夏天的沉默,2024-02-25 16:06:15,心理学家乔丹皮特森和政治哲学家齐泽克的辩论其中的一个主题：幸福皮特森：    在绝对收入水平和自我评估的快乐与否或痛苦与否，这两者之间存在关联。当财富超过某个临界值后，额外的物质补给不足以弥补我们在个人或社交层面的匮乏感。幸福与可量化的经济状态即收入，是正相关的。幸福在这里可以看作是心理上的快乐（也可能是痛苦的减少），物质的保障是幸福的必要条件，只要在幸福与物质层面的保障相关区间内，那么自由市场就是最有效的提高人们幸福的方式。个人道德中应该有对于至善的追求，个人是终极价值的主体，每个人都是承担社会责任的主体，一个社会的稳定取决于每个人的正直和诚实。齐泽克：   1、幸福应该被视为某种必要的副产品，如果专注于它就会迷失方向，幸福是一种类似于为事业奋斗的过程中的一个副产品……，幸福意味着你可以把责任归咎于其他人。2、不要低估人性之恶。来自斯洛文尼亚的一个故事：一个有着上帝形象的人出现在一个农民面前，对他说我可以满足你的一个愿望，但同样也会满足你邻居的一个愿望，农民想了想说，行吧，那挖去我的一只眼睛吧！这就是人性之恶，永远不要低估它，我们永远不会摆脱它。人的行为一定伴随着错误。哲学是对历史的反思，是对社会秩序的反思，哲学无法预测未来，未来是极端开放的。我们缺少一个基本的认知地图，我们对于自己所处的位置没有清晰的认知，对于将去向何处同样没有清晰的认知。,0,0,0,山西,太原,山西,中国
43,5005296601137280,葈耳,2024-02-25 13:32:45,国内不退能坚持拿到一个证，国外放养+push+pua切换，自我心态支撑+自己指导自己，遭遇严格评估，各种批评做的不行。奔溃是迟早的事。 ,0,0,0,马来西亚,,,马来西亚
43,5005263507297097,一个古风工作室,2024-02-25 11:21:16,??注会向来擅长的自我保护方式是，cpa一旦察觉到对方冰冷的态度，cfa就自觉退避三舍，frm从来不会去想捂热这段关系。 24年中级会计 24年注册会计师 注册安全工程师 真正的坚韧，税务师超话应该是哭的时候要彻底，CPA超话笑的时候要开怀，#注会网课# 说的时候要淋漓尽致，#中级经济师# 做的时候要毫不犹豫。#初级经济师# 希望会有人一直护着你，中级会计网课超话不让你的棱角都被磨平，让你的眼睛里一直带着光，#资产评估师#我也喜欢又子的微博视频 ??? ——每天应做的第一件事，就是运用建立猾心态的技巧控制你的思绪，并且整天都遥持猾心态。,0,1,0,湖北,武汉,湖北,中国
43,5005250383839856,宇宙牌儿香烟-,2024-02-25 10:29:07,持续实践并有效的心态： 1、不带有“新手心态”进入新领域，任何事情只区分成未进行和进行两种情况。 2、对重要事件有回应、持续的评估。 3、爱是一种生命能量。 4、不轻易允诺，或不轻易失约，即是一种自我觉察。 ,0,1,0,河北,张家口,河北,中国
43,5005024610750088,Faith_______,2024-02-24 19:31:59,写报告时的自我评估常常陷入一种二极管思维：在写的还不错和一坨狗屎之间反复横跳 ,0,0,2,辽宁,沈阳,辽宁,中国
43,5005000682248983,戴耳环的奥利弗,2024-02-24 17:56:54,强大的内心自信心和高度的自我认可能力是你成事成功之关键。#个人评估# ,0,0,0,江苏,苏州,江苏,中国
43,5004957623520540,乐活仁寿,2024-02-24 15:05:48,【新年首马 当仁不让 | 参与2024仁马一定要看的注意事项！】跑友们请注意啦！由于本次仁马比赛前期，出现了明显降温天气情况，当天气温3-11℃，且近期正处于呼吸道疾病高发期，参赛选手应充分认识到这些潜在的健康风险。在此，提醒广大跑友们，在参赛前应做好充足的身体健康准备和自我评估，并采取以下措施↓ ↓#仁寿身边事儿##仁寿马拉松#,0,0,0,,成都,四川,中国
43,5004881969024620,从5635439031,2024-02-24 10:05:10,疫情过后这两年，无论百姓还是国家都在对经济表现出前所未有的担忧……本来想写经济发展和人类进步的话题，感觉太大，框架也很凌乱。但是内心总感觉问题不在于经济如何高速发展！就好比一个人吧，挣到很多钱只是结果，而这中间的过程，前提设置，未来规划都的是事实就是的自我评估！而最后挣到钱也只是水到渠成的事，而这种副产品本身就不可以作为前提或者未来理想去设置！不否认人性的恶，思想体系中也不能把消灭恶作为前提设置，恶是本来，善良也是本来，是对立的统一体！人类也许在未来不再需要思考的时候可能两者都会自然被消灭！而此刻我们只能通过一种体系，一种行为去巩固发展更适合人类进步的基因……人是什么，或许就是一个一直等待被进化或者被升级的符号吧！,0,0,0,甘肃,,甘肃,中国
44,5004850075797705,爱可可-爱生活,2024-02-24 07:58:25,今日推介(第1325期)：通过自我验证泛化到新工具、基于Transformer通过搜索动态自举实现更好的规划、语言模型作为通用回归器、重新审视LLM人工反馈强化学习的REINFORCE风格优化、语言模型潜空间控制与评估 公·众·号：爱可可爱生活 爱可可 AI 前沿推介(2.24) #机器学习##人工智能##论文# ,4,0,8,北京,北京,北京,中国
44,5004746244752022,-19cc,2024-02-24 01:05:51,自我评估了一下感觉现在我的身体状况是40岁 ,0,0,0,韩国,,韩国,韩国
44,5004702987066038,piupourj,2024-02-23 22:13:58,抖子上一口一个姐妹我懂你我也是又骚又贱的死绿茶的szn真的一股太妹味自我评估倒是还真没错 ,0,0,0,江苏,无锡,江苏,中国
44,5004632424188065,心理健康小白,2024-02-23 17:33:34,为什么要做MBTI测试?MBTI是很多企业一直使用的人格评估工具。MBTI归纳提炼出4个关键要素，把人区分成16种类型，如ENTJ领导者、ISFP艺术家、INFJ哲学家等，很多人认为MBTI对自己的恋爱、婚姻、职业和自我认知帮助很大。更客观得了解自己！让性格和人格特点成为成长助力！为个性化发展和职业成长打实基础！测试入口MBTI：网页链接,1,0,1,河南,郑州,河南,中国
44,5004628410238230,长耳楊在这儿,2024-02-23 17:17:37,关爱克罗恩病人 🫂IBD｜中国克罗恩病诊治指南（2023年·广州）📝笔记——2023年度克罗恩病诊治指南出处/中华医学期刊全文数据库-中华医学会消化病学分会炎症性肠病学组、中国炎症性肠病诊疗质量控制评估中心内容/详见链接网页链接💬NOTES整理了《中国克罗恩病诊治指南》的目录，具体的内文还是推荐大家直接读全文，根据个人情况酌情阅读理解，积极同医生沟通。预祝有需要的小伙伴们，尽快越过短期目标，突破中期目标，达到长期目标。【对我个人比较有用的几个信息点是】❶ 关于肠道狭窄的处理，除了球囊扩张之外，还有内镜下狭窄切开术。（💡但我还不知道这是什么，而且它的推荐强度是弱，所以可能不考虑）❷治疗目标分为短、中、长期，基本可以概括为短期目标指标正常、中期目标黏膜愈合、长期目标深度缓解。（💡不过这也是个推荐强度弱的，大家都再接再厉加油维持吧）❸ 要常规进行营养评估与监测，制定个体化的营养支持治疗方案。（💡这个推荐强度强，控制炎症的同时，通过个性化饮食保障营养是必要的。）❹ 精神健康状况评估的必要性。（💡心理健康和身体健康相辅相成的，形神都好是最好的，可以继续调整自己，找到适合自己的方法，逐步提高心理韧性，让身心状态都好起来。）#炎症性肠病##克罗恩病##炎症性肠病##自我观察##读书笔记##减压#,0,0,3,湖南,长沙,湖南,中国
45,5004348427602739,爱听歌的人最好命,2024-02-22 22:45:04,结果=努力*基因，认清了我是一个普通人，这辈子能做到三四分努力就足够了  现在自我评估努力0.5分-1分 ,0,0,0,广东,广州,广东,中国
45,5004324893363353,用户7004586978,2024-02-22 21:11:33,任何目标的实现，都绝非线性的旅程，而是一条蜿蜒动荡的曲折道路，充满等待被揭示的经验教训。卓越之人不仅会在繁忙的日程中，抽出时间庆祝胜利，还会深刻的反思经历，进行持续的自我评估，细致入微地剖析决策、行动和结果。回望来路，他们会反思收获的宝贵见解，理解隐藏的失误，同时考虑未来的各种可能。从而不断自我修正，更明智的为未来制定策略。正如尼采所言：「只有通过谨慎反思，才能发现内心的深度。」,0,0,0,福建,莆田,福建,中国
45,5004306593615574,恩阳110,2024-02-22 19:58:50,#周五爆改周四#明天要上班哟晚安 【给自己积极的心理暗示！4步克服厌学情绪高效学习】①自我评估，客观考察自己的习惯和学习方法，找到最适合自己的学习方式；②运用语言的力量调整心态，尝试给自己积极的心理暗示；③先挑选简单任务建立学习的动力，降低期待值；④给自己设定激励行为，劳逸结合。想做行动派，现在就实践起来！via@人民日报  ，分享知识，传递正能量 法治四川的微博视频,0,3,2,,巴中,四川,中国
45,5004247604925501,宝月楼杨勇,2024-02-22 16:04:26,巡视机构、巡视干部应当自觉接受党组织监督、民主监督、群众监督等各方面监督，带头强化自我监督。建立健全内控机制，加强对巡视干部特别是巡视组组长、副组长等关键岗位人员的监督，严格执行回避、保密、重大事项请示报告、作风纪律评估等制度规定，依规依纪依法开展巡视工作。　　 ,0,0,0,河北,邯郸,河北,中国
45,5004201232434599,烬心烬厉Leo,2024-02-22 13:00:10,#每日一善# #阳光信用# 自尊在我们做的每一件事上表现出来。现在，让我们集中在某些特殊的办法上，它们可以帮助我们增强自尊，因而也赢得他人的更多的尊重。很多哲学家都忠告我们：要认识自己。但是大部分的人都把它理解为，仅认识你那消极的一面，不少自我评估都包括太多的缺点、错误与无能。认识自己的缺点是很好的，但如果仅认识自己的消极面，就会陷入混乱，使自己变得没什么价值。,0,26,8,广东,东莞,广东,中国
45,5004176423652222,变美我熟,2024-02-22 11:21:35,"#明星同款##笑容管理##五官分析#面部特征评估微笑风格管理知名人物推荐#日常#生活 你认为笑和哭哪个更丑吗？只需10秒钟就能自我检测你是否应该保持微笑。有些人的笑脸和严肃的表情有着天壤之别！我们发现有人一笑起来就格外迷人，而另一些人即使不笑也同样引人注目!快跟我一起来做个测试吧！1⃣️观察脸部特征2⃣️检查颧骨3⃣️审视下颌线4⃣️查看牙齿状况结果如下:🙌如果选择A选项较多：更适合保持沉默参照名人：刘亦菲、白鹿、迪丽热巴冷酷的脸庞简直就像一把利器！绝对气质美女🙌如果选择B选项较多：更适合露出笑容参照名人：赵露丝、虞书欣甜美且温柔的笑容让人心动不已~🙌如果A, B选项数量相同：无论是否微笑都很美那么你认为你是更适合保持沉默还是露出微笑呢?记得邀请你的朋友也参与进来进行测试哦～。",0,19,0,,,,
45,5004139614438954,明亭道人,2024-02-22 08:55:19,根据心理学研究，大多数成年人在中年时都会经历一次转变(transition)，他们将重新定义或转换自己的人生角色。成年生活的特点就是一系列的转变，转变可能每15年到20年就会发生一次。成功的转变通常会包含一段高度自我反省的时期、重新评估自己当前的角色、探索能够带来全新意义感的可能性以及放弃旧的角色然后致力于新的角色。转变可能包含了某些可以预见的事件，如结婚、生子、退休，也包括一些不可预期的事件，如突如其来的疾病、分手或失去工作或爱人。转变可能是渐进的过程，就像一段关系或工作随着时间会变得越来越乏味，或者一个人变得越来越自信：无论如何，在某一时刻，个体都会意识到一个关键性的差异，这会促使他进入转变期。15到20年，刚好是大运换五行属性的时间段，10年一大运，20年两步大运，就是更换五行。,0,1,7,广东,深圳,广东,中国
