页码,微博id,微博作者,发布时间,微博内容,转发数,评论数,点赞数,发布于,ip属地_城市,ip属地_省份,ip属地_国家
22,5022275553984910,征诚期刊,2024-04-12 10:01:04,经济管理、企业管理专业论文发表投稿指南、经济管理cn期刊投稿  经济管理、企业管理专业论文发表投稿指南、经济管理cn期刊投稿  经济管理、企业管理专业论文发表投稿指南、经济管理cn期刊投稿  经济管理、企业管理专业论文发表投稿指南、经济管理cn期刊投稿 ,0,0,0,河南,郑州,河南,中国
22,5022275172042706,刘编辑_期刊论文,2024-04-12 09:59:33,💥艺术专业评职可投期刊汇总~。✨求求了！真心希望所有艺术专业及都能刷到！ ✨今天给大家整理带来了几本适合艺术专业好发的期刊： ✅《新美域》✅《中华纸业》✅《黄河.黄土.黄种人》✅《黄河之声》✅《音乐生活》✅《今古文创》✅《芒种》✅《深圳青年》✅《丝路视野》✅《黑龙江史志》✅《文化产业》✅《新楚文化》✅《中国民族博览》✅《大众文艺》#期刊##论文发表#,0,0,0,江西,南昌,江西,中国
22,5022268595635133,杂志社--马老师,2024-04-12 09:33:25,学术期刊论文发表《机电信息》 省级，半月刊，知网万方维普 24年7-8月出刊 栏目：电气工程与自动化、设计与分析、设备管理与改造、工艺与技术等。 ,0,0,1,河北,石家庄,河北,中国
22,5022268410825441,杂志社--马老师,2024-04-12 09:32:41,学术期刊论文发表✨✨✨国际中文普刊 ——《现代教育与实践》 5000字符数  🌻现收24年4期 ❗❗——知网 维普收录 收稿方向：理论探讨、教研视点、德育论坛、课题研究、素质教育、教学案例、学校管理、前沿新探 。 ,0,0,0,河北,石家庄,河北,中国
22,5022268327724504,杂志社--马老师,2024-04-12 09:32:21,学术期刊论文发表🎈国际中文期刊——《工程技术研究》 知网、万方首页收录   现收24年10期，6月出版。 有稿速投[庆祝] ,0,0,0,河北,石家庄,河北,中国
22,5022267921400985,杂志社--马老师,2024-04-12 09:30:44,学术期刊论文发表★《现代营销》（下旬刊）★  →F经济刊，知网，有影响因子 →24年5-6月版面，6-7月底出刊，3版6500字符起发 →主收：企业战略、金融、营销、人力资源、区域经济、管理、财务 ,0,0,0,河北,石家庄,河北,中国
22,5022267830701097,杂志社--马老师,2024-04-12 09:30:23,学术期刊论文发表【考试周刊】知网，省级G4，周刊，基教全科(学前教育-高中阶段)，2024年10月版面，11月出刊。3版4500字符， 【（注：江苏、贵州、甘肃、福建4版6000字符起发） 】 ,0,0,0,河北,石家庄,河北,中国
22,5022267742618457,杂志社--马老师,2024-04-12 09:30:02,学术期刊论文发表【商讯】知网，国家级半月刊，经济类； 4版6000字符，24年8月版面，9月出刊； 主要栏目：企业管理、案例分享、金融天地、圆桌论坛、金融证券、人力资源等 ,0,0,0,河北,石家庄,河北,中国
22,5022267643532302,炒白果忠实爱好者,2024-04-12 09:29:38,老师完全不考虑这些人的水平，带我们阅读她发表的英语论文。。。  论文，英语论文，发表的英语论文。666 ,0,0,0,福建,泉州,福建,中国
22,5022267485195685,杂志社--马老师,2024-04-12 09:29:00,学术期刊论文发表通知：《记者摇篮》年内12月今日截稿，明天开始收25年版面 有要24年版面的尽快发稿过来 3版5600字符起发 省级知网月刊，学术期刊 ,0,0,0,河北,石家庄,河北,中国
23,5022267388726492,杂志社--马老师,2024-04-12 09:28:37,学术期刊论文发表知网+官网，理论版，不限方向/单位 【经济导报】审核快，省级 便宜特价，4-5月见报 可带摘要、关键词、参考文献 ,0,0,0,河北,石家庄,河北,中国
23,5022267000226498,我的cp明天就复婚,2024-04-12 09:27:05,今天找导师改论文 导师让好好改可以发表🥲可我只想狠狠去玩剧本杀，已经约了三天的本 ,0,0,0,江苏,,江苏,中国
23,5022263808363498,春风吹战鼓擂1234,2024-04-12 09:14:24,《社区文化》国家级，知网主管：国家新出闻‬版署G0教育文化刊24年半上‬年版面，3版国刊际‬号：ISSN 2095-8196国刊内‬号： CN10-1940/G0收：社教区‬育、民间艺术、文人化‬物、研究探与‬索、作品欣赏、文化馆、社区健康、公管共‬理、社区阅读、社区家教、社会调查、社会慈善、工作队伍设建‬等#论文##期刊发表#,0,0,0,河北,保定,河北,中国
23,5022263682534288,春风吹战鼓擂1234,2024-04-12 09:13:54,《新课程》 中国知网 万方 龙源网全文收录 3版起发，G4纯教育刊，24年6-7月版面，教学设计、教学案例、教学反思、课堂实录、案例分析、教育故事、教学随笔等均可，需要联系！#论文##期刊##期刊发表# ,0,0,0,河北,保定,河北,中国
23,5022260704576079,论文发表红小豆,2024-04-12 09:02:03,论文发表北核 《财会xx》最新题目     随时拟题。录用快1.……企业信贷资源配置的影响2.财务数智化转型对企业价值……3.乡村振兴、社会责任与农业……4.共同富裕背景------企业盈余持续性5.-------产业政策与企业资本配置效率6.审计市场集中度与企业财务------7.-------旅游企业投资效率的影响8.金融偏向性、企业社会责任------9.商业信用环境对企业投资效率-----10.媒体关注对企业绿色投资------11.社会保险缴费与企业------12.互联网------与企业创新绩效13.数字经济、慈善捐赠与企业------14.财务报表格式调整对企业会计-------15.高管人力资本对旅游企业投资效率------,0,0,1,河北,石家庄,河北,中国
23,5022260310313585,5270好运连连连连,2024-04-12 09:00:30,其实我不是很想把我的论文拿给同门发表😂 我明明受了那么多苦来着 但是还是算了我就是比较怂 而且也不想跟他们起任何冲突 只想赶紧离开这里 ,0,0,0,四川,成都,四川,中国
23,5022260062850041,医学论文小助手,2024-04-12 08:59:31,浙江二级，科技核心  心内科，超声科方向， 6🈷️份左右录用 要求：市级单位，🉑挂护理 #核心##护理#执业医师考试#医学##职称评审##论文发表#  ,0,1,0,安徽,芜湖,安徽,中国
23,5022255447543781,爱探险的大马猴,2024-04-12 08:41:10,狠狠点了这个老师，现在学术界的风气真的很难评，唯论文至上，发表的论文多，就越厉害。会写论文有什么用，中国发表的论文排第一但技术却并不是第一，因为90%的论文都是灌水的，大家都是为了论文而发表论文。可科研的本质不是这样呀，不是为了形式主义，不是为了学位光环，而是要真真正正的去探索问题，解决问题。希望学术界一片清风明朗。,0,1,2,湖南,长沙,湖南,中国
23,5022244378248989,上海科协,2024-04-12 07:57:11,【国际最新研究：森林采伐管理能保护大型濒危哺乳动物】中新网北京4月11日电：国际著名学术期刊《自然》最新发表一篇生态学研究论文称，负责任森林管理认证体系覆盖区域内的哺乳动物比非认证管理森林里的哺乳动物更丰富，被捕猎的威胁更低。这项研究基于对西赤道非洲采伐林的观察结果，揭示采取有效森林采伐管理措施，对大型物种和保育优先级高的物种尤其有益。该论文介绍，全球四分之一以上的热带林都有商业性采伐，为方便木材提取而铺设的公路或让之前偏远的地区出现非法和不可持续的狩猎，森林管理委员会(FSC)旨在推广符合当地和国际法律的可持续森林管理实践并保护生物多样性。论文第一作者兼通讯作者、荷兰乌得勒支大学Joeri A. Zwerts和同事及合作者一起，通过分析14个不同伐木特许区(7个有FSC认证，7个没有FSC认证)的数据评估了FSC认证的森林管理的影响。他们从474个相机陷阱点拍摄的130万张照片数据中探测到55个哺乳动物物种。此次研究数据显示，FSC认证的森林管理使FSC认证特许区的哺乳动物总丰度为原先的1.5倍。按体重超过10千克分类的大型哺乳动物在FSC特许区的遭遇概率更高(高2.7-3.5倍)。世界自然保护联盟(IUCN)濒危物种红色名录中的极危动物(如森林象和西部低地大猩猩)在FSC特许区的遭遇概率也更高；FSC认证特许区比非FSC特许区的捕猎迹象更少。对于体重10千克以下的哺乳动物(如啮齿动物)的遭遇概率，论文作者在FSC和非FSC区域没有发现显著的差异。他们发现非FSC区域的小型动物相对更多，说明这里缺乏捕食者和竞争。论文作者总结认为，他们这项研究结果表明，FSC认证体系对采伐区的大型易濒危哺乳动物有积极影响。因此，非采伐林应继续受到保护，而在有采伐区的地方，应采取负责任的高效管理来保护森林及其生物多样性。,0,0,0,,上海,上海,中国
23,5022237494609338,老马自奋蹄,2024-04-12 07:29:50,"具体说说CSRankings全球计算机科学排名(排名囊括全球范围高校计算机专业,以高校和研究机构在计算机科学领域顶级学术会议上发表的论文数量为参考依据 查看图片 //@机械科技:估计提供的数据还不少呢也会花费很大的精力//@震长:这种高校排名多半是一种生意",8,1,6,中国,,,中国
24,5022234370114236,电气技术杂志社,2024-04-12 07:17:25,【中国石油大学（华东）孟庆伟副教授：含高比例风电的远海油气平台群孤网多智能体协同调频】孟庆伟，博士，中国石油大学（华东）副教授，硕导。主持各级各类项目20余项，参与项目20余项。发表论文30余篇，其中SCI/EI检索20篇；申请专利17项，已授权10项。获得各级各类奖项4项。研究方向为新能源电力系统的多智能体（源网荷储）协同调控、性能评价；电压暂降；海上平台电力系统；石油石化电力系统；电力设备的状态监测、评估、预警。网页链接,0,0,0,天津,,天津,中国
24,5022058086140682,LightScienceApplications,2024-04-11 19:36:56,来自清华大学精密仪器系杨原牧副教授研究团队在Light: Science &amp; Applications上发表论文，提出了一种基于超构表面阵列的微型化快照式光谱椭偏仪。该系统利用硅基超构表面阵列将待测薄膜反射光的偏振和光谱信息进行编码，随后根据CMOS传感器采集到的光强信号，通过凸优化算法对偏振光谱信息进行解码，可以高保真地重建薄膜反射光的全斯托克斯偏振光谱，并进一步基于薄膜的物理模型，拟合得到薄膜厚度和折射率。该方案可以显著简化现有光谱椭偏仪系统，并实现快照式薄膜参数测量。网页链接,1,0,33,,长春,吉林,中国
24,5022229936734872,Lee69112,2024-04-12 06:59:48,推荐百万读书+流量慈悲+不戴眼镜+民间护眼+胡向明，国际视觉环境专家，中国发明协会会员，爽目科技（北京）有限公司视觉环境总顾问，德国品牌应用科技大学视觉环境客座教授，广西儿童青少年近视防控技术指导中心视觉环境总顾问。在《光子学报》《环球时报》《光明日报》等期刊、媒体上发表论文和作品多篇。是国际上最早系统提出视觉环境的定义、分类和解决方案的人；也是最早提出从改善视觉环境入手做好近视防控工作的人,0,0,0,北京,,北京,中国
24,5022167491936738,你派姐心情美丽不了一点,2024-04-12 02:51:40,很不幸，又失眠了。所以说，头发怎么会不出走？脸怎么会不烂？姨妈怎么会不痛？黑眼圈怎么会散？多囊又怎么会好呢？早上和老板剑拔弩张了，面对老板这样不就事论事，深陷知识的诅咒和自恋圈套里动不动教育你两句的人，趁着激素的分泌，直接把我炸了。感觉自己的结节又得到了滋养更要命的是，晚上师兄来找我商量，说实验得做。我直接“寿命”延长半年于是我思考着：那需要全国到处找人借的样品（不知得等到何时才能凑齐，还得保质保量），一些颈椎麻痹的解剖动作，还有那从未接触过的实验，身后一些综述、数据分析任务，遥遥无期的“出站快乐日”，同期人按期完成的硕果……一直到现在，我还在床上滚来滚去，不知道怎么才能找到能让我停止思考的最佳姿势。我一直不想做一个被情绪左右的人，我有一个师妹，脾气好，情绪极其稳定，但凡能有这点功力，俺也不会一年多老了快五岁，哪哪都有点毛病，尤其觉得自己心理承受逐日快要到达极限了……我真的思考过我所执着的到底为何？可是我想不明白，现在的事真的是我应该一辈子做下去的吗？我还有别的可能吗？难道这科研是非做不可吗？我到底在追求什么？？？狠狠迷茫了#论文发表##压力过大衰老速度比常人快6倍##失眠##科研#,0,3,1,浙江,杭州,浙江,中国
24,5022160290055462,是马不是人,2024-04-12 02:23:03,#一个很神奇的梦做了一个很玄的梦。梦的开头，一个老师发表了一篇论文，大概是证明了一个物理学新的定理，起初我没看懂。然后梦的中间，夹杂着七七八八各种事情，跟这篇论文毫无关系。然而，来到了梦的最后，神奇的事情来了：我突然出现在了一间小教室，开头的那个老师在黑板上给我演算着这个定理的推导，讲完后我就醒了。在梦里似乎恍然大悟，可是醒来后连定理都记不住，模模糊糊只记得跟物理学和数学相关。——后记：神奇的不在于梦里出现了一个未知的定理，而在于这个梦是一个故事的闭环，但故事的中间和开头结尾毫无逻辑联系，如何形成闭环是一件匪夷所思的事情。这不得不让人思考，梦到底是怎样的存在。,0,0,0,法国,,法国,法国
24,5022124452611668,量子位,2024-04-12 00:00:39,阿里巴巴高级算法专家，通义千问开源负责人林俊旸 确认参与 #中国AIGC产业峰会# ！🔥林俊旸，阿里巴巴高级算法专家，目前为通义千问开源负责人。他的研究领域包括自然语言处理和多模态表示学习，研究兴趣集中于大规模多模态预训练，在NeurIPS、ICML、ACL等多个顶级会议发表多篇论文，Google Scholar引用量4000+。近期工作为研发通义千问大模型（Qwen），包括大规模预训练和对齐，并推动大模型与多模态及外部系统的集合，同时负责通义千问系列模型的开源。此外，他曾参与打造超大规模预训练模型系列M6、通用统一多模态预训练模型OFA、中文预训练模型Chinese CLIP等。⏰ 时间｜2024年4月17日🏨 地点｜中国·北京金茂万丽酒店邀您共同见证生成式AI的应用新时代！欢迎扫码报名参会&amp;预约直播 🙌,3,1,18,,北京,北京,中国
24,5022141770630546,好啊-自由的奶昔yu,2024-04-12 01:09:28,#才知道医学生不用学毕业论文#其他专业的本科都必须写毕业论文？需要发表的那种吗？ ,0,0,0,广西,柳州,广西,中国
24,5022140602256664,高守芳,2024-04-12 01:04:49,唉，第一次磕cp，就这样突然被戒断了，有些不悦，但也瞬间被拉回现实。真真假假的世界，做好自己，努力的人，总会发光，我喜欢的颖宝，你是最棒的，我一直在做一个像你一样坚强、努力、认真的人。希望我的论文能顺利发表，希望今天孩子身体检查，一切安好，感恩🙏🙏@赵丽颖 @林更新 喜欢你的角色，宇文玥和神君,0,0,1,天津,,天津,中国
24,5022134117597722,Daryller,2024-04-12 00:39:02,论文终于发表咯！开心✌️😇😇 广州·广东工业大学 ,0,0,0,广东,广州,广东,中国
24,5022133111752817,对扬弃的扬弃所作的扬弃,2024-04-12 00:35:03,第一篇发表的论文有了1次引用 开心 ,0,3,2,江苏,南京,江苏,中国
25,5022131261281126,-17的理想,2024-04-12 00:27:42,#才知道医学生不用学毕业论文# 虽然毕业论文省了，但是以后可是要每天不断写处方和医嘱的，而且也要定期发表论文 ,0,0,47,广东,阳江,广东,中国
25,5022128720055393,烂就完事了_发疯版,2024-04-12 00:17:36,我焯，论文因为要发表了，老师问我信息，让我按照模板填我直接一个复制粘贴......因为学校名字像...直接重生之我是985 ,0,0,1,吉林,长春,吉林,中国
25,5022124632970116,噜啦啦噜啦啦鲁拉鲁拉,2024-04-12 00:01:22,小论文早日发表录用@锦鲤大王 ,0,0,1,福建,厦门,福建,中国
25,5022122525331188,kkkaewbqjw,2024-04-11 23:52:59,记生活中的一件小事16:   我经常脾气不好发脾气，每次发脾气或者情绪不好的时候，男朋友就各种心理疏导加讲道理。   听着听着我就跑神了，因为我感觉他每次都对着我发表了一篇论文，听不进听不进 ,0,1,1,河南,焦作,河南,中国
25,5022121040545044,Lesleyydsapiosexualucky,2024-04-11 23:47:05,红头文件get 论文发表+1  全渠道视奸我的人有福了，天呐，你们怎么知道我又发论文喇 ,0,0,1,广东,广州,广东,中国
25,5022119731923569,早立一苇渡之江,2024-04-11 23:41:53,我tm要下载自己发表的论文居然还要求助！ 这鬼世道 ,0,0,0,上海,上海,上海,中国
25,5022109931672460,食堂饭好难吃_,2024-04-11 23:02:57,发现本科参与发表的一篇论文影响因子一路飙升，最高的时候到了19，现在也有13。好震撼，明明几年前才6左右。 ,0,0,0,英国,,英国,英国
25,5022100635785917,芋头宝石_加咸蛋黄,2024-04-11 22:26:00,我就不信 我写不出论文 明天开始写 后天就发表 ,0,2,0,江苏,连云港,江苏,中国
25,5022096838885484,论文发表服务杨编辑,2024-04-11 22:10:54,教育全科   可思政   好过稿 《人生与伴侣》知网 ，稳妥安排 #论文发表# ,0,0,0,江西,南昌,江西,中国
25,5022095098250182,论文发表服务杨编辑,2024-04-11 22:04:00,可全包100%包录《中国高新科技》国家级半月刊，知网、万方、维普、龙源等多家数据库同步收录，3版5400字符起发含英摘(有图表相应减)，审稿3-5个工作日。收科技成果、理论探索、人工智能、研发设计、技术创新、电子信息、土木交通（建筑交通）、工程技术、电力电气（水利水电）、能源环境（生态环保）相关优质稿件，可刊登封面人物、大量征收宣传软文(最快可次月出刊)等。刊期：24年年内版面。#论文发表#,0,0,0,江西,南昌,江西,中国
26,5022094892469255,玉溪善者,2024-04-11 22:03:11,相关论文近日已发表在美国《科学》杂志上。研究人员表示，这项成果为研究阿尔茨海默病、血管性痴呆等与大脑缺氧相关的一系列神经系统疾病打开一扇大门，有助于理解久坐不动的生活方式、衰老、高血压等因素如何导致这些疾病。研究发现运动可显著减轻大脑缺氧负担 ,0,0,0,浙江,温州,浙江,中国
26,5022093720684960,诶哟干嘛啦,2024-04-11 21:58:32,同样一句话，怎么硕士论文里就是对的能发表，我写出来就是有语法错误呢，一模一样的话啊 ,0,0,0,北京,,北京,中国
26,5022093315675167,宇宙菠萝堡,2024-04-11 21:56:55,累了 真的累了 在椅子上做了一天 看了几个论文 发了几个邮件 发表一点没干 ,0,2,0,日本,,日本,日本
26,5022084908716697,沐凡祝你笑死,2024-04-11 21:23:31,一个周的时间除了考试还多了三篇论文一个发表老师要不你们还是考试吧我乱写 ,0,1,2,浙江,杭州,浙江,中国
26,5022080286590069,大眼邓小眼_cherry,2024-04-11 21:05:09,为什么我毕业论文使用了自己发表的小论文属于抄袭？降重降到发疯  焦作·河南理工大学 ,0,5,4,河南,焦作,河南,中国
26,5022078267556470,sleepy_girl,2024-04-11 20:57:07,#小乖兽# 小乖同学自己写的第一篇论文，可惜找不到地方发表，只好发在我的微博上。 他想在数学界一鸣惊人，希望这是一个开始 ,0,2,1,北京,北京,北京,中国
26,5021992810185651,化石网,2024-04-11 15:17:33,"#古生物学中的人工智能# 近期，由@古脊椎动物与古人类研究所 、@成都理工大学 及英国、美国古生物学家等合作完成的论文“Artificial intelligence in paleontology(古生物学中的人工智能)”发表在地球科学领域综合期刊《地球科学评论》（Earth-Science Reviews）。研究团队全景式地回顾了过去半个世纪人工智能技术在古生物学领域的发展,并且对当下和未来的人工智能古生物学研究作出了展望,这也是领域内首个综述性研究。P1古生物人工智能研究主要事件(橙色)与部分人工智能重要算法与数据集(蓝色)时间线P2人工智能古生物学研究使用的输入数据类型、算法、任务、生物类群P3人工智能古生物学数据集(蓝色)与主流人工智能数据集(橙色)大小对比P4 两例“数据驱动”的哺乳动物古生物学研究P5两例基于生成式人工智能的恐龙复原图#古生物##人工智能##化石##科普# 南京·中国科学院南京地质古生物研究所",9,2,11,江苏,南京,江苏,中国
26,5022074240240496,淼嗷呜,2024-04-11 20:41:07,sci期刊-工业工程  一本期刊对文章质量的要求都是不一样的。工程类对文章要求就是全部为研究性文章，数据可以去实验室做，这个准备时间就需要规划好，实验也是一个很长周期的事情  #sci期刊##工业工程##学术期刊论文发表##论文##工业工程与管理# ,0,0,0,江苏,南京,江苏,中国
26,5022069119780169,发财不会胖,2024-04-11 20:20:46,倒霉蛋  作业都轮到我我还忘了  我恨一切发表和论文 ,0,1,2,吉林,延边朝鲜族自治州,吉林,中国
27,5022060591710784,打死你我也不活了,2024-04-11 19:46:53,嗨嗨嗨三年前发表的论文我现在看不懂了 ,0,2,1,辽宁,大连,辽宁,中国
27,5022058973496534,海德小徐15373611726,2024-04-11 19:40:27,近期会发表一批职称论文及专利，没有发资料的，还在犹豫的，抓紧机会抓紧时间，24年职称进度过半，还在纠结的你即将迎来25年批次[捂脸] ,0,1,0,河北,秦皇岛,河北,中国
27,5022054292391332,从泥土到星辰,2024-04-11 19:21:51,一周两个小论文两个发表 怎么不直接弄死我呢 ,0,2,2,韩国,,韩国,韩国
27,5022053885282105,猴子瘦身记,2024-04-11 19:20:14,"MIND饮食模式抗衰又抗痴呆！      近日，美国学者在Annals of Neurology杂志上发表论文，称他们研究发现，坚持MIND饮食与痴呆症患病风险和死亡率的降低有关。     作者表明，健康饮食能够减缓衰老对人体的影响，包括对大脑的影响。   该研究题为“Diet, Pace of Biological Aging, and Risk of Dementia in the Framingham Heart Study”。      MIND饮食以地中海和DASH饮食为基础，强调植物性食物、鱼类和家禽，几乎不含饱和脂肪和糖。目前，多项研究报道，MIND饮食能够预防痴呆症、增强脑力。",0,7,8,广西,崇左,广西,中国
27,5022045061251165,期刊论文发表-邓编辑,2024-04-11 18:45:09,《智慧少年》 万方，24年6月版面，17-18期 3版5000字，收高中，初中，小学，幼儿园，教育教学文章 7月出刊 #论文##评职称##老师##教育##期刊发表# ,0,0,0,江西,南昌,江西,中国
27,5022033958666883,花锁少年梦,2024-04-11 18:01:03,病毒这个论据哥用俩小时推论出来，这个确实慢，毕竟哥专攻物理，无学术意义的争论实在对不起自己，重点是如何发表一篇论文 ,0,0,0,吉林,吉林市,吉林,中国
