页码,微博id,微博作者,发布时间,微博内容,转发数,评论数,点赞数,发布于,ip属地_城市,ip属地_省份,ip属地_国家
36,5020478261692401,ZhuHannan,2024-04-07 10:59:16,从0到1的原始基础创新技术和理论，其背景技术来自于马德堡半球实验与托里拆利实验，将其静态实验改进为动态实验，从实验技术中延伸出来三个实际应用发明，《动态真空半球实验》《飞行器动力设计方案》《一种可悬浮军商两用飞行器动力设计方案》，这项原始创新技术可应用到各个领域，望有兴趣者共同探索解密，接下来我会将其技术逐步解密，希望大家喜欢。中国航天科技集团 ZhuHannan的微博视频,0,0,0,江苏,泰州,江苏,中国
36,5020472275898337,弗兰奇不可思议,2024-04-07 10:35:29,前天测序样品放学校门口，师傅来取的时候丢了。 昨天另一批测序结果出来，兴冲冲打开越比对越不对原来测错了，要重新设计引物重新p。 今天早上被中科院老师叫去学实验，人都在地铁上了说细胞没长好下午做，我下午有事于是原地回去。 最近这么倒霉一定会在别的地方补给我吧！！ ,0,0,0,上海,,上海,中国
36,5020467498584906,七上公子,2024-04-07 10:16:30,去年的我：哎呀大四下半年应该会很闲吧，都没课了，毕业设计做完就好了，然后买了一堆衣服等着出去玩。实际上：复试完之后实验实验实验实验，早八晚十一，我说真的够了 ,0,2,1,江苏,镇江,江苏,中国
36,5020462323337235,Lacan和Zizek百年好合,2024-04-07 09:55:56,到底是谁设计的这个一点引导也没有的搓飞机大战的实验…… 我不会啊！我不会啊！ 会者不难？难者不会！ 你校是佛学院的又一力证：授业全靠弟子开悟，课堂belike讲法布道。这下哈佛了。 一想到之后还要搓CPU……估计又是什么都不教直接让开写…… ,0,0,0,广东,深圳,广东,中国
36,5020457793226841,六加一lll,2024-04-07 09:37:56,一想到要设计实验看文献写综述我就轻轻的碎掉了，老师能不能帮我设计实验啊！！！ ,0,2,4,福建,厦门,福建,中国
36,5020450854013533,今日闵行,2024-04-07 09:10:22,【打造生物界的“ChatGPT”！闵行这家企业成全国之最】 #闵行要闻#  走进剑川路955号云境未来大楼9楼上海天鹜科技有限公司（以下简称“天鹜科技”），与想象中“生物设计在实验室里完成”不同，你会发现在这家提供蛋白质设计服务的企业里，大多数员工都在座位上“敲代码”。而这一切的起因，都要从天鹜科技自主研发的AI蛋白质设计大模型AccelProtein™说起。 打造生物界的“ChatGPT”！闵行这家企业成全国之最,106,0,1,,上海,上海,中国
36,5020450382676738,FFFairyyy,2024-04-07 09:08:29,#虚拟仿真实验#就他妈蠢蠢傻🦅一个 难以想象多智障的人能弄出这么个b东西 测试成绩答题都不看 就nm看实验过程 实验过程md还不能中途提交 提交诶 后面的就没分 真nm会设计 🐮🐮 ,0,0,0,江苏,南京,江苏,中国
36,5020449245497433,刘超Orz,2024-04-07 09:03:58,AITO问界#赛力斯汽车##AITO问界# 赛力斯汽车研发团队精研相关技术，通过长期研究和严格实验后，打造出专属于AITO问界M9零重力座椅的舒适乘坐体验。利用零压感知人体工学专利设计，将对座椅的压强均匀分布到背部、臀部、腿部，营造漂浮于太空的轻松感。 ,0,1,2,重庆,,重庆,中国
37,5020253040152379,ibuick,2024-04-06 20:04:19,一边哭着喊着要电吸门，要自动尾门 一边想尽办法用胡萝卜火腿肠鸡爪子小孩手去做防夹实验是你的手金贵？还是你怕夹到🐔儿？还是你你的纤纤玉指跟个鸡爪子一样？那东西的防夹都是针对头，躯干等较大物体设计，不是针对鸡零狗碎。要是那样的话，这些门子天天你都关不上，永远关不上。实在不行就别再折磨自己了，买个普通门子，普通尾门的车不行吗？省钱减重还不会被夹，死不死啊 #别不正经说车##大v聊车##小米su7#,2,34,108,北京,,北京,中国
37,5020353101562004,Whist_,2024-04-07 02:41:56,这周的工作任务是看看文献冲冲麦片 做做图设计一下实验 染一个色 然后欢度周末 我是最棒的小宝宝我一定能行 ,0,1,3,吉林,长春,吉林,中国
37,5020330370271311,DKL顶宜针织实验室,2024-04-07 01:11:36,艺术灵感🧬Katie Truk迷人的张力Katie Truk，来自美国新泽西的多媒体艺术家，以其色彩斑斓、迷人的三维作品而闻名。她运用连裤袜、金属丝与针线，创造出独特的艺术装置🧬她的作品融合了丝袜的柔软和铁丝的坚硬。Katie Truk指出，这些线条交织着攻击性和脆弱性，正如生活的曲折与我们所面临的严格规范和期望🧬“当你深入探究，我的作品其实关乎张力和几何，” Katie Truk说道，“这不正是世界存在的根本吗？”#顶宜针织实验室##流行趋势##针织设计##艺术#,0,0,0,云南,德宏傣族景颇族自治州,云南,中国
37,5020327899824529,鬼泽Xavier,2024-04-07 01:01:47,我完全悟了，关于这个人为什么一直在纠结灵魂与躯体的问题，并在中途走向了灵魂与容器的岔路 目前没想明白这个“你爱灵魂”细节在哪里。于是展开了很多实验！有很多对照组！而且有一部分存在正交反交！好！于是我在实验设计一栏写下了平行世界与转世轮回等模板字眼，看看无限流伙计 ,0,0,0,湖北,武汉,湖北,中国
37,5020326183832732,豌豆白菜,2024-04-07 00:54:58,今天忽然冒出一种想法，猛禽龙是“改造”而来，这个改造用D朝初期的玩具设计思路来看，实施改造的主语其实指不定就是驯兽师？因为和人接触才有可能被改造，或者说，因为和人接触才有可能进化成改造型？改造本身的利弊先不谈，但改造时可能也去掉了被官方文本称为“残酷实验”时使用的旧式接口（毕竟图鉴没提接口），考虑到通过接口乱改核的结果通常都是兽暴毙，指不定对猛禽龙来说这个改造还多少有点好处？所以之后也是因为长期和人接触才进化成了人形的等级-&gt;阿尔法？另外摆X也一直在强调X-level越高越人工同时攻击也越强（相对的X-level越低越野性攻击也越弱），从这方面来看，作为二代目隐藏进化且进化条件更高的猛禽龙线在设计初衷上应该是比多路加线更强，所以理论上也应该是X-level更高=更人工？（虽然最后要进化究极体X-level都得是人工级别（海龙和锹形虫除外）,0,2,2,四川,成都,四川,中国
37,5020325735563603,愚空杯,2024-04-07 00:53:11,在众多奢华酒店中，嘉佩乐用短短十几年，成就了奢华酒店的传奇。这个由前丽思卡尔顿掌舵者Horst Schulze退休后创立的奢华酒店品牌，承载着Horst 对奢华的探索和实验。嘉佩乐专注于雕琢规模在100间客房以内，借助高超的建筑和设计技法反映当地的历史、人文和地貌，吸引并呵护最久经世故的宾客的杰作酒店。三亚嘉佩乐，一开业就占据了三亚顶奢酒店Top级的位置，酒店由堪称“当今世间最贵酒店设计师”的Jean-Michel Gathy与鬼才园林设计师Bill Bensley联袂操刀设计。,0,1,0,广东,汕头,广东,中国
37,5020317162670321,-Popolee-,2024-04-07 00:19:07,清明节最大的成就就是设计了两个课题的下一步实验 ,0,0,2,湖南,长沙,湖南,中国
37,5020311470737841,苏丁烷,2024-04-06 23:56:30,我本人是稍微有点焦虑症闲下来就会难受，从某种意义上适合当牛马，但是设计实验还是算了吧我要神经衰弱了 ,0,0,1,江苏,徐州,江苏,中国
37,5020310246785349,苏丁烷,2024-04-06 23:51:38,终于完成了我们这个实验设计我草 ,0,0,1,江苏,徐州,江苏,中国
37,5020089135400090,配方师Rex,2024-04-06 09:13:01,还以为菜鸟配方师挂了，没想到依然有新品~~#美丽觉醒计划##护肤实验室#  还是水油分离的设计，但这个紫色怪好看的里面东西也不少，各种多肽，二裂酵母，抗氧化的麦角硫因、vc，植物油脂等很多，挺适合这个季节全面修护，都不用面霜了 ,8,112,128,上海,上海,上海,中国
38,5020305209428301,电化你的生活,2024-04-06 23:31:37,FABASSTONE(FR) 法国著名DUB乐队High Tone 的贝斯手，自 1998 年以来，他作为法国低音的先驱，向世界敞开了他实验室的大门。他的宇宙：一个充满力量、黑暗、神秘的配音，一种精心设计的深度恍惚，对于任何优秀的音响系统舞池来说，旋律线都非常有效。 电化你的生活的微博视频 ,0,0,0,四川,成都,四川,中国
38,5020294048389084,奇迹教徒,2024-04-06 22:47:16,其实关P上过一成四以及他想探讨的主题的设计起点是看到了当时10岁男孩上大学的新闻，我那时候搜了一下看完履历还想了挺多的，这次指不定能实验一下看看 ,0,0,1,北京,,北京,中国
38,5020290737767952,狗仔魅影,2024-04-06 22:34:07,这一定是我遇到过最傻叉的作业 上课跟着PPT进行一顿操作，反过来让我设计一个实验进行QTL定位，举一反三也不是这样用的叭 ,0,0,2,湖北,武汉,湖北,中国
38,5020277398573641,感觉牙疼,2024-04-06 21:41:07,小姐姐设计了好久的实验、、 刚刚发现有违伦理。。。 孩子 你无敌了 ,0,1,0,新加坡,,新加坡,新加坡
38,5020260333783702,Lisa陈姐,2024-04-06 20:33:18,技术发展和创新3月份，工程地质研究所开展实验50组300次。完成了一项又一项的压裂液体实验以及地层储层物性实验。实验室是技术发展和创新的重要基石。通过实验室的研究和测试，新的技术和产品得以开发和改进。实验室为工程师和研发团队提供了一个探索新概念、设计新产品和解决技术难题的场所。实验室的设备和资源使得技术创新成为可能，从而推动社会和经济的发展。,0,0,0,河北,沧州,河北,中国
38,5020245526053639,头号玩家super,2024-04-06 19:34:28,这个月对我来说是比较重要的一个月，也是压力巨大的一个月 1.指南项目立项论证 2.博士面试 3.实验室中期检查采购申请 4.3000万项目外协 5.技术方案评审工程设计评审 6.标准研编北京协助工作 7.论文发表 8.审计巡视 9.小孩生病 男人到了中年，真的能依靠的只有自己，但愿自己能咬牙坚持！ ,0,1,1,陕西,西安,陕西,中国
38,5020237840518886,寻兔1005,2024-04-06 19:03:55,感觉熬夜熬的要猝死了假期过完了，论文没写，调查报告也没写，网页设计实验也没做太荒废了 ,1,0,0,广东,广州,广东,中国
38,5020225187875407,Coms暑,2024-04-06 18:13:39,这个代码…这个破图…这个破实验设计… 救 ,0,0,0,广东,深圳,广东,中国
39,5020207965800853,袋鼠138168,2024-04-06 17:05:13,企鹅🐧公司Ai工具  腾讯会议AI小助手：帮我高效开会 TME Studio：AI音乐生成工具 智能设计平台：提供特有的AI创意创作功能 腾讯智影AI数字人直播 ACR实验室：AI图片处理工具 腾讯文档智能助手：AI文档生成和辅助工具 帮小忙：在线工具箱平台 ,0,0,0,海南,海口,海南,中国
39,5020193498338659,科研民工在发疯,2024-04-06 16:07:43,师姐喊我设计实验 我:啊，我? 师姐:嗯，对，等会给我讲该怎么做 我:我试试  试个毛啊，我真不会能不能在讲之前地球爆炸 我现在还不会举一反三啊喂  不，我试试，毕竟还是得有自己的思路 ,0,0,1,海南,海口,海南,中国
39,5020165163188289,中医徐雯,2024-04-06 14:15:07,麻烦在于，我们的看法多半来自无数弥散细弱的线索，无论挑选出哪些作为理据，都显得不够有力。于是，在需要提供证据的时候，我们多半并不是从自己的经验中析取事实，而是去搜集、寻找、发现那些更鲜明，地支持结论的事实。如果有必要，我们还去设计实验，专门生产事实。——《价值的理由》关于中医界过度崇拜、大神过度标榜，这段描写很贴切。一方面，事实仿佛不再蕴涵道理；另一方面，理论本身成为一个独立的系统，仿佛无论事实是什么样子理论本身都成立。某些门派过激行为。,0,0,1,江苏,苏州,江苏,中国
39,5020123246890371,小鬼头睿睿,2024-04-06 11:28:34,清明假期过的是很满足的，写了互联网+的项目书，做了实验设计的答辩ppt，进行了transwell的数量分析，还把细生作业在玩的路上写完了满足又充实！毫不拖延～还有～每天都传四盘细胞～搁两天一去鼓房练鼓～几乎天天就去健身房跳操～（最近清明老师放假）～还有还有今天中午去刷我的小电动车，买了个上门服务洗衣券，把羽绒服洗了之后收着下个冬天穿～时间管理max！加油加油～卖破烂看到奇形怪状小羊羔～健康河进水啦～白嫖的腾格尔小贴纸！好啊好啊～好灿烂啊啊啊啊拜托还有我亲爱的老刘呜呜呜我的心灵寄托！支柱！大大大后盾（啵唧啵唧）,0,1,6,山东,,山东,中国
39,5019934864966906,凤凰周刊,2024-04-05 23:00:00,【#王赣骏寄语年轻人#：现在是你们的黄金时代，要遵循兴趣选择事业】1985年，王赣骏登上了美国“挑战者”号飞船，进行了7天的航天飞行，成为实现华人飞天梦想的第一人，也是第一个在太空完成了他自己设计的物理实验的科学家。在“世界因你而美丽——2011-2012影响世界华人盛典”上，王赣骏获得终身成就奖。他在盛典现场寄语年轻人：现在是你们的黄金时代，中国是个大国，需要各式各样的人才，给了你们很多机会发展自己的才能。希望你们在选择事业的时候依照自己的兴趣，这样才可以全心全意地努力，遇到困难和失败的才不会放弃。#世界因你而美丽##2023-2024影响世界华人盛典# 凤凰卫视的微博视频,3,12,12,,青岛,山东,中国
39,5020070759106940,酷盖去海邊,2024-04-06 08:00:00,0800#c语言程序设计# C语言是一种较早的程序设计语言，诞生于1972年的贝尔实验室。1972 年，Dennis Ritchie 设计了C语言，它继承了B语言的许多思想，并加入了数据类型的概念及其他特性。 尽管C 语言是与 UNIX 操作系统一起被开发出来的，但它不只支持UNIX。C是一种通用（广泛可用）的编程语言。程序设计语言实与编译器是一体的，C编译器有著名的GCC（GNU Compiler Collection）等。,0,2,1,重庆,,重庆,中国
39,5020048178282718,苏州陶小姐,2024-04-06 06:30:16,好消息来了，我国首台大功率氢能源动力调车机车首次完成万吨装车试验！这辆机车以“氢燃料电池+锂电动力电池”为动力，设计时速100公里，最大功率可达2400千瓦，最大起动牵引力560千牛，平直道可牵引载重10000吨，4‰坡道可牵引载重5000吨。本次实验中，机车牵引105辆C80车辆恒速走行2公里，这也标志着，我国重载铁路大功率氢能源动力装备的市场化运用，取得关键性突破。四个字，可喜可贺！,0,1,106,广东,东莞,广东,中国
39,5020024627003815,-归栀-,2024-04-06 04:56:41,我震惊了 我第一次考这种形式的考试 现场设计实验然后做然后写report 还有一堆short answer ,0,2,0,加拿大,,加拿大,加拿大
39,5019980507383150,褐色的阭睛,2024-04-06 02:01:22,【似非而是梅赛德斯奔驰C111概念车】C111是梅赛德斯奔驰在60年代到70年代生产的一批实验性的车型，用于研发新型转子发动机、柴油发动机以及涡轮增压发动机。同时还采用了新型剪刀门等创新设计。 ,0,0,0,广西,,广西,中国
40,5019960127258877,吾主在此_,2024-04-06 00:40:22,我草啊，我本来从工科跨专业来学艺术类的设计学就是不想再搞工科，最后为了写b论文又哭着开始学算法实验模型 头好痒，要长脑子了 ,0,4,4,甘肃,兰州,甘肃,中国
40,5019941616749313,Jeol-bans,2024-04-05 23:26:50,啊啊啊，我就请假三天是什么很重的罪吗，怎么那么多作业啊！做两个讲课用的ppt，拍一个视频作业，还有实验报告，电影分析，设计构成，大学英语…数不清了 ,0,2,1,山东,临沂,山东,中国
40,5019925014120794,鲁网淄博,2024-04-05 22:20:52,《淄博市淄川区实验幼儿园开展“忙趁东风绘纸鸢”活动 - 鲁网·淄博》4月2日，淄博市淄川区实验幼儿园开展“忙趁东风绘纸鸢”活动，让孩子们设计出自己的纸鸢，并趁着假期感受放风筝的愉悦之情，促进孩子们对于大自然的热爱。淄博市淄川区实验幼儿园开展“忙趁东风绘纸鸢”活动 ,0,0,0,,青岛,山东,中国
40,5019917099467750,江戶川春山,2024-04-05 21:49:25,一天在实验室做实验 晚上博士师兄又和我说前面实验设计存在问题 又得先补两组再看 太考验一个好心态了 ,0,0,2,湖南,长沙,湖南,中国
40,5019914899822279,Cx330看山不喜,2024-04-05 21:40:40,求助，分析不下去了 实验设计部分 ,0,0,0,四川,南充,四川,中国
40,5019912433047771,好小一只狄,2024-04-05 21:30:52,昨天狂补一天数据分析知识今天又花了一整天终于把实验设计的论文肝完了利用我强大的文献检索能力时不时借鉴文献让整篇论文有一种屎盆子镶金边的荒诞感外行人看起来可能觉得十分高级懂的人一眼就看出我的论文如红楼梦所述一般满纸荒唐言本来还准备将下面这种分析摘要变成文字凑字数的，没想到最后还超了2k5字没错，我就是一个高产出的屎壳郎,0,7,2,湖北,咸宁,湖北,中国
40,5019911069368624,709号信封,2024-04-05 21:25:26,不想做 PPT 了 不想看论文 不想写实验设计 不想做数据分析 不想重编量表 啊啊啊啊啊啊啊啊啊啊啊啊啊 鲨了我吧要不 ,0,0,0,天津,天津,天津,中国
40,5019889565961921,LOGO大师,2024-04-05 20:00:00,#版式设计# #原创设计# 设计师永尾仁的字体设计实验作品 ,3,0,7,广东,广州,广东,中国
40,5019887512847849,L01518,2024-04-05 19:51:51,《我儿子喜欢做实验》  实验员告诉你 做实验并不好玩 试剂都是骷髅头的剧毒物 博士是不会设计实验瞎JB指挥的 大多都是无用功 跟做饭一样是要洗碗的 而且洗瓶子又毒又难洗 重复性很高的操作工 可替代性极其强  做屁实验啊 博士怎么不来自己做  别学化学听话啊 ,0,0,0,上海,上海,上海,中国
41,5019874872527035,某人的study碎碎念,2024-04-05 19:01:37,啊啊啊啊啊啊啊作业好多做不完的作业，下周又要写阅读笔记了，我这周的实验报告还没写，上周的实验报告也还没改呢，游戏设计也得改，这都清明节之后了，又该准备四级二战了啊啊啊啊啊 ,0,0,0,山东,济南,山东,中国
41,5019855440318004,椰椰树花张欢生,2024-04-05 17:44:24,实验室放九楼-80冰箱放八楼还恒温26℃到底是哪个大聪明设计的，划46个平板跑了二十趟折返跑 ,0,0,0,陕西,西安,陕西,中国
41,5019852188421123,婲-样旳女子s,2024-04-05 17:31:29,来自俄罗斯的自由插画家，图形设计师AboutYuliaBrodskaya非常热爱纸艺创作，不断钻研及实验卷纸艺术，擅长用纸条卷出各种惊为天人的构图！ ,0,0,0,广西,,广西,中国
41,5019830871132533,重庆小杨坤,2024-04-05 16:06:46,自己设计的实验，cell早就发过了，人家论文里都差不多论证过了，虽然我这个点不是重点，还是太年轻了 洛阳·郑州大学附属洛阳中心医院 ,0,0,1,河南,洛阳,河南,中国
41,5019827833934019,SKYline天线老师,2024-04-05 15:54:42,【天线吉他实验室】真香！让人着迷的P90，带你认识与体验传奇吉他拾音器设计今天想和大家来聊聊我最近沉迷的吉他拾音器P90，作为非常原始和早期的一种是引起设计，P90拥有非常强的魅力但是很多朋友却对其不够了解。希望这个视频可以帮助大家更好的了解这种拾音器的发展历史，音色特点和使用上的注意事项。电吉他#吉他##发烧吉他##电吉他##fender##gibson##p90##拾音器# SKYline天线老师的微博视频,0,1,2,上海,上海,上海,中国
41,5019824533277497,用户7765827357,2024-04-05 15:41:35,以前看一眼电影。。。就那拉斯大陆那个。。。那大盔甲大武器。。。明显完全不合常理。。。。 后来又看了一眼漫威的。。。那随便一个实验撞点啥那冲击力都明显能把一个人kill了。。。绝对救不活。。。一集里正常保底得kill10回。。还没算各种明显不合逻辑的设计。。 ,0,0,0,吉林,长春,吉林,中国
41,5019822635090078,延罗王软小七爱喝银耳汤_,2024-04-05 15:34:02,#梅西赛后与对手教练组起冲突# 我知道你们这些收了郭广昌公关费的媒体都真瘠薄能编 但是偷金球亖儿砸，这是由著名理论足球学家皇马小吧主提出的一个著名猜想，由著名实验足球学家克里斯蒂亚诺·罗纳德·多斯·桑托斯·阿维罗先生设计的实验证实，最终该项研究帮助两位分享了2022年度的诺贝尔神学奖，里贝里为两位科学家颁发了奖励证书,0,1,2,河北,廊坊,河北,中国
41,5019799331537773,扁扁要打气,2024-04-05 14:01:27,突然想起来周一要交实验设计 ,0,0,0,四川,成都,四川,中国
41,5019781707335774,一定会有猫猫的_,2024-04-05 12:51:25,怪只怪自己复试方向错了 初试开局也不差，复试完落得这个下场我可真是倒霉啊 一个月的实验设计像是个笑话 还有我那阅读的二三十篇文献 也真真是是个笑话 ,0,0,0,广东,中山,广东,中国
42,5019727245609221,小鸟文学,2024-04-05 09:15:00,我们在现实世界遭受社会孤立之苦，被我们寄予厚望打破隔离的互联网，如今也日益变成充满隔阂与暴力的场所。我们把社交媒体平台的政策和内容分发算法视为罪魁祸首，考虑彻底退网的可能，但美国杜克大学社会学、政治学与公共政策教授克里斯·贝尔让我们停下来思考另一种可能。利用经过精妙设计的在线实验和深入访谈，贝尔在《打破社交媒体棱镜》一书中证明了走出回声室（信息茧房）会使我们更加极化，而不是减少极化。本书挑战了关于回声室、境外势力和激进算法的常见神话，揭示了社交媒体的功能更像是一面棱镜，它扭曲了我们的身份认同，增强了追求地位的极端派的力量，让温和派几乎隐形；而政治部落主义的解决之道，就在我们自身深处。经@潮汐-Tides 授权，我们节选了第七章《我该注销自己的账号吗？》分享给读者。📖试读免费，同步发布于“小鸟与好奇心”,6,0,19,,上海,上海,中国
42,5019778710246508,大吕之四,2024-04-05 12:39:30,我讨厌实验设计 ,0,1,2,湖北,武汉,湖北,中国
42,5019778437612838,倪-2011,2024-04-05 12:38:25,我是上海市建青实验学校的倪文韬。无锡洛社高级中学的赵晓宇这篇论文发表于2023年。我第一次上《阿Q正传》的区级公开课是2021年12月，长宁区的许多高中语文老师都来听课了，都可以做证明。而且我当时就把课堂实录发在B站上。这篇论文的整个教学思路和我的课完全一致，甚至于问题设计的措辞都没有改动。这是否是学术剽窃？？？@无锡市教育局,3,8,16,江苏,苏州,江苏,中国
