页码,微博id,微博作者,发布时间,微博内容,转发数,评论数,点赞数,发布于,ip属地_城市,ip属地_省份,ip属地_国家
36,5022337892353739,Dean_Kaye_Chon田桂成院长,2024-04-12 14:08:47,由我院#PolyUSHTM#和中山大学旅游学院联合举办的第九届中国旅游管理博士学术训练营将于2024年8月5-9日举行。为期5天的学术训练营以“通过创新研究方法和分析提升研究”为主题，欢迎所有旅游和酒店领域的博士生或博士后研究员参加。 请于2024年4月30日前报名：网页链接#理大##理大酒店及旅游业管理学院##PolyUSHTM##香港的酒店及旅游业管理学院##学术训练营 ##博士研究生##博士生##博士后研究员##研究方法#,0,0,2,中国香港,,香港,中国
36,5022335687725232,中科院之声,2024-04-12 14:00:01,有机氟化合物由于独特的理化和生物性能，在医药、农药、先进材料等领域发挥作用。含氟试剂是发展有机氟化合物合成方法的基础，也是氟化学领域发展的基石。近日，中国科学院上海有机化学研究所推出了含氟试剂数据库——FluoBase。上海有机所推出含氟试剂数据库 ,6,1,7,,,北京,中国
36,5022271483676316,寒江独钓僧,2024-04-12 09:44:54,美国国立卫生研究所对中医和中药的解释。传统中医：您需要了解的内容总结：我们对中医了解多少？传统中医的方法（如针灸、太极拳和草药产品）已成为许多临床研究和科学评论的主题。我们对中药的功效了解多少？中医是实践中使用的一些心理和/或物理方法，例如针灸和太极拳，可能有助于改善生活质量和某些疼痛状况。对用于中医治疗一系列疾病的中草药产品的研究结果好坏参半。我们对中药的安全性了解多少？一些中草药产品受到有毒化合物、重金属、农药和微生物的污染，可能产生严重的副作用。制造错误，即一种草药被错误地替换为另一种草药，也会导致严重的后果。什么是中医？中医（TCM）已经发展了数千年。中医从业者使用各种心理和/或物理方法（例如针灸和太极拳）以及草药产品来解决健康问题。科学如何评价中药的功效：针灸针灸是一种治疗师刺激身体特定穴位的技术，通常是将细针插入皮肤。研究表明，针灸会刺激人体天然止痛药的释放，并影响大脑中处理疼痛的区域。然而，一些试验表明，真正的针灸和假针灸同样有效，这表明存在安慰剂效应。然而，许多研究的结果表明，真正的针灸可能有助于缓解通常为慢性的疼痛，例如腰痛、颈部疼痛、骨关节炎/膝盖疼痛和腕管综合症。它还可能有助于减少紧张性头痛的发生频率并预防偏头痛。欲了解更多信息，请参阅我发的针灸篇。太极太极拳结合了特定的姿势、轻柔的动作、精神集中、呼吸和放松。研究结果表明，练习太极拳可以改善老年人和帕金森病患者的平衡和稳定性，减轻膝骨关节炎引起的疼痛，帮助人们应对纤维肌痛和背痛，并提高心力衰竭患者的生活质量和改善情绪。欲了解更多信息，我会在几天后翻译上传。中药材产品中草药产品已被研究用于治疗许多医学问题，包括中风、心脏病、精神障碍和呼吸道疾病（如支气管炎和普通感冒）。由于许多研究质量较差，因此无法对其有效性得出明确的结论。有关特定草药的更多信息，我会在膳食补充剂的视频里面详细说明。科学如何评价中药的安全性：对中药使用的草药产品的报告和研究发现了多种安全问题。一些中草药产品被发现受到未申报的植物或动物材料污染：比如现代药物（例如血液稀释剂华法林和非甾体类抗炎药双氯芬酸）；重金属（如砷、铅和镉）；杀虫剂或亚硫酸盐化合物，这些都可能导致哮喘或严重过敏反应，甚至于一些器官损伤。据报道，使用针灸引起的并发症相对较少。尽管如此，使用未经消毒的针头和治疗不当仍会导致并发症。如果治疗不当，针灸可能会造成严重的副作用，包括感染、器官刺穿、肺部塌陷和中枢神经系统损伤。太极拳和类似的气功技术似乎是安全的练习方式。虽然太极拳不太可能造成严重伤害，但它可能会引起轻微的疼痛。怀孕的女性在开始太极拳、气功或任何其他锻炼计划之前应该咨询她们的医疗保健提供者。NCCIH 所资助的研究：• 中医可以治疗纤维肌痛。• 针灸可以缓解乳腺癌治疗引起的关节疼痛。对于某些人群来说，太极拳项目可以成为传统心脏康复项目的可行替代方案。更多需要考虑：• 如果您正在考虑中医治疗，请务必与您的医疗保健提供者讨论。不要用中医来替代或延迟寻求传统护理。• 如果您有健康问题，请在使用中草药产品之前咨询您的医疗保健提供者。• 如果您正在怀孕或哺乳，或者正在考虑使用中医治疗孩子，请务必咨询您（或孩子）的医疗保健提供者。• 告诉您所有的医疗保健提供者您使用的任何补充或综合健康方法。让他们全面了解您为管理健康所做的工作。这将有助于确保协调和安全的护理。这就是欧美国家现在对中医和中药的认知，供参考。,126,127,450,美国,,美国,美国
36,5022331021823665,中国国土资源经济,2024-04-12 13:41:29,"永久基本农田监测体系及分区监管方法研究永久基本农田监测体系及分区监管方法研究原创 陈政宝 等 导  读文章在传统永久基本农田监测体系的基础上，探索构建了包括10个数量指标、11个质量指标、6个生态安全指标的常态化、定量化的“三位一体”监测体系，构建了动态化、数字化的识别永久基本农田不同分区的依据和原则，结合功能类型将永久基本农田划分为高、中、低三个风险等级的共9个监管区域，并提出了靶向化、差别化的分区监管策略。本文引用信息陈政宝,马明宇.永久基本农田监测体系及分区监管方法研究[J].中国国土资源经济,2024,37(3):36-42.章节目录CONTENTS0 引言1 监测体系构建2 等级分区方法3 分区监管策略4 结论与讨论",1,0,0,河北,廊坊,河北,中国
36,5022330300664225,猴子瘦身记,2024-04-12 13:38:37,瑞士研究抑制饥饿激素新方法        瑞士赛特斯生物技术公司研发人员发现，人体内存在一种饥饿激素，它是胃里产生的一种多肽，能够调节食欲、进食和能量储存等。在人体处于饥饿状态时，它能够帮助人体储存脂肪；而当食物供给充足的时候，饥饿激素的作用是相反的。因此，在人们减肥过程中，只要体重稍有下降，体内的饥饿激素水平就会上升，并且在各种减肥措施停下来以后，人体就在饥饿激素的调节下蓄积脂肪和能量，这样体重就会迅速地恢复到原来的水平。         针对这种饥饿激素，研究人员研制出了一种抗肥胖疫苗。赛特斯生物技术公司首席执行官沃尔夫冈·雷纳说，这种疫苗的作用就是要抑制饥饿激素的活动，这样人们在接受减肥疗法时，就不会担心体重反弹了。      目前，抗肥胖疫苗已经进入临床试验阶段。     但也有研究人员表示，肥胖是一个复杂的问题，要有节制地饮食，注意膳食平衡，提倡食物来源多样化，少吃含糖量高、脂肪含量高的食物。,0,0,1,广西,崇左,广西,中国
36,5022330088588249,宿醉的裤头,2024-04-12 13:37:46,田野調查與傳統社會科學的研究方法差異最大之處，在於研究者 長期性地與報導人互動並互相揣摩對方的期待、慾望、感知和想像能 力的範疇，易言之，這是一個必然具有高度感官性和變動性的交互主體歷程，而且即使必然懷抱著某些問題意識和知識背景進入田野，卻 往往難以預期研究發現，而我認為這也就是田野調查最迷人之處。我們自己的生命進程與報導人的平行並進，互動時互相交織，但也在時 空變遷的狀態下，不斷為快速變化的社會脈絡所重塑。,0,0,0,广东,广州,广东,中国
37,5022326049997574,武侯教育,2024-04-12 13:21:43,为探索校地协同育人新路径，持续推动武侯区心理健康促进项目资源建设落地落实，4月11日，四川大学艺术学院赴川大附小开展调研。四川大学艺术学院的师生们与川大附小教师团队展开了深入座谈，艺术学院的专业教师们向附小的师生们介绍了艺术治疗的基本理念和方法，并分享了艺术学院老师们的研究成果。附小的老师们分享了学校在学科领域对学生心理健康的关注，并带领艺术学院师生参观了校园，向他们详细介绍了附小的办学理念、课程设置以及艺术教育等方面的情况。未来，四川大学艺术学院与川大附小将不断加强艺术与心理教育的跨学科融合研究，为培养更多具有健康心理和艺术素养的未来人才贡献力量。,0,0,0,,成都,四川,中国
37,5022317207618339,科伦坡的幻梦,2024-04-12 12:46:35,在人文地理研究方法与交通地理学间的青藏高原之旅 ,0,0,0,广东,珠海,广东,中国
37,5022315764521387,Juliaaha,2024-04-12 12:40:51,我导非常国际化视野的广泛的研究领域以及sw老师这学期比较教育理论方法课程，让我对比较教育学科、教育全球化、教育社会学和政策社会学的归属感和理解力都强了很多。并且在本学期其他课程中再次感受到对课堂和教学设计研究的不喜欢，跨学科跨的好啊！但要想做好深入的感兴趣的研究太需要多读书多读论文了，一周一组会明显让我对研究结果产出更急切焦虑了一些，没心思认真读理论书了。,0,1,9,上海,上海,上海,中国
37,5022315301830779,超喜欢维达熊四号,2024-04-12 12:39:00,他们下注打了赌：光凭价格这一点就能告诉他们需要知道的一切。可这一回，由于售货员把“1/2”误当成了“2”，他们赌错了。而就长期而言，综合他们过去、未来整整一辈子遇到的所有情况，把赌注押在抄捷径上却可能是最为理性的方法。我们现在可以解释本章开篇研究里那令人困惑的结果了——该研究显示，给人们一杯据说能提高智力的饮料，为饮料支付费用高的人，解决的问题也更多。研究者将这一发现追溯到“贵＝好”的刻板印象上：饮料标价为1.89美元时，人们对其效果的预期高于饮料标价为0.89美元时。值得指出的是，仅仅是这种预期就能影响结果。类似现象也出现在另一项研究中，该研究让被试接受轻微电击，并在电击前为之提供止痛药。,0,0,0,四川,,四川,中国
37,5022315299471536,深柳斋,2024-04-12 12:38:59,有助揭开宇宙能量来源之谜 我国科学家提出研究快速射电暴新方法总台央视记者从中国科学院国家天文台获悉，利用中国天眼FAST的丰富数据，中国科学院国家天文台李菂研究员带领团队提出了一种全新分析构架“Pincus-Lyaponov相图”，得以量化爆发事件的随机性和混沌性，揭示了快速射电暴的时间-能量表现与地震和太阳耀斑等存在本质区别，这种差异挑战了快速射电暴的星震起源。基于全新的相图，团队发现快速射电暴在时间-能量二元空间上游走接近所谓的布朗运动，也就是表现出了高度的随机性。而同样不可预测的地震、太阳耀斑等却表现出远为显著的混沌性。快速射电暴的高度随机性可能由多种机制或者多个发射位置组合形成。中国天眼通过中国天眼FAST的强大观测能力结合创新的分析方法，未来科学家或将能够深入刻画宇宙间的神秘爆发信号，有望最终揭示宇宙的起源。这项研究工作于北京时间2024年04月12日，在“中国科技期刊卓越行动计划 ”综合性期刊《Science Bulletin》上作为封面文章发表。快速射电暴（Fast Radio Bursts，简称FRBs）是一种来自宇宙深处的短暂而强烈的无线电波爆发。就像它的名字一样，快速射电暴在千分之一秒的时间内能够释放巨大的能量，足够驱动人类社会万亿年。自2007年人们第一次发现快速射电暴以来，它就因其神秘和强大吸引了全世界科学家的注意，并在2023年获得了邵逸夫天文学奖。但是，至今为止，我们还不知道这些强大的能量是如何产生的，而解开这样的谜题可能会帮助我们在天文学甚至基础物理学上取得重大突破。尽管现在还不能确切知道快速射电暴具体是如何发出的，但是至少可以猜测其源头，是某种蕴含着极高能量密度的所谓致密天体，比如中子星或者黑洞。我们知道中子星的信号会像灯塔一样，规律地扫过地球，非常稳定。如果快速射电暴也是由这样的天体发射出来的，那么能否看到规律出现的快速射电暴信号呢？非常遗憾的是，在过往的诸多研究中，寻找快速射电暴在毫秒到秒量级的周期的所有努力都失败了。这就要求我们重新考虑快速射电暴的发射方式。天体也存在不可预测、看似混乱的能量释放过程，例如星震和地震。致密天体，特别是具有极端磁场的磁星，其星震被认为是快速射电暴的可能触发机制。地震混乱不可预测，但是并非完全随机。在一次非常强的地震事件发生后，常常会伴随着更多的相对弱小的余震。这说明地震发生的时间和能量是有关联的，不是完全随机的。以往进行的周期搜索无法揭示时间和能量这两个基础物理参数间的关联。一个随机事件，比如抛硬币，其不可预测性稳定持续的。我们无法根据当前抛出的正反面来预测下次，或者下下次的结果。相对应的，一个混沌系统，例如气候，看起来混乱如随机过程，但它的不可预测性是随时间增长的。抬头看天就可以预言下一秒的天气。但是全人类最好的预报系统也难以精确预言几周、几月后的天气。时间越长，不准确性越高是混沌系统的特征。来源：央视新闻（总台央视记者 帅俊全 褚尔嘉）,0,0,11,江苏,苏州,江苏,中国
37,5022312280359534,中天電視亞洲台FUN,2024-04-12 12:27:00,#大陆首个「抗量子攻击护盾」PQC 成功装备应用#大陆《科技日报》12日报导，从安徽省量子计算工程研究中心获悉，中国大陆第三代自主超导量子计算机「本源悟空」 4月10日成功装备大陆国内首个PQC「抗量子攻击护盾」——PQC（Post Quantum Cryptography，后量子密码）混合加密方法。这将使「本源悟空」更好抵御其他量子计算机的攻击，确保运行数据安全。据指出，PQC技术能够有效地抵抗量子计算机的攻击。量子计算机因其超强算力可以对原本的公钥密码体系产生严重威胁。为抵抗量子计算机的潜在攻击，世界各国纷纷加速推进PQC迁移以替换原本的公钥密码体系。据安徽省量子计算工程研究中心副主任窦猛汉表示，「本源悟空」此次上载的PQC「抗量子攻击护盾」由本源量子计算科技（合肥）有限公司研发，是大陆国内首次实际应用。这意味着中国自主超导量子计算机在量子计算领域可以「攻守兼备」。同时，这也是中国数据安全新技术应用的一次重要探索。来源:中时新闻网,0,0,0,,台北市,台湾,中国
37,5022309727602732,焦相彬aa,2024-04-12 12:16:52,研究过下列重大管理战略问题：1激励员工的奖励方式2如何管理计件工人3如何计算计件工资4企业扩张太快的危害有哪些5民营企业融资方法有哪些6员工管理方法有哪些7企业用人理念有哪些8员工频繁调动到适合他的工作岗位上合适吗，能提高工作效率吗9违纪员工的惩罚方式有哪些10大企业病有哪些11哪些员工必须被辞退12企业营销方法管理战略如何调整13如何留住骨干员工14计时工人的管理方法15仓库管理政策等等理论研究内容都保存在我的微博里面，微博内容600多条，我出生于1984年10月9日，属鼠，今年40岁,0,0,0,河南,驻马店,河南,中国
37,5022306242134967,中国科学报,2024-04-12 12:03:00,【超声控制的细胞“生物炸弹”精准攻击肿瘤】在抗击癌症的长期战斗中，科研人员一直在追求一种理想的治疗方法，既能够精准消灭肿瘤细胞，又不损害健康组织。华东师范大学生命科学学院、上海市调控生物学重点实验室教授叶海峰团队近期的一项研究成果让人们离实现这一目标更近了一步。他们提出了一种创新的肿瘤治疗手段——利用超声波控制的细胞“生物炸弹”，对肿瘤发起精准攻击。4月11日，相关成果发表于Cell Reports Medicine。随着合成生物学技术的飞速发展，一种智能微生物递送系统应运而生，为癌症等疾病的精准治疗带来新希望。这些智能微生物如同微型药物工厂，能够针对人体内的炎症、感染和肿瘤等特定状况，感应预设的信号输入，并精确地作出响应。值得一提的是，一些微生物对肿瘤组织具有天然亲和力，可在低氧、高酸、免疫抑制的肿瘤微环境中趋向定殖，并具有天然的抑制肿瘤效果，因此成为抗肿瘤药物递送的理想载体。然而，现有技术中，药物蛋白的表达往往是持续不断的，这不仅可能抑制微生物自身的生长，还可能对人体健康组织造成不良影响。此外，传统的药物递送方法缺乏精确控制，难以达到精准医疗的要求。对此，叶海峰团队在最新研究中提出了解决方案，采用了一种新战术——声遗传学，即利用超声波控制细胞行为。作为一种广泛应用于临床诊断与治疗的安全手段，超声波在这项研究中被赋予了新使命。研究人员巧妙利用超声波的非侵入性、深层组织穿透性以及时空特异性特点，开发了一种超声调控的基因表达系统（SINGER）。该系统依赖于一种温敏型转录抑制因子TlpA39，能够响应超声波引发的微小温度变化，精准启动特定基因的表达。他们还展示了一种新型的声遗传学控制的定制化细菌，在超声波的刺激下，携带SINGER系统的工程细菌能够局部升温到39摄氏度，精确启动特定基因的高效表达。这意味着，超声波能够让工程细菌“听话”地在恰当的时机和地点分泌治疗蛋白，实现对肿瘤治疗药物表达和释放的精准控制。这种时空可控的调控机制确保了治疗效果直接针对肿瘤细胞，同时最大程度地保护了健康细胞不受伤害。工程细菌通过瘤内注射或静脉注射的方式递送到体内，可以选择性地在肿瘤缺氧和坏死区域定殖与增殖。在超声波的精确控制下，这些“生物炸弹”在肿瘤内部被激活，原位表达释放出治疗药物，有效抑制肿瘤的生长，甚至能够彻底清除肿瘤。网页链接,0,0,5,,北京,北京,中国
37,5022051247590465,Meta麻麻,2024-04-11 19:09:45,几乎没有机构能准确研究清楚一家公司，因为公司内部太复杂，有时候连老板自己都不清楚未来发展成啥样，所以才有很多老板和资本对赌失败，最最最聪明的首富王老板都出现这种情况，何况其他人？可见，普通股民要研究透一家公司是很难很难的，那么我认为最好的方法就是研究行业和公司股票形态，做资金推动的行情或者做景气行业的股票，可能成功概率要大很多。,6,16,123,湖北,宜昌,湖北,中国
38,5022302292938133,AllenDella,2024-04-12 11:47:19,自考本科统考只考3科的专业！！艺术教育-美术教育🎨🎨自考艺术教育专业有两个方向，一个是美术教育✅另一个是音乐教育✅毕业时颁发艺术教育专业毕业证！🎈专业介绍：主要研究美术相关的基础理论，掌握科学的教育理论和教学方法，接受教师基本素质和基本能力的训练，并能组织课外美术活动，有初步的科研和创作能力，例如：对油画、国画、装饰画、书法、篆刻等方面的课程进行讲授。🎈就业前景：1、在中小学，培训机构，从事美术教学，社团辅导，学校宣传，班级管理等工作。2、也可以在传媒类的机构，从事广告设计，装潢艺术设计，美术设计等工作。🎈学费：4000/年，一共是需要交两年的学费。🎈优势：1、难度比较低，统考科目只有三门‼顺利的话一次统考就可以考完，️而且不考高数，英语（二）可以选考，不考英语（二）需要加考三科校考科目。2、取得考籍起三年内顺利毕业的，可以免考英语申请学位证书‼️3、成都师范学院可以考英语四六级‼️注意：自考是不需要线下上课的❗️还有外省的同学需要到四川来参加考试❗️#自考##自考本科##四川自考#广东自考#小自考#江苏自考#广东自考#广东自考,0,0,0,四川,成都,四川,中国
38,5022298631836813,WeChat特别代表,2024-04-12 11:32:46,每次看到wreck第一反应都是身体/精神受到破坏的人而非残骸… 我天天研究上吊方法阴得的报应 ,0,0,0,海南,海口,海南,中国
38,5022296729191706,骨科张永奎主任,2024-04-12 11:25:13,别着急划走，耽误你30秒，我是公立三甲医院的张永奎主任，对中医治疗股骨头坏死病方面有着颇深的研究，也有一些独特的调理方法，如有您或者您的家人有股骨头坏死，又没有达到手术的必要条件或者想采取保守治疗在评论区打出:“保守”。我看到后会一一回复大家#中医##股骨头坏死# 骨科张永奎主任的微博视频 ,0,2,5,北京,北京,北京,中国
38,5022294348925511,西藏举报,2024-04-12 11:15:45,#人老了为什么身上会有味#【#预防断崖式衰老的方法#】 医学研究发现，衰老虽然持续进行，但并非匀速发展，在3个年龄容易出现断崖式衰老，分别是34岁、60岁和78岁。延缓衰老的方法有很多，以下几种尤为重要↓↓1、心态最重要：百岁老人和医学研究都证实，好心态的确能抗衰老。2、吃得杂一点：膳食平衡，什么都吃，每天吃够12种食物，每周吃够25种。3、把运动变成习惯：长期不锻炼，组织机能会降低30%。每周应积累150分钟有氧运动。4、有个休闲爱好：可以改善情绪，舒缓压力。5、不碰烟酒：双胞胎中，不吸烟不喝酒的那个往往更显年轻。6、睡足美容觉：睡眠是身体自我修复的过程，每天睡够7小时，最好在23点前入睡。（来源：叙州之窗）,0,0,0,,拉萨,西藏,中国
38,5021992388133019,央证公开课,2024-04-11 15:15:51,【收藏学习！中国茶文化知识点】近日，有国外的科学家通过实验研究发现，#1杯茶可杀死口中99.9%的新冠病毒#。中国茶已列入世界非遗，茶文化深深融入中国人的生活。红绿黄白青黑花，不同种类茶叶冲泡方法，你都了解吗？西湖龙井、黄山毛峰、铁观音…这些都属于什么茶？有哪些制茶技艺？茶不仅是简单的饮品，还承载着深厚的文化内涵。戳图了解↓↓(人民日报),41,12,86,,北京,北京,中国
38,5022291811111680,A-期刊论文杂志社发表,2024-04-12 11:05:40,《生物化工》主办单位：江西省科学院出版周期：双月刊国内统一刊号：CN36-1336/TQ 国际标准刊号：ISSN2096-0387栏目：收生物制药、生物能源、环保、微生态制剂、化工新材料等生物化工领域基础理论、应用研究最新成果。导向性评论与综述，重要的科学问题讨论、研究简报和新技术新方法学术专著介绍等。,0,0,0,河北,张家口,河北,中国
38,5022290704073958,A-期刊论文杂志社发表,2024-04-12 11:01:16,《河南图书馆学刊》 主办单位：河南省图书馆学会;河南省图书馆 出版周期：月刊 ISSN：1003-1588 CN：41-1013/G2 栏目：公共图书馆；高校图书馆；阅读推广；文献研究；理论研究；建党100周年专栏；少儿图书馆；读书方法论析。 ,0,0,0,河北,张家口,河北,中国
39,5022287201568464,暴富暴美好运满满,2024-04-12 10:47:21,毕业论文选题: 1.要先想研究意义 2.研究方法 ,0,0,1,北京,,北京,中国
