页码,微博id,微博作者,发布时间,微博内容,转发数,评论数,点赞数,发布于,ip属地_城市,ip属地_省份,ip属地_国家
31,4426953333486846,隽永hh,2019-10-13 15:23:06,高等教育领域的竞争日趋激烈。竞争本身无所谓好坏，但其结果却有好坏之别。    大学里，为了获得职称升迁，教授们在自己领域接受的培训日益狭隘、专门化和高深化。终身教授的资格在多数情况下授予研究成果突出的教师，很少授予教学贡献突出者。    学术论文正变得呆板和缺乏锐气，只强调写作的技巧。 六盘水,0,0,0,,,,
31,4426874254109056,维度新闻,2019-10-13 10:08:52,#战队风采# 【#哈尔滨# 市万宝小学校：三重选拔掀起益智热潮】在接到由黑龙江省教育学会、黑龙江新媒体集团、北京市国育教育科技发展中心联合主办，中国教育科学研究院培训中心指导的“国育杯”首届#思维运动会# 的征集通知后，哈尔滨市万宝小学经过层层选拔获得了参赛资格，校园内又一次掀起了益智的热潮。#益智器具# 有着独特的魅力，教师一旦为学生打开#益智教育# 这扇大门，学生就会为之痴迷，万宝小学的学生更是如此。为了能取得参赛资格，学校的每一位选手都是经过班级、学年、学校三重选拔才杀出重围，最终获得比赛入场券。参赛的教师们，仔细钻研，寻找解题的技巧，牺牲自己的休息时间进行训练。学习是个开放的过程，学习者从教师传授，到了更广阔的空间，负责项目的老师、班主任教师、家长通过网络进行自学。多方位的学习方式提高老师们水平的同时也使得学生们迅速成长。参赛过程中的体验会在万宝小学师生的心中留下永久的印记。孩子们的倔强与坚持，高强度的思维训练激发出来的探索的欲望，竞技的意识和协作的精神。大鹏一日同风起，扶摇直上九万里，万宝小学希望借助比赛的东风，让孩子站得更好，看得更远！(#黑龙江网# 记者 宋菲)#我和思维课堂有个约会# 原文阅读请戳→网页链接,0,0,0,,,,
31,4425051715424790,来颗草莓778,2019-10-08 09:26:45,工作一段时间后，尝试过几个类型的工作后 突然有了两个念头 1.考个管理类的研究生 2.考英语的教师资格证，可以在培训结构当老师 工作怎么都不顺心，想多给自己余地和选择。还是读书好啊 ,0,6,2,,,,
31,4421293786660255,药师方健,2019-09-28 00:34:05,【看病求医，到底去什么医院最好？医生总结的经验和您分享】作者简介：方健2003年获执业医师资格证书，2006年获中山大学药理学硕士研究生学位，2012年获卫生部临床药师培训...#科普随身行# 【我的诊室】了解更多&gt;&gt;网页链接 【文章详情】点击↓↓↓ 看病求医，到底去什么医院最好？医生总结的经验和您分享 ,0,0,3,,,,
31,4421172709726806,X姐姐即将成为故事大师,2019-09-27 16:32:58,跟一同事聊了一中午天，跟我展示了一个十分紧张的学生升学竞争的世界：孩子还在小学，就在研究初中、高中以及大学的竞争之路，各种设定和安排，如参加某些特长培训班，参加某些英语考级资格考试，参加某些全国性的竞赛，参加全国作文大赛，对广州各区域的初中高中的招生政策研究，如数家珍，对区域的政策研究对各培训机构的特点研究都不在话下，并且反复指责我这种完全佛系的不负责任的态度……强调我这个小学四年级的家长，再不进入状态，孩子一生就被我毁了。建议给孩子数学报四个班，一个奥数的，一个刷题的，一个考资格的，一个不记得了，然后还要考虑一个特长兴趣班，以获取特长生资格……听得云里雾里，汗颜无比。我弱弱地说了一句，不是每个孩子都是天才啊，立即被鄙视，让我开始有点自我怀疑……我们不断被现实碾压，只因为自己不过泯然众矣啊……真的要如此逼迫孩子吗？,1,0,1,,,,
31,4414657722990658,崇州教育,2019-09-09 17:04:44,携手前行，共同成长——崇州市举行幼儿园园长任职资格培训活动        2019年9月5日——9月6日，由崇州市教育局、崇州市教育研究培训中心主办，崇州市实验幼儿园教育集团承办的崇州市幼儿园园长任职资格培训第一次幼儿园跟岗研修活动在实幼集团辰居路总园举行。培训班的几十名园长和老师们积极参与了本次跟岗研修活动，崇州市教育研究培训中心培训部主任罗成、学前教研室主任王燕、继教办老师王羽也来到现场指导关心活动开展。        9月5日，实幼集团陈兰园长以《播幸福种子 听花开声音》为题，分享了实幼的基本情况、办园理念、园所文化、园所特色等。并针对园长的课程领导力，和大家分享了自己的理解和经验。       接着，实幼集团园长助理赵麟慧进行了课程建设专题汇报《默默浸润 滋养花开》。从实幼的课程背景、理念、目标、内容和结构，以及课程实施、课程管理、课程评价等内容，向学员们做了详细的阐释，让学员们对幼儿园课程建设有了更深层次的理解。       9月6日，王燕给全体学员做了专题讲座《重塑幼儿园教师专业形象——&lt;幼儿园教师专业标准&gt;解析》。从幼儿教师的角色定位，到《幼儿园教师专业标准》的制定意义、内容框架等方面进行解读，让学员们对幼儿教师的角色定位有了全新的认识，明确了教师专业发展的新要求。王主任希望学员们将《标准》真正落实到日常工作中，以更专业、更细致的标准做好幼儿园师资队伍管理。       在崇州市教育局、崇州市教育研究培训中心及四川创新教育研究院的积极推进下，在崇州市实验幼儿园教育集团的大力配合下，本次跟岗研修活动划上了圆满的句号。相信培训班的学员们会将所看所学进行自我内化，并运用于自己的管理工作中。      作为教育部园长培训中心成都实践教学基地，崇州市实验幼儿园教育集团也将继续潜心幼教工作，携手幼教同行，共同将幼儿园营造为孩子们的“快乐家园”。撰稿：陆静 赵麟慧      审稿:吴永忠  编辑：马治湘,0,0,1,,,,
32,4410919360952416,粥lily,2019-08-30 09:29:49,#没搞副业的我太难了# 前几天这个副业👇挺火，我随口问队友要不要也搞个副业？(就凭我这呱嗒呱嗒的嘴巴和疯狂买买买的经验真的超适合带货——而且天天被同事怂恿开直播)队友回：你的研究生班怎么还没开学？既然被公司选中了出版资格证就好好全力考。ppt培训班有没有报啊？出钱给你学怎么都不去学？我：。。。,0,1,1,,,,
32,4409666165089594,医学科普阿源老师,2019-08-26 22:30:04,#夜话#  老师你好，我想问一下本科是临床医学（儿科方向），研究生如果考成人内科学硕的话，执业医可以注册为内科吗? #执业医师资格考试# #住院医师规范化培训# ,0,1,3,,,,
32,4408385141049027,服装探秘卢钟鸣,2019-08-23 09:39:44,只有参加过线下短视频培训的学员才有资格申请加入壹商汇抖商分会。抖商分会会员享有短视频课题研究实践的待遇，即优先享受小风口红利。最先实现快速变现每月数十万利润的在他们当中产生一部分。 ,0,0,0,,,,
32,4404417207977915,现代物流报wangwei,2019-08-12 10:52:35,本次研修班纳入“中国管理科学研究院智慧物流人才培养工程”项目，培训考核通过后，颁发中国管理科学研究院职业资格认证培训中心印制的 《智慧物流专业人才能力证书》。 ,0,0,2,,,,
33,4402074118332918,博泉书院李和建,2019-08-05 23:41:59,郴州市博泉教育培训学校的主页 是以成人专、本科函授教育，自考助学，远程教育，研究生培训辅导，教师资格培训，卫生资格培训，中小学优质教育为一体的教育服务机构！  你的选择，不仅仅是一个培训机构，更是一次改变你现在，成就你未来的机会! 网页链接 ,0,0,2,,,,
33,4400596729409611,卢璟考教师,2019-08-01 21:51:22,这是我原来的一个学员，帮着给发个广告 @扬之凡  Peter老师（杨光友），原毛坦厂教师。精通新概念教学；专四优秀；持有初级教师资格证，教龄5年。在上海某家培训机构任职初中教学主管，长期研究小升初和中考教学，对于文来上宝中学有一定研究。 ,0,7,10,,,,
33,4398428097887116,年和月都太类似200611,2019-07-26 22:14:00,杭州上门古筝老师，古筝十级水平，目前浙江音乐学院研究生在读，可上门辅导，教学经验丰富，培训过的学生都以优异的成绩通过音协、中国音乐学院考级资格，价格私聊。#杭州#杭州招聘 ,0,3,5,,,,
33,4397624108708726,英国求职小姐姐_Prada,2019-07-24 16:59:14,英国 Smith &amp; Williamson 正在招聘 Business Tax Trainee   要求：2:1等级以上，协助研究任务和起草技术文档，团队合作能力优秀，在写作和沟通中都有着较强的表达能力  提供ACA/CTA专业资格培训 工作地点位于Bristol  #英国求职##英国找工作##会计师事务所##布里斯托##Smith and Williamson # ,0,0,1,,,,
33,4396556402754651,坚恒勇毅,2019-07-21 18:16:33,@坚恒勇毅 的科研论文班并不是普通意义上的培训班，所以当然不存在试听和教材啥的，因为是实战化训练，本组的十来位研究生都在全程接受训练，教授的资格和资历已经通过985大学的检验，花费了20多年时间的修炼才做到这步的。所以，我再次提醒有意向加入的同学，务必去听一下加入须知的喜马拉雅音频，考虑好再加入，勿拿社会上辅导班那一套东西来询问教授的论文班。 #坚恒勇毅教授的论文班#,2,2,28,,,,
33,4392434660573207,寒鸦栖复惊丷,2019-07-10 09:18:13,#人社部回应80后无养老金#其实影响的还是我们这些普通人，对制定计划的人有影响吗？相比较体制内确实稳定了很多，所以大家也挤破脑袋想进去大学室友考了教师资格证，现在在培训学校教课，马上也准备去考在编的老师了，还有一个等着研究生毕业考公务员，都觉得女孩子安安稳稳最好。我还在做我的社畜，老板每天难以沟通，答非所问，生活好像看不到什么希望。,0,1,4,,,,
34,4392131571398494,Chichichichicho,2019-07-09 13:13:51,#英语家教# 本人是一名英语专业的研究生 本科是英语师范  持有高中英语教师资格证  过了英语专业八级 在培训机构任职过英语教师 也有过多次家教经验 有需要英语家教的可以找我哦 ~   重庆·西南政法大学 ,0,1,2,,,,
34,4389354259057634,kdlkbkxfl,2019-07-01 21:17:48,在经济增长放缓的大背景下，父母焦虑感加剧，推动补课产业繁荣昌盛。身边越来越多优秀的年轻人从事中学生竞赛培训和补课。有的博士毕业多年，在高校有教职，因为买不起学区房，放弃科研兼职补课；有的研究生放弃博士资格，硕士毕业去中学教书；有的本科生学业瞎混，省出时间搞补课。这些当年高考各省前200名的好学生，家长的骄傲，老师眼中的娇子，勤奋努力多年，最终不过是教中学生，帮助他们提高成绩，考个高分，进入牛校，毕业后教中学生，如此循环下去。,0,5,1,,,,
34,4380220453114705,宿敏面试,2019-06-06 16:23:19,没有彻底研究明白教学法的老师，就没有资格培训老师。 ,0,0,2,,,,
34,4377792495671559,烟台共青团,2019-05-30 23:35:29,#烟青榜样# ┆第十五届“烟台十大杰出青年”——于超亮#何为青年 何以最美# 于超亮，1987年出生。茶产业工作者，茶学硕士研究生，农艺师高级工程师，全国茶馆等级评审委员会评审专家，人力资源与社会保障部高级人力资源管理师、培训师，高级中学教师资格。茶，自古为南方嘉木。在中国长江以北种茶是相对艰难的，由于北方天气寒冷，雨水不足等自然原因的限制，茶树种植行业发展的并不乐观。但是在北纬37°的山东烟台，这座美丽的海滨城市里，有这么一家专业的茶叶种植企业，不仅成功的完成了“南茶北移”工作，并且相关配套设施完善，茶叶品质颇好，拥有广泛的发展前景，是当地茶叶种植的领军企业。于超亮，就是这家企业的掌门人。让我们一起聆听和分享他的创业故事。,0,0,0,,,,
34,4374498301866582,江汉大学,2019-05-21 21:25:32,#江大快递# 从江大直博到北大！！！经我校生命科学学院2015级园艺专业本科生、2017-2018学年“校长奖学金”获得者田广梅同学个人申请、考核和面试，在我校系统生物学研究院遗传与生物技术研究中心王卫华博士等老师推荐、指导和培训下，田广梅同学获得了2019年度直接攻读北京大学博士研究生录取资格（直博生）。这是我校自成立以来首次本科生以免试推荐的方式获得世界著名高校直接攻读博士研究生的机会，开创了我校暂时没有保送资格，本科生以保送方式攻读直博生的先河。,7,21,146,,,,
35,4368967155892819,用户7028622937,2019-05-06 15:06:44,湖南正和中医药教育有限责任公司成立于2018年，注册资金600万元。是一家集中医理论精髓与实践应用研究、中医人才教育培训、中医专长医师资格、中医考研考博辅导、中医适宜技术推广、民间验方收集研发、品牌中医馆的加盟连锁于一体的综合性中医专业服务机构。公司师资力量雄厚，名医名师荟萃。联合湖北国胜教育有限公司，重点依托湖南、湖北中医药大学的师资力量，整合两省各大中医医院的医学专家团队资源，同时吸纳全国各地资深中医专家、教授常年莅临任教。针对常见病、多发病以及疑难杂症提供专业前沿的诊疗技术。在中医专长资格考核、中医考研、考博辅导方面，本公司组织业内一线命题教师形成核心辅导小组，采用面对面、小批量、全日制的方式组织培训。培训授课时间长，模拟次数多，确保教学质量优质高效，协助学员快速达到相应执业技术考核要求。为响应国家号召，大力培养基层高素质中医药实用人才，积极开展基层各科常见病种中医实战技能提升辅导、实用针灸、艾灸、小儿推拿等适宜技术推广与传播，切实提高基层医生的中医诊疗技术水平。同时，多方考察整理民间经方验方加以研发，并予以推广，使之传承有序，福泽于民。正和人以继承和发扬中医文化为己任，本着“求真、务实、崇学、向善”的发展理念，综合各方优质资源，为各界中医人士搭建更广阔的发展平台。企业文化：求真、务实、崇学、向善企业使命：弘毅国医、惠泽万民教学宗旨：厚基础、重临床、因材施教、效果为王企业理念：执中致和  成己达人企业愿景：集杏林贤能之师，育橘井可造之材,0,0,1,,,,
35,4356924059308688,青海高院,2019-04-03 09:31:46,重培养 促提升 储后备 强队建  为加强法院审判人才队伍建设，提升新时代法院干警的法律素养和专业知识。中共海北州法院党组研究出台了《关于参加国家统一法律职业资格考试培训工作制度》，本制度共有6项内容，主要涉及参训干警范围、参训纪律、参训费用及相关制度要求，为规范海北中院干警参加国家统一法律职业资格考试培训工作提供了制度保障。    近年来，在省高级人民法院和国家法官学院的大力支持下，海北两级法院选派多名干警参加了国家统一法律职业资格考试培训，取得了一定的成效。2015年以来，海北两级法院通过培训参加国家统一法律职业资格考试取得A证人数2人，取得C证11人，极大地为海北两级法院干警法律职业资格的取得提供了良好的平台，提高了法院干警法治工作质量和效率，为法院干警更好地服务审判执行工作提供了智力支持，切实满足了新时代法院干警的新要求，为审判人才充实了后备力量。,0,0,0,,,,
35,4351698736599250,DDG的老船坞,2019-03-19 23:28:11,呃，其实学生心理健康问题，我十来年前参加研究生导师培训的时候就是培训的重头问题了……虽然我当时没申请导师资格但是当时讲的那些奇葩案例有的还记得……//@饼干姐:原博是现实版面试技巧，大家看看。,0,0,0,,,,
35,4347665459978810,李小韬油画-摄影工作室,2019-03-08 20:21:24,今天下午，国家文化和旅游部艺术发展中心卢珍珠主任（图一）和王磊老师（图二）作客我的画室，就当前地方的少儿美术培训（考级）的现状和发展问题作了交流，并就培训机构的师资资格等下一步和我们粤港澳大湾区书画研究会合作开展活动提出一些建设性意见。 深圳·翠竹街区 ,0,0,3,,,,
35,4342432009166092,宋爷爷健康工作室,2019-02-22 09:45:32,河南电视台公共频道报道:8天中医基础教学，学费19800元，430多名来自全国各地的学员……这家研究院办起培训班，付费学员数百人！一查才知道，竟然没备案……中医确有专长资格考试培训骗局何时了？ 郑州·郑州逸泉国际酒店 ,0,0,1,,,,
36,4339258909667589,用户6383092974,2019-02-13 15:36:46,在中国学医，首先需要：5年本科，3年研究生，3年博士；毕业以后，还需要：3年规范化培训，执业医师资格考试，职称考试；如果医术过硬，还能经受住各种考试、论文。19年的时间，才能当上副主任医师；24年的时间，才能成为主任医师。这时候已经近五十了，医生的辛苦是可想而知的，如果以他们的学识去做个公务员绰绰有余的，还坚守在医生岗位的是遵循做学问；不做良相，只做良医的信念。中国不缺官，但是医生还是需要大量存在，因为人民需要医生。向那些常年在一线岗位工作的医生致敬，他们太累了。,0,0,1,,,,
36,4336730507021010,早晨阳光灿烂O,2019-02-06 16:09:47,2018年过去了。 开心的是：女儿通过了全国统一法律职业资格考试；儿子考上了大学。姨甥大数据培训结束找了工作；在读研究生的姨生女取得了医生执业证书。姐搬了新家。 伤心💔的是：最疼我的伯父去世了再也没人疼我了 ,0,8,1,,,,
36,4332038733616124,用户5483908586,2019-01-24 17:26:22,河南中科医药研究，没有培训资格，伪造个人信息参加医学考试，扰乱医学考试秩序，降低医学准入门槛，拉低医生水品，造成人民生命潜在威胁。增加医疗纠纷。 ,0,0,0,,,,
36,4327672773347897,新岳阳,2019-01-12 16:17:36,#岳阳身边事#【全国大型游乐设施检验员资格取证考核培训开班】1月10日，岳阳职业技术学院（简称：岳阳职院）与湖南省特种设备检验检测研究院共同承办的全国大型游乐设施检验员取证资格考核专业培训活动开班仪式在长沙举行。来自全国32个省（市、自治区）的140名学员参加了此次大型游乐设施检验员培训。 ,0,0,1,,,,
36,4326233653020911,中公许仙,2019-01-08 16:59:03,成都事业单位招聘 【省属】2018年12月四川省属事业单位成绩发布！  省卫生计生政策和医学情报研究所先出！ 排名及复审详情：网页链接 （14-15日资格审查，预计18-19日面试！面试培训课程1月11日开课！不过全退!询028-82005700） ,0,0,0,,,,
36,4323241181305259,手机用户3309316323,2018-12-31 10:48:02,2018年去广东参加会议顺带看了小蛮腰，2018年硕士研究生毕业了，2018年去了天柱山，2018年参加了高等教师资格证培训，2018年收到了几样小礼品，2018年我树还没种成，我的宠物狗狗还没养成......#再见2018##宝宝的少女心# 2018年结束了！2019年我希望我每天都可以笑成傻子一样。 ,0,0,0,,,,
37,4311483003957305,姓髙yo,2018-11-29 00:05:14,重回健身 参加一个电子音乐节 一次马拉松 参加跑团活动30次 卡里有固定不轻易动的钱 或许是研究生或许在工作 主持人培训 当导游不浪费考的导游资格证 历史资格证 看完80本书 去北京 待续,0,1,4,,,,
37,4309174508411824,文化和旅游部艺科所全国美术考级,2018-11-22 15:12:05,中国艺术科技研究所美术考级汕头考区美术、书法教师资格认证培训班于11月19～20在汕头举办。来自北京专家们的精彩授课让学员们教益良多。 ,0,0,1,,,,
37,4308734879201003,药学长,2018-11-21 10:05:09,CRA面试常见问题如何筛查医院？（我的理解是如何判断基地中的sites是否适合开展自己的临床试验？）主要参考4个因素：1）该中心的主要研究者或研究者是否有相关的资格和经验（包括对临床药物的熟悉和GCP培训等）；2）是否有足够的时间按期完成试验；3）是否有足够的病源按时完成入组；4）是否有足够的设备和仪器供试验使用。费用合理合作性良好质量可靠差旅方便有助于注册顺利通过有助于市场推广遵守GCP要求的临床研究者的职责；有充足的时间保证试验实施；对我的新药的临床试验项目的研究价值感兴趣，把试验当作严肃、认真的科学探索活动；能够按时完成受试者的录入计划；不应同时参与其它同病种新药的竞争性试验项目；诚实正派、工作严谨、团队保障。,15,4,16,,,,
37,4218253016413309,西红柿胡萝卜南瓜,2018-03-16 17:42:33,高校教师资格证面试 国培返岗教研 申请材料 题库 教案课件反思 论文 研究计划 研修班 上百篇待修改作文 口语演讲培训 还有什么是我忘记的一块来吧 我肖某何惧 ,0,0,0,,,,
37,4216828173713232,sweet_sweet_sweet,2018-03-12 19:20:44,本人17年毕业于中科院金属研究所，材料小硕一名，在威海工作半年后回到石家庄，目前也在准备教师资格证考试，可以做材料类和教育培训类工作，有需要的可以私我哦 ,0,1,0,,,,
38,4210157032714489,长清法院,2018-02-22 09:32:00,【关注！《国家统一法律职业资格考试实施办法（征求意见稿）》将向社会公布！】 1月31日下午，司法部部长、协调委员会主任张军在司法部机关主持召开国家统一法律职业资格考试协调委员会（职前培训指导委员会）第一次会议。会议研究了《国家统一法律职业资格考试实施办法（征求意见稿）》和国家统一法律职业资格考试大纲制定等工作。具体请戳：关注！《国家统一法律职业资格考试实施办法（征求意见稿）》将向社会公布！,2,0,0,,,,
38,4204388757068670,贵州法治报,2018-02-06 11:30:56,国家统一法律职业资格考试协调委员会（职前培训指导委员会）第一次会议召开-法制生活网　　日前，司法部部长、协调委员会主任张军主持召开国家统一法律职业资格考试协调委员会（职前培训指导委员会）第一次会议。会议研究了《国家统一法律职业资格考试实施办法（征求意见稿）》和国家统一法律职业资格考试大纲制定等工作。 网页链接,0,0,0,,,,
38,4203406027870741,郑渝川,2018-02-03 18:25:55,由中国科技创新与战略发展研究中心资格认证中心主办，军民融合发展委员会幸福大中华计划执行小组，等共同协办的“全国科技人才龙岗培训认证基地授牌仪式”于3月25日在深圳布吉求水山蓝谷森林山庄隆重举行。 网页链接,3,0,0,,,,
39,4185169760445162,滕州教师编,2017-12-15 10:41:29,#教师培训##教师事业编##山东教师资格证##家庭教师##教师招考##山东教师招考##教师考试##山东教师# #教师在编# #山东教师招聘##别人的老师##教师考试##现在烟台##山东大学##研究生招生# 教师资格面试有套路，高分有技巧,0,0,0,,,,
39,4185169470066260,滕州教师编,2017-12-15 10:40:22,#教师培训##教师事业编##山东教师资格证##家庭教师##教师招考##山东教师招考##教师考试##山东教师# #教师在编# #山东教师招聘##别人的老师##教师考试##现在烟台##山东大学##研究生招生#  :回复@阿盈哟_:不可以，需要二级甲等及以上语文学科。//@阿盈哟_:老师 报考小学语文 普通话二乙可以先考吗？,0,0,0,,,,
39,4176193873806803,Day一建集训,2017-11-20 16:14:31,我正在申请微博认证，认证信息为“全国执业资格考试培训 工程师 西南交大土木工程管理硕士研究生”。请@想飞的羊lo @如何证明自己i 转发此条微博帮我确认身份，多谢！！ 申请微博认证 ,0,0,0,,,,
40,4174006720123180,上海瑞金医院感染科,2017-11-14 15:23:34,【全家福】瑞金医院感染科始建于1930年，是国家教育部内科学专业重点学科、内科感染病学专业博士、硕士学位授予点和博士后流动站，是国家卫计委感染病学专科医师培训基地，是国家食品药品监督管理总局新药评审中心资格认定的感染病“肝病专业”临床药物研究基地、感染病学国家临床重点专科建设单位和上海市公共卫生三年行动计划重点学科建设单位，， ，,0,3,15,,,,
