页码,微博id,微博作者,发布时间,微博内容,转发数,评论数,点赞数,发布于,ip属地_城市,ip属地_省份,ip属地_国家
14,5013675927406151,宋瑾老师教育学考研,2024-03-19 16:29:13,【25研 333教育学最新选择题题库】  【2008年真题】在古代文献记载中，我国西周时期设在王都的小学和大学，总称为（） A.都学 B.乡学 C.国学 D.官学  #333##333教育学综合#333教育综合#宋瑾老师教育学##333教育学考研#311教育学考研#333统考# ,0,2,0,北京,北京,北京,中国
14,5013658323912453,国家图书馆出版社,2024-03-19 15:19:16,【新书 | 近代女性教育文献丛刊续编（全三十册）】本书在2021年出版的《近代女性教育文献丛刊》基础之上，继续搜集和整理近代时期有关女性教育的各种历史文献。书中收录的内容，仍沿用前编之例，大致分为如下几个部分：一是有关近代女性教育的专著、专书；二是有关近代女性教育机构的相关文献史料；三是有关近代女性教育的专刊；四是与近代女性教育密切相关的部分教材；五是从期刊中辑录出的近代女性教育文章。这批文献，既是对前编的增扩与补充，也是对相关文献整理的进一步拓展，对教育史、性别史、社会史等相关领域的研究，或能有所裨益。 网页链接 网页链接,4,3,5,,北京,北京,中国
14,5013599581900606,老111大,2024-03-19 11:25:51,#河北邯郸通报初中生被杀害案#每被霸凌的过来人心里都有无法愈合的伤口，回想过去最后悔的是在文献读书，遇到一个对教育没有热情的老师，当我中考完后就有一种解脱了的感觉，因为我知道我今后跟他们就再也不可能在同一平台相遇，只是没到现在还会有这种悲剧发生，内心十分悲凉。这种悲剧是学校的不作为，是善对恶的放纵，要记住恶人永远是恶人。,0,0,0,福建,宁德,福建,中国
14,5013594131400573,焼多摩子,2024-03-19 11:04:12,学一些跨学科专业虽然花样多有意思，但是每到期末周就主打一个三天自学速成一个学科还要写出论文来，读文献读得天昏地暗被八百个理论搞得晕头转向上吐下泻（bushi），有一种都postgraduate了还在搞通识教育啥领域都懂点但啥都不太懂的感觉 ,0,4,1,英国,,英国,英国
15,5013593074699723,中图网官方微博,2024-03-19 11:00:00,李学勤（1933年3月-2019年2月）是我国著名的历史学家、考古学家、古文字学家、古文献学家和教育家，清华大学首批文科资深教授，被誉为“百科全书式的学者”。#淘书团#《李学勤文集》全30卷，16开精装，约1000万字，收录李学勤自1956-2018年期间所撰写的中文论著，集中展现了这位“百科全书式的学者”60余年的学术历程。本套文集分为7大类：古史研究、甲骨学研究、青铜器研究、战国文字研究、简帛学研究、学术史研究、序跋杂文。不仅为全面了解他的学术成果提供了丰富材料，也对中国学术、中华文化的继承和研究有着重大的意义。,7,3,7,河北,保定,河北,中国
15,5013583549434727,Whahaha03,2024-03-19 10:22:09,今天早八就要讲课，这个老师给人巨大的压迫感，总是随机提问，我的ppt改了几次想怎样才能讲的更好。我走在上课的路上感觉要去上断头台，就是不知道那把刀啥时候落下，我们组搞文献综述，汇报的时候老师说你们组还是不错的。（心里想天呐居然被夸了）但是！我也发表过一篇文章也是讲网络思想政治教育规律的，你们为啥没放上来？（我一脸懵批，心里想完蛋了）然后老师说了五分钟怎么查文献，反正终于讲完了，心里的石头终于放下了,0,0,1,湖南,湘潭,湖南,中国
15,5013575511313870,港口区资讯,2024-03-19 09:50:12,全区党史部门主要负责人会议在南宁召开 3月4日至5日，全区党史部门主要负责人会议在南宁召开。会议传达学习了中共中央印发的《党史学习教育工作条例》（以下简称《条例》）和2024年全国党史和文献部门主要负责人会议精神，总结2023年全区党史工作，部署2024年工作。全区党史部门主要负责人会议在南宁召开 ,0,0,0,,防城港,广西,中国
15,5013568279806996,PechaKuchaBeijing,2024-03-19 09:21:28,泰康美术馆于2024年3月15日举办“境在苍穹寥廓中——蒋兆和艺术文献展”开幕。此次展览聚焦蒋兆和20世纪20年代至50年代的艺术创作、教学，汇集40余件珍贵作品及相关文献资料，从三个主题深入研究蒋兆和在中国水墨人物画创作和新中国美术教育两个维度实践的广度与深度。展览持续至2024年5月9日。蒋兆和先生是中国现代水墨人物绘画大师，他在传统中国人物画现代转型过程中的创造性实践，对20世纪中国画的发展和学院教育产生了深远影响。泰康美术馆延续泰康空间2003年以来形成的学术体系，从“媒介”与“建制”两个学术视角观察研究蒋兆和先生的创作脉络，值此蒋兆和先生诞辰120周年之际，在蒋兆和家属与云杪文化的支持下策划举办“境在苍穹寥廓中——蒋兆和艺术文献展”。@泰康美术馆 @NickyMeng 遇见艺术#遇见艺术##nicky带你看展览##蒋兆和#杜甫 北京·泰康美术馆,0,0,3,北京,北京,北京,中国
15,5013566084354998,职称论文-著作专利,2024-03-19 09:12:45,《西部素质教育》省级 知网  7200字符4版（不要英文摘要，文献最低10条）；5版9200字符 主办单位：青海人民出版社有限责任公司 出版周期：半月 ISSN：2095-6401 CN：63-1080/G4 主要栏目：素质拓展  德育研究  高等教育  教育观察  师资建设  信息素养  专家论坛  职业教育  心理素养 ,0,0,0,河北,张家口,河北,中国
15,5013561066129301,安徽科技报V,2024-03-19 08:52:48,本报讯（安徽科技报全媒体记者 黄文静）3月19日至20日，2024年现代科技馆体系联合行动第一期行业交流活动在安徽省科技馆举办。3月19日上午，活动将邀请广西师范大学二级教授导师罗星凯 、科学技术文献出版社社长胡红亮、中国科技馆馆长郭哲三位专家分别围绕科技馆在中小学科学教育中的作用、大模型赋能科技馆建设、当前科技前沿及科学文化等开展辅导报告。,0,0,0,,合肥,安徽,中国
15,5013412474520630,明日冬冬,2024-03-18 23:02:21,刚刚读到一篇教育人类学的文献 是围绕支教团讲的 题目里有五个字“短暂的停留”  再专业的评价我做不了 但我的感受就是 我愿意读 喜欢读 会被吸引 他们的小标题就像在看一本长篇小说 叙事风格是学术的  像国别研究课上听到的 可能课上的其他同学都是研究这些的吧 我会崇拜这样的人  所以到现在我都不知道我自己是属于什么定位 好像也是在几个专业短暂停留了一下  可能是一级学科的代码太过清晰 05和04 我也不像是学外语的但也不像是教育学的 我只知道我自己是一个彻头彻尾的人文社科人  bad  废话,0,1,7,上海,,上海,中国
15,5013366843638516,甘肃文旅,2024-03-18 20:01:02,3月18日，甘肃简牍博物馆、兰州职业技术学院馆校合作签约授牌仪式在兰州举行。甘肃简牍博物馆成为“兰州职业技术学院‘大思政课’教育实践基地”，因简施教、因牍传音，简述中国故事，传播中国声音！ 甘肃文旅的微博视频 ,0,5,2,,兰州,甘肃,中国
15,5013333386462259,Yia咿呀,2024-03-18 17:48:05,最近真的很想把自己掰成几份用。一份教育学一份心理学法律法规一份背课标一份背学科知识一份看文献改论文还有一份可以好好玩 我想我会永远记得这段忙碌充实的日子 ,0,2,3,江西,南昌,江西,中国
15,5013317053317322,钱主任微博,2024-03-18 16:43:10,《新课程》知网收录，省级，上半年版面，不收中职稿件，不要摘要，关键词，参考文献，内容为：教学设计，课堂实录，教学案例，教学反思，教育故事，课文解读等。 ,0,0,0,河北,邢台,河北,中国
16,5013315145961178,鸡西新闻网,2024-03-18 16:35:36,【#民建鸡西会员参观市博物馆#】2024年1月1日，《中华人民共和国爱国主义教育法》正式施行。为加强爱国主义教育，近日，民建鸡西市委组织会员前往市博物馆进行参观学习。通过讲解员对所展示的实物、图片和历史文献的介绍，会员们了解了近代鸡西历史疆域的形成和沿革、鸡西煤炭业的兴起和鸡西的初步繁荣，日本帝国主义对鸡西地区的疯狂经济掠夺和残暴的殖民统治及鸡西人民在英勇抗日斗争中树立的老航校精神和北大荒精神，为支援解放战争所做的巨大贡献。会员们也通过图表和部分实物了解到解放后，特别是改革开放以来鸡西市发生的巨大变化，更明确了只有共产党才能救中国的真理。民建鸡西市委今年将持续开展一系列爱国主义教育活动，让民建会员们近距离了解家乡历史，厚植爱国主义情怀，激发爱祖国、爱家乡的美好情感，为谱写鸡西高质量发展可持续振兴新局面凝聚信心、贡献力量。民建鸡西市委领导班子及骨干会员40余人参加活动。记者 齐方,0,0,0,,鸡西,黑龙江,中国
16,5013306258230210,金彩庄行发布大厅,2024-03-18 16:00:17,#上海国际集团团委与庄行镇团委组织团员青年参观村红色教育馆# 2024年3月12日下午，上海国际集团团委与庄行镇团委组织团员青年来到存古村参观村红色教育馆。活动现场，大家认真聆听村讲解员讲解唐一新等革命先烈的英勇事迹，在讲解员的带领下，大家观看文献资料、历史图片，驻足在一张张革命老照片前，追忆那段战火纷飞的红色岁月，感悟先辈们的革命理想、不屈不挠的斗争精神。本次活动的开展不仅让大家充分了解革命先烈的奋斗史，更是一场思想洗礼，激励大家传承红色基因、发扬优良传统、弘扬民族精神，让红色基因融入现场每一人的血脉中。,0,0,0,,上海,上海,中国
16,5013248000920600,睁一只眼睛就好,2024-03-18 12:08:48,周末值班把主任call来做输卵管开窗取胚，今天被另外一个上级教育我没有掌握手术指征，我就查文献证明我的指征没有错组上的研究生妹妹也听到我被教育，还安慰我，哈哈哈哈 ,0,2,1,福建,福州,福建,中国
16,5013221054874148,清风明月垂耳兔,2024-03-18 10:21:43,汉语言文学 小学教育  财务管理 会计 工程管理 工商管理 行政管理 音乐舞蹈 教育学 法学，成人本科、函授自考文献综述 任务书 开题报告 初稿帮助。 🛰：lunwen760 #自考论文##函授论文##函授##江苏自考# ,1,0,0,河北,张家口,河北,中国
16,5013069987580384,野生六堡,2024-03-18 00:21:26,学术界把covid19来来回回煎炸烹煮炖闷炒将近四年。今日有幸读到一篇文献说比利时人买彩票对数字19的偏好下降是因为covid19的消极影响。结论大致为：1. 迷信信念会提高人的幸福感。2. 公民概率论教育缺失。这一套看似牵强但梳理下来令我如痴如醉的说辞让我想起怀孕的龙妈生吃马心之后说感受到儿子在肚子里骑马与砍杀。学术界壁垒高就高在这儿，我生吃马心顶多作揖祝大家龙马精神。,0,0,0,四川,成都,四川,中国
16,5013064761739931,id错发给妈妈而改名的辣子,2024-03-18 00:00:40,读文献读到怀疑人生 给小孩子贴不同的标签把小孩子的特征定义为各种各样的病真的就是教育学的本质吗？把所有孩子都当作正常小孩不好吗 我真的是越读越觉得我这么一个阳光开朗健康活泼的小女孩小时候都曾有过各种各样的病了 ,0,5,9,匈牙利,,匈牙利,匈牙利
16,5013033513913028,诗人不再沉吟,2024-03-17 21:56:30,明天要做的事：·装Wi-Fi（天呐孩子在浙江的家终于要通网了，这几天一直用我的小11给电脑开热点，小11电池健康度又要骤减了😁）·学国际中文教育的网课（我爱我的B站大学）·继续读文献，解决导师给我论文列出来的问题，如果进度快就直接开始改论文（这个过程太痛苦了，一想到如果去读研还要再次经历这样的过程，就有点退缩，但是勇敢牛牛是不怕困难的）·护肤（最近一阵子熬夜太严重了，要重视起来）,0,0,0,浙江,台州,浙江,中国
16,5013016253041693,今天比昨天离退休更近一天,2024-03-17 20:47:55,真好久没有这种边发言边声音颤抖的感觉了我操。。。。。。。。。。。 下午上课瞄了两眼文献而晚上被问到，教育于此形成了闭环啊我操 ,0,0,0,北京,,北京,中国
16,5012853201308121,国家图书馆,2024-03-17 10:00:00,#国图外文文献推介之“每日一书”#《直面挑战：从全球化视角论音乐教育》探讨了在过去的50年里“世界音乐”的兴起、民族音乐学的发展以及音乐教育中对文化多样性认知的不断提升所带来的多种实践与观念。作者辉伯·西博思根据自己30多年来亲身经历的不同程度的音乐教育，为致力于在文化多样性的环境下学习及教授音乐的专业人士提供了丰富的资料。作者以通俗易懂的方式将在“脱离语境下”学习和教授音乐的复杂性和潜在性展现出来，并且以感性和理性并存的方法发展出一种研究音乐多样性的合理模式，进而对如何将由此带来的观念转化为实践提出了简明的建议。今天为您推荐Facing the music : shaping music education from a global perspective，索取号2-2010\J6-4\S336，附详细馆藏链接网页链接,1,0,5,,北京,北京,中国
17,5012841092874625,期刊论文发表王老师,2024-03-17 09:11:53,《幸福家庭（万方）》 省级 万方  5000-5100字符/3版  现在收2024年3月刊，预计2024年7月初左右出刊。  摘要关键词参考文献不刊登  收录范围： 家庭教育、幼儿教育、青少年兴趣培养、劳动品德、文学与艺术、中小学体育，美术，音乐，语文，数学，英语研究生#职称评审#期刊论文发表#教师##小论文# 锦州·渤海大学,0,0,4,辽宁,锦州,辽宁,中国
17,5012664704827759,皮肤美容李远宏教授,2024-03-16 21:30:58,刚刚在飞机上一直看文献，隔壁姐姐摘下口罩请我端祥，然后问我：你是皮肤科医生？我为什么变这么老，原本皮肤可好了。🌸我解释道：主要怪阳光，是光老化。姐姐不以为然，本以为我至少会推荐护肤品，医美项目啥的…扭过头不说话了！看来防晒抗衰的教育需要大力宣传啊！,4,23,20,上海,,上海,中国
17,5012629888435120,桂小铭Penghao_Z,2024-03-16 19:12:38,写了一天教育学毕业论文“概念界定”这一部分才勉强写完。  找文献是最累的了争取明天写完绪论 ,0,1,0,湖北,武汉,湖北,中国
17,5012443594490117,社会大学教师杨杰,2024-03-16 06:52:22,社会大学之科研问题检索过程怎样才能进入北海幼儿园读书呢，北海幼儿园的招生简章有答案，怎么找到这个招生简章？我先到北海幼儿园找幼儿园的人问问。幼儿园的保安说：每年7月份，在校门口的公告栏张贴招生简章，或者你去教育局问问。参考文献《怎样做文献综述——六步走向成功》归纳总结：针对某个问题，先找到与问题有关对象（即研究对象），缩小检索范围（即指定某个收录文献的数据库或者书店），在该范围内找到不同的人（即研究者），然后了解每个人的工作内容（即研究者的研究方向），如果问题有关的对象与工作人员A的工作内容有关，那么A就是检索对象。向工作人员A寻求答案。在寻求答案时，查询工作人员A输出的答案被传播到哪些地方（即被哪些数据库收录），然后在这些地方收集答案（即收集文献），了解文献内容（粗读文献），保留对研究工作有帮助的文献。再熟悉文献内容（精读文献），保留对研究工作有帮助的文献。,0,0,0,贵州,贵阳,贵州,中国
17,5012295130290085,今天不想跑所以才去跑-,2024-03-15 21:02:26,一下回到解放前了，不想写文学方向的论文了（参考文献只有三四篇），去联系导师了，现在又从零开始了，连选题都没选 准备写教育方面的了 ,0,4,0,河南,信阳,河南,中国
17,5012201654456725,核心段编辑,2024-03-15 14:50:59,《上海企业》2024年8月，省级，月刊，知网，万方，维普收录，149页，5000字符/3版栏目：企业党建、品牌物语、经纶、公司治理、企业经营、企业管理、企业财税主要收企业和经济方向的文章，不要摘要，关键词，参考文献，《家长读本》G4，维普 5100字符3版起发收稿方向：家庭教育、新型教育、基础教育（幼儿、小学、初高中教育）《中国汽车市场》F 经济刊国家级，知网，纸质期刊2版3600字符《陶瓷》知网，3版4500字符，24年7-8月刊期收陶瓷相关，要求图、表、公式、案例必须有其中一项，不收景德镇陶瓷大学， 延迟两个月左右出刊《四川水泥》省级，知网，月刊，第1批学术，建筑专刊，3版5200字符25年1月刊期，次月出刊，可加急10月#大学生活##大学##独著##毕业论文#,0,0,0,河北,邯郸,河北,中国
17,5012143219146970,enieffakk,2024-03-15 10:58:46,我也试验过，然后有一次有一个工作上的问题我想偷懒让他给我写，他说：如果不是这个感兴趣你应该自己去读文献，气死我了，被ai教育了//@华丽电子羊://@810v-7707:转发微博,2,0,2,北京,北京,北京,中国
17,5011797502856648,追风少女恬不二,2024-03-14 12:05:02,与新学期撞个满怀，从做一个#有为青年# 开始。无纸化学习规划如何制定？华为教育中心来助力， 我们可以通过使用学习桌面，制定学习日程，让桌面学习效率up up up！此外，华为浏览器书签同步功能也能大大提高学习效率，课堂上用平板将网站、学习文献加入书签并同步其他设备，回来宿舍打开手机/电脑就能查阅，不同地方不同设备高效浏览，让学习更加高效。好的学习助手让学习更方便，大家开始实操起来吧~,2141,2352,14513,浙江,,浙江,中国
17,5011891931841547,教育学博士桐桐妈,2024-03-14 18:20:16,#生活随记##教育研究#地铁上查资料，让AI推荐几篇关于internationalization at home（在地国际化）的文献，系统给推送了8篇，结果看到一个熟悉的名字，开心一下哈，学人的成就感来的如此简单。 ,0,2,6,上海,上海,上海,中国
18,5011845400235067,花作新鲜的早晨,2024-03-14 15:15:22,真的要被自己蠢哭了。。。那些搞科研的人的脑子都是怎么长的。。。文献我看都看不懂。。。。。他们怎么写出来了。。。本人的思维还停留在应试教育阶段。。。 ,0,0,1,湖南,长沙,湖南,中国
18,5011834388088021,别扭的记忆,2024-03-14 14:31:36,#豫践青春我是主角##豫践豫强# 西柏坡西柏坡是中共中央最后一个农村指挥所，位于河北省石家庄市平山县迎宾路。这里保存了大量的革命文物和历史文献，如毛泽东、周恩来、朱德等领导人的故居和中央军委指挥所等。西柏坡不仅是红色旅游的热门景点，也是进行爱国主义教育和革命传统教育的理想场所。@河南教育 @豫教思语,0,1,1,河南,安阳,河南,中国
18,5011810078690988,湛卢师叔,2024-03-14 12:55:00,#中国革命史珍贵影像资料##爱国主义教育#   深切缅怀革命先烈！！ 人民英雄永垂不朽！！ 湛卢师叔的微博视频 ,2,2,6,浙江,金华,浙江,中国
18,5011806962322162,好运小宝qq,2024-03-14 12:42:37,我的好妈妈真的无时无刻不关注我的心理健康关于去大学讲课这件事我请教了我的老师他尖锐的分析了我在一众教授大咖之间尴尬的处境谈完后我倍感焦虑直接失眠 开始狂刷文献上午麻麻特地打电话告诉我，她觉得我老师说的不对，我完全可以另辟蹊径，从教育之外的视角去讲一些新的东西。她努力将我推出去，并且永远相信我可以做的很好,0,0,1,河北,保定,河北,中国
18,5011772505068595,charles9278,2024-03-14 10:25:42,真希望格致党能拿回一切的历史文献，按格致的精神重塑教育本真。//@墨者几何:考察历史之后才更加知道，现在中国的执政党其实就是明初时候的格致党，追求科技进步和国家富强基础上的社会大同，而不是儒家党，儒家根本就是社会大倒退，从国家社会回到宗法社会,0,0,1,广东,东莞,广东,中国
18,5011698654118146,少年们近冬时以茶泡脚,2024-03-14 05:32:15,在找关于拆那艺术教育市场方面的文献，试图证明为初高中生而设的艺术画室数量远大于为成人设计的，本来这方面的英文文献就少，好不容易找到那么几篇，都含有类似“如今西方文化在拆那的广泛传播为拆那自身的艺术发展带来了严重的危机”的言论，不是……这篇论文用英语的意义是？？真写进去还让不让人混啊请祖国放心，今日已成欧陆一只拆那战狼？,0,0,0,英国,,英国,英国
18,5011653274370273,南轩墨兮驻微办,2024-03-14 02:31:55,诶，听了一个很有趣的小故事，反映了日本佛教对本土肉祭的兼容。出自镰仓时代佛教文献《沙石集》。话说，有个僧侣路过琵琶湖，看见一位渔夫捕获了一条大鲤鱼，于是上前教育他不要杀生，渔夫就把这条大鲤鱼放生了。结果到了夜里，僧侣梦到这条大鲤鱼向他抱怨，说它本来被神明选中为牺牲，这样它就能得到解脱了，结果被他这个僧侣这么一干扰，好事泡汤了。。。,1,0,9,广东,广州,广东,中国
19,5011510214004648,生在九月的北方姑娘,2024-03-13 17:03:27,当我面对自己的年龄、同辈压力和经济压力等现实问题，我果断选择拒绝读博；可是，当我再次回顾自己过往所接受的种种教育、对比文献里所描绘的教育理想国，我又非常坚定地想要去读博，好像试图去改变什么，并且觉得自己能够改变什么，以对过往的自己聊以慰藉。最近，可以说这两年，我时常陷于这样一种纠结和困顿。#读博##碎碎念# 南充·西华师范大学(华凤校区)图书馆,0,5,7,四川,南充,四川,中国
19,5011434964518239,披发奔流,2024-03-13 12:04:26,领导教育说职业规划要做好哦，后面啷个打算想好没有。最近xxx方面的东西比较好发，你研究没有。我说我正在梳理文献准备资料，为下一步工作做铺垫。实际上我在看《秋水堂论金瓶梅》。 ,0,0,1,重庆,重庆,重庆,中国
