页码,微博id,微博作者,发布时间,微博内容,转发数,评论数,点赞数,发布于,ip属地_城市,ip属地_省份,ip属地_国家
2,5009009761326931,小源yuanyuan,2024-03-06 19:27:33,#团团日记# 吃完麦麦的新品突然想分享此刻美妙的心情我一直觉得自己不太适合搞学术 得出这个结论的原因是我非常不喜欢看论文以及写一些纯学术角度的论文 每次写我都会觉得脑袋空空 最终得出个结论或许我压根不太适合进行学术研究但人生中总有一些赶鸭子上架的事 比如我每一节课都有一些课程论文或小组pre 每次快到ddl的时候我都会非常之难受 更加验证自己对自己的看法 但最后又很神奇的都能在某一阶段冒出一些灵感 最后产出一片我自我认为还不错的paper 今天小组开会的时候 组员都是来自各地的法官 当我们各自阐述自己负责部分的结构以及内容的时候 我真的有一种考试的感觉 因为感觉面对的都是身经百战的专业人士 但看到我阐述自己观点他们在点头的时候 我感受到了被专业人士肯定的幸福 他们从事的都是我最向往的职业 在他们的注视下我完成了和想象中未来的自己的第一次交流 很神奇 我终于感受到了为什么有的人愿意花费很多时间在学术研究上 当你对案子有了自己的逻辑和想法的时候 你就有了这个世界上独一无二的产出 那种成就感是要比物质上的东西更直击心灵的 因为你永远不会失去它 它是永远不会消失的 我一直觉得在法律这条路上 实践带给我的冲击是比研究学术更大的 但实际上一切实践的基础是坚实的法律研究 虽然我觉得我还是不适合搞学术研究 有的时候还会觉得我读研究生读的太费劲了 但我在这短短的时间里悄悄体验了一下这种幸福感 留下了许多只有我自己和这个世界知道的一些浅显但努力的痕迹。,0,4,4,中国香港,,香港,中国
2,5008577268548879,荔枝新闻,2024-03-05 14:48:58,#委员建议内地增加一年制硕士# 3月4日下午，全国政协十四届二次会议在北京开幕。全国政协委员、香港岭南大学协理副校长刘智鹏在接受中新社采访时表示，建议内地增加一年制的硕士课程，以对应双需求。投票： #1年制硕士能保证学术研究吗# ？  网页链接 ,2,15,703,,南京,江苏,中国
2,5006643115589896,重生伊勇玉公主,2024-02-29 06:43:20,机缘巧合选到一个目前大热话题global south的课程，但是实在是完全没有任何sense。今天跟一姐chat完，越来越觉得自己作为一个恋旧➕学院派的电影爱好者自始自终都在看（研究）一些老掉牙的问题rp怎么想都是那些过时的研究项目…学术研究道阻且长 ,0,0,0,英国,,英国,英国
2,5005591997056047,新时代遇见好书,2024-02-26 09:06:34,#考研成绩#  【《北大公开课：北大才斋讲堂精华集》】北大才斋讲堂是北京大学研究生院主持开设的面向全校研究生的学科素养课程，邀请校内著名专家学者授课，他们结合自己的学术研究经验，分别从学科架构、学术素养、学科前瞻和学科应用研究等方面，解读学科奥妙，分享研究心得，提升研究生科学精神与学科素养，为同学们从事学术研究和职业发展提供参考和借鉴，促进创新型研究人才的培养和创新性研究成果的产出。 《北大公开课：北大才斋讲堂精华集》是从已出版的《北大才斋讲堂》系列学术演讲（第一辑至第三辑）的内容中精选而成的。主讲人分别是：楼宇烈、厉以宁、叶朗、陆俭明、陈平原、高松、王博、许智宏、柯杨、吴志攀等。本书集主讲人多年的学术研究心得，真知灼见频现，高瞻远瞩，深入浅出，引人入胜，特别适合大中院校的大学生、研究生、教师、学者等阅读。@北京大学出版社,0,0,1,,南宁,广西,中国
2,5003227273105704,英国教育官方微博,2024-02-19 20:30:00,#留英小课堂# 英国是英语的发源地之一，学生沉浸在纯正的英语环境中，可以提高语言能力，为未来的国际职业发展和学术研究做好准备。语言成绩还未达标的同学们，可以先就读英国的语言学校，在国际化的环境中提高英语水平，并以此为跳板进入梦校。如果你有去英国学习语言课程的打算，建议登录网页链接 accreditation/centres，查询并选择经过英国文化教育协会认证的语言学校，教学质量更有保障哦！,0,0,5,上海,上海,上海,中国
3,4994428156252293,Wenwenwin_,2024-01-26 13:45:27,每次做硕士课程的大作业都一次次加深自我认知：我绝对不是学术研究的这块料 ,0,2,0,江苏,南通,江苏,中国
3,4994148216868311,容大中政考研,2024-01-25 19:13:04,在课程的目标上，容大更希望授人以渔，无论是考研备考，还是撰写毕业论文抑或学术研究，教材阅读都是必不可少的。容大希望学员能够通过教材导读班，学会自主阅读教材及专著的能力，带着学员一页一页的领读，固然可以做到，但与教授阅读技巧相比，领读教材意义有限，且时间耗费上，远远偏离了本班次设立的初心，简而言之，这个班次入手不亏。而且，导读课免费，免费！点击下面的链接，了解更多#法考##法大考研#中国政法大学#五院四系考研部落# 开课通知 | 25法大考研教材导读班，免费听！,0,0,1,广东,珠海,广东,中国
3,4989094786761392,欧洲升学指导,2024-01-11 20:32:32,#爱尔兰留学# 想研读中国研究专业的宝看过来梅努斯大学开设有该专业！该专业旨在为已经在本科阶段有中国语言和文化背景的学生提供一个专门研究文化和文学分析领域的机会，特别强调在中国文化圈(中国大陆、台湾、香港和澳门)和中国与西方之间的冲突和交流。该课程向学生介绍学术研究、新思想和理论方法。旨在培养学生的学术、分析、创意、思考和表达能力，以培养他们对中国语言、文学和文化领域的兴趣和参与。录取要求：① 本科四年成绩均分75及以上，有中国研究相关领域背景。② 雅思总分6.5 （小分不低于6.0）#梅努斯大学#出国留学,0,0,0,四川,,四川,中国
3,4987083233428653,蔡雅奇刑法,2024-01-06 07:19:21,"民商法研一投稿，法考已过：时间快、课程少、存在感低、学术研究一无所获、空闲时间比较多。  #我发个微博,请留意.# ",13,35,81,北京,北京,北京,中国
3,4987090099504890,知白守黑行走投资乾坤,2024-01-06 07:46:38,阅读摘录：商务印书馆：2023年度商务印书馆获奖好书：《葛兆光讲义系列》本系列为葛兆光先生从教以来给学生们开授多门课程的讲义结集，均历其十多年之反复修订，其中既有关于古代中国文化、古代中国的经典，征引广博，不同于掇拾浮华；亦有关于学术研究的方法和思考，研思深厚，尤其有裨益于后学。★　“中国出版集团好书榜”2022年度榜★　春风悦读榜“66好书”★　2022年搜狐文化好书★　2022经济人读书会十大好书｜全球历史类《亚洲史的研究方法》★　第二十四届深圳读书月“年度十大好书”★　2022新京报年度阅读推荐★　深圳特区报主题书单★　“科研方法”主题书单《中国经典十种》★　研•书单∣“中华文明原典释读”主题书单★　研•书单｜癸卯冬至年选书单《古代中国文化讲义》★　研•书单｜新学期拓展阅读——“见识与审美”主题书单,0,0,0,陕西,西安,陕西,中国
4,4984292478026727,麻薯利奥,2023-12-29 14:29:53,毕业论文，综测，课程以外的乱七八糟的学分统计 这些东西都不如跟我好好补充一下考研考公考编找工作过程中遇到的信息差  毕竟不是谁都要去做学术研究，去做行政工作 ,0,0,0,浙江,杭州,浙江,中国
4,4983644764507680,横渡镇白溪村的横溪渡人,2023-12-27 19:36:06,我们读书吧#读书过眼录# 《学术研究方法与规范》作者张清民在教学过程中，发现一些学生虽然有志于学，却因不懂治学之道，读书、写作事倍功半，遂于文艺学专业研究生中开设“治学之道”课程，意在授人以渔，使学生了解、掌握学术研究的基本理念、方法、规范，使志于学者有规章可循，省摸索之苦。自2004年以降，不断增益、修改，成为目前这个样子。书中所讲的理念、方法、规范，都是学术研究中的通理常则；所取例证，也都是学术研究中的公例。,0,0,0,江苏,苏州,江苏,中国
4,4983575281142785,北京教育融媒体中心,2023-12-27 15:00:00,【《中国劳动教育发展报告（2023）》发布】日前，《中国劳动教育发展报告（2023）》发布会举行。该报告是中国劳动关系学院自2021年以来领衔推出的第三本劳动教育年度报告，全面呈现2022年中国劳动教育发展的整体面貌，包括政策概览、学术研究、课程建设、教材建设、实践基地、教师队伍建设、评价标准建设、中小学劳动教育特色实践、职业院校劳动教育特色实践、普通高等学校劳动教育特色实践等方面，并基于对发展现状的理性分析，展望劳动教育的未来发展前景。与之前两年的年度报告相比，本年度报告沿承既往风格，新增劳动教育教师队伍建设和劳动教育评价标准建设两章内容，另新增中小学、职业院校和普通高等学校三个群体的劳动教育特色实践，新增1949年以来中国劳动教育大事记。据介绍，年度报告编委会和编写团队首次聚合了教育行政部门、科研院所、普通高等学校、职业院校、中小学等各行各业的专业力量，多维度、全方位呈现了劳动教育领域的发展现状，勾勒了劳动教育的未来发展前景，并表示中国劳动关系学院愿意发挥团队、专业、平台优势，与大家携手共进、并肩前行，共同谱写劳动教育的美好明天。（来源：综合整理 责编：云淡风轻 主编：融融君）,0,0,0,,北京,北京,中国
4,4980358850283829,第二章介绍,2023-12-18 17:59:03,在写人机交互主题的课程作业的时候被同学说好适合做学术研究 啊啊啊啊 听着很性感 ,0,2,3,天津,天津,天津,中国
4,4978568253938369,课程图谱,2023-12-13 19:23:52,学术英语写作专项课程系列（Academic English: Writing Specialization）网页链接 ，这是Coursera上最受欢迎的英文写作课程系列，包含4个子课程和1个毕业项目课程，涵盖语法和标点符号用法，英语写作初步，英语写作高阶，学术研究论文写作，研究论文写作项目，感兴趣的同学可以关注： Transform Your Writing Skills-Prepare for college-level writing and research in just four courses. 网页链接,13,1,3,江苏,南京,江苏,中国
4,4974133064499917,MSO留学,2023-12-01 13:40:00,#MSO留学# 🇭🇰香港大学教育心理学社会科学硕士开放申请！📕 MSocSc Educational Psychology 教育心理学社会科学硕士✅课程简介：该项目旨在提供教育心理学的理论和实践方面的指导和培训。重点是学术研究和该领域的相关实践经验。特别关注中国文化和社会中的专业发展问题。✅学制：2年✅学费：171000港币/年✅专业方向：心理学✅申请要求：心理学背景，有教育工作经验优先✅语言要求：雅思6或托福80感兴趣的同学可以联系MSO留学小秘书哦~#香港硕士留学申请# #留学申请季#,0,0,0,,广州,广东,中国
5,4972959893030079,书影逐梦,2023-11-28 07:58:14,#青春剧为什么不拍研究生#读研期间，学业压力大主要是因为研究内容的深度和广度都比本科阶段要高，同时还需要承担更多的科研任务和学术研究。此外，研究生的课程设置和考试要求也相对较高，需要投入更多的时间和精力来学习和准备。另外，研究生的科研成果和学术表现也会对未来的职业发展产生重要影响，因此也会带来一定的压力。,1,6,5,福建,福州,福建,中国
5,4972021939183395,涛淼,2023-11-25 17:51:09,祝：李炯涛赴俄罗斯攻读博士学位一切平安，顺利！这是一个重要的里程碑，标志着你在学术道路上的努力和付出得到了认可。博士阶段将为你提供更多的学习和发展机会，让你能够在这个领域更加深入地研究。在这个新的阶段，祝愿你在博士课程中取得优异的成绩，顺利完成学术研究任务，并在未来的职业生涯中取得更大的成功。同时，也要照顾好自己，保持良好的生活习惯，保持身心健康。再次祝贺你，愿你未来的学术生涯充满希望和喜悦！,0,0,1,山东,青岛,山东,中国
5,4970934738884055,夢五季,2023-11-22 17:51:00,翻香港电影史这节课的ppt 做了120页（紧赶慢赶讲了10小时 感觉明年能做出200页来 愿意为了讲一节课去看十几本书 真觉得我读博都不一定能这么认真去做学术研究 就像我们有自信课程的质量高于内地80%的高校课堂吧 虽然永远在拖延和看不完书备不完课中拉扯 但我好幸运 好爱我的工作啊 ,0,4,6,新西兰,,新西兰,新西兰
5,4968278189410459,研究生申请田螺阿姨,2023-11-15 09:54:49,#香港留学##24fall##留学文书##留学##田螺阿姨侃侃而谈##香港大学# 香港大学翻译学申请开放！首次招生！📖项目介绍：翻译领域文学硕士（MAT）课程旨在培养学生从事笔译、口译、文案、编辑、语言教师和学术研究人员等职业，重点关注香港的笔译和口译市场及其独特的学术惯例融合了中国和西方研究的见解。翻译课程提供实践和学术培训，教授商业、法律、媒体和公共管理翻译技术，以及翻译的文化、语言和一般理论方面。口译课程侧重于会议和法律口译技能，这对于香港的私营和公共部门都至关重要。⏰申请时间：第一轮：2024年1月31日第二轮：2024年4月30日,0,0,0,重庆,重庆,重庆,中国
5,4966975882134557,军军考学帮,2023-11-11 19:39:55,25考研|美术考研三大专业方向&amp;白名单院校🎨🎨🎨美术考研专业选择三大方向🎨🎨🎨✨美术学（学硕）美术学学硕就是以学术研究为导向，偏重理论和研究，平常上课也是以理论课程为主，培养学生科研研究创新工作的能力和素质。研究方向一般划分为油画研究、国画研究、版画研究等(不同院校会有不同研究方向区分，有的院校没有划分研究方向)学硕一般考英语一，学制3年，学费比专硕便宜。学硕可以调剂到专硕，专硕不可以调剂到学硕。给大家说一下自己的考研经历，英语这块我主要是跟着高途考研的连俊霞老师学的，她讲的很细，逻辑很清晰，我觉得还不错的，我基础很差，需要停下来思考，然后回顾吸收。连俊霞的零基础语法，会将名词作为一节课讲完，冠词作为一节课讲完这种，一节课内容还是挺多的，干货也比较足。不能说是最好的，但我觉得算是更适合我的吧。✨美术（专硕）美术专业偏重实践性，学术型与职业性紧密结合，重视实践和应用。进行美术创作，进行美术技法研究等，属于艺术硕士。与美术学的分类十分相似，美术也分为油画研究(主要是油画创作研究)、国画研究书法方向、水彩创作方向等。专硕一般考英语二，学制2-3年，学费比学硕贵。✨学科教学（教育硕士）学科教学美术属于教育硕士，可以说这个专业是研究生里的“师范生”。学科美术偏重实践性、应用性，所学的内容是理论与实践的结合，主要是美术教育教学的知识。学制2年，一般不划分研究方向。❤️如果看完以上内容，大家还有什么想问的，可以往下看～25考研专业院校扣&quot;222&quot;考研资料扣&quot;333&quot;考研网课扣&quot;666&quot;关注私信：获取考研免费试听课❤️希望大家都能考研上岸！！！#考研##考研辅导##高途考研#,0,2,2,河南,新乡,河南,中国
5,4964300003214464,奶茶恶霸,2023-11-04 10:26:56,今天我们科开学术研究课程 请了两个大佬来教学 结果发现B大佬讲课的时候A大佬在疯狂打瞌睡 哈哈哈哈哈哈哈哈笑死咯原来打瞌睡的不止我一个呀 #小廖的打工日记# ,0,0,1,广东,深圳,广东,中国
5,4963789370294592,初心梦想启航,2023-11-03 00:37:51,西南交通大学希望学院秉承了西南交通大学的优良传统，注重学术研究和学科交叉融合学院为学生提供了丰富多样的课程择，满足不同学生的兴趣和需求 ,0,0,2,四川,成都,四川,中国
6,4962587815182933,谁在看我鸭,2023-10-30 17:03:18,刚写完入学后第一篇课程报告，感觉我玷污了学术研究 ,0,0,1,广东,珠海,广东,中国
6,4960504591682597,echo小茵茵,2023-10-24 23:05:19,昨天考完基础课程的实践考试，可能、大概、也许低空飘过，但也做好重考的准备。这几天在准备理论的考试，难度有点大，考试没有选择和判断题，全是问答题，还要画图和举例。GIC的课程比较偏理论和学术研究。可能考完基础课程，对重点宝石如红蓝宝石、海蓝宝、祖母绿、碧玺、珍珠、翡翠、橄榄石、石榴石等常见宝石有了解后，会考虑转课程吧。月底考完后再决定。这段时间去上课，都是老周在管牛牛了，看着他俩父慈子孝的，孩子没跑来和我投诉，说爸爸怎样怎样……人到中年，有了家庭，还能折腾点水花的前提，是有人帮忙带孩子和管孩子的学习啊。,0,7,17,广东,深圳,广东,中国
6,4958623384208881,金吉列留学西安,2023-10-19 18:30:04,"发布了头条文章：《2024年麦考林最新排名出炉!加本申请的风向标,最具参考价值的加拿大..》 麦考林大学排名公布了2024年加拿大大学排名，其中将大学们分为：医博类、综合类和基础类。医博类：可提供本科和研究生课程，可授予博士学位，有独立的医学院，以学术研究为主要教学目的；综合类：主要提供本科和研究生课程，学术教育与实践教学并重；基础类：主要提供本科课程。在这次排名中，麦考林根据五个领域进行排名，并为每个指标分配权重：学生（20%）、学院（20%）、学术引用（22%）、学生协助（18%）、声誉（20%）。出国留学  2024年麦考林最新排名出炉!加本申请的风向标,最具参考价值的加拿大..",18,0,0,陕西,西安,陕西,中国
6,4957449225242746,好滴呢1,2023-10-16 12:44:23,今天问导师有没有其他老师的课程推荐，帮助我快速入门。  老师说他对其他老师的课程不了解  不知道这是不是学术研究内卷的原因之一 ,0,0,0,江苏,南京,江苏,中国
6,4953878186690415,我嘀神呀,2023-10-06 16:14:21,万物都可PPTPPT（PowerPoint）是一种常用的演示文稿工具，可以用于制作各种类型的演示文稿，包括但不限于商务报告、学术研究、产品介绍、培训课程等。虽然PPT可以应用于各种场景，但并不是所有的内容都适合用PPT来表达。PPT适合用于展示重点信息、图表、图片、动画等可视化内容，以吸引观众的注意力并提供清晰的信息展示。然而，对于某些抽象概念、复杂理论或需要详细解释的内容，PPT可能并不是最合适的工具。总的来说，PPT是一个非常灵活和强大的工具，可以用来展示各种类型的内容，但在使用时需要根据具体情况进行判断，确保选择合适的方式来传达信息。,0,0,0,陕西,西安,陕西,中国
6,4953594614254191,EPlLOGUE_,2023-10-05 21:27:32,研究生退学大三写学术写作课程论文之前，在阳台上哭到喘不过气的时候，是不是以为自己只是普通的厌学呢？如果当时意识到那包含着对学术研究的抵触，可能后面就不会选择保研的路了吧。读研到底给我带来了什么？满足了低年级时的虚荣心吗？ ,0,1,2,湖北,武汉,湖北,中国
6,4953452042257165,香港理工大学PolyU,2023-10-05 12:01:00,【理大工商管理学院博士研究生招生宣讲会  來了！】#理大工商管理学院# 下设会计及金融学院、物流及航运学系和管理及市场学系，提供多个与商业领域相关的博士研究生广泛课程。这些PhD课程提供专业、系统的研究训练，为学术研究打下坚实的基础。想要读博的你一定有很多疑问，包括入学要求、博士 课程安排、研究方向、奖学金、毕业发展机会等等。这一次，理大工商管理学院的老师将来深圳 开招生宣讲会，解答这些你所关心的问题。欢迎有志学术研究的同学报名参加。【理大工商管理学院博士研究生招生宣讲会】日期: 2023年10月14日(星期六)时间：11:00 – 13:00 地点：深圳博林天瑞喜来登酒店招生方向: 会计与金融、可持续金融、物流与供应链管理、航空管理与经济、组织与战略管理、市场学、信息系统学历要求: 本科生、应/往届硕士生皆可报考报名链接：网页链接 查询：Marcus Wong (电邮：marcusw.wong@polyu.edu.hk)招生宣讲会费用全免招生宣讲会亮点• 与资深老师现场面对面 • 扩展交际网络 • 奖学金和资助 在招生宣讲会上，你不仅可以深入了解我们的博士研究生课程，更可与资深导师深入交流，探索研究潜力，发掘无限可能。#香港理工大学# #PolyU#,10,5,20,中国香港,,香港,中国
6,4951421746155215,文军社会学微观察,2023-09-29 21:33:20,为提升社会工作专业硕士的学术研究能力，本学期华东师范大学社会发展学院社会工作系将开展研究方法高水平前沿课程，邀请国内外优秀青年学者，围绕社会工作研究过程中的常用方法进行主题讲座。讲座向全国青年教师和学生开放。 第一讲我们特邀密歇根大学的张安翱博士来讲。张博士就职于美国密歇根大学社会工作学院，目前担任儿童及青少年血液肿瘤项目临床研究主任。长期从事学院和大学博士生课程统计方法课程的教学，包括基础社会统计方法、结构方程模型和荟萃分析等。欢迎对社会工作研究感兴趣的人士关注！,3,1,17,湖南,永州,湖南,中国
7,4950148344449746,大丰老季,2023-09-26 09:13:17,#调休不如适当增加和延长假期#现在有些教授的话已经不是话了，只能当屁一样处理。教授教好自己的专业课程，搞好本专业的学术研究，不要去专业外专门讲些行外话。搞出很多的笑柄。#苏大网# ,0,0,0,江苏,盐城,江苏,中国
7,4940414664574929,美少女申请工作室,2023-08-30 12:35:07,香港珠海学院2023新增的两个专业介绍🆕1.创意产业应用科技文学硕士课程（需要英语成绩/中文授课）创意产业应用科技文学硕士课程旨在为学生提供先进的跨媒体技术和丰富的学习经验，以应对香港及其他地区的学术研究和市场需求。2.艺创科技及数码传播文学硕士（需要英语成绩）「艺创科技与数码传播文学硕士」课程的核心是新世代艺术，特点是一个整合艺术与创新科技应用的跨学科、跨领域的深造课程。课程的理念是建基于「艺术即是传播 (Art is Communication) 」的实践，以培训新世代融合数字科技于各类型艺术创作、策展、创新整合及应用的人才。此课程是特别适合研究新媒体艺术和创新美学，或有志于从事数字艺术创作和跨领域应用的人士进修。⚠️⚠️⚠️全天在线,0,0,0,广东,深圳,广东,中国
7,4937907977062047,DJ周小畅,2023-08-23 14:34:26,如果您或您身边有离异、丧偶经历的亲友，拜托可以填写或者转发此问卷，为沈老师学术研究提供数据源。而且赠送的性别课程，我当年可是自费买的！,3,0,5,上海,,上海,中国
7,4936106137619706,牛津大学客座教授,2023-08-18 15:14:34,UBC大学，音乐艺术读个博，全家枫叶卡，加拿大，管弦乐器音乐艺术博士概述: DMA 课程专为在各自领域已经达到较高水平和艺术水平并且可能希望在大学任教的表演者而设计。该计划提供了一个将创意和表演成就提升到高水平的机会，同时通过学术研究丰富个人背景，包括音乐史和理论以及其他领域的专业培训。入学要求：1.硕士：B+2.雅思：6.5（小分6.0），托福：903. 所有申请人都需要GRE。4. 鼓励联系教职员工简历、官方成绩单、三封推荐信、兴趣声明-有时称为“意向声明”、“研究兴趣描述”或类似内容。官方英语考试成绩（如果需要）,0,0,0,荷兰,,荷兰,荷兰
8,4933715194548768,爱吃马铃薯条,2023-08-12 00:53:49,8.11 ✅GRE七个单词 ✅GRE写作课的基本课程 ✅GRE数学课 ✅GRE阅读课 1 ✅PS上完成一个学术研究 PS：收到g的投喂 开心🥳  找到了一些杀鸡的乐趣 ,0,0,0,山东,潍坊,山东,中国
