页码,微博id,微博作者,发布时间,微博内容,转发数,评论数,点赞数,发布于,ip属地_城市,ip属地_省份,ip属地_国家
30,5017233783521526,老江鉴股,2024-03-29 12:06:52,这一刻，美国把华为杀了的心都有！因为有消息显示，明年华为海思就要出PC芯片了，部署鸿蒙系统到PC，等到2025年，中国可能就要大规模更换PC与操作系统了，加上数据库、ERP、设计软件与各种行业软件，都已经在美国的封锁下快速成长起来，独立于西方以外的一套科技体系正在快速建立起来！这个消息如同一块炸弹，震动了整个科技界。而这一切的发展，其实并非一蹴而就，而是历经了诸多挫折、艰辛和牺牲才得以实现的。回首过去，我们可以看到，美国曾经为了逼迫华为低头，不惜联手加拿大，以莫须有的罪名将孟晚舟克扣近三年。这种霸权行径，不啻为国际社会的一大耻辱。但华为并没有因此屈服，反而更加顽强地挺了过来。华为董事长更是在悲痛之中，继续支持着公司的科研事业，为中国的科技进步贡献了巨大的力量。面对科研人才的流失，华为的领导层也曾倍感焦虑。但他们没有放弃，而是想尽办法留住了这些宝贵的人才。如今，华为的成就已经昭然若揭。鸿蒙系统在手机领域已经取得了巨大成功，现在更是向PC端发起了冲击。预计明年，中国的电脑操作系统将迎来一次大换血，届时，我们将迎来属于自己的科技时代。这一切的背后，是中国人民对于科技独立的追求。我们曾经长期依赖于美国的技术，这不仅让我们在经济上处于不利地位，还存在着国家安全的隐患。因此，我们迫切需要摆脱这种困境。华为站了出来，肩负起了科技创新的重任。在国家的支持下，他们不断投入资金和人力进行研发，最终研发出了海思系统，这是中国人自己研究、自己使用的系统。然而，美国并不乐见中国的科技进步。他们不顾一切地阻挠华为，试图扼杀中国的科技崛起。但是，中国人民有着顽强的韧性，华为更是如此。面对美国的封锁，华为并没有屈服，而是选择了自力更生。他们坚持不懈地进行芯片的研发、生产和试用，最终取得了鸿蒙系统的成功，并且顺利地生产出了之前被美国封锁的海思系统。这一系列的成就让美国感到震惊和愤怒。他们不顾国际贸易法规，公然对中国发起贸易战，并禁止中国芯片进入美国市场。然而，华为的成功却证明了中国的实力和韧性。我们终于拥有了属于自己的技术体系，这是一个具有历史意义的时刻。如今，我们的鸿蒙系统已经在各个IT领域取得了巨大成功，中国的科技力量正以前所未有的速度迅猛发展。而美国，也许会因为自己的狭隘和霸权而错失更多的机会。在这个时刻，让我们共同期待着中国科技的未来，期待着我们的国家更加强大、繁荣！#雷军投资千余家科研公司##A股##优质博文上热搜开放计划#,38,26,356,广东,韶关,广东,中国
30,5017597018378028,飘飘何所似5,2024-03-30 12:10:14,什么烂数据，烦死了，这科研谁爱搞谁搞 ,0,1,0,江苏,南京,江苏,中国
30,5017567408162693,太原发布,2024-03-30 10:12:35,#太原身边事# 3月28日，位于杏花岭区东沟村的仁源堂药业的技术人员正在进行试验数据采集。作为我省首批认定的“高新技术企业”，该公司与山西中医药大学建立科研合作伙伴关系，共同开发品牌药物。牛利敏 郝晨光 摄影报道 ,1,0,0,,太原,山西,中国
30,5017556858176998,邢说,2024-03-30 09:30:39,中国工程院院士张亚勤：无人驾驶安全性比人类驾驶安全性要高N倍 中国工程院院士、清华大学智能产业研究院院长张亚勤在博鳌亚洲论坛2024年年会期间举办的“AIGC改变世界”分论坛上表示，这些年他过半的时间都在开展无人驾驶、无人车相关的科研工作，通过收集分析在世界各地行驶的上千辆无人驾驶车数据，表明现在无人驾驶的安全性比人类驾驶安全性要高出N倍，N远远大于1。#院士称无人驾驶比人类驾驶安全性要高N倍# 邢说的微博视频,0,3,2,河北,,河北,中国
30,5017507354116301,摆烂C57,2024-03-30 06:13:57,被中伤了………………刷到有人说科研就是垃圾堆里挑数据 我哭了，真的哭了，一批垃圾数据，在里面挑一堆还能勉强说得过去的数据🚬🚬 ,0,0,0,瑞典,,瑞典,瑞典
30,5017373726477500,诚澜789,2024-03-29 21:22:57,有正在玩或者玩过剑网三的朋友可以帮忙填一下问卷 我是研究牲，目前搞的论文主题与游戏的历史人文传达有关，研究案例是剑网三，问卷报酬是三元（薅了导师的研究经费，须注册见数平台以便问卷收集完毕后统一发放报酬），承诺数据仅用于科研，求扩感谢#剑三##剑网3#剑网3剑三#剑网三# ,1,2,0,上海,上海,上海,中国
30,5017364722619571,岳岳岳越来越好,2024-03-29 20:47:11,研究生退学 为什么要读研啊，天天被说，我自己也知道我没有科研头脑，不是读书的料，还来找骂，周一一大早就被师姐指着鼻子骂完 周四又被老师说，今天周五又被师姐指着鼻子边教数据边骂一无是处，没有科研头脑，一天瞎忙，什么时候是个头啊，我只想干无脑的事啊 ,0,0,3,新疆,乌鲁木齐,新疆,中国
30,5017340012138073,空天信息,2024-03-29 19:08:59,【科技日报】研究人员构建我国灌溉用水变化估算模型科技日报讯 （记者陆成宽）记者3月26日获悉，中国科学院空天信息创新研究院（以下简称空天院）等单位的科研人员，构建了一种基于机器学习和遥感观测数据的全国尺度灌溉用水量估算模型，并基于该模型揭示了未来气候变化情景下我国灌溉用水的变化趋势和经济影响。结果表明，基于不同的温室气体排放情景，未来70年，我国约60%省份的灌溉用水量会增加，特别是西北和华北区域。相关研究成果近日发表于美国地球物理学会旗下期刊《未来地球》。灌溉农田约占全球耕地面积的20%，贡献了全球40%以上的粮食产量。我国的灌溉农田占全国耕地面积的一半以上。灌溉用水对作物生长和产量至关重要，尤其是在水资源短缺的地区，频繁的干旱和极端气温可能加剧灌溉用水的影响。“全球气候变化使粮食安全受到挑战。在这种背景下，准确估算灌溉用水变化对于制定最优水资源分配政策非常重要。”论文通讯作者、空天院研究员王树东指出。然而，现有的灌溉用水估算方法受到数据可用性和模型结构的约束，在全国尺度和未来气候变化情景下适用性差。此次，研究团队开发了一个基于机器学习的新模型，通过整合一系列高精度水文要素卫星遥感产品、气象驱动因子、经济统计数据和数值模型模拟，在数据驱动框架下估算了全国尺度的灌溉用水。新模型在估算灌溉用水方面表现出较高的准确性。11个农田站点的独立观测验证表明，模拟数据与实地观测数据具有显著相关性，新模型的准确率达到90%以上。研究发现，对比20世纪80年代至2010年的数据，全国灌溉用水到2050年预计最高将增加17.1%，因此带来的每年新增成本最高达到39.1亿美元；到2100年，全国灌溉用水预计最高将增加34.8%，每年新增成本最高达到65亿美元。研究结果突显了水资源可持续利用与管理的迫切性。王树东表示，这项研究提出了一种有效估算当前和未来灌溉用水的方法，它可应用于其他面临日益增长的灌溉需求的国家。该研究结果也可为农业用水政策制定和决策提供重要参考，有利于在气候变化和社会经济动态背景下指导水资源的可持续利用与管理。原文链接：网页链接,1,0,1,,北京,北京,中国
30,5017337696617171,可爱的樱花角色,2024-03-29 18:59:47,今天科研班上到一半，护长说带我去参加循证查房，不听不知道，一听惊呆我，本以为是走个流程，谁知道他们来真的，就从术后患者说了个手麻，开始了循证之路，听同届来的研究生朋友说，她和护长都是熬夜看那些英文文献做双人评价，全过程都清晰展示给我们了，甚至包括筛选后的数据库，除了总结证据，还调查了术后并发症发生率，和国外术后的做对比。。。。手术比较新，也真的是挺有意义，搞循证的研究生提了循证的意见，咱也不懂，但是吧我觉得总结出的证据仅用来写综述太可惜了，所以我私下建议她做随机对照实验咱就是说，不管质量咋样，就这临床科研思维还有执行力，我都服了这帮护士长，我轮的这俩科的也是，才思泉涌，跟护长聊一下午都够我搞半年,0,0,1,广东,深圳,广东,中国
31,5017226912989477,PETD亚洲善待导师组织,2024-03-29 11:39:33,老师晚上好，想问您一个跟老师做科研项目的问题。我在本科一直跟进的一个追踪研究的项目，现在它要开始收集数据，紧接着就分析数据然后写论文了，但由于毕业现在不能参加了，并且老师明确告诉我后续不需要继续参加，已经都交给学妹了（意思就是发论文也不会有我）。但是研究当中所有的内容都是我做的（每次开会老师会告诉我这个行不行，结束之后我继续完善修正这个项目的内容）。之前我看过一个帖子讲贡献、付出与回报的问题，说付出与回报没有任何关系，只有贡献才和回报有关。我认为我在这个项目中的贡献极大，但是没有相应的回报，所以我特别难过，但是我进行了积极的自我调节，觉得已经没关系了。但今天老师又来找我继续干活，我隐约感觉老师好像是想让我当免费劳动力，但我疑惑老师为什么不找那个学妹去干，同学说可能用我用着更顺手。我觉得我现在又要准备考研，又要做毕业论文，还要做免费劳动力。已经做四年劳动力了，现在真的很难受，所以直接跟老师说了“怎么不让学妹做呢？我后续不是不继续跟进了吗？”因为我还是本科生，不太了解学术圈的规矩。所以想问问各位老师，1.是不是只有参与论文写作和数据分析的人才能写到论文作者那一栏，做前期工作的人就不太行呢？2.上面回复老师的话会不会很不礼貌？3.各位老师有什么看法或者建议给我吗？这段文字可能有些语无伦次，希望各位老师见谅，谢谢老师！辛苦啦！,2,36,342,北京,,北京,中国
31,5017268684328045,带购鞍山帅儿子,2024-03-29 14:25:33,我怎么能买到一款 能跑科研数据 能跑剪辑特效 便携且无电量焦虑的本子呢 ,0,0,0,福建,福州,福建,中国
31,5017261902137716,itszilia,2024-03-29 13:58:36,每次问自己一万遍我真的适合科研吗 做了一个多月弄出来的数据那么差 之后三年可能会遇见无数次重头再来 zxd啊你能扛得住这么多次打击吗 ,0,1,2,江苏,南京,江苏,中国
31,5017258348253247,你若撒野我把酒奉陪0118,2024-03-29 13:44:29,前几天看段子说 他做的项目数据调查会得出，独身比结婚比生子幸福感高，根本不敢总结 我才意识到 这样的情况一定非常多 科研结果也不是一直说真话的 ,0,0,0,黑龙江,哈尔滨,黑龙江,中国
31,5017221193533711,艾艾艾艾啊啊,2024-03-29 11:16:51,做物理实验的时候都在感慨还好我专业不是搞科研的，要不就我这种随便篡改数据为非作歹的样子…… ,0,4,1,天津,,天津,中国
31,5016901526493590,复旦大学,2024-03-28 14:06:36,#旦夕学堂#  大数据时代📊 写作业、做科研都离不开数据🔍 数据不仅不可缺少，而且要权威🌐  你是不是有过不知道从哪找数据的困惑？ 收藏这份查找数据的网站与数据库清单 用对数据让你的学术成果更有说服力  （来源 | 复旦大学图书馆） ,13,2,19,上海,,上海,中国
31,5017216955189945,why星人,2024-03-29 11:00:00,北大教授乔晓春：数学不是科学，因为数学没有客观研究的对象，数学普遍适用于物理、化学、生物、经济等各种专业，这些学科都需要借助数学来进行数据整理归纳和分析，可见数学的地位非常重要，但数学不是科学。学数学的人可以到任何单位和部门去就业，但学科学的人只能去对应的科研单位工作，这也说明数学不是科学。#数学# #科学# #微博公开课# #why星人# why星人的微博视频,0,0,2,北京,北京,北京,中国
31,5017200901750969,玄黑宣叙调,2024-03-29 09:56:12,王者荣耀铠 新赛季铠全段位数据  省流：从第一天胜率看不出来有没有吃到装备红利 就一点蚊子腿变化 等等大手子科研  （图一27号数据 图二28号赛季第一天数据） ,0,1,3,美国,,美国,美国
31,5017031986381079,山西日报,2024-03-28 22:45:00,【历山保护区发现山西省鸟类新纪录——灰翅鸫】3月28日，记者从山西历山国家级自然保护区管理局获悉，近日该局与山西农大科研人员在整理生物多样性监测数据时发现，保护区西北部实验区与缓冲区交界处的红外相机于2023年6月9日晚拍摄到一种新鸟类。 @晋中发布 ,1,0,8,,太原,山西,中国
32,5017006891340367,露杉2025,2024-03-28 21:05:17,还有就是我感觉那些非底层出生的人，对底层老百姓的生活根本就不了解，他们就了解那些不知道有没有作假的数据。像那些起早贪黑为城市建设服务的人却居无定所，真正搞科研的人真正干活的人整天内卷，而那些狗屁关系户专家，娱乐圈二傻子，偷税漏税走私资本家天天住别墅。 ,0,0,0,浙江,台州,浙江,中国
32,5016989902833018,小鸟的多重宇宙,2024-03-28 19:57:47,灵感141号 Omega平静地说会陪Alpha去首都星，重新回到不堪的家族里。 Alpha不可置信地看着他，攥紧了自己的拳头。 明明Omega科研需要的所有数据都在偏远星系，为什么要为了他和他母亲再回到黑暗里？ “混蛋，那你的自尊呢？那我的自尊呢？” ,0,0,0,北京,,北京,中国
32,5016988445314514,克利夫兰诊所病理生理学教授,2024-03-28 19:51:59,"看收藏夹以为我是什么科研狂人，pubmed, 翻译，gpt国内版，geo数据库，web of science ，数据可视化平台，b站，GWAS数据库，TWAS分析平台，FUSION分析平台，Ensembl基因数据库，其实我只是记不住网址的懒狗 ",0,0,1,湖南,长沙,湖南,中国
32,5016988395767481,地藏占察科研派,2024-03-28 19:51:47,搞科研，需要的证据越多越好。百个样本一定比十个样本更令人信服。比如下文，作者为论证一个问题，博览群书，旁征博引。证据涉及植物学，化学，医学，佛经，外道，历史文献。大量堆数据/证据，已经能够令人信服。远比以讹传讹，随口一说强太多。研究底层逻辑也是这样，需要堆数据。越多越能服众。 ,0,0,1,湖北,襄阳,湖北,中国
32,5016966859589218,Coop留学日记,2024-03-28 18:26:13,如何选择靠谱的留学中介机构，需要推荐的可以按照下面格式发给我哪个城市的机构：东莞、南昌申请的国家：新加坡、法国申请什么项目：留学科研、双学位留学你的专业：管理、数据科学想了解的机构：AA留学、达伦哥有想找靠谱留学中介机构可以来问我!#香港留学##新加坡留学##留学申请攻略中介机构评价反馈#全国留学中介机构查询系统,0,1,0,四川,成都,四川,中国
32,5016961727074530,翟田田,2024-03-28 18:05:49,西方“科研机构”就是一些人口中的“权威”。看看这个：图是根据他们自己的数据出的，看着这图和数据你丫标题这么写真下得去笔？  这就是为什么我很难崇洋媚外，毕竟外网一翻开全是煞笔！哥脑仁儿疼 ,0,0,1,北京,,北京,中国
32,5016959751818780,白鹤少女下寒烟,2024-03-28 17:57:58,自动备份为什么会自己把删掉的数据找回来啊 画了一天的图，最后发现多了几个被试 得，一天白干 科研避坑之跑程序之前记得检查数据 ,0,2,0,甘肃,兰州,甘肃,中国
32,5016948712669721,嘿嘿吼哈哈嘿吼,2024-03-28 17:14:05,我真的好佩服所有搞科研的人 我收了要两个周的临床数据  我已经感觉内心崩溃了 ,0,2,0,陕西,西安,陕西,中国
32,5016841388559593,南京金刀客,2024-03-28 10:07:38,全球首次发现！Nature发表南大团队突破性成果。记得上次我发首位度的问题，有领导打电话给我说，南京的首位度在很多领域是看不到的。比如高校科研转化，落到江苏各地市的项目很多，这个没有数据可以体现。我说：这好像是首位度的反向指标吧？领导说：这是省会担当。评：南京的高校科研成果异地转化是好事，但这也正是提升首位度的理由，把南京方方面面都做大做强了，异地转化的数量和质量才会更上一个台阶，对吧！把灯泡做更好，才会照亮更多的地方！,1,36,99,江苏,南京,江苏,中国
33,5016919099048166,贪玩小孩要去伊萨卡,2024-03-28 15:16:25,陈星月最近在搞她的毕设。要不就是不回我消息，要不就是回了但是还是在说她的数据情况or毕设进展。一整个就是无应答AI的状态。我算是理解了，跟搞科研的人维持亲密关系的难处。ta的脑子只有ta的数据，根本没法完成正常的分享与互动。当然我很理解，也没有埋怨的意思，就是记录一下星月总近两天跟我对话的状态捏。,0,6,3,江苏,南京,江苏,中国
33,5016915556959197,笑笑的小嘻嘻_,2024-03-28 15:02:21,比论文数据清洗不出来更崩溃的是你的同门毕设论文已经写完了 大哥一天跑数据一天写论文  对于他这种科研奇才 我觉得应该就给他两天写毕设 把多出来的两个月匀给我这种小菜鸡好吗！！！！疯啦啊啊啊啊啊啊啊卷鼠我吧🤡 ,0,2,7,北京,,北京,中国
33,5016899433792529,爱吃不加芝麻酱的热干面,2024-03-28 13:58:17,导师在群里说他把别人的论文挂了 别人的实验技术比我们这边高级多了 别人的实验数据是我们的两倍 他也不看看自己这边是什么样嘛 鸡蛋里面挑骨头 就把别人挂了 自己要啥啥没有 科研从17年开始就没了 就只会在这种事情上来劲 ,0,0,1,广东,广州,广东,中国
33,5016861303112508,牛河梁到南海,2024-03-28 11:26:46,著名中医黑谭秦东，自爆已经进入肾衰阶段，是否真的有科研能力，就提现在对中医的态度上，你若要是什么事都相信那些跨国公司金钱浇灌出来的数据指南，对那些绚丽多彩的自然现象视而不见，对那些效果显著的个案熟视无睹，那么，就不要对自己成为跨国药企的劈柴而感到抱怨。 ,1,1,2,海南,海口,海南,中国
33,5016845140887746,SPSSAU,2024-03-28 10:22:33,2024统计建模大赛主题没思路？看看这篇文献2024统计建模大赛主题：大数据与人工智能时代的统计研究?统计建模没思路，去知网看看文献，如何判断选题可以落地，不会天马行空的? 很简单——去知网看是否有较多的文献，看你的选题的热度是否足够，你的方向是否是都研究过的，数据是否能够查询到。推荐篇关于大数据和人工智能的论文，可以帮助大家开扩一下思路。第一次参加统计建模的小白，不会编程不会用SPSS，用统计软件SPSSAU 就够了~点一点就能出结果，统计建模轻松拿下#spss##数据分析##统计建模##2024统计建模大赛##SPSSAU#科研学术期刊论文发表#大学生竞赛##研究生##毕业论文##论文发表#,0,0,1,北京,北京,北京,中国
33,5016824367809821,江苏大学,2024-03-28 09:00:00,#江大头条#江苏大学【20人！他们是2023中国高被引学者】近日，爱思唯尔（Elsevier）发布2023中国高被引学者（Highly Cited Chinese Researchers）榜单，以全球权威的引文与索引数据库Scopus作为科研成果统计来源，采用上海软科开发的方法，系统性地展示了中国科研领域的人才分布现状，精准呈现各机构、高校优势学科构成及学术影响力，以及在关键技术研究和各重点领域的顶尖人才2023中国高被引学者上榜共计5801人，来自496所高校、企业及科研机构，覆盖了教育部10个学科领域、84个一级学科江苏大学共有20名学者上榜,15,6,9,江苏,镇江,江苏,中国
33,5016824337139517,打勾作记号,2024-03-28 08:59:53,wos      人民日报数据库、读秀、国图、悟空科研 ,0,2,0,北京,北京,北京,中国
33,5016820163544954,地转平衡,2024-03-28 08:43:18,"#海洋研究进展##科研动态# 美国国家大气研究中心等最新研究：利用微观测评估中尺度搅拌模拟，发表在JPO (Assessing modelled mesoscale stirring using microscale observations  网页链接)我们根据从北大西洋示踪剂释放实验（NATRE）期间收集的微观结构数据得出的估计值，评估一组模型中中尺度搅拌的代表性。我们大量借鉴了 Ferrari and Polzin (2005, JPO)的近似温度差异收支框架……",0,0,0,广东,广州,广东,中国
33,5016815861763163,脑科学世界,2024-03-28 08:26:12,"brainnews #健康登顶计划# 2023年Elsevier中国高被引学者榜单【心理学】来源：幸福科学实验室2024年3月27日，爱思唯尔 (Elsevier) 重磅发布2023“中国高被引学者” (Highly Cited Chinese Researchers) 榜单。此榜单以全球权威的引文与索引数据库Scopus作为中国学者科研成果的统计来源，采用上海软科教育信息咨询有限公司开发的方法。爱思唯尔发布“中国高被引学者”榜单, 不仅致力于系统性地展示中国科研领域的人才分布现状，而且精准呈现各机构、高校优势学科构成及学术影响力，以及在关键技术研究和各重点领域的顶尖人才。2023“中国高被引学者”上榜共计5801人，来自496所高校、企业及科研机构，覆盖了教育部10个学科领域、84个一级学科。心理学学科共有来自北京师范大学（7人）、北京大学（4人）、中国科学院（3人）、清华大学（2人）、杭州师范大学（2人）、陕西师范大学（1人）、西南大学（1人）、上海交通大学（1人）、中南大学（1人）、淮北师范大学（1人）、华中师范大学（1人）、华南师范大学（1人）、中国人民大学（1人）、山东师范大学（1人）等14所高校或院所的27位学者入选。",2,1,4,浙江,温州,浙江,中国
33,5016761384567364,北极之光在南极,2024-03-28 04:49:44,每年毕业季研究生不作妖对导师来说真是喜大普奔的一件事情。如果是改论文需要吃降压💊，现在都不是什么太伤神的事情。不做科研、不写论文、在办公室和其他学生打架、告诉导师自己要一稿多投、答辩时威胁参加答辩的答辩组老师让自己通过答辩、发不了高影响因子的数据非要发高影响因子的期刊（导师劝说，控诉导师看不起自己）、电话、短信、社交软件联系不上、要死要活、在外面闹事得罪人让导师收拾烂摊子、在外面造谣惹事、莫名其妙让家长来找学校或导师闹，…现在有些⭕️太魔幻了,0,0,0,上海,,上海,中国
34,5016736270909532,我要开始胡说八道了大家,2024-03-28 03:09:56,被雷吵得睡不着开始疯狂清洗数据，初步整理完之后终于躺下脑子闪过一个idea，然后迅速爬起来开始翻以前的文献。很好，一个科研疯子就此诞生。 ,0,5,1,湖南,长沙,湖南,中国
34,5016680989725300,还有三年就毕业,2024-03-27 23:30:16,每次干完一个活之后就觉得自己真的是天才，科研界舍我其谁 然后过一会再打开刚刚干完的活，就能意识到又产生了一坨数字大便 而这些无用的数据垃圾将成为我对这个世界的唯一贡献 ,0,0,1,上海,上海,上海,中国
34,5016644944398702,今天请让我被抽中一次吧,2024-03-27 21:07:02,讨厌科研讨厌实验，讨厌这破数据啊啊啊啊啊 ,0,1,1,江苏,南京,江苏,中国
34,5016634704005877,越然娱上,2024-03-27 20:26:21,#套娃收费和操作复杂双治理效果显著# 双治理的持续推进，更让我们感觉到科研的力量，当然，行业的进步发展也让我们有了一个大的提升#2023中国网络视听12大数据发布# ,0,0,0,江西,南昌,江西,中国
34,5016629645935638,追星娱综,2024-03-27 20:06:15,#套娃收费和操作复杂双治理效果显著# 我们可真的是一个网络强国，隔着屏幕都能感受到科研人员的那一份用心和真诚#2023中国网络视听12大数据发布#咪咕放映厅的微博视频 ,0,0,0,江西,南昌,江西,中国
