页码,微博id,微博作者,发布时间,微博内容,转发数,评论数,点赞数,发布于,ip属地_城市,ip属地_省份,ip属地_国家
36,4992628711757474,-清海之衣-,2024-01-21 14:35:06,我写作确实喜欢预设一个类哲学的问题，而且我自己会给出一个答案。只是填充过程会让我感到痛苦，所以对我来说写作里最困难的环节不是如何开头如何结尾，而是如何完善中间的那个过程 ,0,0,1,陕西,渭南,陕西,中国
36,4992600992649324,分之道高效提分工具,2024-01-21 12:44:57,从小打基础，以后就不会写作困难了！#写作##大语文打基础##语文# ,0,1,1,江西,南昌,江西,中国
36,4992447291851860,秦算益,2024-01-21 02:34:12,读书+写作分享的模式，持续坚持下去，就会让一个人的影响力变得越来越大，刚开始可能会很困难会很慢，但写作就是这样，它是一个具有复利效应的活，你不知道你写的东西几年以后会不会有人看，就比如说我自己，四年前写的说说到现在还有人点赞。这条路，注定坚信，但为了积累影响力，我们必须迈过去。——秦算益,0,0,0,浙江,衢州,浙江,中国
36,4992386690458530,小琳子LemonMe,2024-01-20 22:33:24,没想到会有一天进入写作极其困难的状态 ,0,0,0,上海,上海,上海,中国
37,4992447324883505,阿益写故事,2024-01-21 02:34:20,读书+写作分享的模式，持续坚持下去，就会让一个人的影响力变得越来越大，刚开始可能会很困难会很慢，但写作就是这样，它是一个具有复利效应的活，你不知道你写的东西几年以后会不会有人看，就比如说我自己，四年前写的说说到现在还有人点赞。这条路，注定坚信，但为了积累影响力，我们必须迈过去。——秦算益,0,0,0,浙江,衢州,浙江,中国
37,4991920696983700,一心寸君,2024-01-19 15:41:41,寸君的独白 最近在读的一些文章很有意思，不约而同的都在讨论写作的困难。大略都是要有钱有闲，体验世界才有可能写出真正的好小说。最不济，也要体验过。当然，在讨论了这个前提之后，评论家们致力于谈论书写者如何定位自身到底是属于严肃文学的还是类型文学的。并分别对严肃文学写作和类型文学写作，以及追求融合严肃文学和类型文学写作的写作提出要求、理念和愿景。并对文学史上的两类作家进行不遗余力的分析。其中有不少观点和见地非常发人深省，值得思考。但当小说家聊到相同的话题时，基本态度只有一个——先写完它再说。,0,1,1,天津,,天津,中国
37,4991917381388832,跟着柚子学托福,2024-01-19 15:28:32,studywithme托福写作困难症的朋友们有福啦！柚子给大家找到了一本宝藏写作书籍！📚书名：《托福写作白皮书》✅适用人群：所有备考托福考生目录涵盖①托福写作考试内容介绍、②综合写作详解、③独立写作详解、④高分范文和⑤高分素材，特别适合第一次备考的托福小白🤗针对托福常考话题，书中精选了 3️⃣0️⃣篇范文，涵盖 8️⃣类热点话题，很适合大家模仿写作，快速掌握独立写作高分技巧针对不常考话题，书中介绍了“三招六式”扩思路法，让你能够在考场中举一反三，即使遇到冷门话题也不必担心无话可说、无据可用每篇范文后还有具体思路分析，并且整理了加分单词、词组和经典句型，让你快速掌握各种句型的写作思路————📚柚子已经把高清P.D.F整理好啦！🉑打印🉑导入手机，有需要的朋友们可以滴滴我~#托福##托福备考##托福写作##托福考试##留学生##留学##出国留学##24fall##25fall##studywithme#,0,0,4,湖南,长沙,湖南,中国
37,4991660818437381,小张努力搞钱_拒绝拖延版_,2024-01-18 22:29:02,为啥全世界就我写论文这么难啊 克服心理障碍和无限内耗的难度已经超过了写作本省的困难程度了 太痛苦了老铁 又一次被这篇垃圾打败了  ,0,0,2,甘肃,兰州,甘肃,中国
37,4991631047262291,潘北北,2024-01-18 20:30:43,最近几年，和数据打交道比较多。写作很少，随着微信好友越来越多，也甚少发朋友圈。好像提笔写作越来越困难，想到什么也很难一气呵成写下来，今年想要重新提笔，用文字记录生活。写作，是就某件事情，某个观点，归纳、总结、论证、阐述的过程，它可以动脑，使人专注自省，逻辑严谨。这是一件我喜欢，且会让我感觉快乐的事情。我没有把喜欢的事情当作职业，但可以做业余爱好。和运动、旅行、读书一样，可以终身坚持的事情。目标🎯20W字（看这就是职业特质，任何事情都数据化、可量化）,0,4,14,福建,厦门,福建,中国
38,4990627808807438,达拉斯er,2024-01-16 02:04:14,努力要求自己经常写点什么吧写点什么吧，写作可以自我救赎。可是我连写点什么都变得困难了。不知道这是为什么，不想说话，也没有语言文字可以组织。这注定又是一个不眠夜，对于人生我无数次怀疑他的意义。对于我，责任而已。不知道从什么时候开始，我逐渐离快乐越来越远。父亲生病，父亲去世，姐夫意外身亡，母亲生病，短短几年，我像被抽走了心。无处话凄凉。尽管是结发之妻，她要的是她期望的你。而你已千疮百孔。吵架，不，不能定义为吵架，我真矫情。意见不合她生气了，这么说。道歉，认错。也许是最好的解决方案，这比解释来的更加容易。如此这般生活，我还有什么心情去较那些对对错错的真。也许像我这样的人不配拥有吧。多么辛酸。我也曾经意气风发，我也曾经对未来充满希望，可如今我的内心只有孤独，令人窒息的孤独,0,0,0,山西,运城,山西,中国
38,4990582357753888,自信阳光快乐-eliauk,2024-01-15 23:03:36,当你写作遇到困难时 说明你正在进步 ,0,1,3,江西,吉安,江西,中国
38,4990032544798712,二二2二胡,2024-01-14 10:38:52,以前考试的时候，语文经常写不完。记得高考的时候，写到作文处只剩半小时。当我发现身边的同学都是提前大半个小时写完，我察觉到自己的与众不同。我称之为“写作困难症”，下笔如无神，写作文的时候简直是绞尽脑汁（字面意思）。“语言、文字是思想的基础。思想无法离开语言、文字而独立存在。”如此说来，我的思想也要出问题，千头万绪不知从何说起。“我思故我在。”如此再说来，我的存在也有了问题，我称之为“存在困难症”。也许，我应该多写多说，想到什么就写什么，不需要太多的逻辑，逐渐理清思绪，作为一种训练，一种治疗。,0,0,3,北京,,北京,中国
38,4989597383655659,暮流河,2024-01-13 05:49:41,迷宫饭我最喜欢的一话就是变形菇……迷宫饭剧情和设定展开的一大障碍是几乎所有人都在地下城里，想要不着痕迹的交代世界观人种等设定是十分困难的。但是借由变形菇这话，剧情十分有趣，又很轻巧地交代了背景设定，并且为玛露的心病铺垫……九井老师这一话真的写作水平非常高超…… ,0,0,0,美国,,美国,美国
38,4988961553124469,嬷法师-不写BE版,2024-01-11 11:43:07,我很难想象一个家庭并不算困难的双职工家庭会留房间给儿子，但是给女儿的是两张长条板凳。对，她的床就是一块板子，两条长条板凳。儿子的房间虽然简单，没做装修，但是配了电脑。女儿没有房间，平常两条板凳塞在桌子下面，晚上吃完了晚饭女儿就把板凳拼一下然后放好自己的被褥拉个帘子睡觉。写作业就在饭桌上写，油腻黑乎乎的桌布会把作业本弄脏，但是写出来的字都是娟秀漂亮。衣服样式都有点土，洗得发白，却干净整洁，稀疏发黄的头发用皮筋简单扎一个马尾，没有什么特别好看的头绳，皮筋就是黄色到底橡胶皮筋。这是我曾经的一个初中同学，跟随父母来这边打工，成绩很好，学习认真，不爱说话。看首页刷到没有自己房间的女孩子，忽然就想到了她，因为她问过我，席梦思是什么东西，我说是床垫，我家里都是这种床垫，天真年幼的我问了一个非常冒犯她的问题，我问她，你家里没有吗？好在她真的是个非常好的人，只是笑笑，没有回答我。直到我有次去她家才知道，原来她的床是两条板凳。后面也没有什么特别励志的经历，义务教育只有九年，无法涵盖高中甚至大学，所以初中上完以后她就回老家了，只能偶尔的翻翻她的QQ空间看看她的动态，有时会更新一点农村的日常，家里做的饭，还有一些拍的风景。直到看到她最新的一条动态，是晒得她的小孩，此后再也没有更新过。这个故事就到此结束了。,1,9,147,江苏,无锡,江苏,中国
38,4988933406721568,藉用白茅,2024-01-11 09:51:17,对自己发出灵魂拷问：你说你想写作，却也没怎么动笔了想觉醒，却也没怎么专注修行事务了我真的“想”吗？真的有贯彻自己真正的意愿吗？还是在虚耗光阴呢？为什么做不到？关注短期信息流、关注市场波动……关注各种杂七杂八的事情。为什么没有做自己真正想做的事情呢？路上太困难了吗？但明明做真正想做的事很开心啊。自己的内心，自己的行为，真的有把握好了吗？好好修行啊，我。,0,0,0,广东,深圳,广东,中国
38,4988392601291686,一只木子果,2024-01-09 22:02:19,同人cp日推#今天也在好好写作# 被欺负的老实人1/@13超粉老实人本是个alpha却被自己老板标记成了omega，对方仗着自己是个enigma胡作非为宿醉醒来的老实人委屈的缩成一团哭的泣不成声，嘴里唠叨着想回家，他现在他腿软的不在下🛏️都困难，后面还火辣辣的痛，肿胀着合不上，老实人抿着唇，泪汪汪的眼睛实在惹人爱，白皙的皮肤上没一块好地方，被弄得青一块紫一块，嘴角也不知怎么像是被磨破，老实人对昨晚没一点印象，只记得老板带自己应酬，他作为员工一直替老板挡9️⃣来着enigma抱着缩成一团的老实人，轻拍安慰着，本以为老实人会从了自己，却不曾想对方提出辞职，还保证不会把这件事说出去的enigma瞬间变了一副嘴脸，释放大量信息素压制着老实人enigma语气中透露着委屈，梨花带雨道“你个骗子，昨晚明明答应和我谈恋爱今天就要辞职走”昨晚的事硬生生说成是老实人的错，还说他是负心汉，睡了人就想跑老实人什么也不记得便信了他的话enigma把人连夜打包回了自己家，老实人本是公司的老新人三十了才入职，那晚过后他直接被enigma升职到贴身秘书，工资更是翻了好几倍，老实人虽很开心却也很累enigma总是把他压在办公桌上做些奇怪的事，还说这是“贴身”秘书该干的事，如果不从就扣工资老实人每天弄得屁股都疼疼的，身上还是各种乱七八糟的痕迹，这就算了enigma回家了还胡来，振振有词告诉老实人这是谈恋爱该做的，不能少老实人总觉得自己好窝囊，三十了被一个二十出头的小子压着，眼泪还总是忍不住流个不停可enigma有时也很好，单纯的老实人总是忍不住动心，帮老实人还了债又给他买了房子和车，老实人之所以年纪这么大才找到工作是因为早早辍学打工为死去的父亲还债，发了工资，大部分钱用来还债，只留一小部分钱，为了以后上学。快三十才攒够上学的钱，完成了学业最近enigma生意上的合作伙伴看上了老实人，他愿意让利五成换人，enigma气的和人打了一架，回家抱着老实人诉苦，最后把老实人摁在🛏️上才算消气enigma出差期间老实人发现自己怀了孕，什么饭也吃不下只有抱着enigma衣服才好些，但老实人却又那么一丝开心，想电话告诉enigma对方却怎么也不接，老实人便没在继续怕打扰到enigma还沉浸在喜悦中的老实人突然收到一封信，里面还有enigma和一个可爱男孩的合照【别傻了，他对你只是玩玩，你没权没背景无法帮助公司，早晚被抛弃】信得内容如晴天霹雳般，本在孕期的老实人肚子绞痛，泪如断了线的珍珠止不住的流，enigma的电话也打不通，无助感袭来，老实人瞬间觉得自己被骗了被标记成omega还揣了崽，现在才发现对方竟还有别人老实人准备打掉孩子，他预约了医生，可需要伴侣的签字，老实人无奈找到了自己的朋友alpha，alpha看着如今的老实人忍不住心疼，他抱了抱老实人却被enigma抓到，工作结束的enigma发现老实人给自己打了很多电话，便撂下工作赶回来，根据老实人手机上的定位找到这里enigma眼中含泪，委屈的扯过老实人“他……他是谁你说啊，为什么在这夫产科，你怀孕了？是他的”勿喷/连载,0,2,34,福建,三明,福建,中国
38,4988271559442595,水野千春,2024-01-09 14:01:19,很多时候，要把脑内无数翻涌不停的感想和思绪选择适当的语言传达，并且精准的描绘的恰到好处是一件困难的事情因为不容易，所以我也有严重的写作拖延症，具体表现为：看完书/电影/打完游戏卧槽牛逼，然后拿起笔来…好累啊怎么还要再从头理顺一遍逻辑/回忆剧情➡️我不如再开一部新的看看呢没错，我是会懒的，所以写感想这事儿只能我自己逼自己在感情最上头最激动最丰沛的时候马上写下来，一旦给自己缓冲期，怠惰就会控制我的大脑（所以我这样的人一定不能去写小说吧到时候挖一堆坑不填大概率会被很多人追着打到wb来罪过罪过）还有写长篇分析文的时候，既要注意对剧情描述的准确（不能误导读者），又要注意尽量客观不要过于感情化评价，还要对角色的心理和形象深度的解读和思考，最后再进行修改润色全过程仿佛做了个语文长篇阅读理解➕心理侧写……我是懒人我真的很懒懒到手指都不想点点屏幕同一个内容反复看会头痛所以脑子里想过了就等于写过了好的废话不多说咱们下一个越码字越觉得能坚持写长文的各位真的太勤勉了，不仅比我有文化还比我更坚持,0,0,22,江苏,无锡,江苏,中国
38,4988050578346758,墓犬,2024-01-08 23:23:14,哎呦真的是，求一些写电竞网游文的作者，不要在文里塞那么多英文专业术语，尤其是moba游戏的，不玩游戏的读者当然看着困难啦 建议选mmo，好歹职业清晰，moba一堆英雄角色，角色多就算了，作者还用角色绰号，更tm看不懂了 作者你gank、ban、adc、t用英文就算了，q技能能不能写作大招 ,0,0,2,广东,深圳,广东,中国
38,4987194990658469,咪咕视频,2024-01-06 14:43:26,#上咪咕看我们读书吧# 因为童年的一些困难，@笔名东西 老师通过阅读中的共鸣来排解，就好似一束光照亮了内心世界，是写作拯救了自己。 咪咕视频的微博视频 ,0,0,1,,北京,北京,中国
39,4987692380855095,寻枝001,2024-01-07 23:39:53,注定熬夜了死鬼作文 今天一天已经写两篇了 还有一篇没开始写 想又要想半天 写作困难户 ,0,0,0,广东,湛江,广东,中国
39,4987342869498715,小钟多睡觉,2024-01-07 00:31:03,忘记回报今天托福了哈哈哈哈哈 阅读24听力28 真的很惊喜 口语写作估计也还不差 100应该ok的 105可能就困难了 ,0,1,1,湖北,武汉,湖北,中国
39,4987153915838818,Agito-,2024-01-06 12:00:12,脑子里有构思了其实很想写出来，对我来说写作要最困难的一点就是要规避我没文化这件事，可是一旦要开始写作关于作者本人没文化这件事会很平铺直叙地表达在文字里，这让我下笔很艰难啊…… ,0,3,2,湖北,武汉,湖北,中国
39,4987108877404828,海上有鱼009,2024-01-06 09:01:15,在互联网大量输出你就可以变富了变富其实是一个体力活，写作其实也是一个体力活。我知道你听到这一句话，就不愿意了，什么意思，写作是一个体力活？你疯了吧？你叫我写一个字我都困难，这些完全死智商问题，你说是体力活。你叫我下楼去把一桶水搬上来，我可以搬十次八次，但是你叫我每天写一百个字，我就是头都想破，都写不出来。可是你没有写啊，如果你写了你就会发现其实100个字很简单那，一下子就写完了。如果你实在没得写了。就写最近的比较火热的嘛？最近《繁华》电视剧比较火，里面有一句话是“做生意先要学会输”。我们写作，我们在互联网写文章，我们就是要先学会输，先输三年五年，我们就是日日不断，每天都这也写，我们知道这个互联网很内卷，我们需要不断的输入，才能拥有更多的用户看我们的内容。我们是制作内容的，我们不是一上场，就是金光闪闪的，再说那些金光闪闪的，难道他们曾经一直都是金光闪闪吗？因为成长总是需要一个过程的，我们要成为一个专业的写作，这是我们的专业，我们就是要日日不断的去写。我知道很多人有写作的烦恼，我知道很多人说到写作就头疼，可问题是，你一点拥有写作这个技能，你将会是这个互联网的宠儿，你写的文章，每天有十几万人看，每天有几十万人看，其实你的文章，你的文字就是广告啊。你的粉丝，你的用户，你的信用，你的各种权威就是从文字里获取来的，哪天写作这件事成了，你就可以离开你打工的环境了，你就可以拥有更高的收入了，这些高收入，就可以给你带来了很多的幸福感。,0,0,1,广东,珠海,广东,中国
39,4986794841740861,一只木子果,2024-01-05 12:13:23,同人cp日推#今天也在好好写作# 信息素困难5文/@小楼每天睡不醒江不予抱着徐洛下车，徐洛整个人埋在他的颈窝里用舌头舔舐他的腺体。江不予走的每一步都很艰难，从后备箱拿了一件衣服出来披在他的头上遮住他。刚到家江不予就把徐洛扔到了床上，自己去厨房喝了一大杯冰水，冰水也解决不了他的火气。徐洛闻不到了茉莉花的味道，追着出来找他。江不予捏住他的下巴“再靠近就要挽回不了了。”徐洛脑子迷迷糊糊的，只能感受到茉莉花的味道，他现在只想贴近这份味道。“没关系，你好香。”徐洛硬凑上去，主动献上自己的吻。江不予也控制不出自己了，重重放下自己的水杯，搂着他的腰进了房间。两个人同时发情，徐洛比江不予先情绪，他还在懊悔自己怎么就被这茉莉花的味道诱惑了，还在痛恨自己不争气，结果背后的人又压了上来。“江不予不行，真的不行了，再继续的话，我要死了。”徐洛的手被扣在了身后，动弹不得。江不予根本听不到他在说什么。结束后都是一星期后的事情了，这期间徐洛都靠营养液撑着。刚结束的徐洛根本不能翻身，只能趴着，屁股痛的要命，江不予还在昏睡。徐洛侧过脑袋戳戳他的脸颊“茉莉花味的臭屁，这么折腾人。”徐洛心里已经把他翻来覆去骂了个遍了，没想到直接被抓住了手指。“少来，骗我是beta结果被我的信息素诱导。”江不予闭着眼睛说。徐洛心里有点微缩，毕竟他真的就是那个被信息素勾引的人，但是气势上不能输“你难道没有被诱导吗?”江不予也不说话了。“我有点饿了...”徐洛又伸手戳戳江不予，江不予没穿衣服，身上到处是他抓出来的痕迹。江不予安静了两秒，然后叹了一口气，睁开眼睛起身去给他点饭。背对着他穿衣服，背上的风景徐洛都不敢睁眼看。“你吃什么?”江不予扭头问他。徐洛噘噘嘴“炒饭就可以……”他现在可不敢要求啥，因为背上真的惨不忍睹，他自己屁股也疼。炒饭甚至都端到了床上给徐洛吃，江不予这人穷讲究，平时要是谁敢在他床上吃东西，喝水都不行。徐洛累的手抖，当着江不予的面饭粒都掉被子上了，江不予脸黑了一秒，就看见徐洛直接手抓掉的饭粒，塞回了自己嘴里。“我吃掉我吃掉!”徐洛嘿嘿笑着。江不予瞪大了自己眼睛“拉肚子我不管你了。”“嘿嘿。”徐洛讨好的笑着“不会的。”,0,2,8,福建,三明,福建,中国
39,4986062617444491,民商法汪华亮,2024-01-03 11:43:46,#公司法修订# 背法条、按套路写作，在法考中是有用的，但是在工作中困难重重。好多同学，写出来的法律文书干巴巴的，就几个法条和一个简单的三段论。大概就是刚才说的法考后遗症。因此，建议通过法考的朋友，能看一点理论专著，或者论文。我们在新公司法的实务课程中，也特别加入了“理论展开”。,4,5,31,江苏,南京,江苏,中国
40,4985908275970697,真真儿好可爱,2024-01-03 01:30:29,#公号摘要##陪哥哥学写作#  要把仿写这件事做好，需要几个条件：1、仿写的资料一定要接地气：很多名家散文文章很长，内容也比较深刻，孩子接受起来比较困难，那就选择相对初中生能接受的一些合刊或者是当代作家的一些文章。2、仿写资料一定要加工：不能拿一本书让孩子自己漫无目的地摘抄完仿写，最好是选择出彩的段落进行分析，比如可以从描写的角度——正面描写、侧面描写，人物描写、景物描写，从阅读分析的角度一举两得，分析这段话人物描写体现在哪里？语动心神外这些描写的好处有哪些，让孩子知道了好处再去引导。3、集中突破：最好就是寒暑假，因为仿写比较费时间，刚开始都得2个小时才憋出来，熟练后也得40多分钟，平日里本身事情就多，舍不得大量时间，也不容易聚精会神。4、有写有评：一个正向的反馈容易让事情坚持下去，所以不能仅仅是写，写后一定要有专业人士点评。5、坚持到底：一鼓作气，一个假期一定会有质的飞跃。,35,1,34,湖南,长沙,湖南,中国
40,4985155926103716,燼_Ess,2023-12-31 23:40:55,今年尝试了很多事情、克服了很多困难、得到了很多爱 明年的愿望是能更好的解决各种乱七八糟事情顺利handle一切然后有更多时间读书写作搞产品！ 加油加油加油！ ,0,7,19,江苏,常州,江苏,中国
40,4985313817267216,大雄作手,2024-01-01 10:08:19,词源倒倾三峡水，笔阵独扫千人军。  ——杜甫《醉歌行》  文思如瀑布般倾泻而下，犹如三峡之水倒流；笔锋所向，能独挡千军万马。这是形容诗人的文笔非常流畅，写作能力非常出色，可以独自面对各种挑战和困难。这句诗表达了诗人对才华和能力的自信，以及对写作的热爱和追求。 ,0,1,8,广东,揭阳,广东,中国
40,4985079316613408,东方之既白-_-,2023-12-31 18:36:30,#2024年第一条微博# 2024年是小时候写作文都没憧憬设想过的一年，现在马上到来了，希望赛博朋克幸运炫酷一点，别辜负期待！ 2023年是机遇与挑战并存，困难与希望同在，是不幸的更是有幸的，感谢在座各位贵人们的帮助支持和爱❤️ 希望2024年在平安的基础上锦上添花 希望各位贵人们大吉大利工作顺利 ,0,1,1,河北,唐山,河北,中国
40,4985030267115895,Ssssami__,2023-12-31 15:21:36,2023一直走在科研的路上 上课、调研、参会、写作 填满了我整整一年的生活 也依然遇到很多问题困难 亟待看到予人希冀的成果 希望在中欧开会看到的这一束光 如破晓的曙光照亮我的2024 能够温暖、充实、多彩、收获 ,0,0,0,山东,淄博,山东,中国
40,4984750473218279,用户7774636358,2023-12-30 20:49:48,恋爱两周年了，选择有困难可以咨询一下它#小易写作# ,0,1,0,北京,,北京,中国
40,4984409608422845,山川青空moleyang,2023-12-29 22:15:19,感觉我所选择（或我被选择）的学科正在磨灭我的创造力写作对我来说已经越来越是一件困难的事收拾东西的时候才想起来我十年前有如此强的表达力但是真正的阻力不是外在而是内在的已经太久没有自然流淌的文字这种阻力在这两年达到了前所未有的高度也许对些许论证感到满意但是已经在众多雷声大、雨点小的研究里迷失了自我我当然认可人文社科的价值，但总是很难看到打动人心的东西,0,0,0,英国,,英国,英国
41,4973871540999114,LotusEssay,2023-11-30 20:20:48,萨里大学Thesis/assignment写作困难？D我解忧 ,0,1,0,云南,昆明,云南,中国
41,4973819384564859,豆拉DorA_,2023-11-30 16:53:33,我写作最大的困难就是对话，因为说实话我根本不会正常和人聊天，我不知道有什么可说的。 ,0,0,1,四川,成都,四川,中国
41,4973510791529165,小芦要好好努力,2023-11-29 20:27:19,英语写作提升打卡第二天，一份耕耘一分收获，写作确实难但我有直面困难的勇气。#库课专升本打卡# @库课网校 #库课专升本# ,0,0,0,河南,三门峡,河南,中国
