页码,微博id,微博作者,发布时间,微博内容,转发数,评论数,点赞数,发布于,ip属地_城市,ip属地_省份,ip属地_国家
9,5022138710887494,商九之,2024-04-12 00:57:18,有时候真的觉得很离谱，我的考试恐惧完完全全就是刻在骨头里了。昨天晚上睡着了做梦，梦到高中把所有毕业生叫回去参加一场考试，考不过要收回高中毕业证。虽然在梦里但是我的大脑依旧在一瞬间完成了“没有高中毕业证会不会撤销大学毕业证➡️撤销大学毕业证会不会没有工作”的思考，于是在没有任何准备也不知道考什么的情况下我立刻动身去参加这场考试，就像我面对的一场场考试一样。然而在到达学校之后却发现要在考前经过好几轮测试。我在最后一轮的考前性格评估那一栏直接被打了不合格而不允许参加考试。后面的评估老师帮我求情说让我重做一遍，我一边看表发现时间来不及重做一遍再去考试，一边大脑飞速思考要怎么填写才能避开刚刚那个老师点出来的我不合格的性格点。最终梦里以我无所不用其极地想让评估通过让我去考试的失败而告终。梦里后面又来了下一批考试的毕业生，而我最终也没有赶上那场考试。醒了之后只感觉心悸和恐惧。我没能完成那场重要的考试。而我已经不止一次在梦里没有完成或者考过重要的考试了。,0,0,0,天津,,天津,中国
9,5022133270873056,pleasedontdisturbme_,2024-04-12 00:35:41,对不起 我有考试恐惧症 一听到考试我就会很焦虑 心跳很快 想很多 感觉很窒息….因为我接受不了自己考差…. ,0,0,0,广东,佛山,广东,中国
9,5022129995910179,1uuuix,2024-04-12 00:22:40,我的所有恐惧害怕能量都消失我一定会心想事成开心快乐通过所有的考试 ,0,1,0,上海,,上海,中国
9,5022118838277467,送煤气关你西红柿,2024-04-11 23:38:20,#她被困在考研考编里的五年#大学毕业后受大环境的影响 越来越把自己局限在一个考编考证的圈子里 从原来活泼阳光到焦虑躲在被窝里哭 甚至感觉自己性格也变得偏执起来 爱和周围人比较 陷入自我否定 焦虑不安 恐惧起了考试 没有了兴趣爱好也不化妆打扮 整天蓬头垢面邋里邋遢 自己也快不认识自己了 我应该学着去享受一下生活了 稍微放慢下脚步可能会事半功倍呢 明知未来的路会很艰难但是关此时此刻什么事呢 去旅游去刷剧去和不同圈子的朋友聊天去体验不曾涉猎的领域 为什么天天要内耗自己呢 开心最重要！ 制造焦虑的退退退！,0,1,0,河北,张家口,河北,中国
10,5022066157557476,-looois-,2024-04-11 20:09:00,很开心 考试之前给自己一个放松的机会 定了一个酒店 脱离一下让自己恐惧的噪音环境 不要再考试之前影响自己的情绪 吃了好吃的东西 到处逛了逛 看看车水马龙 虽然这些钱其实都不应该花的 但是。让自己快乐快乐这才叫做意义 钱可以再赚，但是开心却很难 ,0,0,0,安徽,合肥,安徽,中国
10,5022054204311560,BReaTHingIsLe_,2024-04-11 19:21:30,晚风中的香味令人紧张，可以从中望见数个期待和女孩见面的时刻。那种洗漱打理后，头发还没干透的潮湿，像考试前似乎要被审判的恐惧和激动，以及什么也没有留下的怅然若失。 ,0,6,7,中国香港,,香港,中国
10,5022049533690413,张猫是只李华猫,2024-04-11 19:02:56,看到这条，说个心酸的：我从小就进入应试的内卷体系，天天担惊受怕，怕考试，怕老师，怕考不好家长签字。后来大了，怕论文，怕期末，怕毕不了业……最后这几年才知道，原来人活着不需要焦虑和恐惧的啊，我还以为人活着就会焦虑恐惧呢。,0,0,0,天津,,天津,中国
10,5022008633459766,gogofree-,2024-04-11 16:20:25,因为外婆去世又回到老家奔丧 意外地又获得了两天假期 在山里晒太阳 大家都聚在一起热热闹闹都送老人最后一程 在外婆旁边做着考试题 就算放着锣鼓声我也觉得很安宁平静 再也不是小时候面对死亡的恐惧 竟然觉得此刻像是按了两天的暂停键 感觉好幸福 ,0,0,3,四川,资阳,四川,中国
10,5022000185606701,因风游,2024-04-11 15:46:51,我得了写作恐惧症，从很早之前就已经罹患这种病症了，初中高中的时候因为不想写作文，宁愿测验考试的分数少了一大部分分数我也不想勉强自己写作文，我会为自己交空白试卷而感到些许无力的骄傲，好像在这一瞬间我能稍微地掌握了自己的人生 ,0,0,0,广东,江门,广东,中国
10,5021960353090278,Hannahx_y,2024-04-11 13:08:34,讨厌考试 讨厌一个人 讨厌未知的恐惧🥲 ,0,0,1,陕西,西安,陕西,中国
10,5021959494570727,教师资格证备考资源,2024-04-11 13:05:10,【题号1210】知识点归类：教心类&gt;辅导方法&gt; 让患者自我放松，减轻焦虑、恐惧，用放松反应代替焦虑反应.通过练习消除恐惧和焦虑的做法即为( )。  A.深入共感法  B.系统脱敏法  C.行为契约法  D.模仿学习法 #教师资格证笔试##教师资格证考试#  网页链接 ,0,1,0,上海,,上海,中国
10,5021933122620290,约法三张的小张,2024-04-11 11:20:22,太好笑了，考研法考四六级这些考试我虽然不说准备得多完美，但是80%的程度是有的，雅思这次我真的是想都不敢想，都不敢回想我之前几个月干了什么，太水了真的哈哈哈哈哈后天还能活着出考场吗救命啊，我第一次知道什么叫恐惧😨 ,0,1,4,四川,成都,四川,中国
10,5021932817483915,7Duloxetine-29,2024-04-11 11:19:09,昨天梦见作业没写被老师当堂大声训 还是感觉好恐怖 可能我还是恐惧考试吧 ,0,0,0,湖北,武汉,湖北,中国
11,5021926034769240,iceQu-u,2024-04-11 10:52:12,还是一考试就心慌的毛病 上学时期被考试支配的恐惧已经形成了身体记忆 ,0,3,0,重庆,重庆,重庆,中国
11,5021771275438078,Meme_肥,2024-04-11 00:37:15,两门考试烦人。考完就去沈阳更烦人。烦上加烦。感觉自己🈶未知恐惧症。总是给自己设想出糟糕的未知。去沈阳后感觉自己就类似插班生。无助➕恐惧➕逃离感爆炸。或许有没有一种可能是我预想的太糟糕。现实应该就是顺其自然。不必为没有发生的事情担忧。想起了老爸经常说的船到桥头自然直。车到山前必有路。改变不了的东西就只能改变自己去接受咯。P1愁人的考试之一。P2心情down到爆炸怒吃🍗*2➕🍪*2。不就是两年吗。没关系。姐可以的。,0,12,2,北京,北京,北京,中国
11,5021770015048450,慌慌脏张,2024-04-11 00:32:14,明明备课了，但还是心里没底觉得教的不好，第一次对上课产生了恐惧 图(老师，我那天考试心情不好，所以把卷子撕了，后面我又粘回来了，感动吧) Like 心态已崩的我，努力的复原 ,0,2,5,福建,宁德,福建,中国
11,5021753596444758,青帳缱诗眠,2024-04-10 23:26:59,我知道，你肯定在恐惧一些什么，是的好像躲起来比较安全，不想把自己又置于那种自责的境地，类似：为什么又来自我为难了，不让自己好过一点？为什么不愿意早给自己点儿“本可以”时间，然后事到临头后又温温吞吞开始。最后一刻自我催眠说：或许也没那么重要，就当体验了…自从初中以后，我对考试的心跳就变成了半截入土状态。是那种明明可以活过去，而早早选择了弃疗，安静等待那一天宣布死讯——心如平澜。然后，等到那天来了，到了考场上，当听力题匪气腾腾地在我耳朵里刀剑戟乒乓时，我的血嗖的一下，顶上脑门，当即痛恨手里的长矛不能一笔刺穿这些A兵B卒，在乌泱泱的阵围里，杀出一条血路…骂骂咧咧恨粮草不足，兵马羸弱，然后就发现了：考场上，你生龙活虎的痊愈了,0,1,0,山东,青岛,山东,中国
11,5021740860705870,-du111,2024-04-10 22:36:23,好像得了…那个…考试恐惧症 考前紧张、情绪波动、怕考不好、怕丢脸 考后更挫败，无法面对… ,0,0,0,广东,阳江,广东,中国
11,5021677405341646,转生成为电子_725,2024-04-10 18:24:14,那一天，我终于回想起，被建筑设计支配的恐惧。 （开始准备c2考试 ,0,0,0,广东,佛山,广东,中国
12,5021592406721031,我是铁树会开花,2024-04-10 12:46:29,要命了要命了要命了要命了真的恐惧考试啊 ,0,0,0,湖北,黄冈,湖北,中国
12,5021580743410270,努力养呆狐,2024-04-10 12:00:08,创造性的培养： 1）创设有利于创造性产生的适宜环境。 ①创设宽松的心理环境。 ②给学生留有充分选择的余地。 ③改革考试制度与考试内容。 2）注重创造性个性的塑造。 ①保护好奇心。 ②解除个体对答错问题的恐惧心理。 ③鼓励独立性和创新精神。 ④重视非逻辑思维。 ⑤给学生提供具有创造性的榜样。 3）开设培养创造性的课程，进行创造性思维训练。,0,32,19,福建,福州,福建,中国
12,5021558994899059,若木晚成,2024-04-10 10:33:43,（直面恐惧  2024河南省考成绩 很差（行测44，申论61） 但是第一次没有很难过 就是自嘲式的平静 然后疯狂准备下一个考试 ,0,16,7,河南,济源,河南,中国
12,5021542012163027,_干卿何事_,2024-04-10 09:26:14,感觉自己已经陷入了对考试的恐惧 ,0,0,0,河南,南阳,河南,中国
12,5021536534135398,这泼天的富贵该轮到我了69,2024-04-10 09:04:28,被作业支配的恐惧  谁懂啊毕业好几年了，梦到做作业惊醒了，前段时间有个考试最后一题没写完，今早就梦到写作业没写完，一着急就醒了 ,0,1,0,广西,河池,广西,中国
12,5021402858520962,没事吃个螺蛳粉,2024-04-10 00:13:17,小学的时候没戴红领巾认为这辈子就要完了初中考试没考好 认为考不上高中就完了高中的时候又认为考不上大学就完了可现在 面对着未知分数的恐惧 我害怕 我开始怕我这个人这辈子是不是又要完了路的尽头到底是什么 我开始犹豫如果分数不理想 是继续上学读书出去看世界 还是毕业工作养活自己 可能选择某一条路在未来某一天会想 当初我为什么不选择另一条路可是 究竟什么才是对的 有时候我们自己要接受的苦任何人任何选择都避免不了,0,1,0,山东,济南,山东,中国
12,5021397871494014,Plutory_,2024-04-09 23:53:28,对于读研的恐惧让我犹豫要不要现在立刻马上去报xjxq 的考试！！！ ,0,2,0,湖南,长沙,湖南,中国
12,5021385808153225,此鑫安处是吾乡,2024-04-09 23:05:32,安全感从来不是别人给予你的保障，而是你放下了不安的条件反射:恐惧，焦虑，失望，痛苦，挫败，等等都是你在压榨自己。 当你放下所有的期待，自己努力“保护”自己的时候，所有的美好才会不期而遇。  #研究生考试##人生感悟# ,0,0,0,北京,北京,北京,中国
12,5021348286435871,黄油乳酪蛋糕挞,2024-04-09 20:36:26,一堆ddl要赶 还有各种各样的汇报、考试 喜欢的老师去休产假了，换的老师一来就让我想到了大一被她支配的恐惧😱 但是还是要祝愿温柔的晴老师生产顺利 ,0,1,0,北京,北京,北京,中国
12,5021331200675240,月球日_,2024-04-09 19:28:33,我真太害怕了 我觉得对考试时候肚子疼的恐惧 超越了 我对考试的恐惧 ,0,1,2,福建,厦门,福建,中国
13,5021087153258890,丫老师_,2024-04-09 03:18:47,小红薯刷到脱产三战的，心理素质好强，我是个完全不抗压的人，考完一次研已经对考试产生了抵触和恐惧的心理，一想到余生都是漫长的考试，突然开悟了活着的意义，做一天和尚撞一天钟吧，生命的意义好像就是没有意义。毕业一年不到，曾经的执着热情、少年心气，都化为尘灰随风飘散了，二十四的年纪站在人生的十字路口，却两手空空。多么叫人伤心的人生真相啊，我备考期间读的那些充斥着忧愁伤感、失意落寞情绪的现代诗，现在竟然奇迹地在我身上复活了。熬过寒冷的冬天，穿越厚重的风雪，我才发现这个春天并没有发生奇迹，依然那么冻人。,0,0,1,江苏,淮安,江苏,中国
13,5021065539748837,_青山糯糯,2024-04-09 01:52:54,现在是凌晨1：38分，很遗憾我还没有入睡。不知道为什么专升本考试后的所有情绪都积攒到了这里，我对模糊的未来充满恐惧。突然意识到自己再也不是之前那个无忧无虑的少年了，是时候要向那充满恐惧的未来迈出第一步了。从始至终我觉得我是一个勇敢的人，可当我真正去面对这个现实时，现实却狠狠地给了我一耳光。让我再次退缩，甚至想要逃脱现实。我不知道未来是怎样的，是充满鲜花？还是一路粪土？,0,0,1,河南,焦作,河南,中国
13,5021050937279933,Long-Cnc,2024-04-09 00:54:53,突然超级迷茫 对于未来的恐惧 为什么一定要考试啊啊啊 ,0,1,0,江西,萍乡,江西,中国
13,5021030966625160,夏幽星,2024-04-08 23:35:31,做人不能眼高手低，能力配不上野心当然内耗。  先提升自己的能力和能量（专业技能+人格水平），自然就会升级，不升级还有人请你升级。  而大多数人都是实力不够，又被欲望和生存恐惧推动，所以狂卷变成考试机器人，结果人格水平配不上职位，就会发疯。 ,0,3,0,上海,,上海,中国
13,5021006655390834,真香鸭Ya,2024-04-08 21:58:55,明天考数学 放学回家做了三道数学题 现在对于数学考试真的是有点小恐惧 希望我不要一拿到卷子就两眼一黑看一个一个不会(&gt;﹏&lt;)希望能拿到基础分💪 ,0,2,0,辽宁,营口,辽宁,中国
13,5020929337328883,开心小狗-_-,2024-04-08 16:51:41,我真的崩溃了  我还记得上学期被两个月考试支配的恐惧 啊啊啊啊啊啊啊啊啊我要疯啦我要疯啦我要疯啦我要疯啦 ,0,0,1,云南,昆明,云南,中国
13,5020928834277179,rain疗愈,2024-04-08 16:49:41,有时候在梦里，梦到自己得了绝症或者快被水淹死了，或者是考试时间到了，还有好多题没做，在极度恐惧和焦虑的时候，突然醒来，发现原来只是一场梦，那种欣慰感瞬间就爆棚了。有没有可能，每个人在死去的时候也是这样呢？慢慢的气息越来越弱，随着最后一口气的呼出，心脏停止，灵魂突然觉醒，发现在人间的一切都是大梦一场，呵呵一笑了之，徒留梦里的亲人们悲痛欲绝。清明节回了老家一趟，在老家的两天除了去祭祖，剩下的时间都在跟亲人吃饭聊天，就感觉我之前在城里的日子很虚幻。两天后又回到了城里，又感觉那两天在老家的日子像是梦一场。诚如大师们所言，我们能拥有的只有当下这一刻啊！,0,0,1,山东,青岛,山东,中国
13,5020927105959672,重生之我是玮行摆之猪,2024-04-08 16:42:49,因为考试失败次数太多了反而恐惧考试 但是一想到参加考试以后就可以光明正大找狗肠黏黏（黄焖鸡米饭.jpg），就没那么恐惧了 ,0,8,3,江西,萍乡,江西,中国
13,5020891874856089,Dejavubkp,2024-04-08 14:22:49,#小雪生的工作本# 被考试支配的恐惧又来了😭 ,0,2,0,山东,潍坊,山东,中国
14,5021133847397588,小狗别不开心,2024-04-09 06:24:20,妈妈 我有考试恐惧症... ,0,0,0,上海,,上海,中国
14,5021089465893281,小公举gloom,2024-04-09 03:27:59,最近最大的感悟 就是看到身边很多年龄相仿的人 无论是熟悉的亲戚朋友 还是在外面遇到的人 仿佛都笼罩在“没考上”的氤氲当中 对未知的迷茫和恐惧 考上了，总归是喜悦的 喜悦地奔向下一片荆棘 没考上，在原地打转 望着别人的背影 望着黑漆漆的天空 望着自己 #考试# ,0,2,0,江西,赣州,江西,中国
15,5020976486023928,yy公主依旧坚强乐观,2024-04-08 19:59:02,内耗的第三千六十八秒 我真的要疯了 这周六有个考试 好歹花了一百块钱 但是去了我最多也就当个分母 我真的已经很累了 我讨厌挤地铁 坐车 甚至因为上周的事情我现在恐惧一个人出门我只是心疼我的一百块钱  让我的原本不富裕的生活雪上加霜 让我离抑郁又进了一步 ,0,2,1,河南,郑州,河南,中国
15,5020823509532839,我只想和你见面,2024-04-08 09:51:09,2024.4.8我又逃避了考试 听到一模 我满心的恐惧 去年就是因为一模开始崩溃 我貌似逃不出恐惧这个关卡 我永远想逃避 我总觉得经历大考注定换来失败 我便一次又一次的 控制不住的 流泪 发抖 心慌 走廊里打电话给妈妈道歉 我是真的没有勇气考下去 我确实是个胆小鬼 我为什么要复读呢 为什么要经历这么多次的失败呢 我装了好多书 塞满了行李箱 回家上一对一 好重 从学校出来后 前面走着三个家庭妇女 都背着书包 里面装的应该是刚从市场买回来的东西 手上提着鸡蛋和青菜 她们聊着给家里新添置的东西 聊着怎么给孩子做营养还好吃的黄瓜 聊着阳台晾的衣服刮风差点刮跑 我想这或许是她们的一辈子 也同样是我妈妈的一辈子 这不是我期待的注定作为家庭妇女的未来 我想独立 想闯出去开启一个理想的生活 但这些的基础都得是 学识 经济 我什么都没有 我连考试都考不了 连考试都不敢面对 我该怎么面对未来 回家的路上 我点了一根又一根的烟 唉声叹气吐出去的烟雾 也带不走我心里的面的难过和恐惧 回家之后还要面对爸爸妈妈失望的眼神 想到这我更难过了 先辈读书为了不让中国被淘汰 现如今读书是为了不被中国淘汰 读书 好难 各种变化的题型 在我脑子里翻江倒海 越学越杂 我如果再聪明一点 身体再好一点 意志力再强一点 或许现在也能坐在考场里 顺畅地答题 勇敢面对自己的不足了吧 可现在的我什么都做不到 一直在懦弱 我最讨厌自己的懦弱 但我貌似没有办法打倒他,0,0,0,辽宁,大连,辽宁,中国
15,5020815408760543,鸭鸭睡了,2024-04-08 09:18:58,昨晚做梦梦到自己高考作文忘记写了..直接惊醒果然过了四年还是被考试支配的恐惧根深蒂固 ,0,0,1,浙江,杭州,浙江,中国
15,5020802168653748,炸了毛的仙人球,2024-04-08 08:26:22,额头上起了好几个痘痘，伴随着焦虑入睡，前半夜梦到自己烂脸，后半夜梦回大学，易烊千玺来我们学校开演唱会，还会我安排了专属位置，在梦里我下午有个考试，千玺给我扔纸条说他请了10天假，让我下午陪他出去游玩，他花了2万元钱帮我搞定了下午的考试，我竟然因为恐惧老师，拒绝了他，坚持考完试，醒来如失恋一般失落，在梦里都这么没出息,0,2,1,江苏,无锡,江苏,中国
16,5020639041684898,Charlie55555555,2024-04-07 21:38:09,求求求求了哪个学神附身一下我他妈有考试恐惧症 ,0,0,0,广东,深圳,广东,中国
16,5020585396798098,南十八羯,2024-04-07 18:04:59,前两天做梦梦到自己去考老师了 然后快到考试时间了 我突然想起来我还没有报备 赶紧打电话给人力资源经理报备被单位支配的恐惧 ,0,0,0,湖南,永州,湖南,中国
16,5020584809598112,多音字真的很烦呀,2024-04-07 18:02:39,感觉我这一年恐惧上台的原因源于线上考试。 因为专业老师坐在台下以及三次录制机会，我总是追求完美，跟自己较劲。即使老师说还可以还可以，我还是不满意总觉得能再好。可是两首15分钟，怎能可能一直没错。但我现在才想明白 ,0,0,0,天津,天津,天津,中国
16,5020582672603600,AAA大剑香蕉批发,2024-04-07 17:54:10,啊啊啊啊啊啊啊啊我有考试恐惧症 ,0,0,2,北京,,北京,中国
16,5020550805586355,我一定要多喝白开水,2024-04-07 15:47:31,工作了还是有被考试支配的恐惧 鲨了我吧 ,0,1,1,湖南,邵阳,湖南,中国
16,5020537757631659,村里的老大妈呀,2024-04-07 14:55:41,但凡祖辈不是都发达过后来落魄受罪了，我爸不是考试运太差成绩还不错，那时候的不错应该还可以，大慨就没有那么多要求和恐惧？不知道，但凡，咱没冒头，也是普普通通鸡零狗碎的一生可能也会满地鸡毛也未可知啊！这年头和以前可不一样了。反正都是要喘气儿的，这是毋庸置疑地。 ,0,0,0,重庆,重庆,重庆,中国
17,5020332331368512,草莓居不吃w拉面,2024-04-07 01:19:23,就 发现 小时候上学，会有意思恐惧上学的心理，害怕考试，害怕老师，害怕检查作业，害怕受批评 然而现在长大了，工作了 好像没什么两样啊  这样看来，最轻松的时候就是做大学生的时候了 ,0,1,2,广东,汕头,广东,中国
17,5020286051160480,我不能没有烦恼吗,2024-04-06 22:15:30,要学崩溃了 我有考试恐惧症 ,0,0,0,河南,漯河,河南,中国
17,5020281114460957,喜亿遨禾安,2024-04-06 21:55:52,现在对于上班的恐惧不是上班，而是那个活我不会干啊，我现在就像学生时代告诉我第二天要考试要默写那样的恐惧。啊啊啊啊啊啊啊啊无助，考试时候做不出题的无助。 ,0,0,0,江苏,无锡,江苏,中国
17,5020219385577974,禾三悠闲地吃草,2024-04-06 17:50:35,三大欲望企图抵御对考试的恐惧 ,0,0,0,北京,北京,北京,中国
17,5020182080916658,倚窗观白鹤,2024-04-06 15:22:21,如果有机会我也想去一下追的三国线下毕竟有紫鸦快点公布就是估计票不好抢还有时间问题希望那时候不忙吧还有就是本人社恐也没参加过一切线下活动而且除了上大学那会儿去学校我好像从未独自出行考试和同学同事一起出差和同事一起旅游和家人一起有点点恐惧😬嗯如果去的话估计全程😷0交流哈哈哈还有希望饼饼也可以参加,0,0,0,安徽,阜阳,安徽,中国
17,5020176988509438,二鹿不二,2024-04-06 15:02:07,内心崩溃无人知晓 真心不想考试，对这些东西从内心里恐惧。 ,0,0,0,湖北,黄冈,湖北,中国
17,5020139634564376,小张er超可爱,2024-04-06 12:33:41,这次一点都没有上班恐惧 因为明后天考试 并且下周只有周五有晚课 又幸福了 ,0,0,0,辽宁,铁岭,辽宁,中国
18,5019965700965573,春天的花要开了,2024-04-06 01:02:32,其实我觉得我挺矛盾的。。。。。。二战导致我现在特别恐惧考试想随便找一个学校就去读书了 但是又很不甘心尼玛感觉完全违背了我考研的初心 ,0,0,0,广东,汕头,广东,中国
18,5019957144584273,你寇,2024-04-06 00:28:31,打印准考证总会拉肚子，考试却又不会。可能考试那天不是恐惧和紧张 是摆烂。 ,0,0,1,河南,洛阳,河南,中国
18,5019943823475720,圈圈缝缝补补,2024-04-05 23:35:36,考研的动力并不是想做什么带来的，而是不想发生什么事而带来的。推着我前进的是恐惧和压力，所以我不仰视这场选拔考试，也不认为它会有多余的意义。对一部人来说，所谓上岸的第一步，是对岸脱敏。 ,0,0,0,山东,济南,山东,中国
18,5019462533382351,反射弧超长星人影九,2024-04-04 15:43:07,看到大家都喜欢松弛感觉得松弛感是一个人最大的潇洒确实很多人从小就在，“好好听话，好好考试，好好表现……不然爸爸妈妈就不喜欢你了”的恐惧中长大长大后，又是在“好好干，不然老板就不要你了”的恐惧中生活与其说是喜欢松弛感，不如说是羡慕羡慕别人有不会互相指责的家庭氛围，羡慕别人有说走就走的洒脱，羡慕别人有能不干就不干的底气和勇气……而我们说完一句真好啊又得憋着气，回去搬那个破砖，上那个破班,36,48,817,广东,东莞,广东,中国
18,5019836092254856,watchingthestars,2024-04-05 16:27:31,真的不想上学了，总是挂科总是逃课，一堆不想做的作业以及不想考的试，最近因为逃避补考正面临被开除的恐惧，想到这样会没有文凭又会恐惧。 一个成熟的学校应该尊重学生有不想考试做作业写论文的权利 ,0,2,0,俄罗斯,,,俄罗斯
18,5019808514967777,番茄土豆豆豆,2024-04-05 14:37:56,一闭上眼睛满脑子都是考试时候的错误答案 那种恐惧和害怕在我的脑海里一幕幕浮现挥之不去 我该怎么办 如果考不上 这或许会成为我一辈子的心理阴影 孔乙己的长衫我这辈子都摆脱不掉… ,0,0,0,海南,海口,海南,中国
18,5019776680725087,娃娃1122,2024-04-05 12:31:26,今天到医院来复查，总是各种担心。胸口一直像压着一块石头一样，试着告诉自己，你的根在外面，在头顶，你。是可以静静的去感受身体，那时候感觉是最舒服的。但是一不小心就会陷入到各种想法和各种担心恐惧当中。突然想起孩子物理考试成绩，于是感觉胸口好像悬着的，硬硬的。虽然看了成绩考的不好，但这一次好像没有太多的似乎要掉下悬崖的感觉。当我自己被想法占有的时候，感觉一切都不如我意，然后我的胸口会堵的慌。整个气好像在向上浮涨。也许这个病是我的一个业，其实我自己对自己造的业。我对自己的评判，我的懊恼，我的后悔，这一切都是我的夜。也许这个病是在帮我消业吧，静静的去感受这样的业力吧。嗯这一切的发生，不过是来长养我的。,0,0,0,四川,成都,四川,中国
