页码,微博id,微博作者,发布时间,微博内容,转发数,评论数,点赞数,发布于,ip属地_城市,ip属地_省份,ip属地_国家
2,5022072561991684,奔跑在明媚阳光下的小米,2024-04-11 20:34:26,#全面排查中小学重点班快慢班#义务教育阶段确实没必要分快慢班，在初中升高中实现自然分流了，也满足社会化就业的多层次需求。 ,0,0,0,福建,厦门,福建,中国
2,5021999334162472,昆明统战,2024-04-11 15:43:27,#统战·看基层# 【安宁市多措并举推动中华民族发展史  学习教育走“新”更走心】安宁市始终以铸牢中华民族共同体意识为主线，通过构建一体化制度、搭建资源化平台、善用社会化课堂，纵深推进中华民族发展史宣传教育，不断引导各族群众增强“四个共同”“五个认同”。网页链接（安宁市委统战部 供稿）,0,0,0,,昆明,云南,中国
2,5021653489419729,方之夫,2024-04-10 16:49:12,年轻人的现状，都是社会化大教育的成果。 ,0,7,23,上海,上海,上海,中国
2,5021716577521765,也舌多乱,2024-04-10 20:59:54,一直在想难道文青病是专属于女性的一种处境，定义文青的话，表面化的一些标签无非是受过足够你对世界产生教条的体系之外更深思考与困惑的一定程度教育、社会化程度稍低当然这一点存疑、文学艺术类的爱好者或从业者等，当然对于不同的人或许也会有社会人际功能与理想主义深入程度的区别，但是相对来说男的贴上这种标签就得到人文层面一种进可攻退可守的极致武装，首先见过太多话语体系包装到哲学，内里一滩烂泥的人文社科男，其次男的借助这个定位总能迅速凭空接生自己的魅并进行物质层面的变现，而以我为例这三个字几乎该怎样被概括：极致的理想主义阻碍了向社会接轨；怀疑性高所以无法稳定；对自己天赋的认知过高过低地摇摆；用高的道德标准约束自己即被我友定义为注定水土不服的一种傲慢的清高；无法真正实现自洽，正视物欲与自己的喜好挂钩的可能性，文青病之所以让我们只得到贫穷，就在于我们太看得起自己又太看不起自己，道德与欲望，审美与物质没办法握手言和，只看这段话里我让渡多少次，就知道这现象在我身上完成了怎样的闭环。,0,0,0,韩国,,韩国,韩国
2,5021535410850374,佛山消防,2024-04-10 09:00:00,最后一天！佛山消防新媒体主播招聘即将截止，速投简历→【佛山市消防救援支队全媒体中心新媒体主播招录公告】佛山消防全媒体中心是以提升消防宣传传播力和影响力为目标，承担佛山消防救援队伍形象宣传、新闻素材采编、新媒体平台运营、文化创作、消防科普教育基地运营以及线上线下社会化消防宣传活动等任务的实体机构。因工作需要，现向社会招聘1名专职新媒体主播工作人员，具体要求请戳链接了解：佛山市消防救援支队全媒体中心新媒体主播招录公告,0,0,1,,佛山,广东,中国
2,5021509460427688,啾啾与汪汪,2024-04-10 07:16:53,教育的本质是什么？从必须品的角度，是为了社会化，为了在社会里有容身之地，可持续地活下去；从奢侈品的角度，是为了“理解你自己，成为你自己”。二者兼备自然是最好的，但在社会实现“全民基本收入”这样的政策之前，还是要先活下去，然后再寻找自己。生存焦虑是很大的焦虑，如果不解决基本生存问题，在这样压倒性的焦虑面前，很难拿出盈余的认知资源来思考“我是谁，我要去哪里”这样的问题，即使硬想出答案，这个答案也一定是被扭曲的。不要有太多负债，不要把生活成本推得太高，要有足够简简单单生存下去的钱，斯多葛哲学的路子。中考、高考，这些选拔性考试，本质上考的是“其他投资者要不要对你进行大笔追加投资”。被选中的，就被追加投资，被选中的人群里，再次被选中的，再次被追加投资，一次次在选拔里胜出的人，可以“好风凭借力，送我上青云”。但不被选中，绝不是末日。世上有许多投资者，各有各的选拔标准，不被这个投资者选中，还可以被别的投资者选中。实在没有人投资你，你还可以成为自己的投资者，投资自己。再说，在这个世界上活下去，最重要的，不是有没有人愿意“投资你”，而是有没有人“需要你”，愿意和你做交换，你能拿出的“有价值的东西”有多少。狭义的鸡娃，本质上是要看这个娃在学术路上合不合适追加投资，合适，就慢慢追加，不合适，就去寻找其他“在这个社会上活下去”的办法。给娃施加的压力，如果甚至大过了在这个社会上生存的实际压力，就是一种无意义的施虐了。（写完早上的想法，现在去喊啾啾起床。）,55,35,290,福建,厦门,福建,中国
2,5021192643937065,Ooo0普通用户,2024-04-09 10:17:58,距离婚姻法出台和一夫一妻制真正受到法律保护不过区区七十年，当代女性的社会化定位困境仍然存在。看见被群体无意识绑架和在职业生涯中受困于性别角色定位的优秀女性们，唯有可怜可悲可叹。再一次感慨自己是多么幸运，能够拥有接受过高等教育的父母和亲朋长辈们。 ,0,0,0,黑龙江,哈尔滨,黑龙江,中国
2,5021166393624478,省学科及新疆丹尼斯,2024-04-09 08:33:40,4月9日 第二天统筹课程、学校特色、特色化道路P2的课程其实蛮有意思的我觉得高中生其实最应该接受的是社会化教育关于目前就业形势的分析、社会发展的趋势、社会保障制度的落实之类对于高中生来说很需要先建立对社会的了解和认知然后才是树立理想与信念高中生正值对任何事物都感兴趣的年纪如果抓住这个时间去了解水稻、车辆的相关科学研究可能会培养出更多科研人员科学启蒙其实蛮重要 但目前挺难实现的大多数乡镇学校的科学实验课程都形式化了,0,4,0,广东,深圳,广东,中国
2,5020978354854589,似鳥銘斐,2024-04-08 20:06:28,追张佳乐还是有点难的，他知道自己讨人喜欢但也不会把喜欢这事儿看得太清楚。加之接受能力强社会化程度不怎么高，就会出现一种亲嘴拥抱还是兄弟的尴尬场面，都是兄弟亲一下怎么了亲一下也不是什么大事！所以怎么追呢，可以给张佳乐来一场爱的教育，也可以有点心机又如何给张佳乐先一脚踹进爱河。这个艰巨的任务就交给各位相方,0,9,23,云南,昆明,云南,中国
2,5021140849001200,最爱-JONATHAN,2024-04-09 06:52:09,今日议题: 中医药学的未来在哪里？①教育篇 ②规划篇 ③先导篇 是否以问题为切入点进行研究实践?是否产生社会化成果导向?中医药学的宣传引导、狠抓落实应该实现有效督导，认知与准入的管理制度要更加鲜明、体系更加完善，供应链产业链更加完备。 ,0,2,0,吉林,长春,吉林,中国
3,5021021751479533,金三顺movielife,2024-04-08 22:58:54,深度关系-尤其难以处理好的一种情绪是愤怒。愤怒是一种次级情绪如果一个人觉得表达某些情绪（如受伤、排斥、嫉妒）会让他过度暴露自己的脆弱，他往往会觉得表达愤怒会更加安全对于男人来说尤其如此，因为他们所受的社会化教育告诉他们，不要表达自己的脆弱较为基础的、脆弱的情绪转变成愤怒的过程可能是高度自动化的，以至于生气的人都没有意识到表面之下的情绪。但是，表达愤怒可能会使双方都陷入僵化和防御的态度你的情绪就是你的情绪，如果你感到生气，那种感受就是真实的。你如何处理愤怒才是问题所在,0,0,0,北京,,北京,中国
3,5020936061585333,北京禁毒,2024-04-08 17:18:24,【西城区 金融街街道开展禁毒宣传活动】为全面推进禁毒教育社会化，切实提高辖区群众“识毒、防毒、拒毒”意识，从源头上预防和减少涉毒违法犯罪，西城区金融街街道禁毒工作站在金融街辖区开展禁毒宣传活动。活动中，禁毒专职社工通过悬挂禁毒标语，向辖区居民群众发放禁毒宣传单、宣传物品等形式，向大家宣传禁毒知识，讲解毒品的种类及危害，使辖区居民深入了解毒品给我们带来的侵害，同时号召广大群众要积极参与到禁毒活动中，坚定珍爱生命，远离毒品的决心，坚决同吸毒、贩毒违法分子作斗争。通过此次宣传活动，使毒品危害更加深入居民心中，也为辖区营造一个安全、文明、健康的社区环境提供了强有力的保障。@中国禁毒在线,0,0,0,,,北京,中国
3,5020923377484723,北疆女声,2024-04-08 16:28:00,#小北播报# 【“草原福嫂”呼伦贝尔巾帼家政万人培训工程2024年扎兰屯市首期培训班结业】 为推动“感党恩、听党话、跟党走”群众教育实践活动走深走实，落实自治区、呼伦贝尔市民生实事，深化“乡村振兴巾帼行动”，进一步提升城乡各族妇女创业就业能力，拓宽妇女就业渠道，适应城乡家政服务社会化，培养高素质、专业化母婴护理人员，近日，扎兰屯市妇联举办“草原福嫂”呼伦贝尔巾帼家政万人培训工程2024年扎兰屯市首期培训班开班仪式。“草原福嫂”呼伦贝尔巾帼家政万人培训工程2024年扎兰屯市首期培训班结业 来   源：扎兰巾帼 #坚定跟党奋进新征程 北疆巾帼建功新时代#,0,0,0,,呼和浩特,内蒙古,中国
3,5020918867034868,陕西党建网,2024-04-08 16:10:05,#秦学习# 【干部参加社会化培训规定】《干部教育培训工作条例》第十六条规定：“干部个人参加社会化培训，费用一律由本人承担，不得由财政经费和单位经费报销，不得接受任何机构和他人的资助或变相资助。” 详戳↓↓ ,1,0,1,,西安,陕西,中国
3,5020829234498193,没有昵称的BY,2024-04-08 10:13:55,感性是天生本能的，而理性需要教育，特别是女生，需要后天的社会化和训练，而且是能成的。 ,0,0,0,中国,,,中国
3,5020685514049548,boilingMoon,2024-04-08 00:42:49,1. 今天听播客，听到沈老师说，在传统权威被消解的大背景下，教育更重大的意义在于，如何让孩子找到正向的人生意义，找到自己的价值，完成社会化。这是比教会孩子能力和素养更重要的事情。（看起来似乎很急迫的样子。2. 又说但是由于互联网的广泛存在，家庭教育，学校教育对孩子的影响其实都很小，甚至变得微乎其微。而社会教育扮演着越来越重要的角色。我们根本不知道孩子都从哪些地方获取些什么样的信息。这样的问题其实也是传统权威消解了，但新的权威并没有真正确切的出现。（我时常觉得我这班上得战战兢兢如履薄冰，我怕我的某些细微举动无意之中就影响学生。但是跟巨大的社会整体环境相比，我对自己的苛责和紧张程度有得到一些缓解。学校教育对他们的影响不如想象中大，而我的影响没准其实多半是好的影响。3. 在这种巨大的挑战之中，如何做好学校和家庭教育也是更值得探讨的。既然亲子教育的基础是亲子关系，那么学校教育的基础是师生关系吗。（我其实非常不擅长工作中的人际关系处理。,0,1,0,四川,成都,四川,中国
3,5020673708132657,我想起个新名字-,2024-04-07 23:55:54,饿 我的微博可能是最无趣的，除了饿就是抱怨 教育的社会化作用在我身上体现的淋漓尽致，没有一点个性。 ,0,1,0,河北,唐山,河北,中国
3,5020486054971111,昆明市民政局,2024-04-07 11:30:14,【儿童福利机构社会化教育的云南探索】为了促进儿童福利机构内儿童的社会性发展，云南省民政厅持续在全省儿童福利机构开展社会化教育活动。按照省民政厅工作要求，各地儿童福利机构聚焦儿童所需，整合社会资源，积极创新活动形式和内容，在拓宽孩子们的视野、培养他们自立自强精神方面作出了不少有益探索。  儿童福利机构社会化教育的云南探索,0,0,0,,昆明,云南,中国
4,5020455939604616,中国教育新闻网,2024-04-07 09:30:33,北京市海淀区实验小学九一分校：从劳动和体育切入促社会化发展发布时间：2024-04-07作者：楼薇琳来源：中国教育新闻网-中国教育报小学阶段是儿童社会与情感能力发展的重要时期。我们意识到这个问题对孩子长远发展的重要性，不断探索有效策略，通过课内外结合的一系列丰富多元的活动，对学生开展社会与情感能力的培养。以劳润心，构建社会与情感能力培养场。一是启动“窗台课程”。鼓励学生在教室的窗台上进行“小种植”与“小养殖”。班级学生以小组为单位开展植物和小动物的养护活动，提升学生的责任意识和协作能力。二是深耕劳动试验田。学生在教师指导下，结合学校的九大方面劳动实践课程，深耕健康润心田、美育创造田、体育风采田、生活技能田、志愿服务田等九大试验田，提升学生的劳动素养。三是深入开展志愿服务。教师和家长都会鼓励学生积极参与志愿服务，并引导和支持孩子在服务中结交朋友、锻炼人际交往能力。很多学生在家长的带动下，积极投入到盲道安全守护者、助残共融沙龙等公益活动中。志愿服务后还会组织分享和交流。以体育心，推动学生的健康全面发展。学校坚持“健康第一”的教育理念，重视育体与育心、体育与健康教育相融合，鼓励所有学生参与运动，让运动成为他们的生活习惯。除了定期举行学生运动会和跳绳比赛，学校还开展了丰富多彩的体育社团活动，涉及篮球、足球、棒球、跆拳道、毽球等体育项目。每个团队打破班级、年级界限，引导队员在团队中树立共同成长目标，在团结互助中增强体质、磨砺意志，促进社会化发展。以动促静，助力学生拥有稳定的心理状态。“动”指的是心理状态的动态调整，“静”指的是通过调节达到新的平衡，使个体保持稳定的心理状态。学校通过系统的心理健康教育，引导学生了解自己的内心世界，并学习、了解与自身成长相关的心理健康知识，培育学生热爱生活、珍视生命、乐观向上的心理品质。学校注重普及心理健康教育。除了学校的心理教师进班授课外，每个班级每月还会开展一次心理班会，内容涵盖认识自我、人际交往、情绪管理等，并根据学段特点设计不同的活动内容。学校每周一次的“阳光心语”广播，每学期开展的心理讲座或团体辅导，全员参与的心理健康周活动，都受到学生欢迎，对提升他们的心理健康意识和应对心理危机的能力发挥了作用。此外，学校还将心理健康教育纳入课后服务体系。心理专家根据班级特点和需求量身定制活动内容，并对学生的心理健康状况进行摸排。学校根据“一生一策”的原则，在达成家校共识的基础上对有心理问题的学生开展一对一心理辅导。同时，心理专家定期与家长沟通，进行个性化家庭教育指导。（作者系北京市海淀区实验小学九一分校校长）作者：楼薇琳《中国教育报》2024年04月07日第3版 版名：校家社周刊,0,0,0,,北京,北京,中国
4,5020306743495605,I丹卿,2024-04-06 23:37:43,"曾小敏著名粤剧表演艺术家、广东粤剧院院长曾小敏在接受广州日报新花城采访时表示，可以从以下几方面去扩大粤剧的影响力—— 1,加强粤剧教育和培训，培养新一代的粤剧人才，推动粤剧社会化考级培训，确保艺术传承发展的连续性。 2,举办粤剧节、比赛和展览等活动，提高粤剧在公众中的知名度和影响力。 3,利用现代媒体和网络平台，如短视频、社交媒体等，让粤剧艺术走进民众的生活。 4,创作与青年人生活紧密相关的优秀粤剧作品，增强观众的共鸣和参与感。5,开展国内甚至全球的粤剧巡演和文化交流活动，将粤剧艺术带到全国乃至全球华人社区。 “通过上述措施，我希望能够以广州为支点，有效集结湾区资源，进一步弘扬粤剧文化，推动粤剧在全国乃至全球华人中的影响力不断扩大。”曾小敏说。（来自：广州日报新花城 网页链接 ） I丹卿的微博视频",1,0,16,广东,广州,广东,中国
4,5019950271955070,邦妮帮帮你呀,2024-04-06 00:01:13,说到女人玩电竞的少，其实女人去做有雄竞上有风险的事情人数总体就少…这个是不是和女人天性有关我不知道；但是这个事情和社会化教育确实有着极大关系…最近看一些子供向动漫，包括看一些武侠小说，里面常见情节是“男主男二或者任意一个男性角色要做什么高风险的事情，然后女性角色跳出来说，某某，这样太危险了！”然后男性角色做成功了打了女角色的脸…倒不是因为我是什么文艺作品审判家，是我确实看到女人更容易被要求去做那个更负责、更懂事的人，从小到大都是这样。我有个朋友很漂亮找了个脾气不太好的男人，男的有钱且嚣张，经常惹麻烦，他冷静下来会说“你要拦着我啊，你要出来打圆场，给台阶啊”这个事情在我看来太可笑，你这么懂，你怎么不自己劝自己一下呢？ 但是“妻贤夫祸少”这个概念就是从小被灌输进去的，确实，负责的性格会相对而言好找对象，但是这也扼杀了不少女人在高风险行业成功的可能性：她们从小没有学着和风险搏斗，而是学着为风险兜底，去做讨人厌的被打脸或者被连坐角色#情感#,7,5,63,浙江,杭州,浙江,中国
4,5020217317525207,岁月6555,2024-04-06 17:42:22,教育的社会变迁功能是指教育通过开发人的潜能，提高人的素质，引导人的社会化，影响人的社会实践，能够推动社会的发展与变革，这就是教育的社会变迁功能，它表现在社会生活的各个领域 ,0,0,0,湖北,十堰,湖北,中国
4,5020093275177524,Libra月亮供电不足,2024-04-06 09:29:28,从某一天上班路上忽然想到我们从小接受的教育其实是另一种社会化的驯服 ,0,0,1,天津,,天津,中国
4,5019470906789110,蓝色彼岸v,2024-04-04 16:16:24,日前，中国气象学会公布了第五批气象教育特色学校名单，武义县芦北小学上榜！据悉，推动“气象教育特色学校”发展是中国气象学会强化校园气象科学教育、推动气象观测社会化、提升气象科普服务效果的重要举措，目前全国范围内已有82所中小学校获此殊荣。恭喜武义县芦北小学。#八婺荣光##与武相遇 e路同行##气象教育#,1,1,1,浙江,金华,浙江,中国
4,5019215411806551,Doraemon_sll,2024-04-03 23:21:09,教育心理学 219  221 276-279 埃里克森的社会化发展理论 认知风格的差异 学生常见的心理障碍 学生心理健康教育的方法 ,0,0,0,湖北,武汉,湖北,中国
4,5018919649935707,布加不顾,2024-04-03 03:45:54,今天第一次在家给元旦洗澡 他竟然一点都不反抗 元旦宝宝不是那种从小做社会化教育的小猫 所以他的乖巧又让我骄傲又觉得亏欠 🥹🥹全世界最聪明最懂事的小咪🥹 ,0,0,3,浙江,金华,浙江,中国
4,5018790658051512,橘Jv,2024-04-02 19:13:20,真的搞不懂一些人怎么就痴心妄想猫能跟她完全同频，居然还希望猫能给她提供一切情绪价值?????这个世界上，都没有存在过一个人能跟另外一个人完全同频的情况，有些垃圾虽然接受过教育但是照样不当人。更何况她没有很长期给猫猫做社会化训练，只觉得她花了那点钱，猫就应该自己社会化自己，真是自私又愚蠢，缺爱又脑瘫，没有爱的能力的人连猫都能算计，那你的确不配得到爱享受爱 。不去直面问题解决问题的根源，不管换多少只猫都没用，这套理论同样适合渣男。,0,0,0,江苏,宿迁,江苏,中国
5,5018717374909949,十万只猫-阿比西尼亚猫,2024-04-02 14:22:08,阿比西尼亚猫 幼猫#社会化之猫妈教育 猫妈的现场教学，捕猎玩闹~ #日常吸猫##迷惑行为大赏#   ,0,0,2,天津,天津,天津,中国
5,5018496323555166,周何伟超,2024-04-01 23:43:45,文化发展对于人类的意义人类父对精神世界的认知源于教育赋能，由于教育和社会的开化使个人逐步的成长和塑型，以及不断社会化的调整，而文化的影响一直伴随着个体，直到生命的结束，所以人类的发展对于人类而言是不可或缺，也是说文化一直滋润着人类的精神大地，不断的丰富人类精神文明，为此文化对于人类而言具有决定生死的能力。但是现行的文化情况并不乐观，尤其地域差异的原因，形成了文化排斥或文化隔阂，严重的影响人类的精神健康，也阻碍着文化人类化进程。今天的世界是人类化的世界，我们需要不断的突破和创新，实现人类文明人类化，而不是具有极强地域色彩的文化组合，而是要打造出更具高层次的文化内涵，使人类从精神上得到改变，为人类认知人类化奠定基础，以此支撑人类走向未来，形成更具生命力的文明基因，通过基因的传承，让人类处于更加有利于的境地，而不至于一次次经历周期性人类治理灾难，所以通过文化的更新迭代，使人类从精神上更加的符合人类对未来追求的需要，以此满足人类对美好未来的精神期待。文化是人类繁衍生息的重要依赖，也是人类精神延续的脊梁，如果人类没有文化，那人类就像“鱼”，无法创造更加美好的未来，尤其无法创造更加灿烂的文明，应此可以看出，文化对于人类的影响，这也成为人类需要极其重视的公共治理组成部分，因为人类离不开文化，更无法脱离文化，为此只有不断的提升文化质量，突破局限性，让文化得到更好的发展，以此更好的服务于人类社会，而文化的健康持续发展对人类实现幸福安康具有决定性作用。文化的发展离不开教育，也离不开宣传，但是文化的核心点依然是立场问题，因为文化的属性决定着文化是有利于还是不利于人类走向真正的未来，所以文化发展对于人类社会极其重要，它不仅仅影响人的精神，还会延伸到行为，从而呈现出一个人的精神状态和良莠，应此文化的潜移默化，就要春雨一样，一直在影响你，以及自己身边的人，以此可以讲文化的良莠决定着人类的良莠，也影响着人类文明的良莠，为此重视文化发展是人类的重要核心工作，也是需要花大力气持续抓的重点工作，所以文化对于人类的作用就像水对生命一样，一个支持着生理，一个支持者精神，从而让更多的人懂得，让更多的人明白何为人，何为人类，何为宇宙，只有更大的胸怀才能让人类文明拥有更加丰富的内容，才能更好的服务于人类发展，才能更好的创造未来，从而使人类真正的幸福安康。不要恶化文化，更不要毒化文化，更不要让文化更加的私化，而是要不断的开阔胸怀，让人类更加的具有眼界，更好的包容这个宇宙，以此形成人类最具有安全性能的人类精神防火墙，使人类真正的可以在自己的文化中不断的汲取养分，为人类的发展奠定坚实的基础，让人类真正的拥有幸福安康。人是万恶之源，不如说文化是所有的源头，而健康、可持续、高质量的文化会给人类一个不一样的未来，也会让人类真正的强壮和独立。,0,0,2,北京,,北京,中国
