页码,微博id,微博作者,发布时间,微博内容,转发数,评论数,点赞数,发布于,ip属地_城市,ip属地_省份,ip属地_国家
2,5023383165863474,沉浸式蹲坑,2024-04-15 11:22:19,社会研究方法老师每节课关键词：大学生婚恋观 武大华科 同性恋 ,0,2,2,湖北,武汉,湖北,中国
2,5023382496346480,景德镇消防,2024-04-15 11:19:40,近日，@景德镇消防 灭火救援攻坚组培训班组织开展防盗窗（网）破拆技能实操训练，积极探索防盗窗（网）快速破拆方法，提高消防员灭火救援能力。此次实战训练主要是针对建筑防盗窗（网）破拆，从如何做到“科学施救、精准施救、高效施救”等方面进行了破拆研究。实战中，各学员各显神通，尝试不同的破拆器材和方式方法实施破拆，并做好训练效果的登记。实战结束后，参训学员就训练的情况进行了交流探讨，提炼总结，形成经验，为下一步灭火救援行动提供有效的的指导意见。,0,0,1,,,江西,中国
2,5023379100273351,爱指标_小作手,2024-04-15 11:06:10,配对出现价值很给力，这套方法终于研发出来，在上证指数的应用上得到验证，周末研究了A股的几千只个股给了很多启示，何以解忧，唯有暴富#上证指数# ,0,9,8,北京,北京,北京,中国
2,5023378522511037,箫yj,2024-04-15 11:03:52,#仲景爷爷再救我一次#  @仲景宛西制药 他们不断运用智慧之光，勇攀知识之巅，掌握新技，探索健康奥秘。他们关注全球健康动态，深入研究各类疾病成因、传播途径和治疗方法，以科学态度面对健康难题。同时，他们审视未来发展，思考如何更好维护人类健康。在面对挑战时，他们毫不畏惧，敢于直面困难，挑战未知。他们的勇气不仅显于行动，更见于精神，坚信信念与勇气，必能克服一切。,0,0,0,河北,邢台,河北,中国
2,5022776222029011,ipo观察,2024-04-13 19:10:33,【斯坦福教授演讲：如何让孩子擅长数学 】            学不好数学是因为天生就没有数学细胞，没有数学天赋？但一直关注数学教育的斯坦福大学教授Jo Boaler用神经科学等多个学科的研究结论告诉我们，完全不是这么回事！我们不仅误解了数学本身，更忽视了数字能力发展的科学规律！只要方法对，我们都能学好数学。 痴史的微博视频,64,1,40,广东,深圳,广东,中国
2,5023376217214023,旺旺的白月光呀,2024-04-15 10:54:43,#500个AI与人类同台挑战数学大赛# 可以推动人工智能在数学领域的研究和应用创新，特别是探索AI在解决复杂数学问题方面的潜力，催生新的模型和训练方法。#00后训练AI挑战全球数学大赛# ,0,0,0,海南,儋州,海南,中国
2,5023375550579331,用户7633477059,2024-04-15 10:52:04,《高中历史教学方法与策略研究》缺1主 《中小学道德与法治教学设计探究》缺3主 《中学地理课堂有效教学研究》缺2、3主 ,0,0,0,河北,邯郸,河北,中国
2,5023372138514132,七月hzl,2024-04-15 10:38:30,大理大学出大理大学834教育研究方法背诵资料➕真题➕框架导图➕网课视频 ,0,0,0,云南,大理,云南,中国
3,5023368326155236,陈昌文,2024-04-15 10:23:21,小名老师的稿子，是可以干到一天几百单的。方法很简单，植入陈昌文的营销技术，营销技巧，营销录音。如果您想日出几百单就是这样不过小名老师自己也能日出几十单了。不断的学习我的营销，他的收入会达到日收入十万。想复制的，赶紧复制，这是初期，我们日日研究营销，后面这个稿件会非常厉害。-陈昌文,1,0,2,上海,上海,上海,中国
3,5023365439684948,马鞍山发布,2024-04-15 10:11:53,【复旦大学运动医学研究所马鞍山分中心成立】 近日，“复旦大学运动医学研究所马鞍山分中心”和“陈世益教授团队名医工作室”签约揭牌仪式在市人民医院举行。运动医学是将医学领域一些最新的方法和技术应用到运动损伤和运动性疾病的治疗，能有效保障全民健康运动的正常开展。 ,0,0,1,,马鞍山,安徽,中国
3,5023364594799429,天1海慧,2024-04-15 10:08:32,互联网上实际上没有任何竞争力，只有影响力。研究怎么去扩大影响力，提高自己的影响力，这才是互联网的魅力，传统行业被网络力量打垮，还是信息技术发展带来的结果。降维打击也是这个意思。打败你的不是同行，而是跨界。影响力最终的本质是收钱，用什么更好的方法来做好收钱的动作？这才是最核心的。,0,0,0,河南,郑州,河南,中国
3,5023362533819848,青舟Ming,2024-04-15 10:00:20,吉林师范大学 接体育考研辅导 学校体育学、运动生理学、体育科学研究方法等，欢迎咨询 ,0,0,0,吉林,四平,吉林,中国
3,5023362450195104,国家能源集团之声,2024-04-15 10:00:00,#央企黑科技#【风储联合调频，国际领先+1】近日，国家能源集团龙源电力“风电机组转速调节及储能管理研究及应用”项目成果通过中国电力企业联合会科技成果鉴定，达到国际领先水平。项目提出风电机组储能协同参与一次调频的控制策略、风电机组储能容量配置优化方法，自主研发了风电场风储联合参与系统频率调控技术，可大幅提升风电场一次调频和惯量响应能力，助力新型电力系统发展建设。,1,0,1,北京,北京,北京,中国
3,5023358641507471,全款拿下四位老公,2024-04-15 09:44:52,今天开了论文会议  情况比我想象中的要好一些  老师给出了研究方法的建议（虽然不会…但起码比不知道选什么方法好）还说后续也会开会  有什么问题可以发信息给他…也算是好消息吧 ,0,2,0,安徽,马鞍山,安徽,中国
3,5022347675830973,中小学教师资格证考试,2024-04-12 14:47:39,【题号1233】知识点归类：教育类&gt;教师专业发展的方法&gt;【教师资格证/教师招聘 】教师由“教书匠”转变为“教育家”的主要条件是（） A.坚持学习课程理论和教学理论 B.认真备课，认真上课 C.经常撰写教育教学论文 D.以研究者的眼光审视和分析教学理论与教学实践中的各种问题，对自身的行为进行反思 #教师资格证笔试##教师资格证考试# 网页链接 ,1,1,85,上海,,上海,中国
4,5023356565061694,大学生想说就说,2024-04-15 09:36:36,19178 【作业】一篇3000字的文献综述➕一篇1500字的研究方法➕一篇5000字的研究报告，老湿你不想让我活了你可以直接杀了我 ,1,0,5,湖南,衡阳,湖南,中国
4,5023353075925041,A-期刊论文杂志社发表,2024-04-15 09:22:44,24年SCD 《中学生英语》 主办单位：华中师范大学 出版周期：周刊 ISSN：2096-6199 CN：42-1862/H 栏目：教学改革与创新、教学理论与实践、课堂教学方法探讨、言与测试研究、村英语教学探索 中职英语教法探微、媒体教学与研究 ,0,0,0,河北,张家口,河北,中国
4,5023351586685200,肾病大夫梁维成,2024-04-15 09:16:49,想要摆脱尿蛋白的困扰，这个方法值得一试，简单又有效！🌟不管你的蛋白尿是1年5年还是10年也不管你是尿蛋白高降不下来、口腔有尿味、尿血、水肿、腰酸乏力....我想告诉大家，以上问题都是可以通过中医药进行调理的。🌟我是北京肾病专家梁维成一直致力研究肾病近40年有着丰富的临床经验🌟分享过很多调理蛋白尿的验方，很多患者都说用了之后蛋白尿得到了改善，蛋白尿一天比一天好了📝处方:芡实，生黄芪、菟丝子，山药、百合，白术、党参、枇杷叶，茯苓、金樱子、黄精。用法:水煎分3次服，每日1剂。💪临床功用：益气健脾，补肾固精。主要调理脾肾两虚型蛋白尿，症见面色苍白，少气懒言，疲倦乏力，腰酸腿软，食纳不振，腹胀便稀，夜尿频多，小便清长，舌淡边有齿痕，脉象沉缓。❤点评:肾炎患者尽管水肿消退，但蛋白尿经久不愈者，一般均有脾肾两虚之证。芡实、金樱子益肾固精;菟丝子性平质润，不温不燥，也不滋腻，既能补阴，又能益阳，并有固精之功;黄芪、白术、茯苓、党参益气健脾;山药既能补脾又能养肺肾而固涩;肾水充足，蒸腾化气以固精，故加入肺经之药百合、黄精，滋补肺金，以助肾水;枇杷叶入肺，以清降为功，肃降肺气，所谓“保柔金而肃治节”。💊💊此方为基础方，用料用量有所加减，有此类情况可以在评论区留言说说你的情况，给你看看!#蛋白尿##肾病##中医健康#,0,0,0,北京,,北京,中国
4,5023351575676838,A核心期刊sCI论文发表,2024-04-15 09:16:48,北大核心，官网查稿，2024年年内，可理工科职院+大学，必须加大学单位副教授，需要省部级以上基金（职院需要国家级基金）1.……电镀液温度状态控制方法研究2.铜锡合金电镀……金属成分含量测试方法研究3.不同热处理方式下……不锈钢化学镀层耐蚀性能分析4.酸性蚀刻环境……纳米结构金属镀层界面稳定性研究5.高温循环条件下……多层镍合金涂层热疲劳性能研究6.电沉积Ni-纳米TiC………复合镀层耐磨性能研究,0,0,0,河北,张家口,河北,中国
4,5023351517219946,凤凰网健康,2024-04-15 09:16:34,【#从1数到10可平复愤怒#】发泄愤怒的那一刻，你是不是感觉有点“爽”？但美国俄亥俄州立大学研究人员日前发表在《临床心理学评论》杂志上的研究显示，发泄其实对减少愤怒没什么用，反倒是常用于缓解压力的方法，如深呼吸、正念、冥想、瑜伽，甚至从1数到10，能更有效地减少愤怒和攻击性。#当代年轻人解压方式大赏#一般来说，人们会用两种方法控制愤怒情绪：一是参与提高生理兴奋的活动，俗称“发泄”，如击打沙袋、跑步等体力活动；二是参与降低生理兴奋的活动，如深呼吸、正念、冥想、瑜伽等。研究人员分析了154项研究，以确定减少愤怒的最有效方法。分析结果显示，真正有效减少愤怒的是降低生理兴奋。因为这会降低人们的攻击性，且无论性别、年龄、文化有无差别，结果都是一致的。相比之下，提高生理兴奋的活动则会产生一系列复杂结果，比如，慢跑有增强愤怒情绪的可能。研究通讯作者、俄亥俄州立大学传播学教授布拉德·布什曼认为，面对愤怒，发泄听起来像是个好主意，从某种程度上说，它也可能对心脏有好处，但上述研究表明，从发泄中获得的任何良好感觉实际上都会增加攻击性。因此，不如使用深呼吸、数数等降低生理兴奋的技巧缓解愤怒，这些方法都是免费或廉价的，且很容易做到。（生命时报）,0,0,0,,北京,北京,中国
4,5023349701086352,不休L,2024-04-15 09:09:21,研究生退学按老师想法做的开题报告，快做完了发现这种方法数据收集很难很难，对资源和人脉太多了，不知道要怎么办 ,0,4,1,江苏,南京,江苏,中国
4,5023135961715201,董晨宇RUC,2024-04-14 19:00:01,"周五在上海交通大学做了一次关于数码民族志研究方法的分享，其中有一位同学提问，很多人在谈论这个方法，但似乎这方面的教材并不多。我觉得可能更准确地讲，是翻译过来的并不多。于是分享六本英文教材/手册，感兴趣的朋友们可以参考。(1) Hine, C. (2020). Ethnography for the internet: Embedded, embodied and everyday. Routledge.(2) Marcus, G. E., Taylor, T. L., Pearce, C., Nardi, B., &amp; Boellstorff, T. (2012). Ethnography and virtual worlds: A handbook of method. Princeton University Press.(3) Horst, H. A., &amp; Miller, D. (Eds.). (2020). Digital anthropology. Routledge.(4) Sanjek, R., &amp; Tratner, S. W. (Eds.). (2016). eFieldnotes: The makings of anthropology in the digital world. University of Pennsylvania Press.(5) Pink S., Horst H., Postill J., Hjorth L., Lewis T. &amp; Tacchi J., (2016). Digital Ethnography: Principles and Practice. Sage Publishing(6) Hjorth, L., Horst, H. A., Galloway, A., &amp; Bell, G. (Eds.). (2017). The Routledge companion to digital ethnography. Routledge.",77,10,227,北京,北京,北京,中国
4,5023340153015644,傅松涛,2024-04-15 08:31:24,科学家应用人类细胞首次培育出“人造肺脏”，为自体细胞再生肺脏带来曙光！培育可供移植的人造器官是解决器官捐献不足的方法之一。异体肺移植后排异反应很强，如何培育以自体细胞为主导的“人造肺”，是当今细胞治疗领域的研究热点。最近，日本东北大学和加拿大多伦多大学研究人员在英国《科学报告》杂志上发布成果宣称，他们利用人类细胞与小鼠肺脏脱细胞组织支架，培育出“混合人造肺”。将其移植到其他小鼠体内后，血液能流到肺的各个角落。本项研究中，研究人员先清除小鼠肺的全部细胞，再向脱去细胞的“肺组织支架”中注入人类血管内皮细胞并加以培养，成功使“肺组织支架”里重新形成新的肺血管网。研究人员分析发现，培养这种“混合人造肺”时，注入约3000万个人类血管内皮细胞最为合适，人造肺中毛细血管网络能够得到充分的再生。将这种再生的“人造肺”移植给其他小鼠后，研究人员确认了新生血管网络的血流得以恢复，血液能流到小鼠所移植的人造肺的各个角落。近年来，随着多功能干细胞（包括间充质干细胞和诱导性多功能干细胞）进入临床应用，利用患者自身的细胞或者干细胞来培养“自体细胞来源的人造器官”越来越成为可能，因其不会发生排异反应而日益得到临床研究人员和患者的重视。本项研究的科研人员表示，猪肺和人肺尺寸和解剖结构相近，下一步准备将人体细胞与猪肺脱细胞支架相结合，用来培养人造肺。如果实验能够成功，那么离人造肺脏的临床应用就更近了一步。,0,0,0,山西,太原,山西,中国
5,5023339991009327,笑岳心理,2024-04-15 08:30:46,彭聃龄普通心理学带背第一天 第一章  心理学的研究对象和方法 第一节  心理学的研究对象心理学考研心理学#考研复试# ,0,0,0,云南,昆明,云南,中国
5,5023335505986637,岁月静好20200,2024-04-15 08:12:56,不经历不会有同感，高考的改革，为了学生的成绩，不得不让我临时报佛脚，寻求解决做十八题的新思路，以减少计算量，让我的学生能够在短时内完成，思路一个一个又一个，可是如何把这些方法，做到融合贯通，让我心里空空的，没有自信，突然想起了儿子的一句话，由于本科和研究生不在同一专业，不能把知识系统起来，我现在也有同感了，最后五十天，不放弃，继续努力,0,0,0,河北,沧州,河北,中国
5,5022935515660750,爱可可-爱生活,2024-04-14 05:43:31,"[CL] Multilingual Large Language Model: A Survey of Resources, Taxonomy and Frontiers   网页链接   全面回顾多语言大模型研究，提出参数微调对齐与参数冻结对齐的统一分类法，讨论方法、资源与新兴前沿，为研究提供指导。 ",14,0,18,北京,北京,北京,中国
5,5023329733577366,纪录片之家,2024-04-15 07:50:00,【有争议的成果 Work with Controversy #微博纪录片联盟# 】 #涨姿势# RIPE项目研究成果也有争议 #欧洲和非洲对基因改造作物持怀疑态度# RIPE项目中某些方法依赖转基因培育杂交作物，各个国家队基因改造作物的立法态度不一！美国在转基因作物上虽有20余年的种植经验，但欧洲民众还是谈转基因色变，非洲也正被反基因改造作物的思潮席卷！更多精彩，请@纪录片之家科技控 纪录片之家的微博视频,8,0,4,辽宁,抚顺,辽宁,中国
5,5023320963024608,我-吊爆了,2024-04-15 07:15:09,神金阿b，到底把分p方法藏哪了研究了半天也不知道怎么上传分p视频 ,0,0,0,湖北,武汉,湖北,中国
5,5023318185083667,上证指数sh000001,2024-04-15 07:04:07,#A股#【“元素周期表”行情爆发 周期派基金经理走红】A股“元素周期表”爆发，对大宗商品的深度理解成为基金经理的决胜秘籍。此前，许多基金经理和投资者一直将“自下而上”选股的研究方法奉为圭臬，近两年的市场则让拥有“自上而下”周期视角的基金经理崭露头角，年内多位主动权益基金经理均是周期行业研究背景出身，其中还有基金经理曾发长文论证大宗商品周期对长期股票市场风格有着至关重要的影响。“元素周期表”行情爆发 周期派基金经理走红,0,1,1,,,,
5,5023317239532060,牛津大学客座教授,2024-04-15 07:00:21,牛津大学，英国G5读个博，换个轨道，换个人生，博士研究方向：包容性研究管理学博士概述：该项目：• 以心理学理论为基础，运用实验方法，寻求对工作场所不平等的根本原因的见解，例如高层领导职位和其他男性主导领域（即创业）中女性的代表性持续不足。• • 通过这样做寻求开发和测试解决方案，以提高传统弱势群体的公平性、包容性和职业成果。• 社会创新、系统变革和有争议的知识的形式和实践不断变化。全职： 4年博士申请材料：潜在博导（提前找博导）推荐信3封成绩单简历研究计划个人陈述,0,0,0,美国,,,美国
6,5023309276381551,蓝天白云黑土10,2024-04-15 06:28:43,社会学也是民主实现，民意表达能够科学规范有效开展的重要甚至唯一的方法论。这是一个非常系统的科学研究体系，是人文，哲学，历史，经济学，心理学，政治学，统计分析学，数学，等融大成的学科。这块古老的土地吃亏就吃亏在没有重视社会学研究。 ,0,0,0,北京,,北京,中国
6,5023281704599956,霹雳无敌爆炸超级goushi,2024-04-15 04:39:09,练车日记昨天的，写晚了昨天是我第五次练车，我刚开始还以为是第6天了练车的前两天我自己研究了修库我还库库做了笔记今天去练的时候直接倒车入库开始第一把右倒库还是不对 开出去又重新第二把有点感觉了 左右都凑合进去了然后侧方 不错 S弯 不错再倒库 OK啊 学的方法也是用上了 非常的棒啊后面虽然也有擦线进去的但是能进了呀OK啊我觉得还不错啊但是最后一把侧方线没领好 一整个大出线我看教练玩手机没注意 我赶紧把车开出去了OK啊没被发现 没有被骂然后练完啦教练说我可以约考了 开得很不错啊嘿嘿 这倒还是不敢不过很爽2024.4.14,0,0,0,湖南,长沙,湖南,中国
6,5023268299604051,CyanLF,2024-04-15 03:45:53,我第一次遇到做创把嫌弃组员、冷嘲热讽且不懂理论和研究方法搭便车的人踢了，被要求赔1k劳务费、科研经费如果批了还再赔2k的情况（且慷慨地为我们节省了她周末工作的劳务），折合知网一篇文章10块她复制粘贴一次要100老师听完来龙去脉自己都笑了，但谈完话结果是建议私下调解，并表示她现在“同意只要1000块加好好道歉”，没立上项我真想把学院和这人一块打包冲了自适应情绪不稳定这么有含金量啊,0,1,6,北京,北京,北京,中国
6,5023257300566656,是阿瑶瑶瑶瑶瑶瑶,2024-04-15 03:02:11,所以能不能来个科学家研究一下熬夜又对身体好的方法，这个真的会很实用 ,0,0,1,辽宁,沈阳,辽宁,中国
6,5023257008537611,钟爱绿色的丽丽酱,2024-04-15 03:01:00,#中医建议的最佳作息时间表#  告诉我你得出此结论的研究方法、研究过程 ,0,0,1,广东,广州,广东,中国
6,5023243102847191,昝廷全,2024-04-15 02:05:46,马克思曾经指出，只有当一门学科可以成功地利用数学时才算成熟。我们在系统经济学研究中提出，在同一层次，从定性走向定量是研究深入的表现。这里的关键是对“定量”的理解。1974年诺贝尔经济学奖得主哈耶克，基于对“定量”的传统数学理解，反对经济学对于计量的强调，甚至怀疑科学方法在经济研究中的重要性。我们认为，对于复杂系统的定量，不应局限于传统测度空间理论，而应将这里的定量理解为“广义量化”，其基本原则就是PM中的“辨异同、排泛序、显运转”。其中，“辨异同”是基础，在此基础上才可以进行“排序”，进而引进足够的运算。这一原则适用于所有关于复杂系统的定量研究。经济学中的序数效应论，可以被看作是这一原则在经济学的成功运用。更一般的数学方法，是赋半序范线性空间理论。所有关于复杂系统的量化研究，包括计算社会学、计算传播学、计量经济学等，都可以按照这种数学思想和数学框架进行深入研究，有望得出更多更好的研究结论。,1,0,0,北京,北京,北京,中国
6,5023221879408447,永远坚信狗狗教,2024-04-15 00:41:26,在研究“自己到底是有什么问题”。 在这种事情上花了很多时间，拥有丰富的方法论，但没有什么结果，感到深深的挫败。 我对人生的方法论真的超过大多数人，但就是对我的人生起不到作用，或许我缺的真的不是方法。 ,0,0,0,湖北,武汉,湖北,中国
7,5023213672989171,都记住快下课,2024-04-15 00:08:48,#仲景爷爷再救我一次#  @仲景宛西制药  在保护人类健康的战场上，66勇士以智慧为矛，以勇气为盾。他们不断研究，寻找疾病的弱点，用科学的方法对抗病魔。同时，他们毫不畏惧，勇往直前，用实际行动诠释着对人类健康的坚守与承诺。 ,0,0,0,河南,郑州,河南,中国
7,5023212731631766,蓝莓汁033,2024-04-15 00:05:05,#仲景爷爷再救我一次#  @仲景宛西制药 66勇士们，他们是智慧与勇气的化身，时刻守护着人类的健康与未来。在疫情肆虐时，他们挺身而出，用专业的知识制定出防控策略，以无畏的勇气面对病毒的挑战。他们不仅研究病毒的传播途径，还积极寻找治疗方法，为人类的健康筑起坚固的防线。他们的智慧与勇气，是人类战胜疫情的重要武器。,0,0,0,江西,上饶,江西,中国
7,5023211400726498,看不惯我就去4__,2024-04-14 23:59:47,今日打卡！下个礼拜要好好学一周！因为要做的事情太多了。。。。 今天的收获是发现了一个记单词的方法，比之前的造句法更费时间，但是效果更好了点，据说听力也要这样训练。 明天去研究一下听力训练，还有怎么坐对脊椎好现在我低头十多二十多分钟就会开始脖子痛omg 以及第无数次骂学校和导员 ,0,0,1,湖南,长沙,湖南,中国
7,5023210747988215,科学追光者官方,2024-04-14 23:57:12,【世界量子日说说量子之#量子力学#】#世界量子日##科学追光者#量子力学是当今物理学最前沿的一门学科，也是最神秘最难搞懂的一门学科。那么什么是量子力学呢？从科学界的定义来说：量子力学是研究微观世界粒子运动规律的物理学分支。我们用相对简单的理解方法，可以把“量子”与“力学”拆分开来理解。量子一词当中包含了微观世界，即由微小单位所构建的世界。而量子一词还有一重意思——微小可划分的单位量。力学一词则就是包括能量，物质的变化，以及变化表现和变化原理，还有运动以及运动的表现和其相应的原理的意思。因此，我们可以把量子力学看作是，研究微观世界一切事物的产生原理以及一切事物变化、运动以及表现原理的物理学科。#微博新知##微博知识+#,0,0,2,,杭州,浙江,中国
7,5023209601106504,_葛滚滚,2024-04-14 23:52:38,慢下来但是不摆的生活 真的幸福感up！早上一觉睡到十点钟，12点才慢悠悠的起床 也不化妆，溜达着去退快递，然后慢悠悠的去食堂吃了个最近非常爱吃的面。买了水果慢悠悠的到办公室，烧壶水冲个咖啡，吃着水果看了集无耻，然后把导师交代的统计分析方法研究了一下，敲了点论文。晚上和朋友去逛了喜欢的衣服店，陪她买了衣服和鞋子，又吃了个小烧烤，回到宿舍搞了搞卫生，屋里看着顺眼了许多，然后洗个热水澡香香的钻被窝儿，明天还是不用早起。特别普通特别普通的一天，很慢很舒服，我很喜欢。,0,0,0,山东,日照,山东,中国
7,5023209139735663,hahaha涛,2024-04-14 23:50:48,时间是一个轮回，21年的今天面试了菜鸟，9月份就在楼下的南京商厦研究离职，今天散步路过让自己坚定要离职的客户门口。以前从未想过还会有这样的重逢，前段时间体悟的宿命论不过是让自己遇事平静的一种方法，其实自己内心一直坚定的：命由我作，福自己求。感谢自己，感谢相遇。 南京 ,0,0,1,江苏,南京,江苏,中国
8,5023206866423234,腰间盘很好,2024-04-14 23:41:46,项目招生应该➕一项requirement :对哲学和存在主义感兴趣，看得懂胡塞尔和海德格尔，并对现象学以及使用现象学方法论进行心理咨询研究有自己的想法。 ,0,0,0,英国,,英国,英国
