页码,微博id,微博作者,发布时间,微博内容,转发数,评论数,点赞数,发布于,ip属地_城市,ip属地_省份,ip属地_国家
2,5022650324485230,脆花小骨肉,2024-04-13 10:50:16,#跑步日记#累死做了个摸底十公里，不考虑心率也不过如此了。我发现人只要曾经取得过成绩，就很难正确评估自己当前的实力诶，开始几公里进7分，后面累成狗，摸底对于自我评估纠正非常有必要！本来想7点起来跑步，但瞌睡实在香，由于意志过于强烈，导致我迷迷糊糊梦到自己去跑步了，还遇到个跑步明星，不过一低头，发现没涂防晒，该醒了。跑完最强烈的感受是，我需要冰水，我就像是沙漠里走了20天那么需要冰！至于为什么这么晚顶着烈日跑，我想是为了做耐热训练（本人很擅长自我宽恕）。,0,1,1,四川,成都,四川,中国
2,5022639261221422,OpenHotels,2024-04-13 10:06:19,开酒店：消费与投资，虽同是花钱，却蕴含着不同的逻辑。消费，重点在于自我满足，只要喜欢，无需顾及他人眼光，钱花得开心就好。而投资，则是期望今天的花费能在未来带来更多回报。在投资时，我们必须深思熟虑，思考未来谁会成为我们的买家，理性客观地评估每一分钱的投入是否会受到未来客户的喜爱。切勿仅凭个人喜好进行投资，误以为消费者的口味会与自己相同，这种天真的想法可能导致未来的投资失败。若因个人决策失误而蒙受损失，切勿责怪他人，应自行承担后果。,0,0,1,广东,广州,广东,中国
2,5022588869280221,Rose0591,2024-04-13 06:46:04,读书小来早晚安心语  卡罗尔·德韦克（Carol S.Dweck），美国心理学家，率先提出“成长型心态”理论，该理论鼓励学童积极评估及发展自己的潜能，在教育界影响深远。代表作有《终身成长》《自我理论：它们如何影响动机、人格与发展》《努力的意义：积极的自我理论》等。 ,0,0,0,上海,上海,上海,中国
2,5022565950816347,恒悯恒悯,2024-04-13 05:15:00,面对更多考验的时候，还要时时提醒自己内心的平衡、处事的从容、心地的大度和情怀的宽阔。能够更客观的自我评估、自我定位、自我反思和自我优化，培养自己一个更良好的内心情怀和行为表达。分享一组盛开的油菜花。#不一样的中国节气##随手拍禅意# ,1,1,1,河北,沧州,河北,中国
2,5022433918847860,Niko爱化妆,2024-04-12 20:30:21,自我评估：你的脸型适合长头发还是短头发？。。 . 发型  测评   脸型测试。 . ,0,12,0,,,,
2,5022413232276101,babyonemonth,2024-04-12 19:08:09,一个自我价值感高一点的人 他可能夸张一点 是什么表现呢 嗯 不夸张的表现就是这个人在生活中 他是能够客观的认识自己 能够正确的评估自己 嗯能够看清楚真相是什么 能够不被自己的经验所局限 嗯 能够相信自己本身就是值得被爱 值得被重视的 就是一种很强烈的值得感 这就是一种自我价值嗯，世界是孤独的，但我也认为我是有价值的,0,1,0,广东,肇庆,广东,中国
2,5022392999216814,异次元的城市,2024-04-12 17:47:45,网页链接  搞得我又期待又害怕，说自己以后要拍科幻电影那肯定是剧拍的自我评估还不错吧是的吧？别给家人们拉托大的 ,0,0,0,美国,,美国,美国
2,5022381616139818,心理健康小白,2024-04-12 17:02:31,MBTI是一种人格类型理论模型，是一种迫选型、自我报告式的性格评估测试，用以衡量和描述人们在获取信息、作出决策、对待生活等方面的心理活动规律和性格类型。MBTI测试有助于更好的了解自己和实现职业目标，更深入自己的优点缺点。可以帮助做出更明智的选择和决定，更好地与他人沟通，建立更友好的关系。测试入口：网页链接,1,0,0,河南,郑州,河南,中国
2,5022380984369534,Chiri有7个哩,2024-04-12 17:00:00,有些兴趣，我先自我评估一下//@成伤MK2:Repost,4,0,1,日本,,日本,日本
2,5022359428533835,非主流教育专家刘博士,2024-04-12 15:34:21,我的马甲是 @大熊湖的春天   请自我评估一下你享用的教育资源：  1.中国的教育资源一共18级别，你的孩子上的中国第几级别的学校  2.你孩子的班主任是什么学历  3.孩子的班主任拿正眼看你吗  4.在学校以外的地方，你的孩子能接触到多少博士（看病时遇到的医生除外） ,1,0,2,上海,,上海,中国
3,5022323747586392,动动枪DongDongGun,2024-04-12 13:12:33,自我评估了一下，吃大闸蟹是最安全的。1256，会撑死；3478都有中毒风险,0,7,3,北京,北京,北京,中国
3,5022308907614528,PrayerSavan,2024-04-12 12:13:36,躺平学今年我感觉略有小成：工作评估的时候自我打分一分钟做完，全部填“中等”，主要诉求是不要升职；同事晚上在群里讨论工作冷眼旁观；五点无特殊情况准点下班明天再说。jojo我不做好学生啦！！！ ,0,0,2,加拿大,,,加拿大
3,5022282837917903,徐州发布,2024-04-12 10:30:00,#徐州生活# 【江苏公布省级“乡村著名行动”先行区名单，徐州这里上榜】为大力提升乡村地名管理服务水平，助力乡村振兴，经自我评估、集中答辩、查阅相关证明资料、结果认定、社会公示等程序，江苏省民政厅确定15个县（市、区）为省级“乡村著名行动”先行区，其中新沂上榜。 ,1,0,3,,徐州,江苏,中国
3,5022275535637538,2024年星座运势,2024-04-12 10:01:00,宁缺勿滥！最难追的星座女！水瓶女是一个对自我要求很高的星座，不仅是对自己严厉，对未来的另一半也有着很高的期许和要求。她也是比较高冷的人，有着神秘的气息，因此往往吸引了很多的异性靠近，但却很少有人能够入得她眼。她要的是个能与自己心意相通的有缘人，因此在交往前都会仔细去评估对方，如果是对方不符合自己想要的条件，就会毫不犹豫的冷处理。因此水瓶女真的颇为难追。金牛座是很有实力的女生，但对于感情这档事，她是很要求另一半经济的基础，虽然她也有能力自给自足，但金牛女也深深知道没有面包，光靠爱情是不会长久的。加上金牛女都是皮肤白皙、气质出众，本身条件优秀的女生，自然有条件找一个经济稳定、对自己好的伴侣。也因此金牛女往往单身期很长，不是没有人追求，而是她不想委屈自己将就。别看射手女总是一副大姐大的样子，嘻嘻哈哈感觉很随性，其实在陌生人的面前，射手女都是比较高冷的，对感情她有自己的一套见解，加上射手女的能力很强，往往在工作上占了一席之地，个性上也爱自由、讨厌被拘束。因此想追到射手女并非简单的事，而射手女的眼光也颇高，普通的男人根本就看不上眼，可以被她看上的，只有有才华、有外貌、有能力，能够撑起一个家的优秀男人。处女女是出了名的完美主义，对感情更是要求甚高。只不过每个处女女重视的条件都大约不同，有的是看重对方经济能力，有的则是希望对方跟自己有着相同兴趣，有的则是看中对方的责任感。对于处女女而言，「完美」并没有一定的准则，她的心中自有一把尺，如果对方不符合自己的条件，就一定会冷漠的斩断这段缘分。#失恋分手复合# #水逆接好运# #星盘#,1,0,5,广东,广州,广东,中国
3,5022246743576292,刘欢112233,2024-04-12 08:06:35,在扑面而来的事务中学会分析重要紧急优先排序是工作有效的重要技能，要学会和上游做有效反馈沟通，然后从结果影响上自我评估判断。 ,1,1,0,辽宁,沈阳,辽宁,中国
3,5021902014254455,幻想狂劉先生,2024-04-11 09:16:45,商君书的精髓其实很好理解。比如在我讲清楚秦军功爵制“升级”和“掉级”的基本原理之后，自我评估如果进入这个体系我必死无疑，直播间里很多宅男纷纷表示规则很苛刻但待遇很诱人，嘲笑我胆小懦弱，认为搏一搏单车变摩托搞不好碾压白起零级直通关内侯，是什么让他们有这种认知呢？,41,72,264,新疆,石河子,新疆,中国
3,5022083204253458,艾艾199506,2024-04-11 21:16:44,《蛤蟆先生去看心理医生》阅读第十、十一章：在成功的人生里，父母状态，成人状态，儿童状态这三种状态都是必需的。每一种状态都很重要，都对生存有价值。成人状态有它的特殊重要性，我们只有在成人自我状态里才能学到关于自我的新知识，才能思考当下的事情，评估自己的行为或者倾听别人对你的看法，而不马上驳斥。这一点很难做到，我们应该先去接纳自己，慢慢疗愈自己。,0,0,0,山西,晋中,山西,中国
4,5022033383785336,律政佳人666666,2024-04-11 17:58:46,自信是谁给的呢？既然是自信，自信不是别给的，而是自己给的。自信是一种自我评估，是对通过自身能力而达成目标的信念。自信可以通过自我暗示与取得阶段成功而不断巩固。 ,0,0,0,山东,泰安,山东,中国
4,5022028949621316,不要蓝莓酱蛋挞,2024-04-11 17:41:09,Z还是教会了我很多角度，比如做作的不直抒胸臆就是做好了不被在乎的准备，比如难过就该说难过生气就该说生气，比如人要有重不重要的评估，比如自我倾向，比如过度同情是滥情，是对自己情感的不尊重。 ,0,0,0,天津,,天津,中国
4,5021982556422778,全民健心计划,2024-04-11 14:36:48,自我评估 如果把人分五类：自燃者、易燃者、难燃者、不燃者、阻燃者，你认为自己属于哪一类？ ,0,0,0,浙江,杭州,浙江,中国
4,5021951013684529,司晨一鸣,2024-04-11 12:31:28,🐔👑🌸个人品牌打造的方法论。 总结一下，一个IP的养成是需要在三方面去下功夫的：1、能力（定位）要不定期对自我进行评估，发现自己所做的事情的性质，产品人、运营人、还是营销人，那个部分比重最多。根据市场的反应，评估出你所要投入精力的比例。2、人脉（不同平台和合作伙伴）优势能力是木桶的长板，决定着你是否会被看见。   各种平台、人脉是木桶的桶箍，熟悉+惊喜才是爆款流行的主要因素。3、方向通过不断试错，结合自己的优势，确定方向。各种努力，都是为了最终的IP主标签服务。能够让一个人一直走下去的最根本原因，是他内心中的信念。,0,0,0,北京,,北京,中国
4,5021897444038238,谭点点Shire,2024-04-11 08:58:36,#思考的力量#   批判性思考，是对现有初级思考的再次加工，对初级思考，也就是第一层思考，比如说，洞察力，偏见，事实等这些思考，再进行一次分析评估。  批判性思考是对自我管理，自我约束，自我监督和自我调节的一种思考或者提升自己的一种方式。 ,0,1,0,广东,深圳,广东,中国
4,5021888787253865,TANGERINEVV,2024-04-11 08:24:12,女命，紫府做命在寅，做人格局较稳，女生对异性比较有依赖性，但 男方容易聚少离多  22-31大限走的比较难受，欲望多要求高 自我不平衡而失望，心理健康状况有待评估  今年开始走丁巳限，大疾忌入大迁冲大命，身体容易有些小毛病，建议今年及早检查身体（眼心脑），多有吃药现象 紫微斗数 ,0,0,1,广东,深圳,广东,中国
4,5021721635589531,泰州发布,2024-04-10 21:20:00,#泰州消息#【省级名单！泰州+1】根据省民政厅《开展“乡村著名行动”助力乡村振兴实施方案》（苏民区〔2023〕10号）等文件要求，经自我评估、集中答辩、查阅相关证明资料、结果认定、社会公示等程序，确定南京市浦口区等15个县（市、区）为省级“乡村著名行动”先行区。其中，泰州市高港区入选。 ,0,0,1,,泰州,江苏,中国
4,5021701508696919,医学界网站,2024-04-10 20:00:01,特应性皮炎治疗有两大关键阶段，患者还可以自我评估疗效!#特应性皮炎# 医学界网站的微博视频 ,1,1,2,,上海,上海,中国
4,5021632832473338,用户5593474132,2024-04-10 15:27:07,①评估主体从内部转向外部，为了弥补电子政务内评估的劣势，顺应政府治理模式变革的潮流，我国应突破以往电子政务绩效单纯由政府自我判定的局限，积极引入多元化的外部评估主体，借助&quot;外脑&quot;的智力支持，探索建立电子政务绩效的目标管理联席评审制度。②评估导向从过程转向结果，为确保电子政务建设的可持续发展，我国的电子政务绩评评下标评估和结果评估相结合。③评估范围从整体转向局部，不能用全盘信息化的思维来审视我国的电子政务绩效，而应适当收缩绩效评估的范围，将评估的立足点定位在微观层面。④指标体系从静态转向动态，在设计电子政务绩效评估的指标体系时，既不能过度滞后，也不能盲目超前，要从电子政务所处的实际发展阶段出发，避免指标设计的概念化和理想化．,0,0,0,北京,,北京,中国
4,5021620131596910,音音LYin渡海为宁,2024-04-10 14:36:39,#刘宇宁珠帘玉幕# #刘宇宁燕子京# 摩登兄弟［魔羯說魔羯］之［關你（我）屁事］👉討厭被人管，因為我們的自我要求，是自己評估過且可承受範圍，所以你（旁人）的指導，就謝謝再聯絡。👉討厭管人家，我們正想辦法讓自已更好，此時焦點就是放在自己身上，哪有閒功夫關注到你（除非是對自己很重要的人）所以你們會覺得魔羯很認真對待，很負責，就是這樣來的。因為專注……而頭家，你的寵粉，說明我們對你是真的很重要🌈因為這就是事實💞圖片來源@與寧同行_可樂要加冰愛寧要用心 @摩登兄弟刘宇宁向死而生 -摩登兄弟刘宇宁热辣滚烫 -摩登兄弟刘宇宁刘宇宁魏劭✨刘宇宁折腰刘宇宁卓不凡✨刘宇宁天行健刘宇宁帝林✨刘宇宁紫川摩登兄弟刘宇宁❣️刘宇宁❣️宁哥❣️棚主❣️lyn,3,23,37,中国台湾,台北,台湾,中国
5,5021619430885286,微整之王忠杰,2024-04-10 14:33:52,泪沟看似只是下眼眶边缘与脸颊交界处存在的一条沟壑，但有时候当眼袋比较凸，视觉上也会形成一个假泪沟，黑眼圈太重也会有色差假象。  填充之前一定要明确清楚，自己眶下凹陷的具体原因，准确的术前评估，是治疗的保障。  #正确的抗衰治疗思路##哪些时刻需要自我支撑# ,0,0,6,北京,北京,北京,中国
5,5021583103755466,扁舟花底z,2024-04-10 12:09:31,所有自我责怪的人，基本上都是自谦或者是客气；但是喜欢责怪别人的人，我都要做个人品评估看看皮囊下面到底是什么个妖魔鬼怪😅 ,0,1,0,英国,,英国,英国
5,5021575952992745,咸侃,2024-04-10 11:41:06,3岁以后父母能逐渐找回家庭与自我之间的平衡了，若夫妻双方已形成作为父母的独立价值体系，选那个能让家庭成员生活体验更好的方案。若有任何一方需要向外寻求身份认同获得安全感，也是非常合理的需求，那就接受老人对育儿的深度参与&amp;夫妻双方让渡私人空间，这些机会成本需要夫妻双方共同衡量做好评估。,0,0,1,北京,,北京,中国
5,5021475477913719,Justinshih,2024-04-10 05:01:51,人的”确认偏误”会让一个人以不正确的眼光看待自己和评估他人。一个人最难得的，是保持客观和清醒的头脑以及谦下的态度。人在低谷时，要看到自己的”迷之自信”；处高峰时，要眼中有别人，戒除傲慢自我。这才是为人处世的智者。卯时，晨安～～🌥️🌥️🌥️ 上海,0,0,1,上海,上海,上海,中国
5,5021326034864834,虚假体面的狸老师,2024-04-09 19:08:01,去年这时候完全没有这么焦虑、恐惧，而且现在完全无法分辨是因为面对未知而产生的毫无必要的恐惧还是产生于准确自我评估下的实质性恐惧，怎么会这样，明明一年前应该更焦虑 ,0,0,0,福建,厦门,福建,中国
5,5021324594643936,易楠问道-情感姻缘,2024-04-09 19:02:18,12星座最难克服的爱情困惑   · 金牛座 ·  和对方年纪差太多想法差太远  金牛座个性务实，不奢望攀龙附凤的他对生活环境差距太大的人会敬而远之，而跟年龄差距太远的情人在一起有可能会失去自我的这件事对金牛座而言是一件很严重的事情，有个性的他这时会再度评估这段感情的可行性。 ,0,0,0,上海,上海,上海,中国
5,5021294167329606,陕西省图书馆,2024-04-09 17:01:23,陕图读书会 | 发现自我:《盔甲骑士》的启示时间：2024年4月13日（星期六）14:30-16:00地点：陕西省图书馆（长安路馆区）一楼多功能厅主讲嘉宾：马啸西安国际医学中心医院心理评估与治疗部心理治疗师国家二级心理咨询师发展与教育心理学硕士陕西省儿童心理健康专委会委员《盔甲骑士：为自己出征》作者: [美]罗伯特·费希尔（Robert Fisher）出版社: 机械工业出版社索书号：B84-49/706，中文借阅三区参与方式：请扫描二维码预约线下活动西安·陕西省图书馆,0,0,1,,宝鸡,陕西,中国
5,5021249918995446,小良子198002,2024-04-09 14:05:34,2018年，《柳叶刀·精神病学》发表了来自耶鲁大学团队的一项研究，该研究涉及超过120万名成年人。研究通过对比经常锻炼的人群与久坐不动的人群在心理健康方面的自我评估，发现即使是每周仅进行1小时的运动，对于改善抑郁症状也具有显著的效果。令人震惊的是，持之以恒的锻炼不仅促进了人们的身心健康，换算成经济收益经济价值也十分可观。研究表明，这相当于每年增加了约17万元的收入，或者等同于在高中毕业后额外获得一个大学学位所带来的收益。纳入研究的运动种类共75种，被划分为八大类别：团队运动、自行车骑行、有氧或体操运动、跑步与慢跑、娱乐性运动、冬季运动、游泳及池边活动、以及散步等 南宁·福克斯健身瑜伽会所(时代茗城店),0,0,0,广西,南宁,广西,中国
5,5021233670521643,苦咖啡天下第一,2024-04-09 13:01:00,烦死了，电话不断。一个都不接 自我评估应该是…… ,0,0,0,北京,北京,北京,中国
6,5021186883060622,黄油pocky,2024-04-09 09:55:04,在自我介绍自我评估的时候感觉自己真的是商品 ,0,2,0,北京,,北京,中国
6,5021084149350995,抹茶无糖脱脂,2024-04-09 03:06:51,我再也不希望送银朔和某个队友关系变更好了 和队友保持距离的做法完全正确 硕儿现在划线自我评估是还可以忍得住的范围 ,0,0,0,新加坡,,新加坡,新加坡
6,5021066118300080,大型快乐蟑螂,2024-04-09 01:55:12,（特种部队LCA还需要干评估危险等级的活吗，也对扭曲和异想体由他们回收）罪种是同质化的 无法成为扭曲的人变成的东西………………所以说罪种是自我意识没有强到能够保持个性、被集体无意识淹没的产物？（智勋你是不是忘了自己还写过考验=罪种这样的设定，这玩意完全不是人变的是从水里捞出来的啊…你这河里怎么还有零点几个人）,0,0,1,浙江,杭州,浙江,中国
6,5021033465909414,小梨泡泡儿,2024-04-08 23:45:27,怎么现在还有人道德绑架说什么社会了 必须每个人都要有驾照 我就是那种路怒上了车一脚油门想撞死一排人的那种人 想冲进去 踩到底 让我开车还是想让我早点进去早点死呢 自我评估我就是不适合开车 什么年代了一定要自己开车才行 我打车 地铁不能出门了是吗 ,0,0,0,上海,上海,上海,中国
6,5020951811721088,华水微博协会,2024-04-08 18:20:59,#子湖夜语# 清明小假期已过，新的学习任务再次来临。同时也是新一轮教育教学评估来临的时候，这不仅仅是学校的机会，也是自我提升的机会。  网页链接 ,0,0,2,,郑州,河南,中国
6,5020876935005389,棉花糖在冬天等待,2024-04-08 13:23:27,情绪容易不稳定的人更需要自爱的勇气，这样才能不断提升认知的高度，实现扬长避短。因为敏感的情绪意味着对世界的灵敏触角，风起于青萍之末，能从微小处觉察变化与异常，是一种天赋。而这种天赋如何服务于自我？至少可以变为一种觉察，对关系压力值的评估。 ,2,0,6,上海,,上海,中国
7,5020852330697118,STAYOUT__,2024-04-08 11:45:41,喜欢一个人去探店，跟陌生人谈天说地聊一些无关紧要的话题让我很放松，萍水相逢，不用计算信任成本，不用做风险评估，也不会有期望落空。相遇一场，然后相忘于江湖，不必刻意逢迎伪装维系。短暂而真实的自我时分，就算不虚此行。 ,0,1,0,广东,东莞,广东,中国
7,5020843419635644,大易生书院易学吴从复,2024-04-08 11:10:17,大易生书院/吴从复“潜能评估”，活动通知：吴从复导师，多家企业和上市公司易经风水顾问，服务过无数的企业和企业家从几十万到几百万再到几千万甚至上亿。现实生活当中，很多人确实是千万级以上的命局，但是并没有实现自我的价值，社会价值，如果你相信易经风水，相信奇门遁甲，可以联系吴从复老师，为你做一个潜能评估，也许能帮助你实现人生梦想。评估方法，准备手相图片一张，男左，女右，出生年月日时，是农历还是阳历注明一下，具体几点钟，出生城市等告诉我，（知道自己家的阴阳二宅字向并有阳宅户型平面图更好）然后约定时间电话微信:AA15086774803讲解。活动时间2024年4月8日至4月15日                ——大易生书院/吴从复,0,0,0,重庆,,重庆,中国
7,5020828926742191,医悦汇,2024-04-08 10:12:41,医悦汇#健康科普##肺部手术# 【人是铁饭是钢，肺部术后吃得好，营养才能更加棒！】❤️❤️如何判断营养状况？如何判断患者的营养状况，我们营养师可是有各种各样的秘密武器。今天为大家介绍一下患者和家属如何进行自我评估。BMI=体重（kg）/身高(m²)  ☺正常范围：18.5~24.9😣小于18.5为营养不良❤️❤️测量体重很重要！俞医生建议😉：患者可以一周进行一次体重测量，并做好记录。一旦出现体重下降的情况，需要调整饮食。🎃🎃手术后该怎么吃？“手术后该怎么吃？”这个问题常常困扰着家属。医生会告诉大家应该吃流食、半流食等。那么什么是流食？什么又是半流食？今天让我们一起搞搞清楚吧！七大营养素蛋白质、脂肪、碳水化合物、维生素、矿物质、膳食纤维、水💪蛋白质、脂肪、碳水化合物是产生能量的物质，更是重中之重！内容来源：上海市胸科医院,2,3,4,北京,,北京,中国
7,5020617696608446,张老师教你远离疼痛,2024-04-07 20:13:19,肩胛骨内侧疼痛，自我评估#肩胛骨缝疼的缓解方式##肩胛骨疼痛不要乱按摩# 苏州·金鸡湖 张老师教你远离疼痛的微博视频 ,0,0,3,江苏,苏州,江苏,中国
7,5020577071104305,无常笑匠玄虚君,2024-04-07 17:31:53,5年过去了，回看过去发的种种状态，再自我评估一下当下，虽然还对自己有诸多不满，但也算是进步颇多，从病中走出，彻底摆脱了药物，附带还变得没有那么傻叉了，很好很好，拍拍自己的肩膀，创造全新的未来去吧～ ,0,0,0,浙江,杭州,浙江,中国
7,5020568780800365,用户7738569552,2024-04-07 16:58:58,穷就去创业创业是一种非常好的方式来实现自我价值和增加收入。如果你有一个好的创业想法并且准备好去实现它，那么你应该充分准备并努力工作，以实现自己的梦想。同时，也要注意风险和市场变化，做好创业计划和风险评估，避免过于冒险。通有钱就不叫创业了，那是投资。创业就是从无到有，从零到一，从微小做起，再慢慢把雪球滚大赚钱方法#兼职赚钱创业群##决定攒钱后真的要精打细算##网购维权取证记住这7步##创业##工作哪有自己重要#,0,3,5,浙江,衢州,浙江,中国
7,5020562336256179,阿斯伯格女孩在抗抑,2024-04-07 16:33:21,抑郁症转发，我也参加这个活动哦~招募10-16岁的【高功能孤独症、阿斯伯格或社交焦虑】青少年参与评估青春期是自我意识以及同伴关系发展的关键时期，个体在青少年时期会出现更多的情绪困扰。想知道您的孩子是否存在情绪困扰？想知道您的孩子同伴关系怎么样？欢迎来北京大学参加我们的项目～评估总时间约2-3小时，包括访谈、问卷和社会性注意等部分；若您的孩子没有智力评估结果，我们还将进行韦氏智力测试评估结束后，您和孩子将获得：心理状态评估报告、小小科学家证书以及精美北大文创一份。#阿斯伯格# 报名二维码详见海报 北京·北京大学第六医院海淀院区,0,1,0,内蒙古,包头,内蒙古,中国
