页码,微博id,微博作者,发布时间,微博内容,转发数,评论数,点赞数,发布于,ip属地_城市,ip属地_省份,ip属地_国家
32,5010221507018891,困困冰原提,2024-03-10 03:42:35,我太清楚我是个什么玩意儿了仗着自己脑子好使 一点都不努力死到临头挣扎一下还能有个不错的结果我的迷茫和焦虑全都来自于清醒的自我认知带来的心安理得的躺平和偶尔发作的野心之间的矛盾我是个从不瞻前顾后的人对我来说风险评估只是让我看清前面有什么它并不能决定我走或是不走 更不可能让我回头我又是个很乐观的悲观主义者 明明知道尽头是什么 也会觉得无所谓 随它去吧所以我一路走一路摆 也算是活着 虽然偶尔想尝试一下所谓热烈的人生 但一潭死水才是我的常态 不管是精神还是情感哦 在我眼里世界就是一袋巨大的比比多味豆我可能是什么可乐威士忌或者碎薄荷之类的小玩意儿吧尸体凉凉的 很安心,0,0,0,上海,,上海,中国
32,5010157713229937,kissyy_come,2024-03-09 23:29:06,复制粘贴：财经大学继续 总结认清自己是一个复杂而深刻的过程，涉及自我反思、自我评估、接受反馈、目标设定、尝试新事物、记录思考和感受以及寻求专业帮助等多个方面。以下是详细信息：反思与观察。花时间思考自己的想法、感受和行为，观察自己在不同情境下的反应并思考其中的原因，有助于了解自己的优点、缺点和情绪倾向。自我评估。考虑自己的价值观、信念和目标，思考自己看待事物的方式以及自己内心的动机和愿望，自我评估可以帮助你认清自己的核心价值和意义。接受反馈。请亲近的朋友、家人或同事提供对你的反馈，他们能够给出你在他人眼中的印象，从而增加你对自己的认识和了解。目标设定。确立清晰的个人目标和愿望，这有助于你更好的了解自己的期望和动机，设定目标时要注意确保目标与你的价值观和天赋相符。尝试新事物。不断尝试新的活动、技能和经历，这可以帮助你发现未曾意识到的能力和喜好，尝试新事物也有助于发现自己的兴趣爱好和热情所在。记录思考和感受。通过写日记或记录自己的思考和感受，你可以把握到自己内心的变化和发展，这也是一个反思和了解自己的方式。寻求专业帮助。如果你觉得自己很难认清自己，可能需要寻求心理咨询师或专业辅导来帮助你探索自己的内心世界。此外，认清自己还包括了解自己的生理自我、心理自我和社会自我，以及通过他人评价、合理的社会比较等方式来认识自己。日常粉丝头条使用攻略世界文学名著文学名句汇总大智若渝,0,1,0,湖南,长沙,湖南,中国
32,5010112221811873,每日早晨阳光,2024-03-09 20:28:20,#现在的年轻人是扣扣搜搜的花了很多钱# 学会评估消费所带来的长远价值，把钱花在能提升自我、增加幸福感的事物上，这才是新时代年轻人应有的理财观。 ,0,0,0,浙江,杭州,浙江,中国
32,5009931304436477,某顺,2024-03-09 08:29:26,《正确的自我评估》之所以选三八节这天，讲正确的自我评估，还是因为某顺愿意和希望看到更多闪闪发光的女性。长相漂亮≠闪闪发光，前者是皮囊，后者是神采；挣钱多≠闪闪发光，前者是财运，后者是气质；桃花频密≠闪闪发光，前者是仅对异性有性魅力，后者则是对男女两性都具吸引力。所以，眼前这个热闹喧嚣的世界，即便社会新闻里动辄涌现出新的女富豪、女能人，可能有人会因自我渺小感而被此类消息冲击到，但对某顺我来说，所谓活得风生水起的女性，对我从来都形不成刺激，我根本不关心。我更关注一个女性是否活得闪闪发光、熠熠生辉。大家现在可以微合双眼、认真思索那么几秒，想想你身边是否有活得闪闪发光、熠熠生辉的女性。如果有，恭喜你，你有比较切实生动的学习对象了；如果没，那更好，因为你有机会成为你圈里第一个活得闪闪发光、熠熠生辉的女子。不要怀疑自己有无这能力。因为我前面都说了，闪闪发光并不等于好看、不等于有钱、不等于桃花多，而是有神采、有气质、有持久的吸引力。我见过在外光鲜亮丽、体面招摇，但她家里却乱成狗窝一般的所谓时尚达人，这样的人善于伪装，而装这件事本身又很难持之以恒，所以她也就没法对别人产生持久的吸引力了；我也见过职场中如鱼得水、得势得利的事业女子，但一个人的脑子里如果只有工作或挣钱，这样的人真会无趣空洞到令你只想早点逃离她；我还见过打扮上从头精致到脚、生活上也尽现物质档次的人，她的心思全用在了怎么强调自己所在的阶层上，这样的人至多能收获比她穷比她丑的人的恭维和艳羡，在我眼里她真是仅拥有她努力展现的那点东西。如果你们也和某顺一样，认同某顺对自己的评价，某顺我算是一个见多识广的人吧？那么我前面所说的，装体面的、装精致的、和迷恋钱的这三类女性，就算眼前再风光红火，她们也很难让我心仪。当然，她们并不是为让我心仪而来人世的，我的看法也不代表真理，所以她们继续保持她们的特点就好，她们自己满意自己就ok。这里我不是批评她们的活法，而是说她们不具备吸引我的能力。算是见多识广的某顺我对闪闪发光的灵魂的追逐，非常的坚定和认真，她们不是闪闪发光的人，就不是我关注的人。但你们可能有机会成为闪闪发光的人呀，我为什么这么说？因为闪闪发光并不是一个市侩的物质指标，而是更趋向于人类理想中的精神层面。前几天在我家的那个学生，本身已具备高素质，我给她的最新建议是，”让自己格局更高“。而去年这个时候她离开我家时我的建议是，“知识分子要有社会责任心”。我希望每个自认寻常的女性，都有让自己格局更高一点的追求，尔后你就拥有了闪闪发光的可能。你希望自己成为什么样的人，你就有可能成为什么样的人。纵观中国历史，所有至今还被正面传颂的人物，无一例外，都是因为他们在他们那个时代，活成了闪闪发光的精神体。你只有持久地照亮别人、影响别人、感染别人，你才是真正闪闪发光的人。而照亮影响和感染他人，都不需要你的姿色、你的票子、以及你时常端着的架子。因此，我才说各位都有机会成为闪闪发光的女性，也因此，某顺认为我们对自我的评价都要更准确才是。好吧，今天的重点虽然有些绕，但最终还是绕到了——现在某顺就来说说重点，我们如何正确的自我评估。1 ，首先是对个人外在的自我评估。其实大多数人都长得实在一般，都是扔在人堆里就立刻淹没的水平。所以你不要为自己的外在而过于处心积虑了，能时刻记得自己的外在就是“中等稍偏下”即可。也所以，中等偏下的你我，都不必在个人行头上投入太多资金，咱的硬件天生不够格，后天软件再改良也糊弄不过去。但别人说我们好看时，咱心里要有点逼数，不能当真，在大力装扮和钱的胁迫下，是会让某些眼力不好、心术更不好的人夸咱美腻，但清醒应该是我们还能无偿占有的美德之一，我们一定要坚持有自知之明这个美德。2，其次是对个人生活的自我评估。不要以为你眼前和之前的生活都糟烂无比，都配不上你的公主身子甄嬛志向。其实我们每个人眼前过着的，都是最匹配我们的生活，如果之前有努力，而现在还是不见努力出我们想要的局面，也仅代表两点：一是我们努力错了方向，二是我们努力的还远远不够。所以，对眼前生活的一味不满，很不理智；对现有配偶的一味嫌弃，更是缺脑子。不是说你这一生都非得以你不能接受的面目呈现于世，而是叫你理智地重新审视自己，审视自己的实力够不够过更好的日子、睡更好的人？最终答案往往是NO。3，第三是对所处圈子的自我评估。圈子，含括我们身边所有的人，亲友同事家人甚至邻居都算，那些经常与我们打交道的人，构成了我们的社会关系。如果你觉得你的社会关系不够高级，大体是因为你个人水平限制了你的圈子，而不是你只能与自己看不上的这群烂人虚与委蛇。现实世界确实分三六九等，虽有阶级已固化之说，但总有漏网之鱼还能拼力突破围堵、游向远方。所以，如果你在现有圈子里抱怨不断，还不如长点志气，努力让自己冲出阶级藩篱，登高一级又不是完全没可能。但如果你都没力气没勇气冲出去，那就早点死心塌地、接受自己眼下的圈子吧。括弧，这点能让你在职场在社交中都平静下来，括弧完。4，最后是对个人价值的自我评估。这一点针对的是人际关系中的失措和失衡。总以为自己的付出没换来等价回报，总以为对方不及你爱他那般爱你，总以为自己没有受到公平对待，总以为自己理当获得重点关爱……这都属于个人价值的自我评估出问题了。你虽有付出，但如果别人的付出比你还要多呢？或你付出的并不是环境或对象所需要的呢？你直觉对方不爱你，你的直觉没问题，但有问题的是，你忘了爱本身完全是你自觉自愿的，他给你机会爱他，对你已是赐予；你以为自己没被厚待，但有无可能是你就配这待遇呢？你以为自己理当被重视被偏爱，但你真的具有被重视和偏爱的实力？好了，以上四点就是我们需要重做的自我评估。你的评估靠谱，你才会有平常心，才能渐渐喜欢上你正在过着的日子，积极起来的你才能拥有发光照亮别人的可能，最终你就离那个闪亮有趣的灵魂不远了，也最终能让我与大家发现你，那个在任何物质环境里都闪闪发光的你，相当有魅力。 j,12,2,38,湖南,长沙,湖南,中国
32,5010110457320561,zz老张zz,2024-03-09 20:21:19,溪木源积雪草修护面膜30片   80     2024/3/9 20:21:36  做女人难，做个好女人更难，要想成为社会上举足轻重的好女人，男人梦寐以求的好女人，就是难上加难了。既然我们做了女人，就尽可能的做得完美，自己满意，才能让别人满意，所以自信，自我评估也很重要！如果你已经是好女人了，你想让她再完美一点，就要加点坏坏的感觉拉：美丽、俏皮、解风情、懂浪漫，并且要从骨子里坏得洒脱，坏得大气，坏得高兴，坏得让男人舍不得、搁不下，夜缠梦扰，为之消魂。这种女人就是好女人中的极品了，你做到了吗？,0,1,0,江苏,南京,江苏,中国
32,5010090564520209,虚假塑料炸猪排,2024-03-09 19:02:16,cha是一个相当明显的商品化过程。“视觉对象以商品形式——大量存在、彼此竞争、公开展示、易被替换——存在时，尤其会让注意力变低。”注意力变低以后，评估物化就会取代承认的过程。这不仅发生在受众身上，与此同时爱豆也在疯狂自我评估和物化，如此循环。 ,0,6,1,吉林,长春,吉林,中国
32,5010044191510328,长春中妍赵胜有,2024-03-09 15:58:00,馒化是什么？馒化，称为面部过度填充综合征（FOS），是填充材料在全脸部的过度使用后不断累积所引起的一种现象，错误的美学评估，有问题的注射技术，不正确的填充物放置，错误的产品选择都是常见原因。馒化的机制1、错误的位置：注入位置错误时，增加颧隔膜的不透水屏障（阻碍淋巴引流）2、错误的剂量：注入量过大时，直接压迫淋巴，从而导致水肿（持续几天到几个月）3、抑制表情传递：当微笑和其他类似面部表情时，颧大肌的肌肉收缩会拉紧面横隔并改变其形态，从而改变深层脂肪区室的移动，填充物注入后会增加面中部的总体积，影响面中软组织的生理活动性多余的填充物注入面中浅层脂肪时，会限制肌肉拉动口角蜗轴的能力，阻碍面部肌肉的运动，使口腔连合和水平朝向颧骨弓，从而露出不自然的微笑。#什么是正确的抗衰思路##哪些时刻需要自我支撑#,0,0,0,吉林,长春,吉林,中国
33,5010030439434421,希望2121,2024-03-09 15:03:21,遇事不沉着冷静需要怎么解决，冷静思考，是指在面对困难、问题或决策时，不受情绪或外界干扰，保持冷静、清晰的头脑，通过分析、评估和推理，寻找最佳解决方案的过程。它是一种理性思维方式，需要人们具备自我控制、分析判断、逻辑推理等能力。在生活中，我们常常会遇到各种问题和挑战。如果情绪失控，就会容易做出冲动、不理智的决策，进而产生后悔和损失。但是如果能够冷静思考，就可以避免这种情况的发生。冷静思考可以帮助我们分析问题的本质、寻找问题的根源、评估各种可能的解决方案，从而做出明智的决策。     总之，冷静思考是一种非常重要的能力，它可以帮助我们在面对各种困难和挑战时，保持冷静、清晰的头脑，寻找最佳解决方案。这种能力需要我们不断地训练和提高，只有掌握了冷静思考的方法和技巧，才能更好地应对生活和工作中的各种挑战。,0,0,0,浙江,丽水,浙江,中国
33,5009700300522088,轩师处世之道,2024-03-08 17:11:30,越不怕领导，越招领导喜欢1、主动在上级面前展现自我上级要管理和决策的事情众多，若不多展示自己的工作成果，到绩效评估时他们可能不清楚你的具体贡献。每次与上级和同事讨论工作事务时，我都专注聆听，虚心采纳有价值的建议。偶尔在团队聚餐或轻松交流中，谈及行业动态或生活趣闻，这样能让上级逐渐加深对你的认知和了解。2、面对上级的私下表扬，只需表达感激，无需过度解读若上级在公共场合赞扬你，而在私下却对你严格要求，切勿生气，这其实是真心关注你的成长。如果上级平日里常常表扬你，但在晋升机会来临时却没有考虑你。请自我审视，是否已经有一段时间没有与上级进行深度的工作对话了。3、避免越级汇报只有当直接上级的行为确实存在明显问题时，可以采取如谈心般的方式，委婉地向上一级领导表达你的观点。此刻，应视上级为尊长，诚恳地道出自己在工作中遭遇的困扰和迷茫。4、不可抢夺上级的风头你完全可以在某些方面表现得比上级更出色，但务必找准自己的定位。即使上级有时行事不拘小节，你也应保持冷静，懂得调整心态。5、向领导请示工作时，提供选择题或判断题式的方案你的角色是顾问和建议者，遇到问题时仅抛出问题而无解决方案会让上级觉得你不尽职且不可靠。6、具备洞察力有助于你在职场上步步高升初入职场时，在参加员工大会后，我将椅子归位。并随手带走留下的纸杯，还贴心地关掉了会议室灯光，这个细微举动多年后仍被上级记起并赞赏。7、逢年过节给上级发送个性化的祝福短信避免群发式的信息，首先真诚地送上节日祝福，接着表达对他们培养和指导的感激之情。最后表明自己对公司及上级的忠诚度。再次强调这一点！#知识科普接龙##亿点曝光计划##职场##微博新知博主#,16,1,19,河南,三门峡,河南,中国
33,5009829259641911,珍珠一瞬,2024-03-09 01:43:56,所谓的自我效能感就是我清楚自己的能力，作为一个客观的评估，不失意不气馁。明天得硬抗啊，注意休息好。 ,0,0,0,云南,楚雄,云南,中国
33,5009825199292521,茉莉爱吃桃子黑布林,2024-03-09 01:27:47,少找自己问题，频繁找自己问题的人是吸血鬼最爱的血包，吸血鬼可以是个人，组织，环境中的任意一个，直至你被吸成人干，就到了被彻底丢弃的时候，因为失去了利用价值。人的存在本身是不应该被工具化的评估和对待的，这种关系即使来自自己也是一种自我霸凌。建议少找自己问题，多问问外界配不配，外界和他人是否在其位谋其政，是否尽了应尽的责任。,0,0,2,广东,广州,广东,中国
33,5009804401840096,上班以前是乖乖女,2024-03-09 00:05:10,学了这么多年英语 自我评估 阅读水平B1 听力A2 口语写作A1 归来依旧只能和韩梅梅对话替李华写信 ,0,0,0,北京,北京,北京,中国
33,5009675064182129,江南显富贵竹,2024-03-08 15:31:13,为什么有时候感觉告诉别人自己要做的事，往往会失败？因为当一个人满足做一件事的条件的时候，不需要告诉别人“我要去做xx了”，而且做完了说“我xx了”。说了自己要去做某一件事的人一般是有想法却不满足做事条件，其实一开始就已经自我评估，我做这件事是否能成功，对于成功的把握没有靠后面的努力提升，所以往往无疾而终。,0,0,0,广西,玉林,广西,中国
33,5009601521781077,好的_可以的_,2024-03-08 10:38:59,#普通人没必要对孩子进行苦难教育#这样说吧，想找个普普通通的写字楼格子间的工作，还必须读个大学，过了六级，考出几个证|书呢。然而，决定“有一个孩纸”之前，无须任何测试，几乎没有任何资质要求。这已经比较离谱了。所以，某些家长，完全不懂“起跑线”的含义与作用，又不做自我评估，让孩纸一出生就在泥坑，却依然坚信“孩纸还不够苦”，依然试图运用自己对孩纸的那点“权势”，持续规训，满足自己的发|泄|欲与权力欲。,0,2,15,福建,厦门,福建,中国
33,5009575600980311,归舟1221,2024-03-08 08:55:59,杨紫“知人者智，自知者明”。自知之明，是对自我认知的深度把握，是对自我价值和能力的清晰认识，让我们在纷繁复杂的世界中保持清醒的头脑，不被外界的繁华所迷惑，也不因自身的缺陷而自卑。有了明确的自我认知，我们才能准确的评估自己的能力和潜力，从而制定出更为实际和可行的目标，在追求梦想的道路上，找到正确的方向。@杨紫,0,1,0,山西,吕梁,山西,中国
33,5009542058345147,用户5613819698,2024-03-08 06:42:42,每一次的跌倒，都是一次对自我的挑战。它让我们重新审视自己，重新评估自己的能力。在这个过程中，我们可能会发现自己的不足，也可能会发现自己的潜力。但无论结果如何，我们都应该珍惜这些经历，因为它们让我们更加了解自己。早安 ,0,0,0,重庆,重庆,重庆,中国
34,5009425654090736,o0哎呦嗬咯嘞0o,2024-03-07 23:00:09,轮i人的自我修养 1.拒绝拍照.无法正视自我 2.莫挨老子 3.与我无瓜 4.不愿走出自我舒适圈 5.无法评估自身价值 6.跟你不熟 7.十大孤独体验基本通关 8.时间越长越孤独 9.常以嘉宾的身份见证挚爱 ,0,0,4,江西,赣州,江西,中国
34,5009236871873309,皇家马德里足球俱乐部,2024-03-07 10:30:00,「安切洛蒂：表现不佳必须自我反省；裤袜、米利唐或将回归」「低空飞过」我们面对的是一个没有什么可失去的强敌，吃到了超乎想象的苦头。本场表现不佳，但重要的是挺进了1/4决赛。「自我反省」我们施压的强度不够，防线也太靠后了。我在阵容上犯了错误，必须自我反省，做好评估为下一场比赛做好准备。如果重新安排阵容，将不会是今天的设置。「战术设置」我期望中场发起更多高位逼抢，保持快节奏，压制反击，但本场的表现却十分薄弱，防线也过于靠后。这和上赛季对阵利物浦时的局面有所不同，与此前面对沙尔克时却有着相似的碰壁，我们必须以不同的方式备战。「伯纳乌的嘘声？」是我们应得的，你必须接受批评。严格要求的伯纳乌球迷一直是我们前进的动力。在1/4决赛中，气氛将更加壮观。「威尼修斯」非常精彩的进球。犯规动作？我认为那够不上红牌。「略显疲态」我们失去了活力，掌控力和控球权都有所下降，我们必须充足休息、打起精神。好消息是1/4决赛也许会迎来库尔图瓦和米利唐的回归。「战术改变」防守层面，楚阿梅尼和卡马温加搭档钳制奥尔莫和西蒙斯很重要。我们选择433阵型，以便克罗斯策动进攻。然而对手利用两名中后卫和内线收拢加以应对，我们只好无功而返。踢得不好责任在我。#皇马之声# #欧冠联赛# 皇马,13,25,223,四川,成都,四川,中国
34,5009413691934403,信屌丝儿闫得永生,2024-03-07 22:12:37,人类幼崽真的太可爱了 每天贴贴100次都不够带崽做了4月龄儿保 评估发育达到5个半月水平 80分优秀她得了106分 已经从出生的满分💯宝宝 成长为卓越了哈哈哈 老母亲留下了感动的泪水评估显示社交属性优秀 自我认知一般 医生要求在家只能统一叫一个名字（她大概有十几个昵称吧） 她爹就搞了个积分制 叫错一次扣一分 每天积分最低者第二天不能抱孩子 哈哈哈哈 于是…,0,0,0,陕西,西安,陕西,中国
34,5009286235424677,北方夕鹤,2024-03-07 13:46:09,过去一年的关键词之一是“质疑理解（成为）” ，各种事情上。自我评估宽容度比之前提高了，表现之一是几乎不会在微博公开阳怪气各路□□，很好，阴暗度⬇。 说回到质疑理解，一方面是外力驱使，一方面是年龄增加。我感觉不算坏事，除了前后的反差效果不太有观赏性 ,0,1,1,浙江,杭州,浙江,中国
34,5009256941617722,隆泽隆哥法师,2024-03-07 11:49:45,12、 自我测评：我的心能（心量和心力）在几级真实的评估自己，才是对自己负责。了解自己真正的位置，才能更好的采取行动去提升。我的心量在        级我的心力在        级我的心能在        级我当下最应该做的是：                                                可以汇报给隆哥老师。每次评估完写上日期在读书会群晒出来。 专栏 · 心能究秘--隆哥心力法门理论和实修01,0,0,1,湖北,武汉,湖北,中国
34,5009233231744234,北海有点冷,2024-03-07 10:15:32,饭的成长日记 | 01最近完全能接纳“有人讨厌我”这个事情了，或者说对“负面反馈”更加脱敏、更加顿感了；我甚至会害怕没人批评我——能面刺寡人之过者受上赏。以前会害怕负面评价是因为我对我的自我价值不稳，我会参考别人的评价来评估我自己。但现在我完全自我接纳，我接纳我的缺陷，我也接纳我的不完美，我完全自爱。所以我只会确认这件事只要我的发心是善的就ok，至于那些零星的负面评价那就无所谓；伤害你的人他们代表不了世界，他们如何对待你，是源于他们的经历他们的生活里的人教他们的，那是他们的命。但如果你被伤害了，就用他们来定义世界，你就也掉入了和他们同一个地狱，这才是他们给你造成的最大的伤害；,0,2,5,福建,厦门,福建,中国
