页码,微博id,微博作者,发布时间,微博内容,转发数,评论数,点赞数,发布于,ip属地_城市,ip属地_省份,ip属地_国家
15,5021388873927035,郑小白白白,2024-04-09 23:17:43,今天的科研就到这里结束叭是看不懂的证明和意识到以后都要加上去的实验啊就组会听到的内容晚上看论文正中眉心早上师兄：这个论文选数据的时候把依据伯努利、马尔科夫、循环选择都试了一下做了对比听到这话的我be like 啊？？要做这么多嘛？好麻烦，还好不一个方向晚上在看组会准备讲的论文看到实验的地方emmmmm？？？这熟悉的字眼是早上组会听到的啊啊啊啊啊啊啊啊啊啊啊啊怎么这样以后怕不是做实验也要都加上去才可以和这篇论文做对比了#小郑的求学之路#,0,2,2,广东,广州,广东,中国
15,5021189853938387,Algo姐,2024-04-09 10:06:53,医学硕士医学博士不学看病，实验室疯狂研究细胞研究小白鼠。找工作的时候，医院不看你医术水平咋样，主要看你那个垃圾论文发了几篇。  医学界规培老司机疯狂吐槽：“咱们做那个科研到底有没有用？数据它真不真实？统计方法用的科不科学？”哈哈哈 Algo姐的微博视频 ,16,5,32,浙江,杭州,浙江,中国
15,5021382763873146,秋小小嘛,2024-04-09 22:53:26,读研的唯一收获就是发现自己确实不是读书和搞科研的料，而是一个扔到人群里就看不见的普通人，意气风发没了，灵气没了，剩下的就是冷漠和麻木，对于我这种自身能力平平也不善手交际的人，卷又卷不动，躺又躺不平，摆又摆不烂，觉得最后悔的就是考研读研，一想到写论文找数据跑回归，就头疼心慌紧张害怕，一想到开学就烦躁焦虑，一想到要和老师同学们的相处，就发愁烦躁，每天都想什么时候能毕业，什么时候能上班挣钱，上班至少有钱赚，读研什么都没有，真的什么都没有。,0,10,5,湖南,长沙,湖南,中国
15,5021375082791837,波夏梦,2024-04-09 22:22:55,晚上十点 在下数据 准备收拾东西走 学姐：你不等着了吗 我：啊？（是真的啊出声了真的很震惊我一个科研混子真的不应该呆到十点我要回寝我的尸体很不舒服了 ,0,0,1,湖北,武汉,湖北,中国
15,5021353311472609,爱柚是小牛仔啊,2024-04-09 20:56:24,科研？做尼玛科研，去尼玛的实验，垃圾数据，天天做一堆垃圾玩意儿（掀桌 ,0,0,0,江苏,盐城,江苏,中国
15,5021316337895171,眼神张海明,2024-04-09 18:29:29,整形技术越来越发达，为啥失败率却越来越高？公立三甲整形主任，说点你不知道的！20年前了吧，我就开始在“中国医学科学院整形外科医院”做大拉皮了，那会儿我是面颈科的主任，科研处的处长。为什么整形失败率越来越高，我觉得我能回答这个问题。那会其实不管是设备、理论知识、临床数据，跟现在都是没法比的。但反而，我们那时候的失败率是非常低的，我在八大处做了三十多年整形，还没有一例投诉。现在整形失败率高的根本原因，就是不正规的医美机构大行其道、整形医生过度包装。我们那会儿是只有主任医师才有资格做大型整形，而且都需要技术审核。所以很多求美者说我做的大拉皮自然（如图二），那都是最基本的，如果我做的不好，医院早就把我的项目停了。而现在，行业缺少把控，一心向利。很多医生，整形都还没做几年，就开始动手做大型项目了，更多的是停留在理论阶段，术中很多突发状况他不知道怎么解决，应对不当就会导致失败。再就是广告问题，其实早些年我们八大处也打广告，我记得那时北京很多公交车上，都印着我们的广告。现在很多人跟我说，你一个公立三甲的整形主任，还打广告？变味了！这个也可以回答你们，没变味，我们最早也打广告。所以广告宣传是一把双刃剑，可以让人更便捷的了解适合自己的项目，遇到好的医院、医生。也会让很多缺乏经验，甚至是资质不全的医生，摇身一变成了大专家，整形失败的风险，自然就提高了！所以做整形，大家就认公立医院，就认有经验的医生，最好是主任医师。我跟大家分享一个很现实的问题，八大处医生的工资，可以说高于绝大多数同行，因为资源优先级高。社会地位更不用说，地处首都，全国唯一的三甲专项整形医院。人往高处走，顶尖的医院聚集的一定是顶尖的医生，大家在这个圈子里去选择，会收获一个更有利的结果，包括其它地区一些口碑好的公立医院。这番话对同行不友好，但我觉得，对求美者，是有帮助的。#医美抗衰#医美#拉皮手术#,0,0,0,天津,,天津,中国
16,5021307773911890,陕西阳光网,2024-04-09 17:55:27,【#卡斯柯信号系统精准监测列车前方500米内环境风险#】随着全自动无人驾驶系统在西安地铁16号线落地运用，西咸新区入区企业卡斯克信号（西安）有限公司持续加强全自动无人驾驶和基于云平台、大数据、5G、北斗等下一代信号系统关键技术研发。卡斯柯多个科研项目已经有具象产品展示。超视距智能感知及预警技术，主要用于探测列车前方侵入限界障碍物，精准实时监测列车前方500米内环境风险，进一步提升无人驾驶列车运行安全。西安广播电视台的微博视频,0,0,0,,西安,陕西,中国
16,5021307544800463,Earuan,2024-04-09 17:54:33,做科研困难重重 但没想到遇到的困难会是 学校买的数据库不全 很多想看的文献没有下载权限 西八shake！！！只好委托原来学校的同学帮忙下载文献 我相信HIT 你肯定买了所有的权限 right？！！！然后想要上微博来吐槽 刷到关注的博主去喝咖啡 没有领到labubu的贴纸 我也想要点开咖啡小程序 在库底咖啡一顿乱翻 为什么只有海绵宝宝和派大星 没有我可爱的拉布布！！这不公平。切回微博一看 好嘛 原来是瑞幸家的活动 对不起了库迪 骂错了然后进入了瑞幸 发现不仅没有贴纸 连100多的咖啡杯都么得了我恨这个世界 嘤,0,0,0,新加坡,,新加坡,新加坡
16,5021277843360718,漏风小站第17分店,2024-04-09 15:56:31,这b学 科研键盘手要录入那么多数据 还下周五交论文框架 还连续两周讲课程ppt 偏偏这个时候实验室分叶子翻倍 然后呢 您猜怎么着 大姨妈来了 想创飞这个世界 ,0,6,5,山西,太原,山西,中国
16,5021273266849688,红眼睛的大灰鹅,2024-04-09 15:38:20,我对挂梯子不能看知网和不挂梯子进不去GPT这个矛盾是不能谅解的 嗯我也不想在知网龟速找数据但导非让从硕博论文里找真蛮绝望 想工作了真的 两边儿快把科研热情全磨没了 ,0,0,2,天津,天津,天津,中国
16,5021272309763889,超好的牙膏,2024-04-09 15:34:32,看到实验室的师姐们做实验有困惑可以求助男朋友、甚至数据处理都可以放心交给男朋友、好羡慕好想有一个跟自己同专业的男朋友、感觉科研路上孤军奋战太难了😫 ,0,0,0,贵州,贵阳,贵州,中国
16,5021247893145307,彧玊叽,2024-04-09 13:57:31,闲鱼撑起了本国科研的半边天，什么数据都买得到 ,0,0,0,广东,广州,广东,中国
16,5021238349008791,丁香谷老五,2024-04-09 13:19:35,精英联赛小组赛还剩最后两天，妈的xg能不能别搞了，能不能痛痛快快赢一把，就非得搞科研，就非得跟谁都一比一，就非得跟谁都五五开。不能二比零拿下黑名单，就得跟香槟神拼刺刀了。去年年底单位组织的那个数据营一个月一万经验的挑战，到现在已经过去三个月了，说好了给的奖品到现在都还没发，拖着。反正公司照发就行，其它的随意。,0,0,0,美国,,美国,美国
16,5021165314115138,路远不远路,2024-04-09 08:29:22,综合分析类：小米新能源汽车近日，小米SU7新能源汽车官宣上市，迅速冲上热搜第一，27分钟预订50000台的数据，更是引爆全场。对此，你怎么看？（路达面试模拟预测题）百家争鸣：1、首先，小米SU7新能源汽车的崛起，代表了我国汽车等制造业行业的科研技术和科技创新水平的进步。2、其次，小米SU7新能源汽车的崛起，也离不开政府的大力支持。3、最后，小米SU7新能源汽车的崛起，也说明了民众对国货品牌的认可度的提升。山东事业编山东选调生山东省考青选计划国考山东三支一扶,0,0,0,山东,,山东,中国
17,5021059254585286,妈妈人生是综咪啊,2024-04-09 01:27:56,对不感兴趣的人的认知就是比科研数据还无聊 ,0,0,0,天津,,天津,中国
17,5021034438200539,過路人是一個大可愛,2024-04-08 23:49:19,改论文改得好痛苦，不得不说读研以来还是潜移默化受到了一些科研训练，之前本科觉得写得很好的课程论文现在读起来觉得好拉，做了一堆数据分析却没有理清基本逻辑和思路，“故事”也没有讲好，明天接着改吧不管结果如何尽力而为吧，以后还是要尽量和老师多多交流，老师点拨之后感觉就是不一样 ,0,4,0,上海,上海,上海,中国
17,5021030890082397,被动语态_,2024-04-08 23:35:13,讨厌科研的不知道第多少天，今晚发现半个月前的数据跑错了又重新跑，做的新内容做了半天发现数据没改一晚上白跑，想拓展新内容结果新内容结果异常不理想，还有一个月交稿咱还有一章没做，不知是该骂自己还是骂自己。顺便骂一句土木楼的网清明过后卡得我连文献都看不了，算了，打不了鱼死网破 ,0,1,0,上海,上海,上海,中国
17,5021020697662962,智翰-,2024-04-08 22:54:43,处理数据好无聊好枯燥，希望未来的科研人们能坚持下去吧 ,0,1,0,河南,焦作,河南,中国
17,5021012953665648,小福贵掉头发啦,2024-04-08 22:23:57,妈的天天就知道催催催，卡住了啥也帮不了就会让看论文，还科研不是我妄下定论的。问中期交材料啥也不知道，做个毕设天天让我创新创新发文发文，连IP和input都分不清，自己测的文件都找不到给我发错的数据。这家伙真的带过毕设吗？ ,0,0,2,河南,开封,河南,中国
17,5021003350018580,Neveah_老萌,2024-04-08 21:45:47,写数据预处理，写模型结构，写训练函数，写采样函数，写主函数。不到一个月，写完了一个Project。中间还穿插了挑战极限的挑战杯，零零碎碎的党务工作。我每一步都完成得很慢，每一步都好难。看见它跑起来的那一刻，我心跳都快了好几倍。果然，科研不可能顺利的。生成的数据真是乱七八糟，我的idea可能一开始就是错的。可能需要换一个模型，再换一个数据集，然后从头开始没关系，阶段性的小胜利也值得记录一下。加油啊啊啊啊啊啊啊冲啊啊啊啊,0,2,1,湖北,武汉,湖北,中国
17,5020938570039585,行走的蘑菇a,2024-04-08 17:28:22,科研人的崩溃就在一瞬间， 上一秒：处理了一个礼拜的数据，还差一步，今天就可以用它来跑模型了！ 下一秒：rm -rf 删错了文件夹…  这周六还要开组会， 心塞… ,0,0,0,吉林,长春,吉林,中国
17,5020937561051596,倒置阻生,2024-04-08 17:24:22,如果数据分析和写论文都是我一个人来那请问最后在学校申报科研组员最后名单的时候，我能填我自己吗真的有点崩溃 ,0,0,0,湖北,武汉,湖北,中国
17,5020524822662381,粗面CM_,2024-04-07 14:04:17,新买的小硬盘，喜欢爸爸的大科研数据吗？ ,0,15,25,广东,深圳,广东,中国
18,5020848924919665,平静的黑酸奶牛,2024-04-08 11:32:09,#什么样的人能用到1tb内存# 可能是那些处理大型数据集、进行复杂计算的科研人员 ,0,0,0,河北,保定,河北,中国
18,5020820151471972,上海杨浦,2024-04-08 09:37:49,#杨浦news##小杨带你看新闻# 【这一科研团队，收到一封飞跃2000多公里的感谢信】“用行动为我们展示了专业、高效的上海理工大学作风！”近日，上海理工大学收到了一封来自中国航发哈尔滨轴承有限公司的感谢信。在这封飞越了2000多公里的感谢信背后，是机械工程学院迟玉伦老师带领的机床制造大数据研究团队的不懈努力，团队深入企业生产一线，持续开展了一年多的航空发动机轴承制造数据研究，为“钢铁心脏的跳动”贡献上理力量。,0,0,1,,,上海,中国
18,5020810309797832,巧兰啊巧兰,2024-04-08 08:58:43,一位患者一开始在跟牙医讨论自己牙齿治疗的事儿，我在旁边看着书等家人，等我再仔细听了一下他俩的聊天，好像就开始讨论样本量、研究数据了…这话题是不是太流动了？现在医患之间都开始合作科研了？ ,1,0,0,广东,广州,广东,中国
18,5020798291805047,义薄云天立本心,2024-04-08 08:10:57,刘学义lxy#刘学义画眉# lxy#刘学义计丹阳# 计专家的“任性”——看着有科研数据的胶卷就要被敌特给抢走，计专家心生一计，直接把胶卷全部曝光，因为所有的数据分析都在他脑海里，就算没有胶卷计专家也能分毫不差的列出所有数据来，这就是计专家的“任性”，谁都不会想到他会这样处理胶卷(话说计专家这个镜头好酷😎)。@Mr_刘学义,0,0,1,湖南,长沙,湖南,中国
18,5020736058295237,留给未来回忆,2024-04-08 04:03:40,#研究称饭量减3成能多活20年#《Nature》上一篇论文，用科学数据论证了控制饮食，不要吃太饱，就可以抑制胰岛素，减缓基因的转录速度，从而逆转人体衰老变化。一个猴子寿命在20岁左右，但每天进食量减少30%后，猴子寿命有了明显增长，最高可达43岁。这是一项重要的科研成果，为长寿指明了一条切实可行的道路。相对现代的科研成果，我们看看中医几千年前在这个问题是如何认识的？中医认为吃饭七分饱，胃口好到老，要食勿令饱，这样身材好又健康长寿。七分饱同时要做到两倒，哪两倒呢？子时大睡，午时小憩。就是说晚上一定要在子时之前(11时之前)入睡；午觉则只需在午时(11时～13时)休息30分钟即可。做到七分饱和两倒，人体则阴阳平衡，经脉通畅,0,0,0,辽宁,沈阳,辽宁,中国
18,5020682594812491,·Wonderland,2024-04-08 00:31:13,用Mac 最烦的一点真的是 有几个科研软件只允许windows还得找别人借电脑处理数据 我服了  但是Mac转换文件格式真的好方便 ,0,0,0,北京,,北京,中国
18,5020679256673294,相面知心4153,2024-04-08 00:17:57,生病了就要多休息但是科研精神真的值得敬佩，其实两者并不矛盾糟蹋身体，当然身体就差，全心科研，积累数据，为后人植树，福生无量~~~ ,0,0,1,河北,沧州,河北,中国
18,5020672808190152,第几高冷很高冷,2024-04-07 23:52:19,烂得像💩一样的科研真的有必要做下去吗 半年了因为这破数据 一点进展都没有 实在不行换方向一切重来吧 ,0,0,0,北京,,北京,中国
18,5020639467672403,健康的大美女呀,2024-04-07 21:39:51,读研对我来说就是为了发现自己没有搞科研的性子，尤其不愿意整天面对一堆数学公式和数据各种算算算。 但造化弄人，考上了研究生还报了一个如此严厉的导师，看来老天是为了磨我的性子吧，以前太随意了，随意的有点过了好像。 ,0,0,0,新疆,伊犁,新疆,中国
19,5020629444854860,山西日报,2024-04-07 21:00:01,#图看山西# 【团队科研 让晋文化绽放光彩】4月7日，太原理工大学数字媒体研究领域高永利教授、张晓教授带领团队成员开展文化遗产数字化保护研究工作。该团队围绕石窟、墓葬、古建等山西文化遗产，探讨文物数据采集与信息云端共享数据库构建的可行性，探索对考古材料数据进行文化解释的可能性和具体办法，为基于设计学的多学科云端数据库搭建提供新的思考路径和解决方案。,0,0,0,,太原,山西,中国
19,5020597883765340,牛神nddpg111,2024-04-07 18:54:36,#室温超导研究作者被坐实数据伪造抄袭# 124页调查报告出炉！曾轰动全球、被《自然》两度撤稿的室温超导研究作者迪亚斯被坐实数据伪造、抄袭等多项不当行为。  数据伪造，其研究成果自然也不值得相信，没有价值可言。科研结论一定要真实可靠，经受得住实践的检验，绝不能允许造假。 ,0,0,0,湖南,怀化,湖南,中国
19,5020577046463701,用户6788618310,2024-04-07 17:31:48,#室温超导研究作者被坐实数据伪造抄袭#科研就是草台班子，都是垃圾 ,0,0,0,安徽,合肥,安徽,中国
19,5020576420200610,perovskite我还是爱你,2024-04-07 17:29:18,真的不适合做科研，看到丑数据会恶心作呕 ,0,0,1,上海,,上海,中国
19,5020572079621715,编辑部_马编辑,2024-04-07 17:12:04,《江西建材》知网主管单位：江西省建材集团有限公司主办单位：江西省建材科研设计院出版周期：月刊ISSN：1006-2890CN：36-1104/TU(2023版)复合影响因子：0.154(2023版)综合影响因子：0.058该刊被以下数据库收录：JST 日本科学技术振兴机构数据库(日)(2022)栏目设置：政策法规、行业资讯、综述、试验与研究、质量控制与检测、规划设计与建筑、岩土工程与勘察、工程技术与应用、建设经济与环保。,0,0,0,河北,张家口,河北,中国
19,5020564652297122,KiraSxz,2024-04-07 16:42:33,搞科研，分析数据不能被表象所迷惑，计算和实验之间存在误差是一定的，要分析误差的成因，不能简单的说“我觉得怎么怎么样误差减小了，所以怎么怎么样”。 ,0,0,0,山东,青岛,山东,中国
19,5020552094549655,小梅花情怀,2024-04-07 15:52:39,#室温超导研究作者被坐实数据伪造抄袭#室温超导研究领域的这一丑闻反映了学术不端行为的严重性，并凸显了科研工作中诚信和透明度的重要性。该事件还在持续发酵中，未来可能会有更多的细节和后续处理结果公布。 ,0,1,1,广东,佛山,广东,中国
19,5020545322060235,不晒太阳啊晒月亮,2024-04-07 15:25:45,在无人机细分领域中，大疆创新等企业在全球消费级无人机市场上扮演着引领者的角色；而在工业级无人机市场，以“飞行器数据服务”为核心的生态正快速形成，极有可能成为低空经济中率先取得经济效益和科研成果的领域之一。 ,0,0,0,广东,广州,广东,中国
19,5020543080466700,嗷嗷里给11,2024-04-07 15:16:50,Scopus是什么啊?全球最大的出版商爱思唯尔(Elsevier)推出的科研管理、学科规划数据库，是全球最大的同行评审期刊文摘和引文数据库。尽管学医的小伙伴们一提到文献检索，首先可能想到的是Pubmed和Embase数据库，而对Scopus并不那么“感冒”，很多小伙伴甚至可能都没听说过，但Scopus的优势在于其信息面覆盖非常广泛，其中还包括部分中国学者发表量最多，而未被其他数据库收录的医学期刊。除此之外，Scopus具有强大的检索导航功能，能够实现文献、引文、机构、作者之间的相互链接。在查找Pubmed、Embase等数据库的同时，检索一下Scopus，可以起到优势互补的作用，对于文献查全、查新还是很有帮助哒~#scopus# ，#scopus期刊投稿#,0,0,0,江苏,南京,江苏,中国
20,5020541829775525,用户7886307115200309,2024-04-07 15:11:51,科研好难，没有地方能给我实验，也收不上数据 ,0,1,0,上海,上海,上海,中国
20,5020497284962369,刘进今天si了吗,2024-04-07 12:14:52,#读研会惩罚每一个考上研的混子#真的很痛苦，不喜欢科研，不喜欢做实验，不喜欢录数据，一看文献就头疼 如果不是规培必须浪费三年，我本科毕业就去打工了 ,0,3,19,江苏,苏州,江苏,中国
20,5020523964666705,哈尔滨市图书馆,2024-04-07 14:00:53,#馆内动态#   中国知网数据库培训——“书山有路 知网为径”为了更好地服务读者朋友学习与科研，帮助读者全面了解中国知网CNKI数据库的功能和价值，提高文献查阅、论文撰写与科学研究的能力，哈尔滨市图书馆特邀中国知网专业讲师为广大读者进行数据库使用技能和技巧培训，解决广大读者使用CNKI资源过程中存在的问题。欢迎广大读者踊跃参加。一、培训主题：“书山有路 知网为径”二、培训内容（1）我馆订购资源及模块说明（2）需求文献精准获取（3）检索结果多维筛选  三、培训时间2024年4月13日9：30四、培训地址哈尔滨市图书馆三楼报告厅,0,0,0,,哈尔滨,黑龙江,中国
20,5020477942662142,内蒙古日报,2024-04-07 10:58:00,#京蒙协作赋能内蒙古创新发展# 【韩佳彤团队创新发明成果获国际金奖】#内蒙古发展绿色低碳的新质生产力#近日，在莫斯科举行的第二十七届“阿基米德”国际创新展会上，由呼和浩特市现代信息技术学校副校长韩佳彤教授带领教科研团队研发的“城市生命线市政工程建设运维大数据及安全管控技术转化及推广应用”创新成果斩获金奖。　　该创新成果开拓了工程建设安全运维协同管理的技术新理念，打造了基于物联网大数据技术的城市生命线工程建设运维大数据及安全管控技术转化及应用推广平台，形成了一套经济适用、生态环保、操作简便、技术先进的工程建设安全及运维协同新体系，创新发展了公共服务基础设施的新质生产力。该创新成果经教育部科技成果查新确认、内蒙古自治区电子信息产品质量检验院功能测试确定，填补了国内外空白，达到国际领先水平，取得原创性的“重大突破”。　　“阿基米德”国际创新发明展展品由专家委员会和国际评审团进行挑选和评估，从新颖性、实用性、设计、低成本、社会经济影响和市场机会等方面进行评审，优秀项目方可获得由俄罗斯及其国际合作单位颁发的金、银、铜奖。  （记者  刘洋）,0,0,7,,呼和浩特,内蒙古,中国
20,5020470859008575,复旦大学,2024-04-07 10:29:51,#复旦·科研新动态# 【微电子学院陶俊教授团队与昆山杜克和上海交大合作提出利用未标记数据进行半监督学习的锂电池寿命预测方法】锂电池具有能量密度高、使用寿命长等优点，当前已被广泛应用于电动汽车、手机等各个领域，在现代社会中起着至关重要的作用。复旦大学微电子学院陶俊教授团队与昆山杜克李昕教授团队、上海交通大学万佳雨副教授团队合作提出了利用未标记数据进行半监督学习的电池寿命预测方法——部分贝叶斯协同训练（PBCT）。近日，相关成果以“Semi-supervised learning for explainable few-shot battery lifetime prediction”为题发表于《焦耳》（Joule）。与现有的方法相比，PBCT在寿命预测精度上取得了高达20%的提升，且几乎无需额外的数据采集成本。因此，在同样预测精度的前提下，PBCT可以大幅度降低数据采集成本。此外，该研究还发现，将未标记数据纳入训练过程中，有助于揭示影响电池寿命的关键因素，这些因素在仅对标记数据进行分析时往往会被忽略。因此，PBCT这一监督学习技术为高效且具备可解释性的数据驱动电池状态估计开辟了新的路径，引领了未来的研究方向。（来源｜微电子学院）,2,0,11,上海,,上海,中国
20,5020102537775190,复旦大学,2024-04-06 10:06:17,#旦夕学堂##学习资源分享# 初入科研的你🧐是否难以找到合适的数据集？是否苦于难以迈出这研究开始的重要一步？别担心，这份网站合集可以让你秒变大神！数据分析、机器学习、海量文献检索…这份秘籍都可以帮到你📚数据集成so easy!希望大家可以通过这篇“秘籍”了解和获取有助于科研的数据集和代码库并在实际应用中取得佳绩💪（来源｜复旦研究生）,29,2,68,上海,上海,上海,中国
20,5020138201943541,电竞小小徐,2024-04-06 12:28:00,Keria这种逆天选手能拿冠军，是对冠军的侮辱~打辅助只想玩显眼的，ad中单直接当孤儿，一看数据还挺好看，实际上是队内最÷的选手。顺风就浪，逆风红温。也就是T1其他几个人太狠了平时一打大赛就犯怵，掉小珍珠这种玩意能混到冠军？一辈子原批的儿子常规赛所谓科研这么多英雄，结果大赛连个屁都不敢放，跟原批反差明显#英雄联盟s14# #英雄联盟#,11,11,327,河南,洛阳,河南,中国
20,5020294316036401,宫大拿的废话日记,2024-04-06 22:48:20,迎接我的这一个月是： 项目结项、活动报账、Q1总结会、活动申请、科研项目跟进、重点医院数据分析。 ,0,1,0,辽宁,沈阳,辽宁,中国
20,5020236993003678,那不如去试试,2024-04-06 19:00:32,搞科研的最怕遇到舍友这种学术杠精，把人家的论文的公式和数据重新推算，还做了仿真验证，发现过程和结论无法复现，问原作者没回，一气之下给出版社发邮件，说他数据造假给他撤稿…… ,0,3,1,上海,上海,上海,中国
