页码,微博id,微博作者,发布时间,微博内容,转发数,评论数,点赞数,发布于,ip属地_城市,ip属地_省份,ip属地_国家
18,5019763017254556,becase88,2024-04-05 11:37:09,梦到去面试一个需要在现实世界跟异能世界中穿梭的工作，试用期时来了一场闭卷考试，看着密密麻麻的题目头昏脑胀，最让人头皮发麻感到恐惧的是，那些科目，没有一项是我擅长的。而我的同事，各有所长。 ,0,1,0,湖北,仙桃,湖北,中国
18,5019730229070200,呼拉圈1982,2024-04-05 09:26:51,#大学教授开生死课带学生参观殡仪馆#教授开设生死课，让我们学会直面死亡，用遗书书写内心的恐惧与期待。#大学开生死课不考试作业是写遗书# ,0,0,0,江苏,镇江,江苏,中国
19,5019452443724489,-MOvON-,2024-04-04 15:03:02,我草嘞…我爸问我当初怎么不报清北…虽然我出乎意料考得很好但是考试成绩出来之前我一直处于读不上书的恐惧状态……考上了就谢天谢地从来没觉得自己报低了怎么家长还反过来不满足了 ,0,2,0,湖北,武汉,湖北,中国
19,5019349914486172,四时平安-JY,2024-04-04 08:15:37,君霄cp 就，你们别太离谱了啊， 又出来这么多，还带题库了！！！考试做题的恐惧！！！   （更新一下，附个题库链接） ,0,47,75,河南,安阳,河南,中国
19,5019412174472699,整肃馍泥下攻真的不可以吗,2024-04-04 12:23:01,怎么恐怖呢就是前面说老婆出远门了，后面却又拿着相框让作者看着说你本来可以见但是不愿意，家里处处是妻子的影子又只有相片，作者还因为想见对方妻子的渴望而感到恐惧……我边看边觉得像是恐怖怪异小说……但又觉得这种考试应该不会出这种吧…… ,0,0,0,湖南,长沙,湖南,中国
19,5019346491409260,渝舟之,2024-04-04 08:02:01,我都24了，做梦还能梦见高考，要考试了，我啥都不会，高考果然是中国人一生刻在骨子里的恐惧😱 ,0,0,0,广东,中山,广东,中国
19,5019204153511092,-努力奋斗的小羊,2024-04-03 22:36:25,曾经以为很遥远的地方，即将到达。 大城市的多元性，让我逃出了被考试困住的恐惧。 ,0,0,0,广东,广州,广东,中国
19,5019179319298804,梁造作zZ,2024-04-03 20:57:44,其实在组暑假车的时候我都在想我能坚持到暑假吗 又期待暑假又恐惧暑假 暑假就代表期末考试我的课业能不能完成呢 ,0,0,0,广东,中山,广东,中国
19,5019165389493702,piu程,2024-04-03 20:02:23,考试的恐惧再一次支配我😱😱 ,0,1,1,陕西,咸阳,陕西,中国
19,5018849861440654,上清懋岚,2024-04-02 23:08:35,东亚恐惧困扰一生。  有一天梦中惊醒，原因是梦到了自己在读研究生，写不出论文，考试不会写。哭着说不读了能不能不读了，梦里面老师威胁我退学要进局子。  然后梦就醒了。哪怕毕业多年，仍然心悸。  考试就是一生的恐惧。读书是东亚人难以逃离的梦魇。 ,6,17,66,四川,南充,四川,中国
20,5018739676026799,艾尔鲨,2024-04-02 15:50:45,一紧张就肠胃难受，像有虫子在爬……我已经得上考试恐惧症了。 ,0,4,2,吉林,,吉林,中国
20,5018680218620356,舍予miya2-7,2024-04-02 11:54:29,让一年级的孩子考试就是在折磨孩子，折磨老师。根本不符合儿童身心发展规律。给发育慢的孩子辅导简直是挑战忍耐极限，但又不能怪他。毕竟现在就是对文字不敏感的阶段啊。不是孩子笨，是教育太卷，走的超前。有什么成长意义呢？对他的人生除了增加考试恐惧又有什么意义呢？ ,0,3,1,广东,佛山,广东,中国
20,5018667752096962,没有烦恼的麦脆圈,2024-04-02 11:04:57,上课打太极 老师叫4个一组 我每次都是第一组 我都紧张的不行啊啊啊 然后动作又记的不是很清 今天说要太极半期考 我上去开头又紧张的忘记了  什么时候能克服这种上课打太极考试的恐惧啊 ,0,2,0,福建,泉州,福建,中国
20,5018642725470630,海淀区八里庄健康教育,2024-04-02 09:25:30,【如何克服焦虑？】焦虑是即将面临某种处境时产生的一种紧张不安、恐惧的感觉和不愉快的情绪。几乎每个人都有过这种情绪体验，比如考试、面试之前，都会感到焦虑。正常人的焦虑是建立在现实情况之上的，所担心的事情也符合当时的处境，适度的焦虑有利于我们应对面前的危机。下列这些方法可以帮助我们在日常生活中预防焦虑，不妨试试： 1、迈开腿这听上去像是预防心血管和糖尿病，但是对预防焦虑也有效。想想看自己有多久没有跑步了？跑步或慢跑，可以有助于消耗体内的多余的可的松，促进有益的神经递质分泌，改善睡眠和情绪。2、管住嘴不要养成抽烟、喝酒或喝大量的浓咖啡等不健康的习惯，少吃油炸食品、高糖碳水化合物等食物，多吃富含镁或维生素B1、维生素B12、维生素D等健康食品。健康饮食习惯有助于身体和心理健康。3、会呼吸许多焦虑和惊恐发作的患者“不会”呼吸，有的人存在过度换气，即过度的呼出二氧化碳，过度的吸入氧气。但是过度换气还会让人感觉到缺氧，患者于是不断的进行深呼吸，这反而会加重焦虑体验。即便对着纸袋呼吸也可能不成，因为患者很难遵循，而且二氧化碳本身也会引发患者的焦虑，所以要重新学会呼吸。方法是，试着练习从鼻腔里吸气5秒，屏住呼吸2秒，接着从口里呼气7秒。每天练习15 分钟～30分钟，能改善过度换气，减少焦虑。（来源：北京回龙观医院）,0,0,0,,北京,北京,中国
20,5018570842702317,用户7837713857,2024-04-02 04:39:52,还有两周就考试了，已经学了两周，进入了疲倦的时期，对咖啡馆和图书馆感到恐惧。晚上打开cbvv的视频开始重温。先把昨天的vlog又看了一遍，然后再看了关于平衡的，最后看一集他去参加马拉松训练营的。视频开始说，跑步其实不需要任何准备，只要去跑就好了。我立即关掉视频，去图书馆。我希望只要我坐在那里就好了，坐在那里就是我的胜利。,0,2,3,英国,,英国,英国
20,5018515016778894,和严抬头看看,2024-04-02 00:58:02,每次比别人分少就会很b溃  为什么大家愿意去做这些。首先是因为浩翔自己做得好。  我等4.22  等我考完。  4.22应该就能好好打帮了，至少比这个考试“轻松”一些。  呜呜呜，有些焦虑。浩翔，一起努力吧。  就让恐惧发生。 ,0,0,0,湖南,长沙,湖南,中国
20,5018477748555994,小喇叭花今晚要早睡,2024-04-01 22:29:57,怎么感觉人生总会因为各种不同的事感到悲伤不幸，单身会羡慕恋爱的甜蜜，恋爱会陷入患得患失的恐惧，考试没考上会感觉自己真的好失败，考上了也会质疑自己的能力。 ,0,4,2,湖北,武汉,湖北,中国
20,5018431827216476,如果不快乐你就喝可乐JC-Tt,2024-04-01 19:27:28,今天的心态印证了一个道理：实力不行就特容易破防啊啊啊啊啊啊啊啊啊啊啊啊被考试支配的恐惧 ,0,0,0,陕西,榆林,陕西,中国
21,5018874496158371,每天都真nmd烦呵呵,2024-04-03 00:46:29,还没睡着  在想事情   我突然觉得考研带给我的伤害其实很大     我现在会恐惧考试觉得自己的能力不行 ,0,3,0,云南,红河,云南,中国
21,5018841788716795,璃子-umherirrenderHund,2024-04-02 22:36:31,昨天下午午睡，继梦见之前被pua的悲惨处境之后，又梦到了开学，我在我爹妈面前哭的哗啦哗啦的，说我不要开学，就差在地上打滚撒泼了果然人类对开学和考试的恐惧是刻在DNA里的睡醒后遂决定珍惜当下快乐young and rich的时光，之后回牢里至少也是个饱死鬼，立刻出门去步行街和西湖吃吃喝喝逛逛最后拎着沉甸甸的一大堆吃的喝的，感慨自己的恩格尔系数真是高的吓人#璃子今天也在到处浪##璃子奇奇怪怪的梦#,0,0,4,广东,惠州,广东,中国
21,5018801446060110,立秋好节气,2024-04-02 19:56:11,下午睡觉还梦到了考试迟到 明明特别特别累但还是被这个梦吓醒了 醒了后天已经黑了恐惧疲惫的感觉也一直环绕着 准备边听音乐边写论文 但音乐是备考的时候听的 现在再听 备考那段时间的记忆又涌进脑海 于是无力感自卑感也袭来 为什么第一次拼尽全力要这么让自己失望 我又要花多长时间才能与自己和解 我还会不会有再一次拼尽全力去做某件事的勇气 下次再去努力的时候又会不会想起这次考试然后退缩,0,0,0,江苏,淮安,江苏,中国
23,5018193959846203,Lucas星星星星星,2024-04-01 03:42:16,希望硕士的时候，我身边有个朋友，真心朋友那种，我们可以彼此真正地抱团取暖，希望是女生。期末考试周前焦虑恐惧到吃不下饭是我的常态，真得很可怕 ,0,0,0,法国,,法国,法国
23,5018128302475979,英语主播皮卡丘,2024-03-31 23:21:22,#事业单位联考##事业单位##事业单位联考答案# 2024年上半年事业单位联考已经结束。今天给各位参加事业单位考试的小伙伴准备的公考资料是：2024青海、陕西、山西事业单位考试真题试卷及答案解析（电子版pdf）。对答案可以让考生逐渐适应考试结果的反馈，减少对未知的恐惧和焦虑。【对答案】2024青海、陕西、山西事业单位考试真题试卷及答案解析（电子版pdf） ,0,0,0,福建,龙岩,福建,中国
23,5018119422350257,一些樱桃酱糕点,2024-03-31 22:46:05,好好好，成功确诊科三恐惧症，还没预约考试呢我就开始焦虑紧张上了 ,0,0,0,河南,三门峡,河南,中国
23,5018104771643064,译薇7,2024-03-31 21:47:52,#岁延译恳#  今晚吃螺蛳粉 同学的小老鼠 同学给的小零食ovo 这周上三天 而且其中两天要考试 相当于只上一天 不过再考虑要不要考试 因为有点考试恐惧了 ,0,14,4,广东,河源,广东,中国
23,5018080239947158,小戴没有眼袋噢,2024-03-31 20:10:23,被考试恐惧症支配的一生。。。 ,0,2,1,四川,成都,四川,中国
23,5018078016180135,xxhhqbdbjYiCc,2024-03-31 20:01:33,我感觉我有考试恐惧症一告诉我要考试我就有压力 ,0,3,0,广东,,广东,中国
23,5017968234463880,JnnnnnYa,2024-03-31 12:45:19,果然，不管多大年龄， 都逃不开被各种「考试」支配的恐惧  作为一个平平无奇的打工人， 我“自愿”向「升职加薪」低头🙇♀️  打卡！我还活着，就酱，over❗️ ,0,1,2,黑龙江,齐齐哈尔,黑龙江,中国
23,5017926855822315,风水相面,2024-03-31 10:00:54,有种情感叫做恐惧，这种情感是影响运势的大敌       “临床测算”这么多年，我发现很多客户在测算某件事情之前会自觉不自觉的有害怕恐惧心理        比如：我这次考试恐怕是考不过，如果考不过，我怎么办呢？       比如：我这次如果被裁员了，怎么办呢？我感觉这次我是逃不过了。       比如：如果他跟我分手，那我怎么办？我什么都没了。       比如：如果我们俩离婚，孩子怎么办？会不会影响孩子未来发展，心理健康，等等等等。     以上都是在事情未发生之前的恐惧心理，会对未知的事情感到害怕，不安。     当然人之常情，但是就因为这种“常情”是影响你命运往好的方向发展的大敌，这种人往往是惯性思考，惯性恐惧，这就会导致你的运势总是往糟糕的方向走，即使有什么好的结果但很快就败坏了，因为意识上，潜意识上，就是一种“坏结果感”、“不配得感”，无论你未来如何选择，运势走到哪，结果一定是不理想。       “命理咨询”我大多数时候会充当一个心理疏导员的角色，给与客户勇气，从而影响结果（结果当然改变不了，但是有个范围，可以在这个范围内移动“光标”控制大小）。      要知道恐惧是心灵的“杀手”，是命运的“死神”，训练自己对未来无所畏惧，直面恐惧心理，任由他来，任由他去，切记不要抓住，车轱辘。     否则你的人生总是失败的，鲜有阳光，这类人往往会期盼安静无事的人生，最好什么事情也没有，因为有事情他一定无法承受，所以检验自己是否能够控制恐惧，那么问问自己，是否可以接受充满挑战，刺激的未来？,8,2,28,山东,青岛,山东,中国
24,5017794324464942,飘飘飘飘门,2024-03-31 01:14:16,昨天考了个试，去玩的，简单，但是没怎么学过，所以没做完。 很愉快的一次考试，对考试的恐惧好多了。 ,0,0,4,上海,上海,上海,中国
24,5017776335098333,王花花花花hhh,2024-03-31 00:02:47,每次阻拦发作品我都很恐惧，很焦虑，操心这操心那，根源就是怕成绩不好直接糊掉，估计能归到考试焦虑症里，不过好像不止我一个人这样，大家火气都很旺，看得我心暖暖的☺️ ,0,0,10,黑龙江,哈尔滨,黑龙江,中国
24,5017657877731119,bigyellowmuyo,2024-03-30 16:12:04,每次考试前，都会紧张，深析这些“紧张”，发现底层逻辑仍是恐惧。于是，每次我都会默念：“恐惧是思维杀手。恐惧是引向彻底毁灭的小小死神。我将正视恐惧，任它通过我的躯体。当恐惧逝去，我会打开心眼，看清它的轨迹。” 这类心理暗示和安抚，对我很有效。 ,0,2,7,重庆,重庆,重庆,中国
24,5017627746111677,Dvd_Diamond_0226,2024-03-30 14:12:20,#事业单位联考# 怎么也逃不过被考试支配的恐惧 ,0,1,2,安徽,,安徽,中国
24,5017601986006873,cindy不吃瓜,2024-03-30 12:29:59,考试综合症 从小到大被考试支配的恐惧🙃 小时后考试失眠 长大后监考失眠 ,0,6,0,福建,厦门,福建,中国
24,5017558522266289,欧姐AWY,2024-03-30 09:37:16,碰见韦一航了，考试的恐惧也没了 ,0,0,1,河南,郑州,河南,中国
24,5017537318225659,Updaterror,2024-03-30 08:13:01,居然做梦在考数学期中考试 被支配的恐惧 ,0,0,0,江西,赣州,江西,中国
25,5017437206479076,英语走狗,2024-03-30 01:35:12,我好像考研后 就提不起任何力气去准备其他考试了 可能这条战线太长了 长的足以填满我对未知的恐惧 ,0,1,0,陕西,延安,陕西,中国
25,5017419053798616,shine7327672728,2024-03-30 00:23:04,刚开始以为会很紧张，结果平静的可怕。好像到现在没啥可怕的了。当我决定的那一刻就已经赢了，不管结果如何，我都不后悔。两次的考试不会是我的上限，我只会越来越勇敢。击败恐惧的最好方式就是大胆地直面它，在生死面前这些事情都不值一提。晚安 好梦！ ,0,0,0,广东,,广东,中国
25,5017415253755217,Chen_Syyy_,2024-03-30 00:07:58,再也不会在考试周给自己搞的体弱多病了，也不会恐惧对答案了 我要相信我自己！ ,0,0,0,天津,,天津,中国
25,5017408918261206,Rotted,2024-03-29 23:42:48,对济南真的有恐惧感 每次去都是去考试 上次去希望再也不去了 结果又要去了 我恨 我希望老天爷救救我 赐我点好运气吧 ,1,0,1,山东,青岛,山东,中国
25,5017374028464510,ni水蘑菇,2024-03-29 21:24:08,谁能告诉我怎么克服考试恐惧症 一想到明天考试我就紧张害怕的不像话 ,0,1,0,湖北,武汉,湖北,中国
25,5017367115992812,Axel_Axel,2024-03-29 20:56:41,我又有发现了我发现我真的是一个奇怪的人，我很容易退缩，在很多事情没有干的时候就退缩，并且很恐惧这个事情，就是切切实实的恐惧，就比如说参加考试，公务员面试，或者要面对一些重要的事情，都会想放弃，都会退缩 ，怕的要死（即便我知道这并不会对我有什么影响 ，这些事情也并不是什么大事 ） 但是正经历这个事情的过程中，就并不会有害怕恐惧了，甚至很轻松，我很快就能适应 ，轻松的完成，然后在结束之后我就会觉得这个事情也没有那么可怕但是等到下次！同样事情之前，我还是会焦虑 恐惧，害怕 ，我即便知道当我处在这个事情中时候会很轻松，在事情发生之前我还是会害怕和恐惧！就很讨厌！即便我很努力的说服我自己 你之前都干过了，这个不可怕，又没什么，但还是不由自主的心烦意乱焦虑！！烦吐了都 ，真讨厌这样！怎么解决,0,2,1,内蒙古,巴彦淖尔,内蒙古,中国
25,5017335205465955,喵琪的美好生活,2024-03-29 18:49:53,带着目的做某件事真的会给自己增加压力，之前第一次跑教招只是抱着试试的态度，所有没什么负担。但这一次是真的想要上岸，不知怎的，感觉心里没底，不自信，也怕进不了面。明明还没开始考试，心里却很是担心，恐惧未知的一切…… ,0,1,0,广东,佛山,广东,中国
25,5017324140367781,量身定制的另一半正从天而降,2024-03-29 18:05:55,世界上有没有什么工作不需要笔试面试的我有考试恐惧症 ,0,0,0,福建,厦门,福建,中国
25,5017267978374314,钮钴禄西柚,2024-03-29 14:22:45,此时正坐在去酒店的车上，这应该是毕业前最后的一场考试了，该怎么形容这一路呢四个月前决定踏上这条路浑身是牛劲的我到现在这场考试仿佛成了一个心病，这期间无数次焦虑，不安，恐惧，失眠，烦躁  省考前高烧拖着疲惫的身体撑完了两场考试无论最后结果怎样希望自己能坦然面对，我还年轻，步子小一点慢一点没关系，只要是在向前走就好考试不是目的，成为更好的自己才是，祝一切顺利^_^！,0,0,1,黑龙江,佳木斯,黑龙江,中国
25,5017195146904333,每个礼拜都回来,2024-03-29 09:33:21,专业课给我来的恐惧 已经远远小于下节课的视唱练耳月考了 谁大学每个月考试啊 ,0,0,0,四川,成都,四川,中国
26,5017190789022277,Inuyasha24,2024-03-29 09:16:02,西内 早上快醒了的时候做梦又梦到在考试 啊啊啊 被支配的恐惧 ,0,0,0,广东,东莞,广东,中国
26,5017178577307387,疯疯癫癫hxx,2024-03-29 08:27:30,被高考支配的恐惧😱 一到考试前就做梦自己回到高考前一天的课堂上，突然听到明天就要高考，我准考证找不着，啥啥不会，谁谁都不认识～ 感觉就像被高考扼住了喉咙，上不来气 ,0,0,2,内蒙古,呼和浩特,内蒙古,中国
26,5017177666882879,易弦的新微博,2024-03-29 08:23:53,又梦到回去高补了 久违的考试恐惧感袭来 这次这次复读的同伴少之又少…🙉 ,0,2,0,江西,宜春,江西,中国
26,5017155445458214,浮落落落落落,2024-03-29 06:55:35,被考试迟到支配的恐惧😱 ,0,0,0,广东,佛山,广东,中国
26,5017072323790473,第十一只烊_y,2024-03-29 01:25:17,对考试一直都是恐惧的 不知道怎么缓解 ,0,0,0,广东,河源,广东,中国
26,5017057307133243,一个关于玩耍和幻想的REN,2024-03-29 00:25:37,考上就上考不上就考不上又能怎么样我才二十岁出头我还有很多机会人生这张答卷乱写都是满分凭什么一场考试来定义未来所有恐惧都来源于想象所有看法评价也只是暂时的姐要是没考上翻个白眼转身就走了妈的没什么大不了的这破精神状态别烦我了!!!当然如果小女子有幸能再缴三年学费我以后肯定日行一善积德积福爱国敬业诚信友善,0,0,2,广东,惠州,广东,中国
26,5017041667362123,布丁兔不太好吃,2024-03-28 23:23:28,我又开始听give it back了 说真的好久没再听过 好像以前就说过 去hk的话 要在你向我招手的一瞬间配上give itback的高潮后来为票和时间焦虑 我突然有点体会到 有些事情不是光靠爱可以做到的 爱只是一种理想状态 可是经济上的困扰 对抢不到好座位的忧虑 以及与考试时间相撞的恐惧才构成了现实的那一部分我不敢再听give it back 因为我知道如果我用随时可以离开你安慰自己 那就绝对不能再听这首歌 因为听着这首歌 我就好像已经看见你向我招手 哪怕你看不见我 甚至看见我在不远的未来还是无法从那一场美梦中脱离 可是我还是会忍不住心软 因为我的心里无论怎样都还是爱着你 想见你,0,0,0,安徽,,安徽,中国
26,5017002657976146,爱吃巧克力麻薯,2024-03-28 20:48:28,从小到大我对考试或者就是问答我都有种莫名的恐惧感。。。。 ,0,0,0,四川,成都,四川,中国
27,5016960127733216,洛栖YAN,2024-03-28 17:59:28,考试恐惧症重度患者 ,0,4,0,江苏,淮安,江苏,中国
27,5016939388207217,·我的碎碎念,2024-03-28 16:37:02,考试恐惧症 别让我考试了🙏 ,0,4,1,河南,驻马店,河南,中国
27,5016856985601241,牛牛大仙子,2024-03-28 11:09:37,昨天身边坐了一个工程大哥，落座后一直在讲电话，设计院，施工单位，合同里面的惩罚项一一落实完。又给家里小孩打了一会视频，安抚了小孩对考试的恐惧和对考试结果的焦虑。然后又精力充沛的给业内朋友交流，今年生意比去年少了四分之三，非常惨，不敢懈怠刚去了xx又要去xx出差云云～旁听大哥仿佛看到了很多人，很多事,0,0,0,山东,济南,山东,中国
27,5016852692730796,三元中第荣归故里,2024-03-28 10:52:33,焦虑症快考试越来越焦虑，本来就学不下去。之前省考听到有人晕过去有人跳楼还和我妈说我比他们坚强所以别担心我（的考试恐惧症）。结果事业编越来越急今天吵架自己想去逝了，（）之前在西京也没拿到药，门诊让我申请住院，床位排号2900+等了两年了（） ,0,3,1,陕西,延安,陕西,中国
27,5016832999688852,Jessica向阳而生,2024-03-28 09:34:18,被复试支配的恐惧真的太可怕了 昨晚做梦已经梦到在学院复试了 就差进考场与老师们面对面交流了 早上睁眼醒来就是心里紧张#被考试支配的恐惧##真的好紧张# ,0,2,1,安徽,芜湖,安徽,中国
27,5016812576047937,喜欢你才闹你啊,2024-03-28 08:13:09,昨晚梦境分享:我在考试，时间不够，但我一直沉不下来做题，思想乱飘，时间一点一点过去，我的试卷居然少了两页答题纸，我问老师要，老师说由于你的试卷不完整，多给你一些时间考试。我在梦中还意识到这是做梦，我还在想我在梦里还被考试的恐惧支配，不考了！ ,0,2,2,河南,郑州,河南,中国
28,5016460544183024,春曰部防卫队队长,2024-03-27 08:54:18,总是会梦到明明已经毕业甚至上班了，却还要回到中学去上课甚至重新面临考试，就好像连续剧一样，今天早上又做了这种梦，太真实了导致我在梦里苦苦挣扎，好在闹钟叫醒了我，醒来后那种痛苦还伴随了几分钟……唉，一生被考试的恐惧支配的中国学生 ,0,7,2,陕西,西安,陕西,中国
28,5016320242617821,琪琪熬夜日记,2024-03-26 23:36:47,我有考试恐惧症 一到考试我就紧张的不行 手心冒汗 失眠  ,0,5,0,湖北,襄阳,湖北,中国
28,5016297702687078,YMacieeeee,2024-03-26 22:07:12,上了十年学还是很害怕考试，今天月考结束了可我并没有想象的那种解放，心里只有面对成绩的恐惧，和与同学们交流成绩的不安。 ,0,0,0,天津,天津,天津,中国
28,5016285412330513,小饼干不不加糖,2024-03-26 21:18:23,批卷子批的我脑子痛 好想当学生 想感受被考试支配的恐惧 ,0,1,0,山东,青岛,山东,中国
28,5016276806927230,噼里啪啦天妇罗,2024-03-26 20:44:10,老铁啊，老铁现在没那么抗拒考试，但一些惯性心理又挺恐惧的，总有一种会在考场上开哭的预感啊……不要酱紫啦…… ,0,0,0,天津,天津,天津,中国
28,5016255641422231,冷漠荷兰豆,2024-03-26 19:20:05,朋友约我看坠落的审判 我一看152分钟就想起了高中被语文考试支配的恐惧  pp都坐麻了、、 ,0,0,0,广东,深圳,广东,中国
28,5016158513661482,拜托别当大笨蛋了好吗,2024-03-26 12:54:08,未知最恐惧经历了就不恐惧了 反而有收获比如害怕公开课其实还行 比如交换考试我恐惧的肯定还有很多比如144选2个 比如工作还不稳定可能144个很多人没来呢 或者很多人划水呢和你比的永远都是最前面的那些人，只需要努力到前面去就好，多少人有什么关系呢！因为你要去前面所以感到巨大的压力是很正常的，不用再睡不着了，对于未知的恐惧你可以面对的！,0,0,0,福建,泉州,福建,中国
28,5016151201416443,小張小張t_,2024-03-26 12:25:05,25岁的中国女人也逃不过被考试支配的恐惧 ,0,2,3,山东,青岛,山东,中国
29,5016131724904846,小刘同学睡不醒m,2024-03-26 11:07:41,上小学的时候写不完作业是天大的事，初中觉得考不上高中是天大的事，高中了又觉得如果不考上好的大学是不是就碌碌无为一辈子了，现在本科即将毕业，又觉得迷茫不知道以后干什么…可是现在我再也不会觉得作业写不完，考试考不好是多困难的事了…享受当下吧，那些害怕的事，恐惧的事总有一天可以像讲故事一样说出来吧#小狗日记#,0,3,0,黑龙江,哈尔滨,黑龙江,中国
