页码,微博id,微博作者,发布时间,微博内容,转发数,评论数,点赞数,发布于,ip属地_城市,ip属地_省份,ip属地_国家
36,5021776055372860,我嬷了全世界,2024-04-11 00:56:14,不要什么事情都拖到最后一秒做啊，这次项目结题临答辩才找到论文发表，也不知道答辩之前能不能搞出来 ,0,0,0,黑龙江,哈尔滨,黑龙江,中国
36,5021772176950248,脉搏停摆,2024-04-11 00:40:50,二十页的论文Ei是不让发表吗？我请问呢？找一篇翻译全都给我写十页十页的死薛晓还要求五千字，卧槽啊啊啊啊啊我草！ ,0,0,0,江苏,苏州,江苏,中国
36,5021766674287762,西红柿炒豆角a,2024-04-11 00:18:58,希望这个月论文可以顺利完成✅，顺利发表！ ,0,1,0,河北,石家庄,河北,中国
36,5021765636457038,孤独别醒来202001,2024-04-11 00:14:50,好焦虑啊，怎样才能发表论文，导师又不靠谱，真害怕延毕 ,0,1,1,贵州,贵阳,贵州,中国
36,5021758120267117,茉莉蜜茶歪歪迪艾斯,2024-04-10 23:44:58,卧槽了感觉自己拖延症没救了。。周五有个论文发表和期中考试，论文只写了一半，期中考试一字未准备。总觉得明天晚上一夜之间能全部做完，虽然时间紧的要死但是又不想现在干，反正就是死到临头但是还没临头，等到临头了再挣扎总能活的这种想法……真的没救了。 ,0,5,1,韩国,,韩国,韩国
37,5021366160200222,当年小帅V,2024-04-09 21:47:28,抄作业也不行？中国科学家发现美高超武器失败绝密原因：为何要告诉美国人？据《南华早报》报道称，中国科学家发表论文指出美国持续高超音速武器试射失败原因，NASA主导建立的高超音速空气动力学模拟分析软件或存在致命缺陷，网友纷纷表示，对于这种绝密级别的发现，怎么能发表论文广而告之呢？就让美国一直失败下去，找不到原因最好！,23,29,279,重庆,,重庆,中国
37,5021754923682886,邮一颗芒果呀,2024-04-10 23:32:16,开心的日子 马上结束 md 马上又有两篇论文要发表 ,0,0,0,韩国,,韩国,韩国
37,5021667339011657,LightScienceApplications,2024-04-10 17:44:14,来自国防科技大学周朴研究员课题组联合中国科学院苏州纳米技术与纳米仿生研究所张凯研究员课题组在Light: Science &amp; Applications上发表论文，开发了一种基于偏振各向异性准一维层状材料的动态可调控的超快光纤激光器，实现了在同一谐振器系统中孤子与类噪声脉冲状态的切换，并应用于光源的高速数字编码。网页链接,2,0,39,,长春,吉林,中国
37,5021745922706782,loving_wangcq,2024-04-10 22:56:30,冯·诺依曼号称在6岁时就能心算两个八位数的除法，8岁时自学掌握微积分。到19岁中学毕业时，他已经发表正式论文，首创集合论的“序数”(ordinal number)概念。虽然他从小表现出非凡的数学能力，务实的父亲还是坚持要他去学化工以获得有价值的谋生技能。冯·诺依曼很听话。在22岁大学毕业时，他有了一个化工专业的文凭。但同时，他也获得数学的博士学位。天才！！,0,0,0,浙江,杭州,浙江,中国
37,5021745364340697,医药背包客,2024-04-10 22:54:17,近日，大连医科大学第二附属医院的研究人员在《Frontiers in Nutrition 》期刊上发表了一篇研究论文。该研究发现，多吃香蕉或苹果，降低高血压患者全因死亡风险，两种水果联合食用，益处最大。具体来说，与很少吃苹果的人相比，每周吃3-6次苹果，与高血压全因死亡风险降低40%相关；与很少吃香蕉的人相比，每周吃3-6次香蕉，与高血压全因死亡风险降低24%相关；与很少吃香蕉和苹果的人相比，每周吃3-6次香蕉和苹果，与高血压全因死亡风险降低43%相关。与此相反，梨、菠萝和葡萄，与高血压患者全因死亡率之间没有显著关联。,1,0,2,浙江,杭州,浙江,中国
37,5021743267974450,养乐多出逃记,2024-04-10 22:45:57,今天中午lu姐说如果能回到10年前，她最想做的事就是把那些大牛论文全背下来然后发表……这什么职业病啊🙉 ,0,0,0,中国香港,,香港,中国
37,5021725224603881,湘潭大学学生创新创业中心,2024-04-10 21:34:15,#小创速递#【中子星或是理解暗物质关键】　　北京时间4月9日，澳大利亚墨尔本大学领导的ARC暗物质粒子物理卓越中心物理学家在最新一期《宇宙学和天体粒子物理学杂志》上发表论文称，他们通过计算发现，当暗物质粒子在冷却死亡的中子星内部碰撞并湮灭时，传递的能量会使恒星迅速升温。        这项研究首次表明，大部分能量可在几天内储存起来。中子星或许“掌握”着理解神秘暗物质的“钥匙”，为科学家解开宇宙一大谜团提供了方向。【来源：科技日报】,0,0,0,湖南,湘潭,湖南,中国
37,5021716032259552,淼嗷呜,2024-04-10 20:57:43,sci期刊：工业工程 收稿：土木工程，建筑工程，电气工程，电子工程等工程类的文章 提前收稿，周期短，工科的最优选择，源头刊物。#电子电气工程##论文发表推荐期刊##学术期刊论文发表##期刊论文、职称论文代发表# ,0,0,0,江苏,南京,江苏,中国
37,5021715985864082,咸菜粥55,2024-04-10 20:57:33,发表论文可以有几个作者一般是1-5个作者，人多的话可能被涉嫌凑数的。那什么情况下允许作者超过5个以上呢？1:特别重要的论文，需要几个人配合分工完成2：高质量的论文，字数1万以上，英文字数3万以上，如sci论文会有实验，数据等所以可能需要多人配合。不过还是需要具体情况具体分析还有就是大家比较在意的如果一篇文章不是一作的话还有用吗？这边分情况，如果只是在自己的简历上加份不在乎是否一作，这种情况随便几作都可以但是如果这边是用来毕业，评职称，拿奖金啥的有的单位和学校要求自己必须是一作，而且只有一作有用，这里的一作是物理上的文章作者排序顺序。所以这边发表文章是用比较重要的用处的话还是不要想着跟别人拼一个文章啦。自己发表比较靠谱。#sci期刊##scopus期刊投稿##ahci#,0,1,0,江苏,南京,江苏,中国
37,5021715338628171,大明湖畔的浣熊少女,2024-04-10 20:54:58,选题别选自己不熟悉的东西好吗，即使他看起来很高大上 但是很难找资料！！！不理解这群人，又不是要发表论文！！无语啦！高大上的东西只会让自己写出来的东西更像💩 ,0,0,0,广东,广州,广东,中国
38,5021714871747716,中序梁编辑,2024-04-10 20:53:07,论文发表 ,0,0,0,河北,石家庄,河北,中国
38,5021714687199370,中序梁编辑,2024-04-10 20:52:23,期刊论文发表 ,1,0,0,河北,石家庄,河北,中国
38,5021561333747138,或曰,2024-04-10 10:43:01,家里的学术期刊清理出来，堆在客厅，准备当废纸卖，换点儿酒钱。望着成堆的刊物，滋味杂陈：俺苦哈哈攒劲儿想在这些期刊上发表论文而不可得，当它们搁在眼前却连翻看一下的兴趣都没有，这些刊物于俺而言究竟有何意义…… ,7,14,35,河北,石家庄,河北,中国
38,5021709594004172,杂志社--马老师,2024-04-10 20:32:09,学术期刊论文发表《广东安全生产技术》24年2月下已出刊，请各位老师注意查件🎉  ♦万方，主收：安全教育（校园安全教育、食品卫生安全、校园暴力等）；工程安全（建筑施工安全、事故应急救援等）；安全管理 ,0,0,0,河北,石家庄,河北,中国
38,5021709515883840,杂志社--马老师,2024-04-10 20:31:50,学术期刊论文发表《知识经济》24年4月（下）已出刊  ♦F经济刊，万方，主收：宏观经济、区域经济、产业经济、数字经济，财政金融、财务会计、经济管理、管理工程、学科建设 ,0,0,0,河北,石家庄,河北,中国
38,5021698099249753,想住在livehouse,2024-04-10 19:46:28,论文发表了，还有稿费拿，在学期间发表三篇，也不算很难看的硕士成果啦 ,0,0,6,广东,广州,广东,中国
38,5021697982073828,lui心_,2024-04-10 19:46:00,突然发现搞科研何尝不是一种追星/磕cp行为呢科研什么火就研究什么↔追星哪个热度高就追那个热门的研究方向↔热坑冷门的研究方向↔冷坑研究主张相似↔同担研究主张相反↔对家写论文的研究生↔写文的太太看新发表的论文↔吃上热乎饭（x）花钱看论文↔花钱买谷收藏欣赏免费开源的论文和代码↔无料复现代码，写论文阅读笔记发在csdn↔二创知名的导师↔大ip如果有比喻的不恰切的地方欢迎家人们纠正毕竟本人并不追星,0,10,12,北京,,北京,中国
38,5021694748788070,小鱼知学术,2024-04-10 19:33:09,一个冷知识，你知道中国发顶刊第一人是谁吗？        这位是出生于清朝嘉庆年间的徐寿先生，在国人还在读八股文的年代，1881年，他的文章就已正式出版在《nature》上，虽然论文形式跟今天有所不同，但也很有历史意义。顶刊第一人更是得到了北大和新华网的认证。        徐寿先生是近现代中国化学启蒙者之一，设计制造中国首台蒸汽机和国产蒸汽动力轮船，除此之外，他翻译并制定了化学元素中文名称和命名规范，还协助创办了中国第一本中文科学期刊。        沾沾祖师爷的光，祝愿各位科研顺利，多发顶刊。专注南核，北核SCI发表，更多资讯欢迎关注@小鱼知学术 #论文##发表一篇nature意味着什么#,0,0,0,天津,天津,天津,中国
38,5021605281403833,学者马亮,2024-04-10 13:37:39,"#晋升##领导批示# 我们有关领导批示与部长任期的研究在JAPP发表，网页链接这篇论文提出领导批示可以用来衡量部长的主观政治绩效，进而会影响他们的仕途。过去研究主要关注地方主官，而我们则聚焦中央部委的主官。我们使用毛时期的历史数据，回答了这个问题，也是#量化历史研究# 的一种尝试。参考文献：Chen, S., Christensen, T., &amp; Ma, L. (2024). Written directives and ministerial tenure in China: a novel gauge for political performance? Journal of Asian Public Policy, 1–20. 网页链接",28,3,36,北京,北京,北京,中国
39,5021689926912759,科学网,2024-04-10 19:14:00,#小柯机器人# 【洞庭湖流域2022年干旱量化及近20年TWSA时空演变】近日，中国地质大学（武汉）吴云龙团队在研究洞庭湖流域2022年干旱量化及近20年TWSA时空演变方面取得新进展。相关论文于2024年4月8日发表在《大地测量与地球动力学》杂志上。研究人员利用近20年来的GRACE/GRACE-FO和GLDAS研究数据，探索DLB地区陆地蓄水异常（TWSA）的时空变化特征。从2019年7月到2023年5月，TWSA呈现明显下降趋势，根据GRACE/GRACE-FO和GLDAS确定的变化速率分别为每年-1.94cm和每年-1.99cm。研究人员采用GRACE—干旱严重程度指数(DSI)来识别和评估2022年DLB干旱事件的严重程度和时空演变。研究结果准确捕捉了从2022年7月开始持续到2023年3月的干旱事件，其中最严重的干旱事件发生在2022年10月，GRACE-DSI值为-2.06，TWSA分别比2021年和2020年同月下降15.24cm和33.51cm。此外，2022年城陵矶水文站的日水位变化也打破了以往的记录，最小水位变化只有19m。2022年干旱事件与2006年和2011年的干旱事件相比，干旱对植被生长条件的影响相对较小，但整个DLB的植被仍然退化严重。据悉，人类活动和全球变暖引发的异常大气扰动对干旱和洪水等极端水文事件的影响越来越大。在过去的20年里，由于复杂的气候变化，洞庭湖流域（DLB）经历了严峻的环境条件，伴随着极端的洪涝和干旱。网页链接,0,0,1,,北京,北京,中国
39,5021669754407866,Colorful_ful_ful,2024-04-10 17:53:50,我对这个破园区已经毫无留恋，现在除了我的论文之外，别的任何事情我在想发表看法的时候都随着心里的一声算了而闭嘴🤐 ,0,5,2,北京,北京,北京,中国
39,5021669080959267,山东就是老家,2024-04-10 17:51:10,北大教授乔晓春：大家经常讲我们 # 社会科学 领域 # 论文发表量和引用量超过美国，一个不会做科学的人引用另一个不会做科学的人写的东西，有意义吗？ （视频来源:why星人） 山东就是老家的微博视频 ,3,0,5,黑龙江,哈尔滨,黑龙江,中国
39,5021666754954009,智商落在火星,2024-04-10 17:41:55,【年轻时加班伤害持续到50岁】#超时工作增加抑郁风险##专家称8小时工作制有益身心健康# 你的工作，是否有996和随时待命的状态？加班不光影响心情，还可能给身体造成长期影响。2024年4月3日，美国纽约大学学者Wen-Jui Han发表的论文显示，20多岁经历加班、倒班工作，会让你到了50岁睡眠质量更差，而且更容易抑郁。与朝九晚五的人相比，工作时间不规律的人受到的影响更大↓30年追踪调查显示：二三十岁加过的班，还能伤到50岁的你,0,0,0,,,,
39,5021624095212041,澎湃新闻,2024-04-10 14:52:24,【《自然》杂志：调查显示#美国室温超导研究人员学术造假#】英国《自然》杂志网站日前发文说，美国罗切斯特大学一份长达124页的调查报告，详细披露了该校室温超导材料研究人员兰加·迪亚斯存在数据造假、剽窃等学术不端行为。迪亚斯因其团队声称研发出室温超导材料而备受科学界关注，但该团队发表的论文数次被《自然》等科学刊物撤稿。新华社网页链接,5,2,13,,上海,上海,中国
39,5021662997120505,哈勃观察员,2024-04-10 17:26:59,最新假说：中子星或是暗物质的“存储器”！据科技日报4月9日援引外媒报道，澳大利亚墨尔本大学的物理学家在最新一期《宇宙学和天体粒子物理学杂志》上发表论文称，他们通过计算发现，当暗物质粒子在冷却死亡的中子星内部碰撞并湮灭时，传递的能量会使恒星迅速升温。这项研究首次表明，大部分能量可以在几天内储存起来。中子星或许“掌握”着理解神秘暗物质的“钥匙”，这为科学家解开暗物质谜团提供了新思路。寻找暗物质是科学界最吸引人的事件之一。根据假说，暗物质占宇宙物质的85%，但人们却看不到它。暗物质不与光相互作用，不吸收也不反射光，自身也不发光。但是，从理论上预测暗物质是一回事，而从实验上观察暗物质是另一回事。按照澳大利亚物理学家的新说法，中子星扮演着巨大的天然暗物质探测器的角色，在宇宙长期历史中一直收集着暗物质。这个假说还需更多的观察实验去证实。#热门微博##科研动态##暗物质##中子星#,7,3,16,广东,深圳,广东,中国
39,5021662646899145,不叫哇哇耶,2024-04-10 17:25:36,让本科生写论文真是神金#建议取消本科生发表论文规定# ,0,1,0,内蒙古,赤峰,内蒙古,中国
39,5021662634576440,安徽大学,2024-04-10 17:25:33,"#新闻安大#近日，许振朋教授及其合作者在量子互文性研究中取得新进展，论文发表在物理学顶级期刊《物理评论快报》（DOI：10.1103/PhysRevLett.132.140201）。该研究工作证明了一些量子可观测量的集合在同构变换下是唯一的，且其量子互文性可被态无关地探测到。而这两个属性使得这些可观测量在实验上的统计数据足以验证其自身，整个过程可以使用任何满秩的入射量子态（包括热态和最大混合态）。该工作首先研究了在理想情况下三维及以上维数空间中的满秩自验证（certification with any full-rank state），而后分析了三维和四维空间中满秩自验证对抗噪声的稳健性。此外，该工作建立了满秩自验证和贝尔自验证（Bell Self-testing）之间的基本联系，表明这两种方法可以在同一个实验中结合使用。许振朋教授为第一作者，安徽大学为第一单位。西班牙塞维利亚大学的Adán Cabello教授，印度科学教育与研究所的Debashis Saha教授以及新加坡科技研究局的Kishor Bharti研究员为重要合作者。许振朋教授及其合作者长期从事量子关联方向研究，包括量子互文性，贝尔非定域性以及量子网络纠缠 [物理评论快报 120, 050403 (2018)；光学 5, 718 (2018)；物理评论快报 124, 230401 (2020)；自然-通讯 13, 496 (2022); npj 量子信息10, 11 (2024); 物理评论快报 132, 110204 (2024)；物理评论快报 132, 140201 (2024)]。量子关联为量子科技提供了重要支撑，不仅能够用于形成量子技术的优越性，而且能够保障量子技术的可靠性和安全性。该研究工作为验证量子设备的可靠性开辟了新的途径。",5,0,5,安徽,合肥,安徽,中国
39,5021662418832094,农民数学家杨艳红,2024-04-10 17:24:41,@孔庆东 @司马南 @阿里达摩院扫地僧  @北京大学李晓明  来了份《媒体与网络杂志》的约稿函，不收费，将《千禧年难题PNP逻辑证明》投稿，收到回复是已发表，要的是没有公开发表的论文 ,0,0,0,云南,丽江,云南,中国
40,5021657788057778,论文期刊辅导代发,2024-04-10 17:06:17,北大核心 微论 《中国学校xxx》有目录  有页码  无后缀          栏目：项目介绍 收录：心理 - 思想政治-美术-体育-音乐-地理-教育-英语-舞蹈-电子商务 等等论文发表发表论文期刊论文评职称 ,0,0,0,山东,济南,山东,中国
40,5021655558521189,科学网论文,2024-04-10 16:57:25,【海洋保护区对鱼类种群的恢复并无帮助】海洋保护区的目的是让成鱼种群从过度捕捞中恢复过来，但根据一项为期12年的研究发现，加勒比海海洋保护区的鱼类数量并没有反弹。研究人员表示，海洋保护法规执行不力、海岸开发和水温上升都可能是罪魁祸首。相关论文近日发表于《全球变化生物学》。论文传送门☞网页链接中美洲珊瑚礁沿着伯利兹、危地马拉、洪都拉斯和墨西哥的加勒比海岸绵延1000多公里，是各种野生动物的家园，包括500多种鱼类和65种珊瑚。在过去几十年里，这些国家的政府建立了许多海洋保护区，目的是保护珊瑚礁宝贵的生物多样性，恢复因过度捕捞而减少的鱼类种群。这些地区可能在一年中的某些时间禁止捕鱼、禁止某些类型的捕鱼设备，或限制旅游、采矿等其他活动。为了评估这些海洋保护区的有效性，美国史密森尼环境研究中心的Steven Canty和同事在2006至2018年间分析了111个保护区和28个未保护区的鱼类生物量变化。作为健康珊瑚礁倡议的一部分，这些数据是由水肺潜水员在调查中收集的。研究小组发现，在研究期间，只有11个海洋保护区的成鱼生物量增加。与此同时，28个保护区的成鱼数量减少，其余保护区没有变化。研究发现，在鱼类数量反弹的11个地区，海洋保护区法规得到了充分执行，海面温度波动较小。恢复不佳的地区往往会出现相反的情况，保护措施执行不力、人们在沿海活动增多、气温异常现象增多。“执法在其中一些地区的成功，在一定程度上起到很大作用。”Canty建议，以成鱼为生的当地人应该在管理海洋保护区方面发挥更大作用，确保海洋保护区位于不受气候变化影响更大、更容易管理的地区也至关重要。“关于海洋保护区，我们还有很多不了解的地方。”同样就职于史密森尼环境研究中心的团队成员Justin Nowakowski说，“因此，能够回顾过去，优化海洋保护区未来布局和管理方式至关重要。”（来源：中国科学报 李惠钰）,3,0,0,河北,保定,河北,中国
40,5021654696331992,昆明市生态环境局,2024-04-10 16:54:00,#环境聚焦# 【绿色新法用杨树制造扑热息痛】 据最新发表在《化学化工》杂志上的论文，美国科学家开发出一种成本效益高、环境可持续的制药方法，可用植物代替石油制造止痛药扑热息痛及其他有价值的产品。 绿色新法用杨树制造扑热息痛 ,0,0,0,,昆明,云南,中国
40,5021651365789897,玫瑰女人Rose_is_a_rose,2024-04-10 16:40:45,我有时候在想我有了十个亿做什么。大概会花2个亿买中美的房子，选择上海和加州。花400w买一辆冰蓝色宾利continental GT is米白色内饰。剩下的钱拿利息一年几千万周游世界，学航海知识，潜水追鲸鱼一个月。资助儿童，资助女童。学运动生理学博士最好能发表论文，为人类做一点微小的贡献。学瑜伽健身，追求一些心灵的成长，当一个美女教练帮助她人塑造肉体。大概也只放在固定收益，花一花利息，再也不操心了。,0,3,0,河南,郑州,河南,中国
40,5021647972863830,可爱熹熹子,2024-04-10 16:27:17,以为自己写完交完论文会很开心 但实际上，开心占一半，另一半是持续的担心，会不会还有很多问题没发现的，会不会过不了初审，小论文能不能成功发表 啊啊啊啊啊 ,0,4,3,四川,,四川,中国
40,5021647469546734,培正会计学院学生会,2024-04-10 16:25:17,#“尚行讲堂”之科研论文写作与发表#  于4月10日中午14：00在学术报告厅圆满结束。感谢各位老师、各位同学的参与！@我是邓惠 @培正会计学系团总支 ,0,0,0,广东,广州,广东,中国
40,5021646073628796,杂志社--马老师,2024-04-10 16:19:44,学术期刊论文发表《中华纸业》5月征稿，6月出刊 国家级，知网、万方、维普、龙源收录 月刊，有影响因子，可定制 选题： 1.仿古纸张材料*当代艺术设计****应用 2.纸张材料****粘贴*当代拼贴艺术创作**** 3.纸张材料质地*纹理*版画艺术设计**** ,0,0,0,河北,石家庄,河北,中国
40,5021645851068380,杂志社--马老师,2024-04-10 16:18:51,学术期刊论文发表 🔥F经济刊🔥  1.中国商界：国家级，知网月刊 2.新晋商：万方，收稿广 3.知识经济：万方，质优价低 4.理财周刊：维普，好录用 ,0,0,0,河北,石家庄,河北,中国
40,5021645515523943,杂志社--马老师,2024-04-10 16:17:31,学术期刊论文发表 《村委主任》知网，半月刊，24年5月刊期 主要栏目：治村方略，产业经济，乡村旅游，乡村建设，农村视野，服务三农等栏目。 ,0,0,0,河北,石家庄,河北,中国
40,5021645075123579,期刊发表刘老师356576630,2024-04-10 16:15:46,论文期刊发表化工首都经济贸易大学  中国化工贸易 主要栏目：石油化工、医药化工、行业动态、化工教育、科研开发、节能环保、产品推广、经济论坛、化工科学、管理论坛、商贸纵横、教育研究、财会研究、金融资本、工程技术、专利集锦、百家争鸣、化工行业设备。 ,0,0,0,河北,石家庄,河北,中国
41,5021644891095538,杂志社--马老师,2024-04-10 16:15:02,学术期刊论文发表 《英语广场》知网 省级 旬刊 纸质刊高职、高校起发(可少量加急） 4版/5000字符  现收11-12月刊，预计24年12 月/25年1月出刊 ,0,0,0,河北,石家庄,河北,中国
41,5021623996389078,山西青年报,2024-04-10 14:52:01,#青春兴晋奋斗有我# 【山西工程技术学院专任教师张媛  愿做“楼台”为大学生铺就登高路】张媛，女，1989年7月生，中共党员，山西工程技术学院电气与控制工程系电气工程及其自动化专业专任教师，先后获得学院“优秀共产党员”“优秀教师”荣誉称号，发表教、科研论文10余篇，实用新型专利1项，成功申报《供电工程》省级教学改革创新项目、校级金课等项目，并获得学院第二届教师教学创新大赛中级及以下组二等奖、学院2023年校级思政教学设计大赛暨教师教学创新大赛课程思政组别比赛中级组一等奖，在首届全国高校教师教学创新大赛山西赛区获中级及以下组三等奖。她指导学生参加大学生创新创业计划项目，获得省级项目，参加“蓝桥杯全国软件和信息技术专业人才大赛”获得国赛优秀奖，参加全国大学生电子设计大赛，获省级一、二、三等奖。　　 “为了适应未来的需要，培养优秀的新时代新青年，作为一名青年教师，我们应该多增长知识储备，提升职业能力。”张媛说。（本报记者 孟存田 文/图）网页链接,0,0,0,,太原,山西,中国
41,5021617951082680,书亦文化知识产权,2024-04-10 14:27:59,《文苑》省级，万方收录，2024年2-3月刊期，3版5000字符起发，收历史类、馆藏类、传媒类、社科类、文学类、汉语言文学类均可。#高级职称#评职称学术期刊论文发表#评职称# ,0,0,0,河北,承德,河北,中国
