页码,微博id,微博作者,发布时间,微博内容,转发数,评论数,点赞数,发布于,ip属地_城市,ip属地_省份,ip属地_国家
2,5022714920176086,沈阳晚报,2024-04-13 15:06:57,#沈阳市第二座国家安全主题公园开园啦# 【#沈阳市南湖国家安全主题公园开园#】4月13日，在第九个全民国家安全教育日来临之际，沈阳市南湖国家安全主题公园开园仪式在和平区南湖公园举行。#沈阳市南湖国家安全主题公园# 南湖国家安全主题公园为区域性改造公园，按照“融入环境、寓教于乐”的设计理念，以总体国家安全观为主题，沿步道建设了富含国家安全元素的展示景观，并自然融入公园整体环境，营造出“国家安全、人人有责、人人可为”的浓厚氛围，未来将成为广大市民学习国家安全知识、提升安全防范意识的重要阵地。主题公园入口处的山水主题雕塑组，通过石与金属的结合，在无声中传达出国家安全教育刚柔并济的作风。国家安全“4·15”方块，以三种鲜明色彩为基石，构建金属方块城墙造型，彰显着稳固与坚定，更深刻体现了安不忘危、存不忘亡、治不忘乱的智慧理念。“12339”雕塑，以中国传统鲁班锁为灵感源，强调整体与局部的联系，提醒我们要关注每一个细节，共同为国家安全贡献力量。国家安全文化长廊，既为市民提供了静谧休息场所，更成为一处沉浸式学习国家安全知识的宝地。截至目前，沈阳市已建成南湖、金阳大街2座国家安全主题公园。同时，在全市近30个公园设置国家安全宣传标语牌400余块。沈报全媒体记者：徐佳婷,1,0,2,,沈阳,辽宁,中国
2,5022713920097952,宁波生态环境,2024-04-13 15:02:59,【市生态环境局召开党纪学习教育动员部署会】详见市生态环境局召开党纪学习教育动员部署会 ,0,0,1,,宁波,浙江,中国
2,5022120625047299,剧音儿,2024-04-11 23:45:26,追风者，沈图南结局写的不好沈图南是个坚定的三民主义者，也是资本主义革命者典型代表，家庭出身，接受的教育以及上海和江西的小资生活环境，都决定了他的立场，没有原由会突然转变立场，对农民无产阶级产生同情，尤其是在瑞金苏区还判了他死刑的情况下，政治立场的转变太突然。可以是国民党中的左派或者完全放弃政治选择出国都说的通。,30,58,174,福建,,福建,中国
2,5022707017843300,杨以萱,2024-04-13 14:35:33,在增强鲎分布地沿海民众对珍稀濒危生物及其栖息地环境保护意识、促进海峡两岸科学公民教育、共建人与自然命运共同体的道路上起着积极推动作用。我会将整合资源力量，携手科研院所、社会爱心力量进一步共同促进科研、增殖放流与栖息地保护，让具有蓝色血液的“海洋活化石”中国鲎能更好的繁衍生息。中国鲎，是一种古老的海洋生物，其特殊的生理结构和生态角色在海洋生态系统中发挥着重要作用。中国鲎的血液在医学和科研领域有着重要的应用价值。保护中国鲎不仅对于维护海洋生态平衡具有重要意义，也有助于保护人类健康和生物多样性。我们每个人都应该意识到保护这些珍贵生物的重要性，并积极参与到保护行动中来！#中国鲎#,0,0,0,河南,洛阳,河南,中国
2,5022702410663105,Suicidepot,2024-04-13 14:17:15,我的职场态度就是该我做的我一定好好做，但我不会违背自己的原则、喜好、人际交往的态度去做一些让我觉得别扭的事情。国内的教育体系、职场体系、社会环境都已经卷到/甚至病态到一定令人发指的程度，我无法与整个环境对抗，但我有权力选择我的处世方式。无论生态如何，我都不需要阿谀奉承、谄媚讨好，我只会做好我自己的事情、扮演好需要我扮演的角色，任何人都无法pua我或是否定我，我也不需要和任何人去比较、竞争。,0,0,0,四川,成都,四川,中国
2,5022635160766568,幻想狂劉先生,2024-04-13 09:50:01,这类其实是“性讨好型人格”（俗称舔狗）的同素异形体，因为教育、环境等问题，他们无能力建立正常、平等、健康的两性关系，他们认知里的两性关系就是“要么我给你跪下，要么你给我跪下”。那么当他跪下了却没有得到性的时候，他自然就想要让你跪下来得到性，So……远离舔狗保平安,42,20,102,新疆,石河子,新疆,中国
2,5022700408144309,YuLei__,2024-04-13 14:09:16,下一代的娃娃些真的好幸福 不用从小忍受贫穷的折磨 不用从小忍受扭曲负面畸形价值观的折磨  既有试错的资本也有建设性的指导 既有家庭条件也有家庭教育  等他们长大了国家人口也降下去了 资本的原始积累也完成了 社会环境也变好了  再想起自己畸形的童年真的是心理都要扭曲[呲牙] ,0,0,0,四川,成都,四川,中国
2,5022698076114993,山西大学,2024-04-13 14:00:01,"#全民国家安全教育日# 《黑猫警长之国安特别篇》是继十年前“一只耳案件”的续集篇。影片讲述了一只耳越狱的同时，以食猴鹰为首的犯罪团伙对生物、航天、能源、军事等领域的专家进行了绑架，这对森林的社会、科技、环境安全造成了巨大危害。熟知一只耳的黑猫警长在鼩鼱特工、猎豹狱警、螳螂警官、鸽子警官的帮助配合下，成功抓捕了食猴鹰等犯罪团伙，并将越狱的一只耳等一同捉拿归案。此后，在森林安全局的带领下，黑猫警长和团队们继续进行着新的斗争，维护着森林家园的安全。       通过以经典动画《黑猫警长》中各种动物警察们守护家园安全的角度，折射出国家安全重如山，重任在肩不畏难，家喻户晓广宣传，于无声处斗魔顽。国家安全，众望所归；保守秘密，你我有责；牢记安全，珍惜生命；心系四方,万家平安！严惩危害国家安全行为，永保国家长治久安！听春雨亲吻着花儿的呢喃，看万家灯火温暖的港湾，沐浴着和谐铁运的发展，让安全意识常驻心田，让安全行为时刻不变，让安全手段更加科学，让安全大路越走越宽！视频来源：人民日报新媒体文字来源：张凯源 山西大学的微博视频",1,1,9,山西,太原,山西,中国
2,5022690893367165,请不要同我说话,2024-04-13 13:31:29,难道真的有人真心觉得C罗没天赋，现在的成就全靠他努力吗？普通人只要像他一样自律努力就能得到和他一样的成就？ 当然，每个人教育环境和认知都有差异，对一件事有不同看法，这也是很正常的事，真心觉得C罗没天赋的人也不能说人家智商有问题，只能说，祝你们幸福快乐。永别了，没脑子的东西 ,0,0,0,四川,泸州,四川,中国
2,5022690840939854,xiaoxican,2024-04-13 13:31:16,不要因為別人沒素質讓自己嘔氣而懲罰自己。有些人因為環境受教育程度以及認知不同，思維觀念一定有局限，世界的運轉不會因為他們而變得不同，真理總是掌握在少數人的手裡，時間和耐心總會給出正確的解答……,0,0,0,中国台湾,新竹,台湾,中国
3,5022688762659173,湖北鼎晟企业管理服务有限公司,2024-04-13 13:23:01,珀莱雅双抗粉底液   （219）     当然，大脑的发育会受到周围许许多多因素的干扰，遗传、环境、教育、营养与疾病等都会给宝宝大脑的发育造成一定的影响。父母要给宝宝充足的营养、丰富的环境刺激，为宝宝创造一个良好的生活环境，为宝宝大脑的发育提供一个良好的基础，让宝宝的大脑健康的发育。 ,0,2,0,广东,深圳,广东,中国
3,5022688164971509,你的幸运已发货,2024-04-13 13:20:38,我哥在那个以教育著称的地方生活，害，我看他们给孩子报的那些课，和我小时候差不多。不是说去了那，你的孩子教育水平就提高了。啥也是看人看家庭了。环境只是一个方面 ,0,1,0,山西,吕梁,山西,中国
3,5022687449844598,屁大点事分享专业优秀毕业生,2024-04-13 13:17:48,读《牛顿传》，有种在看自己这几年经历的既视感“从幼童到少年，他几度被引领着走向不同的方向，这使他不明所以，无所适从。在学校，他对传统的教育不满，与同学格格不入，最终领悟到以自己的天性难以觅得他人的友情，不如将自己隔离。他不能满足于正统的小成就，而要超越他成长的环境所加的限制，去寻求更大、更新的世界。”看着几百年前的人和自己如此相似的经历，可能我也不是孤单一个人吧,0,0,0,湖南,衡阳,湖南,中国
3,5022685619293412,嵗曲,2024-04-13 13:10:31,《孩子读得懂的漫画墨菲定律》儿童绘本6册    （24.8）  而从我们离开父母去上学开始，选择权越来越大了，懂的事也多了，原来我们是在选择中学会了长大。当然由于每个人的家庭背景不一样，父母观念各不同，受教育程度不等，从小到大，选择的权利、范围、环境、背景等等各不相同，长大了，对于人生的选择也就各有差别。,0,1,0,云南,楚雄,云南,中国
3,5022685372089670,数学张良,2024-04-13 13:09:32,"家长的首要职责是营造积极环境，这个环境有充足的空间，能看见孩子的努力，鼓励孩子的进步，接纳孩子的不足，并能提供必要的帮助。  #家庭教育宝典##家长只有先改变自己,才能改变孩子##行为模型# ",1,0,3,中国,,,中国
3,5022638778878591,薄建辉,2024-04-13 10:04:24,读书不是唯一出路。 但当前的环境下，读书与不读书的人，社会差距究竟能有多大？这个人文纪录片，建议家长周末与孩子一起看看。#教育#   . 薄建辉的微博视频 ,218,21,110,河南,南阳,河南,中国
3,5021973656373101,图文收集,2024-04-11 14:01:26,大格局文案1. 不期待任何人的伞 我就是暴风雨2. 尊重各种声音 但只成为自己3. 山高自有客行路4. 干掉标准答案 你就是标准答案5. 没有表达清楚的爱意都是错觉6. 只筛选 不教育7. 所谓万丈深渊 下去 也是前程万里8. 你在任何环境里 都能成为其中的风景9. 安静的去做 成功了再说10. 少表达一些没人要的诚意11. 我偏要做这傲于高墙的凌霄花12. 永远置顶自己的感受13. 近城远山 都是人间14. 但是之前的话都毫无意义15. 祝这个世界继续热闹 祝我仍是我16. 盐与忠告 不是对方开口要 都不要随便给17. 禁止上头 保持清醒18. 款款独行 才不致倾溢19. 那就让理智永远占上风吧20. 重不重要 都不要了21. 要及时清醒 也要事事甘心22. 我记得这花香 便对得起这时光23. 可能岸上的人更爱海 海上的人更向往港湾24. 去发光 而不是被照亮25. 允许一切发生26. 任何事落到实处再开心27. 做自己 而不是解释自己28. 若无共鸣 沉默即安29. 无爱方可破情局 无情方可破全局30. 没关系 不用理解 各有各的路31. 闲话一直有 不听自然无32. 行己所爱 爱己所行33. 无需比较 我独我34. 放下世俗的眼光 去做你的光35. 你并不差 请置顶你的自信#男生头像##朋友圈文案##文案##头像#,23,4,57,上海,,上海,中国
3,5022676282769855,一颗桃心呀,2024-04-13 12:33:25,对人的爱，对小动物的爱，对万事万物的爱……没有学会的人，怎么都不会懂“如何去爱”装，也是装不像的。模仿，也是模仿不来的。生存、财富、竞争、输赢、享乐，社会环境中，这类恰恰是好追求的，有路径可寻的。人从小一路成长，受教育的路上，各种方法论。或灌输，或倒逼。恰恰，“爱”这件事，从未有方法论。未教，也难教。研究，也研究不来。全凭，个人修为，个人造化。,0,0,0,上海,,上海,中国
3,5022675422157476,重庆消防,2024-04-13 12:30:00,【学知识 强演练 | 重庆消防带领师生共修这堂消防安全课】为切实做好校园消防安全防范工作，营造良好的校园消防安全环境，全市各级消防救援队伍立足实际，在全市范围内开展形式多样、内容丰富的校园消防宣传教育活动，其中，江北区消防救援支队、大足区消防救援支队、铜梁区消防救援支队、两江新区消防救援支队深入辖区中学、大学校园，开展2024年春季消防安全培训演练。#消防安全# #重庆消防# #消防蓝朋友#,1,0,1,,重庆,重庆,中国
3,5022670907507616,墨子曦是个,2024-04-13 12:12:04,    爱意随风起      我出生在一个平凡的家庭，虽不富裕，却非常温馨。小时候，我的世界充满夸赞，我以为我真的非常好。      在爷爷奶奶那上完一年级后，爸爸妈妈为了给我更好的教育环境，将我转入了他的学校，故事也从这里开始。      日子过得很平淡，上学、放学、出去玩，千篇一律。直到五年级下册，一次擦肩而过，惊鸿一瞥，我记住了他，于是我开始好奇：他叫什么呢？带着这个疑问，我开始关注他。从一开始的在人群中寻找他的身影，到熟悉他的行踪，一眼锁定他的位置。我知道了他的名字——宋雨泽。       他非常优秀，就如同那夜晚的星星，璀璨、迷人，却遥不可及。我开始注重形象，无数次假装偶遇，无数次面无表情的擦肩而过却在走过他身边后一次次回头看他。所以，相比他的正脸，我或许更熟悉他的背影。12、3岁，青春期开始的年纪，大片的痘痘出现在我的脸上，使我本就不太漂亮的脸变得糟糕，我一遍又一遍地拿起镜子，一遍又一遍的想：我配不上他。        转眼到了小学的最后一年，我那平凡的、温馨的家庭逐渐支离破碎，爸爸妈妈一次次的争吵。那是我第一次感觉到生活的灰暗，但每当看见你，我的心情就会莫名其妙的好，即使你从未注意过我。            升入初中，很幸运，我们还在同一个学校。我越来越在乎我的容貌，我想要你能注意到我，但我又害怕你注意到我。我依然会在人群中寻找你，但当你我对视上的那一刻，我会飞快地避开目光。            初中的时间过的很快，初二下册你有了对象，她非常漂亮和她比起来我就像一只丑小鸭。学校篮球比赛，你还是那么厉害，带着你们班打进了决赛。可我却没有办法专心看你的比赛为你欢呼，我的目光永远是看向你的，看到你得分的时候我真的很想为你喝彩，但是每当这时候我都会看到那个女生。一整场比赛，我只能看到你，当你小腿抽筋下场休息的时候，我多想问问你：疼吗...可我没有这个资格不是吗。我想我该学着放下你了，因为他们说你很喜欢她，我想那就祝你幸福吧。           可是好景不长，听说她玩了你三次，你说你不会和她复合了。我那颗沉寂的心脏又开始了跳动，我想：那我是不是还有机会？但是我又会觉得，她那么漂亮，那么瘦，我呢？长相一般，身材一般，皮肤也不好，你怎么可能会看得上我呢？            我的爸爸妈妈最终还是离婚了，他们的感情在无数次的争吵中消磨殆尽。与此同时，我的成绩也算是一落千丈。那段时间，或许说直到现在，我的世界都是灰色的。你是唯一的一抹色彩，而你往往会穿非常鲜亮的衣服给我的世界带来色彩。       我是一个非常懂得知难而退的人，但是唯独在喜欢你这件事上，我不想退，我想：万一呢，万一有一天我不用只能观望你的背影了呢？万一我可以成为站在你身边的人了呢？还记得去年初雪，你就在我前面，我很想跟你说：下雪了，你知道的，你能回头看看我吗... 当然，这是不可能的。         直到这个学期，他们说要帮我追你，我兴奋了好久好久，还记得我加上你微信的时候我整个人都傻了，傻傻的看着你的头像，一遍一遍地看你仅有两条的朋友圈。他们说让我主动出击，但是他们怎么会知道，在你面前我的大脑只有一片空白，没有办法思考。我恨自己的不争气。同时再次陷入深深的容貌焦虑和身材焦虑，我想：这样的我怎么能配得上你呢？         有人问过我：“你到底为什么那么喜欢他？就只能是他吗？”我没有办法回答，我也不知道。或许是因为你像一道光，恰好照在了我灰暗的世界。就像他们说的：情不知所起，一往而深。                                                                              ——未完待续,0,0,1,新疆,塔城,新疆,中国
4,5022669393368735,想暴富的小台,2024-04-13 12:06:03,中式教育典型的“跟好的比”我辛苦 有人比你更辛苦 我累 有人比你更累 我优秀 有人比你更优秀 打压式环境下生长的中国小孩总是做事束手束脚然后去羡慕外国孩子的自信大方,0,0,1,广东,广州,广东,中国
4,5022411034465316,林心如小海豚,2024-04-12 18:59:25,林心如在教育孩子时，父母之间的一致性不仅能增强教育的效果，还能为孩子提供一个稳定、安全的家庭环境♥ 林心如小海豚的微博视频 ,5,2,66,四川,成都,四川,中国
4,5022666866297638,西安生态环境,2024-04-13 11:56:00,【西安市生态环境局碑林分局开展干部作风警示教育暨主题党日活动】近日，西安市生态环境局碑林分局在秦岭太平峪圭峰山以“全面推进美丽中国建设——守护美丽秦岭，碑林环保先行”为主题开展干部作风警示教育暨主题党日活动。活动现场，大家沿途拾捡河道两边草丛中的废弃物、纸巾、果皮、食品袋等垃圾，共同改善生态环境，用实际行动守护绿水青山，为建设美丽西安贡献一份力量。,0,0,0,,西安,陕西,中国
4,5022666041853085,YU-AN-NA,2024-04-13 11:52:44,工作、生活、孩子的成长、教育环境  一个人周全所有，成就的背后累啊怎么不累  #不忘初心努力前行# ,0,0,0,福建,漳州,福建,中国
4,5022665151088900,海面向下,2024-04-13 11:49:11,我看到的越多似乎也能够理解原谅他了 他的成长环境个人境遇使他变得自私 现在我也不会像以前一样因为他某个举动就把他的爱全盘否定 而是真正用心去体会他对我的爱 如果他那时候能享受到和我一样的教育一样的资源 一定会出人头地（sorry孔维融没有找到有你的合照 以后一定要去照一个全家福 ,0,0,0,湖北,孝感,湖北,中国
4,5022663276498038,淑女不读书照样会输,2024-04-13 11:41:44,曾经在小办公室时 有一个姐姐跟我讨论她老公说 人跟人最大的区别就是认知  这话很对  人的认知是怎么来的？家庭环境 教育环境 工作环境中种种信息来源 的总和  及 自己价值观的选择信息来源很重要 如果获取的是片面的 单向的信息 就无法建立正确的认知 甚至三观所以 大家一定要想尽办法 多看 多想,0,0,0,陕西,西安,陕西,中国
4,5022657743948428,guo289,2024-04-13 11:19:45,每个人都有每个人的想法，每个人都有每个人的做法，我们没必要指责别人，笑话他人。环境不同、教育不同、理念不同，每个人的想法自然不同，做法自然不一。不能苛求，别人与我们想法一致，做法一样。错对都是自己的，快乐都是个人的，我们无需指责，无需笑话。喜欢的，就是最美的；适合的，就是最好的。 ,0,0,0,广东,茂名,广东,中国
5,5022657623887531,超优秀的毛血旺,2024-04-13 11:19:17,逐渐觉得我的教育环境刻意隐瞒了一件事；不是只有第一名才是好的 有人比你better不等于你就不good 好坏不是从比较中产生的，它有自己的标准，而且因人而异 ,0,1,2,北京,北京,北京,中国
5,5022655037571508,曲江新区,2024-04-13 11:09:00,【#全民国家安全教育日# | 生态安全、核安全主题宣传海报】（生态环境部）从这里看见美丽中国#全民国家安全教育日# ,2,0,0,,西安,陕西,中国
5,5021520315811220,苏醒AllenSu,2024-04-10 08:00:01,春日虽好，鼻炎烦恼却不少，作为新上任的鼻炎春日关爱大使，我和@新华网 一起向你发出#春日鼻炎苏醒警告#《中国变应性鼻炎诊断和治疗指南（2022年，修订版）》倡导做好环境控制、药物治疗、免疫治疗和健康教育，推荐使用#布地奈德#等鼻用糖皮质激素（鼻喷），作为一线治疗鼻炎方案之一。其强力抗炎，以及局部作用于鼻部的安全性特性，可以有效缓解鼻塞、流涕等多种鼻炎症状。科学应对鼻炎，尽享春日时光！ 《中国变应性鼻炎诊断和治疗指南（2022年，修订版）》建议的鼻用糖皮质激素喷雾包括布地奈德、曲安奈德、丙酸倍氯米松、氟尼缩松、糠酸莫米松、丙酸氟替卡松、糠酸氟替卡松、倍他米松、环索奈德。（注：本文内容仅供参考，无法替代医生的诊疗建议，药物治疗需谨遵医嘱。） 苏醒AllenSu的微博视频,14065,10182,31570,浙江,,浙江,中国
5,5022649682494819,宁小蘅,2024-04-13 10:47:43,摩登兄弟 大哥说：每个人都有自己的气质，气质是从哪来的呢？一是你受过的教育。二是你从小成长的一个环境。三是你在社会上经历了什么。四是你爱过的人。很有道理——2019年7月8日直播@摩登兄弟刘宇宁 ,0,1,0,浙江,丽水,浙江,中国
5,5022649137236871,俗客无双,2024-04-13 10:45:33,#看见大山里的妈妈#  大山里的妈妈，育儿初心简单而纯粹。她期望孩子快乐成长，身体强壮，能憧憬未来。她的养育观念独特，亲近自然，享受自然养育与情感陪伴。 为了轻松高效育儿，她善用纸尿裤等母婴产品。对偏远山区的妈妈，她有话想说：环境虽有限，爱与教育不应受限。要关注孩子成长，创造良好环境，重视营养与健康，更要关注心理，给予足够情感支持。 育儿初心要坚守，用爱与耐心陪伴孩子。无论何地，妈妈的爱都是孩子的依靠。让我们看见大山里的妈妈，感受那深沉纯粹的母爱。,0,0,0,安徽,铜陵,安徽,中国
5,5022642005871404,盛世菠菜,2024-04-13 10:17:13,教育头条之前的我看不懂换行业、换职业、换生命角色、换生活地方的价值，也就没有在这些方面多投入和重视，因为我是一个好奇心特别强的人，我大学所学专业与职业无关，我换了行业；我从家乡到了异乡，换了生活环境；从职场离开做育儿妈妈换了职业；从一对一用嘴巴沟通到通过文字输出与多人沟通是改变了沟通方式……这些有意识改变和调整让我感受体验到了新的风景和活出了自我想要的生命状态，如此看来“树挪死，人挪活”是对的，我很庆幸自己持续不断挪动自己的位置，位置不同，风景不同，我很享受这种持续挪动的感受和体验。大部分幼儿园小朋友上学有很多不乐意情绪和拒绝上学，经过刻意练习，他会慢慢习惯和爱上幼儿园；刚踏入社会的成年人，刚开始工作，有很多痛苦、煎熬和不适应，熬着熬着习惯了工作；刚踏入城市生活的农村人，城市的分工明确和合作共赢让他意识到把自己手里的事做到极致的必要性，他强迫自己习惯城市的生活模式、工作模式和相处模式，全方面改变和调整自我是痛并快乐着的过程，熬着熬着他活成了一个城里人；刚生养孩子的女人，生命过程中突然多了一个孩子，她的生命图景、生命路径和时间精力分配都发生了翻天覆地的变化，她煎熬、痛苦、难以习惯和精疲力尽是正常现象，熬着熬着和随着育儿过程的持续推进，她的育儿能力变强了，她也就慢慢习惯和爱上了育儿这件事……生命过程中大事难事，也许有人能轻而易举就干好干成，对我来说每一件事都难，都经历过煎熬和强迫自己的过程，熬着熬着才爱上和干成。人和人是不同的，对待每一件事的感受体验是不同的，自我呈现也就不同的。,0,0,0,河南,濮阳,河南,中国
5,5022641376725476,艾玛冲浪菌,2024-04-13 10:14:43,大s现在在台湾有多惨如今就剩下一个代言了她刚刚离婚的时候，花了不少钱做了综艺节目什么的，推广想卖掉，但是没有电视台买……那个钱花了不少而且她的麻烦在后面呢，在两个孩子的教育和培养上她都没怎么用心，也没给孩子提供良好的家庭环境，这些问题将来对她都是会反噬她这个一上热搜都是靠官司的人设，谁还敢碰，而且找她代言不便宜，效果又不好了，内地已经完全没她的市场了这个女人一生最大的错误就是放弃了自己，把自己搞得一文不值，没有任何价值，其他关系就不会正常，要依靠男人，又不愿意善待他人不知道她为啥不把她的本事，聪明才智用到正道上。脑子有问题，有个张兰那样的婆婆，好好跟着婆婆学做生意，跟汪小菲一起打拼个更好的未来，自己做豪门不好吗？非得弄得鸡飞狗跳的跟着前夫屁股后边要点小钱,6,6,8,四川,巴中,四川,中国
