页码,微博id,微博作者,发布时间,微博内容,转发数,评论数,点赞数,发布于,ip属地_城市,ip属地_省份,ip属地_国家
40,4966074967655126,法律出版社,2023-11-09 08:00:00,#新书推送# 刑法学什么？怎么学？如果有此困惑，那么推荐你阅读《刑法难题》这本书。这是一本谈论我国刑事立法现状、刑法教学现状以及这种现状所产生之原因的非学术书籍，它将治愈法科学子所遭受的来自刑法科目的“创伤”、加强刑庭审判员和刑辩律师去认真对待、细致解读我国现行《刑法》的意识——也许还能树立刑法学者研究和传授实实在在的法律规则的信心。同时，这本大众读物也是写给所有人的，它用轻松幽默的语调讨论刑法问题，将带给你不一样的阅读和学习体验。,2,2,4,北京,,北京,中国
40,4965914204706580,王雪峰-静宝宝,2023-11-08 21:21:11,#当代大学生有多能装# 每个背包都是个神秘领域，装有技术和知识的宝库，从最新款的科技产品到各种学术书籍，一切都为了那不停求知的心 ,0,0,0,福建,福州,福建,中国
40,4965875833899441,咖啡因摄取抑制剂,2023-11-08 18:48:43,看到评论说流畅好读，立马加入书架，但是看完了一章还是觉得好难理解，点进去原评论一看原来人家是中文系的。  行吧，不要在知识储备不够多的时候挑战一本偏学术的书籍 ,0,0,1,广东,广州,广东,中国
40,4965550818858923,小小地瓜泥,2023-11-07 21:17:13,研究方法：本研究将采用以下方法进行数据和资料的获取：文献综述通过查阅相关的学术期刊、书籍、学位论文以及互联网上的相关资料，对绩效考核的理论、方法和实践进行综合梳理和分析，以获取绩效考核领域的最新研究成果和理论观点。实地调研通过实地走访该单位，与相关部门负责人、员工进行深入交流和访谈，了解该单位该类人员绩效考核的具体实施情况、存在的问题以及相关人员的意见和建议，获取第一手的调研数据。案例分析选取该单位或类似单位的绩效考核实施案例，进行深入分析，探讨其绩效考核体系的设计、实施过程中的挑战和解决方案，从中汲取经验教训，为本研究提供实践案例支持。通过以上研究方法的综合运用，将获取关于绩效考核理论和该单位该类人员绩效考核现状的相关数据和资料，为论文的深入分析和解决方案的提出提供可靠的依据。研究方法：问卷调查设计并实施针对该单位该类人员的问卷调查，以获取员工对绩效考核制度的认知、满意度、存在的问题以及改进建议等信息，从而全面了解员工对绩效考核的看法和期望。数据分析收集和整理相关的定量和定性数据，运用统计分析方法对绩效考核实施过程中的关键指标进行分析，如绩效评价结果、绩效奖励发放情况等，以客观数据支持研究结论。专家访谈邀请绩效管理领域的专家学者或该领域的从业人员进行访谈，就绩效考核的设计、实施和改进提出建议和意见，以丰富研究视角和提高研究的可信度。对比分析选择其他类似单位的绩效考核实施情况作为对比对象，进行横向对比分析，发现该单位绩效考核的优势和不足之处，为改进提供参考。实地观察通过实地观察该单位的绩效考核实施情况，了解实际操作中的细节和特殊情况，为研究提供直观的数据支持。SWOT分析运用SWOT分析方法，对该单位该类人员绩效考核的优势、劣势、机会和威胁进行全面评估，为改进提出具体的策略和建议。参与式研究采用参与式研究方法，让研究者深入到该单位的绩效考核实施过程中，与员工和管理者共同参与、观察和反思，以获取更深层次的理解和发现。通过以上多种研究方法的综合运用，将全面深入地了解该单位该类人员绩效考核的现状和问题，并提出切实可行的改进方案。,0,0,0,山东,青岛,山东,中国
41,4965505996691293,discursive_Rady,2023-11-07 18:19:07,无论通俗的还是学究的书籍，凡是比较符合现代学术规范的书籍，无论你认不认可、喜不喜欢其中的观点，但是这些观点背后往往都堆积着厚厚叠叠的学术论文和著作，你甚至觉得作者似乎都是不自由的。我多多少少都有点不是特别喜欢这种风格…但是我突然意识到，就算别人觉得我观点比较 radical or cynical，我大部分也都可以找到明确的出处（指符合现代学术规范的书籍）。当！被回旋镖打中了！,0,0,0,安徽,宣城,安徽,中国
41,4965056412651813,量子位,2023-11-06 12:32:38,#750万册学术书籍数据独家一年访问权限#  开源数据组织Anna's Archive收集了750万册学术数据，现在愿意独家提供一年访问权限给一家大模型公司  要求：贡献OCR结果 网页链接 ,14,2,22,,北京,北京,中国
41,4965141727415605,PlatinumArowana,2023-11-06 18:11:38,Reading Week结束啦！除了去Reading徒步了一个下午之外，其他时间一直在看书。上午看学术书籍，下午读Dickens，终于快要把近1000页的Bleak House读完了，昨天搭好了seminar的框架。开发了几个新菜：香辣鸡肝青菜炒面，烤鸡配菜饭，ciabatta bread夹烟熏三文鱼配黄油炒蛋和蒜茸蘑菇。几个月前在海边吃到过ciabatta bread配熏鱼，发现这两种食材的口感融在一起很奇妙，因为同属焦脆的口感，而且熏鱼的咸味能把面包的香味衬出来。五颜六色的日历：深红色是重要事项，淡红色是娱乐项目，蓝色是需要参加但无需互动的事项，绿色是教课，紫色是听讲座。,0,1,2,英国,,英国,英国
41,4965103709980202,峰哥说个球呢,2023-11-06 15:40:34,·姜云升  谈自己除了写歌和睡觉的爱好以外就是看书·姜云升爱看学术研究类书籍#亿点曝光计划##搞笑##涨姿势##日常# 张咔咔的微博视频 ,0,1,2,安徽,宿州,安徽,中国
41,4964432691072125,南瓜博士李昕升,2023-11-04 19:14:11,人在国内，如何购买日文学术类书籍呢？#南瓜时空# 英国·剑桥大学植物园 ,4,15,22,英国,,英国,英国
41,4964694868629502,魔怔不彻底就是彻底不魔怔,2023-11-05 12:35:59,+1，A解决了很多z lib/lib gen未收录或被隐藏的学术书籍，最近才受网友推荐转向A真感觉错过一个亿//@萧湘14pro:「安娜的档案」确实非常好，书很多，z_lib也只是它的子集。另外，对三年内的新书，建议大家不要白嫖，支持新书，免费老书，才是互联网爱书人的精神！,0,1,4,江苏,苏州,江苏,中国
41,4964643773875325,hohohoapril,2023-11-05 09:12:57,照顾生病咳嗽的娃好费神，以至于现在打开学术性书籍我都感觉到身心的一阵舒畅放松😌 ,0,0,0,广东,,广东,中国
41,4964203757568424,zwischenvierundsechs,2023-11-04 04:04:29,比起电影，爆米花更适配躺在床上阅读一些学术书籍。 ,0,0,4,德国,,德国,德国
41,4963722692922959,Tina--V,2023-11-02 20:12:54,原以为是一本专业学术类书籍，但从教学方法上入手，一下子就好读了。其实我身边的教育从业者大都也是从教学目标、教学方法、教学过程….等内容，开启第一堂课的，但和巫鸿老师的授课效果相比，差距肉眼可见。我想我们更多的是给予，段位怕是最低的，要学会带领和启发，去点亮他们，课堂才更具魅力。方法还是有很多的 #我读#,0,0,2,辽宁,大连,辽宁,中国
42,4963409086908815,弟弟踢,2023-11-01 23:26:45,也挺好 就是繁体竖版看学术书籍看着眼睛发疼 ,0,0,4,广东,深圳,广东,中国
42,4963357404960827,澳门留学陈老师,2023-11-01 20:01:23,大家好，我是陈老师。今天继续分享澳门工商管理博士付费咨询案例。以上案例真实有效，如有雷同，属于侵权。学生背景：本科双非，双学位，国际贸易和会计，硕士澳洲前三，专业会计，已经工作20多年，有在单位和高校工作经历，并取得多项专业资格证，科研经历丰富，多篇文章发表，主持相关学术书籍编撰，和多段海内外交流经验。研究方向电子商务。学生背景特别好，在我看来，可以直接申请澳大的dba项目。选校推荐了澳大澳科技澳城市的工商管理博士项目，澳科技必须在学校认可的核心期刊发一篇文章才可以进行论文答辩，澳大和澳城市完成博士论文答辩即可。关注陈老师，持续分享更多申请！#澳门工商管理博士##澳门留学##dba工商管理博士#,0,0,0,河南,郑州,河南,中国
42,4963228604435663,一枝桃儿,2023-11-01 11:29:34,今天看完了朱光潜的《谈美》。按理说，这本书应该是去年这个时候应该阅读的，但是在我备考期间实在抽不出空去阅读一本小几万字的学术类的书籍。所以在我已经有了艺术原理的基础以后再去读这本书，实在是太好理解了。希望我也会变成一个可以感悟生活中美的人，慢下来去感受 ,0,0,0,广西,南宁,广西,中国
42,4962962127192584,啾咪须佐酱,2023-10-31 17:50:41,一个原则：如果翻译学术类书籍时对该学科的学术素养不够，请按照字面意思来直译，别自己xjb润色 读原文都不如读翻译累，译者能读得明白自己翻出来的是什么玩意吗？ ,0,0,11,北京,,北京,中国
42,4962875431190642,酸汤牛瘪,2023-10-31 12:06:10,没眼力好像真是原罪#情感# 日尔曼人走出森林虽然还不很久，学术文艺却已经很可观，便是书籍的装潢，玩具的工致，也无不令人心爱。独有这一篇童话却实在不漂亮；结怨也结得没有意思。猫的弓起脊梁，并不是希图冒充，故意摆架子的，其咎却在狗的自己没眼力《朝花夕拾》 ,0,0,0,贵州,黔东南苗族侗族自治州,贵州,中国
42,4962560555614830,喵娘叫做徐小喵,2023-10-30 15:14:59,📖/#书单请食#「《着装规范：创造历史的时尚法则》：被法例和陈规所推动的时尚」/原版书名为《Dress Codes：How the Laws of Fashion Made History》，是由斯坦福大学法学教授理查德·汤姆森·福特（Richard Thompson Ford）所著的学术书籍，他以众多历史学家认可的古代结束和现代感性之始的14世纪为时间节点开始书写时尚脉络，以相关的政治事件和知识相关事件为入手点，探究与不同时代的法则和社会规范是如何让时尚产生的社会意义和个人价值的。目前我只阅读完第一章节，感觉阅读此书需要有一定的时尚知识门槛，它比较适合的读者群体是时尚历史文化研究者、相关专业的学生以及对时尚历史已有大致把握的爱好者。因为，福特虽然列出了一条鲜明的时间轴——约是从1200年至2000年左右，但整本书并非是传统概念中对历史背景、社会现象进行的线性书写，而是以不同时期的政治事件、法律条例、社会陈规——即书名中的「Laws」为线索展开，也就是在「时尚主历史」外列了一条以「法律规则」为核心的新主轴。因此，如果没有对时尚历史有足够的了解，可能很难和线性的时代背景事件、服装史发展进行一一对应。其次，正如福特在书中所写，他将时尚发展总结为四个关注点，分别是：地位、性别、权力和个性，将时尚的历史和个人主义的历史并行讨论。譬如，历史学家斯蒂芬·格林布拉特(Stephen Greenblatt)认为，16世纪，用「时尚」一词来表示「自我个性的形成……这一个性的形成既有身体形态的变化，又有个性的改变。」福特将缝纫服装（技艺）的出现当作是现代个人意识的出现标志，个人主义在中世纪晚期和文艺复兴时期开始出现，随后而来的便是时尚，「我认为，时尚是个人主义精神的一种展现，没有个人主义，时尚也就无从谈起。」时尚鼓励人们强调自我价值，这是启蒙运动人文主义的早期形式，而人文主义最终取代了神学的宇宙中心地位。该书建议有一定时尚历史基础的朋友阅读的还有一个原因是，书中出现的时尚专业术语的中译有一定的商榷余地，其中有一些专业名词在我们比较习惯了英语语境后，可能很难将它的中文进行联想，譬如「Flapper 女郎」书中译为了「新潮女郎」、「Cornette」译为了「白布帽」、「Sprezzatura」译为「刻意疏忽」、「Hose」译为「宽松短罩裤」等，因为涉及到知识点的延伸学习，鉴于国内目前也鲜少关于此类时尚专业术语的权威性翻译，所以读者在阅读时可能需要同步留意到中英文专业术语的转化，方便进行延伸思考。一般来说，遇到这种情况我会同步购买英文版本作为参考。总体来说，此书的信息量和视角非常不错，很适合对时尚历史有研究爱好的读者阅读。另外，对此书感兴趣的小伙伴也可以上油管搜索「Dress Codes：How the Laws of Fashion Made History」关键词，有福特教授的采访和斯坦福大学分享的读书笔记，大家可做参考。下图是我拍的部分书页，请忽略被我画得一塌糊涂的记号。XD,32,8,73,浙江,宁波,浙江,中国
42,4962275577561745,二代目寝坊君,2023-10-29 20:22:35,曾经我是有些许忧虑的，自媒体起来之后，人人都是自媒体嘛，人人都可以发表观点嘛，那学术也就不仅于期刊和书籍了，对伐，总有你以为蛮有意思的东西，诶在哪个犄角旮旯的互联网角落里已经有人发过了，不时髦了。但就我近几年在微博的观察所得，忧虑是多余，反正都会被夹掉、会被半年可见的嘛（nili互联网确实不可靠,0,0,2,海南,海口,海南,中国
44,4960329047214084,回溯hui_su,2023-10-24 11:27:46,捏的 前几本看的都是小说 想着换换口味 就打开了《传染病与社会》 结果这种比较学术的书籍果然对于我来说还是太难看下去了 上一本看的类似的《浪漫主义的根源》 花了三年时间才好好读完整本 ,0,0,5,广东,广州,广东,中国
44,4959318477113422,记录生活的巧克力派_,2023-10-21 16:32:07,和室友瞎溜达，溜达到了市图书馆，我靠这是什么天堂，我居然才发现它全是我爱看的小说，每一本都那么诱人，比学校的学术书籍有意思一万倍，我能在这里住着不回家以后我要常来多来 ,0,0,1,河北,石家庄,河北,中国
44,4958696992148361,我系耙耙柑,2023-10-19 23:22:34,终于把这本书看完了，《中国封建结构探要》真的是无意发现的宝藏，它通篇围绕着中国封建结构开讲述，语言通俗不学术，表达清楚又简明，是一本让你越读越有滋味的社科书籍。       一开始我也以为这本书会是那种通篇晦涩深奥的语言但是读起来一点都不枯燥，我一向不喜欢那种标榜自己是学术书籍，所以明明可以简单明了的表达清楚非要写的让人看了就昏昏欲睡，从而丧失对社科类书籍的兴趣，我认为如何把无趣的研究内容写的有可读性是每个著者需要思考的问题。,0,0,0,河北,张家口,河北,中国
44,4958500868327334,本子老头在天堂,2023-10-19 10:23:14,鸢车倒是对车不怎么有印象但是喜欢偶尔流露出来的纯爱情侣小细节。小鹿问广抄什么书广随口报一个黄文名小鹿充耳不闻接上了一本学术书籍的名字这里suki ,0,0,0,日本,,日本,日本
44,4957931699438350,Free_bo,2023-10-17 20:41:34,当下状态： 看见学术论文和参考书籍里面的文字就大脑出走，无法运作，理解不了一点。 阅读小说时的脑活动十分活跃，通过对字里行间情节的脑补，对内容充分理解品鉴。 ,0,0,2,广东,汕头,广东,中国
44,4957525927267211,寥若晨星2024继续前行,2023-10-16 17:49:10,我最喜欢的学术书籍开头至今仍是Mary Bly所著，主题是文艺复兴戏剧里的黄色笑话，专注于King's Revels Children这个剧团的那一本：I begin with the desire of laughing with the dead. ,2,4,6,四川,成都,四川,中国
44,4957225983677173,马丘比丘的花匠,2023-10-15 21:57:18,开始读一些学术性的考古/历史书籍📚👓，看过几本分享一下心得。喜欢的事情还是要逐渐专业化才能称得上是喜欢啊！ ,0,0,0,北京,,北京,中国
44,4956850460820814,迟迟菁,2023-10-14 21:05:06,studyaccount 吃饭睡觉读康德这周试用了新的手帐排版to do list+时间轴+每日总结是很不错的！规划和总结都很清晰 安利给大家以及 开始为期中周做准备了虽然时间很紧张 但是学术性强的书籍不仔细读就等于白读  所以还是慢慢来吧^ ^以及 看到入学合照后我朋友：你头发怎么这么多我：哈哈我们粗硬发质是这样的祝大家秋天快乐！(･･;),4,89,982,上海,,上海,中国
45,4955515068874828,東方e曉,2023-10-11 04:38:44,半夜里突然牙疼，用陈年老海盐漱口，疼痛缓解，但是睡意已消，预感天亮后精神状态定是欠佳。既然疼痛将睡意打消，索性读读书。不能太学术性的书籍，会使睡意消失的更快。随手取出梁实秋的雅舍小品，读过多次的小书，依然动人。朴实的文字，简单的日常，却写出不平凡的见解与道理，难怪几十年读者众多。 ,0,0,0,上海,上海,上海,中国
45,4954569098920706,11月是最后的秋天,2023-10-08 13:59:47,箴言书苑《陈漱渝藏学术书信选》陈漱渝   选编   孙旭宏              这一本书关于老一辈知识分子的学术藏书信研讨往来的内容书籍。让我们了解了书信背后的努力，和严谨工作态度。注重事实，正能量的呈现了学人们的治学态度。作者作为北京鲁迅博物馆鲁迅研究室的副馆长兼鲁迅研究室主任，在对一些有历史意义的重要事件实物、学术资料进行存档、求真实性，保护等，进行了与工作外的许多学术界名家、社会名流等人士接触，得以把工作全面展开。        特殊的年代，老一辈人的工作生活书信是他们密切联系的主要方式。那时候不像现在的通讯发达。他们一封信件从始发地到目的地需要好几天，甚至更多时间。看得出来，在近300封珍藏书信中，作者和当事人及非当事的亲朋友，他们在书信往来时反应的客观问题，每个字每句话都是经过严格认真表达的。那时候他们的书信记录了更多的是一些力求真实事实的还原，又或者是一篇文章一首诗歌的考究之处，反复推敲到更合适的表达。由此可见，作者的工作不但需要做好博物馆内的职责，还要付诸实质的理解能力，才可能保持真实性存于馆内，彰显它们的意义和精神鼓舞。        其次是老一辈人之间，在工作上那种协同合作的真诚度，即使事隔多年，大家的生活都发生了变化，那份感恩之心，因那份忙碌工作之心而耽搁了许多友谊的见面，又一次见证了他们对工作不断追求的积极向上精神，令人钦佩！,0,0,0,广西,南宁,广西,中国
45,4954316856099832,肆囍闫,2023-10-07 21:17:28,九月读物#九月再见# 学术月 看了两本学术类书籍 难啃，《月光落在左手上》没看完 ,0,2,1,黑龙江,哈尔滨,黑龙江,中国
45,4954044643410141,supercalifragilisticexpialidoo,2023-10-07 03:15:47,读书群建了快两个月了大家都只在群里聊了学术书籍影音。觉得可能是因为读书群人多不方便大家随意聊天就建了个小群，然后小群的画风从相册中看来是这样的： 换了个读书环境的读书群增加了（很有意思 ,0,16,14,美国,,美国,美国
45,4953409763410036,方脑壳邓铂鋆,2023-10-05 09:13:00,#当年明月作者的顶级觉悟#副处级以上，党员，出版非学术书籍要单位党委党组开会讨论通过。石局座不想让私事上会，出书的事情那就算了。 ,6,14,236,山东,济南,山东,中国
45,4952846035583810,半岛圣雪,2023-10-03 19:52:57,不要用想象中的样子定义我，我从来不喜欢篮球，也不喜欢打篮球，我喜欢琴棋书画，我喜欢读外文书，我喜欢读学术书籍，我喜欢读政治，历史，英文，我对一切昂贵的东西感兴趣，我曾经喜欢绘画，我不喜欢小说，不喜欢动漫，更不喜欢日漫，我喜欢钢琴，我喜欢用英语口语交流。 ,0,0,0,辽宁,朝阳,辽宁,中国
46,4951341883458184,死刑布告,2023-09-29 16:15:59,高铁站里的书都是些过期财经杂志、红色文宣、甚至还有一些学术书籍文献资料。是不是为了防止旅客看入迷忘记乘车时间，也防止旅客带走啊。 ,0,0,1,湖南,株洲,湖南,中国
46,4950749903324570,AS_源,2023-09-28 01:03:40,我真的。。怎么会有人能在微信看学术书籍，还能写长篇大论的书评啊为什么有人每天都能写书评啊怎么看得那么快，还条理清晰能不能分我半个脑子 ,0,2,1,江苏,扬州,江苏,中国
46,4950716940550276,-二两饭-,2023-09-27 22:52:40,快十月了呀，心里有个角落柔柔的，整个人慢了下来，最近趁着培训空隙，读完了《秋园》和《分身》，正在读《叫魂》（？想不到居然是学术书籍），晚饭散步到青年书店买了《额尔古纳河右岸》，我不着急，那么多欢愉时刻，是因为有你啊。 ,0,2,0,云南,,云南,中国
46,4950362035323845,非也非qq,2023-09-26 23:22:25,不知道是不是古文字类学术研究书籍的通病，金文文字图像基本看不清 ,0,0,0,黑龙江,哈尔滨,黑龙江,中国
46,4950211904145409,半虚构的main,2023-09-26 13:25:51,生活处处都在印证着学术书籍里常看到的“资本主义/消费主义强大的收编能力”,0,0,2,山东,青岛,山东,中国
46,4950099707036426,Kakushirei_,2023-09-26 06:00:01,导师约我第二天线下见一面，好可怕，怕她发现自己招了一个用英语讲不清话并且前一年一本学术类书籍都没有看这两天天天刷电视剧的傻子。 ,0,2,3,英国,,英国,英国
46,4949509266738609,lovelife旦旦,2023-09-24 14:53:49,旦哥很开心今天的学术报告被教授表扬：“旦旦虽然是外国学生，且是英文书籍材料用泰语报告，旦旦用词恰当且严谨，思路清晰，归纳总结很好，值得博士班的其他泰国同学学习。” 泰国·BangkokThailand ,0,11,76,泰国,,泰国,泰国
46,4949506494039671,地球什么时候大bz,2023-09-24 14:42:48,若近来无事，可尽情看电视剧课外书，那此时的电视剧和课外书定是顶顶无聊的。 若最近有一门考试，那么曾经看不进去的那些子学术历史类的书籍，此刻读起来也是分外有趣。甚至连知网上的论文看起来都是非常亲切可爱的。 ,0,3,1,山东,菏泽,山东,中国
