页码,微博id,微博作者,发布时间,微博内容,转发数,评论数,点赞数,发布于,ip属地_城市,ip属地_省份,ip属地_国家
2,5048835304590772,皖粮发布,2024-06-24 17:00:02,省粮食和储备局组织党员干部赴省侨史馆开展革命传统理想信念教育       为持续深入推进党纪学习教育，结合理想信念教育月工作安排，6月19日下午，省粮食和储备局党组成员、副局长罗立高率机关党员干部赴省侨史馆开展理想信念教育。       省侨史馆由序厅、侨史展厅、侨联发展展厅、侨联工作展厅、侨界风采展厅、皖籍侨团展厅、侨界贡献展厅、尾厅组成。在现场讲解员的引导下，党员干部们通过图片、视频和实物资料等多种形式，全面回顾中国和我省侨的历史、侨联光辉足迹，深入了解广大侨胞衷心爱国、守望相助、情系桑梓、追求卓越的生动事迹，学习侨界心系祖国、情注人民、艰苦奋斗、无私奉献的优良作风。       大家纷纷表示，要以此次学习教育为契机，深入学习贯彻习近平总书记关于保障国家粮食安全的重要论述和重要指示批示精神，践行初心使命、忠诚履职尽责，坚决扛稳粮食安全重任；要扎实开展党纪学习教育，持续强化作风建设，立足本职岗位、主动担当作为，为推动我省粮食和物资储备工作高质量发展，助力现代化美好安徽建设凝聚奋进力量。,0,0,0,,合肥,安徽,中国
2,5048830548510845,看金牛,2024-06-24 16:41:08,【开展主题党日活动 回顾百年党纪建设】#金牛播报# 纪律严明是中国共产党发展壮大、不断从胜利走向新的胜利的重要法宝。6月22日，中共成都市金牛区人才交流服务中心委员会组织开展&quot;知党史·强党纪&quot;党规党纪和革命传统教育主题党日活动。四川省委省直机关党校科社法学教研部副教授，省直机关工委党的二十大精神宣讲团成员欧阳玉蕾围绕党史中的党纪建设进行了专题讲座，引导广大党员真正把纪律规矩转化为政治自觉、思想自觉、行动自觉。（金牛融媒） 看金牛的微博视频,0,0,1,,成都,四川,中国
2,5048829642808131,白天杨a,2024-06-24 16:37:32,#中高级轿车领航者##有一种新风尚叫迈腾B9# 一汽大众全新迈腾B9换挡方式发生了革命性的改变，由传统的换挡杆变成了怀挡，换挡方式更加方便，上下不同的旋转就能改变档位，右手都不用离开方向盘太远，使用起来更加便捷。而且还增加了中控区域的空间！这样的设计很实用！ ,0,0,0,河北,石家庄,河北,中国
2,5048802506178787,大别山红色教育培训基地,2024-06-24 14:49:41,大别山红色教育基地培训咨询：17637673888（刘老师），新县大别山红色教育基地介绍，信阳新县位于河南、湖北、安徽三省交界处的大别山腹地，是一片充满革命历史的热土。这里不仅有着丰富的红色资源，更承载着深厚的革命传统和伟大的大别山精神。新县大别山红色教育基地是广大党员干部和群众接受革命传统教育，弘扬大别山精神的重要场所。发布了头条文章：《新县大别山红色教育基地》  新县大别山红色教育基地,0,0,0,河南,信阳,河南,中国
2,5048755901960839,zhujun_sh,2024-06-24 11:44:31,信息和熵互为对方的负数，信息的度量是秩序，熵的度量是无序！第一次工业革命（传统控制论）通过引入机器竞争贬低了人类劳动的价值。第二次控制论工业革命“也注定会贬低人类脑力劳动的价值”，当下的AI agent可以理解为基于信息控制论后的第三次工业革命，注定会把人类从纯粹知识决定论中走出来，强调在这个星球上以人为本的重要性！,0,0,1,上海,,上海,中国
2,5048739145714719,人大重阳,2024-06-24 10:37:56,加强纪律建设是全面从严治党的治本之策。开展党纪学习教育，是加强党的纪律建设、推动全面从严治党向纵深发展的重要举措。我们要深入学习习近平总书记关于全面加强党的纪律建设的重要论述，牢牢把握开展党纪学习教育的重大意义，把纪律严明的光荣传统与真抓实干的优良作风结合起来，把自我革命的理论旨归与党纪学习教育的实践要求结合起来，把纪律建设的整体部署与高校阵地的具体要求结合起来，以高质量开展党纪学习教育的工作成效彰显高水平推进全面从严治党、从严治校的坚韧执着，为建设中国特色、世界一流大学保驾护航。 张东刚：推动党纪学习教育走深走实,1,1,0,北京,北京,北京,中国
2,5048733244588401,人民政协报,2024-06-24 10:14:29,【#人民政协学习座谈会的由来#】#政协掌千秋# 重视学习、崇尚学习，是人民政协的优良传统。中华人民共和国成立后，在毛泽东、周恩来等老一辈革命家的积极倡导和身体力行下，学习成为人民政协的重要任务和重要基础性工作之一。学习座谈会是人民政协在上个世纪50年代创立的一种学习组织形式，在提高民主党派和无党派人士理论政策水平、广泛凝聚智慧建设新中国等方面，发挥了重要作用。人民政协学习座谈会的由来,1,1,1,,北京,北京,中国
2,5048729600000995,阳泉日报--阳泉新闻网,2024-06-24 10:00:00,连日来，百团大战纪念馆游人不断，许多外地游客和本地市民走进这里，通过一件件满是岁月痕迹的实物、一张张珍贵的历史照片，接受革命传统教育，体验红色文化魅力。图为6月19日，游客在百团大战纪念馆内聆听讲解员讲解。晋向华摄 ,0,0,0,,阳泉,山西,中国
2,5048727871687016,阿--PO,2024-06-24 09:53:08,BoardMix - PPT制作的革命 BoardMix是一款PPT制作软件，它通过AI助手彻底颠覆了传统PPT的制作方式。用户只需输入标题，AI便能在一分钟内生成多个PPT方案。BoardMix不仅支持演示文稿的快速制作，还能一键生成思维导图、流程图等，同时允许导入多媒体内容进行自定义修改。它的多人在线协作功能，让团队协作更加无缝和高效。,0,0,0,江苏,南京,江苏,中国
2,5048720477914167,贵阳新闻网,2024-06-24 09:23:45,【有理贵阳 | 党的纪律的基本功能和实质】#贵阳贵安开展党纪学习教育# 我们党是靠革命理想和铁的纪律组织起来的马克思主义政党，纪律严明是党的光荣传统和独特优势。在以中国式现代化全面推进中华民族伟大复兴的新征程中，中国共产党要肩负起自己的历史使命，更好地发挥坚强领导核心作用，必须加强党的纪律建设，把严明党的纪律和规矩落到实处。党的十八大以来，习近平总书记高度重视从严管党治党，多次强调“要把纪律建设摆在更加突出位置”。这是总结我们党一百多年自身建设特别是纪律建设经验所提出的要求。它反映了党的纪律在功能和实质方面的内在要求，广大党员、干部应认真领会党的纪律的基本功能和实质。党的纪律的基本功能：教育、引导、警示、预防、惩戒、纠错。纪律之所以有用，就在于它的功能。纪律体现的是共性要求，在一个团体、一个组织内部，纪律体现的是对团体或组织内部所有成员的要求。因为是对所有成员的共同要求，才能够保证组织内部成员行动的一致性。如果纪律要求在组织内部厚此薄彼、因人而异，那就发挥不了应有的作用。所以，纪律不是“橡皮筋”，纪律最怕“开天窗”，最怕搞特殊化，纪律的执行必须做到人人平等。违反了纪律，就必然受到处分，《中国共产党纪律处分条例》(以下简称《条例》)就明确规定了各种违反纪律的行为必须受到的相应处分。当然，纪律的主要功能并不是处分人，处分是对已经违反纪律的行为给予处罚。如果我们对党的纪律的功能加以细分和排列，应该是这样一个顺序，即教育、引导、警示、预防、惩戒、纠错。首先，党的纪律是用来教育和引导人的。我们党历来重视纪律建设和纪律教育。之所以要进行纪律教育，就是为了让党员干部深刻认识到纪律的重要性，强化自身的纪律观念，对纪律具有敬畏意识，明白行为底线是什么，什么是可以做的，什么是不能做的。其次，党的纪律是用来进行警示和预防的。纪律就是“红线”，就是“高压线”，明确纪律就是把“高压线”标示出来，告诉人们，这是不能触碰的。制定和公布《条例》，就是明确告诉党员干部，如果该止步的地方不止步，无视这样的警示，那就要受到处分。最后，纪律具有惩戒和纠错的功能。党员干部违反纪律受到相应的处分，一方面能够纠正其在工作中的错误，减少其错误造成的危害;另一方面能够引起更深入的反思，不再发生这样的错误。对于党员干部来讲，这就是我们所说的惩前毖后、治病救人。党的纪律的实质：自律和他律相结合。党的纪律主要发挥两个方面的作用：一是通过教育、引导、警示、预防，使人明白其中的道理，从而在行动上实现自律。二是通过惩戒和纠错，以外在的强制性约束，帮助人们改正自己的错误。因此可以说，党的纪律的实质就是自律和他律相结合。自律是一种觉悟、一种境界。人们一直将自律作为个人品德修养的重要内容。中华优秀传统文化中强调的自省、慎独、克己，其实就是强调人的自律。优秀的中国共产党党员都拥有高度的自律。这种自律是出于对党和人民事业的责任，也是出于对党的纪律的敬畏。革命战争年代，生活那么艰苦，中国共产党领导的军队却严格遵守着群众纪律，从井冈山时期不拿老百姓一个红薯，到后来的不拿群众一针一线，所以受到广大人民群众的衷心拥护。要做到这些，仅靠外在的强制性约束是不够的，主要依靠的是广大党员、干部内心对纪律的深刻认识和遵守纪律的高度自觉。中国共产党之所以以纪律严明著称，根本原因在于其不仅有组织内部严格的纪律要求，更有成千上万能够严格自律的优秀党员干部。当然，作为一个组织，要保证整体的团结统一和步调一致，仅依靠个人的自律是不够的，还必须有严格的他律。这是因为在组织内部，人的认识和觉悟是存在差异的，而能够做到自律的程度也是存在差异的。所以，必须有统一的要求、统一的准绳。作为长期执政的马克思主义政党，面对各种严峻的考验和现实的危险，坚持全面从严治党，不断完善党内法规制度体系，把各项纪律和规矩立起来，是非常必要的。（贵阳日报评论员 戴焰军）,0,0,0,,贵阳,贵州,中国
3,5048713057142351,乐东法院,2024-06-24 08:54:16,【踏寻革命足迹，传承红色基因 | 乐东法院法庭党支部开展主题党日活动】为进一步深入开展党支部学习教育活动，教育引导党员深入学习党史，学习革命前辈的优良传统和红色文化，6月20日，在党组成员、副院长潘海同志带领下，乐东法院法庭党支部党员、积极份子到五指山革命根据地纪念园开展主题为“不忘初心 砥砺前行”的党日活动，以实际行动传承红色基因。网页链接,0,0,1,,乐东黎族自治县,海南,中国
3,5048552692389688,赵振华Honey,2024-06-23 22:17:02,【伟大是熬出来的：以英伟达🐂和特斯拉🐂为例】伟大是熬出来的：以英伟达和特斯拉为例 人类社会先后经历农业革命、工业革命以及信息技术革命（目前正处于#人工智能# 革命的开端）。资本市场的第二个基本特征是：公司市值的变化形式与商业模式有关，从传统企业到科技型企业，市值变化的非线性特征愈加明显。在长达近25年的统计中，英伟达🐂80%的市值都是在2023年至今（2024年6月18日）创造的。以2022年3月31日的特斯拉🐂市值高点为参照点，在其近12年的统计中，其市值的80%都是在1年半内创造的。,0,0,0,湖南,长沙,湖南,中国
3,5048547655025342,文化虹口,2024-06-23 21:57:00,从宝山路到多伦路——毗邻党建聚合力，打造红色朋友圈静安区的宝山路街道和紧邻的虹口区的四川北路街道都拥有光荣的革命传统和丰富的红色资源。为推动党史学习教育常态化、长效化，不断助推区域资源联享共建、互联互促融合发展，6 月 18 日上午，宝山路街道社区党群服务中心与虹口区四川北路街道社区党群服务中心携手开展联学共建活动。通过集中学习、实地参观、座谈交流等形式，达成共建目标，凝聚毗邻党建聚合力，同心共筑红色朋友圈，力争在服务好辖区党员群众方面展现新作为详情请戳链接：从宝山路到多伦路——毗邻党建聚合力，打造红色朋友圈,0,0,0,,,上海,中国
3,5048540581593606,李文敏的诗词号,2024-06-23 21:28:54,李文敏送别——文/千诗/李文敏—中国传统文化促进会会员（湖北省武汉市）多殇之秋，大人却行离辞，心悲殇极。秋晨，寄道送别之列，盛集殒之悲。秋分兮，悲首起吟悲赋离别季。人生之尽岁，革命志健行誓俱行满。君归途，阡陌清明，人间千秋辉，必留千古名，送别。 武汉,0,0,0,湖北,武汉,湖北,中国
3,5048069115087441,种花家的菌事兔,2024-06-22 14:15:28,#相约传统村落# 这是山西晋城传统村落上庄村的红色故事，“最后一口粮做军粮，最后一儿子送战场。”上庄村为支援前线作出的贡献可能在革命历史中只是隐隐之光，但是却代表了全中国百姓的抗战热情。战争的硝烟渐渐远去，但抗战的历史却永远不能被忘却！先烈们用鲜血和生命打下的江山，永远立在了人民的心中。#高质量发展中国行#  种花家的菌事兔的微博视频 晋城·天官王府景区,75,112,605,山西,晋城,山西,中国
3,5048473600134542,亦凌斯儿,2024-06-23 17:02:45,长久以来，传统对女性角色的定位是私人事物、家庭事物，具有收缩性和封闭性，大大限制了女性价值。从哲学角度来看，解构主义哲学家拉康提出: 为什么当代社会的女性最具 革命性?因为女性文化自身就具有流体性，具有时间维度的自由感，当遇到这样一个坚硬的世界时，她们所激发出来的内心的种种声响会比男性多得多。——梁永安,0,0,1,浙江,杭州,浙江,中国
3,5048422333946018,为民公考-黄药师,2024-06-23 13:39:02,"#事业单位综合应用 a# ——展览前言【参考】国家博物馆文案——古代饮食文化展前言饮食不仅是人类赖以生存的物质条件，也是社会发展进步的重要标志。饮食文化是中华传统文化的重要组成部分，从茹毛饮血到炊煮熟食，从大羹玄酒到佳肴美馔，中国古人的餐桌见证了上万年的饮食革命和文化流变。吃饭——不仅是为了果腹与生存，更成为一种生活方式的集中表达，调羹弄膳之间，处处流露着生活智慧和生命尊严。此次中国国家博物馆面向公众推出“中国古代饮食文化”专题展览，就是要深入贯彻落实习近平总书记“让文物说话”“让历史说话”的重要指示精神，系统阐释中国古代饮食的发展变迁与文化内涵，引导广大观众细细品味“民以食为天”的中国味道，深刻感知中华民族的血脉与生趣。【重要性：历史变迁和展览目的】中国古代饮食文化绵长而厚重，在其长达数千年的历史积淀中，不仅包含了造型精美的饮食器具、自成体系的烹饪技艺以及浩如烟海的典籍制度，还由此孕育衍化出一系列影响中华文明发展进程的哲学观念、政治智慧和科学思想，同时也为传统音乐、舞蹈、绘画、雕塑、诗歌等诸多文艺创作提供了不竭源泉。本次展览共分为“食自八方”“茶韵酒香”“琳琅美器”“鼎中之变”“礼始饮食”五个单元，展出精选文物240余件(套),从食材、器具、技艺、礼仪等不同角度出发，全面呈现中国古代饮食文化的历史变迁，真实刻画古代劳动人民充满烟火气息的日常生活.深刻表达中华民族对丰衣足食的美好生活的憧憬和信心。【介绍本次展览】jpp指出“如果没有中华五千年文明，哪里有什么中国特色?如果不是中国特色，哪有我们今天这么成功的中国特色社会主义道路?我们要特别重视挖掘中华五千年文明中的精华，弘扬优秀传统文化，把其中的精华同马克思主义立场观点方法结合起来，坚定不移走中国特色社会主义道路。”中国国家博物馆作为代表国家收藏、研究、展示、阐释能够充分反映中华优秀传统文化、革命文化和社会主义先进文化代表性物证的最高机构，历来特别重视挖掘中华五千年文明中的精华，从历史和现实、理论和实践相结合的角度深入阐释和弘扬优秀传统文化。衷心希望广大观众通过本次展览能够更加深入了解中国古代饮食文化，深刻感受优秀传统文化的独特魅力，增强做中国人的骨气和底气，以更大的信心和勇气汇聚起建设社会主义现代化强国、实现中华民族伟大复兴中国梦的磅礴力量。【现实意义，观看收获】",0,0,3,山东,济宁,山东,中国
3,5048402874470150,林哥技术派,2024-06-23 12:21:43,比亚迪汽车的科技研发大军不负众望，将在2024年8月迎来了革命性的成果——第二代刀片电池系统的正式发布。这款备受期待的新品，正如比亚迪掌门人王传福所承诺的那样，将纯电动车型的续航里程推向了1000公里以上的全新境界，这一数字不仅震惊了业界，也彻底颠覆了人们对电动车续航里程的传统认知。在发布会上，王传福亲自解释了新一代刀片电池的技术细节和优势。他强调，这款电池不仅续航里程长，而且充电速度快、安全性高，彻底解决了电动车用户的后顾之忧。他自豪地表示，比亚迪始终坚持以用户为中心，致力于通过技术创新推动新能源汽车产业的发展。新一代刀片电池的能量密度高达190Wh/kg，较第一代提升了近36%，这一数字已经超越了目前主流的三元锂电池和磷酸铁锂电池。而刀片电池的独特设计，使得同等尺寸下可以装载更多电池材料，从而大幅提升续航里程。此外，凹型极柱设计的创新应用，使得新品的体积成组效率再次大幅提升，为实现1000公里+的续航里程提供了有力保障。随着第二代刀片电池的量产，比亚迪的电动汽车产品线将迎来全面升级。消费者将能够享受到更长续航里程、更快充电速度和更高安全性的电动车产品。这不仅将大幅提升电动车的竞争力，也将推动整个新能源汽车产业的快速发展。面对这一技术突破，传统燃油车企业无疑感受到了巨大的压力。随着新能源汽车技术的不断进步和普及，燃油车的市场份额将逐渐缩小，甚至面临被完全取代的风险。而在这场变革中，比亚迪凭借其在电池技术领域的领先地位和持续创新的能力，将成为最大的赢家。同时，比亚迪的成功也将激发更多企业投入到新能源汽车技术的研发和创新中。,0,8,189,广东,韶关,广东,中国
3,5048262249939482,红安县革命传统教育基地接待中心,2024-06-23 03:02:55,走进中国第一将军县湖北红安开展红色主题活动 红安革命传统教育基地首家红色接待中心 O7I3-535I688#红安干部教育基地# 黄冈·红安 ,0,0,0,湖北,黄冈,湖北,中国
3,5048237926910504,清风hong2,2024-06-23 01:26:16,习近平总书记指出：“我们党是靠革命理想和铁的纪律组织起来的马克思主义政党，纪律严明是党的光荣传统和独特优势。”自4月起，全党如火如荼开展党纪学习教育。只有坚持不懈加强纪律建设，才能不断提高思想认识，做到心中有标尺、行动有准绳学原文，阐释解读深学。把《中国共产党纪律处分条例》作为案头书，认真钻研深刻理解此次《条例》为什么修改、改了哪些地方、修订背后的深意。进一步清晰该做什么、不该做什么，能做什么、不能做什么，全面熟知掌握、准确规范使用。同时，深入学习党内规章制度，坚持党性党风党纪一起学，贯通融合纪律教育与党的理论教育、理想信念教育、革命传统教育、党风廉政教育等。在不断学习党规党纪的过程中，校准思想行动、增强党纪意识、提高党性修养。提升遵规守纪的自觉性和坚定性，做到知行知止、令行禁止。学案例，深化以案为鉴。运用典型违纪违法典型案例，拍摄警示教育片，汇编警示录、忏悔录，开展分类分层的警示教育，用身边事教育警醒身边人。同时要确保警示教育不能走过场。有的党员干部参加警示教育，却带着“看客心心理”“猎奇心理”听故事、看热闹，自认为案例离自己很遥远，不以为然。必须教育引导党员干部摒弃，杜绝这种错误的想法，切实把自己摆进去、把职责摆进去、把工作摆进去。深入学习警示案例，揽镜自照，挖掘问题根源，吸取教训，入脑入心。不断增强警示教育的针对性与实效性，确保警示教育常在常新，让党员干部真正受警醒、明底线、知敬畏。 查自身，加强自我检视。有些违纪违法党员干部在忏悔录中说究其原因是对党规党纪不上心、不了解、不掌握。通过此次党纪学习教育，在深入学习《条例》后，要自觉查找自身不足，查问题根源。勇于自我批评，要融入日常、抓在经常，对苗头性、倾向性问题及早察觉、及早纠正。使铁的纪律转化为日常习惯和自觉遵循。增强党员干部自我约束、自我检视、自我净化、自我提升能力，努力把他律要求转化为内在追求，把遵规守纪化为“内心律令”，绷紧纪律规矩这根弦。我们要珍惜此次党纪学习教育机会，上好纪律必修课，把好信仰“方向盘”。做到学有所得、学有所悟、学有所用，努力在自觉遵守和维护党的纪律上有新进步新提升，进一步增强政治定力、纪律定力、道德定力、抵腐定力，奋进新征程、建功新时代。,0,0,0,上海,上海,上海,中国
4,5048388923952158,可爱清清_wozuiai,2024-06-23 11:26:17,托马斯.库恩《科学革命的结构》：提出思维转换，科学研究的每一项重大突破，几乎都是首先打破传统，打破旧思维、旧模式才得以成功 ,0,0,0,山东,德州,山东,中国
4,5048367248048753,般若拈花,2024-06-23 10:00:09,只有革命才能推翻一个部族政权的力量。因为对满清政权不满，影响到对历史上传统政治也一起不满意。共尊共信之心也没有了。 ,0,0,0,安徽,合肥,安徽,中国
4,5048326940525089,国事家事D,2024-06-23 07:19:59,科学革命的三大源头 所有人都在惊叹“科学”的强大。但罗马不是一天建成的，科学革命也不是突然爆发的。现代科学诞生之前，西方其实有着悠久的科学传统。是三大传统的融合最终造就了这场革命。#公众号华尔街俱乐部##为何科学革命发生在西方#  科学革命的三大源头 科学革命的三大源头 ,0,0,0,广东,深圳,广东,中国
4,5048307267403830,用户7757863168198612,2024-06-23 06:01:47,自我革命咬耳扯袖提提醒，红脸出汗常示警。防微杜渐防腐生，有改无勉促提升。优良传统和作风，团结统一方向明。齐抓共管守党纪，从严治党不放松。大党独有难题在，答案清晰真英明。群众监督促整改，自我革命内力生。历史周期律破解，刮骨疗毒防虫洞。顽瘴痼疾敢怯除，百年芳华焕纯情。～甲辰夏,0,0,0,河南,南阳,河南,中国
4,5048214666086856,津门李哥,2024-06-22 23:53:50,#科技创新V观察#蜜度公司展示文修大模型，这一技术革新引起了广泛关注。#遥遥领先的天津智造# 该模型引入了混合专家模型(MOE)和智能体策略，显著提升了审校能力，新增了多种审校错误类型检测。这一突破为出版业带来了革命性的变革，传统的数天校对时间被缩短至仅需90秒，极大地提高了工作效率。文修大模型的应用不仅大幅缩短了出版周期，也为出版业的数字化转型奠定了坚实基础，展现了智能技术在出版领域的广阔应用前景。#2024世界智能产业博览会#,5,2,3,天津,,天津,中国
