页码,微博id,微博作者,发布时间,微博内容,转发数,评论数,点赞数,发布于,ip属地_城市,ip属地_省份,ip属地_国家
34,4355764942406991,FNS97,2019-03-31 04:45:51,我现在觉得佐助真的特可爱是怎么回事。尤其是忍界四战时的他，感觉全场忍者联军里只有他不想回忆不想嘴遁不想煽情，对嘴遁无敌免疫，就特么想赶紧解决带土、十尾、斑和辉夜，然后赶紧搞他的忍界革命。不然这所有人都中无限月读了，他还革命个脑袋啊。佐助真是始终如一的执行力超强，能动手绝不bb的货啊，超级实在。全场能配合他攻击的只有鸣人，但鸣人贼忙，一直在战场和别人嘴遁和神交。他想杀带土，可鸣人和卡卡西要煽情，他插不进去。他想杀宇智波斑吧……也杀不了，气势很够但实力不行，人家斑眼里只有他的柱间，他也插不进去。看见鸣人意志消沉不想打了，他还得鼓励一下，不然这仗可就打不完了，他着急地很,1,1,3,,,,
34,4346601365860391,江湖需要大侠,2019-03-05 21:53:04,各级政府要勇于自我革命，深入推进简政放权，加快转职能、提效能，增强政府公信力和执行力，更好的满足人民对美好生活的新期待。 ,0,0,0,,,,
34,4344057226293848,狮城海哥,2019-02-26 21:23:34,也只有中国的基金人能整出这种“革命式”逻辑的投研报告，没有阐明半点经济及政治经济的机理。即使以其之式，却把中国特色社会的绝对主宰甚至本身就是主体——政府、政策、统治执行力给遗忘了。而这是中国当下的绝对力量与意志！现实中有什么力量去决定大A牛熊转换？2019.02.11是谁能定下新年的方向？现在不是“大革命”那个半封建半殖民地时代，当下是人民当家作主的代表——执政党政府鼎盛的大一统时期，是追梦的时代，是民族伟大复兴的时代！这才是中国一切发展问题的出发之处。李蓓：从“A股各阶层的分析”，看当前为什么只是反弹,1,2,1,,,,
34,4337863322184259,河洛黄生,2019-02-09 19:11:12,关山初度尘未洗，策马扬鞭再奋蹄。目标越近，越要点燃不辱使命的奋斗激情；关键大考，时间越紧越要保持如履薄冰的敬畏之心；任务越重，越要以革命加拼命的精神苦干实干。大家要心中想着军令状，手上拿着作战图，脑海刻着倒计时，以箭在弦上的紧迫感，雷厉风行的执行力和舍我其谁的精气神，发起冲锋，奋勇向前，要聚焦主战役，投身各战区，拼在主战场，打好问题清零歼灭战，确保脱贫攻坚旗开得胜。👍✌『最爱洛宁』网页链接,0,0,2,,,,
35,4338593436801715,Mr潘潘-佳美,2019-02-11 19:32:24,现在团队的执行力我很喜欢 就像警察消灭不了的扒手最终被支付宝消灭一样，不与时俱进最终会被时代淘汰。革命尚未成功，同志仍需努力 开年饭大吉 网页链接 ,0,6,2,,,,
35,4330213070056581,阿俊-科技情感伪天使,2019-01-19 16:31:50,别担心，目前人工智能技术还是按照“人本位”的思路在演进的。在如何更好地服务人类的思路引导下，人工智能会用于处理人类不想干或者不愿干的工作，至于人类不能干或不会干的工作，人工智能会辅助人类去干。所以和历次工业革命带来的变化一样，人工智能的普及会帮助人类释放出更多的思考力和执行力，这是好事。人工智能对于人类而言，也具备一定的“过滤器”的作用，这就对应了一些人的担忧——在这次过滤中，人类失去了自己的定位和价值。过滤之后，适应的人将在新的工作岗位上继续发挥价值，不适应的人则会举步艰难。不过，如何防止人工智能变成人类的“大过滤器”，是一个需要认真研究的话题。实际上也就是如何在将来与人工智能（如强人工智能）相处的过程中，始终确保“人本位”的最高优先级。 随着人工智能技术的发展，诸多岗位将可能被机器人取代，是否会造成大家以后无业可就，您怎么看？,0,0,2,,,,
35,4323399889287130,三井夫人0314,2018-12-31 21:18:41,依然有很多东西想学，希望自己执行力更强一些，不要浪费时间了。 依然想要遇到良人，希望自己种一株可以盛开的桃花树。 依然想挣钱盆满钵满，希望自己好好踏实上班。 依然觉得好身体是革命的本钱，希望自己和家人爱护好自己的身板儿，坚持锻炼，留住马甲线。 2019年我很期待你哦。 ,0,0,2,,,,
35,4322636836255733,绮绮0724,2018-12-29 18:46:34,到底是从前的车马慢，还是如今的光阴快，2018年的最后一个工作日也结束了。回头望望，年初立的flag还在远处的山头上高高飘扬，不禁在心里狠狠地鄙视了自己三秒钟。总是对自己没有清醒的认识，每次都高估了自己的执行力，以至于每次都把红旗插在过高过远的山头。但是总的来说，我是一个革命的乐观主义者，对于已经发生的不可改变的事实，我一般都能很快地适时地就和自己的灵魂达成和解。2018年发生了太多的事情，有好有坏，每件事都能让我在今后的人生当中细细回味。2019年对于我来说有点特殊的意义。虽然心里百般不情愿，可也不得不面对这个残酷的事实，自己真的成了一个半百老太，一个众人口中嫌弃的中国大妈了[流泪]唯一的好处就是离自己退休的日子也近了一步。这样一想，又心生欢喜，对即将到来的知天命之年也有了更多的期待！[呲牙],0,0,0,,,,
35,4316399394376607,绿道游客,2018-12-12 13:41:13,三菜一汤 三菜一汤公资章，大盘装莱锅炖汤。 规章制度执行力，革命传统观念强。 城乡居民奔小康，小碗盛宴变花样。 满桌荤腥知多少？请看图六午餐享。 ,5,6,20,,,,
35,4309293278978684,温州陈小章,2018-11-22 23:04:03,一、所为执行力： 想到就去做，先上轨道后加速  二、革命不彻底，要性不强，一流的战术都会败给三流的执行力。 瑞安·锦湖 ,0,0,0,,,,
36,4301463507654824,南巷清风Mmmm,2018-11-01 08:31:20,最近感觉自己明显比以前进步了，遇到事情，有问题时，不知不觉少了抱怨，更多的是在想解决办法，调整心态，自我疏导并且执行力也迅速了，感觉不错，没有以前那么烦躁了，那么拖延了，反而多了份踏实，自信。#hi十一月# 革命尚未完成，工作仍需努力，加油姑娘！十一月，早安ﾉ☀ 郑州,0,0,2,,,,
36,4299015744649653,厦门华博基尼向大大----柏冬梅,2018-10-25 14:24:48,【👉论团队的重要性】有着革命般的信任和绝对的共同目标的才叫团队！ 绝对的信任、绝对的目标一致、绝对的执行力！网页链接 ,0,0,0,,,,
36,4293159896968029,盒饭财经,2018-10-09 10:35:44,阿里在B端的五力：概念力、执行力、基座力、战略力、耦合力，是检验一家科技公司在T2B2C时代的实力坐标.#盒饭财经# 发布了头条文章：《阿里和蚂蚁的新2B革命》  阿里和蚂蚁的新2B革命 ,1,0,2,,,,
36,4289633490162869,孟什利,2018-09-29 17:03:04,出了一趟差虽然睡的少跑的累偶尔身心疲惫但工作本身倒都挺顺利的不仅见了献歌 还和一起做DD的其他中介培养了良好的革命友谊到厦门那晚都十点了 结果靠着投行的超强执行力硬是给我们放了两个小时假把土笋冻沙茶面大龙虾膏黄蟹都吃了个遍 （然后再回酒店继续加班）第二天四个人在厦门ifc看访谈对象的豪华海景view 开始讨论二十年后能不能来厦门养老今天回来跟老板反馈行程 老板说我这条线的投行同事其实比较senior而且非常龟毛和难搞 弄得我现在像个小学生一样 因为完成一项艰巨任务得到老师表扬而有点满足中午和组里同事一起吃饭 我们几个放了司考假的久别重逢 其中一个同事说“大家都回来了聚到一起好开心啊”工作是普遍让人痛苦的 但都不得不学会从间隙里找让人快乐的火花被人尊重和认可 自己满足和渴望 应该是目前我对工作最大的期望了希望未来会好一点 借飞飞吉言：“Time for something good next year.”,0,6,7,,,,
36,4286082986122141,句了个号哎,2018-09-19 21:54:38,一遍两遍说说就可以了整天挂在嘴边就讨人嫌了知道胖不用再三提醒昨天去量房慌张到模糊画图的一天（有点小失落😔）革命尚未成功同志仍需努力💪💪💪💪💪今天同事家新店开业前段时间还想名字来着我以为只是说说而已转眼店都开业了执行力懂得自己想要什么做一个有思想有执行力的人,0,0,1,,,,
36,4285966074224836,财富中文网,2018-09-19 14:10:04,张勇在中国科技公司的动荡年代接过了马云的指挥棒。其主要对手腾讯、京东、滴滴和百度，仍在创始人的掌控之中，而阿里却将重任交给了更年轻、更看重执行力的领导手中。随着中国科技领域的革命进入更加成熟的阶段，这位克拉克·肯特型的人物说不定恰好就是时代所需要的超级英雄。,0,0,1,,,,
37,4254954372426798,王洁pure_,2018-06-26 00:20:38,今年的目标一定要实现，革命尚未成功，同志仍需努力，执行力一定要强啊，一天也不耽误，一天也不懈怠，看行动！ ,0,0,2,,,,
37,4234256986686348,天之眼通,2018-04-29 21:36:37,看21克拉，感受到洗尽铅华，返璞归真，现实的普通爱情，平淡如此美好。目前是要突破自己，让自己有雷厉风行的作风，提高执行力。拖拖拉拉，惰性等要完全消除，革命之首任务，就是改变自己，革新改变自己。充满正能量，自信满满的尽力做好成长建设工作。爱在心中。 哈尔滨·黑龙江科技大学 ,0,1,4,,,,
38,4203270643377320,浐灞生态区,2018-02-03 09:27:58,#浐灞资讯# 【奔跑•这一年丨在行政效能革命这条路上 浐灞做好“五星级服务员”】执行力是政府机关的生命力，“行政效能革命”则是大西安“追赶超越”的助推器和新动能。回首2017年 浐灞生态区全面推进“行政效能革命”从6个方面开展50项工作，当仁不让做好“五星级服务员”。 ,0,0,0,,,,
38,4182445182005411,HG薛晓燕,2017-12-07 22:15:00,"#把握青春航向,领略大骨风采#我是美医大骨班第二组第4号薛晓燕  学生干部是学生中的骨干，应起到带头作用。首先，要加强自身的心理素质和身体素质，所谓身体是革命的本钱，只有拥有健康的体魄，才能更有干劲和执行力；此外要有七个意志：政治意识、服务意识、奉献意识、责任意识、表率意识、大局意识、民主意识、形象意识，严格要求自我。最重要的还要加强自身综合能力，如：组织领导、沟通协调、团队协作等能力。总之，如何做一名合格的学生干部也是我们的一门必修课程。@宜春学院-美容医学院团总支  @宜春学院团委  @赣青团学  @宜春学院团委通讯团",0,0,0,,,,
38,4179222950310728,吉普的素描,2017-11-29 00:51:00,人跟人在一起搞事情，小的叫江湖，往大了讲就是搞政治，个人与集体的利益，个人与个人的利益，左右取舍，权衡利弊，怎样把一盘散沙凝聚成具有竞争力的石头，怎样把一群乌合之众训练为一支有执行力的队伍，小组织靠交情，大组织靠制度，牛逼组织讲文化，党的建设那叫意识形态革命信仰政治思想工作，可是啊，搞政治没有嘻嘻哈哈，政治分歧也都是很残酷的，君不见，庙堂之上，昨日万人敬仰，今日殿前庭杖！昨日封疆大吏，今日秦城监狱！一个政客可以左右逢缘，大不了苏联垮了我也能分红，可是一个政治家就难了，从古至今，从西论东，从南往北，好像未有一个身兼个人与集体命运皆成功的政治家，呜呼哀哉，呜呼哀哉！,0,0,0,,,,
38,4179036060540805,myday乐多,2017-11-28 12:28:22,身体是革命最大的本钱啊，身体不舒服直接导致意志力下降，意志力下降直接没有执行力 ,0,0,0,,,,
38,4178432830975111,付安城,2017-11-26 20:31:21,拖延是不是懒......我想一方面是由来已久的惯性，干事情都要外力来推动；另外，也是人对于舒适区的依赖，总想着做某个阶段的“保守派”；而一个人能成事，有活力的一个特质就是不断做自己的“革命派”。在这方面，貌似许多女性反而做的比男性好很多，大概也就是所谓执行力吧。对于个人，尽量保持清苦，适度紧绷，随时能够行动起来，也能防止油腻啦，哈哈。,0,0,1,,,,
38,4175763697100919,wsjzywnx,2017-11-19 11:45:11,本人在股票技术分析上还算有点见解，在模拟盘业绩还算亮眼，奈何执行力不够，所以一直碰壁。原因就在于不能做到心中无股的境界。革命尚未成功，同志仍需努力 义乌·廿三里 ,0,0,0,,,,
39,4171823279094262,leah7896,2017-11-08 14:47:21,健忘的我！执行力不够的我！确实开始随身携带一个小本本一支笔周一记下了本周要完成的10件任务，今天周三目前完成40%，效率有待提高！！革命尚未成功，同志还需努力💪,0,0,0,,,,
39,4167097561068187,阿勒泰公安在线,2017-10-26 13:49:02,世界最强团队！集全党全国人民智慧，管理国家服务人民，向心力、凝聚力，号召力、战斗力、执行力、创新力、革命力……都是世界一流。,18,0,46,,,,
40,4148440726511429,再冷也要早起吃早餐,2017-09-05 02:13:26,难过的日子熬过来了，安逸平淡的生活让人麻痹。每每在平淡中挣扎，都觉得是一次革命，做一个决定有多难，只有面临选择的人才会知道，想改变自己有多难，我不知道，只有经历过的人才会了解，渴望一次人生蜕变，却总敌不过现实束缚和执行力的静默。安于平淡，我无时不刻不在思考挣扎，在每个熬到深夜四下无语的时候，静静思考出路在哪里，我该怎么改变，从哪里下手。我总以顺其自然安慰那些在感情和生活中收到挫折的人，其实我知道顺其自然，是对既定事实不作为的借口，是思想的自我安慰和麻痹，逃避问题的方法，就像今天的挫折，可能一切都是安排好的，就应该在那时那地发生，于是我们也就能坦然接受事实。       哲学家尼采说:“知道自己想要的是什么，就能忍受任何生活”我觉得对于有执行力的人来说，这当之无愧是个兴奋剂，可是这世界从来就不缺梦想家，他们思维活跃天马行空，在他们的世界里自己是个成功人士，家庭 事业 名利 权利，他都拥有，可偏偏又不得不面对赤裸裸的现实世界，一无所有。      我曾经想象，有一天我会事业有成，拥有很好的成绩，我会住着别墅，开着豪车，我会把精心准备的戒指捧到你面前，单膝跪下，请你嫁给我，让我为你遮风挡雨。一一去实现曾许下的承诺，圆了曾经吹过的牛逼，接受众人的祝福。我太需要改变了，平淡空闲的生活让我觉得空虚，为了……我要改变。,0,0,1,,,,
40,4148399684907068,Luckinaa,2017-09-04 23:30:21,现在才明白为什么思想解放先于革命斗争，因为思想就是绝对的执行力，不然革命只是空谈。上学时历史上只是背背，从不思考，我的生活也没让我有那么高思想觉悟，我发现我总是后知后觉，一个人的觉悟决定行为，行为决定后果。 ,0,0,0,,,,
40,4143274861989783,西安广播电视台,2017-08-21 20:06:08,#西商大会# 柳传志谈及强森医疗未来的发展时说到 “参加完这次西商大会，能够真切感受到西安市委、市政府坚持改革、坚持创新、发展‘大西安’的决心，从‘烟头革命’、 ‘厕所革命’这些细节的执行力上，西安也确实在发生着变化，在积极努力的打造营商的环境，我们做企业的，就要紧抓这种机会，先小心的把脚下的路踩实，稳扎稳打，联想控股将加大在西安的投资，未来强森医疗一定会加速奔跑”。@强森医疗  社区医疗的“星巴克” | 柳传志现身西安这家社区医院,5,2,6,,,,
40,4140562225972486,咕嘟苏打,2017-08-14 08:27:05,🗓 | 时间轴 | Week 32 执行力：⭐️⭐️⭐️  🎐身体是革命的本钱。🎐不想立flag了，反正都会倒。🎐“我折腾不动了，没有风花雪月的精力了，剩下的力气是要用来和世界搏斗，做个屠龙勇士的。”    #suki考研日记##studyaccount##2018考研打卡# 🌵抄送组织@StudyAccount分享平台 @StudyAccount梦想家 @-studyaccount小组 @StudyAccount打卡平台 @文具控万事屋@纵向书写 打扰啦。  ,6,22,91,,,,
40,4133795689526154,旅游规划怎么搞,2017-07-26 16:19:17,【读道-鲁商银座】长发哥受邀来济南为鲁商集团银座旅游做分享演讲，合作六年的中国好甲方！在一起做文旅项目的进程中，越来越意识到，顶层设计固然重要，战略落地才是关键，革命性的创意不是难事，执行力最为关键，它几乎就是竞争力的同义词。为鲁商点赞👍 ,0,0,1,,,,
40,4131358328394521,沛哥哥-,2017-07-19 22:54:05,革命工作不能停啊！昨晚上跟我说让我帮忙给老干部们汇总些重要材料，正好儿大雨滴答滴答睡不着，任务也完成了。下午自己做的文件就被老政委拿走了研究了，说我执行力强简直雪中送炭哈哈哈哈 北京 秒拍视频 ,0,0,1,,,,
40,4123379474383023,秦福务,2017-06-27 22:28:58,一网友：“ 看了三分之二了，是最接地气的自传。最让我收益的是'执行力的价值'一章。曹德旺的管理革命，一是对于各个生产环节的细节精细化管理，二是各部门强有力的执行力。成功路上缺一不可。” ,0,0,4,,,,
42,4092960033009954,星火青年志愿服务队,2017-04-04 23:52:58,缅怀革命先烈，传递星火精神 大家太棒啦！活动从策划到执行仅用两天！赞有执行力，有组织力，有感染力的志愿者们！为你们点赞鼓掌！星星之火可以燎原，大家齐心协力定能传递更多的正能量！有关于今天的活动，组长编辑的这篇文章里都有，还有你不知道的清明节由来的故事！点击下面的阅读全文即可加入星火青年志愿服务队哦！清明小长假已过，新的一天，继续携手前行！如果你有什么想对星火说的，可以在文章下方留言！当然，也可以赞赏哦，你的赞赏将会作为我们活动的经费，我们会定期公布，接受社会监督！ 网页链接,0,0,2,,,,
42,4091151134736247,你一定能考上,2017-03-31 00:05:03,为考研而发的第一条微博，今天过得还算充实吧，但是希望自己以后稍微早起能够给自己留出吃早饭的时间，毕竟生命才是革命的本钱，看到图二的时候感触很深，感觉自己这么多年来梦想依旧是梦想的原因就是缺少一些执行力吧，蓝图倒是构思了很多，但是大多也只是想想，希望自己能慢慢改变，加油，晚安 ,0,0,1,,,,
42,4089103802875700,曲阜王老吉,2017-03-25 08:29:41,平保的蜕变受益于中国崛起、互联网革命，以及自己几十年如一坚韧不拔的战略决心和执行力。平安现在所达到的高度，中国及全球同行不要说超越，连复制都不可能，不要说复制，连读懂都很难。,3,1,1,,,,
42,4085161753136540,Amy妍酱,2017-03-14 11:25:23,一个人的精力有限，如果想要同时做好几件事情很难，需要很强的毅力和执行力。但是也有人能同时把几件事情做好，但是这样的人很少。如果想要做到，必须不能让自己有一丝松懈，很多事情，坚持做了，就成功了，半途而废必然失败，多问问自己失败的原因是什么，不是自己不够强，只是不够坚持罢了。革命尚未成功，同志仍需努力~,0,0,0,,,,
42,4082940080730752,A股道中道,2017-03-08 08:17:15,不管什么原因，炒股不赚钱就是你犯的最大的错，说明你一直在用错误的方法做错事并且一直在重复同样的错误！如果你想改变，就需要颠覆和革新就需要勇敢的自我革命，但不能停留在想法和下一次，应该马上行动，要的就是执行力和效率！ ,0,1,0,,,,
42,4082716821767299,湖滨融媒,2017-03-07 17:30:06,近日，湖滨区委组织部根据市委、区委开展“效能革命”的部署和要求，在全区组织系统和组工干部中创新开展 “强执行、提效能、重服务、求卓越”活动，深化机关效能和干部执行力建设，全面形成守责任、重执行、抓落实、争上游的浓厚氛围，进一步提升部机关党员干部的执行理念、服务效能和工作作风，积极打造模范部门、过硬队伍，全面落实区十三次党代会决策部署，为打造省际中心城市、建设“五个湖滨”提供有力保障。,0,0,0,,,,
42,4082086824693010,猴子兔子小乌龟啥的,2017-03-05 23:46:42,在我看来，战略有了成功路上能占到五分之一就不错！战术呢？时机呢？领导艺术呢？团队精神呢？执行力呢？……呢？！唉，革命尚未成功，同志仍需努力！ ,0,0,0,,,,
42,4081611081502764,庸人三省,2017-03-04 16:16:17,Walzer认为清教徒在英国的出现直接改变了英国的政治模式，因为清教徒具有高度组织化和执行力，他们本着良心与戒律，要推翻传统秩序。他们经过玛丽时代的流亡后，回到伊丽莎白时期的英国，与非神职清教徒结盟，到1630年代他们面临两条路：移民与革命。作者认为1640年英国革命是（加尔文宗）清教徒革命。ps.本书翻译不甚通顺。 武汉·华中师范大学,0,2,3,,,,
42,4081033097622509,行者-葉巍,2017-03-03 01:59:35,【中高层干部职业素质要求】 1.行动力 具备超强的行动力，做事干净利落，不脱泥带水。今天事今日毕。 2.服从力 执行力超强，不与组织或上级讨价还价，无条件执行上级交与的任务。革命战士就像一块砖，哪里需要就往哪里搬。 3.服务力 身为干部，更加懂得为组织付出，树立服务下属、服务客户的观念。 ,0,0,2,,,,
43,4072798252441857,热浪直播间,2017-02-08 08:37:16,【真实的特朗普，可能跟你想的不一样】特朗普自己是CEO，用的内阁高官也都是CEO，这些人有钱、阅人无数、有执行力，和那些只会“纸上谈兵”“贪得无厌”“理论重于实践”的“学者专家”或者“穷人革命家”不同。（饶说）网页链接 更多网页链接 ,14,18,29,,,,
43,4070441058268847,四海承风3005,2017-02-01 20:30:36,感情的深浅看真诚，生命的长短见修行[愉快]……唯有一种感情不能因人而控制，那就是爱情……思想是革命的根据地，目标是希望的摇篮曲，而执行力就是所有经历的工具…… ,0,0,1,,,,
44,4052689342292167,币思雨,2016-12-14 20:51:37,到了重新定义社会秩序的时候了，到了重新研究共产产品的投入产出比的时候了。在这个最关键的时刻，哪个民族最清醒最早开始变革最有执行力，哪个民族就最先摆脱这种不安全的忧虑。郑永年：特朗普主义——社会革命与世界不安全 郑永年：特朗普主义——社会革命与世界不安全 ,0,0,0,,,,
44,4048271565231435,推好高质量发展,2016-12-02 16:16:57,工业和信息化部原部长李毅中12月2日在“第七届财新峰会：改革执行力”上表示，中国发展智能制造、推进新一轮制造业升级的思路，兼容并蓄美国、德国的经验，推动互联网和实体制造业的协同发展。李毅中指出，美国和德国已经成为本轮工业革命中的领先者，他们各自有不同的发展思路，值得中国借鉴。李毅中：中国制造业升级兼容美、德经验,3,2,0,,,,
45,4032992852654802,赤阑桥烟雨,2016-10-21 12:24:48,不是说先贤理论不行，而是具体实践中的执行力问题，归根结底还是人的问题，理论再好也要有一大批德才兼备的人走上领导岗位参与实践才行。就拿马列来说，在太祖手里就能成功领导革命，在王明一伙手里却只能成为败家子，这能说马列不好吗？//@清越2: 我的结论是得儒家，必亡政！,4,1,0,,,,
45,4032418115069877,Wincent_xiang,2016-10-19 22:21:00,下午与“杨家酱”老板雷总在院子喝茶，方知“杨家酱”从准备到上市仅仅用时不到一月时间，除了本身产品的文化底蕴，更多的还是决断与执行力。 革命尚未成功，同志还需更加努力啊，加油吧…… 成都·锦江 ,0,2,1,,,,
45,4024698176595914,冬天的梦想家,2016-09-28 15:04:43,有令不行，诸多借口，才是执行力不高的最大问题。干革命不能讲人情。 ,0,0,0,,,,
46,3981039116074779,看风吹雨,2016-05-31 03:39:11,经销商如何打造自己的根据地市场？  擅长快消品行业的“战略制定，战术实施，品牌推广，渠道管理，销售团队管理，销售团队执行力的打造、经销商开发和管理、样板市场和根据地市场的打造等等”。  01 什么是经销商的革命根据地？经销商如何打造自己的根据地市场？ 济宁·自助图书馆 ,0,0,0,,,,
