页码,微博id,微博作者,发布时间,微博内容,转发数,评论数,点赞数,发布于,ip属地_城市,ip属地_省份,ip属地_国家
2,5049041320673905,尼克安闲,2024-06-25 06:38:40,再过……年共产主义就实现了！,1,0,0,江苏,苏州,江苏,中国
2,5049039475179797,千奇唔好同我讲嘢,2024-06-25 06:31:19,三更半夜发出来，我还是想问什么是爱国贼、红卫兵、左棍、灰粉？这是李星文赐给我们这些共产主义接班人的名衔#请追风者剧组公开道歉回应#,3,1,8,广东,广州,广东,中国
2,5048572945108736,万事支持哥,2024-06-23 23:37:31,👍，社會主義終於開始向共產主義進發了。,4,25,114,西班牙,,西班牙,西班牙
2,5048976821452895,Sszzzzzz_,2024-06-25 02:22:21,爱是坚持到底的冒险，是最小的共产主义，是一种持之以恒的胜利。@琪子琪子琪子 ,0,0,0,北京,,北京,中国
2,5048974941881229,昊哥很哇塞诶,2024-06-25 02:14:54,复读一遍分爱我我爱分，分来分来分从四面八方来，我热爱祖国我爱人民我爱党我时刻为了共产主义事业而奋斗，我时刻以为人民服务的宗旨约束自己。我弘扬中华优秀传统美德正确的核心价值观，我希望世界和平再无战火。只要我上岸中国就会多一个希望，多一份力量 谢谢你我的国！我爱你。,0,0,0,北京,北京,北京,中国
2,5048949274838929,Carrotitten11,2024-06-25 00:32:55,我要是能活到共产主义社会就好了 ,0,0,0,甘肃,天水,甘肃,中国
2,5048947630671873,吉小小小小然,2024-06-25 00:26:23,就让我为共产主义事业奋斗终身吧 ,0,0,1,吉林,长春,吉林,中国
2,5048944754951531,Psycheaprari,2024-06-25 00:14:57,共产主义快实现(｡ì _ í｡) ,0,0,0,湖南,衡阳,湖南,中国
2,5048942687686078,功利足球爱好者,2024-06-25 00:06:44,共产主义理想就是人类彻底摆脱丛林社会的唯一希望。,0,0,0,浙江,舟山,浙江,中国
3,5048940150130237,攀登的蚊子,2024-06-24 23:56:39,养老金的上涨就是赤裸裸的既得利益阶层对后来者的剥削和掠夺，这种情况严重不符合我们共产主义接班人的信仰！,0,0,0,河南,商丘,河南,中国
3,5048939328573558,燃烧的化学方程式,2024-06-24 23:53:23,为共产主义事业奋斗终生 ,0,0,1,重庆,,重庆,中国
3,5048935471388660,对一切批过场绝不姑息,2024-06-24 23:38:04,“底层蝼蚁”用于自嘲是可以接受的，但如果从一个党员领导口中说出，并指向比他身份低的人，就可以断定他不是一个真正的共产主义战士。 ,0,0,0,四川,成都,四川,中国
3,5048931648541270,奔跑一万里,2024-06-24 23:22:52,通过这些文艺作品我才能想起共产主义的道德观是什么样的，个人的牺牲和集体主义，这些品质就像“水往高处流”，需要修道一样的磨练才能被传承，相比之下资本主义道德观“水往低处流”，自然地就会发生。,0,1,0,山东,济南,山东,中国
3,5048930491173986,AI-赛伊-Cei,2024-06-24 23:18:16,遇到二次元共产主义了！在一番赏机器前犹豫要不要来一发的时候，边上的小姐姐突然递过来一个袋子，说全送我了 本来以为可能是抽到纸片啥的，一打开两个C一个D，而且还是双黑cp组 ,0,1,1,上海,,上海,中国
3,5048921002609906,由由客-张书杭,2024-06-24 22:40:34,【求联合创业同志，做共产主义生意。】由由客，信马毛主义，做天然产业，造集体企业，搞公产经济，为自由人联合体探路。当前，在淘宝店主营自产天然农产品（大蒜、杂粮等）、红太阳酒、祥酒、钢山酒、微山湖酒、孔府家酒、微山湖鸭蛋、柳絮粉条、嘉冠豆油等。马克思主义是什么？人类生产方式进化论。批判旧的资本雇佣劳动生产方式，创造新的联合劳动生产方式，路径是联合斗争。教员思想是什么？人民斗争，三种方式人民战争、人民政争、人民商争，三种原则实事求是、独立自主、群众路线。共产主义生意如何做？总路径，人民商争，创造新的劳动者联合体生产方式。具体路径，全世界劳动者，联合起来，自己解放自己，搞物质生产，建立大集体企业，啥生意都做，共产共消共有共享，千年接力扩大联合体的边界和纵深，打通自由人联合体之路。具体产业，从销售白酒开始，逐步向天然农业、天然食品加工过渡，未来接力进入各行业。详情淘宝、微店、公众号、网站：由由客个人公众号：新赤潮,0,0,0,山东,济宁,山东,中国
3,5048919763715215,懒蛇阿沙,2024-06-24 22:35:39,今天娃和闺蜜约了晚餐，我和媳妇在家吃了简单版晚餐（中午是土豆炖牛肉的共产主义大餐），喝粥，蒜蓉焗茄子，还配了高邮咸鸭蛋。晚餐 北京·安定门 ,0,1,3,北京,北京,北京,中国
3,5048865495714343,抗战直播,2024-06-24 19:00:00,1935年6月24日讯：日关东军司令部发表春季讨伐抗日军报告称，最近六个月内，东北抗日联军估计有2.8万人，在东北北部活动区域有40余处。与抗日联军交战达195次，死日兵25人，伤75人。抗日军多住于密林中，渐次集体化。服装与旗帜渐次模仿“满”军，战术巧妙，以共产主义为中心思想，以北满东部边境为根据地，现正继续活动。,0,0,32,上海,上海,上海,中国
3,5048907346220538,萌音可汗,2024-06-24 21:46:18,🏊♀️✨【宝贝儿，嘴个！】在1956年的莫斯科，苏联人民运动会的泳池边上演了一场激烈的竞技之美。蛙泳比赛中，玛丽亚·哈夫里什 (Maria Havrish) 被她的对手埃琳娜·科瓦连科 (Elena Kovalenko) 击败。比赛后，哈夫里什向科瓦连科表示了真诚的祝贺，这一刻被丽莎·拉森 (Lisa Lason) 用相机永恒地记录了下来。(📷： Lisa Lason) 这不仅是对运动成绩的肯定，更是对运动精神的传承。对手间的尊重和友谊，比金牌更闪耀！#共产主义视觉形象#,3,1,13,河北,邯郸,河北,中国
4,5048888337894638,思想先行,2024-06-24 20:30:46,我希望朝鲜真心能靠自力更生让朝鲜人民过上富裕的共产主义社会，不被资本主义玷污； 我又希望朝鲜能进行改革开放，丰富人民的物质和思想。 个人叱咤，是为天下。 思想先行的微博视频 ,0,4,2,广西,玉林,广西,中国
4,5048879808517721,我只是一种感觉-,2024-06-24 19:56:53,家庭是最小单位的共产主义，我不同意这句话，我觉得家庭是最小单位的资本主义，处于上位者的男性不断压榨女性的剩余价值，不仅要求她们生育，赚钱，劳动，甚至还要求她们提供情绪价值 ,0,0,2,北京,北京,北京,中国
4,5048874819912829,思想沸点,2024-06-24 19:37:03,#美国两小偷盗同一包裹就地决斗# 快递小哥淡定地看了一眼就走了！各尽所能各取所需，快来看看，已经实现共产主义的美利坚！支持美利坚人民自由获取快递，美利坚人民自由万岁，都自由发挥吧！  网友：没直接抢快递车、还是有职业操守的！ ,0,0,2,福建,泉州,福建,中国
4,5048858772767949,小金鱼蕾子游历史,2024-06-24 18:33:17,爱是最小单位的共产主义，也是最小单位的殖民地 ,0,0,0,浙江,宁波,浙江,中国
4,5048854512928961,欢欢喜喜坚持到底,2024-06-24 18:16:22,左们组团去太阳国，右们打包去自由国，都挺好，不寒掺。老右别润去自由国后还装左装爱国，在微博上天天喊红太阳万岁，受不了心口不一的润人，润出去了别天天口嗨共产主义了，你交税交给谁了？老左也别口嗨不行动，科技发达了，生产资料丰富了，倒是实践一下公社呀？唉？怎么不动弹呢？把财产都捐了，搞个大公社，无产阶级团结起来，怎么没人实践呢？,0,0,0,浙江,杭州,浙江,中国
4,5048853585729552,郑芮希01,2024-06-24 18:12:41,爱是人类最小剂量的共产主义 深圳 ,0,0,0,广东,深圳,广东,中国
4,5048850090557908,电子EnD,2024-06-24 17:58:46,只有共产主义才能救…,0,0,0,德国,,德国,德国
4,5048841021952866,用户戴永成,2024-06-24 17:22:45,《如何通过创新思维，运用道德经、易经开创无利息的金融贷款管理机制推进实体经济和科技创新研发实现国家战略实现共产主义》是人类文明发展进程中最先进的金融战略。。 ,0,0,0,安徽,合肥,安徽,中国
5,5048838763056710,法务老司机,2024-06-24 17:13:47,【公平，包括结果公平，也强调权利公平、机会公平、规则公平】公平正义是人类社会的最高境界，也是社会主义和共产主义的首要价值。马克思、恩格斯在构想科学社会主义蓝图时，就曾这样强调。在改革开放推进30多年之后，我们对什么是公平，有了更为深刻的理解。这种公平，既包括结果公平，也强调权利公平、机会公平、规则公平。假如“寒门难出贵子”依然是人们无奈的喟叹，假如“学好数理化，不如有个好爸爸”依然是社会潜行的规则，假如“知识不是力量、编制才有分量”依然是体制壁垒的注脚，假如“无机会群体”的出现、“马太效应”的产生依然难以避免，甚至愈演愈烈，我们就很难说，“公平”的核心价值得到了弘扬，社会主义的本质得到了体现。公平正义是人类社会的最高境界，也是社会主义和共产主义的首要价值。来源:人民网-人民日报  2014年08月20日07:20,0,0,0,北京,北京,北京,中国
5,5048833170473988,哲王miao2娃,2024-06-24 16:51:33,你们距离革命还有一段时间。你们对于我的态度还是不可以革命。而且，好人老实人还没有出来。这两个问题不解决，就不能革命。下面还是要深挖敌人的底线。而且还要继续准备。准备的还不充分。而且，你们还会受到巨大打击。看看能不能承受下来。革命至少还有一个星期左右。共产主义万岁！！,0,0,1,河北,石家庄,河北,中国
5,5048816712287396,任意长整数的加法,2024-06-24 15:46:09,我突然有一个大胆的想法 既然现在科技已经发达到让很多很多的普通人都没有了工作的机会 也让很多人为了工作焦虑得很 难道这是应该的嘛 现在在很多行业都是很明显的供大于求 那么是不是意味着共产主义的时代不远了呢 是不是大同世界 幼有所养老有所依已经在慢慢实现了呢 我期待着这个世界的变化 期待着我们当代人类思想的转变 期待着幸福指数直蹭蹭的增加的那一天,0,0,1,河北,廊坊,河北,中国
5,5048815363295611,摄政王柳智敏,2024-06-24 15:40:48,虽然苏东式的政治实践失败率100%但我不认为是左派理论的问题，因为哪怕在苏联占优势阶段的时期，真正想搞共产主义的好像也只有风评最差的玉米晓夫。 ,0,0,6,陕西,西安,陕西,中国
5,5048814303973504,神秘的1问3不知,2024-06-24 15:36:35,我们是共产主义接班人#我的街道我的城#  绿洲 哈尔滨 ,0,0,0,黑龙江,,黑龙江,中国
5,5048500461768124,远古的刀,2024-06-23 18:49:29,如果人人都进入编制，印度是不是提前进入共产主义了//@樱雪丸:莫迪：你们国家自己没有名字的嘛？//@牛春宝:转发微博,3,4,20,上海,上海,上海,中国
5,5048811989239122,袁大成_,2024-06-24 15:27:23,我们都是共产主义接班人，继续加仓干！ ,0,0,0,山东,泰安,山东,中国
5,5048553894579505,褚识斯,2024-06-23 22:21:49,你这个老子英雄儿好汉的逻辑，他真的共产主义吗？ ,3,13,176,上海,,上海,中国
6,5048811122590548,哲王miao2娃,2024-06-24 15:23:57,我鼓励你们革命和传递革命思想，不是为了你们能成功，是为了自己。 我不会放弃我的共产主义事业。  我相信，共产主义迟早有一天会到来！  共产主义万岁！！ ,0,0,0,河北,石家庄,河北,中国
6,5048808901968998,用户5744465529,2024-06-24 15:15:07,人类有史以来最伟大的事业，就是建立起共产主义模式的企业，进而解决所有人的生存问题和公平正义问题，0这就是人类社会的唯一出路也是唯一通向光明之路。相信这个事情很快就会发生，而且永远的解决人类的所有灾难，拯救这个世界的人一定是有正义感的企业家。 ,0,0,0,江苏,苏州,江苏,中国
6,5048806915709338,山西青年报,2024-06-24 15:07:14,【中国共产主义青年团山西应用科技学院第三次代表大会召开 勇于创新 谱写共青团工作新篇章】6月22日，中国共产主义青年团山西应用科技学院第三次代表大会召开。共青团山西省委副书记陈锴出席大会开幕式并讲话，团省委学校部部长刘晋，该校党委书记、督导专员薛智，执行校长杨万利，党委副书记、副校长、妇联主席原美荣，各兄弟院校团委书记，该校各学院党总支书记、学管、青年教师和学生代表等出席开幕会。　　原美荣以 《强化使命担当 启航再续新篇》为题致辞。她肯定了近年来该校共青团在团省委和校党委的正确领导下，始终以务实举措践行以学生为中心的工作理念，在各个方面取得的显著成绩，并提出三点希望与各级团组织及广大团员青年共勉：把牢政治航向，筑牢理想信念之基；敢于担难担责，善于投身创新创造；锤炼过硬队伍，倾力服务青年发展。　　陈锴向大会的召开表示热烈祝贺，并代表团省委对共青团山西应用科技学院委员会五年来的工作成效表示了充分的肯定。（本报记者 陈彤）#山青资讯# 网页链接,0,0,0,,太原,山西,中国
6,5048800049628778,吃肉女,2024-06-24 14:39:57,共产主义属实了//@黑眼罩杀手:这个记录太有意思了哈哈哈，查了下还真的有鹪鹩给大山雀养孩子的记录，然后叽喳柳莺又跑去给鹪鹩养孩子判断具体是什么状况还需要更多细节，比如巢里到底是谁的孩子？跨种抚养有时候是因为确实混成一巢了，有时候是因为一者繁殖失败，就去给别人当养父母了。,0,0,0,江苏,南京,江苏,中国
6,5048779495704091,鸡西步,2024-06-24 13:18:16,“多少年政治圈里较短长，到头来为谁辛苦为谁忙？武装革命是空流血，共产主义太渺茫。常言道英雄豪杰识时务，何苦再出生入死弄刀枪？倒不如抛开名利锁，逃出是非乡。醉里乾坤大，笑中岁月长，莫管他成者王侯败者寇，再休为他人去做嫁衣裳！” ,0,0,0,河北,唐山,河北,中国
6,5048777167079140,认清当前现实,2024-06-24 13:09:01,昨天去通州时见到我们到那仙家跟到那，看看在通州天气就知道人心以走到什么程度了！怀柔太阳，顺义开始白云西边站！走到通县阴天照满车总站！通县自报区长讲话！人间人全听得见！不用解释大家全明白到底谁在围难走向共产主义道路在逆反！ ,0,0,0,北京,北京,北京,中国
6,5048772447176443,abbeywww_,2024-06-24 12:50:16,爱是人类小剂量的共产主义。 ,0,0,0,浙江,杭州,浙江,中国
6,5048768757763970,和乐儿布唯,2024-06-24 12:35:36,为什么工作不能大家各司其职，劲儿往一处使 ？都好好工作，不是早日实现共产主义的前提吗 ？ ,0,1,0,浙江,杭州,浙江,中国
6,5048747769990033,刘建项,2024-06-24 11:12:12,啥时候可以成为“共产主义接班人”，为党国效力呢？ ,0,0,0,辽宁,葫芦岛,辽宁,中国
7,5048733030940931,红色基因7606,2024-06-24 10:13:37,再过几百年，实现了共产主义，地球就安全了。//@alan8616:哎，再过几年，地球也不安全了。马斯克带着美国撤退到火星，也不知道能不能实现。//@alan8616:建议撤到珍珠港，关岛已经不安全了。//@alan8616:好像卡尔文森号最值钱。,0,0,0,江苏,,江苏,中国
7,5048728391519071,浮生萍聚0711,2024-06-24 09:55:12,#苏ae86#真是头一次见到哪个圈子敢这么明目张胆搞80的，有些人的发言都可以截下来给我同事当教学的反面素材了，感恩。 孩子们快跑吧，远离烂人回归现实，感受共产主义的温暖。至于其他，还是那句话“放下助人情结，尊重他人命运” ,0,11,83,北京,,北京,中国
7,5048724667236652,褒姒最大的特点是不爱笑,2024-06-24 09:40:23,政府和社区卫生服务中心，有时候比亲戚靠谱。爱国之情不会凭空生出，只有受到祖国的照顾和庇护，心生感激，感情才会日渐浓厚。而我此前的爱国更多只是对共产主义的空想与憧憬而做出的理性选择。 ,0,0,0,四川,成都,四川,中国
7,5048718133297663,杨正辉,2024-06-24 09:14:25,马克思的博士毕业论文就是讨论伊壁鸠鲁哲学的，共产主义思想最早来源于柏拉图的《理想国》，说西方古代史是虚构的，就说不清楚马克思主义的来源。 ,0,1,0,甘肃,白银,甘肃,中国
7,5048711855997653,孙健敏,2024-06-24 08:49:30,回复@理想人间a:目前金融资本主义最担心的并不是共产主义，而是民族主义，因为它会打断全世界权贵联合起来的统治网络。全世界的无产者目前来说，并无一种可以联合起来的手段，只是喊喊口号而已。但各国的无产者以民族的名义反对金融资本的扩张，已经是一种正在实践的现实，某种程度上这也是一种联合。,2,0,7,北京,北京,北京,中国
7,5048699401013717,山西青年报,2024-06-24 08:00:00,#山青读报#早安02版“五十六个民族凝聚在一起就是中华民族共同体”——习近平总书记青海、宁夏考察纪实05版 山西各级团组织“青”力奏响安全生产主旋律06版 培训+“送课上门”激发农村青年电商创业热情07版 中国共产主义青年团山西应用科技学院第三次代表大会召开 勇于创新 谱写共青团工作新篇章08版【青春兴晋·奋斗有我】长治市第二人民医院足踝外科病区主治医师刘杰 医德高尚医术精 精心救治获赞誉山西应用科技学院文化传媒学院学生李昊阳 投身志愿服务 总时长超650小时09版“非遗说·大咖分享会”第3期举行 晋韵悠长 在流光溢彩中感受非遗之美12版 山西九部门行动打击安全生产资格造假13版 2024年高考志愿填报6月26日开始 网页链接,0,0,0,,太原,山西,中国
7,5048693629650916,诗乐园699,2024-06-24 07:37:04,文学名句汇总  ～用生命的火花照亮后人～  作者：吴枫（笔名诗乐园）  身受宫刑写《史记》， 尝遍百草记药理， 双目失明炼“钢铁…… “为共”累死马克思！  屡遭禁言敢“呐喊”， 鲁迅精神天地知！ 共产主义何其远…… 谁能消灭私有制？ 哈尔滨 ,0,15,13,黑龙江,哈尔滨,黑龙江,中国
7,5048676774839564,迪巴拉老婆是我,2024-06-24 06:30:06,金毛小狗被同事认成gay气炸了… 用“我全家都是共产主义我向上帝发誓我不是gay”来辩解（？ ,0,0,0,北京,北京,北京,中国
7,5048666824376664,沉没电子羊,2024-06-24 05:50:33,我的梦想2：生产力大发展，实现共产主义 ,0,1,2,北京,北京,北京,中国
