页码,微博id,微博作者,发布时间,微博内容,转发数,评论数,点赞数,发布于,ip属地_城市,ip属地_省份,ip属地_国家
2,5036427465199012,广东文体广播,2024-05-21 11:15:43,#于适谈精神内耗##于适生日愿望是身体健康#恭喜解锁@于适Yosh 《给我5分钟的时间》花絮！如何做到敏感但不内耗，执行力超强的于适现身说法！于适今年想要的生日礼物是“身体健康”，因为身体才是革命的本钱！！娱情Lab的微博视频 ,0,0,0,,马鞍山,安徽,中国
2,5035688280198115,蔡贵兰2020,2024-05-19 10:18:27,强大的执行力，需要有旺盛的气血，身体才是革命的本钱。钝感力和屏蔽力来源于身体健康、精气神饱满，就会无所畏惧，肾水足，胆气正，就会带来足够的魄力和精力，甚至脑力去做任何事儿。精神上的内耗，会因为体魄的改变而终止，所以当你找不到解药的时候，就去锻炼身体、保养身体。当你身体变好了，焦虑和不安也会随之慢慢消失[爱心]试试看～,0,0,0,福建,泉州,福建,中国
2,5034574738360332,BB212BB,2024-05-16 08:33:38,要记录的革命友谊 半小时就把票买好要来陪我 执行力强 我连机票任何都还没买 不想去啊 不过有朋友就是动力 ,0,5,0,四川,乐山,四川,中国
2,5033627442220126,打野花海,2024-05-13 17:49:25,现在真是觉得强大的执行力需要有旺盛的气血，身体才是革命的本钱。 ,0,0,0,陕西,西安,陕西,中国
2,5032389762613739,橘子哥哥喜欢喵,2024-05-10 07:51:19,如果明晚广东队输了，暗示着未来五年男篮都渺茫了，造星帮助不了男篮，普林斯顿体系，UCLA传切才是解法。希望这场真不是“js”，希望上次的输是宏远手感和执行力的问题。这不止是一次比赛更是革命，是男篮的政zhi方向。辽宁队唯一解局的方式就是付，张，弗拼命的凿内线+赵的三分手感，广东的牌很多，这一年的胡明轩比巅峰还强。周琦和乔丹贝尔的双塔，Sonny的最强快攻。如果广东队输了，可能就得等下一个山寨版约基奇来拯救男篮。#广东宏远男篮##辽宁队逆转广东队##如何评价辽宁逆转广东这场比赛#,0,0,1,广东,,广东,中国
2,5032014392852822,奔跑吧jiejie,2024-05-09 06:59:44,确实，身体是革命的本钱，没有一个健康的身体，做事便没有积极性和热情，懒懒散散，浑身疲惫，不光身体，还有自己的思想也会懈怠，不够灵活，身体不想动，大脑更不想动，严重影响做事的效率和执行力！ ,0,0,1,河南,濮阳,河南,中国
2,5031506005198422,山海皆可平Dune,2024-05-07 21:19:35,奇迹暖暖尼德霍格是个真正意义上的革命者，心狠手辣，目标明确，执行力强。作为反派，尼德霍格的形象塑造得非常成功，狗叠没有用一大串的美强惨苦情戏洗白他的所作所为，而是把他塑造成一个先锋，一个不被众人理解的革命者，他不是为了去争取什么复仇什么，他是为了打破虚假的和平，还众人一个真正的、有血有肉的奇迹大陆他有功有过，是一个真实的、立体的人。就像历史上的伟人，我们歌颂他们的功，也痛斥他们的过。我们庆幸中国站起来了，也惋惜文‖革带来的惨重损失。无论站在什么样的视角去评价都是合理的，因为世界本来就不是非黑即白。绫罗是最无辜的，带入绫罗视角痛恨尼德霍格的人一定是共情能力非常强的善良的人。尼德霍格也有巨大的角色魅力，当我们站在上帝视角去审视和评判，也很容易被这样的角色吸引和折服。,0,0,11,北京,,北京,中国
2,5030262126415734,火炎焱燚晶晶yu,2024-05-04 10:56:51,华晨宇#华晨宇演唱会唱到日出##华晨宇日出演唱会会有日出吗# 见证了历史性的音乐革命！ @华晨宇yu 你是 实干派的浪漫主义者！ 执行力超强的梦想家！ ,0,3,1,上海,上海,上海,中国
2,5025907162748395,灿烂未来123,2024-04-22 10:31:47,以“三严”书写好正风肃纪新时代答卷以自我革命精神推进作风建设，是我们党新时代全面从严治党的成功经验，也是驰而不息抓作风、坚定不移改作风的客观需要，作为新时代的纪检监察干部，要始终保持自身的先进性和纯洁性，擦亮自我革命的底色，不断提升政治判断力、政治领悟力、政治执行力，积极主动作为，以永不懈怠的精神状态、一往无前的奋斗姿态，跟上新时代的步伐。严于律己，严出好作风。“要牢固树立纪律和规矩意识，在守纪律、讲规矩上作表率，自觉做政治上的明白人。”守纪律、讲规矩是全体党员必须遵守的行为准则，作为纪检监察干部更要把守纪律作为终身必修课，在一体推进“三不腐”的实践中强化自身建设，永葆自我革命精神，纯洁思想、摆正心态，不断锤炼意志力、坚忍力、自制力，坚守政治红线、纪律高压线、廉洁底线。严负其责，严出战斗力。“肩扛千斤，谓之责；背负万石，谓之任。”纪检监察干部肩负时代重托，必须严负其责。把责任牢记于心、贯彻于行，让初心永远保鲜、永不褪色。严负其责，就是要敢于下深水、涉险滩、啃硬骨头，该做的事，知重负重、攻坚克难，顶着压力也要干；该负的责，挺身而出、冲锋在前，冒着风险也要担。只有严于尽责、心中有责、履职尽责，才能对得起群众的信任，让群众在正风反腐中有更多的获得感、幸福感、安全感。严管所辖，严出新形象。一个好干部，首先要管好自身，还要管好家人亲戚、管好身边人身边事、管好主管分管领域风气，在营造风清气正的政治生态、营造向上向善的社会环境等方面带好头、尽好责。纪检监察干部在日常监督中严肃纲纪、敢于较真，才能让更多党员干部体会到严管中蕴含的大爱、督促里饱含的温暖，自觉做到心有所畏、言有所戒、行有所止。踏进新时代，开启新征程，纪检监察干部要永葆自我革命精神，勇当自我革命的主力军，自觉接受革命性锻造和精神洗礼，严于律己、严负其责、严管所辖，不断提高政治能力、业务本领、作风操守，在新时代新征程上实干担当、奋勇直前。,0,0,0,宁夏,中卫,宁夏,中国
3,5024842200387931,起司卷cheese,2024-04-19 12:00:00,向未来张望的时光，或许孤独而漫长，希望努力过后都是晴朗执行力是拉开人与人之间差距的关键，你继续拖延下去，余生都不够用因为生活的本质，其实是柴米油盐酱醋茶如果这是在革命年代，我们都算是有着相同且崇高革命志向的伟大阶级同胞。有着不屈的情怀与执着的远方。始终坚持前行，相识见证成长我的目标不需要靠愿望来实现，靠自己来实现。很多时候我们在害怕逃避的事，也只是内心一时胆怯而已，真的鼓起勇气做到后，其实，一切都还好“坚持”这件事本身就不是那么容易，但无论结果，每一位在坚持的人都值得喝彩与掌声你人生的路是你自己的，你要为你走的每一步负责开学什么要庆祝？——庆祝有学上，有书读，有知识，有成长，有前途，有未来 ,0,2,0,黑龙江,大庆,黑龙江,中国
3,5018384574186355,知音杂志,2024-04-01 16:19:42,到底怎么样才算创新？创新和对标抄袭之间的界限是什么？浅层次的创新累计到一定程度能带来根本性技术革命吗？贾跃亭点评小米后，网友的反应也很有意思：说的是实话。但欢迎贾跃亭回国和雷军对面辩论，而不是隔空喊话。意味深长又直截了当。【#贾跃亭点评小米汽车#：执行力和营销能力值得点赞，#贾跃亭说对标抄袭无法带来根本性技术变革#】4月1日，@贾跃亭 发文称：小米汽车的首次发布非常成功，体现了中国新能源汽车产业链在近几年的日臻成熟和中国制造体价比的巨大优势。小米造车的执行力和营销能力诚然值得点赞，但是，山寨文化、走捷径模式和follower思维却被很多人奉为圭臬，令人担忧。他认为，价值观决定了天花板，对标、抄袭和浅层次的创新无法带来根本性的技术变革和基础科技超越。只有变革文化成为主流，而不是山寨文化依然盛行；只有原创精神刻进创业家的骨子里，而不是将follower思维视为创业“圣经”；只有涌现出一个又一个伟大企业家，而不是仅仅培育出一批批成功的商人；只有科技产业的头部企业成为开创者，而不是走捷径的跟随者；只有建立全球价值观征服全球市场，而不仅仅是着眼局部市场利益；才能真正推动中国科技进步，引领全球产业变革。#专家谈车市新一轮价格战#,0,0,0,,武汉,湖北,中国
3,5014151392659105,饱的碎碎碎念,2024-03-20 23:58:33,今天中午吃的酸汤水饺遇到了超级好的阿姨 超级亲切的感觉 下次还要去吃 看一看我的新挂件吧～可爱晕了 今天执行力🌊⭐ 革命尚未成功 同志仍需努力 ,0,0,0,河南,南阳,河南,中国
3,5013036198792314,西门不邈,2024-03-17 22:07:10,影评【서울의 봄】（首尔之春）：“失败才叫叛乱、成功就是革命”，成王败寇的理念，孤注一掷的反扑，肩负京畿重地却未能关键时刻守卫首都，悲情万丈。影片从一开始就节奏拉满，调度、协同、攻心，军人们用行动诠释忠诚与执行力，站队正确都是事后的说法，韩国导演敢于把全斗焕卢泰愚那些事搬上荧幕也是斗胆。黄政民、郑雨盛，双男主，刺激十足，尿性爆棚。“张泰玩”作为首都警备司令官，铮铮铁骨，非常尽力了。,0,0,0,浙江,杭州,浙江,中国
3,5008124291056635,活力陇南,2024-03-04 08:49:00,【#人民日报评论员#：#奋力跑好历史的接力棒#】 广大年轻干部要深学细悟党的创新理论，切实提升马克思主义理论水平和运用能力，着力提高政治判断力、政治领悟力、政治执行力，树立和践行正确政绩观，走好新时代党的群众路线，愿挑最重的担子、能啃最硬的骨头、善接烫手的山芋，发扬彻底的自我革命精神，永葆共产党人清正廉洁的政治本色，以过硬本领展现作为、不辱使命，不断创造无愧于党、无愧于人民、无愧于时代的业绩。人民日报评论员：奋力跑好历史的接力棒,0,0,0,,陇南,甘肃,中国
3,5007385401231194,人民日报评论,2024-03-02 07:52:55,【#人民日报评论员#：#奋力跑好历史的接力棒#】 广大年轻干部要深学细悟党的创新理论，切实提升马克思主义理论水平和运用能力，着力提高政治判断力、政治领悟力、政治执行力，树立和践行正确政绩观，走好新时代党的群众路线，愿挑最重的担子、能啃最硬的骨头、善接烫手的山芋，发扬彻底的自我革命精神，永葆共产党人清正廉洁的政治本色，以过硬本领展现作为、不辱使命，不断创造无愧于党、无愧于人民、无愧于时代的业绩。 人民日报评论员：奋力跑好历史的接力棒,32,6,96,,北京,北京,中国
3,5003659890395711,鱼蛋卡车,2024-02-21 01:09:04,当然还是下意识地给两方阵营划好了正反派，当反派以难以置信的决策力和执行力占据优势局面并且正派一直猥琐发育的时候简直心急如焚，其实早就被剧透了结局，虽然内心期待着大反转但已经是定局。于是好强地想将预先设定好的正反派反转，把自己置于革命/叛乱者的队伍拥护者后终于发现，本就没有正反一说,0,0,0,北京,,北京,中国
3,5000310001504124,你好亚龙,2024-02-11 19:17:48,大规模燃放，还不出事，本身就是一种执行力强的体现。这些人往前推一百年放在革命时期保不准是炸碉堡的主力。。。。老外看我国春节烟花惊呆了#外网热评#外网评论翻译 #年味 ,0,0,0,河北,石家庄,河北,中国
3,4999619107097545,Dylan__Wong,2024-02-09 21:32:26,新年新气象，要做些新变化。 1. 照顾好身体，身体是革命的本钱。 2. 提高执行力，想都是问题，做才有出路。 3. 坚持去积攒一点一滴，行百里者半九十。 ,0,0,0,湖北,孝感,湖北,中国
4,4994911923340954,最容易-zz,2024-01-27 21:47:46,以前的国际环境法 国内的法规 第一个环境法在英国 是无效的 缺失执行力 工业革命的模型需要法定statutory的控制污染物的排放 ,0,0,0,江西,景德镇,江西,中国
4,4990095627391807,很爱很爱me_baby,2024-01-14 14:49:32,做什么都不如跟对人学对人 健康是革命的本钱认知决定方向执行力是落地的保证别的就看天了 ,0,0,0,江苏,苏州,江苏,中国
4,4984070945641674,用户65668899,2023-12-28 23:49:36,#微博开新年#身体是革命的本钱， 身体健康、执行力强，领导才会 喜欢，别玩虚的，实事求是才能 彰显自己的价值！ ,0,0,0,河南,驻马店,河南,中国
4,4983681595214967,芭比俺们去哪,2023-12-27 22:02:27,来自领导的吐槽最为致命😂在降本增效的环境下，领导也没有安全感不过也是没有想到他会跟我说这些在我印象里他一直是执行力强非常认真地完成工作任务，比如半夜三点都还在跟上级会议。也很少抱怨，具有独当一面的稳重可能我们一起干没有加班费的苦差事的革命友谊升级了，所以今天对我有感而发,0,0,1,广东,广州,广东,中国
4,4979378523474020,倒霉孩子捣蛋鬼,2023-12-16 01:03:35,所以就是00在几天之内就完成了把人和孩子带走，或许有强制？与对方重修就好，理开对方心结。 这恐怖的执行力，眼镜学学。不至于现在还在等李子林革命。 ,0,0,0,内蒙古,呼伦贝尔,内蒙古,中国
4,4976070793363845,周小姐的影子,2023-12-06 21:59:50,自从感冒好了以后就很难再跳帕梅拉了，这个月的工作一直偏体力，准备转八段锦了，深刻体会到身体是革命的本钱。有身体才能有执行力。 ,0,0,0,浙江,宁波,浙江,中国
5,4969138885757817,小吴_不想上学版,2023-11-17 18:54:55,昨天逛超市无意间发现的牛奶 味道很不错/最近真的成药罐子了身体是革命的本钱 大家一定要注意保暖/六年多第一次带对戒全不知道怎么展示好了🫶🏻/大松很爱图图送的猫窝（的挂件）舔完就离开💔/我和我最后的倔强 嗓子痛吃了微微辣的涮肚/周末执行力差到爆 窝在床上大半天突然刷到了东北雨姐的视频🫡一个鲤鱼打挺起来和妈妈来搓澡搓完去饭饭咯 喜欢周末！生活小提示🔔对抗焦虑的方法是做具体的事！,0,2,0,山东,临沂,山东,中国
5,4956768397691660,GoddessCheng程女神,2023-10-14 15:39:01,#程女神语录# #星座#射手座，白羊座适合上战场打仗，尤其射手座。白羊座本真善良，是赢在了执行力和火热上，勇往直前，一股脑的往前冲，而射手座则是赢在了思想性，革命性上，再个就是劲儿大。我说过天蝎座和射手座属于灵魂型的，但是他们往往把自己接地气的使用，我说的都是常规战斗力，不是极端战斗力，像双鱼那种惹急了才是全宇宙最阴毒的，那都不算。它不属于常规战斗力，除射手白羊适合上战场打仗之外，还有一个正面执行力非常强的，适合打仗的金牛座，射手座往往是为了战争的意义而战，是远方的理想，而金牛座它就是为战场而生。双子座在全球范围内出的革命家，战争家很多，可为什么我不把双子座提上榜？就是因为它也不属于常规战斗力，你站到我头上，我才最厉害。 GoddessCheng程女神的微博视频,12,7,64,北京,北京,北京,中国
5,4951994689652892,姜岚昕,2023-10-01 11:30:00,时刻提醒自己，不断锻炼自己的11个能力体力，革命的本钱学习力，持续吸收，努力成长屏蔽力，停止内耗，储足精神专注力，一事一专，关注重点执行力，立即行动，注重落实沟通力，学会表达，避免误解写作力，提炼语言，语出惊人规划力，深谋远虑，循序渐进分辨力，明察秋毫，洞察是非决断力，审时度势，果断抉择复盘力，不断完善，提高效率,151,6,132,湖南,,湖南,中国
5,4949185369474310,叫我秋仟,2023-09-23 17:26:46,#今日拜访有感from姣爷是金子都会发光，成功的背后是选择、魄力、拼搏和持续的自驱。二十年的服装人，从零售干到批发再到抖音直播，干哪行哪行都能赚大钱，揪着竞争对手不断地倒逼自己进步，取长补短的执行力、自我革命的魄力和长期事业布局的眼光，都造就了实打实的一个个成功的大主播大卖家，成功的人真的放哪都是非常拼，自我要求非常高的人。行动才是硬道理。,0,0,0,浙江,,浙江,中国
6,4937612744462423,wawawa_kk,2023-08-22 19:01:17,饭搭子的执行力真的强 以前在家的时候吃垃圾团队随喊随到 现在来A市了C市的搭子们也是随时到位跨市也要一起吃饭  只是革命根据地从C变A了 七夕快乐~ ,1,17,9,湖南,长沙,湖南,中国
6,4926884297572476,Athena0704,2023-07-24 04:30:16,产后的身材恢复对于爱吃的我来说真的很难，虽然恢复到了怀孕前的体重，但悲催的是怀孕前就已经是胖子一枚减肥革命大业尚未成功，同志仍需努力同时我还每天为各种各样的事情担忧焦虑，整个人状态很不好，需要进行调整，定目标，提高行动力执行力，获得满满的能量，摆脱焦虑 ,0,0,0,四川,成都,四川,中国
6,4925538534431915,楚雄环境,2023-07-20 11:22:41,【下好“三步棋”推动作风革命效能革命走深走实】作风是单位的形象，优良的作风是执行力、战斗力、凝聚力。自作风革命、效能革命活动开展以来，楚雄州生态环境局双柏分局大力弘扬“马上就办、真抓实干”的作风，牢固树立以钉钉子精神抓落实的工作理念，切实解决群众最关心最直接最现实的生态环境利益问题。把抓落实作为开展工作的主要方式，做到任务一布置，马上抓落实；工作一部署，马上去推动；工作一完成，马上就反馈，让“踏石留印、抓铁有痕”成为双柏环保铁军的鲜明特质。下好学习研讨“基础棋”，强化思想政治引领。作风革命效能建设，狠抓理念转变是支撑。州生态环境局双柏分局始终把加强学习，锤炼党员党性意识放在首位。深刻认识作风转变促效能提升的必要性、紧迫性和有效性。认真落实“第一议题”制度，依托局党组理论学习中心组学习会议、局党组会、周例会等多种形式，对环境执法监管工作经验、助企相关政策解读等业务内容的进行专题学习，提高干部职工对作风建设重要性的认识，使作风效能革命贯穿于双柏县生态环境保护工作的全过程，助力实现理想信念、系统思维、法治理念、廉洁意识、宗旨意识、履职能力、工作效能“七提升”。2023年以来，分局共组织集体学习8次，党组理论学习中心组3次，专题党课2次，宣讲报告活动1次。下好监管执法“长远棋”，守住环境安全底线。坚决扛牢压实生态环境保护政治责任，始终把生态环境执法作为深入打好污染防治攻坚战、推进生态文明建设的重器、利刃、“刀把子”，始终把“公平公正的严格执法，就是最好的营商环境”作为推进工作的原则、理念，凝心聚力、狠抓落实。深刻汲取事故教训，坚持以安全生产专项整治为契机，全面排查整治全县各类环境风险隐患，建立健全联防联控长效机制。2023年以来，双柏分局累计出动执法人员 234 人次，检查工业企业 101  家，发现各类环境问题176个，重点涉气问题 1 个，立案查处环境违法行为1件，共处罚金3万元整。受理环境信访举报投诉8件，7件在限定时间内办结完成，1件正在办理中。下好服务企业“关键棋”，助力优化营商环境。不断深化助企服务，为企业解决项目环评审批、污染防治、信用修复等难题。强化环评要素保障，提高行政审批效率，深入开展减时限、减材料、减环节、减费用、优流程“四减一优”行动，实现环评审批从“排队审批”到“马上审批”转变。2022年上半年，共审批建设项目9个，全部在承诺时限内办结，总投资额6430.80万元；登记备案项目26个，总投资额41447.67万元。开展环保知识培训，助力企业清洁生产。对八个乡镇和县属26家排污许可持证单位，开展生态环境保护法律法规及环保业务培训，为企业今后做好环境治理提供指导，进一步规范排污单位的环境管理水平。落实信用体系建设主体责任，跟踪指导帮扶失信企业，引导企业纠正失信行为，修复企业信用，助力企业发展。（楚雄州生态环境局双柏分局  姚青 ）,0,0,1,,楚雄彝族自治州,云南,中国
