页码,微博id,微博作者,发布时间,微博内容,转发数,评论数,点赞数,发布于,ip属地_城市,ip属地_省份,ip属地_国家
2,5044436855164192,上海静安,2024-06-12 13:42:10,【出发吧，去静安！跟着主播沉浸式打卡中共中央秘书处机关旧址纪念馆→】#关注静安# 静安是中国共产党早期活动的核心区域，是马克思主义传播地、革命领袖足迹地、中共中央早期机关聚集地、首部党章诞生地、群众运动策源地和党的统一战线政策提出地。静安区红色资源底蕴深厚、数量众多、特色鲜明，现有106处重要红色革命旧址、遗址，其中，已考证的在沪30多处中共中央早期机关有20余处在静安。详见：网页链接,0,0,1,,上海,上海,中国
2,5043545326748275,Frankie126,2024-06-10 02:39:33,昨天，匈牙利首都布達佩斯的市中心舉行了大規模的抗議活動  數萬人參加了 TISZA 黨及其領導人 Péter Magyar 在布達佩斯舉行的選舉集會。  匈牙利反對派領袖呼籲抗議者「共同拯救匈牙利」。Magyar表示，該黨的目標是改變奧爾班政府，讓匈牙利重新走上歐洲道路，並建立一個基於法治的更公平的體系。 ,3,0,45,加拿大,,加拿大,加拿大
2,5043313740614178,股海性中人,2024-06-09 11:19:19,我们敬爱的伟大领袖毛主席曾说过：“田里长着两样东西，一种叫粮食，一种叫杂草。杂草年年要锄，一年要锄几次，农民需要年年跟田里的杂草做斗争。我们党的作家，艺术家，评论家，教授也需要年年跟思想领域的杂草作斗争，杂草一万年还会有，所以我们也需要斗争一万年。”   专栏 · 历史长河 | 家国情怀 | 怀念伟人 ,2,2,9,广东,,广东,中国
2,5042630908182817,小米置地,2024-06-07 14:05:58,蔡奇：不少同志谈到，党的十八大以来，每次主题教育都是习近平总书记开讲“第一课”，聆听之后都是醍醐灌顶的洗礼、触及灵魂的叩问、不忘初心的感召；无论是讲意义的振聋发聩、讲目标的拨云见日，还是讲问题的语重心长、讲对策的鞭辟入里，都让人深受教育，真理的味道、思想的力量、领袖的魅力深深触动人心；习近平新时代中国特色社会主义思想是一本读不完的书，一经掌握群众，就会转化为强大物质力量，只要我们坚持不懈学下去、悟进去，就一定能从必然王国走向自由王国，一定能创造出更多令人刮目相看的人间奇迹。#学习贯彻习近平新时代中国特色社会主义思想主题教育#,0,0,0,北京,北京,北京,中国
2,5042161324654928,司马南,2024-06-06 07:00:01,【@司马南 丨李慎明关于正确评价毛泽东方法论研究之十七：有些经验从痛苦中得来】 伟大历史人物大都有他们的缺点，包括圣贤在内，总是有过的，有过必改就好了; 不可以苛求伟大历史人物;要使有威信的党的工作人员有机会了解自己的领袖，并且把每个领袖放在适当的位置上。 司马南的微博视频 ,22,19,176,北京,北京,北京,中国
2,5042311308510353,蓝鲸铲史官,2024-06-06 16:56:00,1945年抗战胜利前夕，党的七大公布的60名著名烈士名单。当时共收录英烈名单9000多个，6月17日在延安举行了中国革命死难烈士追悼大会。60名烈士基本都是土地革命时期牺牲，包括李大钊、陈延年、罗亦农等重要领导人，农民运动领袖夏明翰、彭湃、韦拔群等，长征后留守苏区的刘伯坚、贺昌等，陕北苏区创始人谢子长、刘志丹等 ，以及工人运动领袖汪寿华。战争年代的艰苦环境下，很多烈士没有留下姓名，没有留下照片，英雄功勋与世长存！致敬烈士!致敬英雄!,5,3,11,江苏,镇江,江苏,中国
2,5042012092896234,23仰大物流管理3班,2024-06-05 21:07:02,习近平与大学生朋友们   品读领袖故事，感悟思想伟力——《习近平与大学生朋友们》第二卷专题读书会纪实。   新时代伟大成就、伟大变革的取得，根本在于以习近平同志为核心的党中央坚强领导，在于习近平新时代中国特色社会主义思想科学指引。习近平总书记作力党的核心、人民领袖、军队统帅，始终站在党和国家事业发展薪火相传、后继有人的战略高度，关心青年成长成才、谋划青年工作发展进步，深刻回答事关青年事业长远发展的方向性、全局性、战略性重大课题，为做好新时代党的青年工作提供根本遵循。      6月3日晚，仰恩大学物流管理专升本3班于在共和楼220召开《习近平与大学生朋友们》学习班会。此次讲座由3班学习班长刘书铖主讲，物流管理专升本3班班主任和全体同学参加了此次会议。      通过25篇访谈，让同学们更深刻领会。一篇篇访谈录告诉读者，习近平同志对青年始终抱有亲切的感情，始终寄予热切的期望。每到一地，他总是积极联系大学生。他从当正定县委书记开始，就与大学生们有工作交往，后来到厦门当常委、副市长，到宁德当地委书记，到福州当市委书记，到浙江当省委书记，到上海当市委书记，再后来到中央工作，无论工作多么繁忙，他总要抽出时间接见学生，给大学生写信，到学校看望大学生，与学生们座谈，为师生作报告，谈学习、谈工作、谈生活、谈形势、谈未来。不管“官”当多大，大学生们在他身上却从来看不出一点儿官架子，他总是那样平易近人、热情坦诚。        青年是国家的未来、民族的希望。在每一次与高校青年的互动与交流中，习近平总书记总是将当代青年与中华文明的繁荣传承、中华民族的伟大复兴紧密联系在一起，鼓励他们将青春年华在为国家、为人民的奉献中焕发出绚丽光彩。这也让我对自己高校教师的身份有了更深刻的认识与更深入的思考：身处于新时代的我们，正在塑造新时代建设者、接班人的我们，责任重大、使命光荣。站在接触青年大学生的第一线，我们所肩负的历史使命与时代责任，都值得我们在立德树人的全过程中去全情投入、孜孜以求，用陪伴去点亮潜藏于青年学子内心的主人翁意识，用真心去唤醒厚植于他们脊梁中的家国情怀，汇聚磅礴的青春正能量，投入到实现中华民族伟大复兴的中国梦中。 #大学生活##读书##好书推荐##习近平与大学生朋友们# 泉州·仰恩大学,0,0,0,福建,泉州,福建,中国
2,5041256952759830,上海静安,2024-06-03 19:06:22,【出发吧，去静安！走进那段峥嵘岁月→】静安是中国共产党早期活动的核心区域，是马克思主义传播地、革命领袖足迹地、中共中央早期机关聚集地、首部党章诞生地、群众运动策源地和党的统一战线政策提出地。静安区红色资源底蕴深厚、数量众多、特色鲜明，现有106处重要红色革命旧址、遗址，其中，已考证的在沪30多处中共中央早期机关有20余处在静安。今年是新中国成立75周年、上海解放75周年，静安区委宣传部联合上海广播电视台推出《出发吧 去静安》系列短视频，快跟着主播们沿着静安红色经典步道出发吧~去静安打卡！详情见：出发吧，去静安！走进那段峥嵘岁月→,0,0,2,,,上海,中国
2,5041227512680205,失落的感姛,2024-06-03 17:09:23,【王奇生：悲情的革命家陈独秀】陈独秀一生最具历史影响的业绩有二：一是发起五四新文化运动，一是创建中国共产党。这两件大事，影响了二十世纪中国历史的走向。陈独秀在其生命的最后两三年，思想再次发生“突变”，认为的无产阶级专政实际上是党的独裁和领袖独裁。 ,0,0,0,广西,,广西,中国
2,5040531237765640,石木云1,2024-06-01 19:02:37,"历史党的领袖不能不尊重党内多数的意见。多数，这是领袖不能不重视的力量。列宁对这一点的了解并不亚于党内其他任何领导者。但是列宁从来没有做过多数的俘虏，尤其是当这个多数没有原则立场的时候。在我们党的历史上有过党内多数的意见或党的眼前利益同无产阶级的根本利益相抵触的时候。在这种情况下，列宁总是毫不犹豫地坚持原则，反对党内多数的意见。而且在这种情况下，他简直不怕独自一人去反对全体，因为他认为﹣﹣正如他自己常说的那样﹣-&quot;原则性的政策是唯一正确的政策&quot;。下面两个事实可以特别明显地说明这一点。第一个事实。在一九○九年至一九一一年的时期，党被反革命势力打败，处于完全解体的状态。这是人们不相信党的时期；这是不仅知识份子，而且一部分工人也纷纷退党的时期；这是人们否定地下活动的时期；这是取消主义的时期，瓦解的时期。当时不仅在孟什维克中，而且在布尔什维克中也有许多派别组织和派别思想，而且大部分都是脱离工人运动的。大家知道，正是在这个时期产生了要完全取消秘密组织而把工人组织成为合法的自由主义的斯托雷平党的思想。当时只有列宁一人没有随波逐流，而高举着党性的旗帜，以惊人的耐心和非常的坚忍精神来收集党的零散残部，猛烈攻击工人运动中所有一切反党派别，以非常的勇气和空前的毅力来捍卫党性。大家知道，在这个为党性而进行的争论中，后来列宁成了胜利者。第二个事实。在一九一四年至一九一七年帝国主义战争炽烈的时期。所有的或几乎所有的社会民主党和社会党都染上了流行的爱国主义狂热，替本国的帝国主义尽忠效劳。这是第二国际在资本面前放下自己的旗帜，连普列汉诺夫、考茨基和盖得等等一类人物都抵挡不住沙文主义浪潮的时期。当时只有列宁一人。或几乎只有列宁一人掀起了反对社会沙文主义和社会和平主义的坚决斗争，揭露盖得之流和考茨基之流的变节行为，痛斥骑墙派&quot;革命家&quot;的不彻底性。列宁明知跟随他走的只有很少的少数，但是他认为这没有决定的意义，因为他知道，彻底的国际主义政策是唯一正确的有前途的政策；因为他知道，原则性的政策是唯一正确的政策。大家知道，在这个为新国际而进行的争论中，列宁成了胜利者。&quot;原则性的政策是唯一正确的政策&quot;,——这就是列宁的公式，列宁用这个公式攻占了许多新的&quot;不可攻占的&quot;阵地，把无产阶级优秀分子争取到革命的马克思主义方面来。                                       ——斯大林：《论列宁》,《斯大林全集》第6卷，第52～54页。",2,0,20,内蒙古,鄂尔多斯,内蒙古,中国
3,5039133900409440,伸懒腰的lazy,2024-05-28 22:30:07,牛僧儒是唐朝宰相，牛李党政里牛党的领袖。杜子春那个小说其实就反映了他这个主张，但是并不像许多古代笔记一样异史氏曰，直白点出主题，而是含而不露，不做任何评价，用看似相反的主题把真实的主题隐蔽起来，让读者自己领会。 ,0,0,0,山西,太原,山西,中国
3,5038556978876443,宁德广播电视台,2024-05-27 08:17:38,总书记“公开课”|自觉做党的创新理论的笃信笃行者学习贯彻习近平新时代中国特色社会主义思想是新时代新征程开创事业发展新局面的根本要求。央视网《人民领袖习近平》专栏特别推出系列长图解《总书记“公开课”》，与您一起从总书记的“知”与“行”中汲取奋发进取的智慧和力量。在2024年春季学期中央党校（国家行政学院）中青年干部培训班开班之际，习近平总书记作出重要指示，强调“要自觉做党的创新理论的笃信笃行者，坚持不懈用新时代中国特色社会主义思想凝心铸魂，不断筑牢信仰之基、补足精神之钙、把稳思想之舵，切实提升马克思主义理论水平和运用能力”。党的创新理论是引导年轻干部健康成长的行动指南，也是培养造就堪当强国建设、民族复兴重任的可靠接班人的科学指引。,0,0,0,,宁德,福建,中国
3,5037504467568708,西部一老兵,2024-05-24 10:35:20,#历史上的今天##那年·今日#1977年5月24日，毛主席纪念堂竣工。#毛主席纪念堂#——是党和国家的最高纪念堂，是全国各族人民热爱的伟大领袖毛泽东同志安息的神圣殿堂，也是以毛泽东同志为代表的党的第一代领袖集体纪念堂。　　1976年11月24日，毛主席纪念堂正式开工建设，1977年5月24日，胜利竣工。历时仅181天。这个独具民族特色的雄伟建筑成为北京中轴线上壮美的景观。1977年9月9日，毛主席逝世一周年之际毛主席纪念堂正式开放瞻仰。🙏🙏🙏,0,0,0,新疆,哈密,新疆,中国
3,5037234421761034,网信湛江,2024-05-23 16:42:16,【总书记“公开课”｜自觉做党的创新理论的笃信笃行者】有故事，有温暖，有力量。编者按：学习贯彻习近平新时代中国特色社会主义思想是新时代新征程开创事业发展新局面的根本要求。央视网《人民领袖习近平》专栏特别推出系列长图解《总书记“公开课”》，与您一起从总书记的“知”与“行”中汲取奋发进取的智慧和力量。央视网&gt;&gt;总书记“公开课”｜自觉做党的创新理论的笃信笃行者,0,0,0,,湛江,广东,中国
3,5037146065341241,仰恩23会计1班,2024-05-23 10:51:10,为加深青年学生对党史及马克思主义的了解，进一步提升学生思想政治素养和阅读交流能力，推动“学习二十大、永远跟党走、奋进新征程”主题教育活动深化开展，仰恩大学2023级会计学1班在5月22日下午15:00开展了主题为“品读领袖故事，感悟思想伟力”的班会活动。        领袖著作是我们党的重要文献，是思想伟力的集中体现。通过学习领袖著作，我们可以更好地领悟马克思列宁主义、毛泽东思想、邓小平理论、“三个代表”重要思想、科学发展观、习近平新时代中国特色社会主义思想等重要思想，更好地理解党的路线方针政策，更好地把握时代脉搏，更好地为实现中华民族伟大复兴的中国梦而努力奋斗。        在学习领袖著作的过程中，我们深刻认识到思想伟力对于个人成长和发展的指导意义，感受到了马克思主义的真理力量和实践力量。因此，我们更加坚定了信仰，明确了方向，也坚定了走中国特色社会主义道路的信心。今后的生活中，我们也会勇于担责，努力成为他人的榜样，为党和国家贡献自己的力量！@cl曹流1210 @仰恩大学会计学院团委 @DODoq_ @仰恩大学团委,0,0,0,福建,泉州,福建,中国
3,5036531261900299,北温带的王月辉,2024-05-21 18:08:10,学习毛泽东思想是否过时？答案是否定的。做为中国共产党、中国人民解放军和中华人民共和国的主要缔造者，中国各族人民的伟大领袖，领导全国人民改变了自己的命运和国家面貌，毛泽东给我们留下了极其丰厚的文化遗产，涉及到治国治军治党的各个方面，具有超越了时空的永恒价值。毛泽东思想是了解世间万物的永恒规律，从底层逻辑出发看待事物发展的客观角度，用历史唯物主义的方法来分析一切变化的至高真理，是人类社会迄今为止的最高智慧。因此，如果想要成就一番事业就一定要研读毛主席的著作，毛主席的作品也永不会过时。,0,0,0,北京,北京,北京,中国
3,5036425651684483,马研网,2024-05-21 11:08:30,【林建华：国际共产主义运动历史进程视域下马克思主义政党建设的三个重大问题】       马克思主义政党的建设水平是衡量国际共产主义运动发展水平的重要内容。衡量一个政党的建设质量和水平，最根本的就在于看其是否拥有科学的理论、杰出的领袖和铁的纪律。科学的理论是党的思想武器和行动指南，马克思主义政党的先进性，首先体现为思想理论上的先进性；杰出的领袖是党的主心骨和定海神针，马克思主义政党必须始终坚持维护自身的权威、维护自身领袖的权威；铁的纪律是党锻铸坚硬的整钢和战无不胜的法宝，马克思主义政党的本质特征，决定了其内部可以通过实行极严格的集中和极严格的纪律，团结成“一块坚硬的钢铁”。坚持科学理论指引，坚持维护党中央权威和集中统一领导、维护党的领袖的权威，坚持铁的纪律，是马克思主义唯物史观的基本观点，是马克思主义建党学说的主要内容，是成熟的马克思主义政党必须始终坚持的重大原则，也是国际共产主义运动发展的宝贵经验。网页链接,1,0,1,北京,,北京,中国
3,5035183447474552,灿灿灿灿文怡同学,2024-05-18 00:52:26,布尔什维克党的诞生绝不是偶然的，它是俄国革命工人运动发展的必然结果;它是在列宁《火星报》制订的关于党的思想原则和组织原则的基础上形成的;它是在同各种机会主义的斗争中诞生的。布尔什维克党的诞生，是同列宁火星派的努力奋斗分不开的，因此列宁被公认为是布尔什维克党的创始人和领袖。 ,0,0,0,河北,唐山,河北,中国
4,5034626022377300,偶像思想搬运工,2024-05-16 11:57:25,筹备了一段时间的万屋崇拜党终于有了眉目，今天算是万党创建党员的第一次聚会，大家一起站起来大喊：木有日结啊～～～然后开会，会议确定了以偶像为精神领袖的党纲，并就如何运营提出了初步意向。在偶像思想的引领下村里GDP翻倍是万党的目标，而第一步就是向筑地申请每个人发放劳保，虽然未必获批。 ,3,6,7,所罗门群岛,,所罗门群岛,所罗门群岛
4,5034420224658846,一民看社会,2024-05-15 22:19:39,普京是如何批评列宁的？为什么批评？ 能不能批评？列宁是他参加共产主义运动后的化名。列宁是国际无产阶级革命的伟大导师和精神领袖，是著名的马克思主义者，无产阶级革命家、政治家、理论家、思想家，是世界上第一个社会主义国家和苏联的主要缔造者、布尔什维克党的创始人、十月革命的主要领导人、苏联人民委员会主席 。对于这样的一个大人物，普京为什么批评？能不能批评？一、普京是如何批评列宁的？为什么批评？在苏联解体后的1999年，军人普京步入了俄罗斯的政治舞台 ，被任命为俄罗斯政府的总理，2000年当选为俄罗斯总统 。1、间接批评列宁1999年普京发表了题为《千年之交的俄罗斯》的论文， 阐述了他对过去一个世纪俄罗斯历史的见解。1）普京认为，尽管苏联时代俄罗斯取得了不容忽视的成就，但这个时期的政治路径并未使国家走向繁荣。2） 普京指出：长达近七十年的苏联统治，尽管追求高尚的共产主义理想，却未能带来与西方国家相匹敌的经济发展。3）普京提出：是时候正视这一历史遗留的问题，并重新定位俄罗斯在世界上的地位。以上3个观点和说法，实际上是对列宁的间接批评。2、公开批评列宁，指出列宁最大的错误1）2016年1月21日，列宁逝世92周年， 普京公开对列宁的批评。普京认为：列宁过分的民主化思想是导致苏联解体的核心原因，并将这种思想比作植入在俄罗斯体制内的一颗“时间炸弹”。2）普京在人权理事会会议上曾说：列宁瓦解了一个存在了近千年的国家。3）在2019年的一次记者招待会上， 普京说：列宁允许苏联各加盟共和国有权退出联盟的宪法设计是一个历史错误。普京认为：正是这个设计在苏联解体时导致了各加盟共和国迅速分裂。普京说：“列宁同志最大的错误，就是将沙俄这个统一国家，改造成为了国家联盟。并且根据苏联宪法的规定，这个国家联盟的加盟者，还被赋予了脱离国家联盟的权力。”二、普京对于列宁的总体态度虽然普京对列宁进行了批评，但是对于列宁给予了足够的评价与尊重。他说：“俄罗斯人不应该对列宁产生非议，对于每一个俄罗斯人，列宁都是无法遗忘的历史，俄罗斯人需要做的，就是继续向前。”普京说：对于俄罗斯人民来说，列宁的历史地位是不可磨灭的。普京保护列宁遗体，他 表示：“只要我还在俄罗斯的总统的位子上，就不允许任何人对列宁的遗体动粗。”三、能不能批评列宁？任何人都有历史局限性，任何人都会有成绩、有失误。对历史人物的评价具有争议是正常的。重要历史人物的思想，具有时代性， 也不是一个人的思想，具有集体性。对任何历史人物都可以评价、议论甚至批评。但是，评价历史人物要慎重，要客观，要基于事实，要基于当时的历史条件与背景；不能无中生有、不能歪曲更不能污蔑。知名人物具有影响力，评价历史人物更要慎重。普京对苏联过去的强盛有一种怀念，也对苏联过去的弊端、问题有一定认识。总起来看，普京对于列宁的评价还是比较恰如其分的。四、感悟1、俗话说：“谁人背后无人说，谁人背后不说人” 。2、 “病从口入，祸从口出&quot;，告诫人们为人之道，做到谨言慎行，以免引火上身。3、话是开山虎。4、语言是心灵的窗口。5、话不说不知，木不钻不透。6、 “横看成岭侧成峰，远近高低各不同。不识庐山真面目，只缘身在此山中。”7、 郭沫若诗：千秋公案翻云雨，百顷良田变土田。无字碑头镌满字，谁人能识古坤元。一民看社会 2024.5.15,0,0,0,山东,滨州,山东,中国
4,5034386844287391,Ryds_2,2024-05-15 20:07:00,"领袖的逝世没有引起党的队伍涣散。就像一棵大树一样，强有力的将根深深地扎入土壤中，即使削掉树梢，也绝不会因此而凋零。人最宝贵的是生命.生命属于人只有一次人.人的一生应当这样度过:当他回首往事的时候,不会因为碌碌无为,虚度年华而悔恨,也不会因为为人卑劣,生活庸俗而愧疚.这样,在临终的时候,他能够说:'我已把自己的整个的生命和全部的精力献给了世界上最壮丽的事业---为人类的解放而斗争'.",0,0,0,广东,广州,广东,中国
4,5034052640048278,蓝鲸铲史官,2024-05-14 21:59:00,难得一见的老照片。  1979年，时任国务院总理的华国锋出访英国留下的照片， 华主席高大魁梧，一代忠诚于人民忠于党的伟人领袖！ ,2,10,46,江苏,镇江,江苏,中国
4,5034309186487831,您访问的好友已注销,2024-05-15 14:58:26,领袖的逝世没有引起党的队伍涣散。就像一棵大树一样，强有力的将根深深地扎入土壤中，即使削掉树梢，也绝不会因此而凋零。 ,0,0,0,广东,广州,广东,中国
4,5033736609726511,柳下再会123,2024-05-14 01:03:12,没有性别歧视的意思。只是觉得女性相对来说，比较短于逻辑思维，更容易被一些美妙的口号蛊惑。早前的日本赤军头子重信房子、意大利红色旅首领玛格丽特卡戈尔、德国红军旅领导迈因霍夫、美帝黑豹党的戴维斯，如今的环保少女等，这些名震世界的左翼革命领袖，都是女性,0,1,0,河北,邢台,河北,中国
4,5032511644111675,小殊的阅竹随笔,2024-05-10 15:55:38,列宁说得完全正确：“在历史上，任何一个阶级，如果不推举出自己善于组织运动和领导运动的政治领袖和先进代表，就不能取得统治地位。”他又说：“培养一批有经验、有极高威信的党的领袖，这是一件长期的艰苦的事情。但不这样做，无产阶级专政、无产阶级的‘意志统一’，就会成为一句空话。” ,0,0,0,北京,,北京,中国
